17,"Uskladijo pa se tudi med temi roki, če osebni dohodki na zaposlenega porastejo za več kot 5%."
17,"Ta določba zveznega zakona je na prvi pogled jasna, pri izvedbi pa pušča odprtih kar nekaj vprašanj."
6,Ta vprašanja urejamo s predloženim zakonom.
22,"Zveza se je odločila, da to ureja s posebno metodologijo, mi smo se odločili ob ustavnem zakonu, da te metodologije ne sprejemamo."
36,"V izvršnem svetu smo pri pripravi predloga spremembe zakona izhajali iz načelnega izhodišča, naj se zaradi te spremembe ne bi spremenilo razmerje med poprečno pokojnino in poprečnim OD, kakršno je bilo po do sedaj veljavni zakonodaji."
13,"Zato je predložena, po našem mnenju, za upokojence dokaj ugodna rešitev navedenih vprašanj."
17,"Pravim, dokaj ugodna zato, ker se pojavlja med upokojenci v zvezi s predlogom tega zakona veliko pomislekov."
15,"Mi se trudimo ohraniti, vsaj približno ohraniti obstoječa razmerja med osebnimi dohodki in med pokojninami."
20,"Kakšno je finančno stanje v SPIZ-u in kakšne so obremenitve delavcev in vseh drugih s prispevki za pokojninsko zavarovanje, vemo."
16,"O tem ne bi danes posebej govorila, ker je bila izčrpna informacija dana na prejšnjem zasedanju."
37,"Predvidene rešitve, takšne kot jih predlagamo, so naslednje: pokojnine naj bi usklajevali glede na gibanje poprečnih osebnih dohodkov na posameznega delavca, ne na maso vseh osebnih dohodkov zavarovancev republike, ker masa raste počasneje zaradi upadanja številke zaposlenih."
43,"Pokojnine naj bi obvezno usklajevali 1. januarja in 1. julija, med temi roki pa vedno takrat, ko bi osebni dohodek od zadnje uskladitve pokojnine porastel za več kot 5% in ob vsaki uskladitvi pokojnin naj bi se izplačal še poračun za en mesec."
19,"Uskladitev bi torej veljala od začetka prvega meseca po mesecu, za katerega je bil ugotovljen upoštevan porast osebnih dohodkov."
59,"Ker se tudi osebni dohodki poprečno izplačujejo nazaj za mesec oziroma za celo mesec in pol glede na to, da se izplačujejo od 1. ali 15. ali 20. v mesecu, je časovni zamik med povišanjem osebnih dohodkov in med povišanjem pokojnin približno mesec oziroma ponekod celo manj, pol meseca lahko, ker so ta izplačila različna, mislim, izplačila osebnih dohodkov."
49,"Skupščina je na prejšnji seji odločila, da se usklajevanje pokojnin zadrži do sprejema te metodologije oziroma najdlje do konca letošnjega leta, se pravi, da je ta metodologija s tem zakonom danes prinešena in ta predložena sprememba zakona bi omogočila takojšnjo uskladitev pokojnin za 7,6% z veljavnostjo od začetka oktobra."
16,"To bi konkretno pomenilo, da bi upokojenci dobili sedaj 15% za nazaj oziroma za naprej 7,6%."
18,"Predlagamo, da se ta zakon sprejme na tem zasedanju po skrajšanem postopku, zato da se to izplačilo omogoči."
42,"Ob koncu moram povedati še to, da s tem predlogom ne bo razrešeno vprašanje financiranja Skupnosti pokojninskega in invalidskega zavarovanja, da to ostaja in se celo zaostruje in zato kakršnakoli rešitev, ki bi bila ugodnejša za upokojence v sedanjih razmerah, ni mogoča."
21,"Tako stališče je izvršni svet zavzel tudi ob predloženem amandmaju, predložen je bil namreč amandma gospe Oblakove v Zboru združenega dela."
13,"Šlo je za predlog, da je ta procent od 5 celih nekoliko manjši."
16,"Moram povedati, da je Zbor združenega dela zakon že sprejel, in sicer brez tega predloženega amandmaja."
2,Hvala lepa.
2,Hvala lepa.
12,Predlog za izdajo zakona s predlogom zakona ste prejeli 20.11. na klop.
9,Obravnavala so ga pristojna delovna telesa in pisno poročala.
6,Želi morda kdo od poročevalcev besedo?
28,"Če ne, potem lahko povem, da je Zakonodajno-pravna komisija opozorila na redakcijske popravke, ki naj se upoštevajo pri pripravi besedila zakona za objavo v Uradnem listu Republike Slovenije."
2,Pričenjam razpravo.
20,"Spoštovane kolegice in kolegi, 26. člen zakona pomeni kompromis med zamrznitvijo pokojnin in njihovim sprotnim usklajevanjem, ki je bil doslej."
19,"Kompromis bo med upokojenci povzročil veliko nezadovoljstvo, ker življenjski stroški ne poznajo nobenega kompromisa, temveč nevzdržno in sproti naraščajo."
14,"Iz statističnih podatkov vidimo, da tudi osebni dohodki aktivne populacije naraščajo vsak mesec sproti."
76,"Pravično bi bilo, da bi temu sledile tudi pokojnine, zato predlagam, da se zadnji odstavek 2. člena zakona o spremembah in dopolnitvah zakona o pokojninskem in invalidskem zavarovanju spremeni, tako da se ta del besedila 26. člena glasi tako: ""Pokojnine se usklajujejo tudi izven rokov, navedenih v prvem odstavku tega člena, če osebni dohodki v enem ali več mesecih prerastejo oziroma porastejo za več kot 5% glede na mesec, za katerega je bila izvedena zadnja uskladitev."
23,"Usklajene pokojnine se izplačuje od prvega dne meseca, v katerem so bili izpolnjeni pogoji za uskladitev."" V tem je razlika od predlaganega teksta."
20,"Sprememba, ki jo predlagam, pomeni, da bodo upokojenci tudi glede prejemkov delili usodo aktivne populacije sedaj in tudi v bodoče."
12,"Tukaj v besedilu, ki ste ga brali ste izpustili besedo ali padejo."
5,Ali je to tudi predlog?
4,Tudi to je predlog.
4,"Se pravi, tudi to."
5,Ne samo sprememba zadnjega odstavka.
23,"Kot vidim, tukaj je napisano pisno ""tudi narastejo ali padejo"", vi ste izpustili ""ali padejo"", zaradi tega sprašujem - tako kot je napisano, dobro."
1,Hvala.
7,"Se pravi, spremeni se samo zadnji stavek."
4,Kdo še želi razpravljati?
10,Ali lahko v imenu izvršnega sveta kakšno mnenje o tem?
18,"V zvezi s tem predlogom je treba reči, da predloženi amandma pomeni, glede na predložene naše spremembe, širitev."
19,"Zahteva večji obseg sredstev, pač en mesec več gredo uskladitve kot predlagamo, za dva meseca nazaj, ne za enega."
10,"To pomeni več sredstev, zato za nas to ni sprejemljivo."
4,Besedo ima gospod Glavič.
24,"Ugotavljam, da torej izvršni svet še vedno računa z naraščanjem inflacije in da torej ne predvideva nobenih ukrepov za znižanje cen in znižanje plač."
4,Besedo ima gospa Belopavlovič.
31,"Mi s trenutno pokojninsko valorizacijo rešujemo tisto situacijo, ki je že nastala in vidimo, da ta inflacija dejansko obstaja oziroma vežemo stvari na zvišanje, ne življenjskih stroškov, ampak zvišanje osebnih dohodkov."
6,Do tega pa je dejansko prišlo.
15,"Prišlo je povprečno 7,6% oziroma enkrat 4,3, drugič nekaj čez 3%, kar znese skupaj 7,6%."
40,"Mi v bodočo zakonodajo ne nameravamo vgrajevati inflacije, treba pa je varovalke postaviti, če bo do nje prišlo in tudi če bo prišlo do drugih zvišanj osebnih dohodkov in ostalega, da bodo pač aktivni in pasivni prebivalci delili isto usodo."
1,Hvala.
4,Besedo ima gospod Feltrin.
13,"Kar nekako nerodno mi je, da moram zopet priti gor zaradi iste stvari."
18,"Nikogar ne vidim od izvršnega sveta, ki bi zaščitil tistega delavca, ki dela za manjšo plačo od upokojenca."
6,Pa nimam proti upokojencem čisto nič.
3,"Prosim, razumite to."
25,"Samo, kako bomo mi to opravičevali, ko delavci danes delajo z manjšo plačo na istem delovnem mestu, kot so pred dvemi meseci delali njihovi kolegi?"
4,Jaz tega ne razumem.
31,"Prosim vas, ne razumeti, da sem proti pokojninam, proti zvišanju, ampak, kdaj bo prišel izvršni svet s tem, da bo delavec imel, jaz slišim, da so se plače povišale, samo komu?"
19,"Jaz še vedno poznam tovarne in delavce in so plače še vedno nižje od pokojnin, od njihovih bivših sodelavcev."
11,"Ne vem, kje se to računa in kako se to gleda."
34,"In kadar mi bo izvršni svet to povedal in kadar bom videl to dejansko stanje, da se je res izboljšalo, jaz sem zelo za to, da imajo upokojenci res tisto pokojnino, ki jo zaslužijo."
40,"Ampak delavci pa tisto plačo, ki jo zaslužijo in tudi potrebujejo, da bodo delali, da se bodo lahko pokojnine dobile, ker denar ne vem, kje bo izvršni svet dobil, če ga delavec ne bo za strojem ali pa nekje zaslužil."
1,Hvala.
4,Besedo ima gospod Oven.
2,Imam repliko.
7,"Mislim, da je napaka v tem izvajanju."
41,"Ti, ki so v pokoju, so si to pokojnino že zaslužili, ne si zaslužijo in mislim, da moramo s tem zakonom zaščititi, bi rekel, ta segment prebivalstva, ki nima možnosti več vplivati s svojim delom ali pa življenjem na svojo usodo."
31,"Lahko vplivamo samo skozi ta zakon, tiste, ki pa so v delovnem razmerju, lahko ščiti obstoječa zakonodaja, ki ureja področje delovnih razmerij in socialne zaščite delavcev, ki imajo podpovprečne osebne dohodke."
1,Hvala.
4,Želi še kdo razpravljati?
4,Besedo ima gospod Kramarič.
9,"Sem član Komisije za delo, zaposlovanje in socialno politiko."
7,Na njej smo temeljito obravnavali to problematiko.
5,Upokojenci predstavljajo precejšnje število državljanov.
8,"Upokojenci so upravičeni do pokojnin, katere so zaslužili."
7,To ugotavlja tudi zadnji razpravljalec pred menoj.
14,"Tudi mnenje upokojencev je, da sami niso krivi za nastalo situacijo v Republiki Sloveniji."
8,Po njihovem mnenju je temu vsega kriva politika.
18,"Naša naloga v parlamentu pa je, da te slabe razmere, ki trenutno pri nas obstajajo, čim prej odpravimo."
4,Dolžni smo sprejeti zakon.
12,"Iz njega bi lahko odvzeli vse tiste določbe, ki zagovarjajo socialno politiko."
6,Naše gospodarstvo bi morali oblikovati drugače.
6,Preveč delavcev odhaja predčasno v penzijo.
5,Število upokojencev se zato povečuje.
10,"Breme plačila pokojnin pa pade na že ""slabotne"" aktivne delavce."
14,"To neljubo situacijo bi morali rešiti do konca koledarskega leta, lahko tudi s krediti."
6,Zagovarjam strpnost pri nadaljnjem razreševanju problema.
5,Približati se moramo avstrijskemu načinu.
12,Oni se bodo pripravljali na novi zakon kar dve do tri leta.
2,Hvala lepa.
1,Hvala.
4,Besedo ima gospod Deželak.
5,Če dovolite prav na kratko.
15,"Menim, da moramo čuvati podatek, na katerega smo v Republiki Sloveniji lahko po svoje ponosni."
36,"Namreč razmerje med povprečno izplačano pokojnino in med povprečnimi pokojninami, torej starostno pokojnino in povprečnimi osebnimi dohodki je pri nas daleč najboljše in se mi zdi, da je tam nekje na ravni 100:80 ali pa 1:0,8."
21,"To pomeni, da smo dosegli raven socialnega varstva upokojencev, ki je neprimerno boljša, konsistentnejša kot je to v drugih področjih Jugoslavije."
4,To je ena stvar.
23,"Druga stvar, da smo ujetniki starega sistema na en način, kajti pokojnine še vedno na podlagi veljavne zakonodaje obravnavamo kot nadaljevanje osebnih dohodkov."
5,Torej mi nimamo drugih osnov.
32,"Če likvidnostna bilanca skupnosti že beleži take prilive, ki nastopajo zaradi tekočih gibanj na področju osebnim dohodkov, je seveda nujno potrebno vzpostaviti ta začasni mehanizem, da te prilive takoj transferiramo v pokojnine."
22,"Vsako zavlačevanje tega procesa menim, da je nerešeno do segmenta, torej do populacije Slovencev preko, slišali smo okoli 356.000 prebivalcev Republike Slovenije."
57,"Po drugi strani pa delim mnenje nekaterih pred menoj, ki pravijo, da je nujno potrebno preiti pri tovrstnem varstvu tudi na financiranje povprečnega nacionalnega programa in vseh ostalih oblik dodatnega varstva na kapitalskih naložbah, ker konec koncev pokojnina ni neka miloščina, ampak je pravica nekoga, ki si jo je ustvaril v svoji aktivni dobi ustvarjanja in delovanja."
1,Hvala.
2,Hvala lepa.
4,Besedo ima gospod Zakonjšek.
24,"Dodatno k temu, kar je gospod Deželak rekel, bi opozoril na znano distribucijo pokojnin, ki je bila predložena h gradivu v prvi fazi razprav."
32,"Zares visoke pokojnine uživa manj kot 1% upokojencev in to so verjetno tiste pokojnine, ki pogosto motijo v razpravah o višini pokojnin, oziroma v razpravah o odnosu med osebnimi dohodki in pokojninami."
3,Drugo zanimivo dejstvo.
22,"Še vedno je najboljša pokojninska osnova obdobje 1966-1976, kar pomeni, da so po tem času realni osebni dohodki začeli postopoma padati."
9,To nam dokazujejo tudi vsi statistični in analitični podatki.
8,"Seveda je to problem, ki zahteva drugačno rešitev."
10,Ne smemo pa zato prikrajšati upokojence za njihovo zasluženo pokojnino.
2,Hvala lepa.
4,Besedo ima gospa Belopavlovič.
18,"Jaz sem hotela povedati samo za orientacijo, ker smo že prišli do primerjav osebnih dohodkov in povprečne pokojnine."
33,"Povprečni osebni dohodek za oktober je bil 6.176 dinarjev, starostna povprečna pokojnina je bila 5.213, invalidska 4.279, družinska 3.720, to se pravi, če bi vzeli povprečja, so vedno nekoliko riskantna, kadar jih jemljemo."
24,"Vse pokojnine, ki jih vzamemo kot povprečne, to se pravi starostno, invalidsko, družinsko, je povprečna pokojnina znašajo 4.691 dinarjev, povprečna plača pa6.176 dinarjev."
57,"In dejansko do teh anomalij oziroma do tega, ker je prej gospod rekel o razlikah, da prihajajo nekateri v pokoj z večjo pokojnino, kot so imeli plačo, vse to izhaja točno iz tega 10-letnega povprečja. 10-letno povprečje ti v osnovi znese več kot ti znese zadnja plača, če si konkretno v organizaciji, kjer so trenutno dohodki slabi."
16,"In pravzaprav je ves čas ta anomalija, ki se vleče med osebnimi dohodki in med pokojninami."
5,Tako da tukaj so težave.
15,"Moram reči, v našem resorju se pojavljajo aktivni in brezposelni in upokojeni in te primerjave."
32,"S temi relacijami imamo tudi precej problemov, zato tudi ta predlog v nekem smislu je kompromisen, se strinjam z gospodom Starmanom, je kompromisen, ampak mislimo, da je v dani situaciji dokaj realen."
1,Hvala.
9,"Zaključujem razpravo, ker ni nikogar več prijavljenega za razpravo."
34,"Ugotavljam, da imamo predložen en amandma k temu zakonu, zato bomo najprej glasovali o tem amandmaju, se pravi amandmaju, ki ga je predlagal gospod Starman in ki ste ga tudi v pisni obliki dobili."
36,"Spremeni se zadnji stavek 2. člena, ki se sedaj glasi: ""Usklajena pokojnina se izplačuje od prvega dne v mesecu, v katerem so bili izpolnjeni pogoji za uskladitev."" Slišali smo tudi, kaj to pomeni za samo izvajanje."
2,Ugotovimo sklepčnost!
3,Kdo je za?
3,Je kdo proti?
4,Se je kdo vzdržal?
8,"Ugotavljam, da je amandma z večino glasov sprejet."
8,Prehajamo na glasovanje o predlogu zakona v celoti.
3,Kdo je za?
3,Je kdo proti?
4,Se je kdo vzdržal?
8,"Ugotavljam, da je zakon z večino glasov sprejet."
16,"Napočil je pravzaprav čas za naš odmor, po odmoru, ob 14 uri je nadaljevanje skupne seje."
9,"Čimprej bi bilo potrebno, da začne delati usklajevalna komisija."
16,"Če bo to že takoj ob ali po skupni seji, bomo poskušali že tam člane obvestiti."
4,Sicer pa potem tukaj.
6,Po skupni seji takoj pridemo sem.
12,"V usklajevalni komisiji pa so: Kuhar, Lukač, Kramarič, Jež Boris in Ivanušič."
2,Prekinjam sejo.
2,Ugotovimo sklepčnost!
3,Torej smo sklepčni.
3,Lahko nadaljujemo sejo.
39,"Glede na to, da je tudi današnja usklajevalna komisija do zdaj že končala delo in glede na to, da imamo nekatere neusklajene stvari od zadnjič, predlagam, da najprej opravimo te zadeve, preden se lotimo pač naslednjih točk dnevnega reda."
10,"Predlagam, da bi morda najprej kar te današnje zadeve pogledali."
14,"Prosil bi, da nekdo v imenu USKLAJEVALNE KOMISIJE POROČA, kakšen je PREDLOG TE KOMISIJE."
3,Kdo bo poročal?
1,Današnje.
12,"Gospod Kuhar, boste lahko vi, že kar zdaj, čeprav malce na hitro."
9,"Upam, da bo pisno poročilo prišlo kmalu na klop."
24,"Če sem uspel vse zabeležiti o usklajevanju bom lahko opravil svojo nalogo, če ne, pa bi prosil, da me še ostali člani komisije dopolnijo."
27,"Kar zadeva predloga za izdajo zakona o zadrugah z osnutkom zakona, smo v Družbenopolitičnem zboru in v Zboru občin sprejeli predlog za izdajo zakona v prvi fazi."
12,Zbor združenega dela pa je sprejel predlog za izdajo zakona z osnutkom.
7,Torej se bo usklajeval Zbor združenega dela.
11,Tak je bil dogovor na usklajevalni skupini delegatov vseh treh zborov.
2,Samo trenutek.
17,"Po mojih podatkih smo mi in Združeno delo z osnutkom, samo Družbenopolitični zbor je samo prvo fazo."
21,"Da, nam je bilo rečeno, ker je bilo med strokovnimi sodelavci tudi različno mnenje, da tako kot sem jaz sedaj povedal."
7,"Tam je bilo poročano, če smem dopolniti,"
13,"poročano, da niti naš zbor niti Družbenopolitični zbor nista sprejela, nista združila faz."
9,"No, ne, ne, saj potem bo tudi poročilo tako."
1,Dobro.
14,"Jaz se opravičujem, ampak v tem primeru bi raje počakali na poročilo, če dovolite."
21,"Ker no, medtem je prišel tudi minister Kranjec, tako da bi se lahko lotili usklajevanja tistih zadev, ki so od zadnjič."
14,"Jaz se opravičujem, gospod Kuhar, pač sem narobe ocenil, kako bi tole lahko šlo."
40,"Se pravi, zadnjič, od prej nam je ostalo še, da se USKLAIMO V ZVEZI Z ODLOKOM O USTANOVITVI OZIROMA SPREMEMBAH ODLOKA O ZAKONODAJNO-PRAVNI KOMISIJI na kratko povedano in pa v zvezi z dvema ODLOKOMA, ki se nanašata na zvezne akte."
18,Eden na ZAČASNE UKREPE IZ PRISTOJNOSTI ZBORA REPUBLIK IN POKRAJIN IN drugi NA AKTE IZ PRISTOJNOSTI ZVEZNEGA ZBORA.
26,"Prosil bi, da v imenu, torej pisna poročila ste dobili v zvezi z obema zadevama, morda najprej, da absolviramo to zadevo v zvezi z Zakonodajno-pravno komisijo."
11,"Ali je potrebna še dodatna obrazložitev predloga, ki je bil dan?"
54,"Torej kot se spominjate, mi smo ta odlok sprejeli, drugod pa ni bil sprejet, tako da je usklajevalna komisija zdaj pripravila sporazumni predlog, po katerem naj bi se ta odlok sprejel, s tem, da naj bi pa vse člane, vseh 11 članov ponovno se pač vrnilo v usklajevanje v politične organizacije v klubih delegatov."
7,Ali kdo še želi dodatno pojasnilo morda?
5,Imate pač pisno poročilo že.
12,"Če ne, bi dal ta sporazumni predlog Komisije za usklajevanje na glasovanje."
3,Kdo je za?
3,Je kdo proti?
4,Se je kdo vzdržal?
10,"Ugotavljam, da je predlog usklajevalne komisije z večino glasov sprejet."
8,Prehajamo na USKLAJEVANJE V ZVEZI Z ZVEZNIMI AKTI.
4,Imeli smo dva odloka.
16,"Prvi je zajemal AKTE IZ PRISTOJNOSTI ZBOROV REPUBLIK IN POKRAJIN, drugi pa IZ PRISTOJNOSTI ZVEZNEGA ZBORA."
4,Dobili ste pisna poročila.
14,"Ali je potrebno, da se še ustno poroča v zvezi s predlogom usklajevalne komisije?"
10,"Če take želje ni, pač potem ali želi kdo razpravljati?"
8,Bi morda gospod Kranjec kaj o tem povedal?
5,"Gospod predsednik, spoštovane delegatke, delegati!"
16,"Usklajevalna komisija se je sestala, ker je vaš zbor zavzel odklonilno stališče do predloga izvršnega sveta."
15,"Jaz sem na usklajevalni komisiji poskušal pojasniti, zakaj smo tako stališče na izvršnem svetu zavzeli."
6,Šlo je predvsem za pragmatičen pristop.
53,"Namreč, vi veste, da se izvršni svet v začetku in vseskozi ni strinjal s povečanjem zveznega proračuna, čeprav se zavedamo, da imajo posledice tega nestrinjanja tudi materialne efekte, s tem, da kolikor proračun ne bi bil sprejet, bi se naj plačevalo subvenciji za izvoz in beneficiranih obresti ter nekatere regrese pri umetnih gnojilih."
9,Mi seveda s tem predlogom nismo uspeli v Beogradu.
76,"Smo bili preglasovani, zato so bili ti predlogi sprejeti kot začasni ukrep, in smo seveda v tej situaciji potem pristopili pragmatično, tako da ne nasprotujemo še naprej temu izvršenemu dejstvu, na katerega žal ne moremo vplivati, ker bi to lahko pomenilo, da bi se Zvezni izvršni svet odločil in postavil na stališče, ker Slovenija pač ne daje soglasja k temu, meni, da ne potrebuje sredstev in se lahko postavi na stališče, da sredstev enostavno ne nakazuje."
25,"To je bilo edino vodilo izvršnega sveta pri tem stališču, vendar je tukaj bila pobuda dana, da se kljub temu izrazi nezadovoljstvo s takim načinom."
10,"Jaz mislim, da nezadovoljstvo lahko izrazimo, in da ga izražamo."
7,"Samo efekta to, žal, v Beogradu nima."
33,"In mislimo, da morajo pragmatične konfiguracije prevladati nad moralnimi načeli in zato smo seveda skušali le prepričati usklajevalno komisijo, da bi le dala soglasje in seveda sprejela enak sklep kot ostala dva zbora."
45,"Če sem razumel dobro usklajevalno komisijo, se je s tem strinjala in obljubila, da bo priporočila temu zboru, da se ponovno prouči vaš sklep, da bi vi dali potem soglasje, da bi bili usklajeni, da bi potem imeli enake sklepe v vseh treh zborih Skupščine."
31,"S tem dejansko nimamo nobenih materialnih posledic, ne zapiramo pa si vrat pred možnostjo zvezne vlade, da se postavi na zelo negativno stališče do Slovenije in nam enostavno sredstev ne nakazuje."
23,"To je bilo v bistvu edino vodilo izvršnega sveta, ne pa da bi se v načelu razlikovali od gledanj vas oziroma republiške skupščine."
17,"Jaz bi vam rad še povedal, da mi še pričakujemo sredstva v tem letu iz zveznega proračuna."
38,"Ta sredstva lahko po podatkih, ki jih imam trenutno na razpolago, znašajo še okoli 1.300 milijonov za izvozne spodbude, namreč ocena vseh izvoznih stimulacij, ki naj bi jih Slovenija dobila do konca tega leta, je okoli 2700 milijonov."
14,"Okoli 1400 milijonov je že bilo plačanih, to se pravi okrog 1300 še ostane."
10,Potem je ocena sredstev za regrese in obresti v kmetijstvu.
47,"Ta sredstva, ki bi jih dobila Slovenija, znašajo okoli 300 milijonov, od tega smo že dobili okoli 240, to se pravi, gre še za dodatnih 60 milijonov, in pa pri regresih za umetna gnojila, katerih vsota bi znašala okrog 95 milijonov letos, dobili smo pa okoli 80."
49,"Skratka, gre za 15 milijonov, gre za 60 milijonov, 75 milijonov in okoli 1300 pri izvoznih spodbudah, to se pravi za okoli 1400 milijonov, ali okroglo po uradnem tečaju 200 milijonov mark in mi nismo želeli zapreti vrat za ta sredstva, ki bi eventualno lahko prišla še v Slovenijo."
22,"Zato ta pragmatičen pristop in seveda, jaz vam priporočam, oziroma bi prosil, da premislite ponovno o vašem sklepu in se poskušate uskladiti."
44,"Sicer mora stvar iti ponovno v celotno proceduro, se bo zavlekla in zvezna vlada, sicer ne vemo, kako, koliko časa bo ta konstalacija Jugoslavije trajala, ampak pač nihče ne more predvideti, ampak pragmatično, bi rekel, ravnanje narekuje, da smo tudi mi pragmatični v tem."
14,"In to je v bistvu vse, kar je izvršni svet vodilo pri tej odločitvi."
2,Hvala lepa.
2,Hvala lepa.
24,"No, kot ste verjetno videli, usklajevalna komisija predlaga, da naj Zbor občin ponovno razpravlja o sprejemu odloka o soglasju z zakonom o začasnih ukrepih."
16,Izvršni svet Skupščine Republike Slovenije naj Zboru občin pred tem predloži razloge za sprejem navedenih odlokov.
7,"No, drugo smo zdaj slišali, te razloge."
9,"Torej na nas je, da se o tem odločimo."
4,Ali želi kdo razpravljati?
3,"Prosim, gospod Gros!"
5,Zdaj pa jaz ne vem.
19,"Tukaj gor piše, da naj bi mi ponovno obravnavali, potem pa naj bi šlo na skupno zasedanje v decembru."
7,Ali je to tako mišljeno ali ne?
11,"Kako, tisto je potem naprej, če se mi ne bomo strinjali."
2,"Da, saj."
16,"Zdaj ne vem, ali je to normalno, da se tukaj v Skupščini hipotetično pogovarjamo ali kako?"
18,"Glejte, tukaj sem jaz prebral ta del predloga usklajevalne komisije, ki ste ga vsi pisno dobili na klop."
13,"Ta del, ki se nanaša na ta del postopka, pri katerem smo sedaj."
27,"Če se ne bomo odločili, vsak je lahko prebral, da se bo potem to preneslo na obravnavo na naslednjo sejo, torej na skupno zasedanje vseh treh zborov."
4,Ker bomo tam usklajevali.
5,"Vsi vemo, kako usklajevanje poteka."
7,"Potem pa predlagam, da tega ne sprejmemo."
13,Da zavrnemo tako kot zadnjič in naj gre po normalnem usklajevanju spet naprej.
35,"Ker ne moremo se strinjati s tem, da bomo zato, da bomo nekaj fičnikov iz zveznega proračuna dobili, da bomo potem pa vse svoje moralne, kakor ste rekli gospod Kranjec, vrednote prodali za nekaj fičnikov."
8,Jaz sem pač gospodarstvenik in smatram tole fičnike.
54,"No, gospod Gros, če smo že pri tem zadnjem odstavku, potem nam nalaga ta usklajevalna komisija tudi, naj delegate ostalih dveh zborov seznanimo z argumentacijo, ki je bila osnova za odločitev zbora, tako da tiste, ki se eventualno zavzemate za našo negativno odločitev, da navedete argumente, da bi jih lahko posredovali ostalima dvema zboroma."
3,"Prosim, gospod Jež."
12,"Če dovolite, samo naslednje: razmišljal sem popolnoma drugače kot naš finančni minister."
21,"Svoje stališče bi bil pripravljen spremeniti samo v primeru, če nam lahko izvršni svet predloži obračun v zelo preprosti, poenostavljeni obliki."
22,"Kolikšen je znesek, ki ga mi v ta proračun dajemo in kolikšen je znesek, ki ga mi skozi tovrstne postopke dobimo nazaj?"
9,"Moje dosedanje prepričanje je, da več dajemo kot dobimo."
36,"In moj predlog je, da ta sredstva pri nas zadržimo, iz teh sredstev damo prispevke vsem upravičencem iz tega naslova, razliko, ki je po mojem prepričanju pozitivna, pa uporabimo za prepotrebne intervencije v našem lastnem gospodarstvu."
29,"Če lahko gospod Kranjec danes postreže z drugačnimi podatki, ki bi nas lahko prepričali, da je saldo v drugačnem primeru za nas ugodnejši, potem sem tudi pripravljen drugače glasovati."
2,Hvala lepa.
45,"No potem bi, če dovolite, opozoril vseeno na gradivo, ki ste ga prejeli z gradivom za to sejo, to je ocena prilivov in odlivov Republike Slovenije v federacijo v zvezi z dopolnilnim predlogom Zveznega izvršnega sveta k osnutku zakona o skupnem obsegu odhodkov proračuna Federacije."
12,"Mislim, tam so določeni ti podatki verjetno kar vsi, po katerih sprašujete."
2,Gospod Kranjec.
26,"Gospod predsednik, vi ste že povedali kje so ti podatki, mi smo jih že večkrat dali in jih tako rekoč od seje do seje ponovno pripravljamo."
15,"Moram reči, podatki so, lahko jih precizno, na eno decimalko ponovno pripravimo, če je potrebno."
10,"Dejstvo je, da mi dajemo v Beograd več kot dobivamo."
21,"To je jasno, zato so tudi vsi problemi in problemi v zvezi s plebiscitom in problemi s suverenostjo in tako naprej."
8,"To se rešuje, bi rekel, na drugem nivoju."
