45,"Moram reči, da smo po sedanji organizaciji predvideli 7 centrov za obveščanje v Republiki Sloveniji in dodatnega osmega na obali, ravno zato, da bi se na tem mestu koordiniralo zbiranje, obdelava in posredovanje tovrstnih podatkov in seveda v zvezi s tem aktiviranje vseh strokovnih služb."
17,"O tem, ali bomo imeli svojo obalno stražo ali ne, mislim, da ta hip ne bi razpravljali."
35,"Nočem podcenjevati dolžine našega morja, vendarle je ta prostor omejen, karkoli bomo na tem morju imeli, mora biti večnamensko, uporabno za več namenov, ko gre za tehniko in ko gre tudi za kadre, za plovila."
26,"In tukaj mislim,da se bomo morali sporazumeti med vsemi upravnimi organi in strokovnimi službami, da racionalno k temu pristopimo, da ne delamo drug mimo drugega."
33,"Ali se bo to imenovalo obalna straža ali bodo to plovila Sekretariata za notranje zadeve, ki bi morala biti dodatno opremljena, posadke pa usposobljene tudi za tako reševanje, ali je to kaj drugega?"
21,"Ta hip ne bi o tem razpravljal, bi pa želel zagotoviti, da smo te potrebe obale imeli ves čas pred očmi."
13,"Kar zadeva 16. člen, govori, mislim, da ste vi postavili vprašanje, o odzivanju."
8,Gre samo za odzivanje za zaščito in reševanje.
5,"Torej, samo za to gre."
10,Človek se mora odzvati na poziv za zaščito in reševanje.
29,"Na vprašanje v zvezi z 58. členom, kdo bo po prenehanju obstoja, morebitnem prenehanju obstoja, predsedstva odločal o teh ključnih stvareh, ali bo to samo predsednik ali kdo drug?"
31,"O tem bo odločila skupščina, ko bo sprejela ustavo in z ustavo bomo morali uskladiti tudi vse izvedbene predpise, pa tudi ta ali kakšen drug zakon, ki bo urejal to področje."
64,"Kar zadeva pripombo na 11. člen, za starostno mejo, naj bi se zvišala na 18 let s sedanjih 15 in znižala s 60 oziroma 55, ko gre za zgornjo mejo, je odgovor naslednji: Ko gre za zgornjo mejo, zakonska opredelitev, da človek mora opravljati dolžnosti zaščite in reševanja do te starosti, pogojuje tudi določene predpogoje, namreč, da je temu zdravstveno in tudi sicer kos."
56,"Imamo pa seveda zelo različne nivoje zaščite in reševanja in imamo organe vodenja in poveljevanja, konkretno imamo štabe civilne zaščite, kjer so strokovnjaki v 55 letu starosti, ko gre za gospe in v 60 letu starosti, ko gre za gospode, na vrhuncu svojih zmožnosti in bi umetno ali pa zavestno zniževanje tega verjetno ne bilo korektno."
16,"Torej, če pa gre za zdravstveno nesposobnost ali omejeno sposobnost, pa to urejamo z drugimi predpisi."
17,"In razumljivo je, da oseba, ki fizično, psihično, ali kakorkoli ni kos tem razlogom, tukaj ni vpoklicana."
18,"Isto velja za omejitve, ko gre za matere samohranilke in podobno ter za ljudi, ki imajo druge obveznosti."
10,"Ko zadeva spodnjo starostno mejo, gre za določene ukrepe samozaščite."
14,"Gre za ukrepe, kjer se tudi 15-letnik lahko že zelo intenzivno in uspešno vključi."
6,"Pod pogojem, da ima določena znanja."
24,"In tudi tisti pomislek, ali poskušamo z enim od členov pripeljati, kot je bilo rečeno, predvojaško vzgojo nazaj v šolo, je treba takoj zavreči."
15,Cel člen govori samo o znanjih za zaščito in reševanje in določenih vedenjih za obrambo.
15,"Gre preprosto za seznanjanje vsakega državljana Slovenije, kakšne so pristojnosti in nevarnosti na tem področju."
27,"Vedeti, kaj ti lahko grozi ali pa se aktivno vključiti v oborožen boj, je nekaj čisto drugega, oborožen boj, tega ne boste našli nikjer v tem členu."
7,"Prosim, da se o tem povsem razumemo."
16,"Na vprašanje, ali bo ta teritorialna obramba zdaj zato dražja, ker prihaja v pristojnost Republike Slovenije?"
12,"O tem, ali bo obramba dražja, boste odločali vi tukaj v parlamentu."
18,"Mislim, da morate pri obrambi začeti razmišljati o tem, ne koliko nas stane, ampak koliko nas lahko stane."
12,"In odločitev o tem, koliko nas bo veljala, je v vaši pristojnosti."
13,In z nobenim zakonom s tako centralizacijo mi te odločitve uzurpirati ne moremo.
15,Imeli boste jasen nadzor nad republiškim proračunom in posamezna stroškovna mesta so tudi tukaj jasna.
7,"Mislim, da je ta skrb povsem neutemeljena."
22,"Kar zadeva gorsko reševalno službo, smo jo že v izhodiščih za proračun za prihodnje leto uvrstili tudi v tako imenovani nacionalni program."
24,"Gre predvsem za opremo, ki se nanaša posebej na vas, zdravnike, na dodatno opremljanje helikopterjev letalske enote milice, na dodatno opremljanje s sredstvi zvez."
16,"Torej, gre za izredno tehnično zahtevno in drago opremo in to moramo financirati skozi nacionalni program."
9,"In ta skrb, mislim, da bo s tem presežena."
32,"Seveda pa to ne omejuje občin, da bi pa specifične potrebe postaj gorske reševalne službe v svoji občini še dodatno zadostile s kakšnim dinarjem iz sredstev, ki so v pristojnosti matične občine."
31,"To vaše vprašanje, ko gre za nadomestilo osebnega dohodka, če bo republiški sekretar predpisal usposabljanje pripadnikov gorske reševalne službe, bo zato zagotovil tudi vse potrebne pogoje, vključno z nadomestilom osebnega dohodka."
28,"Je pa res, da mi še vedno predlagamo, da za čas zaščite in reševanja same reševalne akcije, država firmi, kjer je človek zaposlen, ne daje nadomestila osebnega dohodka."
31,"Tukaj smo se zgledovali po vzorih, ki so povsod v zahodnem svetu, vsi so, bom pošteno rekel, življenjsko zainteresirani, imajo reševalce zaposlene pri sebi in nikjer se te zahteve ne pojavljajo."
31,"V kolikor pa ocenjujete, da je to potrebno tudi za čas same intervencije zagotoviti iz državnega proračuna, potem je to stvar dopolnitve tega zakona in odločitve, ki je pri vas, poslancih."
4,Zakon je militantno nastrojen.
15,"Torej, to je absolutna trditev, v kateri pojma militantnost in militarizacija nihče ne želi opredeljevati."
19,"Mislim, da nimamo izdelanega pojmovnega aparata, da pri terminu, ki ga tukaj kdo uporabi, ne stoji vedno isto zaledje."
30,"Mislim, da bi bilo zelo dobro, da se ob naslednji razpravi o demilitarizaciji najprej s predsedujočim dogovorimo, da definiramo ta pojem in potem v skladu s temi definicijami tudi operiramo."
31,"Če mislite, da se želimo s temi rešitvami vpletati v politiko, potem moram odgovoriti da ne, to je strokovno vprašanje, da o ključnih zadevah odloča skupščina, o uporabi pa predsedstvo Slovenije."
11,"Naših delegatov ne boste srečali nikjer, tako kot je danes primer."
24,"Mi o dejavnosti ne moremo odločati, mi lahko predlagamo, mi lahko v skupščino pridemo z določenim programom, ne moremo pa sami o tem odločati."
13,"Vika Potočnik je očitala, da zakon ne ureja civilnega služenja in ugovora vesti."
17,"Jasno in mislim, da bom to v imenu izvršnega sveta ponovil petič ali 10 v tej skupščini."
10,Ta zadeva se lahko uredi v zakonu o vojaški obveznosti.
18,Ker ugovor vesti je ugovor služenju vojaškega roka in v okviru tega zakona se ureja tudi alternativno služenje.
21,"In ko bomo pripravili ta zakon, rok za nas, da ga pripravimo pa je 28. december, bomo uredili tudi to področje."
7,Mi zdaj ne urejamo služenja vojaškega roka.
15,"Ko govorimo o oboroženih silah, pa govorimo samo o teritorialni obrambi in o njeni organizaciji."
28,"Kar zadeva vprašanje službe za opazovanje in obveščanje; ta služba tudi doslej ni bila namenjena zbiranju tovrstnih informacij, ki jih je bilo moč zaznati iz razmišljanja Vike Potočnik."
33,"Torej to ni bila obveščevalna služba, to ni bila špijonska služba, ampak je bila organizacija, v kateri so se zbirali, obdelovali in posredovali podatki, ki so zadevali ogrožanje človeških življenj in materialnih sredstev."
7,"Uvodoma sem povedal, da to službo devojiniziramo."
35,"Iz nje umikamo tisti del, ki se je do zdaj ukvarjal s spreminjanjem zračne situacije in posredovanjem podatkov o morebitnem naletu sovražnih letal, pravočasnem opozarjanju na te nalete in posredovanja teh podatkov tudi oboroženim silam."
33,"Mi s tem v tej službi ne bomo v realnem času, poudarjam, ta hip, ko do dogodka pride, lahko ustrezno reagirali in obvestili vse tiste strokovne organe, ki morajo v tistem hipu ukrepati."
32,"To je namen službe za opazovanje in obveščanje, osnovni element te službe so pa centri za obveščanje, ki jih bo, kot sem rekel, 7 po posameznih pokrajinah in dodatni osmi na obali."
53,"Drug del je pa dopolnilno opazovalno omrežje, v katerega vključujemo vse ključne organizacije posebnega pomena, kot so: hidrometeorološki zavod, ko gre za meteorologijo, železnica, ko gre za stanje na železnicah, Letališče Ljubljana, ko gre za tanje v zraku, Petrol, ko gre za probleme, ki so vezani na skladiščenje naftnih derivatov in tako naprej."
9,"Torej, to pa je tako imenovano dopolnilno opazovalno omrežje."
19,"Gre za sistem, ki nam na enem mestu povezuje vse segmente, ki lahko povzročijo kakršnokoli ogroženost na tem področju."
19,"Trditev, da je zakon še vedno preveč vezan na obstoječe stanje; torej, mi lahko izhajamo samo iz obstoječega stanja."
10,"In uvodoma sem poudaril, da moramo zagotoviti kontinuiteto delovanja sistema."
13,"Mi ne moremo uničiti nekega sistema, preden imamo pripravljen nadomestni, ki je boljši."
9,"Mi lahko te stvari izvajamo samo postopoma, kot proces."
30,"In ocenjujemo, da ta hip določene spremembe moramo narediti, tisto, kar je možno v okviru teh pooblastil, ki jih zdaj imamo, vam tokrat tudi v obliki tega besedila tudi ponujamo."
7,Kar zadeva zaklonišča; mi zaklonišč ne gradimo.
21,"Zaklonišča smo zgradili, kolikor smo jih zgradili, v letošnjem letu je moratorij za gradnjo zaklonišč, pogovarjamo se samo o vzdrževanju zaklonišč."
11,"In v okviru programa za ekipe, ki bodo ta zaklonišča uporabljale."
29,"Povsem se strinjam s tistim razpravljalcem, ki je danes rekel, da zaklonišče ne more opravljati svoje osnovne funkcije, če zraven ni strokovnih ljudi, ki bi znali te stvari uporabljati."
13,Vsako zaklonišče potrebuje tudi ekipo za uporabo zaklonišča in za to intenzivno delamo.
15,"Gre pa za to, da obstoječa zaklonišča ohranimo, jih vzdržujemo in zagotovimo njihov dvojni namen."
25,"Zadnja 3 leta je RSLO pri vsakem soglasju za gradnjo zaklonišč že v fazi izdelave lokacijske dokumentacije predlagal, da projektant pripravi dvojno zasnovo tega zaklonišča."
13,"In povsod tam, kjer so to naredili, je ta dvojni namen tudi dosežen."
7,52. člen; uporaba TO izven območja Slovenije.
16,"Za uporabo TO je danes odgovorno Predsedstvo Slovenije, ko gre za čas miru in izrednih razmer."
16,"Ko gre pa za neposredno vojno nevarnost in vojno, je to sedaj v pristojnosti Predsedstva Jugoslavije."
25,"Vendar, po tem zakonu tudi v vojni in neposredni vojni nevarnosti Predsedstvo Jugoslavije enot TO brez soglasja našega Predsedstva ne more potegniti iz območja Slovenije."
28,"Torej, dajmo stvar razumeti, ne kot poskus, da bi mi projicirali našo vojaško silo na ozemlje sosednjih republik ali držav, ampak kot varovalni mehanizem, gledano na obstoječe razmere."
14,"Kar zadeva 161. člen, mi zavestno uporabljamo termin soglasje za imenovanje predstojnika upravnega organa."
11,"Mi zdaj inštitut mnenje imamo, ampak inštitut mnenje je neobvezna kategorija."
23,"Mi pa govorimo, da področje obrambe ni več splošna ljudska dejavnost, ampak je strokovno področje in mi moramo zagotavljati operativno delovanje naše stroke."
13,"Torej, republiški sekretar za ljudsko obrambo mora imeti pravico izbire svojih ključnih sodelavcev."
3,Zato predlagamo soglasje.
23,"Še vedno bo Izvršni svet v občini volila skupščina občine, toda mandatar bo predhodno dobil soglasje za človeka, ki bo pokrival področje obrambe."
29,"Da se razumemo, ne gre za neko strankarsko odklonilno stališče, da bi se šli kadrovsko politiko, tako kot je bilo to še pred meseci, ampak gre za strokoven pristop."
14,Mi moramo zagotoviti ukrepanje v realnem času in zato morajo biti izpolnjeni določeni predpogoji.
22,"V kolikor mislite, da lahko sekretar za obrambo zlorabi to zaupanje ali ta mandat, se zastavlja vprašanje njegove sposobnosti in njegove odgovornosti."
8,Na tem nivoju se je potem treba pogovarjati.
21,"Ko pa gre za občino in za predstojnike upravnih organov, pa gre v bistvu za stroko in zato uvajamo termin soglasje."
24,"Kar zadeva razpravo o tem, da premalo govorimo o zaščiti in reševanju in dejstvo, da je potrebna večja strokovnost, s tem se popolnoma strinjam."
30,"Zato sem tudi že pred tem rekel, da želimo programe usposabljanja in pogoje usposabljanja v tej državi dvigniti na višji nivo, da bi reševalci v občini bili kos svojim nalogam."
44,"Celotna zaščita in reševanje ostaja v občinski pristojnosti, toda država mora vendarle postaviti neke enotne okvire, enotne normative, naj se gasilski organizaciji to še tako neprijetno sliši, ampak država ne more dovoliti,da v nekem društvu kupijo vozilo, ki gre letošnje leto iz proizvodnje."
13,"Ker to pomeni, da čez 10 let ne bo več sredstev za vzdrževanje."
11,Ne bo tehničnih možnosti in lahko vse skupaj zapeljemo na odpad.
10,"Mi moramo postaviti določene normative, ko gre za te stvari."
10,"Eno od vprašanj je bilo, ali se zgledujemo po zahodu."
3,Seveda se zgledujemo.
42,"Mi bomo predpisali tudi normative za vozila, kakšna vozila so, kakšni so minimalni standardi, da se ne bo dogajalo tako kot se dogaja zdaj, ko ima vsak proizvajalec v Jugoslaviji gasilsko opremo vgrajeno na drugi strani vozila, na drugi višini tega vozila."
34,"Vendar se moramo zmeniti za tri, štiri osnovne tipe in na tem vztrajati, iz državnih jasli, iz proračuna, dati denar samo za tisto, kar bo utemeljeno in kar bo v skladu z nekaterimi normami."
7,"Torej, tukaj pa večja strokovnost mora biti."
9,In ta sistem mora biti enoten na ozemlju Slovenije.
42,"Upam, da se strinjate z menoj, da v kolikor bomo ugotovili, da na določenem področju potrebujemo gasilsko enoto, zato, da bo pokrivala, na primer potrebe karavanškega predora in železniškega predora na Jesenicah, da to ne more biti stvar Jesenic, izključno stvar Jesenic."
13,Da oprema za reševanje v predoru mora biti financirana tudi iz republiškega proračuna.
11,"In zato tukaj, določene drugačne pristojnosti morajo biti kot so doslej."
10,Danes imamo ravno tako na področju požarnega varstva popoln lokalizem.
6,Teh republiških programov praktično ne poznamo.
16,"Tu pa seveda v nobenem primeru, še enkrat poudarjam, ne posegamo v dejavnost Gasilske zveze Slovenije."
14,"Posega pa se v operativno strukturo posameznih enot, gasilskih enot, to pa seveda da."
9,"Kar zadeva očitek, da ni primerjave s sosedi, resnično."
9,V utemeljitvi in v uvodni misli teh primerjav ni.
27,"Ampak ko smo pripravljali ta zakon, smo v preteklih mesecih tudi šli pogledat v tujino, pogledali smo najbolj razvite sisteme v Zvezni republiki Nemčiji in v Avstriji."
27,"In to, kar je tu predlagano, je kompromis med tistim, kar smo mi počeli v preteklosti, tem, kar imamo sedaj in tistim, kar lahko zgradimo v prihodnosti."
6,Preprosto kopirati nemškega sistema ne moremo.
11,"Gasilci seveda rečejo, tam je ta stvar v pristojnosti notranjega ministra."
1,Drži.
8,"Samo, tam je še marsikaj drugega drugače zastavljeno."
32,"Mi pa želimo, še enkrat poudarjam, sistem zaščite in reševanja enotno obdelati, združiti v okviru tako imenovane uprave za zaščito in reševanje in se pogovarjati o zaščiti in reševanju in o reševalcih."
14,Znotraj tega pa so seveda tudi gasilske zveze in gasilske enote za določen del.
27,"Ko pa gre za specifične, zelo zahtevne naloge, so pa to posebne enote civilne zaščite in so to posebne organizacije in firme, ki so usposobljene za to."
7,Tako da ta sistem mora biti enoten.
57,"Mi danes govorimo na osnovi izkušenj,ki smo jih imeli v zadnji ""havariji"" v vašem koncu, ugotavljam, da nimamo sistema enotnih radijskih zvez, da nimamo sistema vodenja in poveljevanja, da smo zaprti v ozke občinske meje in da občinski funkcionarji, ko odločajo o teh zadevah, tudi niso sposobni realno presoditi,kdaj še obvladujejo stvari in kdaj ne."
39,"Mi moramo ustvariti sistem, po katerem bomo reševalne enote ta hip, v realnem času, poklicali iz Prekmurja na Obalo in obratno in bo ta oprema, ki bo tja prišla, med seboj kompatibilna in vsem reševalcem, ki bodo tam, znana."
4,To so naša izhodišča.
8,Ni pa nobenih zlih namenov zatiranja katerekoli dejavnosti.
3,Še enkrat poudarjam.
57,"Želimo in pričakujemo, da bi bilo kljub tem mnogim pripombam zakon moč uskladiti in pripeljati skozi skupščino do konca tega leta, zato da bi s 1.1. skozi proračun Republike Slovenije prevzeli vse obveznosti do Teritorialne obrambe, omogočili v občinah, da se koncentrirajo na tiste probleme, ki jih najbolj težijo, to pa je vsa pristojnost zaščite in reševanja."
21,"In da strogo ločimo tiste stvari, ki so vezane na obrambo in na tiste, ki so vezane na zaščito in reševanje."
18,"Res je, zakon je prehodnega značaja, ko bo plebiscit opravljen in bodo rezultati znani, pa so potrebne korekcije."
18,"Ampak, zasnovali smo ga tako, da so prisotni nekateri nastavki, ki nam omogočajo tudi izvedbo v prehodnem obdobju."
2,Hvala lepa.
1,Hvala.
10,Zdaj smo že globoko v zamudi v zvezi z odmorom.
26,"Vidim, da so prijavljeni še nadaljnji razpravljalci, zato zdaj odrejam odmor, da gremo na kosilo, praviloma ne več kot 45 minut, in s tem prekinjam sejo."
21,"Sporočam pa še tole, da naj bi se Demosovi poslanci ob 12.30 dobili v sobi 84, to je sporočilo Spomenke Hribar."
4,"Spoštovane delegatke, spoštovani delegati!"
21,"Nadaljujemo z našo sejo, prej smo prekinili točko dnevnega reda, torej 14. točko, predlog za izdajo zakona o obrambi in zaščiti."
49,"Želel bi, da najprej to točko zaključimo, ker razprava je bila v glavnem opravljena, nekateri so se še prijavili, nato pa, in to je bistveno, zaradi česar smo se po tej dokaj svečano obarvani skupni seji še zbrali tukaj, to je pa obravnava predloga zakona o intervencijah v gospodarstvu."
24,"Mislim, da čutite tudi sami, če ste ta zakon pregledali, da je ta točka pomembna in da je potrebno, da jo pač čimprej obravnavamo."
9,"Tako, torej najprej da zaključimo 14. točko dnevnega reda."
13,"Prijavil se je prej, že pred prekinitvijo, k razpravi najprej gospod Marjan Dvornik."
18,"Najprej bi rad rekel, da je predlog za izdajo zakona o obrambi in zaščiti z osnutkom, zelo dober."
7,Če lahko to na nek način izrazim.
11,"Namreč, dejansko stanje po občinah je na vseh teh področjih konfuzno."
24,"Ne samo iz te razlage, ki je bila s strani predstavnikov izvršnega sveta, dejansko je v občinah to področje zelo heterogeno in slabo urejeno."
25,"Kljub temu pa ne morem pritrditi razlagi, da je institut ugovora vesti, ki v poglavju obrambne sile ni implicitno vstavljen, upoštevan že z drugim zakonom."
48,"Gre za 54. člen, kjer decidirano piše: ""Državljani, ki še niso dali slovesne zaveze, jo dajo ob vstopu v TO."" Glede na to, da je mogoče tako določbo razlagati restriktivno, bi pomenilo, da so njej podvrženi tudi vsi tisti, ki vojaške službe iz kakršnegakoli drugega razloga niso služili."
19,"Zato predlagam, da se v nadaljevanju tega člena zapiše: ""razen tistih, ki se drugače odločijo na osnovi ugovora vesti."""
35,"Sam bom, ko bo prišel predlog tega zakona z amandmaji in spremembami, ki so bile predložene, glasoval za, vendar, v kolikor te dikcije v 54. členu ne bo, se s takim zakonom ne morem strinjati."
1,Hvala.
2,Hvala lepa.
8,Prijavil se je že prej tudi dr. Glavič.
32,"Spoštovani zbor, zahvaljujem se za obrazložitve predlagatelja, vendar menim, da primerjave z evropskimi rešitvami morajo biti v gradivu, zato, ker je to sklep skupščine prejšnjega sklica, ki smo ga mi tudi potrdili."
21,"Zato je prav, da vidimo te rešitve ali pa da predlagatelj pove, zakaj jih ni predlagal, zakaj za nas niso primerne."
26,"Recimo primer, ki je bil prikazan za gasilce, bi jaz najbrž pozdravil in bi rekel, da se mi zdi, da so gasilci bližje policiji kot vojski."
17,"Tako da mislim, da je dileme treba v predlogu podati in da je tu možno tvorno sodelovanje."
10,Druga zadeva je bila problem izdatkov v opisu finančnih posledic.
11,"Obrazložitev pravi, da zakon ne bo povzročil novih izdatkov iz proračuna."
49,"Ker je manj zaposlenih, je torej očitno, da se bo napravilo nekaj drugega in bi bilo prav, da se pove, da bo zakon zmanjšal stroške, recimo, administrativnih ali organizacijskih služb, da pa bo ta denar namenjen za te in te namene, ker pač predlagatelj meni, da je tam potreben."
16,"Kar se tiče tretjega problema, to je, da zakon prikazuje ali pa predpostavlja nekoliko trši pristop."
12,"To je seveda iz zakona očitno, če ga primerjamo s sedanjo rešitvijo."
33,"Nekatere akcije sekretariata, ki jih skupščina ni obravnavala in odobrila, so take narave, da je potrebno o njih diskutirati in mislim, da je tudi sokrivda za dvig deviz iz bank na slovenski strani."
15,"Tako mislim, da so potrebna politična pogajanja, ne vojaška zaostrovanja in to na obeh straneh."
48,"Ostrina vlade naj bo usmerjena k reševanju gospodarske politike v okviru Jugoslavije, depolitizaciji vojske, umiritvi političnih strasti in vlada naj ne hodi v Beograd samo zaradi vojske, temveč zaradi preprečevanja stečajev in nezaposlenosti, zaradi vključevanja v delitev srednjeevropskega tržišča, za prehod v ustrezno jugoslovansko ali širšo gospodarsko skupnost."
1,Hvala.
1,Hvala.
2,Gospod Božič.
6,"Spoštovano predsedstvo, spoštovane kolegice in kolegi!"
7,"Bom telegrafski, zaradi tega, ker je pozno."
25,"Centri za obveščanje so bili zelo sporna zadeva in očitali smo prejšnji vladi, da je to neka nasilna ali pa umišljena inštitucija in odvečen člen."
46,"Jaz se s tem stališčem strinjam tudi danes, čeprav naj bi to zastavili nekoliko drugače, iz preprostega razloga, jaz mislim, da je ta družba tako dobro organizirana, da imamo policijo, da imamo še nekatere druge službe, ki bi lahko to funkcijo opravljale,in to zelo kvalitetno."
24,"Več kot je teh veznih členov in več kot jih je podrejenih različnim oblastem in resorjem, večja je zmešnjava in bolj je to komplicirano."
37,"Jaz mislim, da za tiste zadeve, ki se tičejo varnosti pa preprečevanja in ogrožanja oziroma nesreč ali pa ukrepanja po nesrečah, bi lahko to tudi drugače uredili in bi lahko to opravila policija, lahko tudi kdo drugi."
49,"In zato predlagam, da se o tem temeljito razmisli, da se te službe obveščanja, ki so bile že prej postavljene kot morda nek anahronizem, zdaj bolj vrednoti in se jim morda tudi odvzame tisto funkcijo, ki jim je bila dana, to je tista zloglasna številka 985, mislim, da je."
4,Že psihološko slabo učinkuje.
92,"Naslednja zadeva, če je imenovanje občinskih sekretarjev oziroma nižjih sekretarjev strokovna zadeva oziroma gre za strokovnost, potem je treba to jasno povedati, da bo imel Republiški sekretariat po občinah izpostave oziroma, da bo to izključno v njegovi pristojnosti in potem ni treba spet podvajati funkcij in mešati zadev, ker potem bo podobno kot je bilo zdaj s teritorialno, da so ji poveljevali Beograd, Ljubljana in občina in je potem samo dodatna zmeda. če pa bo imela občina nad tem pristojnosti, potem je treba pa pustiti in točno določiti, katere so te pristojnosti."
21,"Oktroiran sekretar seveda neki občinski vladi to ne more biti, potem je lahko to samo republiški uradnik, ki ima drugačen status."
65,"Nadalje bom podprl tiste, ki so rekli, da, recimo, gasilci, gorska reševalna ni vsi drugi in podobne službe nikakor ne morejo spadati pod vojsko. pod vojsko naj spada tisto, kar je vojaškega, tisto, kar je pa civilnega in strokovnega, naj spada pod resor notranjih zadev in morda lahko tudi celo nekakšen drugi resor, nikakor pa mislim, da ni mešati z vojsko tisto, kar ni vojska."
20,"Gasilci so v miru in vojni, imajo podobne funkcije in jih lahko uspešno opravljajo, tako kot so jih približno doslej."
33,"In mislim, da bi pomenila zadeva, ko se jih potiska pod vojsko, čisto degradacijo; in druga zadeva, potem se bi jim lahko grozilo z vojaškimi zakoni, kar ni dobrodošla in je neprijetna zadeva."
42,"Nadalje bi rekel, da predlagam sekretariatu, da temeljito preuči stališča tudi Predsedstva Slovenije, ker mislim, da je Predsedstvo dalo tehtne vsebinske pripombe in usmeritve in da bi verjetno veljalo zakon vsaj še enkrat temeljito pregledati in premisliti, preden pride ponovno na klopi."
61,"Predlagam, da ostane kar na enaki stopnji obravnave, še posebej, ker se mi zdi, da je zelo zazrt v trenutne razmere in preteklost, nič kaj dosti ni pa zazrt v to, da se mi pripravljamo na nek samostojen koncept, neodvisen in da je treba začeti graditi že strukturo, ki naj bi jo imeli potem, ko naj bi Slovenija izglasovala svojo suverenost."
14,"Torej tudi, če je začasen zakon, ni treba, da je zakon zazrt v preteklost."
34,"Hkrati pa tisto izobraževanje za SLO in DS, bi opozoril na to, da nikakor ne bi smelo dobiti to kar piše, podoben prizvok kot ga je imelo poučevanje v srednjih šolah in podobna nasilja."
20,"Se pravi, da je treba ta projekt veliko natančneje in temeljiteje razdelati, da ne bi spet delali nasilja nad otroci."
1,Hvala.
2,Hvala lepa.
5,Besedo ima gospa Vika Potočnik.
35,"Se opravičujem, vem da bi radi šli domov, ampak se moram oglasiti glede na to, da je predstavnik izvršnega sveta večkrat bodisi citiral mojo diskusijo ali pa polemiziral brez argumentov, vendar, da se ne strinja."
33,"Jaz sem rekla že v uvodu, da se ne spuščam v posamezne člene, kljub temu, da sem se, ker sem polemizirala s celotnim konceptom, o katerem še niti nismo v tej skupščini razpravljali."
13,Ta zakon pa pomeni prejudic tudi konec koncev glede našega dogovora v skupščini.
21,"In bi prosila, da se izogibate, takrat, ko zmanjka argumentov, da se potem pač operira s tem, da nepravilno uporabljam terminologijo."
