17,"V imenu vseh tistih poslancev, ki nismo profesionalci, predlagam, da se razprave časovno omejijo na dve minuti."
22,"Ker pa imamo v parlamentu s tehniko, štetjem in merjenjem probleme, predlagam, da se v ta namen kupi malo večja peščena ura."
2,Hvala lepa.
40,"Poslance bi moral opozoriti na to, da je razprava o resoluciji o Litvi že končana in razpravljamo sedaj o predlogu glede izjave Skupščine Republike Slovenije k nastopnemu govoru dr. Borisava Jovića in sprašujem, če je k temu vprašanju kakšna razprava."
1,Prosim.
4,Spoštovani poslanci in poslanke!
41,"Ob tej resoluciji bi prosil za bolj pricizno formulacijo v drugem odstavku: ""take izjave, ki so bile očitne namenjene Sloveniji in Hrvaški..."" Menim, da bi bilo bolje, če rečemo: ""Predstavljajo tudi poskus omejevanja pravice do samoodločbe drugih jugoslovanskih narodov in narodnosti""."
4,To bi bilo natančneje.
11,"Predlagam, da mu ne vzamemo doktorata in napišemo dr. Borisav Jović."
2,Hvala lepa.
7,"Torej, gre za amandma k drugem odstavku."
5,Dajem ta amandma v razpravo.
1,Prosim.
15,"Nimam amandmaja, pa bo verjetno kdo rekel, zakaj pa sploh hodiš potem gor k mikrofonu."
15,"Menim, da bi pri takšnih izjavah lahko bili bolj odločni in ne tako politično omaziljeni."
3,"Prosim, gospod Juri."
18,"V imenu skupine, ki je sestavljala to besedilo, naj povem samo, da je bilo usklajevanje nesporno in neproblematično."
20,"Takoj smo prišli do skupnih stališč in se ne bi strinjal s to zadnjo ugotovitvijo, da je tako politično ponižna."
33,"Besedilo je zelo jasno, osebno pa se strinjam s prejšnjim poslancem oziroma s tem amandmajem, da naj dodamo naziv doktorja in naj dodamo: ""poskus omejevanja teh pravic"", ker gre dejansko za tak poskus."
42,"Naj povem še to, da se je skupina sestala v prejšnjem odmoru malce improvizirano, da ni bil prisoten gospod Mehič, če se ne motim, ostali so bili navzoči, namesto poslanca Bekeša pa je bil iz stranke ZKS - Stranke demokratične prenove tovariš Balažič."
20,"Moram se tudi zahvaliti strokovni službi v imenu skupine, ker nam je takoj posredovala tiskano besedilo, original govora dr. Jovića."
9,S tem je seveda pripomogla k hitrejšemu sestavljanju besedila.
1,Hvala.
2,Hvala lepa.
4,Želi še kdo razpravljati?
24,"Če ne, potem dajem najprej na glasovanje amandma glede drugega odstavka te izjave in da se pri imenu Borisava Jovića povsod uporablja naziv doktor."
28,"Upam, da se med tem časom prisotnost tega zbora ni spremenila, zato ne bi še enkrat šteli prisotnosti delegatov, pač pa bi prosil za glasovanje o tem amandmaju."
5,Kdo je za ta amandma?
3,Je kdo proti?
4,Se je kdo vzdržal?
6,"Ugotavljam, da je ta amandma sprejet."
8,Sedaj dajem celotno besedilo te izjave v odločitev.
10,Kdo je za to izjavo s tem že sprejetim amandmajem?
3,Je kdo proti?
4,Se je kdo vzdržal?
12,"Ugotavljam, da je besedilo izjave sprejeto v predloženem besedilu z vključenim amandmajem."
29,"Pojavila se je POBUDA ZKS - STRANKE DEMOKRATIČNE PRENOVE PREDSEDNIKU REPUBLIKE SLOVENIJE, ker ne more biti predmet razprave, saj to je naslovljeno na predsednika, vendar jo bom kljub temu prebral:"
14,"""Skupščina Republike Slovenije mora takoj vso pozornost nameniti uresničevanju svojih ustavnih pristojnosti in nalog."
12,"Po izvolitvi funkcionarjev skupščine, Izvršnega sveta so zato izpolnjeni le nekateri pogoji."
5,Bistvena sta vsaj še dva.
7,"Prvič, izvolitev delovnih teles skupščine in zborov."
10,"Drugič, sprejem operativnega programa dela za vsaj nekaj naslednjih mesecev."
49,"Zato dajemo delegati, člani skupine Stranke demokratične prenove pobudo predsedstvu Skupščine Republike Slovenije, da takoj predlaga zborom in skupščini delovno področje, naloge in načela sestave delovnih teles zborov in skupščine, predlog operativnega programa dela zborov in skupščine vsaj do meseca julija oziroma prednostne naloge dela zborov v naslednjih mesecih."
11,"O obeh predlogih mora biti omogočena razprava v delegatskih skupinah strank."""
26,"To je samo obvestilo, vendar menim, da je povsem sprejemljivo in da se z njim predsedstvo, če lahko v njegovem imenu govorim, povsem v celoti strinja."
5,Dobili smo predlog delegatov Demosa.
16,"Predlagam, da Skupščina Republike Slovenije na današnji seji sprejme poziv: Prvič, slovenski javnosti zavarovanje družbenega premoženja."
24,"Drugič, odlok o ustanovitvi, nalogah in sestavi Komisije delegatov vseh zborov Skupščine Republike Slovenije za celovito proučitev okoliščin, posledic in pojavov oškodovanja družbenega premoženja."
24,"Tretjič, odlok o izvolitvi predsednika in članov skupine delegatov vseh zborov Skupščine Republike Slovenije za celovito proučitev okoliščin,posledic in pojavov oškodovanja družbenega premoženja."
10,"To se pravi, tukaj gre pravzaprav za tri ločene akte."
46,"Skupina delegatov je podpisala to pobudo, ki je sestavljena iz sledečih poslancev: Ivan Pučnik, Ludvik Toplak, Franc Zagožen, Marjan Stare, Danijel Starman, Valentin Prelovec, Janez Janša, Vitodrag Pukl, Katja Boh, Janez Žampa, Franc Planinšek, Slavko Dragovan, Ivo Bizjak in še dva, ki ju ne morem prebrati."
11,"Ker predloga delegati še niste dobili na klop, ga bom prebral."
7,"""POZIV SLOVENSKI JAVNOSTI ZA ZAVAROVANJE DRUŽBENEGA PREMOŽENJA."
39,"Skupščina Republike Slovenije ugotavlja, da je v zadnjem obdobju vse več opozoril zaradi oškodovanja družbenega premoženja na različne načine, kot so nevestno poslovanje, izsiljeni stečaji, prenos premoženja v tujino, vprašljiva privatizacija s strani vodilnih ljudi v podjetjih in podobno."
21,Opozarja se tudi na neučinkovitost dosedanjih institucij in nekaterih ljudi dosedanjega sistema pri preprečevanju oškodovanja materialne in kulturne osnove slovenskega naroda.
67,"Da bi zagotovili zavarovanje celotnega narodnega bogastva in delovne perespektive delavcem, kmetom in izobražencem ter mladi generaciji v domovini, pozivamo slovensko javnost, zlasti vse državne organe, javne službe, vodilne delavce in sredstva javnega obveščanja, da storijo vse v mejah zakonitosti, zakonitih dolžnosti ter osebne, moralne in dražvljanske odgovornosti, da se od danes dalje preprečijo vsa dejanja in opustitve, s katerimi bi se še nadalje krnilo narodovo bogastvo."
25,"Skupščina Republike Slovenije bo zagotovila proces privatizacije zlasti v primerih neučinkovitosti družbene lastnine na pravni podlagi, v skladu z ekonomskimi zakonitostmi ter pravno kulturo Slovencev."
19,"Posebna skupina delegatov bo na podlagi posebnega odloka imenovana za celovito proučitev okoliščin in posledic pojavov oškodovanja družbene lastnine."""
6,To je poziv oziroma predlog poziva.
11,"Sprašujem, ali predlagatelj predlaga posebno komisijo, ki naj to vprašanje prouči."
5,Ali želi predstavnik skupine besedo?
1,Prosim.
6,"Spoštovani predsednik, spoštovane delegatke in delegati!"
23,Že v predvolilni aktivnosti so bili številni apeli naših državljanov in opozorila na zaščito družbene lastnine in protesti zoper neodgovorno oškodovanje družbene lastnine.
20,"Že na prvi seji so prišle zahteve nekaterih delegatov, da bi nekaj storili v tej smeri in morebiti predlagali resolucijo."
20,"Da ne bi takrat obremenjevali že tako obremenjenega dnevnega reda, smo to zadevo predlagali, da se preloži na današnjo sejo."
53,"Zato predlagamo, da se danes sprejme samo poziv slovenski javnosti k zavarovanju družbenega premoženja, do naslednje seje se pripravi citirani odlok o imenovanju komisije za celovito preučitev pojavov, vzrokov in posledic oškodovanja družbene lastnine in na tej podlagi tudi imenuje komisija s pristojnostmi, določenimi v posebnem odloku, ki bi ga naj skupščina sprejela."
2,Hvala lepa.
10,"V razpravo dajem ta predlog, in sicer poziv slovenski javnosti."
1,Spoštovani!
16,"Seveda globoko inšpektiram ta pojav, ki je evidenten, ki ga je nekako skušal dr. Toplak omeniti."
26,"Podpiram prizadevanja, da se zavaruje družbeno premoženje in da se vsi lastninski in drugi procesi, ki bodo tekli v različnih smereh, regulirajo pravno, organizirano in drugače."
6,"Torej, glede tega nimam nikakršnega pomisleka."
12,"Imam pa pomislek, namreč, ali je oportuno organizirati takšno ali drugačno skupino."
26,"Danes smo že oblikovali 27 - članski Izvršni svet, imamo tri zbore skupščine in vsak zbor ima ducat ali še več raznih komisij, podkomisij, svetov in odborov."
11,"Ne nazadnje imamo organe pregona, sodstva in takšne ali drugačne institucije."
44,"Zato se sprašujem, ali ne bi to pomenilo po nepotrebnem formiranje teles, zapletanje zadev, distribucije odgovornosti, ali je bolj oportuno - zato, sem se oglasil, da preverimo, če ne se direktno obrnemo na danes izvoljeni Izvršni svet in damo apel na pravosodne in organe pregona."
21,"Bojim se, če bomo stvari tako parcelizirali, da bomo spet zapadli v hiperorganiziranost, z vsemi posledicami, ki so v preteklosti znane."
2,Hvala lepa.
15,"Torej vaš predlog je, da se ta poziv naslovi na Izvršni svet, ali kako drugače."
25,"Moj predlog je naslednji, da to področje sodi v normalno funkcioniranje države in njenih organov, ne pa, da se za to ustanavljajo nove paralelne konstitucije."
1,Hvala.
9,"Torej ste za to, da se ta poziv odkloni?"
10,"Kar zadeva poziv, po mojem ne more biti nobenega spora."
16,"Strinjam se, da se vsa stihijnost, ki smo ji zadnje čase priča, na nek način zajezi."
40,"Moja misel gre od tod naprej: kako to operativno, tehnično, državniško, če hočete tudi upravno regulirati, v tem drugem delu pa plediram, da za to zadolžimo obstoječe institucije, ki že funkcionirajo in da ne ustanavljamo posebnih skupščinskih in podobnih komisij."
1,Hvala.
2,Hvala lepa.
4,Želi še kdo razpravljati?
1,Prosim.
10,"Sodim med zagovornike privatizacije, sem celo za radikalnejše oblike privatizacije."
23,"Vendar mi ni všeč način, kako smo dobili to pobudo na dnevni red, dobili smo jo brez vsakega pisnega materiala, brez kakršnihkoli usklajevanj."
5,O tem nisem vedel ničesar.
41,"Na hitrico smo slišali besedo, ki ima precej zanimivih formulacij, nekaj pa takšnih, za katere se mi zdi, da jih ne bi izrekel na prvi pogled brez tega, da bi jih dobro preveril in bi za njim ne stale kompetentne inštitucije."
10,"To so, npr. krivda ljudi starega sistema, potreba po privatizaciji."
16,"Menim, da se bo ta skupščina dogovorila za obliko privatizacije, ampak zaenkrat takega sklepa še nimamo."
49,"Sam mandatar, gospod Peterle je za današnjo vlado, ko se je opravičeval in tudi sam priznal, da vlada nima še natančnega programa, se je skliceval na to, da nima dovolj podatkov in da mora narediti inventuro ter ugotoviti, kje so pomanjkljivosti, da bo vlada potem vedela, kaj mora narediti."
61,"Zato menim, da nima nobenega smisla, da bi skupščina ob tem, ko vlada sama še nima in se tudi izgovarja na to, da nima podatkov, da bi mi karkoli prejudicirali danes, najmanj še, da že danes ustanavljamo ali odločamo o ustanovitvi pravice preiskovalne komisije, ki vsaj po imenu, spominja na tisto znano komisijo ob procesu proti Janši, Borštnerju, Zavrlu in Tasiću."
34,"Prav tako osebno menim, mogoče je to stališče preveč cinično, ampak jaz vanj verjamem, da takšen javni poziv nima nikakršne realne vrednosti, da če jaz slišim za načine, kako se odvija ta divja privatizacija."
52,"Gre za izkoriščanje številnih pravnih lukenj v sedanjem sistemu, ki je pač hibrid stare dogovorne ekonomije in ne liberalizacije, ki jo je prinesla Markovićeva vlada, tako da ima večina teh divjih privatizacij verjetno ta hip relevantno pravno osnovo in je ta hip verjetno velik del teh ljudi, ki to počnejo, nemogoče preganjati."
47,"Namesto tega bi predlagal samo to, da bi v okviru današnje točke pozvali novo vlado, da čim prej zbere podatke o načinih potekanja privatizacije - kar pa je verjetno ena delikatnih zadev in ki jo je treba začeti najprej reševati - da čim prej zbere podatke in predlaga ukrepe."
51,"Če bomo v skupščini ugotovili, da je situacija na robu množičnega kriminala, nimam nič proti temu, da se tudi ustanovi posebna preiskovalna komisija in, če oceni, da je problem zelo urgenten, da ga predloži skupščini še pred vsemi tistimi podrobnimi programi, ki nas čakajo, kot so rekli, čez približno mesec dni."
31,"Vendar, ta hip, razen tega poziva vlade, ne moremo odločati o ničemer drugem, zlati pa ne o čem takem, kar bi bil lahko prejudic stvari, ki morajo izhajati iz temeljnih analiz."
1,Hvala.
2,Hvala lepa.
11,Besedo ima gospod Miran Potrč iz stranke ZKS - Stranke demokratičen prenove.
1,Prosim.
6,Strinjam se z razpravo delegata Šetinca.
37,"Menim, da je točka dnevnega reda vprašanja, predlogi in pobude delegatov namenjena, da se vprašanja postavijo, pobude dajo, ne pa, da se prihaja s teksti k predsedniku, ki jih prebere in bi mi o njih morali odločati."
6,"Predlagal bi, da takšno prakso opustimo."
4,Gre za resno stvar.
22,"Jaz bi vas samo rad obvestil, da se vsi zavedamo, tudi prejšnja skupščina je na dveh - treh sejah razpravljala o istem problemu."
26,"O tem obstaja dokumentacija različnih mnenj, tudi delegatskih odgovorov o popolnih pooblastilih pristojnih organov in drugih mnenj, da pristojni organi nimajo ustreznih pooblastil za takšno zavarovanje."
11,"Ne ustvarjati na prvi seji vtis, da gre za vsesplošno krajo."
18,"Ne trdim, da problem ne obstaja, samo menim, da bi bilo slabo, če bi delali tako na pamet."
25,"Besedilo pa se da razumeti tudi tako, vsaj jaz sem ga, ko sem ga slišal, z današnje seje, da bi dajali nek splošni poziv javnosti."
11,"Mi smo predlagali, da naj se delovna telesa čim prej oblikujejo."
15,"Predsednika sem razumel, da predsedstvo to sprejema in da bo skupščino obvestilo, kateri so predlogi."
13,"Nimam nič proti, če skupaj ocenimo, da je potrebno tudi takšno delovno telo."
12,"Prav tako smo se dogovorili, da je treba pripraviti prioritetne naloge skupščine."
21,"Če bo po informacijah iz danes izvoljenega Izvršnega sveta predsedstvo naše skupščine ocenilo, da je to prioritetna naloga, nimam nič proti."
25,"Vendar, dobimo določene dokumente in gradivo, da se bomo lahko prepričali, ne pa neko besedilo, slabo in nerazumljivo prebrano, mi pa moramo o njem glasovati."
1,Hvala.
2,Hvala lepa.
3,Želi kdo razpravljati?
43,"Torej, imamo zdaj dva predloga, in sicer predlog poziva slovenski javnosti o zavarovanju družbenega premoženja, kot ga je predložila skupina iz Demosa in drugič alternativni predlog, da se vsebina tega poziva adresira kot sugestija Izvršnemu svetu, da stvar prouči in predlaga potrebne ukrepe."
17,"Ker gre za spremljevalni predlog k temu pozivu, bi zato dal najprej ta spremljevalni predlog na glasovanje."
6,Če ne želi nihče več razpravljati?
1,Prosim.
6,"Spoštovano predsedstvo, spoštovane kolegice in kolegi!"
13,"Sem eden pobudnikov in oblikovalcev besedila pobude, ki jo je predlagala skupina Demosa."
18,"Izviram iz prakse in dnevno čutim problem neurejenih pravnih, moralnih, etičnih in drugih norm, ki razjedajo našo družbo."
51,"Menim, da bi ta parlament, za katerega vsi trdimo, da je prvi svobodni, demokratični, avtoritativni, lahko s svojim javnim pozivom preprečil v času do formiranja pravnih aktov vlade in morda tudi parlamenta, da ne bi prišlo do nadaljnjega odtoka kapitala v tujino, do sklepanja škodljivih pogodb, ki so na robu zakonitosti."
23,"Govorim o primeru portoroških hotelov, ki so zdaj pred tem, da jih pridobi skupina privatnikov, ki bo nadaljnjih 10 let upravljala z njimi."
8,Formalno-pravno bi taka pogodba lahko bila tudi zakonita.
54,"Veliko vprašanje pa je, ali je etična in moralna in namen poziva in podpisnikov je, vplivati z avtoriteto parlamenta na sedanje stanje, ko so ogrožena zakonitost, pravna varnost, zlasti pa moralno-etična načela in odnos do družbene lastnine, ki nima lastnika, da prepreči vsak tak akt in vsak postopek, ki bi lahko še poslabšal stanje."
60,"Zato predlagam, da sprejmemo tekst tak, kot je bil predložen, ker ne vsebuje nobene formulacije, ki bi atakirala posameznike, naslavljala karkoli, kar ne bi bilo danes v javnosti neštetokrat poudarjeno, kar smo slišali tudi tukaj danes in da odložimo odločitev o tem, ali se bo oblikovala medparlamentarna skupina, ki bo nadzorovala nadaljnje zakonito delo državnih organov, ki so očitno zatajili."
24,"Zlasti mislim na pravobranilce samoupravljanja, javna tožilstva in tudi javna pravobranilstva, ki morajo po zakonu v določenih primerih preverjati in ocenjevati zakonitost tovrstnih pogodb."
21,"Ne gre samo za statusne zadeve, ki so najbolj kritične, saj vemo, da je naš zakon o podjetjih skrajno nedorečen predpis."
26,"Določbe, ki urejajo področje delniških družb, so izjemno pomanjkljive, prav tako imamo ogromno direktorjev, ki imajo tudi privatne firme iz dejavnosti, v kateri poslujejo kot direktorji."
16,"Menim, da je tudi ta poziv namenjen njim in da bi preprečili poslovanje s tako firmo."
2,Hvala lepa.
2,Hvala lepa.
2,Gospod Potočnik.
16,"Mislim, da se ta dva predloga, postavljanje apela javnosti in pa Izvršnemu svetu ne moreta izključevati."
30,"To zahtevo lahko sprejmemo, hkrati pa lahko sprejmemo tudi drugi predlog, ki pravi, da se Izvršnemu svetu naloži, da naj to čim prej, tako kot je bilo formulirano, tudi sprejme."
15,"Menim, da bomo dali to na glasovanje, pa mislim, da se to dvoje ne izključuje."
2,Hvala lepa.
4,Želi še kdo razpravljati?
2,Gospod Školč.
4,"Spoštovane poslanke, spoštovani poslanci!"
14,"Začeti moram tam, kjer vedno začnem in kjer so pač pogoji za delo poslancev."
30,"Če bi hoteli, da pridemo do tega poziva, potem ne bom rekel, da ni treba misliti na vsako drevo, ampak počasi bo pa le treba dajati papirje tudi na mizo."
28,"Zadnjič smo imeli izkušnje z resolucijo za Litvo, danes smo imeli izkušnjo z apelom, ki ga pošiljamo vezano na to, kar je dr. Jović včeraj govoril v Beogradu."
10,"Govorim samo o metodi, za začetek, da ne bo nesporazuma."
48,"Glede na to, da je bilo na začetku napovedano, da nameravamo uveljaviti svoj protest, vezan na nastop dr. Jovića včeraj v Beogradu, in kar je bilo sprejeto v dnevni red, smo relativno hitro prišli do skupnega besedila z enim samim amandmajem in v normalni proceduri to lahko sprejeli."
29,"Zdaj smo spet pred situacijo, da nam pač neka grupacija, ki lahko v vsakem trenutku s svojim glasovalnim aparatom izglasuje karkoli, nas potisne v to, da ne moremo odločati."
40,"Zato bi prosil v imenu te manjšine, ki je ravno tako legitimno izvoljena in ki je tisti del slovenskega naroda, ki se mu reče po novem ""rit"", da dobivamo ta besedila na klop in da lahko o njih normalno razpravljamo."
11,"Opozoril bi le na eno zadevo, kar se spomnim iz teksta."
10,"Gre enostavno za tisti del, kjer se poziva Izvršni svet."
11,"Skupščina Izvršnega sveta nima kaj pozivati, skupščina Izvršnemu svetu naloge nalaga."
45,"V tem tekstu pač poziva in v tem smislu - če bi bil jaz ciničen, bi rekel, da imenovanje take skupine s približno takim tekstom pomeni, da ta skupina delegatov ne zaupa ravnokar izvoljeni vladi, da bo to preprečevala, kar je za svoj osnovni program imela."
51,"Zaenkrat govorim samo o metodi, če bi hoteli ta tekst naprej dodelati, potem bi prosil, da se držimo teh običajev, da enostavno na hitro imenujemo usklajevalno skupino, ki posluša te naše lamentacije, popravlja besedilo in ga daje na koncu vsem delegatom in si na ta način prihranimo več kot eno uro."
43,"Glede na to, da sem mislil že nekajkrat, da je zadnjič, kako govorimo o načinu dela, se vnaprej zavezujem, da od tega trenutka dalje, kadarkoli se mi bo zdelo, da gredo zadeve mimo običajnega postopka, bom dvignil roko in pred mikrofonom tudi povedal."
17,"Tako delo postaja za parlamentarno manjšino nevzdržno in to je tisto, kar ne vodi tako rekoč nikamor."
2,Hvala lepa.
6,Besedo ima poslanec dr. Lev Kreft.
4,Hvala lepa za besedo.
20,"Ne bom se še enkrat predstavljal, verjemite mi, da izhajam iz izkušnje nekoga, ki je eno oblast že pomagal rušiti."
31,"Ni slabšega kot oblast, pa naj bo parlamentarna ali izvršna, ki z zakoni, ki jih nihče ne upošteva, in z etičnimi pozivi namesto uvajanja reda, pravil dokazuje pravzaprav samo lastno nemoč."
58,"Mi smo danes izvolili Izvršni svet z dokaj trdno večino in prosil bi podpisnike zaradi dignitete tudi tega parlamenta, da svoj poziv, med njimi pa so - če sem dobro slišal - vsaj trije člani novoizvoljenega Izvršnega sveta, med drugim tudi taki, ki delajo na resorjih, ki so povezani s to temo, ki jo zdaj obravnavamo - da ta poziv umaknejo."
26,"Izvršni svet pa, verjemite, da je, še preden smo mi spregovorili, vse to slišal in vedel, tako kot je vse to slišal in vedel tudi prejšnji."
17,"V zelo hitrem času bomo dočakali njegovo reakcijo na ta poziv, pa če ga sprejmemo ali ne."
2,Hvala lepa.
1,Hvala.
2,Gospod Smole.
14,Predlog tega poziva sem razumel kot opozorilo na enega najtežjih problemov: zaščite družbene lastnine.
12,"Za mene je to osnovno in zato predlagam, da ta poziv sprejmemo."
19,"Gre za to, da bi s tem pozivom skupščina opozorila, da je potrebno vse sprejeti, da zaščitimo družbeno lastnino."
19,"Menim, da bi bilo zelo slabo, če bi na tej točki zaradi proceduralnih in formalnih razlogov prišlo do razhajanja."
25,"Zato plediram, da bi pri vprašanju obrambe družbene lastnine - v tem apelu se morda stvari lahko še bolje formulirajo - da bi vendar skupščina pokazala enotnost."
2,Hvala lepa.
4,Naslednji razpravljalec ima besedo.
5,"Spoštovani predsednik, spoštovane kolegice, kolegi!"
6,Problem verjetno in ne verjetno obstaja.
31,"Toda živimo v urejeni pravni državi, v kateri smo danes z naglico odpravili brezvladje, zato da ne bi prišli do diskontinuitete in ne do težav, ki bi jih lahko brezvladje povzročilo."
10,"Ta družba je organizirana, tako da ščiti tudi družbeno imovino."
15,"Imamo republiške in občinske pravobranilce, imamo javna tožilstva, imamo druge upravne organe, ki to ščitijo."
21,"Če je to vse odpovedalo, nam tudi poziv javnosti, da samozaščitno in mimo pravnega reda ščitijo družbeno last, ne bo pomagalo."
34,"Edina rešitev je v tem, da danes s tega mesta, zavežemo Izvršni svet, da takoj pripravi zakonske ukrepe, ki bodo sprejeti tudi po hitrem postopku, če je problem tak, da tako izjemno zaščito narekuje."
39,"Če zadeve niso v naši pristojnosti, in nekatere niso, tu so bila opozorila pravilna, npr. zakon o podjetjih itn. v zvezni pristojnosti, dajmo iniciative, da se ti akti v pristojni skupščini takoj popravijo, dopolnijo, da bi zaščitili družbeno premoženje."
12,"Tudi v zvezni skupščini je gotovo interes, da se družbena lastnina zaščiti."
23,"Poziv javnosti bi kazal na našo nemoč, na nujno samoiniciativno delovanje, ki ne kaže na ustvarjanje pravne države, za katero se vsi zavzemamo."
1,Hvala.
2,Gospod Juri.
11,"Pridružil bi se razmišljanju delegata Lukača, Školča in še enega poslanca."
9,"Gre za to, da se nekako naučimo načina dela."
12,"Predlog tega poziva, pa ne uhajam v pomen oziroma vsebino, je improvizacija."
9,"Ker pisnega gradiva nimamo, se pravilno odločati ne moremo."
10,"Mislim, da bi morala tudi praksa naše skupščine to izbrisati."
20,"Improvizacija je upravičena v trenutku, ko so dogajanja v teku, ko se nekaj spreminja, ko je skupščina dolžna hitro reagirati."
7,Ta problem pa že dolgo časa obstaja.
13,Predlagatelji takega poziva bi ga lahko pripravili za današnjo sejo v pisni obliki.
10,Lahko bi se klubi delegatov sestali in o tem razpravljali.
10,"Bistvo problema ni v samem pozivu, ampak v načinu sprejemanja."
42,"Zato bi še enkrat apeliral na to, da se improvizacije o takih temah, takih problemih, ki dalj časa obstajajo, ki imajo svojo osnovo in svojo argumentacijo, na katerih naj se mi hitro opredelimo in odločimo, da se to več ne bi pojavljalo."
15,"Zato bi predlagal konkretno, da se ta poziv v pisni obliki predloži na naslednjo sejo."
9,"To je prva misel, ki sem jo želel povedati."
1,Drugo.
13,Člani Izvršnega sveta so to slišali in bodo verjetno vključili v program dela.
20,"Že ko smo razpravljali o Izvršnem svetu, so bile dane druge pobude, kako bi naj bil oblikovan program Izvršnega sveta."
5,O teh pobudah nismo glasovali.
10,"Bomo pa glasovali, ko bo program v celoti predstavljen skupščini."
8,Zato še ta problem obravnavajmo na enak način.
1,Hvala.
2,Hvala lepa.
4,Želi še kdo razpravljati?
1,Prosim.
31,"Moram ob tem pozivu povedati, da je naša stranka že za časa sklica prejšnje skupščine imela podoben poziv - samo moratorij vseh transakcij na družbeni lastnini - že podala tej skupščini, prejšnjega sklica."
12,"In to gospod Školč gotovo ve, če je v tej skupščini sedel."
20,"Razen, oprostite, počakajte, da do konca povem, razen če administracija v tej skupščini našega poziva ni dala delegatom na klop."
8,"Tega nismo mi krivi, ampak administracija v skupščini."
9,"Zato apeliram, da ta poziv, kljub vsem pomanjkljivostim, sprejmemo."
17,"To, kar se sedaj dogaja z družbeno lastnino, je skrajno malomarno, celo namerno se dogajajo določene transakcije."
33,"Vi točno veste, da je bivši Izvršni svet, npr. graščino Brdo tako rekoč podaril Gospodarski zbornici Slovenije, da se dogajajo transakcije prek meje, kjer se dobesedno naše narodno bogastvo podarja, ne razprodaja tujcem."
17,"In zato prosim, da ne hodite k temu pultu s proceduralnimi zapleti, ampak, da o tem glasujete."
12,"To je v interesu tudi vaše ZSMS - Liberalne stranke, ne samo nas."
2,Hvala lepa.
1,Hvala.
2,Gospod Šetinc.
20,"Zadeva postaja smešna, ampak ne po naši zaslugi in zaslugi naših proceduralnih zapletov, predvsem glede tega nova skupščina - stara skupščina."
11,"To, kar ste predlagali stari skupščini, nima nobene zveze z nami."
