53,"Jaz imam tu izračun samo za eno organizacijo v Sloveniji, za obdobje od meseca julija 1990 do meseca oktobra je tu zaostanka milijon 983.000 dinarjev, to pa, če seštejem, glede na vse zaostanke, ki so ta trenutek v republiki, gre za velike zamike, ki jih moramo razreševati sami v okviru svojih lastnih virov."
28,"Zato predlagam, da to delegatsko vprašanje urgentno razreši izvršni svet in da obljubo, ki je bila dana, da se bodo vsa sredstva nadomestila iz republiškega proračuna, tudi izvede."
2,Hvala lepa.
5,Naslednji ima besedo gospod Metelko.
20,Poslanski klub Slovenske kmečke zveze v zvezi s problemom razporejanja zbranih sredstev za odpravljanje nesreč po poplavi ima naslednjo pobudo:
12,Solidarnostna akcija zbiranja pomoči za odpravo posledic poplav je v polnem teku.
19,"Razumevanje in zaupanje ljudi, ki zbirajo pomoč, je hkrati tudi veliko odgovorno za vse tiste, ki ta sredstva uporabljajo."
23,"Zato predlagam vsem zborom Skupščine Republike Slovenije, da s sklepom zadolžijo izvršni svet, da sprejme ustrezne ukrepe, ki naj zagotovijo racionalno porabo sredstev."
24,"Zato naj bodo investitorji oziroma nosilci sanacijskih del dolžni zbrati ponudbe za režijske storitve, ki vsebujejo cene strojnih ur, prevozov, delovne sile in materiala."
11,"Na osnovi zbranih ponudb naj izbere izvajalca, ki da najugodnejšo ponudbo."
15,"Izvajalci, ki že opravljajo sanacijska dela, so prav tako dolžni takoj dati zgoraj navedene podatke."
13,Izvajalci del naj tudi dvakrat mesečno poročajo o opravljenem delu in porabljenih sredstvih.
18,"Pobudo dajem zato, ker se ponekod že dogaja, da delo opravljajo podjetja, katerih delo je predrago proti ostalim."
13,"Da bi se izognili kasnejšim prepoznim očitkom, predlagamo, da se naša pobuda sprejme."
4,Klub slovenske kmečke zveze.
3,"Gospod Jakelj, prosim."
4,"Spoštovano predsedstvo, spoštovani zbor!"
16,"Ker bolj redko pridem za govornico, bi izkoristil priložnost, in postavil eno vprašanje in eno pobudo."
16,"Vprašanje bi bilo v zvezi z zaključnim izpitom, ki se letos prvič izvaja v 4-letnih programih."
24,"V vzgojnoizobraževalnem programu naravoslovno matematične dejavnosti, s smerjo naravoslovno matematični tehnik, je kljub temu, da se bliža konec prvega polletja, še vedno preveč nejasnosti."
10,Želim odgovor Strokovnega sveta Republike Slovenije za vzgojo in izobraževanje:
19,"1. Kje ostajajo pobude in vprašanja posameznih šol o zaključnih izpitih, ki bi jih moral obravnavati omenjeni strokovni svet."
38,"2. Zahtevam, da Strokovni svet Republike Slovenije za vzgojo in izobraževanje najkasneje do 20. decembra 1990 seznani prizadete, to se pravi učence in učitelje, z natančnim, dokončnim programom zaključnih izpitov, sicer mora sam prevzeti odgovornost za nastale posledice!"
1,Obrazložitev.
13,Samo še pol leta loči prvo generacijo ponovno reformiranih srednješolcev od zaključnih izpitov.
28,"Zaradi številnih nejasnosti v zvezi z zaključnimi izpiti dobivam občutek, da ravna omenjeni strokovni svet skrajno neodgovorno, saj je bila seja njegovih članov že dvakrat preložena zaradi nesklepčnosti."
23,"Pri delegatski pobudi predlagam, da pride do popravka zakona o prekrških v primeru uporabe kurilnega olja za pogon osebnih avtomobilov, kamionov in traktorjev."
6,Kazen mora biti drastična in odbijajoča.
26,"Na primer, pri vozilih, pri katerih ugotovijo kot gorivo kurilno olje, mora voznik oziroma lastnik prevoznega sredstva plačati kazen 7000 din za vsako leto registracije vozila."
23,"Avtoprevozniki, ki vršijo javne in uslužnostne prevoze pa 100.000 din; v primeru ponovnega prekrška uporabe kurilnega olja se tem voznikom odvzame licenca obrti."
1,Obrazložitev.
15,"V Sloveniji vemo, kakšne težave imamo pri gradnji novih cest, saj nam primanjkuje cestnega dinarja."
24,"V tem, ko večina lastnikov pošteno kupuje bencin ali dizelsko gorivo, nekateri neutrudno goljufajo in ne prispevajo nič za naše nove in dotrajane ceste."
19,"Ko sem že tukaj, bi dal pripombo na odgovor mojemu delegatskemu vprašanju, ki sem ga postavil na zadnji seji."
10,To vprašanje je bilo v zvezi s seznamom vojnih zločincev.
25,"Z odgovorom, ki mi ga je poslalo Javno tožilstvo Republike Slovenije, nisem zadovoljen, kajti trdijo, da seznama vojnih zločincev sploh ni in da ne obstaja."
24,"Obstajala bi naj samo neka evidenca o teh vojnih zločincih, ker je pa ta še vedno nekje v tajnosti, želim, da mi jo posredujejo."
2,Hvala lepa.
3,"Prosim, gospod Gros."
24,"Glede na to, da je gospod Jakelj rekel, da bi bilo treba obrtnikom licenco obrti vzeti, bi predlagal, da tudi družbenim firmam licenco vzamejo."
6,Ker moramo načelo enakosti poslovanja upoštevati.
5,Naslednja ima besedo Vika Potočnik.
14,"Spoštovani kolegi, imam sicer v okviru delegatskih vprašanj nekaj dolgov še iz prejšnjih sej."
37,"Prvo, nisem dobila odgovora, če se spomnite, mislim, da je bila druga seja našega zasedanja zbora, kjer sem protestirala in zahtevala od Komisije za spremljanje uresničevanja poslovnika, da ugotovi, ali je seja potekala v skladu s poslovnikom."
6,Odgovora še do danes nisem dobila.
24,"S tem dajem kritiko predvsem sekretarju našega zbora, ki mislim, da niti ni temu ustreznemu organu posredoval te pobude niti mi ni priskrbel odgovora."
31,"Sicer ne zahtevam več in s tem tudi preklicujem to mojo zahtevo, ker mislim, da je stvar zastarela, prosim pa, da vodstvo opozori gospoda sekretarja, da se korektno ponaša do pobud."
19,"Naslednje vprašanje je stari dolg, če tako rečem, in tudi vezano na mojega predhodnika, v zvezi z našim šolstvom."
33,"Naš zbor je sprejel mojo pobudo in sprejel tudi sklep, da zadolžuje Izvršni svet, da mora ustrezen organ pripraviti celovito poročilo, da zdaj ne naštevam vsega, vseh elementov o spremembah na področju šolstva."
38,"Če ste prebrali odgovor, ugotavljate, da se Sekretariat za vzgojo in izobraževanje skoraj v celoti z menoj strinja, ampak vseeno to poročilo predlaga, da obravnavajo vsi trije zbori, kdaj bo pa to poročilo pripravil, pa ne piše ničesar."
50,"Tako, da se bojim, da bo novo šolsko leto in razpis pred vrati, mi bomo pa s številnimi nejasnostmi, ki so se že pojavljale v prejšnjem šolskem letu, zopet pred vrati, predvsem na škodo in na revolt udeležencev usmerjenega izobraževanja, če ga po starem imenujem, to je učencev in študentov."
36,"Zato predlagam, da to poročilo vsi trije zbori, v kolikor se bosta tudi strinjala oba zbora, obravnavamo in Sekretariat za izobraževanje zadolžimo, da ga pripravi do konca tega oziroma za zadnjo sejo v tem koledarskem letu."
11,"Naslednje, nisem dobila odgovora na vprašanje v zvezi z afero Elan."
21,"Stvari kljub temu da sem jaz takrat povpraševala, zakaj ni naš izvršni svet le dal neprepotrebnega garanta za nadaljnji obstoj Elana."
22,"Glede na to, da je šel z določenimi sredstvi v Elan, tega odgovora danes nimam, mislim pa, da se stvari zelo zapletajo."
37,"Ob tem me tudi zanima, ali so resnične vse informacije v zvezi s kadrovskimi posegi in tudi iskalci kvazi rešiteljev iz te katastrofalne krize že bivšega Elana in zdaj že celo novega podjetja, ki bi se ustanovilo."
12,"Pač predlagam, da vodstvo zagotovi, da jaz v najkrajšem času dobim odgovore."
1,Naprej.
49,"Tukaj je bil gospod Janša, zelo mi je žal, da je sejo zapustil, ampak pod delegatskimi vprašanji direktno postavljam vprašanje njegovemu resorju, ker mi je bilo tako tudi naloženo, naj kar direktno osebno njega vprašam, ali je res, da ustanavlja teritorialna obramba neko obveščevalno službo pod nazivom VIS služba?"
20,"Kdo je dal, bom rekla, v kolikor se ustanavlja, kdo je dal soglasje in kakšne kompetence bo imela ta služba?"
3,Kot naslednje vprašanje.
60,"Že v prejšnji vladi sem si sama prizadevala, da bi tako kot je to v svetu, novim ustanovljenim podjetjem država priskočila na pomoč predvsem v tistih prehodnih obdobjih, to je približno šest mesecev do enega leta z davčnimi olajšavami in s tem pripomogla in pokazala resen odnos in pospešila razvoj, ne samo odpiranja novih delovnih mest, temveč tudi novih podjetij."
30,"Sprašujem vlado, ali razmišlja in kdaj bo prišla v Skupščino s celovito zakonodajo, ki bo omogočila in pospeševala hitrejše odpiranje novih delovnih mest in istočasno tudi hitrejše odpiranje novih podjetij."
46,"Namreč stečaji, ki so pred našimi vrati in kopice nezaposlenosti se najverjetneje ne bo dalo reševati zgolj z otožnimi obrazi, z žalostjo, temveč v tem, da država pristopi s konkretnimi ukrepi in pospešuje s tem tudi, od privatne iniciative do družbene iniciative, če jih tako imenujem."
2,Hvala lepa.
30,"No, jaz bi v zvezi s tisto zadevo, ki je bila prva apostrofirana, tole rekel: Jaz ne morem zdaj sicer zatrditi, da smo ravno tisto vprašanje posredovali Komisiji za poslovnik."
31,"Lahko pa v splošnem rečem, da doslej pri vseh teh vprašanjih, v povprečju 40 na sejo, še nisem zasledil za kakšno vprašanje, da bi ugotovili, da od nas naprej ni šlo."
21,"Se pravi, da moram reči, ker je to letelo na gospoda sekretarja, za konkreten primer ne morem reči, bomo pa pregledali."
63,"Sicer pa gospod sekretar v najkrajšem času pripravi vsa vprašanja, da jih pošljemo naprej na ustrezne naslove, ko pa dobimo odgovore, pa jih tudi običajno še isti dan pošljemo delegatom, ki so zastavili vprašanja, tako da po tej plati pavšalna, bi rekel, obtožba je zgrešila cilj, v kolikor pa gre za ta konkretni primer, bomo pač videli, če je prišlo do slučajne napake."
1,Prosim.
2,Gospod predsednik!
3,Jaz se opravičujem.
14,"To ni bila pavšalna pripomba, temveč je bila zelo konkretna, vezana na konkretno vprašanje."
21,"Na to vprašanje nisem dobila odgovora, po informacijah sem tudi dobila zagotovilo, da ta pobuda ni bila posredovana ustreznemu delovnemu telesu."
19,"Jaz sicer danes ne želim več naprej razčiščevati oziroma ne želim več odgovora zaradi tega, ker je stvar zastarela."
24,"Ker je to druga seja danes, pa ne vem katera, moram pogledati, katero že imamo, prosila pa bi za večjo korektnost in tudi doslednost."
53,"Se pa strinjam z vami, da v kopici teh vprašanj, tudi jaz moram povedati, da do zdaj nisem imela pripomb in sem se omejila samo na to točko in na nobeno drugo, ker mislim, da je od povsod drugod bila korektnost tudi pri posredovanju pobud, bodisi izvršnemu svetu ali pa posredovanju meni odgovorov."
1,Hvala.
1,Dobro.
5,Naslednji ima besedo gospod Žižek.
6,"Če mi dovolite, imam delegatsko vprašanje."
15,"Ker menim, da je plebiscit za Republiko Slovenijo življenjskega pomena, bi želel dobiti naslednje odgovore:"
5,1. Kaj pridobimo s plebiscitom?
5,2. Kaj izgubimo s plebiscitom?
7,3. Koliko podjetij bo ekonomsko preživelo plebiscit?
12,4. Koliko let po plebiscitu bomo čutili še ekonomsko krizo in nezaposlenost.
6,Ker to ljudje na terenu sprašujejo.
13,"Vem, mogoče se to sliši banalno sedaj, ampak takšen razgovor je na terenu."
1,Dobro.
15,"No tukaj bomo morda v zadregi, kam nasloviti to vprašanje: Kdo bi vedel takšne odgovore."
7,"Mislim, oprostite, da sem se rahlo pošalil."
4,Naslednji je gospod Dragovan.
2,Spoštovano predsedstvo!
13,"Imam pobudo izvršnemu svetu, da zagotovi učinkovito kontrolo kakovosti vina na slovenskem trgu."
31,"Obrazložitev: Slovenski vinogradniki in vinarji, organizirani v poslovne skupnosti za vinogradništvo in v Zvezi društev vinogradnikov Slovenije, že dobro leto zahtevamo od Republiškega sekretariata za kmetijstvo, da ustanovi specializirano vinarsko inšpekcijo."
32,"Veljavni zakon o vinu iz leta 1974 v členu 40 navaja, da je pristojen za kakovost vina pri pridelovalcu Kmetijski inšpektorat, kakovost stekleničenega vina na trgu pa lahko kontrolira le tržni inšpektorat."
19,"Ta neživljenjska delitev pristojnosti, ki je unikum v svetu, je dejansko storila, da vino pri nas ni pod kontrolo."
11,"Moramo povedati, da tržni inšpektorji niso usposobljeni za kontrolo kakovosti vina."
25,"Enako so kmetijski inšpektorji v težki vlogi, ker v primeru, da so povzorčili vino, ki je sposobno za promet, plača stroške analize uprava inšpekcijskih služb."
11,"Iz strahu, da ne bi bilo stroška pri hiši, ne ukrepajo."
6,In kakšni so rezultati takega stanja?
28,"Neustrezna kakovost nestekleničenega vina, ki se ponuja na trgu pod oznako domače vino, s katero uspešno zavajajo neuke pivce in kvarijo podobo o resnični kakovosti slovenskega kmečkega vina."
1,Drugič.
26,"Na slovenskem trgu se pojavljajo v razredu namiznih stekleničenih vin, pod različnimi imeni predvsem blagovne znamke neslovenskih podjetij zelo sumljive tekočine, ki jih nihče ne kontrolira."
37,"Recimo samo en podatek, vino tako dobimo na trgu po 12 din, vemo pa, da niti vode ne bi mogli po tej ceni pripeljati iz Makedonije, ker so ti stroški tako veliki, da je tu vprašljiva kvaliteta."
28,"Posledice takšnega razvrednotenja kakovosti vina, poleg še drugih slabosti so: zelo zmanjšane površine slovenskih vinogradov glede na letino pridelamo vina za 4 do 6 mesecev potrebe slovenskega trga."
16,"Zaradi tega veselo cvete trgovina predvsem z vidika sumljive kakovosti, ki prihaja iz območij izven Slovenije."
23,"Ni zanimanja za obnovo vinogradov in 14.000 hektarjev absolutnih vinorodnih površin, ki so za druge kmetijske kulture prerevne, čaka zastonj na rigolni plug."
15,"Ti novi vinogradi, če bi bili obnovljeni, ponujajo 7.000 novih delovnih mest samo v vinogradništvu."
10,Nova delovna mesta bi sledila tudi v turizmu in obrti.
7,V pripravi je nov zakon o vinu.
19,"Zahtevamo, da se ga izdela sodobno po zgledu v Evropski skupnosti, ki bi ščitil kakovost, dejavnost porabnika in državo."
2,Hvala lepa.
2,Hvala lepa.
5,Gospod Kramar ima naslednji besedo.
5,Jaz bi imel delegatsko vprašanje.
13,"Izvršni svet in skupščina občine Dravograd mi je naložila, naj podam naslednje vprašanje."
11,"V katastrofalni poplavi, 1. novembra, je utrpela škodo tudi naša občina."
15,"Ker je bila poplavljena ravno industrijska cona občine, je znašala škoda nad 20% družbenega proizvoda."
14,"Izvršni svet občine je zaprosil ustrezne republiške organe, naj tem podjetjem odložijo plačilo prispevkov."
13,"Ti pa niso odobrili odloga plačila z obrazložitvijo, da je zahtevek prispel prepozno."
23,"Ker je občina Dravograd poslala pravočasno to in ena prvih, sprašujem, zakaj ni bilo podjetjem odloženo plačilo prispevkov, drugim občinam pa je bilo."
1,Hvala.
3,Naslednji gospod Kramarič.
8,Za višinsko območje je posebej pomembna reorganizacija gozdarstva.
25,"Nemogoče se je strinjati, da bi ohranili dosedanji sistem, ko je podjetju, katerega neposreden cilj naj bo ustvarjanje dobička, dano varovanje splošno koristnih funkcij gozdov."
9,Te pristojnosti naj se prenesejo na državne upravne organe.
10,"Konkretno na uprave za gozdarstvo v republiki, območju in občini."
12,Te uprave naj se financirajo iz proračuna Republike Slovenije in področnih občin.
25,Finančni vir v proračunu naj bo 2%-ni davek na povprečno prodajno vrednost možnega poseka v družbenih in zasebnih gozdovih; etati po gozdno gospodarskih načrtih.
11,"Merilo, da bi bilo tako obdavčenje pravičnejše od obdavčenja po površini."
9,Bistveno je treba poenostaviti delovanje in obseg gozdarskih služb.
2,Zato predlagam:
31,"1.Republiška gozdna uprava naj opravlja usklajevalne funkcije na področju planov, predpisov s področja gozdarstva in zbiranja solidarnostnih sredstev za gozdno biološko reprodukcijo 3%-ne prodajne vrednosti neto mase po odkazilu."
12,Ta sredstva naj se porabljajo za sanacijo posledic naravnih nesreč v gozdovih.
4,"Večji vetrolomi, ledolomi, pogozdovanje."
17,2. Območne gozdne uprave naj bodo zadolžene za izdelavo gozdno-gospodarskih načrtov za vse gozdove na določenem območju.
9,Ti načrti naj ostanejo osnova za gozdarjenje z gozdovi.
12,Preko teh načrtov naj bi Republika Slovenija uveljavljala splošno koristne funkcije gozdov.
42,"3. Občinske gozdne uprave naj bi imele naslednje pristojnosti: spremljanje in izvajanje gozdno-gospodarskih načrtov, odkazovanje dela za posek v družbenih in zasebnih gozdovih, odmera solidarnostnega prispevka za gozdno biološko reprodukcijo, odmera prispevka za gradnjo in vzdrževanja gozdnih prometnic, (gozdnih cest in vlakov)."
12,"Predlagamo, 5%-no stopnjo od povprečne prodajne vrednosti neto količin odkazanega lesa."
83,"4. Terensko idejno načrtovanje gozdnih prometnic, zbiranje ponudb za projektiranje in izvajanje gozdnih gradenj, financiranja, nadzor nad gradnjami in kolavdacijo gozdnih prometnic v družbenih in zasebnih gozdovih; nadzor sečišč v družbenih in zasebnih gozdovih, odrejanje ukrepov gozdne biološke reprodukcije pri sečnjah na golo, odmera garancijskih zneskov za gozdno biološko reprodukcijo v družbenih in zasebnih gozdovih; vodenje evidence o višini letnih etatov za potrebe uprave za družbene prihodke občin za odmero davkov od gozdov in izvajanje nadzora nad bonitiranim staležem divjadi po lovsko-gospodarskih načrtih."
34,"Iz tega našega predloga sledi: da naj bi gozdno biološka reprodukcija, razen solidarnosti ob naravnih nesrečah, bremenila neposredno lastnike gozdov, oziroma najemnike družbenih gozdov, kar bi spodbujalo, da bo čim manj sečenj na golo."
13,"Strokovni gozdarski delavci, sedanji logarji naj bi postali gozdno-gozdarski lovski nadzorniki, gozdarsko-lovski nadzorniki."
16,"Posebej poudarjamo ohranitev sistemskega zbiranja sredstev za gozdne komunikacije, kar je največji dosežek dosedanje gozdne organiziranosti."
6,Promet z lesom naj bo prost.
15,"Lastnik naj ga prodaja ali predeluje sam, ali preko svoje zadružne ali kake druge organizacije."
8,To naj bo stvar svobodne odločitve lastnika samega.
38,Za poenostavitev in zmanjšanje dela občinskih gozdnih uprav naj bi se na vseh kmetijah v prihodnjih 10 letih priznalo 30%-no pavšalno znižanje davkov in prispevkov iz gozda in gozdne proizvodnje na račun porabe lesa za domačo porabo.
18,"Menimo, da morajo kmetije nadoknaditi zamujeno in prav v prihodnjem obdobju veliko vlagati v turistične in gospodarske objekte."
10,In prav tu naj bi družba konkretno pomagala znižanjem obveznosti.
19,"Pri takšni organiziranosti, kot jo predlagamo, naj bi za delo na Gozdni upravi Tržič, kot primer, zadostovalo 5 delavcev."
16,"Drugo, predlagam, da se vsa sredstva, s katerimi se financira zvezni proračun, zadržijo v Republiki Sloveniji."
6,"Čeprav to nekako uvajamo, ampak vseeno."
16,"Zlasti gre za sredstva vseh zaposlenih v zvezni upravi, ki jih mora naša republika prispevati zanje."
21,"Pri slovenskem SPIZ-u se naj združujejo sredstva za pokojnine: vojnih invalidov, upokojencev v zveznih in državnih organih, oficirje, carinike in druge."
1,Razlaga:
22,"Če je Republika Slovenija dolžna uresničevati svojo politiko preko svojih predstavnikov v zveznih organih, je zanje dolžna tudi poskrbeti, ko so upokojenci."
10,Dolžni smo izenačiti višino dohodkov in pokojnin po republiški zakonodaji.
17,"Ne razumem, da imajo omenjene kategorije obveznosti in ugodnosti po zvezni zakonodaji, pravice pa samo po republiški."
15,"To je pomembno ob uveljavljanju volilne pravice, ob referendumu, ob referendumskem odločanju in tako naprej."
2,Hvala lepa.
1,Hvala.
4,Naslednji je gospod Starman.
31,"Pobuda, ki jo podajam v imenu poslancev obalne regije in v imenu Skupnosti obalnih občin, se nanaša na sprejem dograditve bolnišnice v Izoli v nacionalni program Republike Slovenije za leto 1991."
16,Uporabniki medicinskih storitev na obali že od leta 1974 zbiramo denar za gradnjo bolnice v Izoli.
25,"Sedaj smo v fazi zaključnih del za kompletiranje usposobitve prostorov ginekološkega, porodniškega in otroškega oddelka in ostalih kompleksov za poliklinično in terapevtsko usposobitev celotnega objekta."
20,"Ker smo pred bodočim planskim obdobjem za leto 1991-1995, je nujno potrebno ta program vključiti v slovenski nacionalni program."
49,"Zato v imenu imenovanih dajem pobudo, da se dograditev bolnišnice v Izoli vnese v republiški proračun za financiranje nacionalnega programa v višini nadomestnih virov, za poseben prispevek, ki ga zbirajo občine Koper, Izola in Piran v letih 1990 in v ceno zdravstvenih storitev, ki se opravljajo v tem objektu."
25,Drugo vprašanje pa je sklep oziroma sprejem na dnevni red moje pobude za spremembo zakona o spremembah in dopolnitvah zakona o funkcionarjih v državnih organih.
17,"Spominjamo se, da smo na zadnji seji to sprejeli, da bomo obravnavali ta zakon po hitrem postopku."
21,"Ker je točka dnevnega reda ""pobude in vprašanja delegatov"" zadnja točka, se sprašujem, kaj bomo naredili s to točko dnevnega reda."
51,"Predlagam namreč, da bi predsedstvo našega zbora obvestilo o tem predlogu ostala dva zbora Skupščine, jima posredovalo pobudo, predlagalo, da se iz istih razlogov odločita na naslednjem zasedanju, da se ta zakon uvrsti po hitrem postopku na dnevni red in da se z argumentacijo, ki je tukaj predložena, zakon tudi sprejme."
15,"Zato prosim predsednika, če bi lahko to pobudo posredoval ostalima dvema predsednikoma oziroma predsedniku Skupščine."
1,Hvala.
27,"No, jaz sem zdajle malo okoli šel oziroma malo izvedel, nekatere stvari in Zbor združenega dela čaka samo še na nas oziroma na našo odločitev o pokojninah."
17,"Zato bi prekinil to točko dnevnega reda, vprašanja in ostalo in bi se najprej lotili PREOSTALEGA USKLAJEVANJA."
8,"Najprej ZAKON O POKOJNINAH, da na kratko govorim."
27,"Tukaj je edino naš zbor sprejel ta dodatni amandma in glede na to, ne vem gospod Starman, jaz bi vas povprašal še, kako je glede tega amandmaja."
16,"Bi ga lahko vi umaknili, sicer bi pač ponovno to obravnavali, da vidimo, če lahko tukaj."
10,"Dobro, gospod Kuhar, prosim za poročilo v imenu usklajevalne komisije."
23,"Tako kot vas je gospod predsednik informiral, sta Družbenopolitični zbor in Zbor združenega dela sprejela predlog zakona v enakem besedilu, torej brez amandmaja."
17,"Mi smo sprejeli pisni amandma, ki ga je predlagal gospod Starman, podpisan pa je bil gospod Zagožen."
14,"V Zboru združenega dela je tekla globoka vsebinska razprava, enaka tudi v Družbenopolitičnem zboru."
27,"Zavrnitev amandmaja je bila predvsem obrazložena s strani tako predlagatelja kot tudi posameznih delegatov, kajti sprejetje predlaganega amandmaja pomeni nove finančne obveznosti okrog 300 milijonov novih dinarjev."
9,Tega denarja pa ta trenutek ni od kje vzeti.
52,"Zadnjič smo poslušali podpredsednika Izvršnega sveta Republike Slovenije dr. Jožeta Mencingerja, ki je ocenil gospodarska gibanja in gmotni položaj gospodarskih organizacij zelo negativno in v luči gospodarskega zloma, zato smo se na medzborovski skupini tudi zavoljo tega uskladili, in predlagamo, da bi Zbor občin amandma, ki ga je sprejel, z glasovanjem razveljavil."
2,Hvala lepa.
10,"Torej, slišali smo poročilo te medzborovske skupine o tem primeru."
4,Želi kdo kaj pripomniti?
3,"Prosim, gospod Kramarič."
6,Danes smo že dvakrat se sestali.
13,"Mislim, da sem imel prav, ko sem rekel, da v bistvu denarja ni."
17,"Manjka ga 300 milijonov in da ga nikjer ne moremo dobiti, razen, če vzamemo kakšno premostitveno posojilo."
9,Edini izhod bi bilo črtanje programa znotraj pokojninskega sklada.
6,"Tudi jaz predlagam, da amandma umaknemo."
1,Hvala.
2,Hvala lepa.
4,Gospod Glavič ima besedo.
10,Gre seveda za zamrznitev pokojnin v bistvu za določen čas.
22,"Zdaj, če to napravimo, je treba zamrzniti tudi ostale osebne dohodke in je treba zamrzniti tudi cene oziroma iti v njihovo zniževanje."
7,Tako da seveda je predlog bil nekompleten.
9,Zato je tudi doživel tako usodo v našem zboru.
19,"In jaz bi predlagal, da izvršni svet da svoje stališče do celotne problematike, ne samo do ene skupine državljanov."
69,"No, jaz bi najprej protestiral proti takemu zavajanju delegatov, ker mislim, da kdor je to prebral, torej nisem strokovno za to podkovan, ampak tudi sam znam prebrati tak zakon in mislim, da je bilo vsem jasno oziroma ne vem, če je bilo vsem, meni je dovolj jasno, da kompetentno trdim, da je govoriti v zboru o zamrznitvi pokojnin zavajanje in ustvarjanje nerazpoloženja pri tistih, ki bi eventualno to slišali."
8,"Zaradi tega mislim, da protestiram proti takemu načinu."
3,"Gospa Puharjeva, prosim."
24,"Da, mislim, da ste že na to odgovorili, ker ravno to sem hotela povedati, ne gre za zamrznitev, gre samo za enomesečni zamik usklajevanja."
6,V bistvu je taka interpretacija prava.
33,"Ker zdaj bi izpadel september, z oktobrom bi šli naprej, pomeni enomesečni zamik usklajevanja, bi pa zdajle dobili, če tole sprejmemo, upokojenci, bi rekla to usklajevalno razliko, mislim, da je nekaj čez 15%."
2,Hvala lepa.
10,"Ker ni več razprave, dajem na glasovanje predlog usklajevalne komisije."
16,"Torej predlog je tak, da naš zbor umakne ta amandma, ki ga je predlagal gospod Starman."
3,Kdo je za?
3,Je kdo proti?
4,Se je kdo vzdržal?
9,"Ugotavljam, da je ta predlog z večino glasov sprejet."
11,"S tem imamo še, da glasujemo o predlogu zakona v celoti."
18,"Torej s tem, ko smo umaknili ta amandma, gre za tak zakon, kot je bil v osnovi predložen."
3,Kdo je za?
3,Je kdo proti?
4,Se je kdo vzdržal?
9,"Ugotavljam, da je predlog zakona z večino glasov sprejet."
13,"S tem ugotavljam, da smo usklajeni pri tem zakonu z ostalima dvema zboroma."
4,Gremo naprej po usklajevanju.
10,"Naslednja zadeva, kjer smo bili neusklajeni, je ZAKON O OROŽJU."
42,"Glede tega, torej predlog usklajevalne komisije, če ga lahko na kratko interpretiram, je ta, da naj bi naš zbor sprejel nekaj amandmajev, se pravi k 3., 4., 5., 6. in 7. členu, izključno v zvezi s kaznimi, ki so predpisane v zakonu."
9,"Torej, nanašajo se vsi ti amandmaji na zneske kazni."
7,Bi jih pa lahko po vrsti prebral.
