39,"Kar se tiče vprašanja ustavnosti tega zakona, ki ga je sprožila, kot je gospod Partljič omenil, Stranka demokratične prenove, mi menimo, da ta zakon ni nič v nasprotju z našo veljavno ustavo in z ustavnimi amandmaji k slovenski ustavi."
25,"Lahko, da bi bil kaj v nasprotju z zvezno ustavo, ampak tega ne ugotavljamo več po ustavnih amandmajih, ki smo jih sprejeli v septembru letos."
18,"Trdim pa, da je ta zakon tudi z zvezno ustavo manj v nasprotju kakor pa zakon o podjetjih."
8,Dejansko zakon o podjetjih gre mimo zvezne ustave.
8,Primerjava z zvezno ustavo tu sploh ni pomembna.
11,"Če pa primerjate zakon z našo ustavo, ne vidim nobenega nasprotja."
34,"Morebiti bi kdo trdil, da je v nasprotju, ker drugače opredeljujemo javne službe in se ne držimo izraza zadeve posebnega družbenega pomena ali pa dejavnosti, ki so nenadomestljiv pogoj za življenje in delo itd."
4,Vse to je isto.
5,To je samo vprašanje opredelitve.
45,"Začasno, dokler javne službe ne bodo ponovno opredeljene v področnih zakonih, je tudi v prehodni določbi rečeno, da se pač pod javno službo šteje tisto, kar je sicer v zakonodaji opredeljeno kot dejavnost posebnega družbenega pomena, tako da tudi ne prihajamo v nasprotje z ustavo."
28,"In če smo zdaj pri tej opredelitvi javnih služb, poglejte, to je bilo bolj na koncu postavljeno, ampak v tem zakonu ni mogoče konkretno opredeliti vseh javnih služb."
7,Tu lahko damo samo najbolj abstraktno opredelitev.
18,"Mi boljše do sedaj nismo izumili, jo bomo pa na osnovi vseh teh pripomb poskušali še bolj dodelati."
9,Ampak javne službe bodo morali konkretno opredeliti področni zakoni.
20,"Konkretno, kaj je javna služba, bo moral povedati zakon o šolstvu, pa zakon o zdravstvu, pa zakon o kulturi, itn."
30,"Tam bomo morali te stvari konkretno opredeliti in sicer bistveno ožje kot sedaj, ko je, recimo, zakon o vzgoji in izobraževanju celotno dejavnost izobraževanja opredelil kot dejavnost posebnega družbenega pomena."
18,"Ne more biti celotna dejavnost posebnega družbenega pomena, ampak je samo del te dejavnosti lahko posebnega družbenega pomena."
28,"Nadalje, pri opredelitvi pristojnosti sveta, če grem spet po vrsti, o čemer je govoril gospod Partljič, pri teh načrtih in programih za razvoj zavoda nismo nič takega mislili."
14,"Mislili smo, da v nekaterih zavodih bo to potrebno, v nekaterih ne bo potrebno."
11,"To je samo zaradi primera našteto, kakšne so kompetence tega sveta."
25,"Nedvomno bo moralo biti že v zakonu o kulturi ali pa ustanovitvenem aktu ali v pravilih kulturne organizacije, gledališča, npr. točno opredeljeno, kdo sprejema program."
13,Seveda ne bo mogel biti to svet kot organ upravljanja ali pa ustanovitelj.
17,"Ta bo lahko o tem odločal samo z vidika finančnih sredstev, ne pa z vidika vsebine programa."
21,"Ali so ustrezna finančna sredstva za izvedbo programa, je stvar sveta, vsebina programa pa je stvar strokovnega sveta in umetniškega vodje."
44,"Kar se tiče termina ""zavod""; v Beogradu nam vseskozi ponujajo zakon o ustanovah, ki je tam tudi v proceduri, samo smo ugotovili, da za nas ni uporaben in da gremo v lasten zakon, ker imamo za to tudi lastno ustavno podlago v naši ustavi."
32,"Ustanova je namreč širši pojem od zavoda in mi na ta izraz ne pristajamo, ker ustanova obsega oziroma se pri nas uporablja predvsem za fondacijo, ali čemur se reče na jugu zadužbina."
7,Za te primere se izraz ustanova uporablja.
24,"Zavod je pa organizacija, ki opravlja določeno dejavnost in tu hočemo ostati pri terminu, ki smo ga že imeli, to je naš pravni termin."
11,Zakonodajo o zavodih smo že imeli oziroma ta termin vseskozi uporabljali.
28,"Ni pa nujno, da se sedaj vsak zavod, vsaka organizacija, ki se ustanovi kot zavod, tudi imenuje zavod, da ima v svoji firmi, v svojem imenu termin zavod."
35,"Slovensko narodno gledališče bo še naprej Slovensko narodno gledališče in ne bo nič treba pisati, da je tak ali drugačen zavod, ampak se bo videlo po aktu o ustanovitvi, da je zavod in po registraciji."
8,Posebej pa tega ni treba izraziti v imenu.
24,"Kar se tiče avtonomije zavodov, je že sedaj za univerzo avtonomija zakonsko zagotovljena, v novi ustavi pa bo celo ustavno zagotovljena, kar sedaj ni."
20,Sicer pa je avtonomija zavodov odvisna od dejavnosti oziroma stroke in je težko opredeliti avtonomijo zavodov v tem splošnem zakonu.
16,"To spet lahko samo po področjih opredelimo, pa spet odvisno od tega, kakšno dejavnost zavod opravlja."
17,"Manj bo najbrž avtonomije v tistih zavodih, ki bodo opravljali javne službe, kot pa v drugih zavodih."
16,"To bo stvar opredelitve v zakonodaji, pa tudi v ustanovitvenih aktih, kadar gre za zasebne zavode."
12,"Mislim za zavode, ki jih ne ustanavlja država za opravljanje javnih služb."
19,"Seveda, ustanovitelj zavoda je lahko vsakdo, tudi razne skupnosti, bodisi, da so pravne osebe ali da niso pravne osebe."
8,Tudi posameznik lahko ustanovi zavod ali skupina ljudi.
13,"Naj hkrati ob tem povem, da tudi samoupravne narodnostne skupnosti lahko ustanavljajo zavode."
13,"To iz zakona izhaja in ne vidim posebne potrebe, da se to piše."
20,"Vendar bomo proučili predlog Komisije za narodnosti, da se to eksplicitno tudi napiše v zakon, da ne bo kakšnih nesporazumov."
9,Ali so prehodne in končne določbe bistveni del zakona?
8,"So pomemben del zakona, niso pa bistveni del."
26,"Bistven je celoten zakon, ker brez prvega dela, to je splošnega dela, ni na kaj vezati prehodnih in končnih določb, ki urejajo prehod na novo organizacijo."
4,Glede soupravljanja se strinjam.
4,To vprašanje bomo preučili.
29,"Bilo je v pripravi zakona tudi vprašanje soupravljanja v obravnavi, samo potem smo ugotovili, da je zadeva lahko tako zelo različna, da je bolje, da to področna zakonodaja ureja."
36,"Tu lahko samo spet samo splošno formulo damo, ker bo čisto drugačen način soupravljanja recimo, v šolstvu kot v zdravstvu, pa spet v šolstvu zelo drugačen v osnovni šoli kot v srednji in zlasti na univerzi."
5,Tu bodo razlike zelo velike.
12,"Seveda, v zakon tudi ne moremo pisati osnovnih kriterijev za oblikovanje svetov."
10,"Bojimo se kakršnekoli uniformnosti, to bo področna zakonodaja lažje uredila."
19,"Mi se bojimo tu kakršnekoli kriterije postavljati, ki bi spet povzročali uniformnost, kakršno je povzročal zakon o združenem delu."
4,To so velike težave.
20,"Strinjam pa se, da bi morali osnovo za povezovanje zavodov tudi zapisati v ta splošni zakon, kar je sedaj izpadlo."
28,"Kar se tiče 5. člena zakona oziroma vprašanja, ali določba, da zavode lahko ustanavljajo tudi tuje pravne ali fizične osebe, velja za področje vzgoje in izobraževanja ali ne."
6,To bo moral šolski zakon urediti.
29,"Mi smo samo možnost odprli, da tudi tuje pravne in fizične osebe lahko ustanavljajo zavode, ampak seveda v tem splošnem zakonu lahko samo rečemo, če zakon ne določa drugače."
6,Drug zakon to možnost lahko izključi.
22,"O tem se bo treba na šolskem področju odločiti, čeprav mislim, da na splošno najbrž tega tudi tam ne bo mogoče izključiti."
8,Kdo bo določal ločitev poslovodne in strokovne funkcije?
7,"Predvidevamo, da zakon ali pa ustanovitveni akt."
6,Tu ne moreš drugih kriterijev postavljati.
12,"Nadaljnje vprašanje je, če imenuje direktorja ustanovitelj, kdo opravi razpis in izbiro."
9,"Organ ustanovitelja, ki je pristojen za imenovanje, nihče drug."
11,"Tu ni več, kakor je bilo do sedaj, nekih razpisnih komisij."
9,"Vse je v pristojnosti tistega organa, ki imenuje direktorja."
23,"Če je določeno, da imenuje direktorja ustanovitelj, ga imenuje pač njegov organ, recimo, da je to izvršni svet občinske skupščine ali republiške skupščine."
9,Ta izvršni svet tudi opravi razpis in opravi izbiro.
40,"Če pa je to organ upravljanja v zavodu, bo pač organ upravljanja v zavodu opravil razpis in tudi izbiro brez razpisne komisije, ker je ni več in potem seveda pri izbiri, če je potrebno soglasje izvršnega sveta, zahteval to soglasje."
12,"Ugovor, je bilo rečeno,da bi moral iti na nek drug organ."
11,"Ne more iti na drug organ, samo gre lahko na sodišče."
10,"Ker, poglejte, pri izvršnem svetu, kam naj bi šel ugovor."
2,Na skupščino?
3,To ne gre.
18,"Ugovor je za to, da ta organ, ki je opravil izbiro, še enkrat preizkusi, če ni delal napak."
4,Saj so roki kratki.
11,"Lahko pa samo ugovor odpravimo, pa je direktna pot na sodišče."
5,Samo ti dve možnosti sta.
9,"Jaz grem tako po vprašanjih, kakor so tekle razprave."
46,"Vprašanje samoprispevka oziroma objektov, zgrajenih s samoprispevkom, bomo posebej proučili, čeprav se je treba zavedati, da je samoprispevek samo ena od oblik javnega financiranja, katere uvedba je na prostovoljni podlagi oziroma na osnovi izreka večine prebivalstva določenega območja, ki je po navadi krajevna skupnost ali občina."
34,"Ko pa se je večina za to odločila, potem postane to obvezno in se sprejme sklep o uvedbi samoprispevka, ki zavezuje vse, tudi tiste, ki so glasovali proti ali pa se niso glasovanja udeležili."
21,"Je to oblika javnega financiranja,ampak to vprašanje bo res treba proučiti, ker tega je bilo v naših razmerah izjemno veliko."
10,Ali ostajajo predstavniki krajevne skupnosti še vedno v vzgojnoizobraževalnih organizacijah?
3,Še vedno ostanejo.
15,"V zakonu piše, da pristojni organi, organizacije in skupnosti imenujejo svoje delegate v organe upravljanja."
25,"Te skupnosti so samo naslednje: to so narodnostne skupnosti, potem je to pokojninska skupnost, če ima kje kakšne predstavnike, in potem so to krajevne skupnosti."
5,"Mislim, da drugih praktično ni."
15,Bilo je tudi postavljeno vprašanje kriterijev za reelekcijo direktorjev oziroma za reelekcijo pri ponovnem imenovanju.
19,Kriteriji za imenovanja direktorjev so določeni že sedaj v področni zakonodaji in po tistih kriterijih jih je treba imenovati.
34,"V šolskih zakonih piše, kakšne pogoje morajo izpolnjevati kandidati, ki kandidirajo za ravnatelje v osnovnih šolah oziroma kakšne pogoje mora imeti ravnatelj osnovne šole, kakšne pogoje mora imeti ravnatelj srednje šole in tako naprej."
15,"Tam so ti pogoji natančno navedeni in te pogoje mora tisti, ki ga imenuje, upoštevati."
9,Ta zakon tudi ne more nekih generalnih kriterijev dajati.
14,"Strinjam se, da je najbrž nedorečena razmejitev oziroma razlikovanje med javnim in zasebnim zavodom."
6,Bomo to v nadaljevanju poizkusili izboljšati.
14,"Vprašanje je bilo tudi, kdo je pri ustanoviteljih javnih zavodov druga javna pravna oseba?"
43,"Kot drugo javno pravno osebo smo mislili tudi javne zavode, zlasti pa javne sklade in druge asociacije, kot so, recimo, lahko pokojninski sklad, sklad zdravstvenega zavarovanja, ki bo ustanovil zavod za zdravstveno zavarovanje ali pa bo lahko ustanovil zdravstvene zavode in tako naprej."
7,Zakaj pa govorimo o javni pravni osebi?
21,"Uvajamo pojme, kot jih poznajo drugi pravni sistemi, mi smo doslej imeli razlikovanje med družbenimi pravnimi osebami in civilnimi pravnimi osebami."
32,"To razlikovanje je anahronizem, ker je bilo vezano za družbeno lastnino in je družbeno pravne osebe izločalo od lastninske pravice, civilno pravne osebe pa je izločalo od pravice uporabe na družbenih sredstvih."
16,"Sedaj mi ponovno uvajamo pojme, kot so pravne osebe civilnega prava in pravne osebe javnega prava."
24,"Država bo pravna oseba javnega prava, prav tako občina in takšne asociacije, kot so Gospodarska zbornica in tako dalje, pa tudi razni javni skladi."
9,Rešitev vprašanja lastninjenja je najbrž res preveč preprosto postavljena.
20,"Formula, ki smo jo postavili v zakon, je preveč preprosta in bomo to skušali izdelati, da bodo te stvari jasnejše."
19,"Na dve vprašanji gospoda Bukovca sem že prej odgovoril, glede ustanoviteljskih pravic narodnostne skupnosti in glede ugovora pri razpisu."
31,"Na vprašanje reorganizacije šolstva glede na reorganizacijo občin po novi ustavi vam sedajle pač še ne morem dati nobenega odgovora, ker niti v osnutku ustave še nimamo natančneje opredeljene lokalne samouprave."
27,"Kakšna bo izvedba tega, je še veliko vprašanje in bo najbrž v tej skupščini tem še tudi veliko razprav, zato vam na to ne bi mogel odgovoriti."
26,"Nadalje je bilo predlagano, da bi v dejavnosti, ki so kot primer naštete v 1. členu, kjer opredeljujemo zavode vključili še varstvo naravne in kulturne dediščine."
7,S tem bi šli v prevelike podrobnosti.
67,"Varstvo naravne in kulturne dediščine sodi v področje kulture in se tam ureja in imamo za to že zakonodajo glede vprašanja, da so pa sedaj nekatere naravne in kulturne znamenitosti, mislim, da ste navedli Škocjanske jame, najbrž isto velja za Postojnsko jamo, Predjamski grad, v upravljanju gostinskih organizacij, ne vem, kako so sedaj razmere urejene, morale pa bi biti urejene po zakonu o naravni in kulturni dediščini."
10,"Če niso, ni nujno, da se ustanovi zavod namesto podjetja."
15,"Lahko se ustanovi zavod in je ta zavod v okviru tega podjetja, ni pa nujno."
41,"Lahko se tudi s podjetjem sklene pogodba o koncesiji, kjer se mu določijo pogoji, pod katerimi upravlja to naravno in kulturno dediščino in seveda, da zagotavlja ustrezno varstvo in vse, kar sicer nalaga že veljavni zakon o naravni in kulturni dediščini."
43,"Če te stvari niso urejene že sedaj, pa bi morale biti po veljavni zakonodaji, jih je treba urediti in ko bo ta zakon sprejet, bo dana tudi podlaga za pogodbo o koncesiji, ker pogodba o koncesiji ne bo lahko sklepala tudi s podjetji."
24,Nadalje gre za problem prenosa financiranja določenih dejavnosti od občine na republike in da pa pri tem ni bilo prenešeno tudi ustanoviteljstvo teh organizacij.
14,"Mislim, da vprašanja ustanoviteljstva in vprašanja financiranja, pridobivanja sredstev za delo, ne smemo mešati."
46,"Če je občina ustanovitelj osnovne šole, da pa osnovno šolo sedaj financira delno republika, to ne pomeni, da mora republika tudi ustanoviteljstvo prevzeti in nimamo osnove, da sprejmemo poseben akt, s katerim kar prevzame republika ustanoviteljstvo vseh tistih zavodov, katerih dejavnost se financira iz republiškega proračuna."
3,To ne gre.
22,"Eno je vprašanje ustanoviteljstva in pravic in dolžnosti ustanoviteljstva do zavoda, drugo je pa vprašanje financiranja dejavnosti, ki jo ta zavod opravlja."
20,"Dalje tudi opredelitev, kateri zavodi naj bi imeli in kateri ne strokovni svet v tem splošnem zakonu ni mogoče narediti."
16,"To bo mogoče narediti v področni zakonodaji, ta vprašanja bodo pa reševali tudi predvsem ustanovitveni akti."
31,"Nadalje, kar se tiče razprave gospe Potočnikove: idealno bi bilo, če bi lahko vlada celoten koncept sprememb na teh področjih predložila, samo tega v tako kratkem času ni bilo mogoče narediti."
13,"Postopno bodo na posameznih področjih pripravljali spremembe te zakonodaje, to pa je začetek."
14,"Tudi ni mogoče, da bi primerjavo z evropsko zakonodajo lahko ponudili pri tem zakonu."
34,"Mi smo evropsko zakonodajo gledali, samo evropska zakonodaja tega ne ureja, razen v Italiji, kjer imajo splošni zakon o javnih službah, ki pa ne ureja statusnih vprašanj, ampak sindikalne pravice delavcev in te zadeve."
9,V evropski zakonodaji ni takih splošnih zakonov o zavodih.
30,"Zavode ureja področna zakonodaja, ker so specifike take, da je čisto drugače treba urejati zavode na področju kulture, zavode na področju socialnega varstva, zavode na področju zdravstva in tako naprej."
23,"Mi pa smo bili v to prisiljeni iz naslednjega razloga: poglejte, tudi svoj čas, pred letom 1952, so te zavode urejale področne zakonodaje."
46,"Potem smo pa začeli prehajati na družbeno upravljanje v javnih službah in kot prvi tak splošni akt, ki je na splošno urejal vse vrste zavodov, je bila temeljna uredba o finančno samostojnih zavodih iz leta 1952, ki pa je dejansko uvedla družbeno upravljanje v te zavode."
20,Potem smo po ustavi iz leta 1963 uvedli v zavode delavsko samoupravljanje in to je uvedel temeljni zakon o zavodih.
49,"To je bil splošni zakon, ki je na splošno urejal statusna vprašanja zavodov, dokler ni po ustavi iz leta 1974 zakon o združenem delu teh zavodov povsem izenačil, jih je spremenil v organizacije združenega dela, niti izraza zavoda nismo več poznali in jih je povsem izenačil z gospodarskimi organizacijami."
24,"Sedaj pa moramo po tej poti nazaj, moramo te zavode skupaj potegniti iz zakona o združenem delu, nakar se bo to po področjih urejalo."
9,"Primerjalna zakonodaja bo po področnih zakonih predložena, mislim evropska."
17,"In sedaj samo še vprašanje profitne in neprofitne dejavnosti in tega, kakšno gospodarsko dejavnost lahko opravljajo zavodi."
13,"Poglejte, definicija neprofitne organizacije ne pomeni, da ta organizacija ne sme pridobiti profita."
1,Sme.
20,"Samo neprofitna je zato, ker tega profita ne sme deliti med lastnike, med ustanovitelje, ampak ga mora uporabljati za dejavnost."
27,"Nadalje, če nek zavod, kot ste citirali šole, ki imajo šolske delavnice, ali pa gostinska šola, ki ima gostinski obrat, ta zakon ne omejuje opravljanja te dejavnosti."
15,"Zakon dovoljuje opravljanje gospodarske dejavnosti, če je ta namenjena osnovni dejavnosti, ki jo zavod opravlja."
10,"Ni pa nobene prepovedi, da se gospodarska dejavnost ne opravlja."
16,"Ta je že sama po sebi profitna in ni nobene prepovedi, da ne bi pridobivala profita."
26,"In tudi 12. člen, kot je bilo postavljeno vprašanje, pač pomeni, da se zavod ne sme ukvarjati z drugimi dejavnostmi, razen s tistimi, ki so registrirane."
14,To že tako za vse velja. 12. člen prepoveduje sklepanje pogodb izven registrirane dejavnosti.
19,"Tako določbo ima tudi zakon o podjetjih, ker je nujno, da prepoveš tako dejavnost oziroma sklepanje pogodb izven dejavnosti."
16,"Nadalje je predlog, da se v zakonu opredeli, kdo lahko pridobiva sredstva s plačili za storitve."
5,Tudi tega ne moremo opredeliti.
21,"Najbrž bo, kot sem že na enem zboru povedal, veterinarska postaja vsa sredstva dobila s plačili za storitve, šola pa nobenih."
6,"Mislim, da sem poizkusil povedati vse."
4,"Hvala lepa, gospod Svete."
4,Besedo ima Marjan Dvornik.
10,"Samo repliko, ne gre za tiste dejavnosti, ki ustvarjajo profit."
11,"Vprašanje je tam, kjer je pa večina, kjer se naredi izguba."
23,"Če bo zavod delal z gospodarsko dejavnostjo izgubo, bo moral najbrž razmisliti, ali jo bo še opravljal oziroma bo ustanovitelj o tem razmislil."
20,"Ustanovitelj mu najbrž tam izgube ne bo kril, ustanovitelj bo kril zavodu ne izgubo, ampak primanjkljaj pri opravljanju osnovne dejavnosti."
16,"Najbrž pa izgub ne bo dolgo trpel, izgub na tistem področju, kjer zavod opravlja gospodarsko dejavnost."
4,Besedo ima Janez Lukač.
8,"Jaz bom, spoštovane kolegice in kolegi, zelo kratek."
19,"Namreč, vedenje o zavodih in njihovih dejavnostih v našem zboru, sami ste se prepričali, je na res visoki stopnji."
13,"Problem pa je v tem, da danes mi celotne reforme ne moremo narediti."
2,Zakaj ne?
25,"Mi imamo urejeno to področje z zakonom o združenem delu, ki gre iz predpostavke družbenega urejanja v dveh smereh - tako imenovane družbe uporabnikov in izvajalcev."
64,"Vi veste, da se je ta dikcija podrla, da smo s samo korekcijo republiške in tudi že zvezne ustave prišli do tega, da smo odpravili tako imenovano urejanje teh področij preko interesov, SIS-ov, in da imamo danes celo ustavno zadevo v reformi, če hočete, ali pišemo novo ustavo in zato nimamo ustavnih predpostavk, da bi zavode tako sodobno uredili, kot so najbrž res zahteve."
45,"Težko se je upreti nekaterim zahtevam komparacije z zahodno Evropo, po vplivu civilne javnosti in kakor, če ste dobro spremljali, ta predlog za izdajo zakona z osnutkom zakona, to poskuša rešiti, kolikor je vedenje o tem danes prisotno in kolikor so za to dane možnosti."
15,"Zato le mislim in sem se priglasil zato, da bi mi danes obe fazi združili."
11,"Namreč, nemogoče je obvladovati to področje, ne da ga mi uredimo."
43,"Verjetno bodo pomanjkljivosti, toda če se te pripombe, ki so danes dane in katere je več ali manj predstavnik izvršnega sveta sprejel, potem lahko pričakujemo, da bomo prišli do zakona, ki bo omogočil področno urejanje, in ko bomo sprejeli tudi ustavo, celotno reformo."
52,"Do takrat pa naše življenje more teči na več ali manj realnih odnosih, tistih, ki danes so in ki so tu ustvarjeni in je za to pač moj predlog v tem smislu, da mi prav lahko z mirno vestjo obe fazi danes združimo, tako da vsaj en del te materije poskušamo rešiti."
43,"Rešeno pa, kakor sem in ste tudi vi vsi priče v današnji razpravi, bo mnogo korektneje kot je bilo do sedaj, bolj funkcionalno in bo omogočalo vsaj do neke mere upravljanje življenja, ki se upravlja preko zavodov ali kot nekateri to prevajajo, ustanov."
67,"Tudi zvezna vlada hiti s to ureditvijo, ker čuti, da je tu potreba, čeprav mi nismo več od tega odvisni, toda ona je to že pred počitnicami dala v razpravo, ker ravno ta občutek, da to področje ni urejeno in da odstopa od ureditve, ki smo jo pa že sprejeli na ostalem gospodarskem področju, potem je najbrž res treba danes podpreti ta predlog o združitvi obeh faz."
19,"Pri tem pa ne bo nobenih problemov, da ne bi vnesli teh naših pripomb, kot so bile danes dane."
1,Hvala.
2,Hvala lepa.
8,"Za razpravo ni več prijavljenih, zato razpravo zaključujem."
20,"Predlagam, da najprej sklepamo o tem, ali da združimo prvo in drugo fazo, se pravi, da odločamo tudi o osnutku."
4,Pred sklepanjem ugotovimo prisotnost.
2,Ugotovimo sklepčnost!
23,"Kdo je za to, da združimo, torej da odločamo o prvi in drugi fazi, da obravnavamo ta akt v prvi in drugi fazi?"
3,Je kdo proti?
4,Se je kdo vzdržal?
8,Torej je podatek o 60 prisotnih najbrž napačen.
19,"Torej, odločili smo se, da obravnavamo ta akt v prvi in drugi fazi, kot predlog za izdajo z osnutkom."
9,"Na osnovi tega predlagam zboru, da sprejme naslednji sklep:"
11,"""1. Predlog za izdajo zakona o zavodih z osnutkom se sprejme."
10,2. Predlog zakona pripravi Izvršni svet Skupščine Republike Slovenije in
29,"3. Pri pripravi predloga zakona naj predlagatelj prouči in ustrezno upošteva pripombe, predloge in mnenja delovnih teles skupščine, pisne pripombe delegatov in pripombe iz razprave delegatov na seji zbora."""
6,Želi o tem sklepu kdo razpravljati?
7,"Če ne, dajem predlog sklepa na glasovanje."
3,Kdo je za?
3,Je kdo proti?
4,Se je kdo vzdržal?
8,"Ugotavljam, da je sklep z večino glasov sprejet."
43,"V zvezi s to točko, pa tudi drugimi, predlagam, da ustanovimo še naš del usklajevalne komisije, ki bi potem v dogovoru z ostalima zboroma po možnosti čimprej začela delati v zvezi z zakonom o zadrugah in z zakonom o zavodih, kjer smo neusklajeni."
3,"V fazah, da."
6,Prosim za predloge za to skupino.
5,Oziroma za naš del komisije.
19,"No, zdaj če ni predlogov, bi jaz predlagal nekatere iz te skupine, ki so že bili na tej seji."
5,"Tovariš predsednik, predlagam gospoda Kuharja."
6,"Dobro, gospod Kuhar, potem gospod Starman."
3,"Ne, ne gre."
7,"Da, dobro, potem na novo izbiramo predloge."
19,"Imamo predlog za gospoda Kuharja, jaz bi predlagal tako, da gospoda Lukača, ki je podpredsednik, potem pa še tri."
15,"Da, dobro, potem pa kar na dan še s predlogi, jaz bi gospoda Kramariča predlagal,"
0,.
10,"Argument je ta, namreč delovne skupine se ustanavljajo pred razpravo."
17,"Jaz razprave nisem spremljala, mislim, da ne bi mogla verodostojno prenašati pripomb, ki jih je zbor oblikoval."
1,Hvala.
12,"Da, to je skupina za usklajevanje, ne za pripravo stališč in sklepov."
7,"Dobro, rekel sem Kramarič, koga še predlagate?"
2,Boris Jež.
5,Ali je tukaj prisoten zdajle?
2,"Da, dobro."
3,Imamo torej tri.
11,"Gospod Ivanušič naslednji predlog in še enega prosim, da ne zavlačujemo."
7,"Mogoče gospod Partljič, bi sodelovali pri tem?"
10,"Dvornik, ali je še tukaj, da lahko pristane na kandidaturo?"
4,Trenutno ga ni tukaj.
6,Da ga ne bi v odsotnosti.
25,"Da, zdaj takole je, predlog za gospoda Kuharja in vključno s tem predlogom imamo trenutno pet kandidatov, torej če preberem: Kuhar, Lukač, Kramarič, Jež, Ivanušič."
4,Še kakšen dodaten predlog?
11,"Če ne, bi dal tak sestav našega dela komisije na glasovanje."
3,Kdo je za?
3,Je kdo proti?
4,Se je kdo vzdržal?
8,"Ugotavljam, da je tak sestav skupina soglasno potrdila."
14,"Torej skupina bo začela delati, ko se tudi ostala dva zbora za to odločita."
9,"Smo se pa dogovorili, naj bi bilo to čimprej."
1,14.
14,TOČKA DNEVNEGA REDA - PREDLOG ZAKONA O SPREMEMBAH IN DOPOLNITVAH ZAKONA O POSEBNEM PROMETNEM DAVKU.
5,Predlagatelj akta je Izvršni svet.
4,Želi njegov predstavnik besedo?
12,"Predlog zakona, s katerim je izvršni svet nadomestil prejšnji zakon, ste prejeli."
18,"Prejeli ste tudi poročilo Odbora za podjetništvo in obrt, ki k predlogu zakona predlaga amandma k 2. členu."
30,"Prav tako ste 20.11. na klop prejeli dodatna amandmaja k 4. členu, ki ju je predložil Odbor za podjetništvo in obrt in dodatno poročilo Zakonodajno-pravne komisije, ki soglaša z amandmajema."
25,"Opozarja pa na redakcijski popravek pri amandmaju k 2. členu, ki naj se upošteva pri pripravi besedila zakona za objavo v Uradnem listu Republike Slovenije."
15,"Predlog zakona so obravnavala torej vsa pristojna delovna telesa, pisna poročila delovnih teles smo prejeli."
8,Želi morda besedo kdo od poročevalcev delovnih teles?
3,"Prosim, gospod Dragovan."
20,"Ker ni predstavnika Bevca tukaj, sem bil z njegove strani zadolžen, da pač podam poročilo Odbora za kmetijstvo in gozdarstvo."
