48,"Verjetno bodo tudi pri posameznem tajnem glasovanju razmerja, ki so se že pojavila na prvi seji, to je čisto moje osebno mnenje, samo da gremo naprej, da se ne bomo ustavljali in da, ko se vrnemo, kot je bilo že rečeno h obravnavi programa, ko bo program dan."
1,Hvala.
2,Hvala lepa.
4,Želi še kdo razpravljati?
7,"Preden zaključimo razpravo, bom najprej podal ugotovitve."
29,"Delegati so podali vrsto predlogov za različne komisije, vrsto predlogov, ki jih lahko vključimo v zadnjo točko dnevnega reda in vrsto predlogov, ki so bili neposredno naslovljeni na mandatarja."
12,"Menim, da o njih ni potrebno posebej glasovati in jih kar sprejemamo."
17,"Prav tako splošna soglasja, če se boste s tem strinjali, ker je temu primerna tudi izjava mandatarja."
4,To povzemam kot ugotovitev.
3,Ali kdo ugovarja?
37,"Preden preidemo na samo glasovanje, vas moram še seznaniti z besedilom 26. člena začasnega poslovnika, ki pravi, da so volitve predsednika, podpredsednika in članov Izvršnega sveta tajne in da ni bilo predlagano, da bi bile volitve javne."
12,"Se pravi, se razume samo po sebi, da je to glasovanje tajno."
22,"Glede članov Izvršnega sveta pa se moramo odločiti, ali želimo tajno glasovanje. ali lahko damo predlog na glasovanje brez podrobnega ugotavljanja navzočnosti?"
5,"Menim, da je večina za."
6,Potem lahko preidemo neposredno na glasovanje.
14,Po poslovniku vodi glasovanje predsednik in generalni sekretar ter po dva predstavnika vsakega zbora.
28,"Imam že predlog, da Družbenopolitični zbor zastopa Anton Tomažič in Tone Anderlič, Zbor občin Jože Jaklin in Ivan Vodopivec, Zbor združenega dela pa Jurij Pirš in Angelca Žerovnik."
5,Se s tem predlogom strinjamo?
1,Dobro.
2,Hvala lepa.
8,Odrejam odmor za pripravo glasovnic in drugo gradivo.
4,Preidemo na samo glasovanje.
3,Najprej nekaj obvestil.
5,Glasovali bomo s tremi glasovnicami.
28,"Bela je za mandatarja oziroma predsednika Izvršnega sveta, na drugi so tri imena za tri podpredsednike in s tretjo, ki je lista kot celota, za člane Izvršnega sveta."
9,Torej glasujemo za listo kot celoto za ali proti.
7,Glasovalna mesta bodo v preddverju te dvorane.
9,"Vsak zbor ima svoje mesto, kjer lahko oddate glasovnice."
7,"Prosim, da bi kar prešli na glasovanje."
6,Nadaljujemo sejo in razglašam izide volitev.
10,Najprej izidi o izvolitvi predsednika Izvršnega sveta Skupščine Republike Slovenije.
27,"Po pregledu oddanih glasovnic je volilna komisija ugotovila, da je bilo oddanih 220glasovnic, od tega je za predsednika glasovalo 184 glasov, neveljavnih glasovnic je bilo 36."
23,"Po pregledu veljavnih glasovnic je volilna komisija ugotovila, da je kandidat za predsednika Izvršnega sveta Skupščine Republike Slovenije Lojze Peterle dobil 184 glasov."
35,"Volilna komisija ugotavlja, da je glede na sedmi odstavek 26. člena začasnega poslovnika Skupščine Republike Slovenije za predsednika Izvršnega sveta Skupščine Republike Slovenije izvoljen Lojze Peterle, ker je zanj glasovala večina navzočih delegatov vseh zborov."
6,Izid glasovanja za podpredsednike Izvršnega sveta.
19,"Oddanih je bilo prav tako 220 glasovnic, od tega je bilo 192 glasovnic veljavnih, neveljavnih glasovnic je bilo 28."
36,"Po pregledu veljavnih glasovnic je volilna komisija ugotovila, da so kandidati za podpredsednike Izvršnega sveta Skupščine Republike Slovenije prejeli naslednje število glasov: dr. Jože Mencinger 190 glasov, Matija Malešič 178 glasov, dr. Leo Šešerko 178 glasov."
42,"Volilna komisija ugotavlja, da so glede na sedmi odstavek 24. člena začasnega poslovnika Skupščine Republike Slovenije za podpredsednike Izvršnega sveta Skupščine Republike Slovenije izvoljeni dr. Jože Mencinger, Matija Malešič in dr. Leo Šešerko, ker je zanje glasovala večina navzočih delegatov vseh zborov."
9,In še izid glasovanja za listo članov Izvršnega sveta.
17,"Oddanih je bilo 220 glasovnic, od tega je bilo 194 glasovnic veljavnih, neveljavnih glasovnic je bilo 26."
9,Po pregledu veljavnih glasovnic je volilna komisija ugotovila naslednje:
12,"Za listo je glasovalo 153 delegatov, proti listi je glasovalo 41 delegatov."
42,"Volilna komisija ugotavlja, da je glede na sedmi odstavek 26. člena začasnega poslovnika Skupščine Republike Slovenije izvoljena lista za člane Izvršnega sveta Skupščine Republike Slovenije in imenovanje republiških sekretarjev ter predsednikov republiških komitejev, ker je zanjo glasovala večina navzočih delegatov vseh zborov."
30,"Če naj torej še enkrat preberem imena: dr. Jože Mencinger, podpredsednik za gospodarstvo; Matija Malešič, podpredsednik za družbene dejavnosti in dr. Leo Šešerko, podpredsednik za varstvo okolja in regionalni razvoj."
204,"Člani Izvršnega sveta so: dr. Marko Kranjec, republiški sekretar za finance, Janez Janša, republiški sekretar za ljudsko obrambo, Igor Bavčar, republiški sekretar za notranje zadeve, dr. Rajko Pirnat, republiški sekretar za pravosodje in upravo, Jožica Puhar za republiški komite za delo, Igor Umek za republiški komite za družbeno planiranje, Stane Stanič za republiški komite za informiranje, Lojze Janko za republiški komite za zakonodajo, dr. Dimitrij Rupel za republiški komite za mednarodno sodelovanje, Mihael Jazbinšek za republiški komite za varstvo okolja in urejanje prostora, dr. Miha Tomšič za republiški komite za energetiko, Izidor Rejc za republiški komite za industrijo in gradbeništvo, Maks Bastl za republiški komite za trg in splošne gospodarske zadeve, Ingo Paš za republiški komite za turizem in gostinstvo, Viktor Brezar za republiški komite za drobno gospodarstvo, dr. Jože Osterc za republiški komite za kmetijstvo, gozdarstvo in prehrano, Marjan Kranjc za republiški komite za promet in zveze, Franc Godeša, za republiški komite za borce in vojaške invalide, dr. Katja Boh za republiški komite za zdravstvo in socialno varstvo, dr. Peter Vencelj za republiški komite za vzgojo in izobraževanje ter telesno kulturo, dr. Peter Tancig za republiški komite za raziskovalno dejavnost in tehnologijo, dr. Janez Dular, odgovoren v Izvršnem svetu za Slovence po svetu."
3,Vsem iskreno čestitamo.
8,"Spoštovane gospe poslanke in gospodje poslanci, spoštovano predsedstvo!"
58,"Moram reči, da sem nekoliko ""zmehčan"" zaradi izida tega glasovanja, ker glede na naš začetek, ki v marsičem ni bil najbolj ugleden - se pravi glede na začetek tega našega novega parlamentiranja, nisem pričakoval take široke podpore in ta podpora mene osebno, podpredsednike in vse ostale člane prve demokratično postavljene slovenske vlade v tem stoletju zavezuje na poseben način."
14,"Mi se bomo trudili, da bomo držali besedo, o kateri sem danes dopoldan govoril."
27,"Rad bi še enkrat poudaril, da je naše temeljno izhodišče zakonitost, naš temeljni cilj polna suverenost slovenske države, z zdravim in konkretnim sosedstvom z vsemi našimi bližnjimi."
81,"Kar zadeva delo državne uprave in področij, kjer bo imela nova vlada pristojnosti, zagotavljam, da bo strokovnost oziroma kvaliteta in osebni prispevek tisto merilo, ki ga bomo najprej in v osnovi upoštevali in če se je komu zdelo, da je bilo premalo na to temo povedanega dopoldan, da je bilo premalo eksplicitno, bi rad povsem naravnost povedal, da ne želimo ene knjižice zamenjati z drugo ali z vsoto drugih, da pač naj bo ta tudi tak način kadriranja nekako zadeva preteklosti."
42,"Jasno pa je, da bo na nekaterih področjih, kjer so ti monopoli zelo očitni oziroma niso še preseženi, moralo priti do nekakšnega uravnoteženja, kakor je prišlo do tega uravnoteženja v parlamentu, kot sem ga skušal zastopati pri samem sestavljanju vlade in podobno."
29,"Jaz se vam iz srca zahvaljujem v svojem imenu in v imenu novih ministrov, dovolite, da jih kar tako imenujem, mi bomo poskušali biti vlada, ne samo izvršni svet."
23,"Ena od naših prvih zadev bo med drugim priprava reorganizacije državne uprave, kjer utegne priti tudi do zmanjšanja sedaj razširjenega števila članov vlade."
38,"Jaz se vam res iz srca zahvaljujem za zaupanje in upam, da bomo v duhu, ki mislim, da je bil danes zdrav, nadaljevali naše politično in operativno sodelovanje s predpostavko, da bo vsak ostajal v mejah svojih pristojnosti."
17,"Zdaj smo pač postavili tretji pol demokratično izbrane demokratične oblasti, zdaj ima Slovenija tudi svojo novo vlado."
2,Hvala lepa.
44,"Še nekaj bi rad rekel, ker predlog, da bi se poslancem vsaj na kratko predstavili, nekako ni uspel, bi prosil novoizvoljene člane Izvršnega sveta, da bi se zdaj obrnili z obrazi proti ljudstvu, da jih poslanci vsaj vidite, nato pa bomo podpisali slovesno prisego."
19,"V nadaljevanju bomo imeli tiskovno konferenco, gasilski posnetek pred poslopjem skupščine, nakar se bomo razšli, da se malo oddahnemo."
24,"V petek imamo že srečanje z gospodom Šinigojem, da na kulturen način opravimo primopredajo, naslednji teden pa z vsem vetrom v jadrih na delo."
6,"Prosim člane vlade, da se predstavijo."
21,"Tovariš predsednik Izvršnega sveta je povedal, da bo opravil slovesno, novoizvoljeni Izvršni svet dal slovesno izjavo pred predsednikom Skupščine Republike Slovenije."
24,"Ta slovesnost se bo izvršila tukaj nasproti, zato odrejam za ta čas prekinitev seje in jo bomo nadaljevali potem, ko bo ta slovesnost opravljena."
2,Hvala lepa.
30,"Prehajamo na 3. TOČKO DNEVNEGA REDA - PREDLOG RESOLUCIJE O LITVI, ESTONIJI IN LETONSKI, kar je usklajen predlog, ki ga je pripravila skupina delegatov, ki smo jih imenovali na prejšnji seji."
26,"Sestavljajo jo: Miran Potrč, Tone Peršak, mag. Spomenka Hribar, dr. Leo Šešerko, Matjaž Šinkovec, Vitomir Gros, dr. Rajko Pirnat, Jožef Školč, Franko Juri in Darja Lavtižar-Bebler."
10,"Predlog ste danes prejeli na klop, prosim, da predlog obrazložite."
7,"Sem Tone Peršak, Slovenska demokratična zveza, Demos."
6,Bil sem član te usklajevalne skupine.
13,"Kot rečeno, ste usklajeni predlog dobili na klop, zato teksta ne bi bral."
40,"Ker pa ste zadnjič lahko prebrali tudi predlog za brzojavko baltskim parlamentom in predlog resolucije, bi povedal to, da je bila na tiste predloge izrečena vrsta pripomb in prav zato je bila imenovana skupna usklajevalna komisija, ki je predloge uskladila."
45,"Ker se bo najbrž pri vsakem od vas pojavilo nekaj vprašanj, zakaj je ostalo samo eno besedilo, zakaj je tekst tako kratek, kakor je in tako naprej, bi vendarle, čeprav nam bo to vzelo dve, tri minute časa, povedal, kako je teklo delo usklajevalne komisije."
25,"Skupina je bila, kot ste pravkar slišali, imenovana na ta način, da je imela 11 članov, 6 iz vrst Demos, 5iz vrst ostalih strank."
12,Včeraj se je udeležilo sestanka 10 članov; manjkal je en predstavnik Demosa.
72,"Na sestanku se je skupina seznanila tudi z nekaterimi poročili Evropskega sveta: s sporočili evropski javnosti, ki kažejo na to, da se evropske države v glavnem izogibljejo vprašanja pribaltskih držav in bolj opozarjajo na nelegalnost priključitve teh držav k Sovjetski zvezi pred toliko in toliko leti, svetujejo tem državam ""potrpljenje"" z Gorbačovom (v narekovajih) in posluh za njegove težave oziroma za ogroženo demokratizacijo v Sovjetski zvezi ter jim predlagajo pogajanja z Moskvo."
81,"Drugič, skupina se je seznanila tudi z mnenjem svetovalca v Skupščini Republike Slovenije Matjaža Kovačiča, ki je v pisni obliki podal nekaj pomislekov v zvezi s predlagano deklaracijo in ga na kratko povzemam: 1. Litve še ni priznala nobena država. 2. Priznanje Litve s strani Slovenije nima pravne teže, ker Slovenija ni subjekt mednarodnega prava. 3. Nevarnost negativne reakcije Sovjetske zveze. 4. Možno nasprotovanje sekretariata za zunanje zadeve, ki bi tak korak ocenil kot korak čez okvir enotne jugoslovanske zunanje politike."
26,"No, v skladu s temi pomisleki je gospod Kovačič predlagal preformulacijo deklaracije v smislu priznanja pravice do neodvisnosti in odstop od formulacije o priznanju o neodvisnosti."
11,V razpravi so se nato v skupini uveljavljala zlasti naslednja mnenja:
18,"1. Treba je oblikovati eno samo besedilo, torej ne posebej resolucije in še posebej pismo oziroma brzojavko parlamentu."
27,"Glede tega smo se kmalu uskladili, naj skupščina sprejme samo resolucijo, ki se jo verjetno s kakšnim spremnim pismom predsednika skupščine pošlje tudi parlamentom treh baltiških držav."
37,"2. Glede na to, da Slovenija po svojem mednarodnem pravnem statusu ni kompetentna, da bi lahko priznala neko državo - tak subjekt je po mednarodnem pravu Jugoslavija - je bilo predlagano, da Skupščina Slovenije sploh ne sprejme nikakršne resolucije."
7,"Seveda, pod pogojem, da Demos predlog umakne."
5,To je bil individualen predlog.
28,"No, več ali manj soglasno je bilo ugotovljeno, čeprav to ne pomeni, da smo s tem zadovoljni, da Slovenija po svojem mednarodnem pravnem statusu dejansko te pravice nima."
42,"Kar zadeva priznanje neodvisnosti teh držav pa je jasno tudi to, da javno povedano stališče o tem vprašanju veliko pomeni za samo Slovenijo, ker s tem povemo, da zahtevamo spoštovanje pravice do samoodločbe za vse narode in s tem tudi za slovenskega."
30,"Izraženo je bilo stališče, da mora biti z deklaracijo predvideno naše stališče, da je Slovenija država slovenskega naroda in da kot taka suvereno odloča tudi pri vprašanjih o mednarodnih odnosih."
43,"Povedano pa je bilo tudi nasprotno stališče, da je pač za to pristojna federacija in da je dejansko priznanje Litve, Estonije in Letonske treba zahtevati od Zvezne skupščine, ker po mednarodnih političnih standardih samo to kaj velja, kot je predlagatelj utemeljeval svoj predlog."
14,"S tem predlogom smo se vsi strinjali, nismo pa se strinjali s formulacijo predloga."
2,Ne vsi.
36,"Po dovolj temeljiti diskusiji je na osnovi teh alternativ in pobud nastal predlog, ki ste ga dobili na mizo in ki skuša upoštevati prvotni namen predlagatelja, pa tudi pomisleke, izražene v zvezi s predlaganim osnutkom deklaracije."
8,Poleg tega predstavlja ta predlog neke vrste kompromis.
24,"Po eni strani predlog nedvomno poudarja, da so za nas odločitve Litve, Estonije in Letonske veljavne, ker so izraz pravice teh narodov do samoodločbe."
22,"Tako v bistvu vsaj v političnem in moralnem namenu besede priznava vse te države kot suverene, kar je tudi razvidno iz besedila."
18,"Po drugi strani pa zahteva, da Skupščina SFRJ mednarodnopravno prizna vse tri baltiške države kot samostojne, suverene države."
30,"Deklaracije tudi opozarja, da je naše dejanje vendar predvsem načelno, moralno in politično in da do kakšnega dejanskega učinka od deklaracije ni mogoče pričakovati, vsaj ne v mednarodnopravnem pomenu besede."
19,"Menim, da je tudi tako formulirana deklaracija pomembna, čeprav ni tako deljnosežna, kot je bilo sprva želeno in mišljeno."
56,"Meni osebno, če lahko dodam še to, se zdi še zlasti pomembno, da s tem predlogom, kakor je zdaj formuliran, zahtevamo zelo jasno odločitev Skupščine SFR Jugoslavije in na nek način silimo to skupščino v položaj, ko se bo morala jasno opredeliti glede pravice vseh narodov do samoodločbe, kar ima pa vendarle tudi nekaj notranjepolitičnega pomena."
1,Hvala.
2,Hvala lepa.
13,"Spoštovano predsedstvo, spoštovane poslanke in poslanci, argumentacijo za in proti temu ste slišali."
16,"Če sem še bolj eksakten, je to zahtevo dalo Društvo slovenskih pisateljev že približno pred mesecem."
24,"Na klubu poslancev Demosa smo to obravnavali in smo hoteli predlagati kompromisno rešitev, nek modus vivendi, torej nekaj, o čemer bi lahko vsi glasovali."
24,"To pa zato, da ne bi bilo zopet delitve pri tako pomembnih stvareh, kot so oziroma gre za simboliko delitve na leve in desne."
39,"V Demosu se s tako formulacijo v bistvu strinjamo, vendar bi predlagali, da bi bili dve resoluciji, in sicer prvi odstavek bi bila resolucija, naslovljena na baltiške dežele, vse ostalo pa druga resolucija, ki bi jo poslali v Beograd."
2,Hvala lepa.
38,"Torej, tu gre za amandma k predloženi resoluciji oziroma niti ne za amandma k predloženi resoluciji, ampak gre za to, da se poleg resolucije v tej obliki sprejme še ena resolucija, ki obsega samo prvi odstavek tu predložene."
7,Ali želi kdo razpravljati o tem amandmaju?
6,Potem dajem ta amandma na glasovanje.
12,"Kdo je za to, da se ta amandma sprejme v predlagani obliki?"
3,Je kdo proti?
4,Se je kdo vzdržal?
12,"Glasov nisem štel, vendar vizualno je bila pretežna večina za ta predlog."
10,"Če kdo zahteva, da kljub temu izvršimo glasovanje, ga bomo."
2,Hvala lepa.
31,"Predlagal bi, da se kljub vsemu zmeraj šteje in da se odločitve sprejema, tako kakor velevajo ustava, zakon in poslovnik, drugače ne bo šlo in tega domačinskega vzdušja ne gre prenašati."
29,"Mi smo se navadili drug na drugega, kar pa še ne pomeni, da ne bi bilo treba za vsako odločitev natančno povedati, koliko delegatov je za, proti in vzdržanih."
13,"S tem, da bi, če se vračam nazaj, posegel tudi v prvo diskusijo."
63,"Ni mi jasno, zakaj je potrebno ločevati resolucije, ker je tem, ki so v Litvi, Letonski in Estoniji, povsem jasno, da je subjekt mednarodnega prava Jugoslavije in v tem smislu njim verjetno dosti več pomeni to, če vedo, da je znotraj Jugoslavije nek parlament, ki si prizadeva za priznavanje njihove samostojnosti, kot to, da jih priznava nekdo, ki navzven za to ni kompetenten."
2,Hvala lepa.
2,Hvala lepa.
19,"Torej, najprej moram ugotoviti, če ta zbor zahteva v vsakem primeru posebej ugotavljanje glasov, da smo k temu zavezani."
11,"Mislim pa, da je potrebna racionalnost vodenja postopka tudi v skupščini."
1,Prosim.
11,"Gospod predsednik, gospodje poslanci in poslanke, brez zamere, sam podpiram Školča."
12,"Ni na tem, da se mi odločamo, kako bomo glasovali ali ne."
12,"Za to obstaja poslovnik in najresneje prosim gospoda predsednika, da tako ravna."
19,"Če nismo sposobni delati po poslovniku, potem naj se odredi odmor, naj se ljudje navadijo, kako je treba delati."
4,Nemogoče je delati tako.
7,Že prvi del seje je bil tak.
9,"Mi imamo po poslovniku razpravo, razprava mora biti zaključena."
18,"Po zaključeni razpravi je predsedujoči dolžan vse predloge dati na glasovanje, razen, če posamezen delegat svoj predlog umakne."
16,"Nisem želel razpravljati, ker bi bil stalno občutek, da se hočem delati pametnega, po domače rečeno."
32,"Ampak nemogoče je, da se tako seje vodijo, ker se bomo jezili brez potrebe drug na drugega, bo pa, brez zamere, gospod predsednik, ki tako vodi seje, kriv za našo slabo voljo."
9,Treba je delati po poslovniku in o predlogih odločati.
20,"Če ne želimo uporabljati teh naprav, naj, in to je zdaj moja pobuda, predsedstvo čim prej organizira nek način dela."
9,"Vem, da je nemogoče, da mi vedno ugotavljamo navzočnost."
4,Zato se ne preštejemo.
16,"Vem, da je nemogoče, da bi predsednik moral 240 ali 220 ljudi za vsak sklep šteti."
3,Jaz ga razumem.
12,"Ampak, potem je treba najti nek mehanizem, ki bo zagotovil normalno delo."
14,"Dokler ga ni, ne moremo po domače ugotavljati, smo za, smo proti, smo vzdržani."
2,Hvala lepa.
2,Hvala lepa.
11,"Dobro, jaz vzamem to na znanje, čeprav to ni kršitev poslovnika."
22,"Se pa popolnoma strinjam s predlogom in prosim, če zahtevate glasovanje, da se v vsakem primeru ugotovi točno glasovanje za ali proti."
1,Prosim.
8,"Spoštovani, prosil bi gospoda Tomšiča za ponoven premislek."
10,"Meni se zdi to zelo racionalno, da je resolucija enotna."
43,"Razumel sem ta vaš napor in skrb, vendar izhajajoč iz tega, komu je to namenjeno in glede na mednarodne razsežnosti, bi rekel, da je razvidnost in prepoznavnost za Litvo in za Letonsko in za Estonce po moje primernejša forma kot delitev te resolucije."
32,"Če nimate kakega tehtnega argumenta oziroma ga jaz morda ne vidim, potem bi tudi v izogib neplodnemu diskutiranju in nakazovanju vendar podprli integralnost tega teksta iz razloga, ki sem ga ravnokar navedel."
5,Predvsem zato sem se oglasil.
2,Hvala lepa.
1,Hvala.
2,Gospod Tomšič.
10,"Torej, kolega Žakelj, ne vem, zakaj bi sedaj to ponavljali."
16,"Popolnoma se strinjam, da je treba določiti, koliko za in koliko proti, kakšno tehniko bomo uporabljali."
22,"To je druga zadeva, vendar pa smo o tem amandmaju že glasovali in videlo se je, da je bila velika večina za."
13,"Zdi se mi, da ne moremo sedaj še enkrat glasovati za isto zadevo."
10,"Menim, da vsak od nas ve, za kaj tukaj gre."
16,"Mi dejansko prehitevamo nekaj, kar bomo šele lahko čez tri mesece ali morda še kasneje izrekli."
10,"Gre za simboliko, zato menim, da velike napake ne delamo."
20,"Glasovali pa smo pač že, a lahko se še enkrat, da ugotovimo, koliko je bilo vzdržanih, kar prej nismo ugotovili."
1,Hvala.
14,Glede na intervencijo nekaterih poslancev kljub temu dajem zadevo na glasovanje s štetjem glasov.
6,"Torej, najprej ugotavljam prisotnost Družbenopolitičnega zbora."
3,Kdo je prisoten?
6,Torej je sklepčnost tega zbora podana.
6,Ugotovimo še prisotnost članov Zbora občin.
7,Torej je sklepčnost tega zbora tudi podana.
7,Koliko je prisotnih članov Zbora združenega dela?
6,Tudi sklepčnost tega zbora je podana.
4,Lahko preidemo na glasovanje.
29,"Še enkrat ponavljam, amandma, ki je bil predlagan, da se poleg te resolucije v taki obliki sprejme še ena, ki obsega samo prvi odstavek te resolucije, je bistvo amandmaja."
5,Kdo je za ta amandma?
12,"Torej za amandma je glasovalo 97 poslancev, in je ta amandma sprejet."
26,"Iz tega zaključujem, da ni treba dati še enkrat na glasovanje, ker običajno glasovanje je, da se najprej glasuje o amandmajih, potem pa še o celoti."
5,Kdo se je vzdržal glasovanja?
3,Je kdo proti?
5,"Ugotavljam, da je amandma sprejet."
22,"S tem, ker amandma vsebuje v bistvu tudi glasovanje o predlogu kot celoti, menim, da je s tem tudi ta resolucija sprejeta."
15,"Prav tako pa je sprejeta še dodatna resolucija, ki obsega samo prvi del te resolucije."
2,Gospod predsednik!
22,"Menim, da smo glasovali o amandmaju in da nam ne morete, kot delegatom, odvzeti pravice, da glasujemo o resoluciji, kot je predložena."
13,"Verjetno bi imeli pravico zahtevati, da tudi o tem izrazimo svoje politično stališče."
2,Hvala lepa.
6,Želi kdo razpravljati o tej stvari?
14,"Potem dajem na glasovanje še enkrat obliko resolucije, tako kot je predložena, brez amandmajev."
6,Tu gre za tipični supremat glasovanja.
7,"Če ga zahtevate, lahko glasujemo še enkrat."
8,Kdo je za resolucijo v tej predloženi obliki?
9,"Gospod predsednik, če lahko samo z enim stavkom pojasnim."
21,"Če ne bi bilo tega zapleta na koncu, bi ugotovili, da smo vsi delegati za resolucijo; takšno, kot je bila predložena."
10,"Menim, da bi to imelo svojo težo in svoj pomen."
14,"Zaplet v načinu oblikovanja dveh resolucij je pa nekaj, kar je nastalo mimo tega."
18,"Menim, da je to pomembno, da ugotovimo in da bi omogočili, da do takega dejstva v skupščini pride."
2,Hvala lepa.
13,"Torej, če je potrebno, dajem še enkrat na glasovanje resolucijo v predloženi obliki."
3,Kdo je zanjo?
3,Je kdo proti?
4,Se je kdo vzdržal?
8,"Ugotavljam, da je resolucija v predloženi obliki sprejeta."
11,"Meni se pač zdi nevzdržno, da tako po nepotrebnem izgubljamo čas."
19,"Namreč, že prej, pri vseh teh odmorih, bi se najverjetneje dalo zagotoviti, da bi z delom nadaljevali že takrat."
22,"Predlagal bi, da te glasovalne naprave do naslednje seje skupščine preverijo, če funkcionirajo ali ne, in če funkcionirajo, da jih začnemo uporabljati."
14,"Kajti sedaj smo precej časa izgubili samo zaradi tega, ker smo preštevali dviganje rok."
1,Hvala.
10,Prehajamo na NASLEDNJO TOČKO DNEVNEGA REDA - PREDLOGE IN VPRAŠANJA DELEGATOV.
43,"Skupina delegatov predstavnikov vseh parlamentarnih frakcij, ki je bila imenovana na skupni seji zborov, 16.5.1990, predlaga, da se na skupni seji Skupščine Republike Slovenije sprejme naslednjo IZJAVO SKUPŠČINE REPUBLIKE SLOVENIJE K NASTOPNEMU GOVORU DR. BORISAVA JOVI]A, PREDSEDNIKA PREDSEDSTVA SFRJ, z dne 15.5.190."
4,Torej še enkrat preberem.
7,"Menim, da ste vsi dobili na klop:"
24,"""Novi predsednik Predsedstva SFRJ Borisav Jović je v svojem nastopnem govoru izrekel trditve, ki so povsem nasprotne demokratičnim procesom in težnjam Slovenije k suverenosti."
54,"To se zlasti nanaša na izjavo o primarnosti sprejetja zvezne ustave pred republiškimi in prejšnji ideološki opredelitvi države, vztrajanje na federalni ureditvi, apriorni in nepristojni oceni neustavnosti uvajanja nacionalnih armad in tiskanja lastnega denarja. take izjave, ki so bile očitno namenjene Sloveniji in Hrvaški, omejujejo tudi pravice do samoodločbe drugih jugoslovanskih narodov in narodnosti."
22,"Skupščina Republike Slovenije izraža prepričanje, da bo Predsedstvo SFRJ svojo vlogo v prihodnje uspešno opravljalo samo ob polnem priznavanju suverenosti jugoslovanskih republik."
23,"Samo te smejo in morejo na podlagi pravice do samoodločbe odločati o tem, ali in na kakšen način želijo združeno živeti v Jugoslaviji."
16,Te pravice jim ne sme in ne more nihče odvzeti; niti Predsedstvo SFRJ niti njegov predsednik.
29,"Ob odhodu dr. Janez Drnovška s funkcije predsednika Predsedstva SFRJ, mu Skupščina Republike Slovenije izreka priznanje za opravljeno delo, ki je v zadnjem letu Jugoslavijo približalo Evropi in svetu."""
7,"Torej, dajem predlog te izjave v razpravo."
3,Kdo želi razpravljati?
1,Prosim.
4,Imel bi dva predloga.
19,"Najprej bi prosil gospoda predsednika, da drugič malo bolj gleda, kdo roko dviguje in da ne vodi prehitro sej."
9,Želel sem se oglasiti že pri deklaraciji o Litvi.
29,"Sedaj bi samo na kratko povedal, da menim, da je deklaracija o neodvisnosti Litve, taka kot je bila predložena, dejansko deklaracija o odvisnosti Slovenije, predvsem v njenem drugem odstavku."
6,Dal pa bi še en predlog.
