29,"Naj spomnim, da so okrog leta 1918 morali čez noč zamenjati avstrijske krone za jugoslovanski dinar v razmerju štiri krone za en dinar, kar je bil očiten rop Slovenije."
17,"Ta izkušnja je za nas drago plačana šolnina z Beogradom, ki je Slovenija ne sme ponovno plačati."
2,Hvala lepa.
6,Gospod Jože Smole se je vrnil.
22,"Predsedniku našega zbora dr. Ludviku Toplaku sem te dni poslal pismo, tri pobude in vprašanja, pa bi jih sedaj zelo kratko obrazložil."
8,Nekatere so vezane tudi že na predhodne razprave.
7,Prva se nanaša na devizne prihranke občanov.
19,"Banke odkupujejo devize po tržni borzni vrednosti, konkretno marko 22,00 din, varčevalcem pa za dinarsko protivrednost dajo 13,00 din."
6,To je za mene čista kraja.
6,Stvar je enaka pri drugih devizah.
18,"Včeraj sem prebral v Ljubljanskem dnevniku, da se nekaj dela na spremembi, danes nekaj piše tudi v Delu."
35,"Samo prosim, ne bom bral te moje obrazložitve, da nam še jutri... predstavniki Izvršnega sveta in Banke Slovenije dajo točen odgovor na vprašanje, kaj mislijo narediti, da se preneha s to krajo občanov oziroma varčevalcev."
20,"Ne govorim o širšem problemu o nezakonitosti dejstva, da ljudje, ki so dajali devize v banke, deviz ne morejo dvigniti."
17,"Ampak je kraja, da za dinarsko protivrednost dobijo po uradnem tečaju, devize pa kupujejo po borznem tečaju."
23,"Dokler so banke odkupovale devize po uradnem tečaju, potem je bila še neka logika, da se varčevalcem dinarska protivrednost daje po uradnem tečaju."
23,"Tisti trenutek, ko se je prešlo na tržno, borzno tečajno listo, je pa normalno, da je to treba upoštevati tudi pri dinarski protivrednosti."
10,Druga stvar se nanaša na predvidene ukrepe na monetarnem področju.
12,Tu so tudi že nekateri drugi kolegi postavili v bistvu isto vprašanje.
22,"Vsi vemo, da je Svet guvernerjev Narodne banke sprejel sklep o izključitvi Republike Slovenije iz primarne emisije dinarja in iz deviznega poslovanja."
14,"Posledice tega diskriminacijskega dejanja, ki pomeni ekonomsko finančno vojno proti Sloveniji, bodo zelo težke."
11,"Sprašujem Izvršni svet Skupščine Slovenije, kakšne ukrepe načrtuje na monetarnem področju."
18,In tretja stvar se nanaša na ta stalna potovanja predsednika Izvršnega sveta Republike Slovenije spoštovanega gospoda Lojzeta Peterleta.
20,"Meni, kot članu skupščinske Komisije za mednarodne odnose ni znano, kako je bil načrtovan obisk Peterleta v Združenih ameriških državah."
22,"Naj pri tej točki dodam, da je spoštovani predsednik Izvršnega sveta Lojze Peterle tisti, ki dosledno ignorira skupščinsko Komisijo za mednarodne odnose."
20,"Minister Rupel se je že navadil, da hodi na skupščinsko komisijo in daje poročila in tudi najavlja, kam bo šel."
35,"Moram reči, da se zelo korektno obnaša predsednik Predsedstva Slovenije Milan Kučan, ki je tudi danes na skupščinski komisiji dal detajlno informacijo o konferenci v Haagu, tudi o njegovem obisku in pa Ruplovem na Portugalskem."
15,"Ampak Peterle, ne vem za kaj, dosledno podcenjuje in ignorira skupščinsko Komisijo za mednarodne odnose."
28,"Jaz se tudi čudim mojemu kolegu predsedniku skupščinske komisije, da je glede tega obnašanja Peterleta tako toleranten in da ga ne upa disciplinirati vsaj na nekaj osnovnih točkah."
42,"Poleg tega prosim gospoda Peterleta, čeprav sem prej slišal, da je sedaj odletel v Pariz, da nam točno pove, s katerim članom ameriške vlade se je srečal v Washingtonu ali kje druge, lahko tudi v New Yorku, samo s katerim članom vlade."
10,S katerim res visokim funkcionarjem ameriške administracije se je pogovarjal.
36,"Na kakšnem nivoju se je pogovarjal s predstavniki ameriških bank in ameriškega gospodarstva in prosim precizno informacijo, na kakšnem nivoju se je pogovarjal s predstavniki Svetovne banke za obnovo in razvoj in predstavniki Mednarodnega monetarnega sklada."
37,"Bistvo moje intervencije je, da dokler je skupščina tista, ki vendarle določa smernice Izvršnega sveta, mora tudi predsednik Izvršnega sveta spoštovati kompetentne organe te skupščine in to je konkretno Komisija za mednarodne odnose, kar zadeva mednarodno dejavnost."
23,"Moram reči, da ne razumem obnašanja Peterleta, ker vsak pameten politik bi vedno poročal skupščinski komisiji, tudi zato, da bi si zagotovil podporo."
30,"Njegovo obnašanje pa je za mene popolnoma nerazumno in jaz grem naprej in bom vztrajal, da mora predsednik Izvršnega sveta enkrat spoštovati skupščino in tudi skupščinsko Komisijo za mednarodne odnose."
1,Hvala.
1,Hvala.
3,Gospoda Semoliča ni.
4,S tem so prijave...
5,"Gospod Rejc bo, kaže, odgovoril."
6,Bili sta mu zastavljeni dve vprašanji.
15,"Bom odgovoril poslanki Metki Mencinovi o tem, kaj in kakšni dogovori so bili z generali."
26,"V Ministrstvo za industrijo sodi tudi program t.i. posebne proizvodnje do pred kratkim; jaz ji rečem ""vojna proizvodnja"", ker ji nima smisla dajati drugih vzdevkov."
41,"Ko se je ta stvar zaostrovala pred našo zadnjo vojno, smo seveda imeli razgovore - bila sta tu dva generala, generalmajor in generalpodpolkovnik - in prav tedaj, dva dni prej, ko so bila v Mariboru zaplenjena s strani naše teritorialne obrambe tista vozila."
19,Ta razgovor oziroma ta obisk je bil že prej dogovorjen in sta takrat oba generala prišla v civilni obleki.
30,Na razgovoru so sodelovali tudi predstavniki naše teritorialne obrambe in je bil vedno sodelavec našega ministra pri vseh pogovorih ter ju je spremljal po tovarnah in vsepovsod je bil zraven.
6,To sem jaz tudi generalom povedal.
23,"Bistvo vsega tega je bilo, da smo takrat rekli oziroma oni so intervenirali, da bi vozila vrnili, ker so bila plačana in podobno."
14,"Mi smo rekli, da se bomo pač dogovorili, da nismo gotovi, kako in kaj."
19,"No, in ko se je potem to uredilo, seveda v dogovoru z našim ministrom, se je potem začela vojna."
27,"V vojni smo takoj prepovedali, da ne smejo pošiljati nobene opreme in nobenih proizvodov, ki jih naša vojna industrija dela in so se naši podjetniki tega držali."
13,"No, vojska je seveda reagirala, da so plačali, da vendarle hočejo imeti svoje."
44,"Takrat sem rekel, da mi tega ne bomo delali, da se lahko pogovarjamo samo na poslovnih osnovah, da lahko eventualno sodelujemo, vendar samo na poslovnih osnovah, in da ne bomo delali v tem primeru, če se to orožje ali ta oprema obrne proti nam."
40,"Vi pa sami veste, da je precej take opreme, ki je vrhunska, bodisi za določene merilne naprave ali pa za določene sestavine najbolj znanih tankov T-84 in vseh drugih proizvodov, ki jih armada sprejema in naša številna podjetja tudi delajo."
36,"Naj povem - in dali smo tudi poročilo - da smo imeli v lanskem letu prometa z njimi 2 milijardi 600 in nekaj dinarjev in da je bil ta promet dosedaj, do konca sedmega meseca, 38% lanskega leta."
22,"To se pravi,da je nekaj čez 600 milijonov, od tega pa smo ugotovili, da od faktur ni bilo plačanih 210 milijonov."
27,"In to je bil tudi razlog, da smo šli na pot in so tudi prosili, da gremo dol in smo šli na pot, skupaj s svojim sodelavcem."
48,"Moram povedati, da je glavni problem, da se naša industrija, ki vemo, da poleg drugega, dela tudi za vojsko, da je približno 8.000 zaposlenih, ki se na to vežejo, da so se nekateri že preusmerili v civilno proizvodnjo, nekateri pa se še niso oziroma se še niso mogli."
41,"Vendar si vsi prizadevamo, da jim pomagamo, da se preusmerijo v civilno proizvodnjo, hkrati pa vam tudi povem, da se je tudi naše Ministrstvo za obrambo vključilo v to, da se določene stvari naredijo za potrebe obrambe naše države tudi doma."
52,"V tem času, ko je bila vojna, ko smo prepovedali kakršnokoli pošiljanje in oddajo kakršnegakoli blaga armadi, smo se pogovarjali tudi s Hrvaško in Hrvaška je takrat rekla, da naj vendar to sprostimo in da oni želijo - ker so tudi v verigi z našimi podjetij - da naj vendarle mi to prepoved omilimo."
5,"Mi smo rekli, da ne."
39,"No, in ko je sedaj prišla Hrvaška v vojno stanje, se je njihovo stališče spremenilo, vendar pa moram reči, da oni tudi še prav tako delajo za potrebe - razen v Slavonskem Brodu, kjer sestavljajo določene stvari za ta tank."
10,Na razgovoru v Beogradu smo predvsem obdelovali tudi problem Bregane.
73,"Namreč, predzadnji petek smo bili na obisku v Brežicah - obisk je organiziral predsednik Izvršnega sveta občine Brežice, gospod Ciril Kolešnik - kjer smo skupaj z ministrico za delo obiskali področje te velike tovarne, kjer popravljajo, delajo in kjer je bilo zaposlenih in je zaposlenih (trenutno sedaj nekaj manj) v glavnem 697 delavcev, ki so dobili dekret, nalog, da se ta proizvodnja konča in stroje odpremijo na ustrezne tri naslove - Čačak, Hadži}i in Travnik."
35,"No, mi smo to videli in ko sem bil v Beogradu, sem povedal, da je pač tu problem toliko zaposlenih, strokovnjakov itd. in da je to problem posebne vrste, ker to pade na državni proračun."
20,"Seveda so na to reagirali, ustreznega generala obvestili - to je general Glivi}, ki pokriva to področje glede umika iz Slovenije."
25,"Vendar so te razgovore že prej vodili naši predstavniki teritorialne obrambe oziroma obrambnega ministrstva, tako da so se v okviru tega dogovora tudi naprej vedli."
20,"Dogovarjali smo se predvsem o tem, da vse, kar se bo delalo, se dela na poslovnih interesih, predvsem za izvoz."
37,"In ta dogovor je bil - oni imajo le veliko možnosti za izvoz, hkrati pa so sami povedali na glas (bili so 4 generali - 2 generalpodpolkovnika, 2 generalmajorja), da imajo dekret in nalog, da se mora bistveno zmanjšati."
40,"Skratka, da se zavedajo tega, da se mora armada umakniti s slovenskega prostora; najbrž bo ta umik sledil tudi na Hrvaškem, vendar to ni naša stvar - da pa se morajo gotovo mnoge službe zmanjšati in tudi denarja od nikoder ni."
35,"O prihodnosti je bil govor tako: generali so rekli, ali bodo to države na področju sedanje Jugoslavije ali bo to neka zveza ali bodo posamezne države, ki pač živijo in delajo na področju bivše Jugoslavije."
25,"Jaz sem rekel: mi smo se odločili, naša pot je povsem jasna in kar bo izvoza, bomo delali, kar ne bo, pač ne bomo delali."
39,"Moram povedati, da so tudi precej denarja vložili v določene znanstvene inštitute in smo se seveda tudi pogovarjali, da bi ta sredstva ne terjali nazaj in da bi plačali tisto, kar so nam dolžni, za kar so dali zagotovilo."
34,"Seveda je pa tudi interes naše proizvodnje, določenih delov proizvodnje - to je pa vsaj okrog 25 podjetij v večjem obsegu in do 40 podjetij v manjšem obsegu - se pravi tistih, ki delajo to področje."
41,"Vse to, kar smo delali zadnje čase, je predvsem, da se pomaga naši industriji in v tistem, kar menimo, da je v redu, to se pa dogovarjamo skupaj z Ministrstvom za obrambo in tudi s predsednikom vlade, v dogovoru s podpredsednikom."
18,"Skratka, delamo po tezi, ki v bistvu pomeni reševanje neplačanega dela dolga, ki ga ima armada do nas."
24,"In prihodnost: mi smo jim jasno povedali, da bomo svoja država, eventualno bomo lahko tudi ponujali svoje usluge, seveda, če bo šlo za izvoz."
34,"Hkrati so nam rekli, da je ta problem, ki ga imajo sedaj s Hrvaško, problem, pri katerem za njih nekaj tankov nič ne pomeni, in da naj vendar tudi Hrvaška razume to njihovo situacijo."
48,"Rad bi še to povedal: ko smo se pogovarjali o prihodnosti - jaz sem tudi našim direktorjem povedal oziroma smo jih obvestili, da določene stvari moramo narediti, ker so nekateri artikli plačani, vendar pa, da bomo določene stvari naredili, to velja predvsem za izvoz, samo tedaj, če bodo plačali."
23,"Ta zapisnik še ni prišel iz Beograda, mi pa sproti obveščamo ustrezni generalštab, to pa je predvsem področje, ki se ukvarja z opremo."
42,"To ni tisti, ki se ukvarja z vojno na Hrvaškem in ne tisti, ki se ukvarja z umikanjem vojske JA s področja slovenske države, ampak je to tisti del armade in generalštaba, ki se ukvarja z opremo, s tehnologijo in z izvozom."
22,"In 1.9. je bilo ustanovljeno tudi posebno državno podjetje, ki na poslovnih osnovah deluje za izvoz predvsem v arabske in vzhodne dežele."
5,To bi bilo v kratkem.
43,"Tisto pa, da sem rekel, da je bila to cinična izjava, jaz sem takrat rekel, da smo ob tistem obisku povedali, da mi ne bomo dajali opreme, ki bi pomenila to, da ko gre iz naše tovarne, se ta oprema obrne proti nam."
15,"To zagotovilo so dali, je pa tudi stvar, kaj kdo reče in kaj potem stori."
1,Hvala.
2,Gospod Gajšek.
4,"Spoštovane poslanke, spoštovani poslanci!"
9,"Imam kratko pobudo, vezana pa je na delovno zakonodajo."
29,"Kadar se naša podjetja pojavljajo v tujini z investicijskimi deli, z raznimi uslužnostnimi dejavnostmi, se zelo pogosto srečujejo z zelo restriktivno zakonodajo, ki obvezuje vključevanje v delo domače delavce."
7,"Pri nas ugotavljamo, da to ni tako."
27,"Konkreten primer je del avtoceste, ki se sedaj gradi na Primorskem: Italijani imajo zaposlene svoje delavce ob tem, da bi lahko praktično vsa dela opravljali naši ljudje."
43,"Na tem področju smo ugotovili, da je zakonodaja zelo ohlapna in ker predvidevamo, da bo Slovenija šla v investicijsko gradnjo, kjer bo najemala tuje kredite, bodo ti krediti zelo pogosto lahko obvezovali našo stran, da zaposli pač delavce, ki jih bodo tujci želeli."
27,"Če bomo pravočasno zapisali ustrezno zakonodajo, ki bo to onemogočala, imamo možnosti, da so v teh poslih zaposleni naši delavci, četudi bodo investitorji in organizatorji del tujci."
30,"Zato predlagam, da Sekretariat za delo preveri ta del zakonodaje in ga napiše kar se da restriktivno, da bo možno čim več delavcev na teh gradbiščih zaposliti z naše strani."
26,"Upam, da bo ta zakonodaja prišla na klop poslancev še v mesecu oktobru, ker s tem lahko v tenderski dokumentaciji že obvezujejo tujce pri naslednjih pogodbah."
2,Hvala lepa.
2,Hvala lepa.
2,Gospod Voljč.
4,"Hvala lepa, gospod predsednik."
7,Nisem se imel sploh namena danes oglasiti.
14,K besedi me je spodbudilo poslansko vprašanje gospe Mencinove in odgovor gospoda ministra Rejca.
24,"Enkrat sem že povedal in ponovno ponavljam, pa kadarkoli bo priložnost nanesla, bom zopet povedal, da me je sram, če bomo Slovenci izvažali orožje."
29,"Izvoz orožja je namreč izvoz nasilja, ali prodaja orožja je isto - je prodaja nasilja, je povzročanje brezpravnosti, revščine, lakote, bolezni, invalidnosti v vseh deželah, kjer se to orožje uporablja."
20,"In menim, da ne moremo Slovenci sodelovati v tem, da rojevamo sirote, matere brez otrok, nesrečne družine in tako naprej."
24,"Slovenci v vsej svoji zgodovini nismo nikdar imeli osvajalnih vojn in menim, da tudi ni potrebno, da si svojo sliko mažemo z izvozom orožja."
37,"Mi potrebujemo orožje za svojo obrambo in menim, da smo se tudi v zadnji vojni izkazali izjemno častno, kajti branili smo vsak kvadratni meter svojega teritorija in nismo kazali pohlepa po niti enem kvadratnem metru tujega teritorija."
19,"Predlagam, da je ena stalnica naše politike v bodoče tudi v tem, da Slovenija orožja pač ne bo izvažala."
2,Hvala lepa.
6,Gospod Kolešnik se je še prijavil.
1,Spoštovani!
14,"Z vsem spoštovanjem do kolega gospoda Voljča, ampak tu se postavlja neko drugo vprašanje."
9,"Na eni strani je res to, kar on govori."
31,"Na drugi strani ga pa sprašujem in vse druge in tudi potem postavljam vladi vprašanje, kako bo rešila problem, ki je pri nas točno v našem območju močno živ ta trenutek."
22,"Doli je tehnični remontni zavod, to je velika tovarna, 16 hektarjev površine, 4 hektarje pokrite, 700 delavcev ta trenutek, kapaciteta 3.00 delavcev."
15,"To je tovarna, ki je bila vse do vojne grajena za proizvodnjo oziroma remont orožja."
8,Jutri oziroma danes teh 700 delavcev dobiva knjižice.
8,"Teh 700 delavcev je naučenih, da dela orožje."
12,"Jaz vas pa sprašujem, kako bomo teh 700 delavcev obdržali pri kruhu."
14,Ali so že drugi nadomestni programi ali pa jih bomo imeli na državnem proračunu.
3,To so vprašanja.
29,"Vseh teh problemov se zavedam, samo lahko je tu, pred tem zborom govoriti ""ne bomo proizvajali orožja, ne bomo ga izvažali"", pojdite k tistim ljudem in jim to povejte."
10,"Ti ljudje ne živijo od iluzij, ne živijo od lepega."
13,Ta svet je še vedno solzna dolina in to bo še veliko časa.
13,"Če zmoremo to premagovati hitreje, pomagajte najprej tem ljudem, ki so v Sloveniji."
2,Hvala lepa.
34,"Opozarjam, da je to točka: Vprašanja in pobude v skladu s sklepom, sprejetim na tem zboru in ne v okviru te točke pojasnila posameznih pobud ali vprašanj, za katere se pričakuje odgovor med sejo."
14,"Mislim, da ne bi zdaj načeli dolge razprave o tej, nedvomno zelo pereči temi."
17,"Če mislite, gospod Magajna, da na vsak način morate replicirati, potem vam te pravice ne bom vzel."
1,Spoštovani!
16,"Mene danes moti že drugič, kako smo z neverjetno lahkotnostjo poteptali neka načela zaradi pragmatičnih razlogov."
13,Prva razprava o Samu Pahorju in tudi ta sedanja razprava o vojaški industriji.
22,"Še bolj me to moti, ko pride to iz ust kristjana in moram pač reči, da se s takimi opredelitvami ne strinjam."
25,"Posebno pa me je motilo tisto v izvajanju gospoda Rejca, ko govori ""saj smo dobili zagotovilo, da se to orožje ne bo uporabilo proti Sloveniji""."
4,Tipični slovenski nacionalni egoizem.
40,"V času, ko na Hrvaškem divja vojna, kjer je objektivno možno, da se to orožje uporablja tudi proti Hrvatom, smo krščansko ozki, kar ni prava krščanska pozicija, se zatekamo v ta nacionalni egoizem, skrbi nas samo, kako bo za nas."
29,"Tudi zadnjič, ko smo imeli razpravo o pomoči Hrvaški, smo porabili za to dve uri, da smo potem sprejeli sklep, da bomo Hrvatom nudili vsaj humanitarno pomoč, na žalost."
1,Hvala.
8,"Zdaj smo točko - pobude, vprašanja, to predtočko, končali."
8,Gospod Juri se zdaj še javlja za besedo.
12,"Delno ta pobuda pokriva že pobudo, ki jo je predstavil kolega Battelli."
14,"Gre za postopek za pridobivanje državljanstva Republike Slovenije, kjer se že pojavlja več nejasnosti."
32,"Priložitvi zahtevka, ki ga za pridobitev državljanstva s strani dela prebivalstva ureja republiški zakon o državljanstvu, morajo stranke priložiti celotno dokumentacijo iz matičnih občin, kljub temu da tega zakon ne zahteva izrecno."
32,"Tovrstne neljube formalnosti so še posebej nesmiselne za tiste stranke, ki imajo v naši republiki stalno bivališče in za katere je moč, upoštevajoč njihovo enotno matično številko, avtomatično ugotavljati vse potrebne podatke."
31,"Na to opozarjam, ker pri veliko ljudeh vlada prava zmeda in iz objavljenih pojasnil v medijih ni mogoče sklepati, kdo od tistih, ki so rojeni zunaj Slovenije, je dolžan vložiti prošnjo."
20,"Ob tem gre upoštevati tudi spremenjene okoliščine v nekaterih delih Jugoslavije, ki zaradi vojnih razmer otežuje nekaterim pridobivanje potrebnih papirjev."
28,"Zato predlagam, da Republiški sekretariat za notranje zadeve omogoči olajšanje postopkom, in sicer z obveščanjem vseh prizadetih posameznikov in z upoštevanjem enotne matične številke občanov pri nadaljnjem postopku."
1,Hvala.
7,"Upam, da je zdaj točka res zaključena."
24,"Preden preidemo na 1. točko dnevnega reda, predlagam, da imenujemo še delovno skupino za usklajevanje dnevnega reda, ker zbori niso usklajeni o dnevnem redu."
16,Običajno je to petčlanska komisija iz našega zbora in prosim za predloge za to delovno skupino.
8,"Gospod Tomšič je prvi predlog, Hobič drugi predlog."
2,Gospod podpredsednik!
22,"Jaz bi svetoval in prosil, da se zadolži strokovna služba vseh treh zborov, da poišče določbe poslovnika, ki predvidevajo usklajevanje dnevnih redov."
15,"O tem po nekaj vprašanjih, ki sem jih doslej dal, nikoli nisem dobil natančnega odgovora."
52,"Zdaj je postala praksa na naših zborih, da poskušamo, ne samo vsebinska vprašanja, ampak tudi dnevne rede usklajevati na ta način, da prek, recimo, odločitve dveh zborov, zahtevamo tudi od tretjega zbora, da mora uvrstiti ali nek zakon ali da mora nek zakon obravnavati v isti fazi, kot to obravnava drugi zbor."
22,"Prosim, naj se temu ustrezno, za delo te skupine, pripravijo konkretne strokovne podlage, ki naj jih pripravi strokovna služba skupščine in zborov."
1,Hvala.
45,"Mi delamo to po 105. členu, ker najmanj za en zakon vemo, da je to za predlog zakona o reprezentativnosti sindikatov, da so različni postopki predvideni oziroma ni soglasja o postopkih iz prvega odstavka tega člena in da bo najmanj za ta primer potrebno usklajevanje."
19,"Vemo pa, da nismo usklajeni tudi glede tega, v kateri fazi obravnavajo zbori zakon pod 1. točko dnevnega reda."
14,"Bili so predlogi do zdaj Tomšič, Hobič, Šetinc, Tomažič, samo ga ni tu, Kolešnik."
29,"Eno od demokratičnih pravil je, da mora biti tisti, ki je za kaj predlagan prisoten, da lahko pove, ali se s tem strinja ali ne in Tomažiča ni tu."
2,Ivan Pučnik.
4,Potočnik se ne strinja.
13,"Kandidati so: France Tomšič, Jože Hobič, Mile Šetinc, Ivan Pučnik in Ciril Kolešnik."
6,Kdo se s tem predlogom strinja?
3,Najprej preverimo navzočnost.
9,"Vse navzoče delegate prosim, da pritisnete na sivo tipko."
9,"Ponovno prosim, da pritisnete vsak na svojo glasovalno tipko."
13,"Kdo je za, da je teh pet imenovanih gospodov v tej delovni skupini?"
3,Je kdo proti?
4,Se je kdo vzdržal?
26,"Ugotavljam, da je za naš zbor imenovana delovna skupina za usklajevanje zapisnika, v sestavi: gospod France Tomšič, Jože Hobič, Mile Šetinc, Ivan Pučnik in Ciril Kolešnik."
9,"Kdaj bo skupina delala, bomo uskladiti z drugima zboroma."
6,Prehajamo na 1. točko dnevnega reda.
1,Prosim.
16,"Včeraj smo sejo Družbenopolitičnega zbora končali pred peto uro, ker je gospod Zagožen sklical Klub Demosa."
4,Izgubili smo dve uri.
15,"Zdaj pa predlagam, da končamo danes sejo, ker imamo pravico, ker smo že vsi utrujeni."
27,"Če je lahko včeraj imel Zagožen to pravico, da je prekinil sejo Družbenopolitičnega zbora, potem imam jaz tudi pravico, ker imamo ob 18. uri sklican privatni sestanek."
12,"Jaz pa predlagam nasprotno, da nadaljujemo delo še eno uro, do sedmih."
27,"So tudi konkretni razlogi predstavniki Gospodarske zbornice so posebej zaprosili danes za besedo, ker je predsednik Gospodarske zbornice Slovenije danes navzoč, jutri pa je na službeni poti."
12,"Predlagam, da nadaljujemo delo, predlog gospoda Smoleta bi upoštevali, damo na glasovanje."
2,Nadaljujemo delo.
13,"Sklepčni smo, razumemo pa odsotnost, zadržanost gospoda Smoleta, da se z razumevanjem sprejme."
12,Prehajamo na 1. TOČKO DNEVNEGA REDA - PREDLOG ZAKONA O LASTNINSKEM PREOBLIKOVANJU PODJETIJ.
15,Predlog zakona o lastninskem preoblikovanju podjetij je predložil v obravnavo Izvršni svet Skupščine Republike Slovenije.
57,"Obravnavali so ga Komisija za preobrazbo družbene in zadružne lastnine kot matično delovno telo, Komisija za strategijo nacionalnega in regionalnega razvoja, Komisija za denacionalizacijo, Komisija za celovito proučitev okoliščin, posledic in pojavov oškodovanja družbenega premoženja, Zakonodajno-pravna komisija, Odbor za splošno gospodarske zadeve na ravni Skupščine Republike Slovenije in Odbor za varstvo potrošnikov na ravni Skupščine Republike Slovenije."
26,"K temu zakonu smo prejeli s pošiljko, dne 27.8.1991 mnenje in amandmaje Gospodarske zbornice Slovenije, in sicer: amandmaje k 13., 12., 11., 18., 23., 26. členu."
39,"Stališče in amandmaje Neodvisnosti - konfederacije novih sindikatov Slovenije, in sicer: amandmaji k 11. členu, za nov 11.a in c) člen ter amandma k 12., 13., 21., 37., 41. členu in amandma za nov 41.a in b) člen."
43,"Že na prejšnji seji smo na klop, to je dne 28.8.1991 prejeli delegati, ki niso bili na tej seji prisotni, prejeli na dom s pošiljko 27.8.1991 stališče in zahteve Zveze svobodnih sindikatov Slovenije in amandma k 13. členu Sindikata delavcev poslovnih bank Slovenije."
62,"S pošiljko 6.9.1991 pa smo prejeli: amandma Kluba delegatov Stranke demokratične prenove, ki ga je vložil Miran Potrč k 2., 7., 10., 11. členu in amandma za novo poglavje amandmaje za nov 11.a, b), c) in d) člen; amandma za nov naslov poglavja k 12. členu in amandma k 37. členu ter k V. poglavju amandma in amandma k 42. členu."
34,"Dalje, amandmaje Andreja Magajne k 8. in 10. členu, amandmaje k 11. do 42. člena ter amandma k 43. členu; dalje k 44. do 46. členu, 48., 50. ter k 49. in 51. členu."
9,"Amandmaje Marjana Podobnika k 3., 20. in 42. členu."
58,"Na klop ste prejeli amandmaje Janeza Kopača k 2., 10., 12., 13., 14., 15., 16., 17., 18., 19., 20., 21., 22., 23., 24., 25., 26., 27., 28., 31., 32., 33., 36., 37., 38., 39. členu za nov 42.a člen, k 42., 44., 45., 46., 51., 52. in 55. členu, popravek Janeza Kopača k 23. in 37. členu."
6,Amandma Žarka Preglja k 36. členu.
35,"Sindikata delavcev poslovnih bank k 2., 3. in 11. členu ter amandmaje, ki so jih vložili poslanci, amandmaje Izvršnega sveta, ki so zajeti v poročilih ter amandmaje, ki so zajeti v poročilih delovnih teles skupščine."
18,"Odbor za splošno gospodarske zadeve na ravni Skupščine Republike Slovenije predlaga amandma k 20., 37. in 45. členu."
21,"Predstavnik Izvršnega sveta na tej seji tukaj, sedel je ves čas dr. Pleskovič, minister Rejc je bil tukaj pa še kdo."
5,Želijo besedo predstavniki Izvršnega sveta?
6,Poročilo gospoda Peterleta smo poslušali danes.
5,Želijo besedo poročevalci delovnih teles?
4,"Prosim, Emil Milan Pintar."
5,Spoštovane kolegice in kolegi poslanci!
8,Najprej bi rad malo korigiral napoved našega predsednika.
28,"Naša Komisija za strategijo nacionalnega in regionalnega razvoja ni obravnavala samo predloga zakona, ki nam ga je predložil Izvršni svet, ampak je obravnavala tudi predloge drugih dveh zakonov."
