1,Vzdržani?
19,"Ugotavljam, da smo tudi ta sklep z večino glasov sprejeli in s tem smo zaključili to točko dnevnega reda."
13,"Po treh urah vas moram kot dober učitelj pohvaliti, imate do 15.30 prosto."
5,Lahko začnemo z malo zakasnitvijo.
39,"Ta zakasnitev je bila skoraj načrtovana zaradi tega, ker smo želeli, da imate pisno gradivo, in sicer zbrane amandmaje in amandmaje k predlogu zakona o proračunu R Slovenije, ki jih je pripravil IS, tako da imate zdaj pisni komplet."
10,"Preden bi pričeli z obravnavo amandmajev, bi predlagal še naslednje."
38,"Ker smo pri zakonu o obrambi in zaščiti neusklajeni, ni pa seveda tako velike neusklajenosti med vsemi tremi zbori, bi predlagal usklajevalno komisijo našega zbora, in sicer: Kočevar Božo, Murko Dejan, Sagadin Vlasta, Berlec Jože in Daneu Ivo."
3,Ste za to?
3,Kakšen dodatni predlog?
9,Namesto Murko Dejana je predlog za gospoda Primoža Rode.
2,Ugotovimo prisotnost!
7,Koliko vas je za to našo komisijo?
3,Kdo je za?
4,Koliko vas je proti?
2,Pa vzdržani?
4,"Ugotavljam, da imamo komisijo."
5,Zdaj pa K NAŠEMU PRORAČUNU.
20,"Kot je pri nas običaj in glede na to, da so pisna stališča zdaj tu jasna, lahko pričnemo z delom."
10,Besedo ima gospod Grašič v imenu delovne skupine za proračun.
5,"Spoštovani predsednik, poslanci in poslanke!"
38,"Z ozirom na to, da smo bili imenovani v delovno skupino, da bi pregledali in poskušali s pregledom nekaj pripomoči, da bi bili hitrejši pri odločanju posameznih amandmajev, bi želel nekaj naših ugotovitev te delovne skupine vam posredovati."
37,"Pregledali smo vse amandmaje, kar nam jih je bilo dostavljenih, skupaj 97, od teh je bilo 71 tistih, o katerih moramo v tem zboru odločati, od tega 7 na sam zakon in 64 na poseben del proračuna."
6,"Z oziroma na pregled, ugotavljamo naslednje."
41,"Najprej, da pri amandmanih, ki imajo v materialu, ki smo ga dobili, naslednje tekoče številke: 16, 42, 46, 56 in 83 niso navedeni viri, ampak samo z amandmajem se predlaga povečanje odhodkov, to ugotovitev tukaj posredujemo in menimo, da niso popolni."
31,"Amandmaji pod zaporedno številko 22 do 26 se nanašajo na isto postavko, vendar so zneskovno različno intenzivni, kot stopnjujejo se s svojimi predlogi po vrstnem redu 23, 22, 24, 25, 26."
18,"Podobno velja tudi za amandmaje 66, 68 in 69, mislim na zaporedne številke, ki jih imate v materialu."
26,"Predlagatelju amandmaja pod tekočo številko 63, gospodu Arzenšku, dajemo sugestijo, da bi od amandmaja odstopil, ker je vsebina tega amandmaja zajeta tudi v amandmaju št. 60."
15,"Ugotavljamo tudi, da v amandmajih št. 64, 65, 66 niso predloženi viri v amandmajski obliki."
38,"Ker je bil v naši skupini tudi gospod Rudi Moge, bo verjetno to še sam potrdil, predlaga odstop od amandmajev št. 1, 2 in 32 z ozirom na to, da je ista materija zajeta v amandmajih Liberalno-demokratske stranke."
22,"In še k amandmajem k predlogu zakona, vsebini amandmajev št. 2 in 3 sta si podobni, vendar je amandma št 3 ostrejši."
49,"Predlagamo pa klubu Neodvisnih, da od amandmaja pod tekočo številko 7 odstopijo, ker je vsebina njegovega amandmaja zajeta tudi v št. 8. Z ozirom na to, da o amandmajih, ki se nanašajo na poseben del proračuna, najprej o teh odločamo, in potem o amandmajih o predlogu zakona o proračunu."
28,"Namreč, postavke v tem posebnem delu so oz. postavke v predlogu zakona so posledično vezane na to, kako se bomo odločali o amandmajih v samem posebnem delu proračuna."
18,"To je tudi naš predlog, da bi najprej o posebnem delu, kasneje pa o amandmajih na sam zakon."
1,Hvala.
3,Slišali ste predlog.
2,Kaj menite?
20,Po tem predlogu bi začeli na strani 3 k posebnemu delu proračuna in bi se potem vrnili k prvemu delu.
3,Lahko začnemo tako?
5,Gre seveda za vsebinski premik.
14,"Na strani 9, prihodki občinam, 30 % davka na dobiček naj se poveča za 280."
6,Predlagatelj Rudi Moge umika ta amandma.
23,"Potem je naprej na 9 strani 2/1, postavka 710, davek na dobiček se zmanjša za milijon 400 din, predlagatelj Rudi Moge, tudi umika."
6,Gospod Moge je umaknil tudi to.
16,"Roman Jakič, je 3. amandma na strani 9, tabela 2.1. prihodki, se črta postavka 710 itn."
2,Kaj menite?
3,"Liberalno-demokratska stranka, vztrajate?"
4,To se pravi umikate?
3,Umikate tudi to.
30,"Potem smo pri Petru Starcu in sicer, postavka zadolževanje pod točko 9, ki označuje vrsto prihodkov, se zniža za znesek, tako da se predvidi višina, ki pa je točno opredeljena."
2,Kaj menite?
12,"Še vedno smo na strani 3 predloga, amandmaji k posebnemu delu proračuna."
6,IS seveda ne sprejme tega amandmaja.
7,"Če ni razprave, bomo glasovali o tem."
46,"Peter Starc piše pri obrazložitvi to: ""S takšnim zmanjševanjem prihodkov iz dohodnine samo delno sledimo upoštevanju številčnih zahtev po večjem obsegu oprostitev pri odmeri dohodnine, kar bi omogočalo večjo možnost za nova vlaganja, novo tehnologijo in s tem večjo možnost za razvoj in odpiranje delovnih mest."""
2,Ugotovimo prisotnost.
17,"Kdo je za amandma Petra Starca v zvezi s to postavko pod točko 9., da se zniža?"
3,Kdo je proti?
1,Vzdržani?
6,"Ugotavljam, da ta amandma ni sprejet."
49,"Smo na 4. strani, in sicer 5. amandma, predlagatelj Peter Starc, 2 1, to so prihodki, v bilanci prihodkov proračuna v skupini 72 konto 720 pod točko, ki označuje vrsto prihodkov, se zniža prihodek od dohodnine za 500.000 din, tako da se predvidi v višini, tako kot je označeno."
7,Želi v zvezi s tem kdo razpravljati?
6,Kdo je za amandma Petra Starca?
4,Koliko vas je proti?
1,Vzdržani?
5,"Ugotavljam, da amandma ni sprejet."
39,"Naslednji amandma, predlagatelj Peter Starc pod točko 1, ki označuje namen odhodka za delo državnih organov, se zniža odhodek za 500.000 din, tako da se predvidi v višini 3.590.589 din in ne v višini 4. milijarde in tako naprej."
8,Izvršni svet seveda tudi tega amandmaja ne sprejme.
3,Želi kdo razpravljati?
5,Kdo je za ta amandma?
3,Kdo je proti?
1,Vzdržani?
8,"Ugotavljam, da tudi ta amandma ni bil sprejet."
10,"7. amandma, predlagatelj Peter Starc, na strani 10, 2.2 odhodki."
24,"Pri postavki 6 - Zvezne obveznosti prenešene na Republiko Slovenijo, se zniža odhodek za 1.500.000 din, tkao da se planira v višini zopet označene številke."
7,Želi v zvezi s tem kdo razpravljati?
7,Kdo je za predlagani amandma Petra Starca?
3,Kdo je proti?
1,Vzdržani?
5,"Ugotavljam, da amandma ni sprejet."
29,"9. amandma Petra Starca; gre tudi za postavko 2.2 - Odhodki pri postavki 7 - financiranje minimalnih funkcij federacije, se zniža odhodek za 1. milijardo, tako da se predvidi v višini."
14,Izvršni svet delno sprejema amandma in predlaga svoj amandma k 1. odstavku 2. člena.
14,"Zdaj ne odločamo o amandmaju Izvršnega sveta, ampak samo v vednost in v dopolnitev."
13,"Če ni razprave, kdo je za amandma, ki ga je predlagal Peter Starc?"
1,Proti?
1,Vzdržani?
4,Tudi to ni sprejeto.
35,"Smo pri 9, tudi postavka stran 10, 2.2 - Odhodki, amandmaja Petra Starca, in sicer pri postavki 2 - Transferji, dotacije, subvencije se povečajo skupna sredstva za 600.000 din, tako da znašajo 32. milijard in tako naprej."
11,Izvršni svet tudi tu delno sprejema amandma in predlaga svoj amandma.
7,Želi v zvezi s tem kdo razpravljati?
6,Kdo je za amandma Petra Starca?
3,Kdo je proti?
1,Vzdržani?
5,"Ugotavljam, da amandma ni sprejet."
27,"Smo pri 10. amandmaju, postavka 2 - Transferji, dotacije, subvencije pod točko 3., Socialni transferji se poveča znesek odhodka za 150.000 din, tako da znaša devet milijonov itd."
8,Ali želi kdo v zvezi s tem razpravljati?
5,Tega amandmaja IS ne podpira.
7,Kdo je za ta amandma Petra Starca?
1,Proti?
1,Vzdržani?
6,"Ugotavljam, da tudi to ni sprejeto."
25,"Naslednji amandma Petra Starca, pri postavki 2, Tranferji, dotacije, subvencije pod točko 5, plačilo storitev na področju družbenih dejavnosti se poveča znesek za 450.000 din."
12,Izvršni svet delno sprejema amandma in ima svoj amandma pod številko 22.
7,Poglejte predlog Izvršnega sveta pod številko 22!
4,Ali želi kdo razpravljati?
7,Kdo je za ta amandma Petra Starca?
1,Proti?
1,Vzdržani?
18,"Smo pri 12 amadnamju Petra Starca, pri postavki 4 - Investicijski odhodki se povečajo skupna sredstva za 400.000 din."
6,Izvršni svet ne sprejema tega amandmaja.
2,Ni razprave?
7,Kdo je za ta amandma Petra Starca?
1,Proti?
1,Vzdržani?
2,Ni sprejet.
4,13 amandma Petra Starca.
18,Pri postavki 4. Investicijski odhodki pod točko 1. Investicije v gospodarski infrastrukturi se poveča znesek za 400.000 din.
5,Izvršni svet tega ne sprejema.
4,Ali želi kdo razpravljati?
6,Kdo je za amandma Petra Starca?
1,Proti?
1,Vzdržani?
5,"Ugotavljam, da amandma ni sprejet."
2,14. amandma.
12,"Odhodki, kjer gre za amandma Romana Jakiča in je precej bolj obsežen."
14,"Gre za spremembe pri delu državnih organov, se zniža in postavka skupaj odhodki itd."
13,"Znotraj postavke Delo državnih organov pa se izvršijo naslednje razporeditve, ki so zapisane."
14,"Izvršni svet delno sprejema amandma s svojim amandmajem, s katerim povečuje sredstva za izobraževanje."
5,Želi kdo o tem razpravljati?
9,Sam sem zaradi tega amandmaja umanil del svojih amandmajev.
3,Gre za to.
20,"Proračun se s tem zniža za tistih 69 milijard navzdol, ker je neprimerno več minusov kot plusov v tem predlogu."
26,"Nameni se pa del denarja, kar so skoraj vsi podprli, za vzgojo in izobraževanje in za to, kar v Sloveniji potrebujemo, to je za cestno infrastrukturo."
32,"Vsaj tri muhe so ubite na en mah: proračun se zniža, nameni se za šolstvo, nameni se za cestno infrastrukturo in delovnim organizacijam tudi nekako pomaga ali pomeni, če se proračun zniža."
8,"To je edini tak predlog, ki znižuje proračun."
4,In kaj potem predlagaš?
8,"Da ga sprejmemo, tako kot je tule predlagan?"
1,Dobro.
9,Še kdo želi razpravljati v zvezi s tem amandmajem?
2,Gospod Muren.
14,V tem amandmaju vidim zmanjšanje sredstev za našo teritorialno obrmabo za dva milijona din.
6,Praktično se ta teritorialna obramba anulira.
22,"Če je kdo tako zelo mirovniško razpoložen, potem naj bi bil vsaj dosleden in naj bi predlagal še zmanjšanje JLA na nulo."
3,Tu ne moremo.
8,"To je tak amandma, kakor je pač predlagan."
10,Se še kdo želi izreči v zvezi s tem amandmajem?
18,"Zgleda, da bom morala še enkrat obrazložiti to, kar sem že včeraj in sem že prej večkrat povedala."
31,"Predvsem pri tem rednem usposabljanju vojakov gre za to, da začetek financiranja tega usposabljanja pomeni prejudic ustavne odločitve o tem, če bo Slovenija postala država z vojsko ali država brez vojske."
73,"Kot sem že včeraj povedala, gre za to, da vkolikor se bomo v ustavi odločili, da postane država z vojsko, potem jo lahko začnemo financirati iz proračuna iz leta 1992, ne pa z letošnjim proračunom, pri katerem - vsaj kar se tule tiče - za vzgojo in izobraževanje, promet in zveze itd. so bistvenobolj pomembne postavke kot pa je sedajle izgradnja neke slovenske vojske, pa naj bo teritorialna obramba ali kakorkoli v zvezi s tem."
1,Hvala.
4,Slišali ste različna mnenja.
4,Ali lahko zaključim razpravo?
31,"Sprašujem vas, kdo je za amandma Romana Jakiča glede 14. točke, kjer gre na eni strani za delo državnih organov, da se zniža in da se tudi znotraj tega izvrši prerazporeditev."
5,Kdo je za ta amandma?
1,Proti?
1,Vzdržani?
3,Amandma je sprejet.
1,15.
4,"Na strani 10, odhodki."
9,"Tu je zopet kar precej delegatov, Roman Jakič tudi."
11,Vse proračunske postavke na odhodkovni strani se linearno zmanjšajo za 4 %.
9,Izvršni svet se seveda s takšno linearnostjo ne strinja.
8,Ali želi kdo v zvezi s tem razpravljati?
4,Kdo je za amandma?
1,Proti?
1,Vzdržani?
5,"Ugotavljam, da amandma ni sprejet."
1,16.
1,Odhodki.
24,"Tu je predlagatelj Vlasta Sagadin, postavka 11.3, Socialni transferji se morejo povečati za toliko, da bodo sredstva za štipendije znašala eno milijardo dvesto itd."
11,Takšno višino sredstev za štipendije predvideva osnutek proračuna za leto 1991.
11,"Postavka 1.3 se mora tako povečati za približno 83,6 milijona din."
4,Želi tu kdo razpravljati?
5,Kdo je za predlagani amandma?
1,Proti?
1,Vzdržani?
5,"Ugotavljam, da amandma ni sprejet."
2,17. amandma.
15,"Sekretariat Izvršnega sveta Skupščine Republike Slovenije, Ivo Daneu, Rudi Moge: črta se postavka Pluralizacija medijev."
6,Izvršni svet se seveda ne opredeljuje.
38,"Meni je posebno zanimivo, zakaj se Izvršni svet ne opredeljuje, ker se verjetno tudi nima zakaj opredeljevati, glede na to, da smo že včeraj opozorili, da je ta postavka morda najbolj nejasna od vseh postavk v tem proračunu."
13,"Niti včeraj niti danes nismo dobili natančnejše obrazložitve, kaj naj bi to pomenilo."
62,"Odkrili smo le, da gre za impulz, ki naj bi bil namenjen v tem trenutku temu, da bi se pač doseglo nekako ravnotežje, kako v medijih, kako in na kak način tega pa nismo spoznavali in zato smo tudi včeraj v razpravi poudarili, da bi seveda potrebovali natančnejše navodilo, zakaj in čemu ta postavka v višini 27 milijonov din, ki ni majhna."
18,"Menim, da pač denarja kar tako zapravljati ne gre, če za to niso seveda jasne obrazložitve oziroma argumenti."
1,Hvala.
4,Še kdo želi razpravljati?
1,Hvala.
5,Stališče Zelenih je nekoliko drugačno.
35,"Smo za to, da se ta postavka 27 milijionov pluralizacije meditev prenese na postavko 326 pri Republiškem sekretariatu za informiranje, tiskovni agenciji in promociji, ki bo namenjen seveda ustanavljanju lastne tiskovne agencije za republiko Slovenijo."
1,Hvala.
11,"Tu sta pa seveda različna amandmaja, zato moramo glasovati o obeh."
20,"Pri prvem gre seveda za to, da se pač črta postavka, medtem ko pri drugem pa za delite te postavke."
11,"Smo pri prvem tem amandmaju 17. po vrsti, in vas sprašujem:"
11,"Kdo je za amandma, da se črta ta postavka - Pluralizacija medijev?"
1,Proti?
1,Vzdržani?
5,"Ugotavljam, da je amandma sprejet."
5,Moramo glasovati o drugem amandmaju.
8,"Lahko ga seveda umaknete, ampak verjetno ne umikate."
1,Dobro.
16,"To je račun na uskaljevanje, kar je seveda čisto objektivno, in sicer smo pri 18. amandmaju."
6,Saj to je pa sedaj zanimivo.
10,"Zdaj če tudi on ostane, potem moramo vsaj deliti sredstva."
6,Kdo je za sprejem amandmaja 18?
1,Proti?
1,Vzdržani?
6,"Ugotavljam, da ta amandma ni sprejet."
21,"19. amandma - Peter Starc, tudi Izvršnu svet delno povzema v svojem amandmaju, ko znižuje sredstva za JLA za 200 milijonov din."
19,"Pri postavki 7 - Financiranje minimalnih funkcij federacije pod točko 7.2 - Financiranje JLA, se zmanjšajo sredstva za 1 milijardo din."
7,Želi kdo v zvezi s tem razpravljati?
11,"Kdo je za 19. amanmda, ki ga je predlagal Peter Starc?"
3,Kdo je proti?
1,Vzdržani?
8,Tudi ta amandma smo v našem zboru sprejeli.
31,"20. amandma - Financiranje JLA, predlagateljica je Vlasta Sagadin, Izvršni svet delno povzema amandma, da se naj pri točki 7/2 zmanjšajo sredstva za nadaljnjih 420 milijonov dinarjev, tako da znašajo 2 milijardi."
9,Želi v zvezi s tem kdo povedati svoje mnenje?
5,Kdo je za predlagani amandma?
3,Kdo je proti?
1,Vzdržani?
5,Torej ta amandma ni sprejet.
16,"21. amandma - Republiški sekretariat za ljudsko obrambo, postavka 4,5,23 se spremeni, tako da se glasi: 4,5,23 .."
9,"Ivo Daneu, predlagatelj Izvršni svet seveda tega ne sprejme."
39,"Načelno smo morali predlagati, ker smo rekli, da bomo za vzgojo in izobraževanje dajali več in za zdravstvo, nekje pa znižali in zaradi tega je ta predlog, da se povsod pač malo zniža pri vojski in pri državni upravi."
10,"Mislim, da ga bomo sprejeli, tako tko smo prejšnje sprejeli."
1,Hvala.
1,Glasujmo!
10,"Kdo je za amandma, ki ga je predlagal Ivo Daneu?"
1,Proti?
1,Vzdržani?
6,"Ugotavljam, da je ta amandma sprejet."
7,22. amandma - Republiški sekretariat za ljudsko obrambo.
17,"Postavka 6.5 se spremeni tako, da se glasi: Redno usposabljanje vojakov, milijarda 319.000, Ivo Daneu ponovno popravlja."
8,"To velja, še toliko bolj, kot za prejšnjega."
6,"Mislim, da tu ni kaj diskutirati."
4,"Predlagam, da se sprejme."
42,"Nočem vas podcenjevati, ampak tu vidim kolege s Sekretariata za finance, ki komaj sledijo po tem predlogu, kje je kaj in kaj se dogaja in jaz bi vas prosil, da vedno preberete stališče Izvršnega sveta in če je odklonilno, da poveste zakaj."
8,"Gospod Kacin, v večini primerov sem to opravil."
11,"Jaz mislim, da to ni dobra intervencija, kar ste sedaj storili."
1,Hvala.
5,Samo to bi rad povedal.
11,"Tažave imamo, ko sledimo, kateri amandma je, mogoče imamo drugo gradivo."
8,"Oprostite, kaj pa vi mislite, da smo mi?"
4,Ni bilo nič zlonamerno.
19,"Ja seveda, če mi lepo po vrsti gremo in glasujemo, vi v bistvu govorite o legitimnosti našega odločanja tu."
7,"Jaz se opravičujem, ni bilo tako zlonamerno."
1,Hvala.
2,Sprejmem opravičilo.
10,"Mislim gre za to, pod točko 6.5 - Redno usposabljanje vojakov."
19,"Že kolega Dejan je govoril o tem, ker še nimamo letos usposabljanja, da to vmestno, da se tukaj znižuje."
24,"Na strani 16 pod točko 10 - Republiški sekretariat za ljudsko obrambo, postavka 6,5 se spremeni tako, da se glasi: 6/5 redno usposabljanje vojakov 1.319.194,6."
1,Hvala.
1,Hvala.
4,Še želi kdo razpravljati?
6,Zaključujem razpravo in prehajamo na glasovanje.
4,Kdo je za amandma?
1,Proti?
1,Vzdržanih?
8,"Ugotavljam, da smo amandma k točki 22. sprejeli."
25,"23. amandma - Republiški sekretariat za ljudsko obrambo, sredstva za redno usposabljanje vojakov, točka 6., se zmanjšajo za 500 milijonov din in tako znašajo milijardo 900."
6,To je predlog gospe Vlaste Sagadin.
6,Izvršni svet ne sprejema tega amandmaja.
12,Mi smo ga že sprejeli in prav tako amandma pod številko 22.
4,Kaj menite gospa Sagadin?
3,Ali umikate amandma?
49,"24. amandma - Tudi Republiški sekretariat za ljudsko obrambo pri postavki 6, zvezne obveznosti prenešene na republiko, pod točko 6.5 redno usposabljanje vojakov, se zmanjšajo sredstva za eno milijardo in pol, tako da znašajo 937 milijonov in ne dve milijardi štiristo sedemintrideset milijonov, predlagatelj Peter Starc, delegat Zbora zdurženega dela."
6,Želi kdo v zvezi s tem?
6,Ti amandmaji si seveda sedaj sledijo.
14,"In če smo že prvega sprejeli, potem se vsi ostali nanašajo na večje zmanjševanje."
21,"Moramo pa glasovati, zato ker so različni, razen, če bi predlagatelj po vrsti vse umikal, kar bi bilo seveda tudi možno."
7,"Sprašujem Petra Starca, če bi umaknil amandma."
3,Žal ga ni.
6,Kdo je za amandma Petra Starca?
1,Proti?
1,Vzdržani?
8,"Ta amandma, 24. po vrsti, ni bil sprejet."
10,"Sedaj imamo 25. amandma, ki ga ni v našem zboru."
11,"26. amandma - predlagatelj Barbara Zupanc, kjer gre tudi za to postavko."
5,Izvršni svet ga ne podpira.
4,Ali ga lahko umaknemo?
10,"Kdo je za amandma, ki ga je predlagala Barbara Zupanc?"
1,Proti?
1,Vzdržani?
5,Tudi ta amandma ni sprejet.
21,"27. amandma, predlagatelj Rudi Može, postavke 6,5 in 4,5 in 2,5 se zmanjšajo za dve milijardi dva milijona in tako naprej."
4,Gospod Moge umika amandma.
5,"28. amandma, predlagatelj Ivo Daneu."
8,Zopet gre za Republiški sekretariat za notranje zadeve.
3,Prosim gospod Daneu.
28,"Sicer gre za isto zadevo kot smo jo predlagali in sicer za zvišanje sredstev za vzgojo in izobraževanje in zdravstvo, moram pa vseeno predlagati, da se ga sprejme."
15,"Analogno temu, kot smo prej predlagali za usposabljanje tukaj, je pač sekretariat za notranje zadeve."
7,"Predlagam, da tega in tudi naslednjega sprejmemo."
6,"Gospod predsednik, spoštovane poslanke in poslanci!"
27,"Glede na to, da gre tu po našem mnenju za strateška odločanja, bi vas seznanil samo z nekaterimi zadevami oziroma kaj bi se zgodilo v takem primeru."
5,Govorim kot poznavalec te stroke.
34,"Organi za notranje zadeve smo načrtovali proračunska sredstva, verjemite, bom mogoče v šali rekel, v pričakovanju oziroma že z novim ministrom, glede na to, da je novi minister uradno resno zahteval temeljito analizo proračuna."
39,"Glede na situacijo, kakršna je, smo po potrebi realno načrtovali 568 milijonov din in smo jih dobili po drugem krčenju 301 milijon din, kar pomeni 53 je indeks oziroma po realnih cenah je to 40, če vzamemo materialna sredstva."
22,"Mi smo po drugem krčenju, ko je bil osnutek in do sedaj, bom prebral nekatere zadeve, kaj smo organi za notranje sprejeli."
25,"Praktično smo ukinili povsod tam, kjer niso nastale kakršnekoli razmere ponoči itd., delo preko delovnega časa, ukinili smo praktično plačevanje vseh izrednih akcij in zavarovanj."
9,"Dalje, redno delo in pripravljenost smo zmanjšali na minimum."
12,"Več se po strokovni oceni, nisem noben politik, ne da več zmanjšati."
17,"Dalje, to znese skupaj 79.800.000 din, to je iz sredstev za bruto osebne dohodke in prispevke delodajalca."
37,"In naprej, ukinili smo vse dnevnice v določenem času, omejili obseg dela po pogodbah, praktično smo odpustili vse pogodbene delavce, tudi tiste, ki s svojim znanjem izredno veliko prispevajo k profesionalizaciji organov za notranje zadeve slovenske policije."
24,"Sredstva za izgradnjo smo znižali popolnoma, tako da smo obdržali samo tisto, kar je treba plačevati, anuitete in pa samske sobe policistov v občini."
12,Znižali smo postavko iz prenos sredstev iz zvezne pristojnosti za 36.000.000 din.
5,To skupaj znese 70.400.000 din.
6,"Tako smo prišli do znižanja 5,79 %."
23,"Glede na to, da je nam predlagano oziroma da je rečeno 100.000.000 din za opremo, bi vas rad seznanil s kratko notranjo strukturo."
14,Šentilj moramo v tem letu opremiti z vso ustrezno infrastrukturo in stane 14.000.000 din.
7,"To niso cene, ki jih postavlja policija."
20,"Naše uniforme, brez tega, da nabavljamo nove uniforme, ampak izključno vzdrževanje uniform, take kot so, 100.000.000 din 90,5 oziroma 90."
28,"Zveze, ki jih uporabljajo organi zanotranje zadeve, 66.000.000 din, obstoječa kriminalistična tehnika, za katero trdim, da je ena najslabših v zahodni Evropi, če govorim o Evropi, 13.000.000 din."
7,Sredstva za nadzor nad prometom 11.000.000 din.
24,"Informacijska oprema 85.000.000 din, s tem, da smo mi morali posodobiti računalniški sistem, ki nam je ob nastajanju evidence državljanstva se praktično popolnoma sesul."
50,"Rad bi opozoril na to, da imamo v organih za notranje zadeve povezane vse občinske upravne organe za notranje zadeve in nanje povezane tudi vse tehnične preglede, da smo mi lani samo, ne bom govoril o številkah, vendar nekaj deset tisoč delovnih ur prihranili z modernizacijo sistema registracije motornih vozil."
55,"Če to skupaj seštejete, potem to znese približno 300 milijonov din, s tem, da nimamo denarja za eno vozilo, da bi vsak pameten gospodar vsaj 200 vozil v organih za notranje zadeve letno zamenjal, ker sicer pomeni, da bomo imeli drugo leto na tem področju, bom s tujko povedal ""kreš"" ali pa čez dve leti."
26,"Se pravi, to bi bilo za 300 milijonov din, vendar v okviru teh sredstev bi po nekih temeljitih gospodarskih ukrepih, ki jih dnevno sprejemamo, nekako preživeli."
15,"Ne omenjam varstva pri delu, ki naj bi znesli 2,5 milijona din, ni nobenih sredstev."
8,"Birotehniko smo v celoti črtali, ni nobenih sredstev."
14,"Se pravi 300 milijonov, to kar sem povedal zdaj, za normalno vzdržvanje policijske infrastrukture."
33,"S tem da glede na drugo postavko - prenos sredstev iz zveznih pristojnosti - Center za begunce, mi ga moramo po evropski konvenciji sprejeti kot država in morali bi že imeti ta center za begunce."
6,"Dalje, vzpostaviti moramo nacionalni biro Interpola."
11,Mi dobivamo zakasnele podatke iz zveze ali jih spoh ne dobimo.
31,"Ali to pomeni, da se lahko Slovenija, razmeroma urejeno varnostno okolje spremeni v prikladen kriminalni prostor glede na to, da smo na prehodu iz vhoda na zahod, iz juga na sever."
26,"Dalje, v celoten prenos kriminalistično tehničnih opravil iz zveze v Slovenijo, mi smo svoje čase financirali v zvezni inštitut ""bezbednosti"" kot se je imenoval velika sredstva."
10,"Mi vsega tega zdaj nimamo, niti nimamo te tehnologije itd."
6,Da ne govorim o projektih državljanstva.
11,"Mi imenujemo to projekt državljanstva, ki ga je sprejel ta parlament."
12,"Da ne govorim o zamenjavi potnih listih, vseh ostalih dokumentov sosednjih stanj."
17,"To so vse zadeve, ki jih je treba izpeljati in to od idejne zasnove do realizacijskega projekta."
4,Spoštovane poslanke in poslanci.
21,"Omenil bom pa še nekaj pred zaključkom, bila so tudi omenjena sredstva, pa ne vem če v tem zboru, na stanovanjsko."
10,Mi smo lani dobili samo za Karavanke in Šentilj sredstva.
23,"Letos nismo dobili za stanovanja, ki jih moramo dati ljudem, ki bodo na Karavankah in Šentilju delali, nobenih sredstev, to znese 23.000.000 din."
13,"Lani smo dobili 45.000.000 din iz sredstev osebnih dohodkov, letos ni te postavke."
27,"S tem, da letos nimamo denarja za eno stanovanje, izključno samo za samske sobe policistov, da je 400 do 500 ljudi brez stanovanj, prosilcev pa imamo 1200."
24,"Ob tem, da nekaeri v našem okolju postavljajo tako restriktivne zahteve najbrž obenem zelo dobro poznajo, da imamo mi hokejsko prvenstvo, da imamo Planico."
22,"Samo za hokejsko prvenstvo bo slovenska policija opravila posel za 5.000.000 din, brez opreme, ki jo ravno za določene zadeve zato nabavljamo."
8,Zato nam ni bil odobren niti en dinar.
37,"In nekaj časa bo še po mojem mnenju preteklo, da bomo lahko v Sloveniji na športne in drugačne prireditve seveda naredili kompleten projekt, v katerega bo zaobsežena tudi ekonomska cena policije, tako kot je drugje po svetu."
23,"Z obiski, ki jih imamo pri kolegih v Italiji, Avstriji in tako dalje, rednimi dnevnimi obiski, nas hvalijo, da ne bom drugače rekel."
