32,"Ta pogodba se pripravljala že od lanskega leta, ko smo mi bili izvoljeni in zdajle, ko bo leto naokrog, ni niti sledu o njej, kaj šele da bi bilo to področje urejeno."
20,"Sedaj je to področje prepuščeno stihiji, zato so ustvarjeni pogoji, zaradi katerih prihaja do motenj in anomalij v delu šolstva."
41,"Moram vas poslanci in poslanke opozoriti, da je stanje tako kritično, da se bodo učitelji zbrali 2. aprila 1991 na sestanku, kjer se bodo odločali, glede na sprejet proračun Republike Slovenije, o tem ali, bodo uprizorili generalno stavko učiteljev ali ne."
15,"Če bomo sprejeli tak proračun, kot smo ga doslej izglasovali, bodo do tega popolnoma upravičeni."
32,"Sprejeti proračun ne izboljšuje stanja na tem področju, tudi če bo ta amandma zdaj sprejet, zato naj Izvršni svet v skladu z ustavo pogleda tisti 23. člen in intervenira z ustreznim zakonom."
30,"Mislim, da to, kar so naredili v zdravstvu, da so videli, da se je proračun znižal in so hkrati tudi ukrepe za varčevanje pripravili, da je bila taka pot pravilna."
40,"To da se pa v izobraževanju, ki je pa neprimerno večji del kot vsi ostali v družbenih dejavnosti, na tem segmentu ni nič naredilo, kaže na to, da stopamo s sprejemom proračuna v takšno stanje, ki ima lahko nepredvidljive posledice."
20,"Nepredvidljive posledice za mir in nepredvidljive posledice za te stvari, v kaj, kako in zakaj bomo vzgajali mladi slovenski rod."
43,"Jaz vas še enkrat prosim, naj vsak pred svojo vestjo očisti s tem, ali so ti otroci naši otroci ali te otroke vzgajamo zato, da nam bo boljše, ali bomo samo na tem segmentu vzgoje in izobraževanja po zopet varčevali in šli navzdol."
4,Sam bom glasoval za.
2,Hvala lepa.
1,Hvala.
4,Želi še kdo razpravljati?
2,Gospod Avberšek.
10,"Meni je žal, ampak ob taki razpravi vedno dobim spuščaje."
37,"Predno zahtevate od Izvršnega sveta, da pove, kako bo s plačami, poveste učitelji enkrat, denar delite s tistimi učitelji, ki hodijo v razred, pa poglejmo, koliko pride na enega, potem pa zahtevajmo nekaj takega od Izvršnega sveta."
10,"Dajmo to narediti enkrat, pa boste videli, kaj se dogaja."
38,"Jaz imam tri otroke, oprostite nič ne morem, otroci iz moje šole niso naredili, niti eden ni naredil sprejemnega izpita na srednji osnovni šoli, pa nič ne morem, pa jih kar naprej še moram na to šolo pošiljati."
22,"Vsi imajo oceno iz angleščine za tri ocene nižjo, kot so jo imeli prej na osnovi šoli, pa nič ne morem narediti."
8,Marsikaj je treba narediti in glasoval bom proti.
4,Gospod Moge ima besedo.
27,"Če vsi poslanci, glede na glasovanje pa večina mislite, tako kot je mislil naš kolega, potem sem nad tem narodom pa nad temi poslanci tukaj globoko razočaran."
1,Zares.
2,Gospod Sekereš.
4,"Spoštovani predsednik, spoštovani kolegi!"
6,Jaz bi podprl predlog kolege Mogeja.
4,Sam sem prosvetni delavec.
23,"Delam že preko 25 let v tej službi, res, da sem si sam izbral ta poklic, veseli me, zato pa še delam tam."
17,"Da pa res ni reda glede zakonodaje, da ni reda teh zadevah, to je že skrajni čas."
51,"Zato pa prosim vas, da za te sklepe, kar je predlagal kolega, da te sklepe zglasujemo, da damo enkrat res na mizo Izvršnemu svetu, da mi razčistimo te zadeve, potem ne bo takih očitkov kot jih je dal kolega Avberšek, da bomo res potem mi tudi enkrat prišli na zeleno vejo."
54,"Trdim, da recimo konkretno na našem področju so učitelji razdeljeni tako, kot je treba, da nimamo nobenega več učitelja, da ure celo tiste nadure, ko ena ura in sami si vzamejo in da ne delimo te učence in ne delimo te učitelje, tako da po zakonu, katere glede na skupno sistemizacijo nam bi pripadalo."
34,"Želim pa res, da enkrat pridemo na zeleno vejo in da to enkrat na Izvršnem svetu jasno in glasno povemo, da res učitelji nismo tista cokla, ki recimo se vlečemo za to ubogo družbo."
2,Hvala lepa.
1,Hvala.
3,Še kdo želi?
3,Prosim gospa Žerovnik.
21,"Jaz se strinjam z gospodom,da je šolstvo res slabo, vendar kako naj bo drugačno, če je bilo 45 let podhranjeno."
25,"Ampak zdaj mu ne moremo še tisto malo odvzeti, zato je treba šolstvo podpreti, kajti to je tista vitalna sila, ki potem narod vleče naprej."
9,"To ni investicija tega trenutka, to je dolgoročna investicija."
6,Je pa to tako majhen denar.
14,"Poglejte, vzdržujemo poseben časopis za borce, našemu naslednjemu rodu, našim otrokom bomo pa odvzemali."
2,Hvala lepa.
41,"Želim povedati, da globoko spoštujem razloge in argumente, s katerimi je tukaj nastopil kolega poslanec Moge, ampak to razpravo danes tukaj vidim v luči proračuna, ki je pičel, pičlo odmerjen in za katerega sploh nimamo garancije, da bo realiziran v celoti."
38,"Mislim, po spominu bom citiral, da v šolstvo vsiljujemo varčevanje, varčnost, ampak dajte mi pokazati eno področje tu notri, kjer varčevanja ni, pa sem takoj za to,da naredimo red in da damo, ampak dati bi morali vsem."
14,"Zdaj je zelo delikatno jemati enemu in dajati drugemu, zato imamo v vladi resor."
13,"In danes posledica današnjih naših odločitev je lahko,da proračun ne bo sprejet."
27,"To pa je absolutno najslabša možnost, potem se pa ne bodo zbrali samo šolniki 2. aprila, ampak verjetno mi 31. marca zato,da bomo popravili današnje napake."
14,"Res je, tam je šlo čez rob, ampak marsikomu bi šlo lahko čez rob."
11,"V Kranju je tovarna, kjer že četri mesec ne dobivajo plač."
12,"Tem ljudem ne gre čez rob, ti ljudje so na robu eksistence."
18,"In enostransko argumentiranje, pa naj mi bo oproščeno, od kogarkoli je slabo početje pri sprejemanju proračuna neke države."
5,Tega pa sprejemamo letos prvič.
3,Še želi kdo?
7,Še sam bi se kot razpravljalec udeležil.
26,"Jaz bom seveda glasoval za amandma, in to zato, ker so dejansko razmere v šolstvu katastrofalne in bolj, ko bomo mi jemali ta denar, slabše bo."
7,Posledice bodo čez 10 in 20 let.
18,"Mi seveda tako daleč ne gledamo, ampak samo trenutno situacijo, se nam zdi ta denar velikokrat stran vržen."
10,"Jaz globoko razumem tudi gospoda Avberška, da dobi včasih ošpice."
18,"Jaz dobim tudi velikokrat ošpice, ko vidim nedelo drugje, ampak zaradi tega po tem nedelu ne sodim vseh."
9,Velika večina prosvetarjev je pa zdaj zaenkrat še intuziastov.
21,"Da so oni tako malo dali od sebe, tudi niso sami krivi, ravno tako kot verjetno še marsikdo pri nas ne."
22,"In zato se mi ne zdi pošteno po enem, dveh ali pa če hočete tudi 10 % učiteljev, ki so slabi, soditi vseh."
24,"To se mi zdi milo rečeno grdo ali zlobno in se mi zdi,da včasih človek celo v čustvenem navalu lahko kaj takšnega reče."
10,"Ko pa globoko premisliš, pa potem ugotoviš, da ni tako."
20,"Jaz bom moral, če to ne bo sprejeto, potem svoje konsekvence, ki vas seveda nič ne zanimajo, so pač moje."
10,"Zato še enkrat, jaz bom pač glasoval za ta amandma."
58,"Se oproščam, vendar sem navajen se boriti za stvari in bi moral povedati, da je nekorektno od mojih kolegov, ki so glasovali takrat pri štipendijah za kmetijske šole, ko je šlo za 102 milijona in da sedaj recimo za vse srednje šole, kar je že bilo omenjeno in za druge zadeve pri 420 milijonih je toliko te razprave."
29,"Če bi bil pa malo zloben, pa ne glede na utrujenost, bi predlagal, da se enkrat pri tej točki posamezno izjasnjujemo poimensko, kdo je za in kdo je proti."
1,Hvala.
17,"Glede na to, da smo bili pozvani poslanci v tej dvorani, kaj smo obljubljali v predvolilni kampanji."
16,"Moram zelo naravnost povedati, danisem bil na nobenem predvolilnem zboru in da nisem nikomurr ničesar obljubljal."
20,"Dobro bi bilo, če bi vsi tisti poslanci prišli sem povedat, da ne bi bili vsi metani v en koš."
19,"Ne sprejemam očitkov po dolgem in počez, da sem proti šolstvu, da sem proti otrokom, da ne razumem itd."
3,To je nemogoče.
10,Slučajno smo se sedajle na tem fenomenu te postavke ustavili.
19,"Kaj bi bilo, če bi vsi začeli; če bi začeli pri vrtcih, pa pri upokojencih, pa pri zdravstvu itd."
6,Nikdar ne bi prišli do konca.
18,"Sicer pa semtrdno prepričan, ko si malo beležim, ne vem, kako bo ta vlada ta proračun spravila skupaj."
24,"Če bi sedaj nekdo sešteval, kaj smo dodajali in kaj odvzemali, smo že mi prišli do višjega proračuna, kot ga je vlada predlagala sicer."
10,Mi bomo sami s seboj prišli v eno strahovito nasprotje.
28,"Zato predlagam, da če bomo glasovali tako ali drugače, ne vem, kako bo v ostalih dveh zborih, da se bo treba v okviru možnosti, ki jih imamo, uskladiti."
14,"Te možnosti so majhne in povsod bomo morali zategniti pas, da bomo prišli skozi."
9,"To bo malo pri šolstvu, malo pri zdravstvu itd."
21,"Mislim, da ne bi bilo dobro, da bi sedajle dramatizirali na enem primeru, čeprav vsi točno vemo, vsi imamo otroke, vnuke."
7,"Vsi vemo, da je treba več itd."
15,"Če sedaljee ne zmoremo, če bomo lahko čez leto ali dve več, bomo pa takrat."
13,"Sedajle bomo pa morali vse to, kar imamo, dokaj enakomerno in pošteno porazdeliti."
1,Hvala.
7,V okviru zasedanja si bom dovolil repliko.
17,"Ali ne bi potem bilo bolj enostavno, da rečemo, da bo pol kilometra ceste v Sloveniji manj?"
13,"Ali ne bi bilo bolje, če bi bilo 150 ali 200 policajev manj?"
10,"So še podobne stvari, da ne govorim o državni upravi."
8,Zakaj ravno na tem segmentu vedno lomimo kopija?
5,"Zato, ker smo najšibkejše organizirani."
12,"Zato, ker nas nihče ne zaščiti in tako je tudi danes tu."
4,Ali še želi kdo?
3,"Prosim, gospa Sagadinova!"
19,"Prej je gospod Ban spraševal, kdo je pred volitvami obljubljal boljši standard v šolstvu in v drugih družbenih dejavnosti."
40,"Moramreči, da je DEMOS to obljubljal in jaz kot članica Zelenih, ki je v koaliciji DEMOS, moram reči, da sem bila kar malo razočarna, ko sem zagledala ta osnutek proračuna, zlasti me je to področje vzgoje in izobraževanja najbolj zanimalo."
22,"Nikjer se ne čutid, da bi bila to neka dolgoročna naložba, neka strategija za dolgoročni razvoj, tudi v tako zaželjenem prestrukturiranju gospodarstva."
31,"Druga stvar, ki smo jo pa morda pozabili omeniti, je pa vprašanje v zvezi z našo srednješolsko populacijo, ki bo zaključila šolanje in bo jeseni vpoklicana v služenje naše slovenske vojske."
50,"Tu gre baje za okrog 2000 fantov, ki morda bodo vpoklicani, morda bodo pa morali šolsko leto nekje prevedriti, bodisi na kateri od fakultet in zanima me, kako naj sprejmemo tak predlog proračuna, ki ne zajema povečanega obsega šolske populacije in ki ne zmanjšuje ne standardov ne normativov, nobene stvari."
10,"Torej vemo, da gre vse to na račun učiteljevih plač."
5,Program bo ravno tako speljan.
7,Učitelj bo ravno tako šel v razred.
15,"Snov bo odpredaval, spraševal bo, ocenjeval, zaključni izpit bo treba narediti, denarja pa ni nikjer."
3,Tega ne razumem.
8,"Obveznosti ostajajo iste, denarja je pa občutno manj."
1,Hvala.
16,"Docela se strinjam z gospodom Mogetom in z ostalimi govorniki, ki so govorili na temo šolstva."
7,Nekaj me pa pri vsem tem moti.
7,"Ne povedo, kjer je treba sredstva vzeti."
16,"Tudi predgovorniki z drugih resorjev so v glavnem govorili, da hočejo več, ne pa, kje vzeti."
15,"Proračun, kakršnega nam je predstavila vlada, je bil pa 69 milijard in še nekaj čez."
21,"To je že 4 milijarde več, kot je bil takrat sklep Zbora združenega deal, ki ga je omejeval na 65 milijard."
15,"Če bi sedaj še te želje prišteli oziorma vse potrdili, bi dobili čez 80 milijard."
29,"Se pravi, vsi skupaj se bomo morali omejiti v okvir možnosti. 69 milijard je pa že dosti visoka stopnja obremenitve za naše gospodarstvo, več kot smo na začetku želeli."
25,"Drugače pa verjamem, da so te dejavnosti, posebej šolstvo, v zelo slabem stanju in to ne sam zadnje leto, ampak dejansko že vseh 45 let."
12,"Ne vidim izhoda, kako dati nekomu, ne da bi pri drugemu vzel."
1,Hvala.
3,Še dve repliki.
8,"Najprej gospod Moge, potem pa še Ivo Daneu."
42,"Če se spominjnate, je Stranka demokratične prenove in Liberalno-demokratska stranka, pa sami smo dali konsistentne predloge, se pravi, po mojem predlogu sem nakazal postavke, ki so se odvzele, tako da je bil proračun manjši od 69, celo na 67 milijard je šrišel."
4,Vsaka stranka je dala.
24,"Ko je Izvršni svet in Skupščina pripravil te amandmaje, so jih razbili po parcelah in ne glasujemo konsistentno o takšnem predlogu, ampak po parcelah."
31,"Zgodilo se bo, kar ste že omenili, da so nekateri amandmaji med seboj v navzkrižju, nekateri so pa celo taki, da bo proračun bistveno povečan in bo treba te stvari uskladiti."
11,To bo pa verjetno kar dan ali dan in pol trajalo.
18,"Ko sem predlagal tele reči, sem dal tak predlog, da bi proračun bil manjši, kot pa je sedaj."
26,"Gospodu Murnu in ostalim bi povedal, ko smo Socialisti predlagali 10 amandmajev, smo v pisni obliki predložili, komu naj se doda in komu naj se vzame."
28,"Če ne drugega, bi morali podreti vsaj tiste predloge, ki jih je akceptiral Izvršni svet, tako da imate lahko dokumentacijo v pisni obliki, pa tudi v našem predsedstvu."
2,Hvala lepa.
6,"Prosim, da gremo sedaj na glasovanje."
3,Glasoval bom za.
15,"Verjamem, da je vsak, kdor je predložil določene spremembe, še imel v vidiku cel proračun."
21,"Ko so se pa te spremembe vseh devetih strank in še Izvršnega sveta prišle navzkriž, se je pa dejansko sistem podrl."
8,Okrog tega bomo morali najti eno novo razmerje.
12,Kaj dosti od tega osnovnega predloga Izvršnega sveta ne bomo mogli odstopiti.
11,"Vsak zase je imel pametne, usklajene predloge s temi okvirnimi možnostmi."
13,"Ker so se pa medseboujno medstrankarsko križali, se je pa vse skupaj podrlo."
21,"Če sedaj ni več kaj tako bistvenega, kar bi doprineslo k argumentom ene ali druge strani, bi lahko zaključil to razpravo."
1,Lahko?
1,Hvala.
13,"Mi bi glasovali o tem amandmaju, ki je tu pod zaporedno številko 75."
8,Razprava se je razvnela in je bila dobra.
34,"Sprašujem vas, koliko vas je za amandma, ki ga je predlagal Rudi Moge pod zaporedno številko 75, da se postavke za srednje šole povečajo in tudi postavka 2.3.6. - Plačilo storitev tudi za nekaj sredstev."
3,Kdo je za?
0,.
3,Kdo je proti?
0,.
3,Kdo je vzdržan?
0,.
6,"Ugotavljam, da žal amandma ni sprejet."
21,"Ob tej priliki moram zbor obvestiti, da odstopam kot predsednik Odbora za šolstvo in šport in boste morali izvoliti novega predsednika."
2,76. amandma.
5,Tu gre za področje kulture.
14,"Sicer gre za investicije, da se zmanjša na ta znesek, ki je tu napisan."
11,"Vstavi naj se nova postavka 4.2.4. a) kultura, investicije, SNG Maribor."
9,"Skupina delegatov iz Maribora, Izvršni svet tega ne sprejme."
7,Želi v zvezi s tem kdo razpravljati?
5,Gledališče Maribor vam je poznano.
12,"Jaz sem že prej govoril o problematiki, ki nastaja v slovenskem prostoru."
9,"Rekel bi samo, da bom glasoval za ta amandma."
28,"Kajti, če smo prej dali za pet kmetijskih šol čez 100 tisoč dinarjev in da namenjamo celotni kulturi denar, s katerim bi lahko celotno področje severovzhodne Slovenije živelo."
21,"Če nismo toliko, da bi to premaknili z 21 tisoč dinarjev, se mi zdi tudi takšno razmišljanje zelo žalostno in temačno."
1,Hvala.
11,Številke teh investicij na področju kulture je obravnaval Odbor za kulturo.
23,"Žal se niso uspeli s tem ukvarjati, ker so se raje ukvarjali z drugimi stvarmi, o katerih raje ne bom govoril bolj natančno."
11,"Zdi se mi, da je ta predlog popolnoma razumljiv in sprejemljiv."
7,Investicij v kulturo vseeni ni tako malo.
14,"Vseeno je treba to in ono, tretje obnoviti in bo tega denarja vedno premalo."
12,"O tem gledališču poslušam 30 let, 30 let ga popravljajo in zidajo."
16,"Še posebej pa poudarjam, da v tem kulturnem razrezu dobi Ljubljana 80% sredstev, Maribor pa 20%."
10,"Nisem sicer navedel točnih podatkov, ampak razmerje je približno tako."
10,To ne pelje nikamor in s tem se ne strinjam.
3,To ni mogoče!
4,Vlada tukaj nima prav.
12,Potrebno je pobrati denar iz drugih področij kulture in narediti mariborski teater.
10,"Mogoče se sliši grobo, banalno in ne mi tega zameriti."
15,"Samo mislim, da je to možno in izedljivo in da ni nič posebnega pri tem."
19,"Potrebno je zaščititi živo delo, igralce, ki tam delajo in to bolj kot kakšno drugo, malo manj živo kulturo."
1,Hvala.
10,"Želel bi povedati samo to, da bom glasoval za amandma."
18,"In sicer zato, ker praktično ne gre za dodatna sredstva, gre samo za prestrukturiranje v okviru obstoječih sredstev."
13,"V smislu policentričnega razvoja sem enkrat že govoril, polna usta so nas vsega."
38,"Danes smo spet sprejeli - pri zakonu o vojaških zadevah, če se spomnite, da smo združili na nivoju republike vse stavbe, ki jih imamo na občinah in mislim, da bomo vsaj v smislu tega policentrizma to prestrukturiranje tudi omogočili."
1,Hvala.
4,Želi še kdo razpravljati?
7,Potem bi glasovali o tem 76. amandmaju.
5,Kdo je za predlaganami amandma?
1,Proti?
1,Vzdržanih?
3,Amandma je sprejet.
8,"Na vrsti je 78. amandma, predlagatelj Peter Starc."
6,Gre za raziskovalno dejavnost in tehnologijo.
23,"Po postavki 11:2,3 - plačilo storitev na področju družbenih dejavnosti pri točki 2,3:2 na področju znanosti naj se povečajo sredstva za 150 milijonov din."
3,Gospa Žirovnikova prosim.
1,Spoštovani!
10,Še bolj kot šolstvo je bilo v preteklosti prizadeto raziskovanje.
8,Zato je teh 150 milijonov pač mali popravek.
37,"Smo pred tem,da bomo odpuščali velik del inštitutskih delavcev, prizadeli tudi Univerzo, vsaj v raziskovalnem dinarju, zato je pač, če lahko marsikaj drugega podpiramo, vsak tisti intelektualni kapital, ki ga še imamo v Sloveniji, skušajmo ohraniti."
1,Hvala.
8,Želi kdo povedati kakšno drugo mnenje za podporo?
23,"Potem bi predlagal, da glasujemo o amandmaju, ki je pod zaporedno številko 78, kjer gre za skromno povečanje sredstev na področju raziskovalne dejavnosti."
5,Kdo je za ta amandma?
1,Proti?
1,Vzdržani?
6,"Ugotavljam, da ta amandma ni sprejet."
19,"Potem je tu 82. amandma, Marko Jaklič, in sicer Mladinski svet Slovenije, postavka 1.1., bruto osebni dohodki, se črta."
4,Marko Jaklič umika amandma.
10,"In tu imamo še 83. amandma, to je predlog liberalcev"
5,", da se ta postavka poveča."
8,"Gospod Jaklič ga je umaknil, vi pa povečujete."
1,Dobro.
6,"Jaša Zlobec pravi, da umikajo amandma."
21,"S tem smo zdaj teh 84 amandmajev, ki so bili predloženi, ne vsi v našem zboru, obdelali, osem smo jih sprejeli."
24,"Zdaj je to tako kot je gospod Grašič povedal, da glasujemo še o tem prvem delu in bi zdaj tu lahko še kaj povedal?"
1,Dobro.
14,"Tu je zdaj zakon sam, 2. člen, imamo tri naše amandmaje k 2. členu."
14,Tu gre najprej v prvem postavku se številka 69 milijard itn. nadomesti z 68.
19,"In v prvem odstavku se zopet - ne bom tega prebiral - nadomestijo, Izvršni svet to delno upošteva v svojem amandmaju."
4,To je prvi amandma.
3,Želi kdo razpravljati?
22,"Jaz se bom samo toliko oglasil, zdaj bi bilo najprej treba ugotoviti, kaj sledi tistim amandmajem, ki smo jih sprejeli ali zavrnili."
13,"Kakšen je zdaj skupen seštevek, najbrž ni tak, kot je zdaj tukaj predlagan."
15,"Ta amandma je lahko vprašljiv oziroma lahko bi glasovali, ko bi ta številka bila uglašena."
8,V bistvu bodo morali predlagatelji pripraviti novo številko.
14,"Mi pa glasujemo o tej številki, ki je taka, kot jo gospod Grašič ugotavlja."
6,Ker so dejansko tu številke drugačne.
14,Ali umikate amandma? 1. memorandum pod zapredno številko 1. in 2. člena predlagatelj umika.
34,"Sedaj smo pri 2. amandmaju v drugem odstavku, kjer se pika na koncu spremeni v vejico in doda besedilo: ""Če ta ni večji od deset odstotkov."" Tudi tu je Roman Jakič bil med predlagatelji."
6,Amandmaja pa Izvršni svet ne sprejema.
5,To je sedaj drugi amandma.
23,"V drugem odstavku poglejte še enkrat, se pika na koncu spremeni v vejico in doda besedilo: ""če ta ni večji od 10 odstotkov""."
3,Prosim gospa Zupanc.
6,Namreč obrazložitev tega amandmaja je taka.
23,"Proračunska poraba je bistven vir gibanja inflacije, zato ni sprejemljiva rešitev, da bi se avtomatično prilagajala rasti drobnoprodajnih cen, pa čeprav za nazaj."
22,"S tem predlaganim drugim odstavkom drugega člena bi Izvršni svet imel povsem proste roke za rebalansiranje proračuna, za kar je pristojna skupščina."
25,"Takšna določba bi pomenila, da se vse proračunske postavke dražijo enako, kot je siceršnja rast drobnoprodajnih cen, kar destimulativno deluje na racionalno obnašanje proračunskih porabnikov."
28,"Menimo, da je navedeni procent rasti drobnoprodajnih cen zadosten okvir za prilagajanje proračunskih odhodkov, za večje posege v proračun pa bi Izvršni svet moral predložiti Skupščini rebalans proračuna."
1,Hvala.
14,"Tu je še tretji amandma, kjer gre za to, da se drugi odstavek črta."
15,"Ta je seveda hujši in bomo najprej sprejemali tega, potem pa bi šli na drugega."
3,Ali predlagatelj vztraja?
30,"Ko sem na hitro pogledal kaj pomenijo sprejeti amandmaji v našem zboru, sem videl, da smo približno pri proračunu, ki je sedaj okoli 600 milijonov manjši, kot je bil predlagan."
20,"To je pa še vedno daleč več, kot smo na zboru, ko smo sprejemali osnutek odločili, koliko je lahko največ."
26,"Ko smo sprejeli, koliko je največ možno, je bilo to mnogo več, kot smo odločili v decembru, kakšen delež družbenega proizvoda za te namene lahko gre."
32,"Iz teh dveh razlogov in seveda, če vsemu temu sledim, vztrajam pri tem amandmaju, s katerim seveda opredeljujemo zgornjo mejo nominalne vrednosti proračuna in vsako spremembo v nominalnem smislu sprejemamo kot rebalans."
20,"To naj bi bil seveda pritisk v to smer, da se dejansko do konca leta pripelje dobistveno realno zmanjšanega proračuna."
4,Kaj sedaj konkretno predlagate?
10,"Predlagam sprejem amandmaja, torej, da se drugi člen amandmaja črta."
6,Še kdo želi kakšno svoje mnenje?
20,"Potem bom najprej glasovali o tem tretjem amandmaju k drugemu členu predloga zakona, ki se glasi: ""drugi odstavek se črta""."
5,Kdo je za ta amandma?
1,Proti?
0,.
1,Vzdržani?
0,.
8,"Ugotavljam, da je amandma v našem zboru sprejet."
5,Sedaj imamo še drugi amandma.
15,"Kljub temu, da smo izglasovali takega kot je, bi vseeno predlagali, da o njem glasujemo."
3,Kaj meni predlagatelj?
2,Ali vztrajate?
27,"Kdo je za amandma k 2. členu pod 2. točko, to je, da se doda besedilo: ""če ta ni večji od desetih odstotkov."" O amandmaju moramo glasovati."
11,"Ko bo medzborovsko usklajevanje, je še vseeno bolje eno z drugim."
5,"Dobro, to je moje mnenje."
3,Glasovati pa moramo.
5,Kdo je za ta amandma?
0,.
1,Proti?
0,.
1,Vzdržanih?
0,.
5,"Ugotavljam, da amandma ni sprejet."
9,"Zdaj smo pri 18. členu predloga zakona, Franci Gradišar."
28,"Besedilo v 1. točki 18. člena se nadomesti z besedilom, ki se glasi, potem lahko tekst sami preberete: 'obvesti Skupščino' v tretji vrstici je ena majhna tiskarska napaka."
14,Želi v zvezi s tem amandmajem kdo razpravljati in se izjasniti o svojem pogledu?
5,Izvršni svet ne sprejema amandmaja.
18,"Ker ni razprave, glasujemo o tem amandmaju, ki ga je predlagal naš delegat Franci Gradišar k 18. členu."
5,Kdo je za ta amandma?
0,.
1,Proti?
0,.
1,Vzdržanih?
0,.
6,"Ugotavljam, da amandma ni bil sprejet."
7,Zdaj imamo k 20. členu dva amandmaja.
22,"In sicer lahko preberete v tretji vrsti 7. alinee se za besedilom presega 1 milijardo din doda pika, ostali tekst se črta."
20,"Predlagatelj je Franci Gradišar v imenu Kluba neodvisnih in potem še 7. alinea, ki jo je pa predlagal Ivo Daneu."
5,Izvršni svet ne sprejema amandmaja.
6,Želi v zvezi s tem kdo?
9,"Potem bi glasovali o prvem amandmaju, pri 20. členu."
9,Kdo je za ta predlagani 7. amandma Franca Gradišarja?
0,.
1,Proti?
0,.
1,Vzdržanih?
0,.
10,"Ugotavljam, da 1. amandma k 20. členu ni bil sprejet."
15,"In še drugi amandma, pod točko 8, da se 7. alinea glasi, predlagatelj Ivo Daneu."
29,"Pri tem predlagamo, da bi se ta 7. alinea glasila: 'daje soglasje k pogodbam za financiranje investicijskih objektov in nakupa opreme, če njihova proračunska vrednost presega 1 milijon din."
11,"Pogodbe, sklenjene brez predhodnega soglasja republiškega sekretarja za finance, so nične."
20,"Menimo, da so to prevelika pooblastila, da bi lahko nabavljali in zato predlagamo ta amandma ter prosim, da ga sprejmete."
1,Dobro.
2,Slišali ste.
6,Izvršni svet ne sprejema tega amandmaja.
4,Gospod Židanik ima besedo.
45,"Glasoval bom za ta amandma, ker, če se ne motim, smo prej, ko smo zakonodajo sprejemali, rekli, da se daje samo Izvršnemu svetu s strani Sekretariata za ljudsko obrambo predlog, sprejema pa Izvršni svet, kar se tiče investicij, in to je v skladu s tem."
1,Hvala.
1,Hvala.
2,Še kdo?
5,Potem bi tudi tu glasovali.
13,Kdo je za predlagani amandma k 20. členu pod zaporedno točko številko 8?
0,.
1,Proti?
0,.
1,Vzdržanih?
0,.
6,"Ugotavljam, da amandma ni bil sprejet."
10,Smo pri 24. členu predloga zakona in 11. predlogu amandmaja.
10,Izvršni svet pa smiselno sprejema amandma in predlaga svoj amandma.
4,Želi kdo tu razpravljati?
15,"Potem bi predlagal, da glasujemo o tem amandmaju pod zaporedno številko 11 k 24. členu."
6,Kdo je za amandma Ladislava Puca?
1,Proti?
1,Vzdržanih?
5,"Ugotavljam, da amandma ni sprejet."
16,S tem so vsi amandmaji iz zborov obdelani in tu so zdaj še amandmaji Izvršnega sveta.
4,Teh amandmajev je osem.
8,"Teoretično vprašanje, jih sprejmemo in obravnavamo v paketu?"
45,"Imamo amandmaje Izvršnega sveta, in sicer prvi amandma k 2. členu zakona, drugi amandma k 8. členu, k 24. členu, 6. amandma k posebnemu delu, gre za finance, 6. za energetiko, 7. za promet in zveze ter 8. za vzgojo in izobraževanje ter telesno kulturo."
7,"Rekli ste, da jih lahko obravnavamo skupaj."
4,Ali še glasujemo skupaj?
7,"Je kdo proti temu, da glasujemo skupaj?"
11,Kdo je za predložene amandmaje Izvršnega sveta v Zboru združenega dela?
1,Proti?
1,Vzdržani?
