23,"No, zdaj, po enem letu, prihajajo danes spet z moratorijem, in to ravno s tiste strani, ki je takrat bila proti temu moratoriju."
16,"In mislim, da je res zdaj za moratorij prepozno, zdaj je čas za sprejetje lastninske zakonodaje."
20,"Ne prenesem, da me obtožuje gospod Muren za stvari, ki jih nisem naredil Kdaj sem jaz bil decembra proti vam."
5,Jaz sem zdaj to predlagal.
12,"Ja vi ste rekli, predlagali so tisti, ki so bili takrat proti."
6,"Ja, pa morate disketo prav naravnati."
16,"Jaz namreč enako mislim in želim, ker mi ni jasno to, kar je gospod Prelovec vprašal."
6,"Dajmo se, prosim vas, proceduralno dogovoriti."
15,"Trije osnutki bodo prišli, kako se pride do enega predloga in kdo bo to delal."
14,"Meni ni jasno in se pridružujem vprašanju gospoda Prelovca, kako bomo do tega prišli."
3,Samo dva stavka.
8,"Verjetno dobimo tri predloge, lahko seveda samo dva."
6,"Jaz mislim, da bosta samo dva."
8,"Teoretično je možnost, da bo samo eden ostal."
8,Glasovali bomo oziroma boste poslanci z mano vred.
13,"Glasovali bomo, katerega bomo obravnavali in katerega bomo pač potem tudi dokončno sprejeli."
6,Nekatere dobre stvari bodo pač odpadle.
6,Potem imaš pa seveda še amandmaje.
11,"Amandmajev bo še, ker bomo mi praktično šele v ponedeljek začeli."
1,Prosim.
9,"Lepo vas prosim, ali hočete sami zakomplicirati celotno proceduro?"
20,"Tu smo zato, da bomo proceduro napravili enostavno in če bo hotel kdo proceduro zavlačevati, se mi pa zdi nekorektno."
1,Prosim.
18,"Jaz mislim, da moramo enega izmed osnutkov izbrati, potem pa ostalega sprejeti kot predlog in amandmaje sprejeti zraven."
4,Druge pametne rešitve nimam.
5,Samo počakajmo potem do ponedeljka.
4,Jaz bi zaključil razpravo.
20,"Dal bi še enkrat samo o tem prvem in drugem sklepu, samo zaradi tega, da ne bi potem bili žaljivi."
18,"Verjetno bodo pa sami v vladi, ne glede na našo pobudo lahko nekaj takšnega pripravili, če bodo želeli."
8,"Tako da bi ugotovil prisotnost, koliko nas je"
0,.
6,Koliko nas je za moj predlog?
3,Je kdo proti?
4,Se je kdo vzdržal?
0,.
6,"Torej, smo ta moj predlog sprejeli."
13,"In sedaj bi vas prosil, da skupina za zadruge gre v sobo 209."
17,"Zdaj gredo: Zabukovec, Peršolja, Prelovec, Osterman, pa Rudi Moge; vsi ostali gremo pa na malico do enih."
13,"Ne vem, če lahko formalno začnemo, ker nas ni 40 tu v dvorani."
36,"Gospod Boštjančič me je opozoril, da sem napravil napako, in sicer, da nisem dal na glasovanje njegovega predloga v zvezi s prejšnjo točko, to je naj Izvršni svet pripravi predlog moratorija na lastninjenje do sprejetja zakona."
10,"Formalno moram dati njegov predlog na glasovanje, ker je rekel."
7,Želi v zvezi s tem kdo razpravljati?
5,Ga bomo potem skupaj formulirali.
1,Prisotnost!
12,"Bi predlagal vseeno, zdaj nas je toliko in še enkrat takšen tekst:"
14,Izvršni svet naj pripravi predlog moratorija na lastninjenja do sprejema zakonodaje s tega področja.
1,Prisotnost!
3,Kdo je za?
3,Je kdo proti?
4,Se je kdo vzdržal?
4,"Ugotavljam, da smo sprejeli."
3,Potem imamo nadaljevanje.
33,"Predlagam, da najprej začnemo s sprejemom stališč in sklepov h kratkoročnim in dolgoročnim ukrepom za izboljšanje gospodarskega stanja v Republiki Sloveniji, ki jih je pripravila delovna skupina in ste jih prejeli na klop."
3,"Prosim, gospod Remškar."
19,"41 nas je, 21 nas je bilo za, 11 proti, upam si reči, da je teh 11 za obstrukcijo."
4,To je njegovo mnenje.
19,Vračamo se na 7. TOČKO DNEVNEGA REDA - REALIZACIJA KRATKOROČNIH IN DOLGOROČNIH UKREPOV ZA IZBOLJŠANJE GOSPODARSKEGA STANJA V REPUBLIKI SLOVENIJI.
11,"Sklepe, ki jih je pripravila delovna skupina, ste prejeli na klop."
2,Pričenjam razpravo.
6,Kdo želi razpravljati o teh sklepih?
13,Na podlagi razprave in uvoda gospoda Ocvirka je delovna skupina pripravila tu stališča.
2,Gospod Ban.
46,"Sicer sem bil odsoten v tistem delu, ko je tekla razprava, samo zdi se mi, da je za naš zbor tole tako skromno in seveda istočasno tako neresno, da sem bolj za to, da formiramo grupo, ki pripravi resnično temeljite sklepe v zvezi z gospodarsko problematiko."
39,"Samo te 3, ne vem, kdo je avtor tega, resnično skromno in seveda s tem nesprejemljivo in mislim, ne vem, kaj je bil namen, če je samo to, se sprašujem, kaj smo pravzaprav v našem zboru s tem dosegli."
3,"Prosim, gospod Erce."
26,"Bi se kolegu Banu tudi priključil, recimo v blagi kritiki teh stališč in sklepov, ker dejansko sem pozabil, kdo je bil v tej skupini za sklepe."
21,"In bi vprašal v 1. točki, predzadnji stavek, kjer tudi pišemo o neki ukinitvi davka na uvoz blaga za široko potrošnjo."
30,"Zdaj, kolikor sem jaz spremljal naše debate, pač tudi debate drugje, moram priznati, da se ne spominjam, da bi bili tako širokogrudni, da bi ukinjali davščine za blago široke potrošnje."
26,"Če ni mogoče kdo mislil pač za določene davščine glede blaga, ki se potem predeluje, ali pa za kakšen uvoz opreme, ki jo naša podjetja rabijo."
16,"Se pravi, samo eno manjše vprašanje tem ustvarjalcem teh sklepov, kaj je s tem delom mišljeno."
2,Hvala lepa.
4,"Še mogoče kdo, prosim?"
1,Zabukovec.
12,"Spoštovani, jaz sem zadnjič mislil predlagati, da teh sklepov ne bi sprejemali."
29,"To pa zaradi tega, ker smo jih inicirali in zastavili v razpravi pred nekaj tedni, ko je bil trenutek aktualnosti čisto drugačen, kot se je tekom teh tednov spremenil."
7,Posebej še glede na ta 7. oktober.
13,Mogoče bi majhno v to smer kdo še razpravljal oziroma podal svoje mnenje.
18,"Če nas je več takih, potem mislim, da bi ponovno začeli stvar gospodarsko pregledati takoj po 7. oktobru."
33,"Tako se mi zdi, da je to sedaj ena naloga, ki smo jo naredili zato, da smo jo naredili, pa se ne bo čisto dobro usedla; bolj formalnega značaja so tile sklepi zdaj."
4,Tako je moje mnenje.
2,Hvala lepa.
1,Hvala.
2,Gospod Boštjančič.
2,Spoštovani zbor.
17,"Če bi pogledali sklepe iz lanskega julija, ko smo razpravljali o razbremenitvi, bi prišli do istih stvari."
9,"Sedaj se neprestano ponavljamo, kadarkoli razpravljamo o gospodarski situaciji."
21,"Mislim, da tak prosti spis niti ni dostojen našega zbora, da ga sprejmemo, ker mi bi morali biti mnogo bolj konkretni."
34,"Konkretni po nočemo biti, ker preprosto mi nekaterih konkretnih stvari vladi ne moremo dajati, ampak mora vlada nam povedati, kaj se da in kaj se ne da, ker ima sigurno širši horizont kot parlament."
33,"Zaradi tega predlagam in podpiram Zabukovca, da tega ne sprejmemo in odložimo stvar po 7. oktobru, kjer bomo pa verjetno imeli nekatere zelo konkretne stvari in o konkretnih stvareh bi bilo boljše razpravljati."
1,Hvala.
1,Hvala.
2,Še kdo?
2,Rudi Moge.
4,Spoštovane poslanke in poslanci!
5,Rad bi pripomnil samo tole.
30,"Prva stvar je, da večina poslancev, ki je danes dobila tole na klop, ni pregledala zapisnika, v katerem bi bili navedeni vsi sklepi, ki smo jih sprejeli na 26. seji."
20,"Tej skupini, ki je te reči sestavljala, se ni zdelo vredno, da bi enkrat vse te stvari tukaj notri napisala."
20,"Grem staviti skoraj s svojo glavo, da tisti, ki so tukaj debatirali, ne vedo več, katere sklepe smo takrat sprejeli."
32,"Če bi jih pogledali, so tisti sklepi bili podobni kot tiste zahteve, ki so jih poslanci dr. Ocvirku zopet zastavljali takrat, ko je bil tu in so se nekateri poslanci samo ponavljali."
3,Ponavljanje na ponavljanje.
41,"Druga reč, ki me zelo moti v tem zboru, mislil sem že parkrat urgirati, pa na koncu nisem prišel do besede, je tista 1. točka dnevnega reda, ki se mi zdi za nas vedno najpomembnejša, ko imamo sprejem in potrditev zapisnikov."
25,"Sam namreč gledam tele zapisnike; imam vse zbrane in v teh zapisnikih sem ugotovil, da ogromno sklepov in stališč, ki smo jih sprejeli, ni realizirano."
28,"Mi se v tej 1. točki vedno ustavimo samo na tem pragu, da vidimo, če je zapisano tako, kot smo sprejeli, potem roke dvignemo, sprejmemo in gremo naprej."
33,"Nikoli se pa še ni zgodilo, odkar tukajle sedim, razen v treh štirih primerih, ki jih imam evidentirane, da je kdo vstal in rekel, ali je to bilo izvršeno, ali ni bilo izvršeno."
22,"To se pravi, da ni nikogar v tem našem zboru, ki bi skrbel nad realizacijo teh sklepov in stališč, ki jih zavzemamo."
50,"Mogoče bi, če bi nekako bolj udarno delal tale zbor naprej, bi bilo dobro, da bi pri tej točki, torej, ko bi sprejemali zapisnik prejšnje seje, naj bi bilo tudi kratko priloženo, kaj je bilo izvršeno in kaj ne; in to ne samo te seje, ampak tudi o vseh nadaljnjih."
7,S tem bi vse debate tukaj odpadle.
2,Hvala lepa.
1,Hvala.
4,Želi še kdo razpravljati?
3,"Prosim, gospod Arzenšek."
4,"Spoštovano predsedstvo, spoštovani zbor!"
4,Samo tole bi rekel.
22,"V delovni skupini sem bil samo zadolžen za družbene dejavnosti, gospodarski del pa je pripravil, a je bil včeraj odsoten, gospod Grašič."
5,Rad bi pa povedal tole.
65,"Zelo dobro bi bilo, da bi tisti, ki ste do sedaj razpravljali, dejansko vzeli sklepe 26. seje, kjer se iz razprave, pa to četrto manjka, kar sem predlagal, pa ne piše, da naj bi praktično gospodarska skupina, širša, kot pomoč tej delovni skupini, analizirala realizacijo sklepov, ki smo jih sprejeli na 26. seji, od točke do točke tistih sklepov, ki jih imamo na treh straneh."
18,"Zelo oportuno je rečeno tole, kar je bilo prej povedano, češ, joj, to je bilo pa premalo ekzaktno."
34,"Tule smo se pogovarjali o podjetjih, celo navajali imena podjetij, bankah in podobne stvari, pa bi se zgodilo, če bi šli v te podrobnosti, bi morali tisti zraven sodelovati, pa bi še koga izpustili."
20,"Tako, da so bila tam stališča in sklepi navedeni po posameznih sklopih, na katere je skušal odgovoriti podpredsednik, gospod Ocvirk."
46,"In seveda, v razpravah smo pa že takrat ugotovili, da se ponavljamo in zato je bilo v tretji točki napisano to, da bi se zagotovilo; to je res načelno, take pogoje gospodarjenja, ki bodo spodbujali in motivirali izvoz itn. kar se je vleklo skozi vso nit."
14,"Posamezni sklopi teh zadev so pa iz junijske seje in pa te, 26. seje."
46,"Zato predlagam, da v kolikor se smatra, je treba zelo precizno pripraviti najprej stališča in sklepe, naj tisti, ki so, recimo, tudi uveljavljali, da so stališča in sklepi na 26. seji, sodelujejo v tej delovni skupini in naj predlagajo tudi nosilca in rok ter vsebinsko opredelitev."
9,"Ker tudi tisti, ki so sedajle diskutirali, govorijo počez."
7,Tako da se moramo o tem pogovoriti.
48,"Mišljeno je pa bilo, da ta stališča in sklepi, to se samo ugotavlja, da ni bilo in v takem smislu je bil moto tega, praktično niso bili niti realizirani, tisti sklepi 26. seje, kaj šele od prej, nekateri pa so bili, kakorkoli so bili, z ugotovitvami trenutnega stanja."
22,"Ne znam pa odgovoriti, ker nisem bil avtor gospodarskega dela, kar je vprašal gospod Erce za to ukinitev davka na uvoz blaga."
13,"To sem vprašal samo, ker so rekli, da je to gospod Grašič naredil."
11,"Nisem dobil odgovora, ker ne vem, kaj je s tem mislil."
7,"To moram tudi odgovoriti, ker ne vem."
40,"Ampak zato predlagam, je čisto sprejemljivo, da se o tem pogovarjamo po 7. oktobru, s tem da tisti, ki so uveljavljali tiste sklepe, da so zapisani, zraven sodelujejo in ocenijo, ali je tisto, kar so predlagali, bilo uresničeno ali ne."
4,Ker drugače govorimo počez.
12,Delovna skupina pa lahko potem na osnovi tega pripravi bolj konsistentno besedilo.
39,"Govorim v svojem imenu, ker za družbene dejavnosti bi lahko napisal na dveh straneh, pa bi rekli, spet so družbene dejavnosti prve, nismo pa mogli komunicirati z gospodom Francom Grašičem, ker ga ni bilo in ker je bil odsoten."
2,Hvala lepa.
3,"Dobro, slišali ste."
4,Še želi kdo razpravljati?
16,"Sam tudi nisem več pristaš ne vem kako dolgoveznih stavkov in sklepov, ki se ne uresničujejo."
33,"Zato se mi je zdelo kar prav, kar je predlagal gospod Grašič, naj na kratko pač napiše, o čem je tekla beseda, ker imamo itak sklep v zboru, da bomo večkrat to obravnavali."
6,Praktično bi morali na vsaki seji.
9,"Strinjam se s tem, kar je gospod Moge načel."
36,"Mi bi verjetno res bolj morali obravnavati vprašanja realizacije teh sklepov, kar pa mi mogoče premalo delamo glede na to, da naj naše sklepe predvsem realizira Izvršni svet in tu je mogoče deloma tudi naša napaka."
32,"Kljub temu pa se v vodstvu Skupščine večkrat pogovarjamo ravno o tem in se potem tudi pogovarjamo s predstavniki Izvršnega sveta o realizaciji teh zadev, tako da je mogoče tu še vzel."
62,"Se pa tudi strinjam in nimam nič proti, če boste pač tako menili, da sprejmemo ta stališča in sklepe kot osnutek in jih bomo uravnavali zlasti zdaj, ko imamo po tem obdobju kar veliko vprašanj, včeraj ste jih slišali z gospodarskega področja in seveda tudi glede na vse ostalo imamo še za dodelati in bi mogoče bili takrat lahko še bolj konkretni."
21,"Predlagal bi, da rečemo, to je osnutek, ki bo dopolnjen še s kasnejšo razpravo o tej problematiki, in bi dali naprej."
7,Ali je o tem sploh treba glasovati?
5,"Mislim, da skoraj ni treba."
20,"To smo vzeli na znanje kot osnutek, o realizaciji teh sklepov pa se bomo tudi pogovorili in bomo šli naprej."
1,Velja?
4,Želi kdo zakomplicirati še?
1,Dobro.
12,Potem je tu še vprašanje USKLAJEVANJE PREDLOGA ZAKONA O RAZVOJU MALEGA GOSPODARSTVA.
7,Poročevalec v našem zboru je Anka Osterman.
31,"Za poročevalca na sejah zborov so bili določeni: za Družbenopolitični zbor ta, za Zbor občin ta in za Zbor združenega dela Anka Osterman v zvezi s poročilom o razvoju malega gospodarstva."
17,"Potem o socialnem varstvu itn., skratka, gre za štiri zadeve, ampak zdaj bi imeli najprej malo gospodarstvo."
24,"Moram reči, da je tale skupina za usklajevanje teh treh zakonov bila edino sklepčna (in Zbora združenega dela), vsi ostali so imeli malo težav."
13,"Zdi se mi fino, da to povem, ker se to kar dostikrat dogaja."
33,"Pri predlogu zakona o razvoju malega gospodarstva veste, da je naš zbor sprejel amandma k 11. členu, ni pa sprejel vseh ostalih amandmajev, tako kot sta sprejela to Zbor občin in Družbenopolitični zbor."
33,"Mi smo na tem usklajevanju imeli tudi gospoda Brezarja, ki nam je še dodatno pojasnjeval, zakaj naj bi vendarle tudi naš zbor sprejel 11. člen tako, kot sta ga ostala dva zbora sprejela."
51,"Gre za sestavo upravnega odbora, ki naj, po njegovih navedbah, vendarle deluje, da bi ta sklad deloval kot kapitalska družba, torej, bi tudi upravni odbor ne imel funkcije razdeljevanja, ampak pravzaprav vodenje politike in nadzora nad razdeljevanjem in težnja je, da bi vlada v ta sklad lahko pripeljala tudi tuje vlagatelje."
22,"Menda taki razgovori že tečejo in seveda zato rabi odprte roke pri tem upravnem odboru, da lahko tako imenuje potem tudi člane."
55,"Da bi pa seveda Izvršni svet itak v skladu z besedilom zakona sprejel posebna merila, po katerih bi komisija pripravljala potem predloge za delitev teh sredstev in bi torej tam bile vključene lahko tudi vse ustrezne oziroma zainteresirane zbornice tako, kot smo se mi zavzemali, da bi že bilo pri samem članstvu v upravnem odboru."
7,Bilo je kar precej diskusije okrog tega.
24,"Mi smo tudi menili, da to v našem zboru niti ni bilo tako pojasnjeno, mogoče da bi predstavnik Izvršnega sveta še dodatno kaj pojasnil."
64,"V glavnem, potem je nekako prevladalo stališče, da naj bi vendarle zbor Zbor združenega dela potem sprejel naslednji sporazumni predlog, in sicer, da bi umaknili amandma k 11. členu, ki ga je prvotno predlagala Gospodarska zbornica Slovenije in da ponovno glasujemo tako, da sprejmemo amandmaje Zakonodajno-pravne komisije k 11. členu, 11.a členu, 12. in 13. členu, kjer se potem pa črta peta alinea."
55,"Tako bi potem glasil sklep: ""V sestavu upravnega odbora sklada iz 11. člena, (to je ta sporna zadeva) je potrebno vključiti tudi predstavnike zainteresiranih zbornic."" In drugič: ""Zbor naj sprejme amandma Gospodarske zbornice Slovenije k 19. členu zakona."" In sicer komisija poudarja, da bo s sprejetjem tega amandmaja zagotovljeno hitrejše organiziranje in pričetek delovanja sklada."
14,"Tega 19. člena pa jaz natančno nimam, tako da ga ne morem posebej obrazlagati."
5,Zato mi morate malo pomagati.
17,"Ja. amandma k 19. členu pravi, da se v prvi vrstici beseda ""šestih"", nadomesti z besedo ""treh""."
4,"Ja, gre za mesece."
27,"Obrazložitev pa je: Menimo, da so trije meseci ustrezen rok za formiranje sklada, saj se enak rok predvideva tudi za sprejem meril in pogojev iz 6. člena."
10,"Gre torej za krajši čas, da se ta sklad formira."
1,Hvala.
1,Hvala.
3,Slišali ste zdaj.
13,"Anka je lepo povedala, kako so delali na komisiji in kaj tudi predlagajo."
6,Tu je še tudi dopolnilo tega.
30,"Komisija je zadolžila ministra za malo gospodarstvo, da delegatom Zbora združenega dela natančno predstavi koncept razdeljevanja sklada Republike Slovenije za razvoj malega gospodarstva ter naloge in pristojnosti njegovega upravnega odbora."
36,"Predlagal bi naslednje: Mi bi danes enkrat mogoče drugače opredelili, da potem, kar nam bo gospod Brezar povedal, je tudi tu med nami, da bi glasovali o celem paketu - to, kar komisija predlaga - ne pa razdeljeno."
3,To je prav.
9,"Prosim, gospod Viktor Brezar, minister Ministrstva za malo gospodarstvo."
33,"Spoštovani poslanci, mi ta zakon o razvoju malega gospodarstva, ki predstavlja konkreten ukrep vlade oziroma enega od predlogov vlade za reševanje gospodarske situacije, obravnavamo že od junija in ta postopek teče od takrat."
11,"Posledično iz tega pravzaprav nastopa velika gospodarska, kakor tudi moralna škoda."
16,"Gospodarska škoda nastaja zaradi tega, ker je zakon bil podprt s proračunom v višini 495 milijonov."
8,Ta znesek se je razpolovil že z inflacijo.
52,"Ker zakon ni bil sprejet, je nastopila škoda tudi na ta način, da je Izvršni svet z renominacijo sredstev oziroma proračuna zmanjšal namen na tem področju na vsega četrtino predvidenega in zaradi tega za ta del gospodarstva v javnosti nastopa informacija in spoznanje, da vlada ne naredi ustreznih ukrepov na tem področju."
26,"V zadnjem času nastopa tudi informacija, da v Zboru združenega dela temu zakonskemu predlogu nasprotujemo oziroma se nasprotuje in da zaradi tega niso stvari resno mišljene."
24,"Če se dotaknemo same vsebine zakona, bi na kratko povzel nekatere stvari, in sicer takole: Sam zakon zasleduje namen, da se spremeni gospodarska struktura."
31,"Gospodarska struktura je v tem trenutku delež malega gospodarstva približno 12%, normalno optimalno v zahodnih razvitih ekonomijah pa delež malega gospodarstva predstavlja od 30 do 70%, Japonska še celo nekaj več."
15,Zaradi tega mi predlagamo spodbujevalne ukrepe in eden od spodbujevalnih ukrepov je tudi razvojni sklad.
36,"Ta razvojni sklad ni interesni sklad, pač pa je to kapitalski sklad in predstavlja instrumentarij države, to je Izvršnega sveta in pa te Skupščine, da ukrepa in intervenira v gospodarstvu ter zasleduje cilj spremembe gospodarske strukture."
49,"Ta sklad temelji predvsem tudi na tem, da se vložek v ta sklad da s strani slovenske države, na drugi strani pa, da je sklad odprt tudi za tuje denarne pomoči, predvsem s strani mednarodnih skladov, kot so npr. Mednarodna banka za obnovo in razvoj, EFTA in še nekateri."
27,"Na tem področju smo mi pristopili h konkretnim razgovorom, od katerih nam je avstrijski sklad VUGES preko avstrijske države pripravljen v ta sklad vložiti 10% ustanovnega deleža."
30,"Glede na to se sedaj postavlja vprašanje amandmajev, ki jih je dala Gospodarska zbornica, umestnost, ali ti amandmaji rušijo sam koncept zakona, in pa namen, ki se s tem zasleduje."
7,"Mi razločujemo dva nivoja, da tako rečemo."
17,"Eno je sklad oziroma upravni odbor sklada, ki ima ta namen, da pridobiva in gospodari s skladom."
13,"Drugi nivo pa je odločanje o interesih, ki se v tem skladu pojavljajo."
29,"Upravni del sklada bi reševal upravni odbor, interesni del, kjer so pa posamezne gospodarske strukture - obrtniki in zasebniki, podjetja, naj se pa rešuje na nivoju instrumentarija za delitev sredstev."
31,"Mi smo akceptirali in sprejeli, da se instrumentarij za delitev sredstev dela skupaj s prisojnimi in zainteresiranimi zbornicami, kar smo akceptirali v 6. členu, in to je tudi normalno in prav."
12,"Ni pa smiselno, da bi v upravnem odboru zopet nastopal konflik interesov."
25,V upravnem odboru sklada mora prevladovati instrumentarij pospeševanja in instrumentarij izvajanja pospeševanja s strani države - Izvršnega sveta in pa seveda Skupščine prek letnih razvojnih programov.
31,"Zaradi tega mi predlagamo, da se t.im. 7. člen, o katerem je tukaj nastopila dilema, da Izvršni svet imenuje svoje člane, tako kot bo Izvršni svet udeležen v tem skladu."
17,"Mi računamo, da se bodo v ta sklad imenovali člani upravnega odbora tudi s strani avstrijskega VURES-a."
24,"Če bomo dosegli sporazum z drugimi razvojnimi skladi, npr. EFTO, bomo vključili v ta upravni odbor tudi predstavnika tega sklada in še drugih skladov."
13,"Namen tega sklada in tega upravnega odbora je, da izvaja politiko tega sklada."
15,"Še enkrat bi poudaril, da je prav, da se poslanci odločite za predlog usklajevalne komisije."
2,Hvala lepa.
4,"Hvala lepa, gospod minister."
3,Slišali ste oboje.
5,Ali želi kdo posebej razpravljati?
4,Potem bi se opredelili.
13,"Predlagam, da glasujemo o predlogu usklajevalne komisije v celoti, tako kot je predlagano."
13,"Ali se kdo ne strinja s tem, da morda želi, da glasujemo postopoma?"
2,Ugotovimo prisotnost!
8,Kdo je za predlog usklajevalne skupine v celoti?
3,Je kdo proti?
4,Se je kdo vzdržal?
13,"Ugotavljam, da je zbor sprejel predlog usklajevalne skupine z večino glasov v celoti."
13,"Sedaj moramo še glasovati, kdo je za zakon v celoti s sporazumnim predlogom?"
3,Je kdo proti?
4,Se je kdo vzdržal?
10,"Ugotavljam, da je zakon v celoti z večino glasov sprejet."
11,Potem imamo USKLAJEVANJE O PREDLOGU ZA IZDAJO ZAKONA O SOCIALNEM VARSTVU.
5,Prosim gospo Anko kot poročevalko.
36,"Pri zakonu o socialnem varstvu je šlo za neskladje, ker sta Zbor občin in Družbenopolitični zbor sprejela predlog zakona z osnutkom, naš zbor pa je sprejel samo predlog za izdajo zakona, torej sprejel normalen trifazni postopek."
48,"Ko smo utemeljevali, zakaj smo se tako odločili, sta oba zbora menila, da smo ravnali prav in je bil potem sprejet skupen sklep, da Zbor občin in pa Družbenopolitični zbor ponovno ocenita svojo razpravo in poskušata vrniti zakon tudi v normalen trifazni postopek, tako kot smo sprejeli mi."
1,Hvala.
35,"Sedaj je tu samo še ta sklep, in sicer: Izvršni svet naj Skupščini Republike Slovenije čimprej predloži osnutek zakona o socialnem varstvu s spremljajočimi dokumenti, tako da bo mogoče zakon sprejeti še do konca leta."
4,Mogoče bi preverili prisotnost.
4,Kdo je za sklep?
3,Je kdo proti?
4,Se je kdo vzdržal?
13,"Ugotavljam, da smo sklep soglasno sprejeli z majhnim dvomom, kako je to možno."
13,Sedaj imamo pa še USKLAJEVANJE O PREDLOGU ZA IZDAJO ZAKONA O REPREZENTATIVNOSTI SINDIKATOV.
26,"Tu pa je Družbenopolitični zbor sprejel trifazni postopek, Zbor občin in naš zbor pa združitev prvih dveh faz, se pravi predlog za izdajo zakona z osnutkom."
101,"Po krajši razpravi je bilo vendarle ugotovljeno, da je materija toliko zahtevna - to je prvič, ko se pri nas delovanje sindikatov ureja z zakonom in da bi bilo vendarle prav, da nekatera izhodišča tudi tukaj poenotimo, da bi torej zakon obravnavali v trifaznem postopku, da bi imeli več časa, da ne bi potem prehitro spreminjali tega zakona, vsekakor pa, da se še sindikati med seboj uskladijo in tako smo potem sprejeli poslanci iz Zbora občin in Zbora združenega dela pobudo, da poskušamo svoj sklep spremeniti tako, da gremo v trifazni postopek in torej sprejmemo predlog za izdajo zakona o reprezentativnosti sindikatov."
2,Slišali ste.
4,Kaj menite o tem?
24,"Komisija predlaga Zboru občin in Zboru združenega dela, da ponovno pretehtata svojo prvotno odločitev in sprejmeta le predlog za izdajo zakona o reprezentativnosti sindikatov."
6,Ali želi kdo razpravljati o tem?
5,Kdo je za predlog komisije?
3,Je kdo proti?
4,Se je kdo vzdržal?
10,"Ugotavljam, da je bil predlog komisije sprejet z večino glasov."
8,Sedaj pa imamo USKLAJEVANJE O PREDLOGU STANOVANJSKEGA ZAKONA.
17,"Tu je takoj prvi problem, ker je to delo usklajevanja bilo že opravljeno, nimamo pa še teksta."
23,"Glede na to, da to v našem zboru - tako izgleda po informacijah - ni nekako problematično, bi vseeno počakali, da bi vsaj to opravili."
3,Ali lahko poročaš?
6,"Tu nas je sedajle 43, 44."
6,"Lepo prosim, da pazimo na sklepčnost."
19,"Gospod Deželak je prišel povedati zaradi komisije v zvezi z zakonom o zadrugah, da bi bilo treba nadaljevati delo."
35,"Če bi ta komisija malo kasneje pričela delo, bi mi s to zakonodajo lahko končali in bi bilo verjetno bolje, da bi šli danes domov, ker bi lahko potem v ponedeljek te stvari delali naprej."
9,Komisija za zadruge bo pričela delo ob 15. uri.
31,"Danes zjutraj je usklajevalna komisija obravnavala amandmaje, ki so bili sprejeti v vseh treh zborih in smo se pač formalno dogovorili, da sprejme zbor, ki je v manjšini, pobudo ostalih dveh."
55,"Mislim, da smo se v vseh ostalih, vseh teh amandmajih, uskladili za 123., za katerega pa nimam zakonskega besedila pa je bil potem skupen predlog, da se besedilo 123. člena spremeni v zakonu za vse tri zbore enako, tako da bi bil amandma te usklajevalne skupine v besedilu, ki bo, tistega nimam v celoti napisanega."
37,"Za 8. člen bi se v našem zboru morali uskladiti z ostalima dvema zboroma, in sicer, da se v tretjem odstavku v drugi vrsti za besedico ""strehe"" doda beseda ""fasada""; doda za besedo ""strehe"" še beseda ""fasada""."
21,"Mislim, to je pač bilo v onih dveh zborih sprejeto, ni pa verjetno nobenih posebnih razlogov, da tega ne bi sprejeli."
