28,"Da gre v fazo osnutka, bomo ugotovili v razpravi, sedaj pa bomo glasovali o predlogu dnevnega reda, kakor smo ga po točkah že določili oziroma prejeli na klop."
5,"Prosim, da ponovno ugotovimo navzočnost."
3,Kdo je za?
3,Je kdo proti?
4,Se je kdo vzdržal?
6,"Ugotavljam, da je dnevni red izglasovan."
7,Sedaj preidemo na 1. TOČKO DNEVNEGA REDA.
4,Pred tem kratka obvestila.
12,"Prehajamo na začetno fazo točke POBUDE, PREDLOGI IN VPRAŠANJA POSLANK IN POSLANCEV."
15,"Na 23. seji smo v začetni fazi pobud, vprašanj in predlogov delegatov sprejeli naslednji sklep."
47,"Delegati Družbenopolitičnega zbora pred začetkom obravnave posameznih točk dnevnega reda ob predhodni predstavitvi posameznih pobud in vprašanj ustno predstavijo le tista delegatska vprašanja in pobude, ki so jih pred tem oddali pisno v pisni obliki in za katere, glede na problematiko, odgovor pričakujejo še na isti seji."
32,"V zvezi s tem prosim delegate, da v skladu s sprejetim sklepom na prejšnji seji zbora ustno predstavite le tiste, in to kratko, na katere realno, razumno pričakujete odgovor na tej seji."
1,Prosim.
1,Spoštovani!
24,"Ker sem danes že govoril tudi kot predsednik Komisije za mednarodne odnose bi poudaril, da govorim tokrat kot vodja poslanskega kluba Social-demokratske stranke Slovenije."
21,"Na zadnji skupni seji, ko je bil govor tudi o brionski deklaraciji, sem plediral za čim bolj natančno izpolnjevanje njenih določil."
16,"Morda se bo komu zdelo, da današnja pobuda oziroma vprašanje ni v skladu s takšnim zavzemanjem."
23,"V Social-demokratski strani Slovenije nas je namreč prizadela vest, da so na nekaterih mejnih prehodih naše države Republike Slovenije izobesili zastave države Jugoslavije."
11,"Menda gre vsaj za Ljubelj, Korensko sedlo, Jurij, Vrtojbo in Lipico."
20,"Social-demokrati sicer podpiramo izpolnjevanje določil brionske deklaracije in poznamo zahteve evropskih opazovalcev, da se na slovenskih mejah postavi jugoslovanske oznake."
19,"Vendar nasprotujemo tako široki interpretaciji sporazuma, saj nasprotna stran v konfliktu ta mednarodni sporazum po našem mnenju močno krši."
19,"Ne moremo pozabiti tudi vseh državljanov Slovenije, ki so s svojimi življenji med vojno branili simbole naše mlade države."
13,"Sramotno je, da zastava med vojno nam sovražne države plapola na naši zemlji."
8,"Social-demokrati menimo, da je treba jugoslovanske oznake umakniti."
38,"Prosimo, da nas Izvršni svet Skupščine Republike Slovenije še danes obvesti, kdo je sprejel odločitev, da se izobesi jugoslovanske zastave na slovenskih mejnih prehodih, na katerih mejnih prehodih se je to storilo in na katerih se še bo."
17,"Zanima nas tudi ali gre za stanje, ki naj bi trajalo do 7. oktobra oziroma do kdaj."
12,"Torej, ali bodo zastave spuščene 7. oziroma 8. oktobra, seveda, leta 1991."
2,Hvala lepa.
1,Hvala.
5,Gospod Viktor Žakelj ima besedo.
22,"Spoštovani podpredsednik, to kar sprašujem, seveda ni samo misel, ki zadeva našo stranko, v dogovoru sem tudi s kolegi iz stranke Zelenih."
19,"V Delu sem prebral pismo dr. Pučnika, predčasno so se podobno zavzemali, v drugačnih razmerah, tudi v Liberalni stranki."
3,Za kaj gre?
15,Jugoslovanski bivši prostor hitreje razpada in zgublja se tudi možnost za racionalne in ekonomske povezave.
48,"Tisto kar nas ta čas povezuje in mislim, da usodno povezuje, usodno v našo škodo, je dinar, naša skupna moneta, ki se sedaj pravzaprav na Topčideru neodgovorno množi, za potrebe, ki nimajo nič skupnega z našimi interesi in menim, da tudi interesi mnogih drugih narodov te nesrečne države."
25,"Ker smo mi preko te monete vključeni v jugoslovanske tokove, kar bi v normalnih pogojih bila prednost, je v tem trenutku vsak dan večja škoda."
17,"Zato sprašujem, govori se, da se pripravljajo različne monete - lipe, lipice, krompir, fižol in ne vem kaj."
7,V najnovejšem času bojda klasje in zrna.
12,"No, kakorkoli že, očitno prihaja čas, ko bomo morali vpeljati lastno moneto."
19,"Predlagam, da Izvršni svet osnovno informacijo o tem, v kakšnem stanju so te priprave, da morda danes ali jutri."
30,"Na vsak način kot drugo pa, da v tem parlamentu opravimo temeljito razpravo, kajti to ne more biti odločitev eksekutive, to mora biti stvar temeljite parlamentarne diskusije in odločitev skupščine."
1,Hvala.
1,Hvala.
2,Gospod Magajna.
1,Spoštovani!
10,Delegatsko vprašanje se nanaša na usklajevanje denarnih nadomestil za brezposelne.
28,"V bistvu ponavljam delegatsko vprašanje poslanke gospe Sonje Lokar, ki ga je zastavila 28. avgusta 1991 in vsaj do včeraj, ko sem z njo govoril, ni prejela odgovora."
17,Zaradi zelo pereče problematike usklajevanja denarnih nadomestil prosim Izvršni svet za čimprejšnje pojasnilo in seveda tudi ukrepanje.
25,"Po 24. členu zakona o zaposlovanju in zavarovanju za primer brezposelnosti, se denarna nadomestila usklajujejo z gibanjem povprečnih osebnih dohodkov vseh zaposlenih v Republiki Sloveniji."
8,Nadomestila naj bi bila zadnjič revalorizirana decembra 1990.
33,"Povprečni mesečni dohodek se je, npr. v prvih petih mesecih povečal za 22%, da ne omenjam porasta življenjskih stroškov, ki naj bi se po podatkih v prvih sedmih mesecih dvignili za 64 odstotkov."
43,"Izvršni svet ponovno sprašujem, zakaj ni prišlo do sprotnega usklajevanja nadomestil z rastjo povprečnih osebnih dohodkov in hkrati tudi v imenu sindikata nezaposlenih dajem pobudo, da se v najkrajšem času revalorizirajo nadomestila v skladu z zakonom o zaposlovanju in zavarovanju za primer brezposelnosti."
1,Hvala.
3,Dr. Drago Plešivčnik.
28,"Doslej sem potrpežljivo trikrat čakal, da bi prišli do zadnje točke dnevnega reda, kjer so predvidene pobude in vprašanja delegatov, na katere odgovorov ne pričakujemo na tisti seji."
14,"Vi pa sami veste, kako z dnevnim redom pridemo na nekem zasedanju do kraja."
27,"Zato bi predlagal, da ta princip spremenimo v tem smislu, da so tudi aktualna vprašanja dopustna na začetku seje, če že tudi ne pričakujemo odgovora na to."
16,"To morda iz prizanesljivosti do tistih, ki gotovo na vsa aktualna vprašanja ne morejo neposredno odgovoriti."
23,"Če pa to ne gre, potem pa naj se ta inštitucija uvede na koncu vsakega zasedanja ne glede do katere točke bom prišli."
81,"Ker pa ne vem, kako se boste opredelili do mojega predloga in tako kot z ene in druge strani ta dogovor kršimo in ker sem pred tednom vložil to delegatsko vprašanje, ki je za naše področje na nek način aktualno, pa nanj nisem dobil odgovora, bom zato začel s tem zadnjim grehom in trajnih strahom, ki je bil domiselni naslov članka, ki ga je uporabil novinar, ko je v Večeru poročal o zadnjih dogajanjih za jezom akumulacijskega jezera Hidroelektrarne Koralpe - Golica."
19,"Naslov združuje izjavo avstrijske ministrice za okolje gospe Marlis-Fleming, ki se je tako izpovedala o svojem obisku v Sloveniji."
38,"Strah se preveša v stalnost pri ljudeh pod jezom, ko se je zemlja v zadnjih mesecih kar dvakrat potresno stresla z epicentrom samo nekaj desetin metrov od pregrade in potrdila domnevo o povečani potresni nevarnosti pri polnem jezu."
3,In kot zadnje.
19,"Naša opozorila Zelenih, ki so jih nekateri ocenjevali kot diletantsko vpitje periferije, pa tudi stališča naše skupščine niso zalegla."
39,"Jez se je začel polniti, nevidne razpoke na dnu pa so požrle toliko vode, da so prestrašile celo sicer zelo samozavestne graditelje, ki so nadaljnje polnjenje jezu preložili do leta 1992, da bi dno med tem inicirali ali zaplombirali."
82,"Naša skupščina je 30. julija 1990 sprejela med drugim naslednji sklep: ""Republiški upravni organi in Elektrogospodarstvo Slovenije so dolžni celovito in tekoče seznanjati javnost in prizadete občane z vsemi postopki, ki tečejo v zvezi z gradnjo Hidroelektrarne Golica."" Tudi tokrat so bili krajani o pojavu razpok obveščeni posredno prek javnih medijev in ne od pristojnih državnih organov, kar je vznemirjenje samo še stopnjevalo in omajalo zaupanje v naše delo, saj smo jim po vrsti zagotavljali, da se to ne bo več dogajalo."
50,"Zato dajem tudi v imenu Kluba delegatov Stranke demokratične prenove Slovenije delegatsko pobudo, da Izvršni svet Skupščine Republike Slovenije ponovno zahteva varnostno preverbo pregrade Hidroelektrarne tako s strani naših kot avstrijskih strokovnjakov in o dogodku ter ugotovitvah oziroma rezultatih obiska na hidroelektrarni z naše strani celovito obvesti skupščino in javnost."
27,"Zahtevamo tudi, da Elektrogospodarstvo Slovenije kot partner avstrijske družbe Kelag pri izgradnji Hidroelektrarne Golica pojasni svojo vlogo pri obveščanju javnosti in ob tem in morebitnih podobnih dogodkih."
30,"Pričakujemo, da bo v podobnih primerih Izvršni svet Skupščine Republike Slovenije poskrbel za pravočasno celovito obveščanje, da prizadeti in celovita javnost ne bo prepuščena delnim informacijam, kot je bila sedaj."
32,"Skupščinski komisiji za varstvo okolja predlagamo, da na osnovi poročila Izvršnega sveta preveri novonastali položaj, predlaga ukrepe za zaščito prebivalcev Bistriškega jarka in Mute ter ugotovi odgovornost za prej omenjeno pomanjkljivo obveščanje."
18,"Posledice morebitnih napak, storjenih pri izgradnji in projektiranju avstrijske Hidroelektrarne Golica Koralpe v največji meri nosi prebivalstvo Slovenije."
12,"Prepričani smo, da slovenske oblasti delijo našo zaskrbljenost ob tem nepričakovanem pojavu."
37,"Zato od njih pričakujemo hitre in energične ukrepe, saj bomo sicer od te zastrašujoče elektrarne dobili le 0,29%, ponavljam, da ne bo pomote, samo 0,29% električne energije bo dobila, kot jo Slovenija potrebuje, iz te problematične elektrarne."
1,Hvala.
4,"Prosim, gospa Metka Mencin."
4,"Spoštovane poslanke, spoštovani poslanci!"
8,To vprašanje postavljam v imenu Liberalno demokratske stranke.
40,"V Neodvisnem dnevniku je bilo 6. septembra 1991 na 5. strani pod naslovom ""Gospodarsko sodelovanje z jugoslovansko armado"" objavljeno, da je Slovenija na dobri poti glede nadaljevanja in poglabljanja nekaterih novih poti gospodarskega sodelovanja z dosedanjimi partnerji v jugoslovanskem prostoru."
41,"V ta okvir, kaže, sodijo tudi nedavni pogovori ministra za industrijo in gradbeništvo gospoda Rejca s predstavniki generalštaba in jugoslovanske armade ter vojaškega podjetja v Beogradu, ki je bilo ustanovljeno, da bi razvijalo poslovni in podjetniški duh v industriji vojaške opreme."
3,In na koncu.
91,"Po vrnitvi iz Beograda je gospod Rejc za Slovensko tiskovno agencijo izjavil: ""Že ob zadnjem srečanju s predstavniki armade v Ljubljani je bilo dogovorjeno, da Slovenija ne bo izdelovala vojaške opreme, ki bi jo jugoslovanska armada lahko uporabila proti Sloveniji."" Ne bi komentirali izjemne ciničnosti te izjave po tem, ko ima Slovenija izkušnje z jugoslovansko armado, kakršno pač ima v situaciji, ko se na Hrvaškem dogaja to, kar se dogaja ter ob naporih Slovenije, da se v Evropi in svetu predstavi kot demokratična in miroljubna, v Evropo in svetu odprta država."
47,"Zahtevamo od ministra Rejca, da poslanke in poslance Skupščine Republike Slovenije podrobneje seznani z vsebino pogovorov v Ljubljani in Beogradu, z okvirji nadaljnjega sodelovanja z jugoslovansko armado na področju vojaške opreme ter z načinom razreševanja težav transporta in sodelovanja med republikami, ki so vključene v proizvodne verige."
1,Hvala.
1,Hvala.
2,Gospod Smole.
2,Ga ni.
2,Gospod Semolič.
2,Ga ni.
4,Zdaj sem pa jaz.
34,"Na 24. seji smo v našem zboru, jaz, v drugih dveh zborih pa še dva kolega, v imenu več podpisnikov vložili pobudo za ureditev razmer na področju produktivne in reproduktivne kinematografije v treh točkah."
34,"V pobudi smo tudi zahtevali, da se Izvršni svet do naslednje seje, torej do današnje, opredeli do pobude in potem naj bi o njej in o stališču Izvršnega sveta razpravljal skupščinski Odbor za kulturo."
36,"Glede na to, da nam Izvršni svet te opredelitve še ni posredoval, ga pozivam, da to stori do zaključka te, 25. seje, da bo tako odbor lahko opravil razpravo in nato na naslednji seji še zbor."
35,"Kajti, kot veste, smo tudi v tem zboru sprejeli sklep, da bomo na eni od sej v septembru, se pravi predvidoma bi morala biti še ena, imeli na dnevnem redu celovito razpravo o slovenski kulturi."
2,Gospod Gošnik.
32,"Ne pričakujem odgovora na svoje delegatsko vprašanje, saj sam želim odgovoriti dr. Voljču, ki je na 24. seji Družbenopolitičnega zbora, 28.8.1991, postavil znano poslansko vprašanje o kajenju v prostorih Skupščine Republike Slovenije."
21,"Žal, okoliščine niso dopuščale, da bi dr. Voljč odgovor na svoje vprašanje prejel že v teku prejšnje seje, kot je želel."
22,"Kot se verjetno spominjate, gre za znamenito proticigaretno vojno, ki jo je želel sprožiti spoštovani kolega, vendar se na srečo ni razplamtela."
56,"Kolega poslanca in druge vas lahko obvestim, da je generalni sekretar Skupščine Republike Slovenije v soglasju z vodstvom skupščine že izdal uredbo, ki obravnava prepoved kajenja v prostorih Skupščine Republike Slovenije in najvažnejšo za vsakdanjo sprotno uporabo torej razlika je ta, da se poslej ne kadi več v jedilnici, razen v tem neprezračenem prostoru pod stopnicami."
11,Takšno uredbo bo seveda mogoče razumeti kot zelo hud poraz kadilcev.
6,Na videz je to res tako.
15,"Toda vedeti je potrebo, da bomo kadilci zaradi tega postali bolj zdravi in torej močnejši."
31,"Res pa je še nekaj, davki na tobačne izdelke so zelo močan vir napajanja proračuna, njihova manjša uporaba, ki bo posledica te uredbe, bo verjetno kmalu terjala dodatno obdavčitev drugih izdelkov."
21,"Takrat se bo moral v vsem svojem sijaju izkazati protikadilski glasovalni stroj, kar bo pri kadilcih gotovo sprožilo dodatne čutne užitke."
21,"In končal bom s stisnjenimi zobmi, upam, da bodo zgledu Skupščina Republike Slovenije sledile tudi druge javne ustanove v državi Sloveniji."
2,Hvala lepa.
1,Hvala.
2,Gospod Buser.
1,Spoštovani!
5,"Kot vedno, bom zelo kratek."
5,Podajam pobudo in poslansko vprašanje.
28,"Pod pobudo bi prosil, da se na dnevni red vseh treh zborov naše skupščine uvrsti vsaj do sredine oktobra vprašanje o posebnih odpadkih in nevarnih snoveh v Sloveniji."
57,"In sicer, v tej točki dnevnega reda naj bi dobili informacije o naslednjem: kje so sedaj spravljeni ti odpadki in snovi; ali so v pripravi skladišča za te odpadke in snovi v Sloveniji in kje; kako in kje bomo izvajali reciklažo posebnih odpadkov; in kot četrto, kdaj je zadnji rok za sanacijo problema posebnih odpadkov na Jesenicah."
24,"Glede na to bomo odgovore seveda slišali, verjetno v kratkem, od našega kolega gospoda Jazbinška za reševanje te problematike, še posebno pa na Jesenicah."
5,Nadalje pa imam poslansko vprašanje.
39,"Tega podajam, ali v obliki pobude ali vprašanj, že danes tretjič pred tem zborom in sem sklenil od danes naprej, da ga bom podajal pri vsakem začetnem, uvodnem delu svojih besed v tej dvorani ali kakšni drugi dvorani skupščine."
56,"Torej, 31.5.1991, je potekel zadnji rok prepovedi spuščanja odplak, ki so obogatene s solfitnim jonom v reko Soro in Savo iz Tovarne celuloze in papirja v Goričanah pri Medvodah. 31.7. t.l. pa je potekel tudi rok enako izdane odločbe, ki prepoveduje izcejanje te snovi oziroma teh odplak v ti dve reki od republiškega vodno-gospodarskega inšpektorja."
23,"Menim, da ta tovarna od slej naprej deluje nezakonito, zato prosim in zahtevam Izvršni svet in odgovarjajoča ministrstva, da ukrepajo v svojih možnostih."
18,"Tečen bom toliko časa, kot sem prej rekel, v tej dvorani, ali katerikoli drugi, da bomo to dosegli."
64,"Predlagam, da se uredi takojšnja sanacija tega problema, kar sicer ni mogoče, če niso tega mogli ukreniti v desetletjih, saj tam delujejo že stroji, ki so stari 110 let, spuščajo odpadne snovi 38 odstotkov lesne mase po vodah, kar je tudi njim v škodo, povzročajo tvorbo sluza po Sori in Savi tja do Litije, povzročajo gnitje na rečnem dnu in še in še problemov."
15,"Torej, ali takojšnja sanacija, ali opustitev dela proizvodnje, ki to povzroča ali pa takojšnje zaprtje."
13,"Po vsej verjetnosti bo ministrstvo gospoda Rejca prvo tisto, ki bo moralo ukrepati."
17,"Zato, prosim, pa že ali do končanja te seje ali vsaj do prihodnje seje, za jasen odgovor."
8,"Vljudno prosim, ker drugače ga bom tudi zahteval."
2,Hvala lepa.
20,"Gospod Capuder bo odgovoril na moje vprašanje in s tem najbrž tudi na pobudo, ki je bila na prejšnji seji."
6,"Odgovor, gospod podpredsednik, je zelo lahek."
25,"Mi smo pripravili informacijo, ki je šla sedaj na Odbor za družbene dejavnosti in bo na naslednji seji vlade in potem bo šla v skupščino."
11,"Verjetno gospod Peršak sam ve, da te reči potrebujejo neko proceduro."
3,To je eno.
43,"Drugo pa, stanje v kinematografiji se dejansko spreminja iz dneva v dan, tu mislim predvsem na problematiko, denimo Viba filma in tudi drugih, tako da smo čakali še na nekaj informacij in v bistvu vsega tudi nismo mogli dati, ker je objektivno nemogoče."
14,"Kar smo pa zapisali, bo pa skupščina v čim krajšem času dobila v roke."
2,Hvala lepa.
1,Hvala.
2,Zgledna informacija.
2,Gospod Pintar.
2,Hvala lepa.
41,"Najprej bi vas rad obvestil, da sva s kolegom Kreftom in še nekaterimi, prejšnji teden obiskala tisto polomijo, imenovano odpadki na Jesenicah in sva vložila podobno vprašanje kot gospod Buser in v celoti podpiram tudi to, kar je on tu rekel."
12,"Vprašanja ne bom ponavljal, ker gre za isto stvar kot je vloženo."
41,"Sam bi pa rad postavil tole poslansko vprašanje: vemo, da je zadnji teden avgusta gospod Šešok v vladi predlagal, da vlada odobri 300.000 dolarjev za stroške obiska gospoda Sachsa in njegove ekipe in dobil tudi seveda pozitivni odgovor na to zahtevo."
28,"Hkrati pa na vsa vprašanja, ki smo jih postavili, koliko je za svoje dvomljive usluge v vladi dobil gospod Sachs, predsednik vlade gospod Peterle dosledno odgovarja, da nič."
36,"Ker sem mu pripravljen verjeti, prosim gospoda Šešoka za precizen odgovor med to sejo: kam so šli ali kam so namenjeni dolarji, ki jih je vlada na tej svoji seji namenila za tako imenovane Sachsove obiske."
2,Hvala lepa.
1,Hvala.
2,Gospod Pahor.
2,Hvala lepa.
44,"To vprašanje postavljam zato, ker manjka gospod Smole, ki bi bil sicer pred menoj in zato, ker delim vaše skupno upanje, da je gospod Peterle danes še prisoten, jutri ga zagotovo ne bo, ker bo na nekem mednarodnem obisku, ki utegne biti zelo koristen."
31,"Je pa jutri na dnevnem redu Komisije za mednarodne odnose tudi njegov obisk v Združenih državah in ker jutri ne bo na to vprašanje mogel odgovoriti, upam, da bo lahko danes."
57,"To vprašanje postavljam brez zadrege, ker vsi dobro veste, da sodim med tiste poslance, ki zelo stimulirajo obiske predstavnikov slovenske vlade v tujini - drugače si ne znam predstavljati doseganje zunanjepolitičnih ciljev - vendar vse mora imeti nek raison in po tem raisonu sprašujem: s kakšnimi konkretnimi rezultati opravičuje gospod ministrski predsednik Peterle enotedenski obisk v Združenih državah Amerike?"
41,"To še zlasti zato, ker se je v tem času zgodila Haaška konferenca, ker se tako sicer v Sloveniji ukvarjamo z vrsto gospodarskih, socialnih in drugih problemov, ker prihaja do eskalacije nemirov v sosednji Hrvaški in tako dalje in tako dalje."
5,To vprašanje zastavljam zelo resno.
33,"Imam pa še podvprašanje: zakaj tudi tokrat gospod ministrski predsednik podcenjuje Komisijo za mednarodne odnose in ne meni, da bi bilo pravilno, da pomemben obisk v Združenih državah Amerike predstavi članom zunanjepolitičnega odbora."
36,"Prvič zato, ker je to mesto, kjer smo poslanci vseh političnih sil, zastopanih v parlamentu in drugič zato, ker smo se dogovorili in stoji aksiom, da se zunanja politika določa v parlamentu, izvaja pa jo vlada."
14,"Vendar, ko gre za pomembne zunanjepolitične obiske, jih je vendarle treba uskladiti v parlamentu."
14,"Edino, če bo gospod Peterle odgovoril, da tukaj ni šlo za pomembne zunanjepolitičen obisk?"
2,Hvala lepa.
2,Aleksandra Pretnar.
57,"Moja pobuda sicer ni taka, da bi bil možen odgovor nanjo že danes, ker pa vsi pobudniki in spraševalci izkoriščajo to prvo točko, jo bom tudi jaz in dajem tole drobno pobudo: Ministrstvu za zdravstvo in socialno varstvo predlagam, da razmisli o smotrnosti ukrepa, da je tudi za večino zdravil kar 85% z negativne liste potreben recept."
42,"Za mnoga zdravila z negativne liste je potrebno plačati polno ceno, poleg tega pa je zanje potrebno imeti še recept, kar pomeni najprej čakanje v čakalnici na vrsto, potem še plačilo participacije za obisk pri zdravniku, ki se bo menda še povečala."
46,"Če torej seštejemo vrednost najmanj dveh ur, ki jih izgubimo za obisk pri zdravniku, plačilo participacije za obisk pri zdravniku in nazadnje še polno ceno zdravila, kot je, npr. heksoral raztopina za izpiranje ustne votline, ne gre več za preplačilo zdravila, ampak že kar za ironijo."
27,"Predlagam, da ministrstvo ponovno razmisli oziroma naredi diferenciacijo med zdravili z negativne liste, za katere je potreben recept in med tistimi, ki jih lahko kupimo brez recepta."
2,Hvala lepa.
2,Gospod Halb.
1,Spoštovani!
7,Za danes imam dve bolj razvedrilni pobudi.
7,"Hvala lepa, da dobro napreduje barvanje jezdecev."
22,"Bi vprašal, pa ga ne vidim zdaj, predsednika Sveta RTV Slovenije, gospoda Šeligo, ker menim, da je bilo vprašanje lahko njemu naslovljeno."
23,"S kabelskimi zamenjavami na RTV Slovenija je zavel nov duh v RTV programe, po drugi strani so pa aviza posameznih oddaj ostala stara."
75,"V duhu zaščite slovenske himne predlagam, ker menim, da je bila uporabljena kot glasbeni avizo za osrednjo informativno oddajo prej, preden je ta parlament inauguriral kot slovensko državno himno, da se tista elektronska grafična pravljica umakne kot vizualna spremljava tej himni, ali da se himna umakne in, če je kakršnakoli možnost, naj spodbudi oziroma inicira, prek urednika ali ustreznih uredništev nove natečaje za oblikovanje novih grafičnih podob, recimo TV dnevnika, Zrcala tedna, Žarišča in Omizja."
26,"Pa še eno, bolj ekonomsko vprašanje: namreč, RTV Slovenija je prešla na nov sistem pobiranja naročnine, to je, vsak mesec pošljejo položnico oziroma talon ali račun."
21,"Sprašujem ali kdo spremlja učinke nepravočasnega plačevanja na tak način in kakšne bodo posledice, sankcije in pa predvsem bodoče nove podražitve?"
18,"Namreč, svet RTV je seveda avtonomna inštitucija, ki nima vladne podpore v denarju, sedaj pa mora ekonomsko poslovati."
14,"Vendar tudi to se da ugotoviti, da se s temi položnicami da lepo manipulirati."
44,"Torej ne plačaš mesec, dva, ker ni nobenega ugovora, nobenega opomina, nobenega izključevanja TV sprejemnikov, lahko tudi nekateri s tem delajo kakšne transakcije in drugi smo vsi enako krivi in prizadeti, ko svet RTV ugotavlja, da denar več ne zadošča in predlagajo novo podražitev."
44,"Sprašujem se, ali bodo tu drastične sankcije, da nam bo kdo pošiljal opomine, da bo hodil izterjevat in pa, kako je po tistih 270,00 din. takojšnje plačevanje naročnine vplivalo na novo to podražitev na 360,00 din., ko so enako prizadeti pošteni in nepošteni plačniki?"
2,Hvala lepa.
1,Hvala.
4,Gospod Battelli je prosil.
2,Hvala lepa.
7,"Jaz sicer nimam vprašanja, imam pa pobudo."
10,"Zdi se mi dosti nujna stvar, zato jo tudi dajem."
26,"Veliko ljudi je v Sloveniji prepričanih, da ima slovensko državljanstvo, v resnici tega državljanstva nimajo in narobe, veliko ljudi, ki ima državljanstvo misli, da ga nima."
24,"To se dogaja pri nas in povzroča seveda zmedo, vznemirjenje, nepotrebno izgubo časa na matičnem uradu oziroma na uradih, kjer se te stvari rešujejo."
46,"Zato predlagam, da matični uradi oziroma uprave za notranje zadeve, občinske, obvestijo poimensko s pismom na dom ljudi, ki nimajo državljanstva in jih povprašajo, ali hočejo ali nočejo ali kakorkoli, da vedo, da ga nimajo in da se to tudi objavi, da to delajo ti uradi."
29,"Tako da se stanje o tem vprašanju umiri, da so tudi vsi, ki nimajo državljanstva, pravočasno o tem obveščeni in lahko gredo, če hočejo vložiti prošnjo za pridobitev državljanstva."
6,Ta rok se neha menda decembra.
11,"In narobe veliko ljudi gre tja, ki pa že imajo državljanstvo."
2,Hvala lepa.
2,Hvala lepa.
14,"Moram vas opozoriti, gospod Battelli, da oddate pisno, ker bo pobuda šla hitreje naprej."
2,Gospod Nemanič.
6,"Spoštovano predsedstvo, spoštovane poslanke in poslanci!"
10,"Torej, na mojo pobudo verjetno ni možno danes dobiti odgovora."
17,"V tej pobudi predlagam slovenski vladi, da prouči možnosti, da Republika Slovenija jamči varčevalcem za devizne vloge."
8,"Doslej je jamčila federacija, ki je ni več."
13,"Prebivalstvo Slovenije razpolaga z devizami, ki jih ima ali v bankah ali doma."
26,"Zaradi negotovosti, ki je rezultat večkratnih, objektivnih, pa tudi nerodnih odločitev ali Narodne ali poslovnih bank, ni velika količina deviz v funkciji gospodarstva, temveč neplodno leži."
23,"Najugodnejši devizni kredit, ki ga Slovenija želi najeti v tujini, da bi imela devizne rezerve za lastno valuto, je po 11% obrestni meri."
17,S trdnim jamstvom bi bilo prebivalstvo Slovenije motivirano položiti devize v banke po približno 7% obrestni meri.
6,Tako ugodnega kredita v tujini ni.
8,"Dejstva pa kažejo, da potrebujemo svojo valuto takoj."
11,Denarna emisija v Beogradu je načrtna ekonomska vojna tudi proti Sloveniji.
16,Dinar bo vsak trenutek papir brez vrednosti in s tem denarjem bo jug izpraznil slovenska skladišča.
8,Ostali bomo brez blaga in z neuporabnim denarjem.
