17,"34. člen, Jaša Zlobec, v 34. členu in nadaljnjih členih se izraz ""pokrajina"" zamenja z izrazom ""okraj""."
21,"Izraz ""pokrajinski"" označuje po zakonu določeno geografsko območje in to ni določena družbenopolitična skupnost, okraj pa to v svojem smislu je."
19,"Ta izraz, torej ""pokrajinski"", je določen tudi v 381. členu ustave Republike Slovenije in ga zato nima smisla spreminjati."
23,"Če bo spremenjena ustava in se termin zamenja, potem mi lahko na tej podlagi spreminjamo tudi terminologijo v zakonih, ki temeljijo na ustavo."
2,Umika amandma.
1,Hvala.
29,"37. člen, v 8. točki se črta besdilo ""o kriterijih in načinu nabave orožja za potrebe državnih organov, teritorialne obrambe in narodne zaščite"" in sega prenese v 36. člen."
6,Tu gre za izjemno velike vrednosti.
15,"Sami smo soočeni ob debati o proračunu z enormnimi milijardami odločati posameznik, ampak kolektivno telo."
17,"Mislim, da se tukaj vsi strinjate, da je s tem samo omogočena višja stopnja zanesljivosti, nadzora itd."
10,Kot skrbni gospodarji boste brez kakršnihkoli dvomov potrdili ta amandma.
35,"Kljub dobrim željam moram Jaši Zlobcu reči, da Izvršni svet tega predloga ne sprejema, preprosto zato, ker ta določba daje republiškemu upravnemu organu, pristojnemu za obrambo, le pooblastilo, da določa kriterije in način nabave orožja."
11,"To pa ne pomeni, da sami odločamo tudi o obsegu nabav."
7,"Skratka, mi imamo samo tehnologijo realizacije tega."
21,"Kaj, koliko bomo kupili, pa odločate vi skozi proračun oziroma Predsedstvo kot nam je nadrejen organ, ko gre za to področje."
5,Zato je taka sprememba nesmiselna.
16,"Teoretično se lahko zgodi, da bomo celo izglasovali, da jim ne odobrimo sredstev, glede na kriterije."
5,Ali še kdo želi razpravljati?
34,"Kdo je za amandma Jaše Zlobca - v 8. točki se črta besedilo: ""o kriterijih in načinu nabave orožja za potrebe državnih organov, teritorialne obrambe in narodne zaščite"" in se ga prenese v 36. člen?"
1,Proti?
1,Vzdržani?
7,"Ugotavljam, da ta amandma ni bil sprejet."
24,"Samo kot obvestilo, vi pa imate v gradivu, so še amandmaji k 43., 45., 42., 55. členu, ki jih pa niso vlagali naši poslanci."
6,Mi imamo amandma k 56. členu.
12,To je 20. amandma od 36-ih in smo dobro polovico že zaključili.
12,Predlagatelj Jaša Zlobec v imenu Liberalno-demokratske stranke umika amandma k 56. členu.
37,"61. člen, predlagatelj Jaša Zlobec, Liberalno-demokratska stranka: Zadnji stavek petega odstavka se spemeni, tako da se glasi: ""aktivna vojaška in civilna oseba v stalnem sestavu teritorialne obrambe ne sme biti član vodstva ali organov nobene politične organizacije""."
11,Tu imamo potem še tudi amandma Iva Daneva v dveh izvedbah.
4,Najprej amandma Jaše Zlobca.
9,"Naše stališče je zopet zelo jasno, preprosto in razumno."
14,Besedilo predloga zakona namreč preveč omejuje osebno svobodo ljudi v stalnem sestavu teritorialne obrambe.
11,"Menimo, da je besedilo amandmaja zadostno varovalo zoper politizacijo oboročenih sil."
24,"Bolj kot politična pripadnost oseb v stalnem sestavu in za depolitizacijo oboroženih sil je pomembno to, da znotraj njih ne deluje nobena politična organizacija."
17,Mogoče bi gospod Kacin kar v zvezi s še ostalima dvema amandmajema na ta člen kaj povedal.
16,"Namen predlagane določbe je, da se v stalnem sestavu teritorialne obrmabe zagotovi poleg departizacije tudi depolitizacija."
29,"To je stvar, na kateri Republika Slovenija vztraja v odnosu do JLA, in mislim, da moramo biti korektni tudi pri nas in speljati depolitizacijo tudi v naši teritorialni obrambi."
34,"V prehodnem obdobju bo treba popolniti ta sestav tudi z aktivnimi vojaškimi osebami iz sedanjih obroženih sil, zato bo pa treba zagotoviti vse najnujnejše omejitve, da ne bi prišlo do nove politizacije oboroženih sil."
22,"Mi imamo ta hip na ozemlju Jugoslavije stranke, katerih političnih cilji so v popolnem nasprotju s plebiscitarno dogovorjeno odločitvijo tukaj v Sloveniji."
23,"Vse socialistične države, ki so opravile spremembo v preteklem času, so izvršile poleg departizacije tudi dosledno depolitizacijo in na tem vztrajamo tudi mi."
15,"Isto velja tudi za odločitev posameznika, ali je pripravljen sprejeti službo pod primerjavo, ampak vseeno."
11,"Če hoče iti kdo v živilsko stroko, mora izpolniti higienski minimum."
15,"Za teritorialno obrambo oziroma naše oborožene sile veljajo nekaj podobnega, podobna zahteva za totalno depolitizacijo."
40,"To pa ne pomeni, da v prihodnje, ko bo Slovenija resnično konstituirana kot samostojna država, tako kot so v vseh demokratičnih državah na Zahodu to storili, postopoma omogočimo tudi omejeno politično delovanje in včlanjevanje posameznih aktivnih oseb do določenega nivoja."
13,"Zaenkrat pa smo v fazi, ko je to po naši oceni nujno potrebno."
18,"Tu je sedaj še Ivo Daneu, kjer gre še za bolj pomembno: črta se zadnji stavek petega odstavka."
10,"Jaša Zlobec ga spreminja, medtem ko ga Ivo Daneu črta."
8,"Če bi bilo po mojem, bi vse črtal."
5,V principu sem proti vojski.
17,"Če jo že moramo imeti, potem bi vsaj lahko pustili nekaterim, saj tu ne gre za vodilne."
15,"Vodilni sigurno ne smejo biti ne iz DEMOS-a, ne iz vrst socialistov, ali koga drugega."
22,"Gre za tiste ostale - npr. za kakšnega skladiščnika, ali pa ne vem koga, ki je verjetno lahko v prostem času določenega prepričanja."
6,Zaradi tega smo mi vložili tole.
11,Pri oznakah pa bi verjetno lahko poseben zakon določal te oznake.
6,Drugače pa jaz ne bom vztrajal.
10,"Če bi pa osebno glasoval, bi bil pa proti zakonu."
19,"Tole, kar je omenil gospod Daneu, (ali je to amandma k 61. členu, peti odstavek) na to nisem odgovoril."
13,Po predlogu zakona določa oznake v terotirialni obrambi Izvršni svet Skupščine Republike Slovenije.
20,"Če bi bil predlagani amandma sprejet, bi s tem že prejudicirali, da ima Republika Slovenije oborožene sile, torej ta termin."
15,V predlogu zakona o obrambi in zaščiti pa se ureja le obstoječa oblika obrambnega organiziranja.
15,"Odločitev, ali Republika Slovenija ima ali nima svojih oboroženih sil, pa je prepuščeno novi ustavi."
14,"Tako, da bi bilo to prejudiciranje, in zaradi tega mi tega ne moremo sprejemat."
7,Bi imel še kdo kakšno tehtno pripombo?
4,Tu so trije amandmaji.
11,"Verjetno je prav, da najprej glasujemo o amandmaju pod zaporedjem b)."
13,"Poglejte še enkrat, predlagatelj je Ivo Daneu, črta se zadnji odstavek petega odstavka."
9,Kdo je za amandma Iva Daneua (k 61. členu)?
0,.
0,.
0,.
5,Ta amandma torej ni sprejet.
17,"Sedaj še: zadnji odstavek petega odstavka se spremeni tako, da se glasi, kot je predlagal Jaša Zlobec."
9,Kdo je za amandma Jaše Zlobca - k 61. členu?
0,.
0,.
0,.
6,Tudi ta amandma ni bil sprejet.
8,"7. odstavek se spremeni tako, da se glasi:"
19,"""Oznake pripadnosti in činov ter položajne oznake v teritorialni obrambi Republike Slovenije določa zakon o oboroženih silah Republike Slovenije""."
11,"Kaj je gospod Kacin v zvezi s tem povedal, ste slišali."
5,Izvršni svet ga ne podpira.
4,Kdo je za amandma?
0,.
0,.
0,.
5,Tudi ta amandma ni sprejet.
21,"23. točka, to je poglavje o narodni zaščiti, s členi 64 in 71 smo že opravili, tako da tega nismo sprejeli."
4,Sedaj smo 80. členu.
48,"Predlagatelj je Izvršni svet: v drugem odstavku 80. člena se doda na koncu besedila stavek: ""Če varnostni organ odkrije dejavnost v skladu s tem členom izven oboroženih sil in upravnih organov pristojnih za obrambne zadeve, o tem obvesti pristojne organe za notranje zadeve, ki izvedejo potrebne varnostne ukrepe."
17,Potem imamo pa tu tudi v 80. členu amandma Jaše Zlobca: ta člen se v celoti črta.
17,"Ker gre seveda za ostrejšo obliko, bomo najprej razpravljali o amandmaju Jaše Zlobca, da se to črta."
11,"Torej brez dvoma gre za daleč, daleč najpomembnejši amandma od vseh."
137,"Gre namreč za člen, ki uzakonja vojaško varnostno službo, ki ima celo večje pristojnosti od varnostno-informativne službe, se pravi od UDBE, kar je po moje nevzdržno in to nevzdrdžnost in nelagodnost je očitno občutil tudi Izvršni svet s tem svojim dodatkom k drugemu odstavku, ki sicer omilja popolno samopašnost vojaške varnostne službe znotraj Teritorialne oz. znotraj slovenske vojske, ampak jaz mislim, da glede na splošno slabe izkušnje s kakršnimikoli varnostnimi službami, če že imamo varnostno-informativno službo, in glede na to, da je Bavčar večkrat javno povedal, kako ta služba obvlada vse in bo obvladala tudi KOS, in glede na to, da se bo JLA umaknila in se bo s tem operativna moč KOS-a bistveno zmanjšala, ne vidim najmanšega razloga, da nam nakopljejo na glavo kar dve udbi, vojaško in civilno kot začetek in zametek nove slovenske države."
57,"Še toliko manj, ker vam lahko povem iz izkušnje, kot član komisije za nadzorstvo nad Bavčarjevo udbo, da smo seveda na milost in nemilost prepuščeni dobri volji Bavčarja in njegovih in bomo tudi tukaj, ne glede na to, koliko komisij bomo ustanovili v Skupščini, na milost in nemilost prepuščeni dobri volji Janeza Janše, Jelka Kacina in ostalih."
66,"Jaz tem fantom popolnoma zaupam, enim in drugim in tretjim, samo vsi vemo, da je težnja vsake varnostne službe, težnja k tajnosti, težnja nekontralabilnosti in podobnem in gledajo na to, da so po tem 80. členu imajo starešine in delavci varnostnega organa, skratka te vojaške udbe, enake pravice in pooblastila kot pooblaščene osebe organov za notranje zadeve, medtem ko člani Bavčarjeve udbe sploh nimajo teh pooblastil."
53,"S tem, če mi sprejmemo ta 80. člen, si bomo prej ali slej nakopali hudiča nad glavo in mislim, da ni nobene potrebe po tem, zlasti ker v 81. členu so dejansko vse možnosti s to vojaško policijo podane vse možnosti za varnost vojaškega prometa, vojaški red in disciplino itn., odkrivanje kaznivih dejanj."
30,"In že iz tega pristavka Izvršnega sveta, da mora varnostni organ tako in tako vse skupaj obvestiti pristojne organe za notranje zadeve, pomeni, da se iz tega zrcali slaba vest."
18,"To bom sicer jaz podprl, če ne bo šlo drugače, ampak lepo vas prosim, dajmo to črtati ven."
21,"Ne nakopljimo si te zgodovinske krivde, da bomo mi tisti, ki bomo novo tajno policijo ustanavljali, zlasti, ker je popolnoma nepotrebna."
1,Hvala.
16,"Verjetno bi bilo prav, da bi v zvezi z 81. členom kaj povedali, ker se povezuje."
37,"Samo citiral bi ga: ""Teritorialna obramba ima vojaško policijo za varnost vojaškega prometa, za vojaški red in disciplino in za odkrivanje kaznivih dejanj v teritorialni obrambi, ki se preganjajo po uradni dolžnosti."" Mislim, da to popolnoma zadošča."
15,Za ostalo nam pa zadošča Bavčarjev sekretariat za notranje zadeve in njegova varnostno informativna služba.
36,"Še enkrat poudarjam, ker je Bavčar večkrat decidirano izjavil, da imajo kontrolo v svojih rokah, mi smo šele naknadno zvedeli, da obstajajo neki zametki tega, kar zdaj tukaj tako vehementno skozi odprta vrata vstopa v Slovenijo."
1,Hvala.
2,Gospod Kacin.
3,Zadeva je taka.
5,Ne rojeva se nič novega.
12,Varnostni organ v Sekretariatu za ljudsko obrambo je obstajal tudi že doslej.
9,Zdaj se stvari samo urejajo na veliko boljši način.
40,"Vsi se boste spomnili časov, ko so iz našega sekretariata za ljudsko obrambo odšle nekatere aktivne starešine JLA, delavci kontraobveščevalne službe, ki so imeli tukaj svoje določene naloge in ki so delovali po navodilih, ki so za našo republiko nesprejemljiva."
31,"V sleherni ureditvi z oboroženo silo obstajata dve varnostni službi, prva, ki je pristojna za javno in splošno varnost, in druga, ki je pristojna za dogajanje oziroma delovanje v oboroženih silah."
28,"Torej tudi po sedanji ureditvi imamo varnostni organ v teritorialni obrambi in ga imamo v pristojnem organu za obrambne zadeve, se pravi v Republiškem sekretariatu za ljudsko obrambo."
35,"S predlaganim amandmajem Izvršnega sveta Skupščine Republike Slovenije k drugemu odstavku 80. člena, pa se še natančneje razmejuje pristojnost med organi za notranje zadeve ter varnostnim organom v republiškem upravnem orgnu, pristojnem za obrambne zadeve."
24,"Kar zadeva očitek Jaše Zlobca, da ima varnostni organ sekretariata za ljudsko obrambo večja pooblastila kot organ o notranjih zadevah, to enostavno ne drži."
30,"Mi sprejemamo predlog, da ista merila, ki veljajo za službo državne varnosti, veljajo tudi za naša varnostni organ in nobena druga merila in nobena druga navodila ali pa tajni predpisi."
5,To je bistvo te zadeve.
28,"Hkrati pa tako, kot je imenovan organ za nadzor službe državne varnosti, komisija za obrambo Skupščine Republike Slovenija prevzema tudi to nadzorno funkcijo nad delom naše varnostne službe."
31,"Skratka, v imenu Izvršnega sveta moram nasprotovati črtanju tega odstavka, hkrati pa v imenu Izvršnega sveta predlagam, da se doda tisti člen, ki uvaja nadzorno funkcijo s strani komisije za obrambo."
13,"In kar zadeva ta drugi del, ki se nanaša na ta 81. člen"
16,": ""S predlaganim amandmajem se iz pristojnosti vojaške policije v teritorialni obrambi izvzame vojaški promet"", je nesmotrno."
42,"Takrat, ko se vojaške kolone pojavijo na terenu, je normalno, da vojaška policija opravlja tudi nadzor nad temi vozili, ker sicer se bodo znašli v nemogoči situaciji, ko bomo iskali organi za notranje zadeve drug drugega za pomoč za obvladovanje takih razmer."
17,"Skratka, gre za povsem jasno dikcijo in jaz ne vidim razlogov, da bi prišlo do takih sprememb."
20,"Torej še enkrat povem, nasprotujemo črtanju celotnega člena, predlagamo pa dopolnilo k 80. členu in zavračamo amandma k 81. členu."
1,Hvala.
2,Slišali ste.
18,"Predlagam, da najprej glasujemo o amandmaju gospoda Jaše Zlobca in sicer, da se 80. člen v celoti črta."
4,To je njegov amandma.
11,"Kdo je za amandma Jaše Zlobca, da se 80. člen črta?"
3,Kdo je za?
1,Proti?
1,Vzdržanih?
0,.
4,Amandma ni bil sprejet.
5,In še amanddma Izvršnega sveta.
11,V drugem odstavku 80. člena se doda na koncu besedila stavek.
9,Kdo je za amandma Izvršnega sveta k 80. členu?
3,Kdo je za?
2,In proti?
2,Ter vzdržani?
10,"Ugotavljam, da je amandma Izvršnega sveta k 80. členu sprejet."
7,Sedaj je še amandma k 81. členu.
4,Gre za ta promet.
14,"Kako si kolega Kacin predstavlja, da bosta in vojaška policija in še Bavčarjeva policija."
26,"Ena bo pač urejala normalen promet in potem, ko se bo v ta normalen promet vmešal v vojaški promet, se bosta stepla vojaški in civilni policaj."
21,"Mislim, da je to zelo preprosta stvar, ker naš amandma hoče samo pomagati in poenostaviti celo zadevo, ne pa jo zakomplicirati."
6,"Skratka predlagam, da glasujete za amandma."
28,"Torej še enkrat povem, da Jaša Zlobec predlaga, da se odstavek spremeni tako, da v njem vojaška policija v teritorialni obrambi ne bo več pristojna za vojaški promet."
4,To pa je nesmisel.
18,"Če imamo vojaško policijo v neki vojaški koloni, potem je njena osnovna funkcija, da poskrbi za varen promet."
9,"Glede predlagatelja komisije za obrambo, da se glasi tako."
4,Ali v nadaljevanju soglašate?
7,"Ne vem, kateri amandma? 80. člen b)."
3,Komisija za obrambo.
11,"Ja, to sem že prej predlagal, to je amandma Izvršnega sveta."
9,"Slišali ste dvoje, pri 81. členu imamo dva amandmaja."
8,"Povedala sta pa, kako je s temi prevozi."
20,"81. člen - Jaša Zlobec še enkrat predlaga amandma, ki ga poznamo, da se prvi odstavek spremeni in glasi po novem."
9,Kdo je za amandma Jaše Zlobca k 81. členu?
1,Vzdržanih?
0,.
3,Amandma ni sprejet.
16,"Sedaj še amandma Komisije za obrambo: v 81. členu se dodata dva nova odstavka, ki glasita:"
0,.
17,"Predlagatelj zakonodajno-pravna komisija predlaga, da se amandma Komisije za obrambo uvrsti kot samostojni člen za 81. členom."
2,Kaj menite?
3,Ali se dopolni?
5,Je treba še kaj povedati?
12,"Če ne želi nihče več razpravljati, zaključujem razpravo in prehajamo na glasovanje."
17,"Kdo je za amandma Komisije za obrambo k 81. členu, s katerim se strinja tudi Izvršni svet?"
1,Proti?
1,Vzdržani?
0,.
8,"Ugotavljam, da smo amandma Komisije za obrambo sprejeli."
31,"K. 87. členu Valentin Prelovec predlaga amandma in sicer k predlogu zakona o obrambi in zaščiti, ki se dopolni z naslednjim tekstom: S tem 87. členom se strinja tudi Izvršni svet."
13,"To je eden izmed treh amandmajev, s katerim se je Izvršni svet strinjal."
1,Glasujmo.
9,Kdo je za amandma gospoda Prelovca k 87. členu?
1,Proti?
1,Vzdržanih?
8,"Ugotavljam, da je amandma k 87. členu sprejet."
50,"91. člen - amandma gospoda Valentina Prelovca, da se doda novi tekst 91. člena, ki se glasi: ""Zaščito in reševanje na morju izvajajo podjetja, zavodi in druge organizacije, ki opravljajo dejavnosti na morju ter v zvezi z morjem, splošne reševalne službe ter enotne civilne zaščite.' Doda se besedilo kot tretji odstavek."
2,Gospod Kacin.
17,"V 88. členu je določeno, da se za zaščito in reševanje na morju lahko organizira posebna služba."
28,"Z dopolnitvijo 87. člena, to kar ste ravnokar storili z izglasovanim amandmajem, je predviden tudi poseben ukrep zaščite in reševanja na morju, zato je predlagana širitev besedila nepotrebna."
6,Tega predloga Izvršni svet ne podpira.
1,Hvala.
2,Gospod Prelovec.
12,"Gre čisto preprosto zato, ker je naše morje za Slovence nekaj novega."
19,"Namreč mi se ne zavedamo važnosti zaščite tega morja, da se vsepovsod, kjerkoli more taksativno našteje zaščito tega morja."
1,Hvala.
3,"Prosim, gospod Kacin."
13,"To taksativno naštevanje ima vedno težave, da koga izpustimo in ne moremo uvrstiti."
36,"Če pa imamo v členu napisano, da se ustanovi posebna služba in se organizira lahko vse, kar se bo tudi v bodoče prijavilo oz. pojavilo, stlačimo pod ta zakon in je ta rešitev veliko bolj celovita."
6,Samo zato nasprotujemo sprejemu tega amandmaja.
1,Hvala.
2,Slišali ste.
2,Še kdo?
8,Potem lahko glasujemo o tem amandmaju gospoda Prelovca.
11,"Kdo je za amandma, s katerim se Izvršni svet ne strinja."
0,.
1,Proti?
0,.
1,Vzdržanih?
0,.
6,"Ugotavljam, da amandma ni bil sprejet."
6,Zdaj smo pa pri 125. členu.
8,Jaša Zlobec: črta se prvi odstavek 125. člena.
4,Bi utemeljil gospod Jakič?
1,Obrazložitev.
16,Gre namreč pri tem prvem odstavku 125. člena za ponovno uvajanje te predvojaške vzgoje v šole.
21,"Osnovne šole so seveda v ta namen oz. za obrambno vzgojo neprimerne, srednjih in visokih šol pa ne obiskuje celotna generacija."
13,Obramba pa naj bi bila tudi po vseh teh debatah namenjena celotni generaciji.
10,Dikcija je torej na nek način v nasprotju z ustavo.
24,"Morebitne potrebne akcije naj se izvajajo prek krajevnih skupnostih in občin v prostem času, seveda na račun sredstev za obrambo in ne za šolstvo."
22,"Šole mlademu človeku ne bi smele vsiljevati opredelitev, ki si jih mora ustvariti sam preko stikov z okolico, starši in javnimi mediji."
52,"Naj vam še povem, da sem zelo, na nek način prizadet glede tega člena, namreč sem eden tiste generacije, ki si je na visoki šoli uspela izbojevati, da je pouk obrambe in zaščite bil črtan iz učnega programa in pri tem nam je seveda tudi potem pomagal naš novi minister, gospod Vencelj."
40,"Zato bi vas prosil, da pozorno preberete še enkrat ta odstavek in da vidite, da tu gre za neko ponovno uvajanje tistega, za kar smo z novimi volitvami in to je pač na področju visokega in srednjega šolstva pozitivno doseženega."
2,Hvala lepa.
1,Hvala.
2,Gospod Kacin.
6,Prosim vas isto kot moj predgovornik.
9,"Namreč, da pozorno preberete, kaj piše v tem členu."
26,"Piše pa dobesedno tako: Šole posredujejo z izvajanjem svojih programov učencem splošno civilizacijska znanja o zaščiti, zlasti o osebni in vzajemni zaščiti ter vzgoji za mir."
22,"Z izvajanjem progamov posredujejo mladim tudi funkcionalna znanja, potrebna za opravljanje obrambnih in zaščitnih nalog v dejavnosti, za katero usposablja posamezna šola."
7,Nikjer ni termina predvojaška vzgoja niti pouk.
13,"Ne gre za usposabljanje za oborožen boj, ampak gre za splošna civilizacijska znanja."
17,"Če bomo mi sprejeli zasnovo nacionalne varnosti, potem je treba ljudem povedati, za kaj pri tem gre."
7,Tu je vzgoja za mir posebej navedena.
22,"Gre za ukrepe zaščite in reševanja in za tista znanja, ki jih človek v šolanju, v posameznih strokovnih šoli, tudi lahko dobi."
5,Dal bom neki konkretni primer.
18,"Pričakujem, da bo gradbenik v času šolanja na Srednji gradbeni šoli nekaj zvezel tudi o gradnji zaklonišč ipd."
9,"Skratka, to je treba vgraditi v programe teh šol."
26,"Ni pa nikjer zaslediti, da bi bilo napisano, niti ni naš namen, d bi za oborožen boj usposabljali v osnovni, še manj pa v srednji šoli."
22,"Zato imamo teritorialno obrambo z moško populacijo, ki se tam usposobi za oborožen boj in to ni vračanje predmeta na zadnja vrata."
7,"Prosil bi, da resnično zadevo tako razumete."
16,"Skoraj stoprocentno tako argumentacijo so dajali tisti, ki so doslej izvajali program obrambe na visokih šolah."
17,"Malo morate tudi pogledati stališča takratnih študentov, ko smo zahtevali in da se ta predmet ne vmešava."
22,"Če pa že nekdo želi, kot vi pravite, pridobiti te civilizacijske norme na področju obrambe in zaščite, pa naj to dela fakultativno."
1,Hvala.
20,"Čudi me, da sta bila tako Jelko Kacin kot Janez Janša absolutno za to, da se stara predvojaška vrže ven."
5,Tu je popolnoma ista zadeva.
18,"Tukaj je jasno kot beli dan napisano, da se v resnici predvojaška vzgoja na drugačen način uvaja nazaj."
8,Kaj ima zakon za obrambo opraviti s šolo?
19,"Prosim, saj to je civilizacijska sramota, če ta člen z vsemi štirimi ne leti ven, in to brez milosti."
9,"Kolegi, prosil bi, da se najperj zmenimo za terminologijo."
19,"Predvojaška vzgoja je bil predmet, dejavnost, ki so jo izvajali prej, predno je Jaša Zlobec bil v srednji šoli."
7,Sedaj je bil predmet Obramba in zaščita.
5,"Mislim, da govorita o njem."
4,Rad bi povedal naslendje.
14,"Naš sekretariat je zavzel načleno stališče, da se ne bo vmešaval v programe šol."
25,"Programe pripravijo šole same, ampak jutri bom od te stranke ponovno slišal, da otrok v času šolanja ne zve, da ima možnost alternativnega civilnega služenja."
11,To bo zvedel skozi ta predmet ali karkoli to že bo.
8,"Skozi različne predmete, ker je treba vsebino vgraditi."
5,Pogovarjajmo se o konkretnih rečeh.
5,Ali so splošna civilizacijska znanja.
14,"Ne govorimo o nobenem novem predmetu, tako kot je bilo zavestno tukaj skušano podtikati."
10,"Šolske oblasti odločajo o tem, na kakšen način in kako."
17,"Želimo pa, da se tudi tukaj napisana vsebina Vzgoja za mir ensotavno vgradi v programe posameznih šol."
50,"Ko je bilo pa govora o šolanju na visoki stopnji, ravno tako povem, da naš sekretariat ni v ničemer nasprotoval, da se te stvari vržejo iz programa in predmet Temelji splošne ljudske obrambe in družbene samozaščite, kakor ste ga poznali na visokih šolah pod predmet I in II, gre ven."
38,"Še vedno pa mislimo, brez da bi vztrajali pri tem, da je dobro, da recimo študentje Medicinske fakultete med ostalimi spoznajo tudi vlogo medicine v nenormalnih razmerah ali v vojni, da zvedo nekaj tudi o vojni kirurgiji ipd."
5,To je stvar Medicinske fakultete.
16,"To je stvar posameznih programov srednjih šol, ne da bi se mi vpletali v konkretno vsebino."
9,"Če dovolite, bom v to razpravo posegel še sam."
36,"Gospod Kacin ima seveda malo smole, da sem jaz učitelj srednje šole in da sem tudi eden izmed tistih, ki sem se zelo trudil, da te Obrambe in zaščite ne bi bilo več v srednjih šolah."
27,"Zaradi tega sm bil deležn tudi marsikatere negativne kritie, ampak moram povedati, da če on opozarja poslance na terminologijo, potem moram jaz njega na šolsko terminologijo opozoriti."
18,"Takoj, ko imamo opraviti s programom v šoli, potem to pomeni določen predmet, določeno število ur, določene učitelje."
7,Zaradi tega sem absolutno proti temu odstavku.
30,"Strinjal bi se pa, če bi prišel Izvršni svet s spremenjenim - tako kot je mogoče on povedal - stavko, na tak način, da bi bilo to možno pri katerem od predmetov."
15,"To je sestavni del 170-ih ali 180-ih ur določenega predmeta, ki gre pač za enoto."
4,To ni nič hudega.
23,"Mi več slišimo v srednjih šolah pri sociologiji, pri zgodovini, geografiji in ne obremenjevati - iskreno prosim vse poslance - šole ponovno s to vsebino."
22,"Komaj smo dosegli - uporabil bom izraz - v 45-ih letih ta odmik, sedaj ga pa hočemo pri drugih vratih spraviti nazaj v šole."
17,"Zato sem odločno proti in podpiram amandma, ki ga je tu gospod Jakič oziroma gospod Zlobec predložil."
35,"Opravičujem se, da tolikokrat pridem sem gor, ampak moram reči, da Sekretariat za vzgojo in izobraževanje ter telesno kulturo v dikciji tega člena ni opozoril, da to avtomatično pomeni, kot ste vi rekli, samostojen predmet."
4,Da se prav razumemo.
13,Na noben način ne želimo prejudicirati in zahtevati samostojnega predmeta ali karkoli podobnega.
22,"Če je to iz takega besedila razvidno, vi kot šolski delavec to poznate, potem predlagam, da izvršimo korekcijo oziroma damo drugačen predlog."
12,"Res bi želel, da ne odidemo s tega srečanja z napačnimi predstavami."
10,"Torej, to ni bil naš namen in še vedno ni."
19,"Tudi sam sem doživaljal ob konsultacijah, da je predmet Obramba in zaščita v šolah ravno k miru prisiljeval mlade."
19,"Vsakkdo, ki je tisti predmet in vsebino poslušal, se je ravno obratno opredeljeval, kot bi morala dati vsebina predmeta."
12,"Ne vem, ali je bila kriva vsebi na predmeta ali pa predavatelji."
34,"Opozoril bi vas, da ste kot predlagatelj zakona dali v ta člen, da šola posreduje z izvajanjem programov, vseibne in določene stvari, sami ste pa za mikrofonom omenili, da programe naj pripravijo šole same."
