50,"Potem teh predlogov skupne komisije ne smemo sprejeti, ampak moramo pri tem vztrajati pri naši prvotni odločitvi, da sprejmemo amandmaje in potrdimo amandmaje, ki jih je zbor že sprejel, kajti na ta način preprečimo, da bi bil prenos ali pa da preprečimo legiriziran prenos lastnine, kar pa ni naš namen."
9,"Prav je, da nihče iz prejšnje ureditve nima koristi."
23,"Poleg tega pa, prav tako sem uveljavljal na tej skupni komisiji, je nedokazljivo, kakšen je delež članarine in kakšen je delež drugih sredstev."
65,"Ker kdor koli hoče, tu ni nobene skrivnosti, naj vzame proračune republike ali pa drugih družbenopolitičnih skupnosti in bo vedno našel sredstva za delovanje DPO, za njihovo funkcioniranje in ne vem kaj še vse, tako da, na primer, če je DPO v dogovoru s temi državnimi organi, se dogovoril, da bo to leto to in to naredil, potem je dobil za svoje funkcioniranje pač sredstva."
52,"Hočem vam povedati, da tukaj ne bo mogoče, da bi upravni organ ločil, kaj je res strankinega, kaj pa je družbena lastnina in zato je edino prav in edino mogoče, tako da preprečimo ta način lastninjenja in da preprečimo oškodovanje Države Slovenije in tudi občin, ki bodo tudi dobile vrnjeno to premoženje."
2,Hvala lepa.
4,Želi še kdo besedo.
2,"Ne, hvala."
6,Zaključujem razpravo in dajem na glasovanje.
37,"Predlog skupne komisije vseh treh zborov, z dne 6.10.1992, in sicer kjer predlaga Zboru občin, da naj umakne amandma k 37. členu, ki glasi: Za 37. členom se doda nov naslednji novi členi a), b), c), č)."
4,Imate to pred seboj.
3,"Ja, prosim lepo."
13,"Ali je usklajevalna komisija obravnavala predlog vlade, da se razpolaganje spremeni v upravljanje."
11,"In še drugo, kako sta druga zbora o tej stvari razpravljala."
7,"Prosim poročevalca, da ne bo različnih tekstov."
2,Gospod Zakonjšek.
11,"Sem prepričan, da je bila pomotoma ta.... v tem zadnjem odstavku."
35,"Ta hip, gospod Starman, je zbor dobil obvestilo Družbenopolitičnega zbora, kjer nas obvešča: Zbor je bil seznanjen z redakcijskimi amandmaji k 37.c členu, kjer se v drugi vrsti zamenja beseda ""razpolagajo"" z besedo ""upravljajo""."
5,Napaka je nastala pri prepisovanju.
4,Predsednik dr. Ludvik Toplak.
1,Zadovoljen.
27,"No, prehajamo na glasovanje o predlogu skupne komisije v Zboru občin in sicer, da umakne amandma k 37. členu, ki je v točkah a), b), c), č)."
3,Kdo je za?
3,Je kdo proti?
4,Se je kdo vzdržal?
30,"S tem, ko smo se tako odločili, če zbor ne umika, potem ni treba da se izjavlja o predlogu skupne komisije, ki je predlagala ta umik in potem svoj amandma."
7,"Gospod Miloš Senčur, vi ste hoteli besedo."
1,Prepozno.
2,"Prosim, hvala."
7,S tem smo s to točko opravili.
19,"Zbor obveščam, da bo sledilo usklajevanje na skupni seji vseh treh zborov, če bo kdo dal predlog, gospod minister."
9,Če bo kdo dal predlog oziroma vlada dala predlog.
1,Drugo.
8,"Ker smo že prekinjeni, potem dajmo še končati."
