53,"Drugi amandma: 1., 2. in 3. člen predloga zakona naj se črtajo in nadomestijo z novim 1. členom, ki naj se glasi: Republika Slovenija se obvezuje kot garant na prvi poziv povrniti poslovni banki vsak znesek, ki bi ga poslovna banka kot garant morala plačati iz naslova izdanih garancij za zavarovanje izpolnitve obveznosti."
80,"In sicer: 1. Savskih elektrarn po najetih kreditih za dokončanje izgradnje Hidroelektrarne Vrhovo do skupnega maksimalnega zneska 38,188.000 nemških mark, povečanega za obresti in ostale stroške kredita. 2. ELES-Elektro Slovenije po najetih kreditih za dokončanje izgradnje Hidroelektarne Golica do skupnega maksimalnega zneska 31.400.000 nemških mark, povečanega za obresti in ostale stroške kredita. 3. Termoelektrarne Šoštanj po najetih kreditih za izvedbo projekta odžveplovanje dimnih plinov bloka 4 do skupnega maksimalnega zneska 130,000.000 nemških mark, povečanega za obresti in ostale stroške kredita."
32,"In 4. Nuklearne elektrarne Krško po najetih srednjeročnih kreditih za izvedbo letnega remonta, t.j. slovenski delež, do skupnega maksimalnega zneska 35 milijonov ameriških dolarjev, povečanega za obresti in ostale stroške kredita."
17,"Obrazložitev je tu že podal minister, jaz bom pa na hitro preletel samo glavne utemeljitve, in sicer:"
47,"1. Predlaga se, da se ti trije členi združijo zaradi racionalnosti samega teksta in da se, razen že omenjenih dveh investicij, t.j. ekološke sanacije Termoelektrarne Šoštanj in Hidroelektarne Vrhovo, razširi še na Hidroelektrarno Golica, kar pomeni obveznost Slovenije do avstrijskega partnerja še 31,4 milijona nemških mark."
28,"Gradnja Golice je v zaključni fazi in bo letos proizvedla že 2/3-ni letne proizvodnje, zato bi bilo z narodno-gospodarskega vidika neracionalno, da se obveznosti ne bi čimprej poravnale."
72,"Pri Nuklearni elektrarni Krško se je 1. maja letošnjega leta pričel remont in ker tekoči prilivi za plačano tokovino ne omogočajo izvedbe remonta, remonta pa se je že itak zavlekel, predlagamo, da se v zakon vključi tudi najetje kredita oziroma garancija v višini 25 milijonov ameriških dolarjev - to je slovenski del, s čimer bo zagotovljeno nemoteno izvajanje remonta in s tem njena pravočasna vključitev v energetski sistem Slovenije in njeno varno obratovanje."
29,"Nadalje finančni obseg projekta odžveplovanje dimnih plinov bloka 4 Termoelektarne Šoštanj znaša 150 milijonov nemških mark in ne 115 milijonov nemških mark, kot je to predlagatelj navedel v obrazložitvi."
15,Zato predlagam v novi 3. točki tega novega 1. člena znesek 330 milijonov nemških mark.
23,"Pri tem predstavljajo blagovni krediti 70 milijonov, finančni krediti 60 milijonov, medtem ko razliko z lastnimi sredstvi zagotavlja Termoelektrarna Šoštanj iz svoje amortizacije."
20,"Za dokončanje Hidroelektrarne Vrhovo je potrebno še 38,188 milijonov nemških mark, zato je potrebno znesek povečati še za 188.000 mark."
41,"Po moji oceni je potrebno v tem trenutku zagotoviti garancijo Republike Slovenije za najete kredite za tiste energetske objekte, ki so pred dokončanjem oziroma so iz ekoloških razlogov nujno potrebni za oskrbo z električno energijo in je potrebna ta ekološka sanacija."
40,"S tem amandmajem predlagam tudi istočasno črtanje 2. člena predloga zakona, ki se nanaša na investicije v kogeneracijo, oziroma kombinirano proizvodnjo toplote in električne energije, predvsem iz razloga, ki je bil tudi že omenjen, da ti projekti niso konkretno navedeni."
21,"In jasno, ker ni konkretnega projekta, tudi ni mogoče definirati konkretne višine sredstev, za katere naj bi dala vlada ustrezno garancijo."
35,"In še tretji amandma. 4. člen se nadomesti z novim 2. členom, ki naj se glasi: Posamične garancije za zavarovanje izpolnitve obveznosti Republike Slovenije izda minister za finance potem, ko so znani pogoji posameznih kreditov."
11,Obrazložitev: Predlagani amandma je posledica predlaganega drugega amandmaja k predlogu zakona.
2,Hvala lepa.
1,Hvala.
2,Slišali ste.
5,Ima še kdo kakšen predlog?
3,"Prosim, gospod Mak."
3,Hvala za besedo.
23,"Kot predstavnik industrije bi rad samo pojasnil svoj glas, da sem odločno za to, da se ta zakon v celoti, z amandmaji, sprejme."
15,"Se pa strinjam z vsemi obrazložitvami, ki jih je dal gospod minister, kot tudi kolega."
1,Hvala.
5,Besedo ima gospod Peter Starc.
1,Spoštovani!
21,"SDP podpira ta zakon, saj je bila na zadnji skupščini tudi dana z naše strani pobuda, da se pripravi poseben zakon."
25,"Ker pa je zakon pripravila tudi Vlada in pravijo, da sta si teksta precej podobna, bi predlagal, da ves nadaljnji zakonodajni postopek vodi pristojno ministrstvo."
39,"Ker pa predvideva zakon tudi garancijo za najetje kreditov za dokončanje Hidroelektrarne Vrhovo, predlagamo, da Vlada pri naslednji zakonodajni fazi posreduje poročilo o izvajanju programa sanacije Save, ki je bil iniciran ravno zaradi ustvarjanja pogojev za njeno energetsko izrabo."
23,"Eden od ključnih pogojev za pričetek obratovanja Hidroelektrarne Vrhovo, kot prvega izmed verige srednjesavskih elektrarn, je namreč izboljšanje kakovosti Save za en razred."
1,Hvala.
2,Hvala Peter.
23,"Tu te moram malo popraviti zaradi tega, ker smo mi sedaj seveda v končni fazi, razen ko bodo še nekatera usklajevanja med zbori."
1,Velja?
2,Podpora je.
12,Ali želi še kdo razpravljati in ali ima še kdo kakšen amandma?
11,"Če ni, bi zaključil razpravo in s tem tudi sprejemanje amandmajev."
21,"Predlagal bi, da bi mi o teh nekaj amandmajih tudi glasovali, potem bomo pa videli, če bo potrebno še kaj usklajevati."
16,"Skratka, da bi mi imeli to fazo, glede na podporo poslancev v zboru tudi za sabo."
1,Hvala.
13,"Najprej bi predlagal, da glasujemo o amandmajih, ki jih je predložila Zakonodajno-pravna komisija."
4,In to v paketu.
17,"K 1. členu: v prvem odstavku naj se besede ""inozemskih dobaviteljskih kreditov"" nadomesti z besedami ""tujih kreditov""."
19,"V 1. členu, v drugem odstavku naj se besedilo ""inozemske dobaviteljske in finančne kredite"" nadomesti z besedama ""tuje kredite""."
20,"Ter v 3. členu, v prvem in drugem odstavku naj se besede ""inozemske finančne kredite"" nadomesti z besedama ""tuje kredite""."
13,"Če bomo seveda sprejeli amandmaje gospoda Vukoviča, bo to tako in tako odpadlo."
17,"Samo mi ne moremo to umakniti - v tem je poanta, razen če predstavnik Zakonodajno-pravne komisije meni tako."
4,Gospod Avberšek ima besedo.
4,Želel bi samo pojasniti.
12,"Namreč, pri teh kreditih ne bi bilo dobro, da bi imeli omejitve."
27,"Danes je že v naslovu predlagano oziroma je prvi amandma - sprememba naslova, da ne govorimo samo o Ljubljanski banki, d.d., ampak lahko najamemo kredite tudi kje drugje."
19,"In končno ni nujno, da bo šlo samo za tuje kredite; morda bodo tudi domače banke sposobne dati kredite."
19,"Torej gre za najetje kreditov in mislim, da je to v amandmajih, ki jih je predlagal gospod Vukovič, zajeto."
33,"Smatram, da bi bili potem ti amandmaji v nasprotju in predlagam, da takih amandmajev ne sprejmemo, ker je to v amandmajih gospoda Vukoviča širše zajeto in je v bistvu to pravilnejše; mislim operativnejše."
1,Hvala.
1,Hvala.
2,Slišali ste.
3,"Predlagam, da glasujemo."
2,Ugotovimo sklepčnost!
15,"Kdo je za amandmaje k 1. in k 3. členu, ki jih predlaga Zakonodajno-pravna komisija?"
3,Je kdo proti?
4,Se je kdo vzdržal?
5,Malo nerodno je - sprejeto je!
6,"Ugotavljam torej, da smo to sprejeli."
34,"Sedaj imamo amandmaje, ki jih predlaga gospod Vukovič, in sicer: naslov zakona naj se spremeni tako, da se glasi: ""Predlog zakona o garanciji Republike Slovenije za najete kredite in izdane obveznice za energetske projekte""."
4,To je bolj prav.
13,"Prosim, da še enkrat ugotovimo prisotnost, ker bi potem s tem številom glasovali!"
2,Ugotovimo sklepčnost!
10,"Kdo je za prvi amandma gospoda Vukoviča, glede naslova zakona."
3,Je kdo proti?
4,Se je kdo vzdržal?
6,"Ugotavljam, da je prvi amandma sprejet."
56,"In tu je drugi amandma: 1., 2. in 3. člen predloga zakona naj se črtajo in nadomestijo z novim 1. členom, ki naj se glasi: Republika Slovenija se obvezuje kot garant na prvi poziv povrniti poslovni banki vsak znesek, ki bi ga poslovna banka kot garant morala plačati iz naslova izdanih garancij za zavarovanje izpolnitve obveznosti:"
27,"1. Savskih elektrarn, po najetih kreditih za dokončanje izgradnje Hidroelektrarne Vrhovo do skupnega maksimalnega zneska DEM 38 milijonov 188 tisoč, povečanega za obresti in ostale stroške kredita;"
28,"2. ELES, Elektro Slovenija, po najetih kreditih za dokončanje izgradnje Hidroelektrarne Golica do skupnega maksimalnega zneska DEM 31 milijonov 400 tisoč, povečanega za obresti in ostale stroške kredita;"
29,"3. Termoelektrarna Šoštanj, po najetih kreditih za izvedbo projekta ožvepljevanja dimnih plinov blok štiri do skupnega maksimalnega zneska DEM 130 milijonov, povečanega za obresti in ostale stroške kredita in"
28,"4. Nuklearne elektrarne Krško, po najetih srednjeročnih kreditih za izvedbo letnega remonta, slovenski del, do skupnega maksimalnega zneska 25 milijonov USA, povečanega za obresti in ostale stroške kreditov."
9,Obrazložitev ste slišali in tu je predlog tega amandmaja.
7,"Kdo je za amandma, naj prosim glasuje?"
3,Je kdo proti?
4,Se je kdo vzdržal?
7,"Ugotavljam, da smo tudi drugi amandma sprejeli."
35,"Imamo še tretji amandma. 4. člen se nadomesti z novim 2. členom, ki naj se glasi: Posamične garancije za zavarovanje izpolnitve obveznosti Republike Slovenije izda minister za finance potem, ko so znani pogoji posameznih kreditov."
4,Kdo je za amandma?
3,Je kdo proti?
4,Se je kdo vzdržal?
42,"Ugotavljam, da so vsi trije amandmaji sprejeti in ugotavljam seveda, da so amandmaji, ki smo jih predhodno sprejeli, predložene s strani Zakonodajno-pravne komisije, popolnoma brezpredmetni, ker teh členov ni več in jaz bi prosil, da bi vseeno z glasovanjem tudi to podprli."
11,"Kdo je za ugotovitev, da so ti amandmaji Zakonodajno-pravne komisije brezpredmetni?"
3,Je kdo proti?
4,Se je kdo vzdržal?
6,"Ugotavljam, da smo tudi to uredili."
14,Sedaj imamo še glasovanje o celotnem zakonu z novim naslovom in s sprejetimi amandmaji.
2,Ugotovimo sklepčnost!
3,Kdo je za?
3,Je kdo proti?
4,Se je kdo vzdržal?
13,"Ugotavljam, da je zbor sprejel predlagani zakon skupaj z amandmaji z večino glasov."
10,S tem smo mi tudi zaključili 3. točko dnevnega reda.
30,Prehajamo na 9. TOČKO DNEVNEGA REDA - POROČILO O DELU SLUŽBE DRUŽBENEGA KNJIGOVODSTVA V REPUBLIKI SLOVENIJI ZA LETO 1991 IN LETNI OBRAČUN SLUŽBE DRUŽBENEGA KNJIGOVODSTVA V REPUBLIKI SLOVENIJI ZA LETO 1991.
15,Gradivo je v obravnavo predložila Služba družbenega knjigovodstva v Republiki Sloveniji in ste ga prejeli.
45,"Gradivo je obravnaval Odbor za proračun in javne finance, ki je ugotovil, da je predloženo poročilo pripravljeno korektno, podan je pregled opravljenih del ter pomembnejše ugotovitve, problemi in nakazane rešitve pri preoblikovanju službe ter opravljanju nalog, ki jih je služba dolžna nadzorovati, kontrolirati in spremljati."
55,"Odbor je v razpravi o poročilu opozoril na sklep odbora z dne 3. in 5.12.1991 ob obravnavi predloga za izdajo zakona o službi za javne prihodke z osnutkom zakona, s katerim so zbori Vlado zadolžili, da do konca I. polletja 1992 v sodelovanju z drugimi inštitucijami pripravi predlog preoblikovanja Službe družbenega knjigovodstva v Republiki Sloveniji."
25,"Danes smo na klop prejeli mnenje Vlade Republike Slovenije, ki predlaga, da poročilo o delu Službe družbenega knjigovodstva in letni obračun za leto 1991 sprejmemo."
6,Želi predstavnik Službe družbenega knjigovodstva besedo?
2,Ga ni.
4,Želi predstavnik Vlade besedo?
9,Želijo poročevalci Odbora za proračun in javne finance besedo?
2,Pričenjam razpravo.
3,Kdo želi razpravljati?
4,Gospod Andrej Šter prosim.
41,"Torej, malo nerodno je, saj prej, če sem dobro razumel vašo pripombo, ni predstavnikov službe tukaj. (Povabljeni so bili.) Dolgo časa se nam je to poročilo vleklo po skupščinskih aktih, zato verjamem, da ga morda kdo od vas nima s seboj."
5,Jaz pokrivam tudi to področje.
26,"Sem poslanec, ki je bil voljen tudi v vseh enotah Službe družbenega knjigovodstva, zato sem seveda imel dolžnost, da ga temeljito preberem in imam nekaj vprašanj."
15,"Ne vem, jaz jih bom vseeno postavil, kadar bo odgovor, bo pač odgovor, če bo."
28,"Vprašanja se nanašajo predvsem na tisti segment poslovanja službe, ki se nanaša na preglede uporabnikov družbenih sredstev, kot se še kar po zakonu o Službi družbenega knjigovodstva reče."
5,Ta zakon je svojstven problem.
38,"Enega od vidikov je nakazal že naš Odbor za proračun in javne finance, ki je seveda pravilno ugotovil, da je služba skupaj z Vlado prevzela zadolžitev, da do včeraj, je ena ""kurioziteta"", oblikuje zakonski predlog ureditve davčne službe."
12,To ni bilo realizirano in to se lahko izkaže za precejšnjo pomanjkljivost.
28,"Iz poročila izhaja, da je služba opravila 1.708 inšpekcijskih pregledov in sicer jih je opravilo 128 inšpektorjev, po drugi strani pa je 50 revizorjev opravilo 29 revizijskih pregledov."
4,Rezultat ni ravno spodbuden.
11,"Sklepati je, da zakon o računovodstvu nalaga službi bistveno večje obveznosti."
15,"Namreč, podjetij, ki se morajo izkazati z revidiranim zaključnim računom, je sigurno več kot 29."
22,"Zanima me, kako je ta problem služba reševala v letu 1991 oziroma, kako se je izven službe to reševalo v letu 1991."
20,"Ker smo pa že v drugi polovici 1992. leta, bi me zanimala tudi projekcija reševanja tega problema v letošnjem letu."
19,"Del poročila govori tudi o 52 pravnih osebah, kjer je bil pregled opravljen zaradi statusne spremembe oziroma procesa lastninjenja."
22,"Zanima me, v koliko primerih je v teh pravnih osebah delavcem službe uspelo ugotoviti nepravilnosti in kako je služba ukrepala, če je."
22,"Če so podatki, me seveda močno zanima tudi, kako se je ta problem ali zmanjševal ali povečeval v dosedanjem delu leta 1992."
28,"Torej, ne glede na to, da odgovora ne bom prejel, seveda bom glasoval za poročilo službe, vendar z mentalno rezervacijo, da bom ta vprašanja zastavljal tudi v naprej."
1,Hvala.
1,Hvala.
3,Prosim gospod Erce.
4,"Spoštovani zbor, lep pozdrav!"
25,"Ker prihajam iz trgovine in nisem tako kot Andrej predstavnik v bistvu tudi delavcev Službe družbenega knjigovodstva, bo moj komentar k temu poročilu malo krajši."
34,"Vendar tako malo za ilustracijo: tudi sam sem začel svoje delo ravno v službi, tako da sem tudi z zanimanjem prebral, kaj po 20-tih letih, ko sem zapustil to službo, nekateri bivši kolegi delajo."
34,"Strinjam se z mnenjem Odbora za proračun in javne finance, da je dokaj korektno poročilo pripravljeno, vendar bi se dotaknil predvsem tega poglavja, ki govori o spremljanju teh statusnih sprememb in lastninskega preoblikovanja podjetij."
32,"Smatram, da kljub temu, kot so nam napisali delavci službe, da je zakonodaja malo še starojugoslovanska oziroma novo starojugoslovanska, malo nedodelana, smatram osebno da je služba na tem področju naredila bistveno premalo."
13,"Strinjam se s temi vprašanji, ki jih je pred menoj postavil gospod Šter."
49,"Tudi to, kar pač sem ter tja malo beremo ali gledamo po raznih teh medijih, me potrjuje oziroma pritrjuje mojim besedam, da sigurno, kljub temu, da pravijo, da je ljudi, ali kvalificiranih ali kakorkoli, v službi premalo, menim, da je slovenska Služba družbenega knjigovodstva na tem področju naredila premalo."
10,"Da pa ne bo samo kritika službe, bi še pohvalil."
39,"Predvsem smatram, zopet osebno in mislim, da tudi marsikdo izmed vas, ki uporablja usluge Službe družbenega knjigovodstva, bo mojim besedam pritrdil, da je eno od področij, kjer pa služba funkcionira lahko bi rekli skoraj brez napake, področje plačilnega prometa."
66,"Tudi, kolikor mi je uspelo prebrati ta akcijski program gospoda Prelovca, ki bo kasneje na dnevnem redu, tudi želijo obrtniki ali pa del njih, da bi se ta plačilni promet tudi za to sfero opravljal preko Službe družbenega knjigovodstva in ne preko poslovnih bank, ker se pač tam denarji po več dni ohranjajo - ne vem, po kakšnih kanalih - dočim služba to svojo funkcijo zelo korektno opravlja."
58,"Tako bi, ko bomo najbrž celo mi, ali pa mogoče naši nasledniki, v tej skupščini oziroma v Državnem zboru kasneje razpravljali o transformaciji službe, bi bilo moje mnenje tako, da v neki obliki to funkcijo ta služba - ali se bo imenovala tako ali drugače - ohrani in da nadaljuje s takšnim in tako kvalitetnim delom, kot ga je doslej."
10,Okrog samega finančnega poročila oziroma letnega obračuna nimam nobenih pripomb.
2,Hvala lepa.
2,Hvala lepa.
7,Še želi kdo razpravljati o tem poročilu?
4,"Če ne, zaključujem razpravo."
11,"Predlagal bi poslancem in poslankam, da bi sprejeli dva ločena sklepa."
7,"O vsakem bi posebej glasovali, in sicer:"
59,"1. Vlada Republike Slovenije naj do konca julija 1992, tako kot tudi odbor predlaga, v sodelovanju s Službo družbenega knjigovodstva v Republiki Sloveniji, Gospodarsko zbornico Slovenije, Združenjem bank in drugimi zainteresiranimi organi in inštitucijami pripravi projekt in zakonski osnutek za vzpostavitev celovite in enotne službe za javne prihodke v Republiki Sloveniji, ki bo vključeval tudi preobrazbo Službe družbenega knjigovodstva."
6,Želi o tem sklepu kdo razpravljati?
5,"Če ne, prosim, da glasujemo."
2,Ugotovimo sklepčnost!
5,Kdo je za predlagani sklep?
3,Je kdo proti?
4,Se je kdo vzdržal?
10,"Ugotavljam, da je zbor predlagani sklep sprejel z večino glasov."
32,2. Zbor združenega dela Skupščine Republike Slovenije sprejema poročilo o delu Službe družbenega knjigovodstva v Republiki Sloveniji za leto 1991 in letni obračun Službe družbenega knjigovodstva v Republiki Sloveniji za leto 1991.
5,Kdo je za predlagani sklep?
3,Je kdo proti?
4,Se je kdo vzdržal?
10,"Ugotavljam, da je zbor predlagani sklep sprejel z večino glasov."
9,S tem smo tudi zaključili 9. točko dnevnega reda.
4,Sedaj smo pri 10.
9,TOČKI DNEVNEGA REDA - ZASNOVA EKONOMSKE POLITIKE VLADE REPUBLIKE SLOVENIJE.
5,Točko je predlagal gospod Prelovec.
12,"Glede na to, da ga sedaj ni, predlagam, da bi jo preskočili."
12,"Mislim, da brez njega tega ne moremo obravnavati, ne bi bilo pošteno."
1,11.
11,TOČKA DNEVNEGA REDA - PROBLEMATIKA ODKUPA KMETIJSKIH PRIDELKOV V SLOVENIJI in 13.
14,TOČKA DNEVNEGA REDA - PREDLOG PROGRAMA TERMINSKEGA PLANA URESNIČITVE MREŽE CESTNE INFRASTRUKTURE V REPUBLIKI SLOVENIJI.
15,"Mi smo se dogovarjali za obe točki, da bi morali v Vladi pripraviti nekaj osnov."
5,Kaj menite poslanci in poslanke?
13,"To se pravi, da podaljšamo in preložimo, ko bo to pripravljeno pa obravnavamo."
1,Obe.
13,"Gospod Horvat, tudi, in jaz mislim, da je prav da še vseeno pove."
4,Spoštovane poslanke in poslanci.
13,"Jaz sem sicer pričakoval, da bo Vlada pripravila neko poročilo glede te problematike."
23,"Obljubljeno je sicer, da bo Vlada zasedala jutri, ker ostala dva zbora bosta verjetno tudi jutri nadaljevala zasedanje, mi bomo verjetno danes končali."
10,"Vendar jaz bi si vseeno dovolil, gospod predsednik, če dovolite."
43,"Mi smo na Odboru za kmetijstvo še 5.6. sprejeli neke ustrezne sklepe, na katere Vlada še tudi ni odgovorila v zvezi s to problematiko, predvsem odkupa mleka in sedaj tako rekoč je poteklo že skoraj mesec dni in se Vlada temu ni odzvala."
16,Zaradi tega so trenutno tudi takšni odzivi oziroma se pojavljajo vedno večji problemi glede odkupa mleka.
8,Sedaj je pa tu seveda še odkup pšenice.
47,"Jaz ne vem, verjetno bi bilo prav, da vseeno povabimo Vlado na sejo oziroma predstavnike resornih ministrstev, da malo povedo, kako daleč so zadeve, ker mi si lahko sedaj tukaj vsi pripovedujemo, vendar Vlade ni tu, resornega ministra ni tu, da bi o zadevah malo podrobneje razpravljali."
36,"Gospod Horvat, idealno bi bilo npr., če bi mi po skupni seji, ki bo, da bi vsaj prišla oba ministra, kmetijski in prometni in povedala, kako je s temi zadevami, da bi tako vsaj nekaj bilo."
12,"Samo roke ne moremo dati v ogenj, da bodo ti gospodje prišli."
3,Prosim gospod Drča.
6,"Dobro, tu so sedaj ti predlogi."
21,"Drugače bi pa to vseeno sedaj zaenkrat preložili na nadaljevanje te seje, če se prav razumemo, to prvo točko, imamo kmetijstvo."
3,To je eno.
17,"Sedaj je pa druga točka v zvezi z dnevnim redom, kot ga je predlagal poslanec, gospod Arzenšek."
3,"Prosim, gospod Arzenšek."
2,Spoštovano predsedstvo.
52,"Jaz, spoštovani zbor, pričakujem z oziroma na to, da je dejansko bil postavljen rok, da bi gospodje ministri ali njihovi predstavniki do treh, ali pa takoj po skupni seji povedali, ali so kaj naredili ali ne in da enostavno povemo potem do kdaj, če ne, pa se je treba malo drugače postaviti."
27,"Jaz moram reči, da to ni v redu, ker jaz sem za to, da se danes konča delo, samo naj se lepo pove ""si, nisi, si končal""."
24,"Jaz sem že prej enkrat rekel, da resorni minister z vso svojo garnituro je tudi v novi vladi, v novi sestavi vlade ostal isti."
92,"Sklep je bil sprejet v mesecu marcu, to se pravi, da je sedaj vmes - ne mi zameriti, da bom namenoma govoril - marec, april, maj in junij in moram tako reči: če si recimo nekdo od resornih ministrov vključno s svojo strukturo lahko dovoli, da svoje osnovne naloge ne opravi v tem času, da pa včasih prisiljuje nas poslance Vlada in še kdo drug, da sprejmemo od danes do jutri ali pa v eni uri določeno stvar zato, da bi jutri stekla, potem moram reči konkretno, da se lahko to vse že preneha."
7,To je prva stvar in druga stvar.
28,"Argumentov za to, da niso do 30.6. mogli pripraviti stvari, ni, ker podatkov o tem, da so težave, imajo 20 let, spremembe trajajo pa že od lanskega leta."
19,"Moramo tudi osnovno strateško strategijo države Slovenije spremeniti in prilagoditi, tudi recimo pogled in principe k programu te infrastrukture."
66,"Če smo opredelili v programu Vlade, sem pa prebral, da je recimo infrastruktura, turizem, pa še par strateških, obrt, malo gospodarstvo in še kaj, tisto, ki naj bi recimo vodilo Slovenijo v moderni svet z boljšim ekonomskim stanjem vsakega posameznika v Sloveniji, potem pa moram reči, da bi to moralo biti že predvčerajšnjim, ne pa da jaz danes prosim za tisto, kar je rok bil včeraj."
35,"Mislim pa, da je na Republiški upravi za ceste, pa drugih organih, pa tu tam v ministrstvu dovolj, da se lahko skupaj usedejo za dva dni pa to napišejo, imeli pa so časa 3 mesece."
34,"Zato zahtevam, zahtevam, da danes minister, ali kdorkoli, pove, kako daleč, zakaj in vzroke, če slučajno tega niso opravili, za cestno in železniško infrastrukturo, ker jaz mislim, da enkrat moramo začeti na ta način."
2,Hvala lepa.
11,"Besedo ima gospod Dušan Fatur, namestnik ministra za promet in zveze."
18,"Gospod predsednik, dovolite mi da vendarle par stvari povem, ker je zadeva bila, vsaj zame, izredno ostro postavljena."
69,"Poglejte, potem so se vendarle prvič zgodile bistvene zadeve in te bistvene zadeve, ki so s to točko v zvezi, so te, da je bil med tem časom sprejet tako imenovan Toplakov zakon, ki je zadeve spremenil v tem da se na ostali dosedanji sistem, tako kot je bil cestni sistem, kot je bil predviden, da se podaljša v smeri od Slovenske Bistrice oziroma Maribora proti vzhodu, proti Lendavi."
36,"To je celo zadevo preobrnilo, jaz imam sedaj pred seboj strategijo graditve in financiranja cestnega omrežja Republike Slovenije, ki je pripravljena, je bila poslana na Vlado in jo bo Vlada, kot sem obveščen, prihodnji teden obravnavala."
15,"Gre za sila pomembne temeljne zadeve, ki smo jih v tej strategiji na novo predvideli."
23,"Gre za to, da je točno opredeljeno, kaj je koncesijska gradnja, kaj je kreditna gradnja in kaj je gradnja z našimi lastnimi sredstvi."
68,"In te zadeve so drugačne, kot so bile doslej pripravljene in zaradi tega ni imelo nobenega smisla, da vi obravnavate tako strategijo, ki je doslej izhajala ali iz proračuna ali iz dosedanjega dela in dosedanjih planskih opredelitev in je zaradi tega po mojem mnenju vendarle smiselno, da se to še podaljša do, torej vsaj kar se Vlade tiče, do prihodnjega tedna, v kolikor bo seveda zadeva šla skozi."
13,"To pomeni, da bo prvič naslednjič ta zadeva tukaj, zato, ker je pripravljena."
11,"Seveda jasno je vprašanje, da se lahko vmes še marsikaj zgodi."
22,"To je prva zadeva, ki je bila zahtevana, druga zadeva pa je vprašanje terminskega plana izgradnje ceste iz Arje vasi, Vransko, Trojane."
40,"Ta stvar je bila enako Vladi posredovana, Vlada jo je obravnavala in je zaradi enega pogoja, ki je v ta terminski plan vključen, zadevo vrnila nazaj na Odbor za gospodarstvo, ki bo stvar ponovno v torek obravnaval, torej prihodnji torek."
41,"Tako da jaz smatram, da vendarle pri teh korenitih spremembah, do katerih je prišlo zaradi hitrega sprejema tega zakona, ki zahteva prioriteto Koper - Lendava, da je vendarle utemeljen tak zamik, do katerega je prišlo, mislim pa da gre za minimalni zamik."
1,Hvala.
3,Hvala gospod Fatur.
10,"Vprašanje je veste, kaj je tu ostro in kaj ni."
24,"Menim, da je bil gospod Arzenšek še premalo mil. Hvala, premalo oster, preveč mil. Kaj bomo storili, kaj predlagaš Jože, ti si bil predlagatelj?"
69,"Glejte, z ozirom na, jaz spoštujem gospoda Faturja, ker moram reči, da je recimo uporaben delavec na ministrstvu, bom enostavno tako rekel za promet in zveze in kjerkoli je, moram pa reči, da mi je pa žal, ne da bi njega podcenjeval, da si gospodje ministri ali namestniki ne vzamejo toliko časa, da pridejo podkrepiti to, kar je on rekel in pošiljajo v ogenj ljudi, tiste, ki pridno delajo."
4,To je prva stvar.
7,"In drugo, moj predlog je sedaj takšen."
