25,"Čas volilne kampanje je čas, ko opozicija z vsemi silami, seveda legitimnimi, bruha svojo jezo in ponuja boljše rešitve od tistih, ki jih ponuja oblast."
40,"Mislim, da je ta kritika, jasno manj kritizerstvo, pravzaprav smisel volilnega boja, prostor in razlog za to, da se bodo državljani tako ali drugače svobodno in po svoji vesti odločali za tega ali drugega kandidata, za to ali drugo stranko."
7,Gre za vprašanje blatenja v volilni kampanji.
38,"Mislim, da si dve leti po prvih volitvah ne smemo privoščiti volilne kampanje, ki bo v javnosti postregla predvsem z zmerljivkami, z blatenjem, s tistim torej, kar tudi naši državi v mednarodnem kontekstu ne bi prineslo mednarodnega ugleda."
68,"Dovolim si tukaj ponoviti mnenje nekaterih kolegov iz parlamentarne skupščine Sveta Evrope, ki so nas opozorili oziroma dali na znanje, da bodo v poročilu opazovalcev, ki bo poslano Svetu Evrope in bo podlaga za odločanje o našem vstopu v to ugledno evropsko institucijo, ne samo poročali o demokratičnosti volitev, o kateri nihče ne dvomi, ampak tudi o obnašanju javnosti, političnih strank, predvsem političnih strank v času volilne kampanje."
30,"Mislim, da bi bilo za naš mednarodni ugled še kako dobrodošlo, če bi bilo v tem poročilu zapisano, da smo Slovenci izbrali svojo legitimno in legalno oblast na kulturen način."
13,"Tako, da kljub nekaterim pomislekom podpiram namero predlagalca zakona, da se sankcionira blatenje."
17,"Torej jaz ne bi imenoval to negativna primerjalna politična propaganda, ampak bi preprosto rekel blatenje političnih nasprotnikov."
37,"Mislim, da je to veliko bolj jasno povedano kaj to pomeni in bi se tudi zavzel v imenu poslanskega kluba SDP, da se takšno blatenje političnih nasprotnikov bolj strogo sankcionira kot je to tukaj predlagal predlagalec zakona."
17,"Naslednja stvar, ki se nam zdi pomembnejša, na katero želim opozoriti v tej repliki, je vprašanje plakatiranja."
6,To urejata 9. in 10. člen.
5,Našteli smo kar pet alinej.
21,"V 9. členu se nam zdi, da ni določeno, kako se bo zagotavljala dostopnost vsem organizatorjem volilne kampanje pod enakimi pogoji."
7,"Mislimo, da mora to zakon enakopravno predvideti."
22,"V 9. členu ni predvidena obveznost organov občine, da določijo plakatna mesta, niti sankcije, če občinski upravni organ ne določi plakatnih mest."
10,Pri plakatiranju zunaj plakatnih mest ni predvidena enakopravnost vseh udeležencev.
23,V vseh primerih je po našem mnenju treba predvideti posebne roke za pritožbe na odločbe upravnih organov in roke za izdajo drugostopenjske odločbe.
9,Kot prekršek tudi ni predvideno trganje ali prelepljanje plakatov.
26,"Pri tem bi za prelepljanje plakatov lahko veljalo načelo objektivna odgovornost organizatorja, katerega plakati so bili nalepljeni na druge, saj mora zagotoviti pošteno nalepljanje svojih plakatov."
2,In končno.
17,"Določi naj se dolžnost organizatorjev volilne kampanje, da takoj po izvedbi volitev poskrbijo za izpraznjenje plakatnih mest."
17,"Določbe o financiranju volilne kampanje so predvsem pomanjkljive v delu, ki zagotavljajo kontrolo zbiranja in porabe sredstev."
10,Meni je bil nastop predsednika poslanskega kluba Zelenih zelo blizu.
29,"Mislim, da podobno usodo delijo tudi nekatere druge stranke in te bodo prav gotovo s toliko večjo pozornostjo bdele nad tem, kako si bodo konkurenti uspeli zagotoviti denarna sredstva."
29,"Mislim pa, da je tudi dolžnost zakona, da seveda prepreči in sankcionira nelegalno zbiranje finančnih sredstev za volilno kampanjo in mislimo, da se mora predvideti tudi nadzor na tem."
15,"Na koncu mislimo, da so zagrožene kazni za prekrške neprimerne, mislimo celo, da so smešne."
19,"Spoštovane kolegice in kolegi, ker končujem, bi se torej zavzel za to, da se sankcije v tem zakonu poostrijo."
31,"Če želimo urediti, in jaz mislim, da je pametno, da to področje uredimo z zakonom, kljub nekaterim drugim pomislekom - tukaj se z ministrom Kacinom strinjam - potem moramo sankcije zvišati oziroma zaostriti."
21,"Mislim, da jih moramo vzeti vsi resno in najbolj so učinkovite tiste sankcije, ki bodo politične stranke udarile po njihovih denarnicah."
11,"Zato se mi zdi prav, da so te sankcije kar visoke."
15,"Torej na koncu, politika vedno zelo krčevito steguje roke po medijih, predvsem po javnih medijih."
34,"Mislimo, da je treba ta apetit zaustaviti tudi z zakonom, ki bo užival zaupanje v tem parlamentu in bo torej sprejet in bo v nekem smislu predlagal tisti kodeks, za katerega se pravzaprav zavzemamo."
45,"SDP torej intenco podpira, povedala je zelo jasno, da ne podpira tistih določil, ki kažejo na intenco države in političnih strank, da bi se vmešavale v uredniško politiko javnih glasil in trdno verjamemo v kulturnost politične kampanje ter profesionalnost novinarjev, ki bodo o njej poročali."
2,Hvala lepa.
1,Hvala.
4,"Prosim, gospa Darja Lavtižar-Bebler."
2,Hvala lepa.
4,"Spoštovane kolegice, spoštovani kolegi!"
3,Povedala bi tole.
32,"Slišala sem, da nekateri poslanci v drugih dveh zborih izrazito nasprotujejo, so nasprotovali temu (ko so obravnavali ta zakon), da bi sploh tak zakon bil potreben, pri čemer imajo načelno verjetno prav."
40,"Konkretno pa mislim, da glede na to, da gre za prve volitve na podlagi nove ustavne ureditve in glede na to, da še nimamo nekih praktično uveljavljenih pravil in standardov, ki bi se nanašali na organiziranje in vodenje predvolilne kampanje."
11,"Torej glede na vse to menim, da je zakon vendarle potreben."
33,"Prav je, da ta zakon posebej izpostavi obvezo javnih glasil, da zagotovijo vsem strankam in kandidatom enake pogoje in enakopraven položaj pri oglaševanju, objavljanju volilnih propagandnih sporočil in pri aktivnem nastopanju v medijih."
34,"Prav je tudi, da zakon določa, da morajo biti plakatna mesta dostopna pod enakimi pogoji in da omili pogoje za sklicevanje predvolilnih shodov ali zborovanj, ki bodo v tem času kampanje gotovo bolj množična."
17,"Primerna je tudi obveznost, da je treba pri objavi raziskave javnega mnenja o kandidatih navesti metodologijo raziskave."
18,"Toda tudi socialisti ne vidimo pravega smisla določbe drugega odstavka 3. člena, ki prepoveduje negativno primerjalno politično propagando."
24,"Vsebinsko ta določba ni precizirana in nenazadnje je normalno, da se volilna kampanja poslužuje tudi poudarjanja negativnih lastnosti ali napak pri dosedanjem udejstvovanju protikandidata."
23,"Za zlorabo prepovedi negativne primerjalne propagande v nadaljevanju besedila zakona - če prav berem ta osnutek, ki je pred nami - ni predvidena nikakršna sankcija."
6,Torej je tudi zato zadeva brezpredmetna.
20,"Zelo pomembno pa je, da se zagotovi spoštovanje osebnega dostojanstva, nedotakljivosti človekove osebne integritete ter zasebnosti in osebnostnih pravic kandidatov."
17,"V tem smislu se zavzemam, da bi se pred sodišči zagotovilo prioritetno obravnavanje tožb iz tega naslova."
25,"Prizadeti namreč nima nič od sodnega varstva, če uspe pred sodiščem oprati svojo čast in dobro ime šele čez nekaj mesecev ali čez leto dni."
13,"Volivci pa so se že bili odločili na podlagi namerno lansiranih laži, denimo."
8,V zvezi s spornim 5. členom pa tole.
18,Ta člen je dejansko mogoče razumeti kot nasprotje z ustavno zagotovljeno svobodo tiska in drugih oblik javnega obveščanja.
18,Začasna razveljavitev ali omejitev te pravice pa je po ustavi možna samo v vojnem ali v izrednem stanju.
27,"Te volitve, predvidene z ustavo in ustavnim zakonom za izvedbo ustave, pa bi težko šteli kot vojno ali izredno stanje, čeprav bodo nemara posamični spopadi zelo ostri."
87,"Konkretno pa bi lahko glede na nesporni nacionalni pomen radia in TV Slovenije in glede na to, da je Skupščina Republike Slovenije posebej določila način upravljanja tega javnega zavoda in določila tudi kadrovsko sestavo Sveta RTV, bi bilo prav, da bi ta zakon na ta Svet prenesel tudi pooblastilo, da določi pravila, ki bi za čas volilne kampanje veljala za oblikovanje programa RTV Slovenije, pri čemer pa bi tudi tedaj morala biti zagotovljena enakopravnost vseh subjektov, ki nastopajo v volilni kampanji in nepristranskost s strani programskih ustvarjalcev."
42,"Mislim, da bi zakon moral od sredstev javnega obveščanja, ne glede na to ali gre za RTV, Delo ali pa lokalne radijske postaje in občinska glasila, zahtevati nepristranskost in objektivnost, ker se to neposredno navezuje na pravico občanov do informiranosti oziroma obveščenosti."
6,"Torej mislim, da zakon je potreben."
15,"Predlagatelju predlagam, da pač naše današnje pripombe in predloge v čim večji možni meri upošteva."
1,Hvala.
1,Hvala.
3,"Prosim, gospod Magajna."
1,Spoštovani!
22,"Preden dam nekaj pripomb na zakon, bi izrekel vse priznanje prav intenci zakona, da uveljavi možnost svobodnega dostopa do medija vsem strankam."
32,"Mislim, da je to v fazi razvoja naše mlade demokracije več kot nujno in da tu ne moremo pristati na nek liberalističen koncept, ki ga prakticirajo v ZDA, Veliki Britaniji ali drugod."
6,Vprašanje je seveda dostop do medijev.
5,Kako naj zakon to regulira?
12,"Slišali smo celo pripombe, da je to sporno tudi z ustavnega vidika."
42,"Vendar menim, da je to kljub temu pridobitev, saj bo na ta način tudi novim strankam, in tudi manjšim strankam, v finančnem pogledu omogočilo vsaj minimalni dostop in hkrati, kot je že gospod Kacin rekel, tudi možnost za volivce, možnost svobodne izbire."
4,To je zelo pomembno.
16,"Marsikdo bi se danes odločil tudi za stranke, za druge stranke, a jih preprosto ne pozna."
8,Problem pa je financiranje in obseg takega prostora.
4,Ti vprašanji sta povezani.
33,"Namreč, če bodo mediji ta prostor odstopili strankam brezplačno, je velika nevarnost, da bodo zelo omejile medijski prostor, namenjen predvolilni kampanji in da bodo glavnino svojega prostora le namenile financiranju komercialnih prispevkov strank."
50,"Tega se dejansko bojim, da bo ta tako imenovana minimalna možnost dejansko tudi v praksi postala minimalna in da bo omejena na skromno minutažo ali pa celo ne na minutažo, ampak na nekaj sekund predstavitve in da zaradi takšnega tolmačenja zakona, ki je tudi možno, bo ta obseg dejansko minimalen."
19,"Seveda pa zahtevati brezplačno, da mediji na široko odprejo vsem strankam, ki bodo kandidirale, svoj prostor, je druga dilema."
17,"Zato se bolj ogrevam za varianto, da bi vsaj del sredstev krili tudi iz proračuna za kampanjo."
22,"Ali je to polovica ali manj in bi na ta način lahko tudi predpisali ta minimalni obseg, minimalni prostor za promocijo strank."
10,"Vidimo pa, da imamo o teh rešitvah nekoliko drugačne poglede."
22,"Razveseljivo je to, da je bil 5. člen deležen tako velike pozornosti, kar nedvomno kaže, da imajo mediji odločilno vlogo v demokratizaciji."
11,"Se pa zavedam iluzije, na katero je opozoril že gospod Požarnik."
11,Kljub tej formalni enakopravnosti strank bodo stranke v zelo neenakopravnem položaju.
20,"Že sedanja startna osnova je tako različna, da seveda ne bo zagotavljala enake startne pozicije, kar tudi končno ni nujno."
13,"Vprašanje je, kako se je ta startna pozicija vzpostavila in na kakšen način."
22,"V zvezi s tem bi še opozoril na poglavje o financiranju predvolilne kampanje, ki je tudi vprašanje in sploh vprašanje financiranja strank."
18,"Se strinjam s predgovorniki, da izseljenske organizacije naj ne bi bile tisti subjekti, ki bi lahko financirale kampanjo."
9,"Mislim tudi, da ne bi smele financirati predvolilnih dejavnosti."
25,"Menim pa, da bi se državljani Slovenije, ki živijo zunaj naših meja, kot posamezniki z nekim minimalnim finančnim obsegom lahko vključevali tudi v to dejavnost."
2,Zakaj to?
28,"Že prej, pri razpravi o političnih strankah, je bil povedan zanimiv predlog, da pri nas ne bi smeli ustanavljati organizacije, ki bi bila neke vrste podružnica tujih strank."
14,Po drugi strani pa v tem finančnem smislu dopuščamo precej prost dotok teh sredstev.
7,Tu bo treba postaviti bolj jasne meje.
37,"O uporabi sredstev in prostorov državnih organov v strankarske namene so tudi predgovorniki opozorili, dodal bi samo to, da ne samo storitve, materialna sredstva, prostori, ampak tudi obiske državnih funkcionarjev ne bi smeli uporabljati v strankarske namene."
32,"V preteklosti je nekaj tega bilo, verjetno vsaka stranka za sebe dobro ve, koliko so se razni vladni obiski uporabljali tudi za navezavo strankarskih interesov in za sklepanje najrazličnejših dogovorov, tudi finančnih."
30,"Mislim, da moramo tudi tu postaviti jasno ločnico, čeprav verjamem, da je zelo praktično, če je že plačana avionska karta, da se uporabi obisk v tujini še za druge namene."
10,"Verjamem, da je to praktično, je pa tukaj načelni pomislek."
1,Hvala.
6,Za repliko je prosil gospod Požarnik.
1,Spoštovani!
11,"Žal, me ni bilo v dvorani, ker sem moral nekam iti."
15,Slišal sem neko repliko na svoje izvajanje in bi hotel biti še enkrat popolnoma jasen.
51,"Če je bilo res v smeri tega, da bi bilo 40% žensk, moram reči, da nimam nič proti temu - tudi jaz sem rekel najmanj 20% - samo iz političnega realizma, iz stanja, takšnega kakršno je, menim, da bi bilo zelo dobro, da bi bilo vsaj 20%, če bi jih bilo vsaj 20%."
16,"Mislim, da bi bilo v tem parlamentu boljše ozračje, da bi bilo bolj tvorno, bolj koristno."
8,"Zato menim, da bi vsaj to številko doseglo."
16,"Na tisto pripombo preje, da to ni predmet te razprave, pa le ne bi tako rekel."
10,"Moja misel je šla v tem, da bi se zapisalo..."
8,"Sedaj smo že pri drugem zakonu, gospod Požarnik."
31,"Moja misel je šla v tem, da bi se zapisalo... še vedno, da se stranke, ki npr. kandidirajo v 88-ih volilnih enotah, morajo imeti vsaj v 17-ih enotah žensko za kandidata."
10,"Tisti, ki v 40-ih, pa ustrezno osem - in tako naprej."
10,"Skratka, da bi bil to pogoj, ki bi stranke zavezoval."
2,Hvala lepa.
3,Hvala za repliko.
11,"Vendar, kot pravim, sedaj smo že pri zakonu o volilni kampanji."
6,Sedaj je na vrsti gospod Žagar.
2,Hvala lepa.
9,"Jaz nisem prijavljen za repliko, ampak za razpravo, kajne."
27,"Kljub temu, da so temeljni volilni zakoni že sprejeti, je vseeno možno reči, da bi bilo boljše, da bi bili tako imenovani navadni zakoni sprejeti pred temeljnimi."
14,Glede zakona o volilni kampanji pogrešam predvsem na začetku v 1. členu Državni svet.
11,Kampanja se nanaša na Državni zbor in na kandidate za predsednika.
4,Državni svet je izpuščen.
33,"To pomeni, da so volitve v Državni svet povsem tajne in brez javnosti, kar po mojem mnenju ni dobro, še zlasti zato, ker imamo 22 senatorjev, ki so voljeni celo na neposreden način."
9,"Zato predlagam, da se to vnese v predlog zakona."
57,"Glede 3. člena, ki med drugim govori tudi o nedovoljeni oziroma dovoljeni negativni primerjalni politični propagandi oziroma, ki propagira volilni boj v belih rokavicah po podobi predlagatelja, je treba reči, da se tukaj postavlja vprašanje o tem, kdaj in kaj je blatenje in kdaj gre za to, meje blatenja; postavlja se tudi vprašanje in pojav zdravilnega blata."
53,"Glede 5. člena, ki govori o tem, da naj bi nekateri mediji posvečali svoj prostor volilni kampanji, in to predvsem javni ali družbeni mediji, je treba reči, če gre za državni interes, potem so vsi časopisi oziroma vsi mediji dolžni, v kolikor je ta interes prisoten, da posvetijo nekaj svojega prostora volilni kampanji."
27,"Sicer se potem država obnaša do teh družbenih medijev kot nekakšen lastnik in samo njim predpisuje, kot da njim lahko, drugim pa ne more, kar ni res."
15,"Torej niti ni še čisto jasno, ali je država lastnik teh medijev ali ni itd."
20,"Glede prostora, ki naj bi ga časopisi odstopili kampanji, je treba reči, da nobena oblika neplačanega propagandnega oglasa ni sprejemljiva."
20,"Nobena taka pot, ki bi omogočila strankam, da pridejo na brezplačen način do nekega prostora za reklamni oglas, ni sprejemljiva."
14,"V bistvu ponižuje časopise in druge medije, v kolikor bi to od njih zahtevali."
20,"Časopisi imajo pač možnost, da na svoj način, v obliki razgovorov ali kakorkoli, predstavijo stranke oziroma zadostijo potrebam volilne kampanje."
5,Še nekaj o financiranju kampanje.
18,"Sem proti kakršnem koli omejevanju financiranja, naj bo to iz tujine ali iz domovine oziroma od domačih oseb."
40,"Pomembno pa je, da se zagotovi nadzor nad temi sredstvi in pomembno je, da je to zelo strogo in da se iz poročil, ki so jih stranke dolžne po opravljenih volitvah predložiti, jasno vidi, kdo je financiral, koliko tolarjev itd."
17,"To povsem zadostuje vsem kriterijem, ne pa da se nekatere izloča iz tega, ker so možne zlorabe."
20,"Recimo slovenski izseljenci: jasno je, da so za nekoga to slovenski državljani, za nekoga so pa to politični emigranti itd."
28,"Možne so zlorabe, pomembno pa je, da so sredstva, ki se uporabljajo za politično kampanjo oziroma za predvolilno kampanjo, jasna in da je možno priti do teh podatkov."
12,"Podobno velja tudi za te prispevke, ki jih lahko dajo domače osebe."
46,"Če še enkrat na kratko rečem: apeliram, da se vključi v predlog zakona tudi kampanja za Državni svet; nadalje, da so vsi mediji, če gre za državni interes, v tem primeru dolžni odstopiti nekaj prostora in na sebi primeren način, ki ga sami izberejo, predstaviti kandidate."
13,"Tretjič, nisem za omejevanje financiranja, ampak za zelo strog nadzor nad uporabo sredstev."
2,Hvala lepa.
2,Hvala lepa.
8,"Moram ugotoviti, da seveda sedaj nismo več sklepčni."
37,"Bojim se, da bi se glede na to, da nas je še sedem prijavljenih, zgodilo, da tudi potem ne bi bili, kar bi bilo za ta zakon slabo, še bolj pa za tiste, ki naj bi sledili."
14,"Zato prosim, ponovno, apeliram, če se zagotovi sklepčnost, da bi to danes še izpeljali."
7,Gospod Šetinc je na vrsti za diskusijo.
1,Spoštovani!
39,"Ne gre zanikati dobrih namenov predlagatelja, da bi z zakonsko prisilo v čim večji meri izenačili možnosti strank, ki bodo nastopile na volitvah, za ustrezno predstavitev njihovih volilnih programov, in to ne glede na njihovo velikost in finančno moč."
28,"Z določilom o prepovedi negativne primerjalne politične propagande, ki sicer ni sankcionirana v kazenskih določbah, pa predlagatelj prav tako skuša doseči neke vrste fair play v volilni kampanji."
22,"Toda vsak hipotetični preizkus teh določil hitro pokaže, da se ti dobri nameni sprevržejo oziroma bi se verjetno sprevrgli v svoja nasprotja."
32,"Negativne primerjalne politične propagande preprosto ni mogoče jasno definirati, zato ni čudno, da se je predlagatelj izognil sankcioniranju, ko bi bila bila ta definicija potrebna, da bi sploh hotel sankcijo jasno postaviti."
41,"Poleg tega bi takšna prepoved prizadela zlasti našo spoštovano parlamentarno opozicijo, ki svoje volilne programe praviloma gradi na brezkompromisni kritiki obstoječe vlade oziroma strank, ki jo podpirajo, medtem ko vladne stranke praviloma uporabljajo - če lahko uporabim ta izraz - pozitivno politično propagando."
9,"To se pravi, poudarjajo uspehe in načrte svoje vlade."
33,"Še bolj sporen je, kot je že obče znano, 5. člen, ki javnim glasilom v javni družbeni lastnini zapoveduje brezplačno odstopanje prostora oziroma programskega časa za enakopravno predstavitev volilnih programov vseh nastopajočih strank."
53,"Predlagatelj se pri tem sklicuje na prakso v nekaterih drugih državah, ki z zakonom predpisujejo način izvajanja volilne propagande v javni oziroma državni televiziji, nato pa uporabi preprosto analogijo med javno in družbeno lastnino, s čimer seveda praktično z zakonsko prisilo razteza veliko večino javnih glasil in drugih sredstev javnega obveščanja v Sloveniji."
37,"Reakcije iz novinarskih strokovnih krogov že kažejo, da bi bilo takšno zakonsko določilo sprejeto kot oblika strankarskega nasilja nad avtonomijo javnega obveščanja, priviligirane samo ene sestavine civilne družbe in suspendiranje zakona o javnem obveščanju oziroma uredniških pravic."
23,"Nasilje, lahko uporabimo tudi ""nasilje"" vseh strank brez izjeme, nad sredstvi javnega obveščanja je kvalitativno nekaj drugega kot nasilje ene same monopolne stranke."
16,"To se mi zdijo hudo pretirani očitki o ""Orwellovski"" družbi, ki tiči za tem zakonskim določilom."
18,"Vendar pa bi tudi takšno nasilje ali ""nasilje"" povzročilo upravičeno nezadovoljstvo in različne oblike odpora v javnih glasilih."
20,"Poleg tega zakon ne predpisuje in tudi ne more predpisovati obsega, na primer časopisnega prostora za brezplačno oglaševanje nastopajočih strank."
12,"Časopisi so zelo različni po obsegu, grafičnem prelomu, uredniškem konceptu in podobno."
24,"Zato je seveda brez težav mogoče pričakovati, da bodo časopisi takšni zapovedani propagandi posvetili minimalen možen prostor in, na primer, minimalno možno grafično črko."
13,Pri tem se bodo brez težav sklicevali na svoje konceptualne in finančne razloge.
18,"Tudi iz uvoda ministra Kacina je videti, da se predlagatelj popolnoma zaveda nemožnosti podrobne zakonske ureditve te zapovedi."
18,"Ta podrobnost pa je seveda nujna, če bi hoteli, da ta zapoved sploh ima kakšno operativno praktično vrednost."
18,"In tudi predlagatelj sam dobro ne ve, kaj bi se iz tega izcimilo, če se sploh bi kaj."
28,"Torej tudi praktični razlogi kažejo, da bi takšno zakonsko določilo prineslo več škode kot koristi tako samim javnim glasilom kot končno tudi strankam, ki bi ta prostor uporabljale."
45,"Ker med časopisi vendarle obstaja že precejšnja konkurenca, se mi zdi smiselno urejati pravila volilne propagande oziroma volilno kampanjo zgolj v radiodifuziji, podobno kot v nekaterih drugih demokratičnih državah, ker je pač RTV tudi pri nas oziroma zlasti še pri nas v bistvu monopolna institucija."
32,"Vendar je po našem mnenju mogoče tudi to urediti v okviru dogovora oziroma sklepov Sveta RTV, kjer so zastopane vse stranke ali vsaj večje stranke in ni potrebno to vtikati v zakon."
10,"Zavzemamo se, skratka, za črtanje celotnega 5. člena osnutka zakona."
6,Na koncu še nekaj o financiranju.
35,"Zavzemamo se za varianto v 17. členu, to se pravi, da se financiranja ne omejuje posebej s strani fizičnih in pravnih oseb, ampak se samo predpisuje, da je treba večje zneske financirati preko žiro računa."
9,S tem je omogočen tudi javni nadzor nad financiranjem.
30,"Namreč, tudi bogata praksa svetovnega parlamentarizma kaže, da bi takšne prepovedi in omejevanja samo povzročila, da bi stranke na različne načine prale denar, ki bi ga dobivale za volilno kampanjo."
8,"Seveda tiste, ki so sploh zanimive za financiranje."
8,"Skratka tiste, ki jih sploh kdo hoče financirati."
10,Tudi takih strank verjetno pri nas ni tako zelo veliko.
32,"Sploh pa bi bilo takšno določilo o omejitvi zneskov v koliziji z zakonom, ki ga prav tako danes obravnavamo z osnutkom zakona o političnih strankah, kjer ni nikakršnih omejitev glede financiranja strank."
15,"Nasploh je samo zahtevano, da se nad določenim zneskom to posebej prikaže v finančnem poročilu."
30,"In torej, ker je nemogoče ločiti financiranje volilne kampanje od financiranja stranke nasploh, naj bi torej hkratna uporaba obeh teh določil, obeh teh zakonov, seveda popolnoma izničila namen tega določila."
11,"Vse, kar potrebujemo, je nadzor, da se ve, kdo financira stranke."
20,"Stranke o tem poročajo in da so tudi podvržene vsem moralnim, političnim in pravnim sankcijam, če pri tem karkoli kršijo."
1,Hvala.
4,Besedo ima gospod Kolešnik.
1,Spoštovani!
15,Že sam minister je s svojimi besedami oziroma s svojim govorom govoril o veliki zadregi.
5,Zakon je res zelo nenavaden.
43,"Opravičilo za zakon je našel v zahtevi Ustavne komisije in vseh drugih, da ne bi na njega padla vsa kritika tega zakona oziroma tega osnutka zakona, ki je vsebinsko zelo ubog, plehek in seveda zbir nekih želja, morda tudi dobrih namenov, vendar brezpredmetno."
29,"Zakon, kot govori gospod minister, je v bistvu kodeks, je zbir nekih pravil, ki mu niti ne bi mogli reči zakon, kajti zakon brez sankcij je težko imenovati zakon."
7,Zato je verjetno minister v taki zadregi.
25,"Poleg tega je le treba tudi povedati, da to, kar je zapisano, je zapisano v drugih zakonih, v mnogih zakonih, ki jih prav gotovo imamo."
12,"Zato se postavlja vprašanje, zakaj je bilo treba pisati še ta zakon."
34,"Verjetno tudi zato, ker se morda misli, da ne znamo brati drugih zakonov oziroma da ne znamo uporabljati več zakonov, da bi se znali obnašati v tako specifičnih zadevah, kot je lahko volilna kampanja."
23,"Zlasti zanimivo je to, da je tudi minister priznal, da nobena država nima takšnega zakona, da kaže, ponovno postajamo v novi državi posebnost."
20,"Očitno se nikakor ne moremo znebiti te dediščine preteklosti in kaže, želimo biti s tem zakonom neka posebnost v Evropi."
37,"Posebej zanimivo je to, da so v tem zakonu v bistvu na drugi strani, tam, kjer se govori o kazenskih določbah, obravnavani oziroma naj bi bili odgovorni, kolikor se pač s kazenskimi določbami določa, novinarji oziroma mediji."
22,"Ti naj bi bili predvsem kaznovani za neka ravnanja, ne pa tisti, o katerih naj bi tekla beseda v tej volilni kampanji."
23,"Zato je prav čudna zadeva, da se predvsem obravnava, kar se mi zdi posebej specifično in nesprejemljivo in posebej moti, prisila nad mediji."
54,"Mediji naj bi bili prisiljeni v nekaj, kar mislim, da ne sodi in se strinjam z vsemi tistimi, ki pravijo, da ni mogoče zaradi nekega načela enakopravnosti prisiljevati medije, da bodo morale imeti vse stranke določen prostor ali v časopisu ali v radiu ali na televiziji oziroma da bodo morale imeti enako določene možnosti."
1,Zakaj?
2,Ni potrebe.
13,"Mislim, da je takšna prisila več kot pa je v demokratičnih razmerah dovoljena."
