7,"Drage poslanke in poslanci, gospe in gospodje."
26,"Ker sem bil obveščen, da je prijavljenih že dovolj poslancev in ker je ura že vsekakor prava začenjam, začenjam 47. sejo Zbora občin Skupščine Republike Slovenije."
29,"Za današnjo sejo zbora so se opravičili: Edvard Oven, dr. Peter Glavič, Boris Jež, Metod Šonc, Vojka Štular, Janez Režun, Ivan Vodopivec, Ivan Mesiček, Ivan Atelšek in Franc Ogris."
9,"Po podatkih Službe, je na seji prisotnih 43 poslancev."
6,"Prosim, da ugotovimo navzočnost v dvorani."
1,Dobro.
12,"Ugotavljam, da je Zbor sklepčen in lahko pravno veljavno razpravlja in sklepa."
34,"Predlagam, da še pred prehodom na določitev dnevnega reda, obravnavamo poročila skupne komisije za pripravo sporazumnega predloga k predlogu zakona o političnih strankah in predlogu zakona o nezdružljivosti opravljanja javne funkcije s pridobitno dejavnostjo."
9,Poročilo skupne komisije ste namreč že prejeli na klop.
25,"Ne vem, če ste prejeli tudi poročilo komisije o predlogu zakona o volilni kampanji, (so ga prejeli), a ja, to je bilo že poprej poslano."
8,Torej bi tudi o tem predlogu komisije odločali.
22,"Gre za to, da poskusimo odločati čimprej, da bi imeli dovolj časa za eventualno nadaljnje usklajevanje, če bi se izkazalo za potrebno."
24,"Vemo pa, da vsaj dva od teh zakonov spadata med zakone iz tako imenovanega širšega volilnega paketa oziroma med zakone iz spremljajoče volilne zakonodaje."
27,"Zlasti zakon o političnih strankah, ki je po mnenju mnogih nujen, da bi lahko potekalo kandidiranje, tako kot je predvideno z zakonom o volitvah v Državni zbor."
19,Najprej gremo na poročilo skupne komisije vseh treh zborov za pripravo SPORAZUMNEGA PREDLOGA K PREDLOGU ZAKONA O POLITIČNIH STRANKAH.
5,Poročevalec komisije je gospod Zakonjšek.
2,Želite besedo.
1,Prosim.
18,"K temu, kar je rekel gospod predsednik, namreč pomen zakona v paketu volilnih zakonov, ne bi dodal nič."
27,"Povedal bi, da je komisija po dokaj napornem usklajevanju in razmišljanju o tem, kako oblikovati skupni predlog, skupni amandma, prišla do predloga, ki je danes na klopi."
10,Ta predlog se ne razlikuje bistveno od že sprejetega amandmaja.
49,"Ima pa nekatera drugačna določila in predvsem je pomembno, da se ob tem, ko bi ta zakon, če bi, in ko bomo ta amandma sprejeli, zavezuje potem ustrezno ministrstvo, da pripravi vso potrebno izvedbeno dokumentacijo, da se pač načelo s principi tega amandmaja v praksi v čimkrajšem času izvedejo."
34,"Tako da komisija, skupna komisija vseh treh zborov priporoča, kot vidite tudi našemu zboru, in to imamo na strani 2, da umakne svoj amandma, ki smo izglasovali in da sprejmemo skupno oblikovali amandma komisije."
13,"Moram reči, da je bil takšen predlog na komisiji sprejet z veliko večino."
22,"Moram pa tudi povedati, da sta se predstavnika našega zbora, jaz sem glasoval za, eden je bil vzdržan, eden bi bil proti."
9,Gospod Filtrin slučajno pri glasovanju ni bil v prostoru.
4,Tako je bilo glasovanje.
5,Vsi ostali so jasno podprli.
13,"Oba zbora sta soglasno podprla ta amandma, ki je predložen tudi našemu zboru."
2,Hvala lepa.
6,"Hvala lepa, gospod Zakonjšek, za poročilo."
7,Želi o predlogu skupne komisije kdo razpravljati.
4,Gospod Starman ima besedo.
2,Spoštovani predsednik!
4,Drage kolegice in kolegi!
19,"Na poslanskem klubu Demos, smo danes ponovno razpravljali o tej problematiki in sprejeli stališče, da vztrajamo na našem amandmaju."
41,"Ugotovili smo tudi, da predlog, ki ga nam ponuja v drugi varianti usklajevalna komisija, ni konsistenten, zlasti pa daje nepotrebne koncesije in odstopa od načela, da je družbena lastnina, lastnina vseh in da si je ne more ena skupina ljudi prilaščati."
24,"Osebno mislim celo, da je tak predlog v nasprotju s 14. členom ustave, ki govori o enakosti pred zakonom, ne glede na družbeni položaj."
28,"Posamezniki, ki so združeni v te tri politične stranke, bi zaradi takega predloga pridobili določene premoženjske koristi in stranke kot take, kar bi bilo v pravem nasprotju zakona."
44,"Predlog gre v to smer, da se v bistvu podržavi tista družbena lastnina, ki je v upravljanju bivših DPO-jev, treh, to je Zveze komunistov, Socialistične zveze in Zveze socialistične mladine, od dneva, ko so bile te reorganizirane v politične organizacije, zgubile lastnost družbeno-pravnih oseb."
21,"In naj bi pridobile to premoženje na neodplačan način, to je z darilnimi pogodbami, ali pa od občin od družbenopolitičnih skupnosti."
15,"Tukaj se izhaja iz tega, da so te politične organizacije lahko kakšno premoženje tudi kupile."
18,"Tega pa niso mogle kupiti, ker nihče v podjetjih, dokler je družbena lastnina, ne more nič kupiti zase."
32,"Družbena lastnina je bila zaščitena v vseh pogledih, tako pri prodaji kot pri menjavi in vedno je bila poleg licitacije, poleg vseh drugih varovalk, ki so jo ščitile, imela še vrsto zaščit."
12,"Zato se tukaj skriva vprašanje, kaj je s članarino teh bivših organizacij."
5,"In še nekaj, dragi kolegi."
23,"Tukaj menim, da moramo nadstrankarsko razmišljati, tukaj gre za legitimacije, ali resno mislimo pravno državo, ki se kaže v detajlih, ne v globalu."
19,"In resno moramo izhajati iz tega, da imamo v drugem členu ustave napisano, da smo pravna in socialna država."
16,"In o teh vprašanjih imamo stališče Ustavnega sodišča Republike Slovenije, kot najvišjega pravnega organa te države."
20,"Ne znam si predstavljati, da si dovolijo posamezni politični predstavniki v nasprotju z načeli, ki jih je sprejelo Ustavno sodišče."
26,"Jaz vam lahko citiram sklep Ustavnega sodišča iz maja letos, v katerem je izrecno navedeno, da je članarina z dnem vplačila na blagajno postala družbena lastnina."
12,"In teza, da ima članarina neko posebno vlogo, poseben status, ni sprejemljiva."
30,"Zato danes polagamo izpit tudi iz pravne države, ker ta parlament odloča o tem v konkretnih zadevah, v majhnih zadevah, ali mislimo resno s pravno državo, ali še vedno samovoljno."
16,"V vseh postkomunističnih deželah so več ali manj ta vprašanja rešili zelo hitro, na prvih sejah."
36,"Menim, da je to ena hudih napak Demosove koalicije, da tega vprašanja ni rešila že v letu 1990 in da moramo danes te zadeve reševati in poskušati postopati po temeljnih načelih pravne države in načelih poštenosti."
22,"Ni prav, da se predstavniki nekaterih strank ali družbenih skupin lahko predstavljajo tudi na volitvah v čisto drugem materialnem položaju kot drugi."
7,Torej gre v nasprotju z načelom pravičnosti.
29,"In ta kompromisni predlog, ki ga tukaj ponujajo, je v nasprotju s tem načelom, ker še vedno pušča tem političnim strankam privilegije, ki so jih dobile v prejšnjem sistemu."
27,"Zato računam na podporo, tako kot smo jo dali že do sedaj in da ne bomo sprejeli tega kompromisnega predloga, ki je nam vsiljen in je protiustaven."
13,"Najprej je prišel gospod Potrč s predlogom, da se jim pusti 1/3 premoženja."
6,Zakaj ne polovica; zakaj ravno 1/3?
11,"Potem so pa oblikovali nekonsistenten predlog, ki nam ga tukaj ponujajo."
31,"Amandmaji, ki smo jih v našem zboru že dvakrat sprejeli, pa izhajajo iz temeljnih načel ne samo ustave, ampak tudi iz zakona o obligacijskih razmerjih in zakona o lastninsko - pravnih odnosih."
4,Gre za stvarno-pravne zadeve.
31,"Zato bi prosil tudi druge poslance, da se dvignemo nad strankarsko disciplino in da v tej stvari, ki ima državno konstitutivni značaj in odnos do pravne države, odločamo po svoji vesti."
2,Hvala lepa.
2,Hvala lepa.
7,K razpravi se je prijavil gospod Zakonjšek.
2,Hvala lepa.
2,Spoštovani zbor!
17,"Če bi vedel, da je amandma, ki ga predlaga skupna komisija, protiustaven, sigurno ne bi zanj glasoval."
40,"Nisem tudi sodeloval pri oblikovanju amandmaja, ko pa sem ga temeljito prebral, sem se odločil za to, da glasujem zanj - mogoče iz treh, štirih razlogov, ki so na nek način utemeljeno vsebovani (po moji oceni) tudi v tem predlogu amandmaja."
14,"Prvič, gre za podržavljanje te lastnine, to se pravi vračanje v last občin, države."
26,"In s tem je po moje zadovoljeno načelu, da se ta lastnina, ki se je ustvarjala v preteklosti, teh treh strank ali skupine strank, podržavi, odvzame."
1,Drugo.
24,"Ničesar ne ostane tem strankam tudi po določilih tega zakona, ker se potem prostori itn., ki jih doslej te stranke uporabljajo, dajo v zakup."
32,"To se pravi, da se bo plačevala najemnina kot za vsak poslovni prostor, kjerkoli pač je in bo verjetno - ali pa ne, odvisno je od odnosa stranke in občine - sklenjena najemna pogodba."
30,"In tretje, kar mislim, da je zelo pomembno, je, da so vse pogodbe o vseh nepremičninah, vse, kar je bilo sklenjeno in tako naprej, od dneva uveljavitve tega zakona, nične."
49,"Jaz sicer nisem pravnik, gospod Starman, vendar se mi zdi, da je s tem tako jasno rečeno, da se lastnina teh treh strank, o katerih je govor, podržavi, uporabo prostorov in sicer je prepuščena najemnim pogodbenim odnosom med bodočim lastnikom, občino in stranko, ki bo pretendirala na te prostore."
17,"In da je vse, kar je bilo doslej sklenjeno in je v nasprotju s tem določilom, nično."
37,"Tako da se je meni, poudarjam kot nepravniku, zdelo, da je s tem dosežen tisti namen, ki ni bil uresničen - kot upravičeno pravite - skozi dve leti iz razlogov, ki so nam pa tudi več ali manj znani."
2,Hvala lepa.
2,Hvala lepa.
4,Gospod Starman želi replicirati.
13,"Če dovolite, bi repliciral, tako da bi prebral 37.a člen ponujenega predloga."
7,"""Nepremično premoženje bivših družbenopolitičnih organizacij (Zveze komunistov,..."
54,"Zveze socialistične mladine, itn.), pridobljeno z neodplačnimi pravnimi posli ali sredstev družbenopolitične skupnosti, s katerim upravljajo Socialdemokratska prenova Slovenije, Socialistična stranka Slovenije, Liberalno-demokratska stranka z dnem uveljavitve tega zakona postane državna last."" Vse tisto, kar bodo izkazali, da so dobili z menjalno pogodbo, vključno to stavbo, kjer smo danes, ne pride pod ta zakon."
54,"Ta stavba je pridobljena z menjalno pogodbo, ki je bila sklenjena, tako da je gospod Popit prišel kot generalni sekretar vlade leta 1949, brez pooblastila, in zamenjal to stavbo s stavbo na Kongresnem trgu 1, (ali 11), ki jo je prvotno dobila z darilno pogodbo zaradi posebnim zaslug v narodnoosvobodilnem boju Komunistična partija Slovenije."
5,In ta zakon to izpušča.
4,To je prva zadeva.
1,Drugo.
32,"Naši amandmaji temeljijo na ugotovitvi, da je z dnem vpisa v register političnih strank, torej organizacij, po zakonu iz decembra 1989, takrat postalo družbeno sredstvo, oziroma takrat postalo občinska oziroma republiška last."
2,Ne danes.
16,"In vse pogodbe, ki so bile v teh dveh letih sklenjene z neodplačnimi darili, so nične."
13,"Ne pa tako, kot pravi gospod Zakonjšek: ""oddane od uveljavitve tega zakona naprej""."
7,To je jasno; to ni treba pisati.
22,"Tako da, če bi to konstrukcijo sprejeli, bi bil prvi primer, da oblikujemo iz družbene lastnine državno lastnino - razen na stanovanjskih fondih."
11,"Vse drugo je danes, dokler nimamo privatizacije, še vedno družbena lastnina."
14,"Bodoče občine bodo imele občinsko lastnino, država bo imela državno lastnino, in tako naprej."
26,"Zato je tak predlog zavajajoč, trdim pa, da je v nasprotju - preberimo 14. člen ustave, ki govori o enakosti pred zakonom, ne glede na družbeni položaj."
21,"Tisti, ki so v teh treh strankah, imajo zaradi družbenega položaja v teh strankah drugačen pravni odnos in drugačne premoženjske pogoje."
14,"Gre za neenakopravnost že čisto na ustavnem nivoju, da ne govorim o načelu pravičnosti."
1,Dalje.
40,"Zakaj je potrebno Ministrstvo za pravosodje in upravo obremenjevati z nekimi seznami, spiski itn., če se te zadeve lepo uredijo v upravnem postopku na občinskih nivojih, ko se delajo vse zadeve; kot imamo denacionalizacijo, kot imamo urejene vse te zadeve."
16,"Zakaj tukaj v nekem ""lex specialis"" urediti neko pristojnosti zato, da bi se te zadeve izigrale?"
15,"Zato so ti predlogi protiustavni, nesistemski, nepošteni in jih je treba iz teh razlogov zavrniti."
2,Hvala lepa.
5,Ali želi še kdo razpravljati?
3,"Prosim, gospod Urbančič."
47,"Ko je propadla bivša Jugoslavija, ali pa še ni propadla, ali pa je bila iz Slovenije izrinjena, ali kakorkoli hočete vzeti, in je propadla Komunistična partija za Slovenijo, praktično ni nobene organizacije, ki bi bila upravičena na vse tisto bivše premoženje, ki je bilo od bivših organizacij."
27,"Če se danes kdo sklicuje, da je naslednik bivše organizacije, potem naj prevzame tudi ime; naj bo ime naprej Komunistična partija Slovenije, pa bo vse v redu."
13,Zakaj ne prevzamejo imena in da so potem res pravni nasledniki vsega tistega?
20,"Če so pa takrat bivše politične organizacije propadle, potem praktično ni drugega njihovega premoženja kot državno; ne more drugo biti."
33,"Če se pa ozremo še na članarino in da se bodo iz članarine plačala osnovna sredstva: članarine ni bilo niti toliko, da bi funkcionirala Komunistična partija Slovenije, čeravno je bila partijska članarina visoka."
10,"Ampak toliko je ni bilo, da bi partija sploh funkcionirala."
17,"In da bo kdo rekel, da so se iz članarine kupovala osnovna sredstva - to je čista laž."
46,"In zaradi tega čisto osnovnega lastninskega principa, če npr. lastnik umre ali ga ni več, potem nekdo, ki je njegov naslednik - ampak mora biti res naslednik, sedaj pa ne vem, če je prenoviteljska stranka res naslednik Komunistične partije, saj ona sama ne trdi, da je naslednik."
16,"In če sama ne trdi, da je naslednik, kako je upravičena do nasledstva bivše Komunistične partije?"
2,Hvala lepa.
2,Hvala lepa.
4,Besedo ima gospod Feltrin.
1,Spoštovani!
10,"Jaz bi samo potrdil, kar je že gospod Starman rekel."
67,"Poglejte: 37.b člen, drugi odstavek: ""Vse pogodbe o razpolaganju z nepremičninami iz 37.a člena, razen pogodb, ki bi jih s Socialdemokratsko prenovo Slovenije, s Socialistično stranko Slovenije ali z Liberalno-demokratsko stranko sklenila Republika Slovenija, sklenjene po uveljavitvi tega zakona, so nične."" To se pravi, da je res tisto, ker sklenjena pogodba med Republiko Slovenijo in to hišo je že sklenjena in ostane njim v last."
11,"Nična bi bila, če bi jo sklepali po uveljavitvi tega zakona."
1,Hvala.
5,Še gospod Grošelj ima besedo.
4,Spoštovane kolegice in kolegi!
29,"Glasoval bom seveda za to poročilo, ki ga je predlagala skupna komisija vseh treh zborov, ker ugotavljam, da je to v bistvu tudi vsebina moje razprave na zadnjem zasedanju."
13,"Kar pa se tiče državne lastnine, pa mislim, da to ni prvi primer."
32,"Gospoda Starmana bi rad opozoril - mislim, da je šlo za 92. člen pri zakonu o zdravstvenem varstvu, ko smo ravno tako splošne bolnišnice podržavili in jih prenesli v državno lastnino, pod republiko."
27,"In ko bomo danes obravnavali zakon o socialnem varstvu, ravno tako predlagamo oziroma je predlog v 119. členu, da se tudi to premoženje prenese v last republike."
29,"Mislim, če je v teh in podobnih členih bila ustrezna ustavna podlaga za sprejetje takih zakonov, da je tudi predlog tega amandmaja, ki je predlagan, v skladu z ustavo."
49,"Vendar ne bodimo obremenjeni samo z nekaterimi svojimi pogledi na politične stranke, ker ne nazadnje lahko predlagate tudi to, da vsi tisti, ki smo ali ste plačevali kdaj svojo članarino, kar se že poskuša, tem, ki so to vplačali, tudi zagotoviti, da se jim tudi vrne v smislu denacionalizacije."
1,Hvala.
2,Hvala lepa.
4,Gospod Starman ima besedo.
11,"Gospodu Grošlju se zahvaljujem, da je omenil tudi premoženje zdravstvenih domov."
17,"Vendar, to samo potrjuje tezo, da moramo iz družbene lastnine narediti državno lastnino, vendar po poštenem načinu."
23,"Protiustavno je zato, ker si določena družbena skupina hoče prilastiti družbeno sredstvo, ki ga je pridobila v bivšem sistemu kot privilegirana ustavno-pravna institucija."
6,V tem je spornost vse zadeve.
18,"In ta stavba, v kateri smo, ne sme postati lastnina ene stranke, druge stranke pa biti njeni podnajemniki."
12,"Če bomo to naredili, smo pljunili na našo ustavo - oprostite temu izrazu."
22,"In gospod Ribičič je v Ustavni komisiji vehementno vztrajal na 2. členu ustave, ki pravi: ""da je Slovenija pravna in socialna država""."
29,"In na velik pritisk na prof. Bučarja je bil ta člen vnešen v ustavo, ker je logično, da demokratična parlamentarna država ne more biti nepravna in tudi ne nesocialna."
26,"In ta stranka se danes zavzema za flagrantno kršitev načela o pravni državi, iz svojih sebičnih razlogov, zato, da bi imela boljše startne osnove za naprej."
25,"Jaz nisem nikoli postavil zahteve, da mi vrnejo mojo članarino in mislim, da je nepošteno zahtevati od kateregakoli društva ali stranke, da ti vrne članarino."
25,"In v prvotnem tekstu teh amandmajev je bila tudi določba, da v treh mesecih lahko vsi člani bivše partije zahtevajo vračilo članarine, drugače zahtevek zastara."
11,"Ali lahko ta zakon določi krajši zastaralni rok, kot je splošni?"
11,"Ali lahko določi 30 dni, da je treba vse postopke urediti?"
8,"To je nenačelen kompromis, izsiljen od vemo koga."
17,"In ta dežela bo samo toliko demokratična, kolikor bo partiji omejila moč gibanja in moč uveljavljanja stvari."
13,"In danes stvari gredo v drugo smer, ki ni načelna in ni poštena."
15,In še enkrat poudarjam - ne bom se več oglasil - polagamo izpit iz zelo pomembne teme.
38,"Ali mislimo resno iti v sodobno državo, ali se še vedno spogledujemo z nekimi samovoljnimi konstrukti itn. in tudi premoženjskimi rešitvami, ko je že od Hamurabijevega zakona naprej jasno, da je temeljno načelo poštenosti, ne pa načelo uzurpacije."
7,"In to, kar se predlaga, je uzurpacija."
2,Hvala lepa.
2,Hvala lepa.
10,"Če dovolite, bi jaz kar od tu zelo na kratko."
19,"Mislim, da mi, in to bi repliciral kolegu Starmanu, stalno polagamo izpite že s samo našo sklepčnostjo na seji."
18,Tako da ne bi zdaj gradili te velike teze ob stalnem polaganju naših izpitov demokracije in pravne države.
27,"Samo na nekaj naj opozorim: na stališča Zakonodajno-pravne komisije, ki tudi upoštevajoč morda dobronamernost samega predloga, je ugotovila, da z zakonodajno-pravnega vidika je sam amandma nerodno oblikovan."
12,"In to je tudi v stališčih, ki smo jih zadnjič obravnavali opozorila."
1,Hvala.
3,"Prosim, gospod Kuhar."
4,Spoštovane kolegice in kolegi!
40,"Glasoval bom za predlog skupne komisije vseh treh zborov in to tudi iz razlogov, ker so se v ponedeljek ob 14.00 uri sestali vodje poslanskih klubov in bi rekel, v dveurni razpravi vložili maksimalne napore, da je prišlo do uskladitve."
35,"Žal na tem sestanku ni bilo predstavnika Demosovega kluba, da bi tudi tam svoje pomisleke in pa predloge ponovno izpostavil, kot so izpostavljeni v predlaganih amandmajih, ki jih je gospod Starman vložil v našem zboru."
25,"Sam ocenjujem, da je očitno iz celotne razprave, sam sem trikrat sodeloval v tej razpravi, najbolj sporna ta stavba, v kateri se ta trenutek nahajamo."
5,In premoženje bivše Zveze komunistov.
28,"Tisti, ki so pravočasno in dolgoročno zadeve gledali v nekaterih strankah, so že odprodali ali na kakšen drug način bi rekel premoženje, nepremično premoženje odtujili in zagotovili sredstva."
18,"In kolikor je meni znano, je stranka Socialdemokratke prenove tudi to zgradbo že Skupščini ponudila za ustrezno zamenjavo."
28,"Tako da bi rekel, delamo nek problem še večji kot sicer je in ki se ga da s tem ustavnim oziroma s tem predlogom amandmajev tudi ustrezno rešiti."
48,"In končno bi rekel, mislim, da je 37.c člen tudi izjemno pomemben za vse tiste stranke, ki so se ustanovile 89. ali 90. leta, ker tudi nove stranke, ki so se prvič 1990. leta pojavile, ohranjajo premoženje, ki so si ga ustvarjale tudi v teh dveh letih."
9,Zato še enkrat - glasoval bom za poročilo medzborovske skupine.
1,Hvala.
3,Gospod Metelko želi.
7,"Mislim, da že predolgo vodimo to razpravo."
10,"In ponavljam vse, ampak jaz bi samo eno stvar vprašal."
19,Katera država v vzhodni Evropi ali pa na Balkanu po spremembi sistemov ni takoj podržavila lastnine bivših komunističnih partij?
12,"Čisto vse države, kot je meni znano, od Poljske pa do Bolgarije."
15,"Mislim, pri nas se pa zaradi tega že ne vem, dve leti ne moremo uskladiti."
16,"Zato, da obrazložim svoj glas, sem proti skupnemu predlogu usklajevalne komisije in vztrajam na naših amandmajih."
3,"Prosim, gospod Feltrin."
9,"Replika, gospod Kuhar. 37.c člen smo včeraj črtali."
5,Imamo še 37.c člen.
7,"Sklep je bil komisije, da se črta."
40,"Ja, morda prvotni 37.c člen, ker ta, ki je zdaj, se mi zdi nov glede na prvotni predlog in mene celo zanima, kaj tole pomeni, to bi pa res želel pojasnilo, kaj pomeni premoženje, s katerim razpolagajo politične organizacije."
17,"So to nepremičnine v družbeni lasti, ki niso bile last, ker izvzema se tisto iz 37. člena."
29,"Mar to pomeni, da če ima neka politična stranka v najemu neko nepremičnino, ki je v družbeni lasti, da s tem postane njena last, ali kaj pomeni beseda: razpolagajo."
18,"Ker če to ni tako, kar pa bi se čudil, da je, potem ta člen ne pomeni nič."
14,"To bi pa morda celo ministra prosil, da to pojasni, zakaj pri tem gre."
15,"Gospod Žampa je želel besedo, ker ni tako nujno, da kar takoj rečemo o tem."
3,Hvala za besedo.
14,"Podpiram predlog in izvajanje gospoda Starmana, noben izgovor ne more biti nobene stranke članarina."
5,Glede lastninjenja bom zelo enostaven.
21,"Gasilci obstajamo 50, 60, 80, 100 let in plačujemo članarino in še zraven fizično delamo in je vse to premoženje državno."
10,"Nikogar drugega, zato tudi velja verjetno to za nekdanje komuniste."
1,Hvala.
4,Želi še kdo besedo?
10,Ali bi se dalo pojasniti ta novi 37.c člen.
3,Kaj pravzaprav pomeni?
33,"Bi se dalo v imenu te komisije pojasniti, kakšen je namen in pomen 37.c člena. 37.c člen, to se pravi, ko se govori o premičnem in nepremičnem premoženju ter denarnih sredstvih."
30,"Razen nepremičnega premoženja iz 37.a člena, s katerim razpolagajo politične organizacije, ki postane z dnem uveljavitve tega zakona premoženje političnih strank, ki so naslednice političnih organizacij po starem zakonu."
23,"Namreč, dejansko je vprašanje tisto kar so te organizacije kupile, mislim, da je to že postalo njihova last, kar imajo pa v najemu."
13,"Je pa zdaj vprašanje, ali s tem členom to njim dajemo v last."
5,To bi me res zanimalo.
71,"Ker to pa mislim, da bi bil kar krepak poseg, morda bi bilo to komu celo všeč, ne vem, tega še nisem zračunal, kaj to za koga pomeni, ampak mislim, da je to tak hiter poseg, ki bi morda v lastništvu nekaterih nepremičnin povzročil tudi težave, npr. da ima na lepem neka stranka v lasti dve sobi v neki večji stavbi, itd., morda bi celo bili problemi v zvezi z vprašanji ..."
9,"... itd., itd., tako da, to vprašanje postavljam iz razloga ..."
3,... je to vključeno.
41,"Ta 37.c člen je bil predmet posebne obravnave predvsem zaradi tega, ker nekako razmejuje točno to, na kar ste opozorili, premoženje, ki je evidentno bilo v lasti teh strank in nanj se nanaša 37.a člen, se podržavi v celoti."
40,"Izvzeto pa naj bi bilo, če jaz tako tolmačim ta člen, tisto, s katerim sedaj razpolagajo te organizacije in so bile ustanovljene in organizirane po zakonu o političnem združevanju in so pravne naslednice pač političnih organizacij, pri čemer je govor."
17,"Skratka, gre za določeno delitev, kaj to finančno pomeni - jaz lahko povem za Liberalno demokratsko stranko - nič."
2,Nima nič.
19,"Seveda so pa najbrž drugi, ki bi morali - kjer bi se ta stvar morala finančno tudi ovrednotiti in videti."
55,"Zaradi tega je tudi postavljena zahteva, da se te stvari, ki so pravno zelo komplicirane, nekje gre za najemne odnose, nekje gre za uporabo naprej in podobno, potem preko ministrstva razčistijo in pripravi pač predlog, ki bo v skladu s temi temeljnimi načeli realiziral ta prenos na državo v bistvu, občino ali morda tudi republiko."
1,Hvala.
55,"To ne razumeti lepo prosim kot kakšno kompliciranje ali zavlačevanje, jaz sem samo začel to točko dnevnega reda in bi bilo prav, da to čimpreje damo ad-acta, ampak moram reči, da ta razprava je sama opozorila na to, da bi utegnilo biti kaj problematičnega, zlasti še, ko smo zvedeli, da predstavniki predlagateljev zakona niso sodelovali."
5,Gospod Starman se je javil.
53,"Pripombe, ki jih sedajle slišimo, kažejo na to, da je tak ponujeni kompromisni predlog strogo politična stvar, strokovno sploh ni dodelana in jaz bi gospoda ministra kot kolega vprašal: ali je določba 37.c člena šteti kot klavzulo za vpis v zemljiško knjigo teh treh strank na vsem premoženju, ki ni predmet podržavljanja."
10,"Predmet podržavljenja je pa samo premoženje, ki je bilo podarovano."
14,"In tukaj jasno piše, da postane z dnem uveljavitve tega zakona premoženje političnih strank."
5,Ali je to klavzula intabulanti.
1,Prosim.
4,Gre preprosto zato - prosim...
26,"Ja, v tem členu ne gre za te tri zgoraj navedene organizacije in njihove naslednice ampak gre za vse stranke, ustanovljene po zakonu po političnem združevanju."
21,"Ne, samo, ki posedujejo - nobena od drugih političnih strank nima v upravljanju ampak ima v najemu, tisto kar imaš v najemu..."
15,"Ja, prosim, gospodje, berimo tako kot piše, jaz sem zato vprašal, kaj pomeni beseda ""razpolaganje""."
15,"Beseda ""razpolaganje"" tako kot lastnino - upravljati, beseda razpolaganje je skupaj s pravico uporabe, stvarno-pravna kategorija."
6,To ni obligacijska kategorija v najemu.
15,Zato krščanski demokrati ne bodo dobili teh prostorov v last na podlagi 37.c člena.
3,To je jasno.
14,"Samo tisti in cela ta stavba preide, zato vprašam, če je to klavzula intabulanti."
