260,"Spoštovani predsednik, spoštovane dame in gospodje! Torej jaz, po tolikem času, kolikor že sedim tukaj, moram reči, da mi že počasi gredo določene stvari na živce. Namreč, ko sem prišel danes sem, sem bil prepričan, da nas čaka tukaj nek dokument, ki ga bo pripravila vlada, v katerem bo pisalo, in popolnoma jasno pisalo, kaj od danes v Sloveniji na novo velja, kaj od danes v Sloveniji ne velja več; dokument, v katerem bo pisalo kaj in kdaj še kakšna stvar pride na vrsto, ki danes še ni zrela, vendar bo jasno povedano, katera stvar bo prišla na vrsto in zakaj ne more priti danes na vrsto. Jaz sem pričakoval, da bo pred nas prišla neka utemeljitev, kakšne so prednosti sklepov, ki jih bomo danes na skupščinski ravni potrdili, kakšne so nevarnosti teh sklepov, slabe strani teh sklepov, potem sem si jaz predstavljal, da bo današnja Skupščina izzvenela kot neko jasno in nedvoumno sporočilo Jugoslaviji kot nek predlog, kot nauk ali kar vi hočete, Jugoslaviji, in sedaj, še enkrat vam povem, po šestih urah sedenja tukaj ugotavljam, da se od vsega tega ni zgodilo nič. Da mi to vse skupaj eno prazno slamo mlatimo z mnogimi dobrimi idejami z vseh strani, tako tudi z opozicije, ki pa nekako sedaj izzvenijo v današnji dan, ki naj bi bil, kot rečeno, en odgovor na neko nesramno dejanje. Vse se to sedaj meša, prši, izgublja; dobro in slabo in prazno in bogato zrnje. Jaz se potem resnično vprašam, čemu potem sploh sklic današnje skupščine in jaz vam svoje povem, jaz sem globoko razočaran."
112,"Zato predlagam, da skušamo to današnjo skupščino vendarle še na nek način rešiti. Jaz bi predlagal, ali naj se predstavniki poslanskih klubov vsedejo skupaj z vlado, ali kakor koli, da naredimo en odmor in da prepustimo, kaj se da danes vendarle konkretnega in jasnega reči. Namreč elementov za to, danes sem videl, je v vseh razpravah na eni in na drugi strani, dovolj. Slišal sem Liberalno stranko, Slovenska demokratična zveza je povedala stvari, za katere se mi zdi, da so dosti uporabne, pa tudi moram reči, s strani opozicije so bile dosti uporabne reči in jaz vam svetujem, da se tega lotimo, kajti sicer se bomo osmešili, da nas bog obvaruj. Nasvidenje."
41,"Zares bom mnogo krajši. Glede na memorandum, ki smo ga dobili, smo pričakovali, da bodo stališča, ki smo jih dobili danes na klop, mnogo strožja. Kajti čas je nastopil, ko si moramo pogledati v oči, kaj se pred našimi očmi dogaja."
130,"Res je to, da moramo vplivati pomirjujoče in bi začel s 1. točko sklepov, ki so predloženi danes nam, da moramo tudi vplivati pomirjujoče, kar se tiče Jugoslovanske ljudske armade. Tukaj je povedano, da bomo dajali kotizacijo finančnih sredstev kot kotizacijo za najnujnejša dela zveznih organov in Jugoslovanske ljudske armade. Ker pa mislim, da so najboljši sosedje vedno tisti, ki imajo med seboj poravnane račune in deloma so ti računi poravnani, deloma pa še niso, zato predlagam, naslednje: V prvem sklepu naj se doda: pri plačilu kotizacije za Jugoslovansko ljudsko armado se odbije znesek denarja za toliko, kolikor znaša škoda, ki jo je JLA povzročila pri odvzemu oz. premestitvi orožja TO v svoja skladišča. Mislim, da je to časten predlog, kajti najboljši sosedje so sosedje, ki imajo medsebojne račune poravnane."
122,"Nadalje, pri 3. točki. Ker vemo, da bodo hajduške metode vedno pogostejše in se bodo dogajale v vsakdanjem življenju, da ne bi bili razočarani, menim, da bi v 3. točki, namesto da pravimo, da zadolžujemo Izvršni svet, naj čimprej pripravi zakon o delovanju Narodne banke Slovenije kot emisijske banke, da ne rečemo danes tukaj, v tej dvorani, naj ga pripravijo, ampak, da naj nam ga dajo danes na klop. Nekateri poslanci Zelenih, med njimi nas je nekaj Štajercev, smo rekli, ne gremo danes prej iz te dvorane, preden ta zakon ne dobimo na klop in po možnosti tudi sprejmemo. Vlada mora računati v bodoče, da se bodo takšne zadevščine še dogajale, in zato naj ima vlada ta zakon o emisijski banki potrjen."
77,"Ne bo treba več sklicevati skupščino, verjetno za dva ali tri člene, drugače pa naj vlada pove, da bo to sila dolg zakon, pa ji bomo verjeli. Če so pa to trije členi, sem prepričan, da ima te tri člene že danes vlada pripravljena in ponovno poudarjam, preden se razidemo, naj nam da ta dokument na mizo, kajti njej sami bo to najboljša garancija za bodoče sigurno in varno delovanje glede poseganja v naše življenje. Lepa hvala."
3,Hvala. Franc Grašič.
108,"Spoštovane gospe in gospodje! So narodi, ki si zgodovine preprosto ne zaslužijo. Eden izmed takih narodov so tudi Slovenci. To je v letu 1990 napisal naš poslanski kolega Franček Rudolf in z njim se strinjam. Pred to sejo sem mislil, da po letu 1991 ne bo več tako, ampak po teh diskusijah, ki jih poslušamo, pa o tem nisem več prepričan, kajti tako številne in dolge diskusije kot so bile te današnje v vseh ključnih vprašanjih in zato gremo prepočasi naprej in strah me je, da si tudi po letu 1991 zgodovine ne bomo zaslužili. O monetarnem sistemu pa le na kratko. Zakaj ne bi uporabljali equje? Hvala."
7,Hvala lepa. Še kakšen spremljevalni predlog? Prosim.
211,"Spoštovane poslanke, spoštovani poslanci! Začenjam skupno zasedanje vseh zborov Skupščine, ki sem ga sklical na podlagi 138. člena poslovnika, ki govori o tem, da predsednik Skupščine lahko v sporazumu s predsedniki zborov skliče sejo zborov, na kateri zbori skupaj obravnavajo zadeve, ki so skupnega pomena za zbore. Smatram, da je tema, o kateri bomo danes razpravljali, vsekakor takega značaja, da je skupnega pomena in mislim, da je v tem smislu sklic na podlagi tega člena upravičen. Poleg tega se sklicujem na 99. člen poslovnika, ki pravi, da predsednik zbora lahko skliče izjemoma sejo zborov v krajšem roku, kot je določen v prvem odstavku prejšnjega člena, če je to potrebno zaradi preprečevanja in odpravljanja večjih motenj v gospodarstvu in tako naprej. Mislim, da so vsi ti pogoji izpolnjeni in moram povedati, da je bila seja sklicana v roku parih dni, kar je mogoče pri nekaterih povzročilo malo začudenja nad zelo kratkim rokom, vendarle, ker gre za izjemno stanje in izjemen položaj,ki ne trpi odlaganja, in je potrebno takojšnje ukrepanje, Izvršni svet pa sam iz svoje pristojnosti ne more sprejemati takih ukrepov, brez legitimirane skupščine, mislim, da je bilo nujno potrebno sklicanje te skupščine, ki naj takoj omogoči potrebno ukrepanje, da se prepreči gospodarska škoda, kot je tudi navedeno v 99. členu."
112,"Hkrati bi, preden preidemo na dnevni red, še predlagal, da na podlagi 349. člena ustave, v skladu z 72. amandmajem, to skupno zasedanje prekvalificiramo v skupno sejo, in sicer glede na to, da je skupna seja utemeljena na določbi, da na skupni seji vsi zbori urejajo vprašanja in postopke v zvezi z uresničevanjem pravice do samoodločbe, razglasitve izrednega stanja, poslovnih ukrepov in podobno. Torej, mi smo tudi zakon o referendumu sprejeli na temelju teh določb in zato smatram, da gre pravzaprav tukaj za praktično nadaljevanje kurza, ki smo ga sprejeli z referendumom in ki nam je bil pravzaprav s posebnimi dogodki tako rekoč vsiljen; drugačen tempo, mislim, da je potem to upravičeno."
26,"Zato bi dal ta predlog na glasovanje, seveda predhodno pa bi želel ugotoviti navzočnost in tudi sklepčnost. Prosim, najprej delegate Družbenopolitičnega zbora, da izkažejo svojo navzočnost?"
6,Torej sklepčnost je podana. Zbor občin?
7,Tudi podana sklepčnost. In Zbor združenega dela?
7,"Ne, ponovimo še enkrat Zbor združenega dela?"
20,"Hvala lepa. Kljub temu je sklepčnost podana. Ugotovim, da je na podlagi tega kvoruma podana sklepčnost celotnega zbora kot celote."
75,"Preden preidemo na dnevni red bi predlagal, če se strinjamo, da potrdimo, da se to skupno zasedanje spremeni oz. prekvalificira v skupno sejo glede na to, da bi na podlagi referata predsednika Izvršnega sveta kot je predviden, in na podlagi razprave tudi sprejeli potrebne sklepe. Sklepe lahko sprejemamo samo kot celoto, ali pa se moramo potem raziti po zborih, da bi vsak zbor posebej, vendar iz tehničnih razlogov mislim, da je bolje, da tako postopamo."
18,"Torej, kdor je prosim za to, da prekvalificiramo to skupno zasedanje v skupno sejo, prosim, da pritisne tipko!"
3,Kdo je proti?
4,Se je kdo vzdržal?
1,Hvala.
29,"Torej potem mislim, da lahko preidemo na dnevni red. Dnevni red ste prejeli oz. ste prejeli s sklicem, in sicer UKREPE REPUBLIKE SLOVENIJE ZA UREJANJE GOSPODARSKIH ODNOSOV V JUGOSLAVIJI."
80,"Dnevni red, kot sem že povedal, je bil narekovan z nujo, ki so jo povzročili izredni dogodki na gospodarskem področju, konkretno tako imenovani vdor v monetarni sistem, ki ga je povzročila odločitev Skupščine Srbije in na podlagi tega je Izvršni svet naše Skupščine pripravil poseben memorandum o stališčih glede na urejanje gospodarskih odnosov v Jugoslaviji. Za to, kot sem že rekel, rabi legitimiranje Skupščine za te ukrepe, ki jih hoče izvesti in prosim, če se s tem dnevnim redom strinjate."
10,"Prosim, če pritisnete na tipko, kdor se strinja s tem?"
1,Proti?
1,Vzdržani?
82,"Torej ugotavljam, da je tak predlog dnevnega reda sprejet. Ob tem še opozarjam na sledeče: Glede na to, da smo to prekvalificirali kot skupno sejo, katere delovno področje je omejeno z citiranim členom ustave, ki sem ga prebral, bi opozoril na to, da dnevni red te seje ni mogoče razširjati z drugimi predlogi, pa tudi sama razprava, torej, da ne bi tudi potem jaz mogel dovoliti razprave, ki bi šla izven tega kroga, ki smo ga določili s tako sprejetim dnevnim redom."
10,"Na podlagi tega prosim predsednika Izvršnega sveta, da poda referat."
50,"Spoštovani! V 7. točki, strinjam se s pripombami. Najprej to, kar je nazadnje govoril gospod Kreft, da se prvi del preoblikuje tako, kot je rekel, namesto drugega dela stavka in prouči predloge za internacionalizacijo tega vprašanja, pa naj pride ""in pripravi ukrepe za vključitev Republike Slovenije v Organizacijo združenih narodov""."
6,Hvala lepa. Besedo ima Ivan Dretnik.
1,Logično.
21,"Gospod poslanec, mislim, da se nisva razumela. Jaz sem ravno rekel, da bom dal na glasovanje. Prosim, Janša želi še besedo."
15,"Dobro, dajem ta predlog, pravzaprav konzumiram, to tudi moje mnenje, oba predloga dajem na glasovanje."
4,Kdo je prosim za?
7,Torej moramo najprej ugotoviti sklepčnost. Družbenopolitični zbor.
5,Medtem ugotovimo sklepčnost Zbora občin.
3,Zbor združenega dela?
8,To se pravi moramo počakati na Družbenopolitični zbor.
23,"Prosim, Družbenopolitični zbor še enkrat prosim, da poskusimo še enkrat navzočnost. Dobro, naj gredo strokovne službe pogledati dol, če je še kdo v"
22,". Stanje se očitno spreminja. Ali lahko poskusimo za Družbenopolitični zbor? Zdaj ugotavljamo navzočnost. Prosim, če pritisnete na gumb. Se pravi, 47. Nesklepčnost."
51,"Še enkrat ponavljam. Gre za odločitev o tem, da danes formiramo komisijo iz predstavnikov vseh strank, konkretno vodje klubov formirajo komisijo, pri kateri sodelujejo tudi člani vlade in definitivno predlagajo predlog sklepov, ki bi jih ta zbor sprejel. Seveda to danes. Če ste za ta predlog, prosim, če pritisnete na gumb."
41,"Sto triinštirideset. Se pravi, ta predlog je sprejet. Zato bi zdaj prosil vodje klubov, da se zberejo v salonu in prosim tudi člane vlade, da pri tem sodelujejo in formulirajo predlog sklepov, vključno z vsem tistim, kar je bilo tukaj predlagano."
7,V ta namen odrejam eno uro pavze.
69,"Spoštovano predsedstvo, spoštovani poslanci, poslanke! Sem sem prišel v imenu kluba Socialdemokratske stranke, ki podpira sklepe vlade, kot tudi memorandum. Kot vsi tisti, ki so pred mano diskutirali in so veliko, veliko tega povedali, bi se lahko šel ponavljanja, vendar to ni izvirno. Lahko navedem samo nekaj stvari, kar je bilo povedano na našem klubu, da ugotavlja, da so ti sklepi, nekako za dobo, v kateri se nahajamo, preohlapni."
86,"Nadalje. Nekateri sklepi zahtevajo hitro operacionalizacijo. To se pravi, hitra izvršitev sklepa. Reševanja naj bodo hitra tudi iz tega razloga - ne bi hotel sedaj, ampak bom vseeno porabil prispodobo, da bodo biologi kaj kmalu ugotovili da imamo Slovenci 20 kož. Nam jih že snemajo eno za drugo. Smo prelisičeni, mogoče po svoji lastni nerodnosti, ker se na to ne znamo pripraviti. Mogoče zaradi tega, ker nimamo državnostnih izkušenj, mogoče zaradi tega, ker smo preslabo obveščeni. Težko bi bilo iskati vzroke na tem istem mestu, zakaj tako?"
207,"V vabilu smo danes imeli točno napisano, ukrepi Republike Slovenije za urejanje gospodarskih odnosov v Jugoslaviji. To je velikanska dilema, kaj sploh lahko še mi urejamo na teh pozicijah? Vprašam se, ali ne bi mi morali biti prvi, ki bi morali jugoslovanski vladi že pred meseci poslati prvi račun, ki je bil dokaj velik in še zmeraj občuten v slovenskem gospodarstvu za blokado našega slovenskega gospodarstva, za zapiranje jugoslovanskega tržišča, ki je imelo zelo velike posledice za razvoj stanja v slovenskem gospodarstvu. Danes vidimo in smo priča vsakdanjim stečajnim postopkom. Takrat smo nekako nemarno zamahnili z roko in rekli, ja 20, 15% to ne bo takega učinka. Dobro, povejmo si, kje imamo mi več kot 15 ali 20% akumulacije? V katerem podjetju imamo mi toliko akumulacije, če je eno podjetje bilo ob 20% pred štirimi meseci, 4 x 20 je 80, to se pravi še 20, pa bo v stečaju. Kdo je ta stečaj povzročil? Zakaj se mi nismo temu uprli malo bolj vidno, kakor smo se sicer? Vdor v monetarni sistem. To so bile planirane konsekvence enega do drugega. Kaj bo jutri nastalo, si lahko samo predstavljamo, da bomo priča novim in novim zapletom, ki nas bodo ponovno siromašili, ki nam bodo ponovno uničevali naše gospodarstvo."
79,"Zaradi tega ponovno naši vladi: hitro ukrepanje na monetarnem sistemu! Kako bodo to naredili, je vprašanje strokovnosti, v katero se s tega mesta po mojem ne velja spuščati. Pripravo na zapuščinsko pogajanje, ki naj bo temeljito kar se da, da vsaj tu ne bomo toliko izgubljali, kot smo do sedaj, in ne nazadnje moramo priti do ciljev umirjanja situacije v naši republiki, da bomo lahko tisti, ki imamo voljo ustvarjati, lahko začeli ponovno delati kot je treba, ustvarjati, proizvajati."
143,"In ne nazadnje bi rad odgovoril, mogoče to ni umestno, ampak kljub temu ne morem mimo dejstva, bi rad odgovoril na žalitve, ki jih mi toliko let mirno prenašamo, in sicer v ""Politiki"" je bilo zapisano tako: da naj Slovenci ob svojem odhajanju dobro premislijo, da kot kulturni narod naj prvo ugotovi, kako bo plačal račun v balkanski krčmi za ekonomske dolgove, za finančne dolgove, za kulturne dolgove. Jaz bi imel eno besedo, zelo kratko bi na to odgovoril. Mi smo v to krčmo vlagali in smo si za naprej plačali bivanje najmanj za 100 let. Odhajamo iz te krčme iz mnogo vzrokov, ki so se kristalizirali skozi leta, ugotavljali, da smo takšni, da smo drugačni, da želimo drugače delati itd. Odhajamo tudi na ta način, da se ne bi hoteli na koncu pokregati do kraja, vendar le s čistimi računi. Hvala lepa."
6,Hvala lepa. Besedo ima Andrej Magajna.
105,"Spoštovani! Tudi sama vidim vsebinsko povezavo med monetarnim vdorom Srbije in med ukazom Predsedstva SFRJ predvčerajšnjim. Zato želim spregovoriti prav o tej temi. Domnevam, da je besedilo ukaza neposredno pripravil Zvezi sekretariat za ljudsko obrambo, in to še v času pred volitvami v Srbiji in Črni gori, ko je Jugoslovansko ljudsko armado še močno skrbelo, kako bi si ohranila položaj pomembnega političnega dejavnika na jugoslovanskem prizorišču in ko sta Hrvaška in Slovenija javno zahtevali depolitizacijo armade. Domnevam torej, da je bil predlog tega ukaza izdelan že v času, ko še ni bilo jasno, ali bodo komunisti preživeli kot vodilna politična sila v kateremkoli delu Jugoslavije."
158,"Ta scenarij za uveljavitev vojske kot varuha socialistične in centralizirane Jugoslavije je postal zdaj znova aktualen. Ima pa druge vsebine, ker je nastal v času pričakovanj, točneje povedano, negotovosti o razpletu volitev v Srbiji. Zdaj gre za ukrep, ki je pisan na kožo in v korist dveh republik, ki sta hkrati za Jugoslovansko ljudsko armado najpomembnejši. Ne gre namreč pozabiti, da so v starešinski sestavi Jugoslovanske ljudske armade Srbi in Črnogorci zastopani s 70 odstotki. Hkrati gre za ukrep, ki je pretežno usmerjen zoper nekomunistično hrvaško vodstvo, vsaj tako se zdi. Ravno ta ukrep pa je nesporno pokazal, da še vedno obstoji dejanska nevarnost za utrditev demokratičnih ureditev v republikah in za izgradnjo pluralistične ureditve celotne Jugoslavije. Ukrep daje možnost, da se s civilnim pokritjem vpelje vojaško varuštvo, tutorstvo in nadzor nad celotnim ozemljem Jugoslavije. Naravnost povedano pa ta ukrep daje podlago za možnost prikritega vojaškega udara, čeprav ima videz korektne zaskrbljenosti za nelegalno delovanje nelegalno oboroženih skupin."
56,"Ne bi posebej govorila o točki 5 ukaza Predsedstva, ki govori o tem, da bo Jugoslovanska ljudska armada, če tega ne bodo zmogli drugi organi, zagotovila zaščito državljanov in njihovih pravic. Ta zadeva je tako prozorna in tako značilna za našo realsocialistično preteklost, da Predsedstvu SFRJ lahko resno očitamo pomanjkanje slehernega občutka za sodobnost in realnost."
111,"In še nekaj. Predsedstvo SFRJ bi moralo pravočasno opozoriti prav nelegalne posestnike orožja v Kninu, naj za božjo voljo nikar prav oni ne pozdravljajo prvi tega ukaza Predsedstva. Ali pa so se nemara hoteli odkrito zahvaliti za podporo Predsedstva. Trdim, da je več kot nesporno, da Predsedstvo SFRJ ni legitimno, saj ne predstavlja že dolgo ne več interesov celotne Jugoslavije in vseh narodov. Zato predlagam, da Skupščina Republike Slovenije sprejme sklep, da ne sprejme in ne bo sprejela ter spoštovala nikakršnih ukazov in obvezujočih sklepov Predsedstva SFRJ, ki bodo sprejeti s preglasovanjem in ne s konsenzom. Mislim, da je to pomembno zlasti zaradi vloge Predsedstva SFRJ kot vrhovnega komandanta oboroženih sil."
66,"Kar pa zadeva predlog gospoda Peršaka, da bi Ustavna komisija že danes prišla v Skupščino s predlogi ustavnih amandmajev in ustavnih zakonov, pa moram povedati, da s tem ne soglašam. Že od sprejetja zakona o plebiscitu vemo, da bodo nadaljnje spremembe veljavne ustave nujno potrebne in domnevam, da so v tem smislu tudi pripravljeni vsi predlogi vlade, ki jih bomo obravnavali na ponedeljkovi seji Ustavne komisije."
18,"In končno bi morali vsaj poskušati minimalno spoštovati ustavna in poslovniška določila, ki obvezujejo to skupščino. Hvala lepa."
129,"Spoštovani predsednik, spoštovane poslanke, poslanci! Izhajam iz Ptuja. Nisem bil namenjen se v tem trenutku tukaj zglasiti, vendar na razpravo in pa tudi, ko se je to najhujše pojavilo v Jugoslaviji, kot smo slišali, mirno rečem tatvina, so mi volivci le rekli, da naj bomo malo bolj pozorni v tej naši slovenski hiši. Zato prvo menim in čutim, da je popolnoma prav da je gospod predsednik Skupščine sklical danes to izredno skupščino. Zakaj je prav? Nekateri so rekli da ne. Bilo je ugibanje levo, desno. Ne pozabimo, tu smo Slovenci doma in če smo tu Slovenci doma, potem moramo za svoj dom v vsakem trenutku resno reagirati, ker drugače bodo na našem domu vse vogale drugi podprli in ne samo oskrunili. Zato menim, da je ta sklic popolnoma pravilen."
419,"Podpiram, ker sem se tudi tako posvetoval, memorandum in pa tudi sklepe, ki so predloženi. Vladi je očitano, da nima programa. Preživeli smo desetletja, ko smo vsakih nekaj let, pa skoraj vsako leto prebrali po centimeter do dva debele programe, ki so jih vlade v tej hiši predlagale, pa jih v tej hiši sprejemale. In kaj je iz tako debelih programov zraslo, ne bom govoril, ker vemo. Zato menim in popolnoma zaupam vladi, katero smo izvolili in za katero danes moramo vsi v tej hiši stati, da ji damo vso pomoč da dela. Ona pa dela in vestno dela. Bilo je slišano danes, da je gospod predsednik vlade ni vsega povedal, kar bi moral. Pa naj mi ne bo zamerjeno, ker je resnica; potem je ta tudi huda. Gospod predsednik slovenske vlade je govoril nekaj minut in jaz kot preprost slovenski kmet sem ga razumel. Ko sem pa 26. decembra poslušal predsednika Predsedstva skoraj 40 minut, pa sem si zelo malo zapomnil in ne vem, kaj tudi iz vsega tega bi bilo. Ko sem poslušal predsednika Skupščine istega dne, gospoda Bučarja, sem si vsaj nekaj zapomnil, pa sem tudi vedel nekaj svojim volivcem povedati. To je rekel gospod predsednik Bučar, kaj je pa rekel predsednik Bučar kaj je pa rekel predsednik Skupščine pa sem dve tretjini pozabil. Oziroma predsednik, oproščam se, predsednik Predsedstva Slovenije. Tako, se oproščam. Res je, oprostite mi na tej strani, nisem tako izvežban govornik moram pa reči, da si upam trditi, da pa imam dokaj čisto vest in s to čisto vestjo sem tudi danes sem naprej stopil zaradi tega, da ne bi več naši vladi nagajali, ampak ji pomagali. To je naša dolžnost, da jim pomagamo in še nekaj, da pa naša vlada, bilo je tudi rečeno, da bomo imeli socialne nemire. Kolikokrat prav ti, ki ste se nasmejali, ste rekli, hočemo imeti tržno gospodarstvo, danes pa, ja, sedaj bodo socialni nemiri. Ja, sedaj katero je pa pravo? Menim, da je naša vlada danes v zelo težkem položaju. Pa se opravičujem, ker bom mogoče spet doživel smeh. Naša vlada, pa ne samo naša vlada, vsi mi Slovenci smo danes postavljeni pred nekaj. Sem kmet in sem bil dolga leta konjerejec pa ne med najslabšimi, verjetno ne. Ampak vem to, da kadar se konj postavi na zadnje tace, potem, pazi se prvih, ker ima prve v zraku. In te prve noge konjske so prav sedaj oprte na nas, Slovence in na našo vlado. Stojmo ob vladi, da nas ne bo konj po glavi! Hvala lepa."
146,"Spoštovani gospod predsednik, kolegice in kolegi! Govorim v svojem imenu pa tudi sicer menim, da bi bilo zgolj usklajevanje strankarskih stališč za to skupščino tragično. V obdobju usodnih odločitev potrebuje slovenski narod, slovenska Skupščina in njeno politično vodstvo trezno, hladno glavo, sposobnost dolgoročnega strateškega razmišljanja in učinkovito in hitro ukrepanje. Zavedati se moramo, da so spoznanja trenutka in izbruhi jeze le kratkoročnega značaja, naše odločitve in njihove uveljavitve pa bo imela izrazito dolgoročne posledice. Jugoslavija taka kot je, je nesporno preživela. Nove pa še nihče ni resno poskušal napraviti. Po mojem projekcija lastnih konceptov in želja še ni ta poskus, iskanja skupnih imenovalcev pa je malo ali pa nič. Če bomo skupno spoznali v Sloveniji, da moramo ven iz vsake Jugoslavije, potem storimo to odločno, brez sentimentalnosti in oziranja nazaj in z jasno opredeljenim programom. Pri tem bistveno opredeljuje naš položaj gospodarsko razsulo, ki je nezadržno."
213,"Ne vem, če se vsi dovolj zavedamo resnosti tega gospodarskega položaja. Tista naša podjetja, ki so bila še včeraj dobra, so danes že na robu propada. Za povprečne in slabe pa je pravi čudež, da sploh še dihajo. Slovenska vlada je več ali manj v položaju gasilca, ki gasi požar z nič ali malo vode. Država SFRJ nekontrolirano razpada. Celo Marković, če pazljivo gledam televizijo, se vse redkeje smehlja. Razpada avtoriteta inštitucij, ruši se etika družbe, ne spoštujejo se norme od ustave do zakonov. In če kdo misli, da se na Slovenskem držimo ustave, naj jo še enkrat izvoli prečitati. Razpada hirarhija odnosov, ki so conditi sine quanon sleherne države ali državnosti. Tu naj omenim, da je v zasnovi ideja in praksa sleherne države v urejanju družbenih razmerij z inštrumenti oblasti. Oblast pa je sinonim za monopol fizične prisile. Brez učinkovite uveljavitve družbenih oz. državnih norm, torej tudi brez prisile, če drugače ne gre, ni nikakršne države, nikakršne oblasti, ampak je anarhija, ki sicer odgovarja balkanski mentaliteti in tradiciji, o kateri pa se vsi skupaj gremo, kdo bo koga. Če se strinjamo, da bomo stvari bolje uredili doma, na Slovenskem - plebiscit je nesporno za to dal vsa pooblastila - potem zaščitimo našo suverenost in prihodnost z učinkovitimi ukrepi. Naivnost je pri tem slabo opravičilo."
110,"V jugoslovanskih razmerah anarhičnih in fevdalnih partikularističnih interesov, mogotcev različnih provinenc, so uspešnejši tisti,ki so nesramnejši, hirejši, učinkovitejši, tisti, ki jih v njihovem ravnanju ne ovirajo nobene skupne ali pravne ali etične norme, bivše ali sedanje. V igri brez pravil igre je važno samo to, kdo je močnejši in spretnejši. Temu običajno uspe, tisti pa, ki se post festum pritožuje, pa le javno priznava svojo nemoč, priznava, da je neuspešen, da je šibkejši in taka je večina reakcij na srbski vdor v monetarni sistem, na nesramno krajo denarja iz slehernega žepa v Jugoslaviji, v katerem je še kak dinar, v bistvu izraz nemoči, parada neučinkovitosti, klic vpijočih v puščavi."
136,"Slovenci smo pri tem v kontradiktornem položaju. Pritožujemo se, ker je do vdora v monetarni sistem sploh prišlo in da srbskega kriminalnega dejanja niso preprečile zvezne oblati. Teza sicer sama po sebi ni napačna, toda ali se zavedamo, da smo nekonsekventni in da smo avtoriteto te zvezne oblasti tudi sami ničkolikokrat sistematično in zavestno razgrajevali. Mislim, da mi ni potrebno citirati primerov. V takih razmerah bi nam, če imamo kaj pameti v glavi, moralo biti jasno, da razpadanje države in razsulo gospodarstva ne pozna oz. še bolje, ne priznava norm in da so še tako neugodna presenečanja zgolj uvertura v še bolj neugodne doživljaje in dogodke. Bojim se, da najneugodnejših presenečenj še nismo dočakali in da nanje tudi nismo ustrezno pripravljeni. Zato se je zadeve potrebno lotiti sistematično, z naprej določenimi programi, s scenariji in načrti."
