6,"Sem rekel, da ne bom glasoval."
52,"Glasoval bom proti temu amandmaju. Ta amandma je ozko povezan s 3. členom tega zakona, ki ga Vlada vlaga in je tudi naš matični odbor bil za takšen člen, kot je tukaj napisan 3. člen. Glasoval bom za ta člen, ki je tukaj napisan in proti temu amandmaju, o katerem sedaj glasujemo."
9,Hvala. Sedaj je gospod Pregelj in potem gospod Potrč.
20,"V zakonu res piše, da gre za spomenike, ki so v javni ali družbeni lasti, v prvem odstavku tega člena. ..."
0,...
69,"Pojasnilo gospodu Potrču, ker njegove namere so seveda zelo dobronamerne, to, kar je govoril. Samo poglejte, za kaj gre? O čem govori 4. člen? 4. člen govori o tem, da se lahko razdrobi tisto, kar je spomenik. Zato pa naš odbor predlaga, da črtamo v tej noveli zakona ta člen ravno zato, da bi Vlada prišla do boljše rešitve, ki bi bila sprejemljiva tako za ljudi kot za stroko."
162,"Spoštovani, se oproščam (moral sem biti zunaj), vendar ta 3. člen, sem zadnjič že govoril, da je pameten takšen kot se sedaj predlaga na novo. Da postane lastnik teh naravnih znamenitosti ali teh spomenikov, tudi kulturnih spomenikov, da postane država lastnik tega, ne občina; ker je to širše varovanje tega. In je ta stvar bolje spravljena, vsekakor, kakor bo v občini. Govorim vam zopet iz lastnih izkušenj. V Nemčiji so lastniki posestniki, kjer so vsi srečni, ker imajo takšne znamenitosti, ampak znamenitosti prodajo državi. Zato je bolje, da je država lastnik, ne občina, ki lahko slabše s tem gospodari, kar se ljudje med seboj poznajo in nimajo širših pogledov na te zadevščine. Zato bom vsekakor glasoval za to, da se to ponudi ob prodaji, ob odtujitvi takšne znamenitosti, vsekakor državi, ne pa občini. Torej za to bom glasoval kot novi člen tudi predlaga. Nikakor pa ne tako, kot je stari člen to opredeljeval. Glasoval bom za novi člen, takšen kot je napisan."
13,"Se pravi za amandma, da se člen črta. O tem se sedaj opredeljujemo."
5,"Hvala lepa. Prosim, Rudi Šeligo."
6,Hvala lepa. Prosim še dr. Capuder.
30,"Če ni več razlage glasov, prehajamo na glasovanje. Ugotavljamo navzočnost. 38 prisotnih. Ali lahko še enkrat prosim, da potrdite svojo navzočnost. Ste vsi? Gospod Franko, lahko še vas prosim? Hvala."
3,Kdo je za?
17,"Je kdo proti? Prosim, da ne odhajate, ker moramo še zakon izglasovati. Sedaj sta dva odšla ven"
4,Se je kdo vzdržal?
5,"Ugotavljam, da je amandma sprejet."
11,S tem sta postala amandma gospoda in amandma Zakonodajno-pravne komisije brezpredmetna.
24,"Sedaj moramo glasovati še o zakonu, vključno z amandmaji, ki smo jih sprejeli. Prosim, da ugotovimo navzočnost. Vse navzoče poslance prosim za potrditev prisotnosti."
20,"Oprostite, še trenutek. Amandma Zakonodajno-pravne komisije se nanaša na kazensko določbo, da se doda nov člen. Se opravičujem. Ugotavljamo navzočnost!"
49,"Se opravičujem, ker je napisano kot amandma na 4. člen, v resnici gre za dodatni člen. Amandma se glasi, da se doda nov 4.a člen, ki se glasi: v 106. členu se 12. točka spremeni, tako da se glasi - če krši predkupno pravico republike, da pride do sankcije."
3,Kdo je za?
3,Je kdo proti?
4,Se je kdo vzdržal?
5,"Ugotavljam, da je amandma sprejet."
6,"Glasujemo o zakonu, vključno z amandmaji."
3,Kdo je za?
3,Je kdo proti?
4,Se je kdo vzdržal?
5,"Ugotavljam, da je zakon sprejet."
6,S tem smo to točko zaključili.
37,"Določiti moramo še delovno skupino za usklajevanje za ta zakon, če bo potrebno. Pet predlogov za to delovno skupino: Vano Gošnik, Ciril Kolešnik, Rudi Šeligo, Žarko Pregelj, ostale bomo po pavzi imenovali, ker sedaj tako nismo sklepčni."
17,"Določam 45 minut pavze. Prosim, da smo po 45-tih minutah nazaj, ker nas čaka še glavno opravilo."
10,Hvala lepa. Še dr. Capuder bo govoril in Rudi Šeligo.
16,"Ne, ne. počasi. Samo malo, poslanec Vano Gošnik: vsak ima pravico pojasniti samo svoj glas. Hvala."
146,"Glasoval bom proti temu amandmaju, ne zato, ker bi nasprotoval potrebi, da se varujejo spomeniki, ampak iz razloga, ker niti delovno telo niti predlagatelj ni bil ob koliziji interesov pripravljen najti rešitev, ki bi bila sprejemljiva za ljudi in sprejemljiva za varstvo spomenikov. Ob tem, ko je ob tej koliziji dal prednost zgolj samo spomenikom, ne pa tudi ljudem, bom glasoval za to, da se ta amandma ne sprejme, da bi prosil, da še naprej razmišlja o rešitvi te problematike. MI smo z zakonom o stanovanjskem gospodarstvu ustvarili nekaj kategorij ljudi, s tem ustvarjamo novo kategorijo. Pri zakonu o denacionalizaciji nismo čutili problema, kako bodo bivši nacionalizirani lastniki ob vrnitvi naprej gospodarili s tem fondom; sedaj, ko bi šlo za stanovalce, ta problem čutimo. Skratka, gre za popolnoma različne kriterije, ki jih imamo in zato bom glasoval za to, da se ta amandma ne sprejme. Hvala."
7,"Hvala lepa. Še kdo? Če ni, glasujemo."
10,"Kdo je za amandma, da se ta 3. člen črta?"
3,Je kdo proti?
4,Se je kdo vzdržal?
5,"Ugotavljam, da amandma ni izglasovan."
100,"Dalje glasujemo o drugem amandmaju Žarka Preglja k 3. členu, kjer predlaga, da se 40. člen osnovnega zakona spremeni, tako da se glasi: ""Imetnik, ki namerava spomenik ali znamenitost prodati, ga mora ponuditi najprej občini, na območju katere je spomenik ali znamenitost in republiki ter navesti označbo in ceno spomenika ali znamenitosti ter druge prodajne pogoje. Pri nakupu ima prednost občina, ki mora v 30 dneh sporočiti imetniku, ki prodaja spomenik ali znamenitost in republiki, ali sprejema prodajno ponudbo. Če občina v roku iz prejšnjega odstavka ne uveljavi predkupne pravice, jo lahko uveljavi republika v nadaljnjih 6 do 10 dneh."""
2,Ugotovimo navzočnost!
3,Kdo je za?
19,Je kdo proti? Prehitro. Ponavljam glasovanje od 43 navzočih. Vano Gošnik želi obrazložiti svoj glas. Mi smo v glasovanju.
6,Gospod Buser bo še pojasnil glas.
82,"Hvala lepa. Ko sem hotel obrazložiti glas, je glasovanje že teklo. Zelo hitro je šlo, se opravičujem za to. Glasoval bom proti temu amandmaju in to iz povsem jasnega razloga. Odbor za kulturo in varstvo kulturne dediščine kot matično telo ni, če smem uporabiti to besedo, prepustil spremembe tega zakona v skupščino, kasneje pa se je na posebno vztrajanje Komisije za varstvo okolja strinjal s spremembo 3., 21. in 29. člena, predvsem zato, da bi lahko zaščitili ogrožene živalske in rastlinske vrste."
155,"Sedaj glasujemo seveda tudi o drugih amandmajih, s katerimi se matično delovno telo ni strinjalo in člani te komisije smo odigrali nekakšno vlogo trojanskega konja. Ker smo dobro voljo odbora, zdaj drugič, izredno spretno, na naš predlog, izrabili. Seveda, vsebinski razlog je pač ta, da bi tudi novi zasebni lastniki delov teh zgradb v zgodovinskih objektih, po besedilu zakona, morali vse posege v stanovanjih opravljati v skladu z zahtevami spomeniškega varstva in tako dalje. Seveda bi morali - toda vprašanje je, če bodo. Izkušnje do sedaj, in tudi v bodoče, bodo prav takšne, kot so bile do sedaj. Seveda bodo morali, ampak tega ne bodo počeli. Zato bomo izgubljali zgodovinske spomenike, gradovi se bodo razdeljevali na več lastnikov, ne bodo vzdrževani, tako kot bi morali biti, adaptirani bodo drugače, kot bi smeli biti. Zato seveda mislim, da je potrebno to zadevo v celoti in sistemsko rešiti. Predlagam vam skratka, da ne glasujete, tako kot bom jaz..."
19,Prosim samo vsak za sebe. Mi smo sedaj pri predlogu amandmaja gospoda Žarka Preglja. Sedaj ima besedo gospod Buser.
97,"Spoštovani zbor! Po zdravi logiki, če smo izglasovali amandmaje k 3. členu (ki predstavlja varovalko tega kar bomo sedaj glasovali), je popolnoma odveč ali brezplodno sedaj razpravljanje o tem 4. členu. Jaz bom glasoval, da tako ostane. Glede te diskusije, ki je bila že ponovljena, se mi pa zdi, da je precej demagoška. Ne bi želel še enkrat ponavljati razlogov. Gre za to, da neki fond, razumen fond preide v privatno last, da bodo z njim gospodarili, seveda ob upoštevanju vseh teh varovalk in ob nadzorstvu oziroma ob vetu pristojnih zavodov za naravne in kulturne spomenike. Hvala."
1,Hvala. ...
5,... Replik v razlagi glasu ni. ...
9,"... Dobro, gospod Šeligo ima besedo in potem gospod Buser."
174,"Glasoval bom za amandma odbora v katerem sodelujem, torej, da se 4. člen črta. Govorili smo bolj obsežno v sredo o tem, jaz sem še zbiral informacije od strokovnjakov in bi rad argumentiral to dejstvo, da bom glasoval za to, da se 4. člen črta na naslednji način: gre za spomenike, ali za znamenitosti, ki so že v javni, ali družbeni lasti. To se pravi: vzpostaviti zvezo s prejšnjim 3. členom - kdo ima predkupno pravico, država ali občina - je popolnoma druga stvar, popolnoma druga stvar. Ne more država sebi prodajati. Tukaj gre za spomenike, ki so že v javni lasti in že razglašeni kot spomeniki in gre za to, da z novim zakonom naredimo tako, da spomeniki, ki so javni, v državni in družbeni lasti, naredimo na ta način, da del tega spomenika kupi tisti, ki notri stanuje. Za 2.500 mark dobi veliko stanovanje in vse kar je v zakonu o spomeniškem varstvu ne bo nič koristilo, da bi ta lastnik novega stanovanja ne povzročil popolne dezintegriranosti strokovnega nadzora oziroma tistega kar zakon predpostavlja."
48,"Jaz sem hotel razjasniti, ne vem točno, o čem delamo. Namreč, jaz sem dal en popravek tega amandmaja. Šlo je zaradi dopolnil, tako da zdaj sta v bistvu tukaj dva teksta. Zdaj me zanima, kateri je v igri. In tudi mislim, da nimamo mi vseh tekstov na mizi."
60,"Kot poslanec bom glasoval za ta amandma, ker smiselno uveljavlja varovalke, o katerih smo že govorili v razpravi v tej Skupščini. Hkrati pa bi malce protestiral proti tako nekompetentni razlagi, govorjenju o zakonu: ""če bo sprejet, ga pač ne bodo izvajali"". To velja za vsak zakon in to še ni razlog, da nekega zakona oziroma amandmaja ne bi sprejemali. Hvala."
19,"Najprej glasujemo o tem, da se ta člen črta, ki ga predlaga Odbor za kulturo in varstvo kulturne dediščine."
29,"Kdo je za, naj prosim glasuje? 3. člen zakona, da se črta. Predlagatelj je Odbor za kulturo in varstvo kulturne dediščine. Prosim, gospod Buser bo povedal, zakaj in kako."
73,"Spoštovani! Glasovati bom moral proti temu členu, kajti v njem sta dve stvari - spomeniki in znamenitosti - izven stanovanjske zadevščine, kot bi rekel. Če bi bil samo prvi odstavek oziroma prvi dve vrstici, bi glasoval za ta člen. Ker pa sledi še druga določba v tem členu, zaradi tiste, ko je pa mogoča odprodaja stanovanj v spomeniških zgradbah, bom pa glasoval zaradi te druge določbe proti temu členu. Jaz bom glasoval proti temu členu."
6,Glasujemo vsak za sebe. Ugotovimo sklepčnost!
6,Glasujemo o prečitanem amandmaju Žarka Preglja.
3,Kdo je za?
3,Je kdo proti?
6,Se je kdo vzdržal? 16 poslancev)
5,"Ugotavljam, da amandma ni izglasovan."
100,"In sedaj glasujemo o naslednjem amandmaju k istemu členu, kjer se predlaga, da se v 3. členu beseda ""republiki"" nadomesti z ""občini"". Doda se nov drugi odstavek, ki se glasi: ""Občina je dolžna v 30-tih dneh po prejemu ponudbe obvestiti republiški upravni organ, pristojen za kulturo, ali bo sprejela ponudbo iz prejšnjega odstavka. V primeru, če občina izjavi, da ponudbe ne bo sprejela, sme to storiti republika. Sedanji drugi odstavek postane tretji"" Amandma je vložil Janez Kopač. Matični odbor je dal svoj amandma, Zakonodajno-pravna komisija pravi, da je to vsebinsko vprašanje, Izvršni svet pa ne podpira. Navzočnost se ni spremenila."
3,Kdo je za?
3,Je kdo proti?
4,Se je kdo vzdržal?
8,"Ugotavljam, da amandma ni izglasovan od 42 navzočih."
0,...
35,"... Prosim v izogib nesporazumom ponovno ugotavljamo navzočnost. Brez Gajška, z Gajškom, ki prihaja, nas je komaj 41. Z Gajškom nas je sedaj 41. Še gospa Spomenka Hribarjeva je sedaj prišla. Ponovno ugotovimo navzočnost. Ugotavljamo navzočnost!"
13,"V dvorani nas je 44 poslancev! V dvorani nas je 44. poslancev! Prosim, ..."
11,"... ne, ne, govorim o poslancih Družbenopolitičnega zbora. Prosim, ugotavljamo ponovno navzočnost!"
3,Kdo je za?
3,Je kdo proti?
4,Se je kdo vzdržal?
5,"Ugotavljam, da je amandma izglasovan."
49,"Naslednji amandma imamo k istemu členu. Zakonodajno-pravna komisija predlaga, da se drugi odstavek spremeni, tako da se glasi: v drugem odstavku se besedi ""60 dni"" nadomesti z ""90 dni"" in besedilo ""nobeden od predkupnih upravičencev"" nadomesti z besedilom ""predkupni upravičenec"". Navzočnost se ni spremenila. Zakonodajno-pravna komisija je vložila amandma."
3,Kdo je za?
3,Je kdo proti?
4,Se je kdo vzdržal?
36,"Dalje, glasujemo o naslednjem amandmaju k 4. členu, ki predlaga, da se ta člen črta. Predlagatelj je Odbor za kulturo in varstvo kulturne dediščine. Gospod Tone Peršak bo povedal zakaj in kako, naslednji je Rudi Šeligo."
207,"Glasoval bom za ta amandma, čeprav sem na ta člen dal tudi svoj amandma, ki sicer je nek kompromis, ampak v resnici slab kompromis. Predlagam, da se ta člen črta in ta problematika, ki naj bi jo reševal 4. člen, ki se v bistvu tiče stanovanjskega zakona, naj se reši na drugačen način. Nedvomno so ti, ki so v stanovanjih, ki se v hišah - spomenikih, prikrajšani za pravico, ki jo imajo ostali imetniki stanovanjskih pravic. Zato naj ustrezno ministrstvo poišče drugačno rešitev: ali nadomestna stanovanja ali kaj podobnega. Kajti v tem primeru bi bil sicer lahko del tega fonda prodan - kajti nekatere hiše so spomeniki zgolj zaradi svoje lepe lege, ali vogalna hiša, ali je na nekem nizu strnjenih hiš, ali gre zgolj za neko fasado - se pa strinjam s tistimi, ki trdijo, da bo problem, ali bodo taka pročelja potem vzdrževana; tu bodo brez dvoma problemi. Druga zadeva je pa ta, da so nekatere hiše spomeniki tudi zaradi svoje notranjosti. V Kopru imamo hiše, ki so v osnovi razdeljene na stanovanje, predhodno je bila pa to ena sama velika dvorana za sprejeme, npr. in še baročna po vrhu. Predlagam, da se ta člen črta in da se ta problematika rešuje na drugačen in ustreznejši način. Hvala."
129,"Jaz bom glasoval za amandma odbora in to iz preprostega razloga, ker če bomo izglasovali to, kar je v zakonu napisano, bomo povzročili poleg tega, da predvidevamo, da bomo povzročili tudi določeno kulturno škodo, povzročili bomo tudi neskončne pravde. Prišlo bo do tega, da bodo ljudje postali lastniki stanovanj v gradovih, v zgodovinskih vilah in podobnih zgradbah in bodo seveda kot lastniki želeli določene spremembe narediti. V mnogih primerih vemo, kako se ljudje obnašajo in bodo v to šli tudi brez dovoljenj in tako naprej. In to bo povzročilo neskončne komplikacije,neskončno tožarjenje in tako naprej in mislim, da preprosto pri zgradbah, ki so nacionalna vrednost, ki so v bistvu javno dobro po svoji naravi, ne glede na to kako so zapisane v zakonu, preprosto tega ne smemo dovoliti."
45,"Za amandma, da se člen črta. Da. Gospod Gošnik se smeje in vsi se smejete, vendar jaz pravim, gospod Šeligo ima zelo prav; ko bi pel pa na stanovanje naprej potem, bi pa videl, da bodo pa težje stvari. Torej bom glasoval proti temu členu."
26,"Prehajamo na ZAKON O NARAVNI IN KULTURNI DEDIŠČINI, ki nam je ostal. Medtem smo tudi prejeli dopolnilno poročilo, ki se za poslance že razmnožuje, glede proračuna."
19,Pri zakonu o spremembah in dopolnitvah zakona o naravi in kulturni dediščini s predlogom zakona imamo glasovanja o amandmajih.
16,"Prvo glasujemo o amandmaju k 3. členu. Prosim, samo 2 minuti potrpljenja, poslanci, pa imamo pavzo."
75,"Ugotovimo navzočnost! Navzočih je 41 poslancev.) Amandma k 3. članu predlaga, da se ta člen črta. Predlagatelj je Odbor za kulturo in varstvo kulturne dediščine, Zakonodajno-pravna komisija stališča ni dala, Vlada pa ga ne podpira. Prosim, Žarko Pregelj bo povedal zakaj in kako. Samo malo, prvo nesporno. Vi imate svoj amandma. Najbolj (po pravilih) odstopa od predloga, pravkar omenjeni amandma, da se ta amandma črta. Prvo, prodam, glasujemo o tem, potem pride vaš amandma. Prosim."
7,Hvala. Gospod Potrč bo pojasnil svoj glas.
