124,"Se pravi: potrebno bo proračun zmanjšati in ga prilagoditi obstoječim realnim virom. Predvsem tu mislim na vir carin, ki po mojem ni realen, kajti carine naj bodo izključno v funkciji zaščite, ne pa v funkcijo polnjenja proračuna, in naj bodo dejansko čim manjše, kajti tudi to je veliko breme za naše gospodarstvo, zlasti za izvozno, ki potem zopet dela z izgubo in ga moramo z dodatnimi stimulacijami ponovno ohranjati pri kolikor-toliko normalnem življenju. Mi se moramo v tem parlamentu zmeniti za prioritete, ki jih hočemo uveljaviti v tem obdobju. Te prioritete so predvsem znanost in razvoj oziroma ohranjanje in razvoj infrastrukture, predvsem prometne in telekomunikacijske. Tudi to je temelj, če hočemo pridobiti tuji kapital, da se bo dejansko začel tu oplajati in nekaj ustvarjati."
122,"Še enkrat ponavljam: proračun je z mojega vidika odločno prevelik; treba ga je zmanjšati in notranje prestrukturirati, predvsem v tem smislu, da dobi infrastruktura več. Konkretno za policijo menim, da je odločno preveč, zlasti po zadnjih informacijah, ko vidimo, da kupujejo drage avtomobile, ko pa vemo, da veliko ljudi že nima dovolj denarja za normalno eksistenco. In to je nemoralno in vsega obsojanja vredno dejanje in tu naj tudi vlada potegne določene konsekvence in ukrepe. Glede obrambe bi pa samo rekel, da pri postavkah, ki smo jih videli, naj ta resor ne vlaga v tej situaciji v zidove, ampak naj raje kupi učinkovito protiavionsko orožje, da se ne bodo avioni sosednjih držav, v tem primeru jugoavioni, nemoteno sprehajali po našem nebu. Hvala."
23,Hvala za besedo. Veliko besed je bilo že rečenih o posameznih postavkah republiškega proračuna. Rad bi povedal nekaj splošnih vtisov o osnutku proračuna.
210,"Vse razprave pravijo, da je prevelik. To je prvi vtis, in ta vtis se potem argumentira z različnimi dokazi, za mnoge, mislim, da so pač upravičeni. Raje bi rekel drugače. Javna poraba je prevelika. Ne samo osnutek proračuna. Javna poraba, skupaj z, torej osnutek proračuna, zdravstvo, poraba občin, občinskih proračunov in skupnost pokojninskega in invalidskega zavarovanja, pa še solidarnosti skladi in še tisto nekaj malo porabe, kar pač imamo, ki ni evidentirana v vsem tem, približno okrog 70% družbenega proizvoda. Ta odstotek je znan. Vendar, zakaj govorim o njem? Govorim zato, ker menim, da se mora republiška skupščina kot inštitucija najprej opredeliti ne do posameznih postavk proračuna; za to nismo kvalificirani, ampak do obsega javne porabe. Od tukaj dalje moramo začeti. Kajti, če se bomo pogovarjali o vsaki posamezni proračunski postavki, bomo hitro ugotovili, da je to potrebno, ono je potrebno in tako naprej, in to se potem nadgradi. Vlada oziroma posamezni resorji izhajajo na ta način z izračunom, s katerim potem pride do take gromozanske številke. Republiška skupščina mora imeti svojo politiko. In ta politika je, da določi plafon, limite javne porabe. Potem je pa treba znotraj tega porazdeliti javno porabo med skupnost pokojninskega in invalidskega zavarovanja, občinske proračune, republiški proračun, in zdaj po novem, ta posebni zdravstveni proračun."
37,"Odbor za javne finance in proračun je predlagal skupščini zelo restriktivno varianto obsega javne porabe. Pravi 50% družbenega proizvoda plus 6%, kar je približna številka 6% družbenega proizvoda, kar približno predstavlja nove obveznosti iz naslova javnega dolga."
41,"Če bomo uspeli zakon o javnem dolgu iz naslova deviznih hranilnih vlog poceniti s strani države, o čemer sem govoril prej, čeprav morda nekoliko nerazumljivo, lahko celo tukaj računamo na znižanje potrebnega obsega družbenega proizvoda za financiranje te novo nastale obveznosti."
82,"Pri osnutku proračuna bi rad govoril o kočljivih virih. Kočljiv vir, torej nestabilen in nepredvidljiv, je vir iz naslova prodaje družbenega premoženja v višini 15 milijard tolarjev, kar je zelo trhla postavka za planiranje proračuna, kajti, ne vemo natančno, kaj se bo zgodilo. Nimamo niti stabilne vlade niti stabilnega parlamenta in zato je zelo težko delati račun na taki predpostavki; torej na predpostavki, da bo zares prišlo do tolikšne prodaje družbenega premoženja in da bo ta denar zares prišel v republiški proračun."
55,"Zato menim, da bi bilo dobro že sedaj, v okviru tega proračuna, izločiti premoženjsko bilanco. Premoženjska bilanca ne sodi v ta proračun, čeprav nam zakon o financiranju javne porabe nalaga oziroma nalaga vladi, da do konca leta 1992 pripravi premoženjsko bilanco. Menim, da je treba poseben oddelek tega proračuna že sedaj oblikovati kot premoženjsko bilanco."
171,"Naslednja stvar, o kateri bi rad govoril je, da mora proračun biti odsev neke politike. Lani to na žalost ni bil pod to vlado. Kakšna so bila izhodišča za postavljanje proračuna? Mnogi se morda spomnite, da je vlada preprosto linearno realno 10% zmanjšala posamezne postavke. To se je zgodilo tako pri pravosodju in upravi, kjer je potem zaradi pomanjkanja nekaterih racionalizacijskih ukrepov, ki bi jih morda moral izvesti gospod Pirnat, prišlo do tega, da je bilo tega denarja premalo in so bili problemi. To se je zgodilo pri zdravstvu, kjer so racionalizacijski ukrepi bili sicer predvideni, pa smo jih v tej skupščini zavrnili in potem seveda je zmanjkalo denarja in tako naprej. Torej, proračun mora biti odsev neke politike. Te politike lani ni bilo za tem proračunom. Tudi letos je ne vidim, in zgodilo se nam bo verjetno to, kar se nam je lani. Vlada bo na vsak način vztrajala, da ima manevrski prostor za renominacije in bo te renominacije poljubno, tako kot je zdaj to, naredila že trikrat, tudi izkoriščala."
59,"Potrebno je varčevanje. Navedel bom samo nekaj ukrepov, ki jih vidim kot možne in ki bi morda zelo veliko prihranili tej naciji. Najprej vsi projekti, ki se financirajo iz proračuna, ki bi morali biti, torej izvajalci projektov bi morali biti izbrani na podlagi javnih natečajev. Javni natečaji so pravzaprav izjema pri naši proračunski porabi, kar nam odnese veliko denarja."
123,"Drug varčevalni ukrep je enotno računovodstvo, ki ga mora vzpostaviti vlada, seveda v okviru Ministrstva za finance. Sedaj se dogaja, da ima vsak resor svoje računovodstvo, čeprav so lokacijsko na istem področju, vendar vsak resor potem tudi sam najprej črpa denar iz proračuna, ga potem vrti po svoje in nakazuje po svoje. S tem je onemogočena tudi učinkovita kontrola s strani Ministrstva za finance, da ne govorim s strani Skupščine. Ta, vključno z Odborom za javne finance in proračun, ni sposobna voditi učinkovite proračunske kontrole, ker ima odbor eno strokovno sodelavko, ker nima natančnega vpogleda v se skupaj, in ker ima člane odbora, ki so tako kot vsi drugi, člani tega parlamenta, člani mnogih delovnih teles in seveda, nekateri so tudi v službah."
101,"Zato menim, da se morajo s proračunskim nadzorom, poleg Ministrstva za finance, ki to dela rutinsko in po nalogi, kakršno pač ima po zakonu o državni upravi in po zakonu o proračunu, ukvarjati profesionalci. Pravi profesionalci. Te profesionalce smo si v ustavi izglasovali. In to je Računsko sodišče, ki mora potem brskati po posameznih proračunskih izdatkih in o tem obveščati tudi javnost. To je, recimo, ustaljena praksa v Zvezni republiki Nemčiji in potem se vsakokrat - enkrat na leto, ko Računsko sodišče objavi rezultate svojih raziskav, zgodi nekaj samomorov med politiki, zgodi se nekaj odstopov in zgodi se nekaj racionalizacije javne porabe."
135,"Vsi govorimo, da je javna poraba prevelika. Vsi seveda govorimo, da so viri proračunski, če izvzamem tiste kočljive vire s prodajo družbenega premoženja, da so viri previsoki. Vendar se po drugi strani ne zavedamo, da mi sami mnogokrat s svojimi odločitvami postavljamo porabo nad vsakršen limit, ki ga je potem teko pokriti s kakršnimikoli viri. Če bom malo ciničen: naslednja točka, po tej je točka, kjer bomo razpravljali o prispevku za zdravstveno zavarovanje. Tam sta ponujeni dve varianti. Po eni bomo za zdravstvo dali 8,1% družbenega proizvoda, po drugi pa 10,5%, torej 2,4% družbenega proizvoda bomo z enim samim pritiskom na tipke ali prihranili ali zapravili. To je velika odgovornost in bom navijal za tisto nižjo, ki še vedno predstavlja realen porast sredstev za zdravstvo glede na to, kar je bilo za zdravstvo porabljeno zdaj."
15,"No, ampak tudi odločanje o porabi je zelo pomembno, in to odločanje v tej hiši."
151,"Da zaključim svoj splošni pogled ali pa to splošno paberkovanje o financiranju javne porabe in o njeni preveliki količini, bi rekel samo to: danes je posebej gospod Pivec omenil problem renominacije, problem usklajevanja, ali pa premetavanje denarja med posameznimi postavkami, ki zamegli kontrolo in ki naredi to, da se vladi ni treba natančno držati zakona o proračunu. Zanjo je proračun oziroma zakon o proračunu najbolj svet dokument v demokratični družbi. Približno toliko svet kot je ustava, in je za obstoj demokracije tudi približno toliko pomemben. Če bomo z njim ravnali tako kot se je pokazalo sedaj, in kot se je kazalo prej, ampak zdaj inštitut javnih financ dobiva težo od svobodnih volitev naprej, potem bomo spravljali v nevarnost tudi obstoj demokratične družbe. Če pa se bo uvedlo tukaj malo več discipline, in to velja predvsem za vlado, deloma pa tudi za skupščino, potem bo tej naciji cvetelo tisoč cvetov. Hvala lepa."
35,"Razumem, da je odgovor gospodu Smoletu zadovoljiv. Če pa ni, bomo še prosili predsednika vlade, da bo odgovoril, ki ga zdaj ni. Predlagam prekinitev te točke, glasovali bi, če bo le mogoče v četrtek popoldne."
15,Prehajamo na 13. TOČKO DNEVNEGA REDA - PREDLOG ODLOKA O STOPNJI PRISPEVKOV ZA OBVEZNO ZDRAVSTVENO ZAVAROVANJE.
48,"Predlog odloka je v obravnavo predložila Vlada Republike Slovenije. Obravnavala sta ga Odbor za zdravstvo na ravni Skupščine Republike Slovenije kot matično delovno telo; Zakonodajno-pravna komisija, ki je predlagala amandma k naslovu in k 4. točki ter Odbor za proračun in javne finance na ravni Skupščine Republike Slovenije."
27,"Ker je odlok predložen v varianti ena in dva, prosim, da se v razpravi opredelite do variant, še posebej prosim, da se do tega opredele delovna telesa."
44,"Poleg tega smo danes dobili od vlade še amandma, točno na 4. točko, ki je v bistvu redakcijske narave, kjer pravi, da bi začel ta odlok veljati 1.3.1992. Mislim redakcijski, glede nato, da ni bil doslej sprejet, je pač datum začetka veljavnosti treba spremeniti."
22,"Predstavnik Vlade Republike Slovenije k tej točki je gospa Katja Boh, ministrica za zdravstvo, družino in socialno varstvo. Prosi za besedo? Prosim."
4,"Hvala. Gospod Ocvirk, replika."
60,"Hvala. Ali to pomeni, da tudi predlagate, da se glasuje po seji Zakonodajno-pravne komisije, kar pomeni v četrtek popoldne, ko bodo že o nekaterih drugih stvareh glasovali, ko bo Zakonodajno-pravna komisija dala mnenje. No, predlagam potem, da počakamo na mnenje Zakonodajno-pravne komisije in da se odločimo, ali bomo glasovali in kako bomo glasovali v četrtek popoldne. Razpravo pa opravimo danes."
9,Že prej sem naštel prijavljene za razpravo. Gospod Šuklje.
13,"Hvala za pojasnila. Razprava, kot rečeno, je končana. Gospod Smole bo postavil vprašanje."
55,"Želel bi reči samo to, da se je zelo težko opredeljevati do nekega programa strukturnega prilagajanja, ko nimamo programa gospodarske politike. In to je ključna točka. Vlada ni bila nikdar v stanju predložiti program razvoja, gospodarski program in potem prihajamo do nekih parcialnih zahtev, nekih strukturnih prilagajanj, ki po mojem vse skupaj nič ne pomenijo.."
3,Hvala. Gospod Pivec.
89,"Moja razprava, če se to sploh lahko tako imenuje, bo zelo kratka, ker smo v tem letu vendarle že posvetili ves dan razgovorom o problemih v zdravstvu. Iz zdravstvenih organizacij ste dobili nič koliko signalov, v kakšnih krizah in težavah je bilo zdravstvo v preteklem letu, tako da sem celo že s strani naših kmetov dobil vprašanje, kaj pravzaprav počnete, da ne morete ničesar več plačati, da ničesar ne urejujete, ker se to zdaj že reflektira na našo dejavnost, ker nismo več mogli plačati živil, elektrike in vsega drugega."
40,"Razumem zadrego ljudi, ki sestavljajo proračun, pa rečeno je že tudi bilo: razumite tudi vi nas. V lanskem letu smo ob sprejemanju proračuna zelo opozarjali na posledice, ki temu zagotovo sledijo. In naše prognoze so bile v tem povsem točne."
99,"Ne naredimo iste napake letos in ne ponovimo te težave in te krize, ker bomo naredili tako škodo, ki je potem 10 let ne bomo mogli popraviti. Zdravstvo stagnira zdaj že leta in leta. Zaostaja za razvojem. Ne investiramo več. Ne popravljamo, ne nabavljamo, ne obnavljamo opreme. To se bo nekega dne tako zrušilo, da bo prava katastrofa. Zato menim, da ne bi navajal številk, ki jih pravzaprav vsi poznate. Povedali smo tudi tu, kakšne so številke o osebnih dohodkih na uro po posameznih profilih zdravstvenega delavca, pa vendar mi nihče ni verjel. Pa vendarle je bila to resnica."
59,"Rad bi opozoril tiste, ki delate pri proračunu, da še enkrat temeljito preberete ugotovitve Vlade, kaj je v zdravstvu, kaj se v zdravstveni dejavnosti dogaja in kakšni so stroški pri tem delu. Zelo bi prosil in pozival vse vas, da se opredelite za boljšo varianto za zdravstvo. Če pa se bo zdravstvo potem kopalo v denarju, ga bomo vrnili."
5,"Hvala. Predlagam, da sedaj glasujemo."
8,Kdo je za amandma gospodov Gošnika in Buserja?
3,Je kdo proti?
4,Se je kdo vzdržal?
5,"Ugotavljam, da amandma ni sprejet."
29,"Naslednji amandma sta prav tako vložila gospoda Gošnik in Buser, ki pravi: dodati novo točko, ki se glasi: ""Od koles"". Matični odbor amandmaja ne podpira. Vlada ga ne sprejema."
3,Kdo je za?
3,Je kdo proti?
4,Se je kdo vzdržal?
5,"Ugotavljam, da amandma ni izglasovan."
57,"Gospodje Dušan Semolič, Miran Potrč, Matjaž Šinkovec, Franci Pivec, Andrej Verlič in Zvone Žagar so vložili amandma, ki pravi: v drugem odstavku se doda nov tretji odstavek, ki se glasi: ""Določbe 1., 2., 3., 4. in 5. točke te tarifne številke se za člane stanovanjskih zadrug uporabljajo 1.1.1993."" Matični odbor amandmaja ne odpira, Vlada ga ne sprejema."
3,Kdo je za?
3,Je kdo proti?
4,Se je kdo vzdržal?
5,"Ugotavljam, da amandma ni izglasovan."
94,"Naslednji amandma je v našem zboru vložil gospod Žarko Pregelj. Opombi pod točko 1 se z besedami ""barve za fasado, zidove, okna, vrata"" dodajo besede ""ki ne vsebujejo zdravju škodljivih snovi. Mnenje o tem, da gre za proizvode iz te točke daje pristojni republiški upravni organ. Preden da proizvajalec ali prodajalec te proizvode iz te točke, mora na njih natisniti oziroma odtisniti klavzulo, da gre za proizvode, za katere se plačuje davek od prometa proizvodov po tej tarifni številki, ter številko, datum in mnenje pristojnega organa."" Matični odbor amandmaja ne podpira, Vlada amandma sprejema."
6,Kdo je za amandma gospoda Preglja?
3,Je kdo proti?
4,Se je kdo vzdržal?
5,"Ugotavljam, da je amandma sprejet."
41,"Vlada Republike Slovenije je vložila amandma, ki pravi: v opombah pod točko 1 se črta besedilo, ki se glasi: ""Gradbeni termoizolacijski materiali, izdelani iz naravnih materialov, steklenih voln, sintetičnih materialov, bitumna, hidroizolacijski materiali, izdelani na bazi bitumna."" Matični odbor amandma podpira."
3,Kdo je za?
3,Je kdo proti?
4,Se je kdo vzdržal?
5,"Ugotavljam, da je amandma sprejet."
46,"K tarifni številki 3 je vloženih čez dvajset amandmajev. Prvega je vložil gospod Jože Hobič, ki pravi: 2. točka tarifne številke se spremeni, tako da se glasi: ""Od osnovnih proizvodov kmetijstva, ribištva, lesa in gozdnih lesnih asortimanov."" Matični odbor amandmaja ne podpira, Vlada amandmaja ne sprejema."
7,Gospod Hobič pa bo obrazložil svoj glas.
23,"Amandma je res tempiran na 1. februar. Predlagam, da v usklajevalni skupini ta datum popravimo, da je to ponedeljek zaradi celotne racionalizacije postopka."
40,"Predlagal bi sedaj, glede na to, da je k 8. točki več amandmajev, da sedaj ta amandma izpustimo in takrat glasujemo, ko bomo prišli do tja, saj sta še dva amandmaja k 8. točki, ki sta bolj oddaljena od tega."
37,"Predlagam, da glasujemo o amandmaju k 6. točki, to je amandma Odbora za varstvo potrošnikov, ki pravi: črta se 6. točka. Matični odbor amandmaja ne podpira, Vlada ga ne sprejema. To je sedaj amandma k točki 6."
3,Kdo je za?
3,Je kdo proti?
4,Se je kdo vzdržal?
6,"Ugotavljam, da amandma ni bil sprejet."
30,"Tretji amandma se nanaša na točko 7. Vložil ga je prav tako Odbor za varstvo potrošnikov in pravi: črta se točka 7. Matični odbor ne podpira, Vlada ga ne sprejema."
3,Kdo je za?
3,Je kdo proti?
4,Se je kdo vzdržal?
5,"Ugotavljam, da amandma ni sprejet."
30,"Sedaj imamo tri amandmaje k 8. točki. Prvi amandma, ki ga je vložil Odbor za varstvo potrošnikov pravi: črta se 8. točka. Vlada ga ne podpira, matični odbor tudi ne."
3,Kdo je za?
3,Je kdo proti?
4,Se je kdo vzdržal?
5,"Ugotavljam, da amandma ni sprejet."
37,"Sedaj je po logiki stvari na vrsti prvi amandma gospoda Hobiča, ki pravi: ""Od osnovnih proizvodov kmetijstva, ribištva, lesa in gozdnih lesnih asortimanov."" Matični odbor ne podpira, Vlada ne sprejema. Gospod Hobič je že razložil svoj glas."
6,Kdo je za amandma gospoda Hobiča?
3,Je kdo proti?
4,Se je kdo vzdržal?
5,"Ugotavljam, da amandma ni izglasovan."
35,"Naslednji amandma k tej točki je prav tako vložil gospod Hobič in sicer pravi: za 8. točko se doda točka, ki se glasi: ""Od naravnih vin."" Matični odbor amandmaja ne sprejema, Vlada ga ne sprejema."
6,Kdo je za amandma gospoda Hobiča?
3,Je kdo proti?
4,Se je kdo vzdržal?
6,"Ugotavljam, da amandma ni bil sprejet."
31,"K 9. točki je vložila amandma Vlada Republike Slovenije in pravi: v 9. točki se besedilo ""biaksialno orientiranega polestirola"" spremeni, tako da se glasi: ""Naravi prijaznejših polimerov."" Matični odbor amandma podpira."
4,Kdo je za amandma?
3,Je kdo proti?
4,Se je kdo vzdržal?
5,"Ugotavljam, da je amandma sprejet."
58,"K točki 10 je vloženih več amandmajev. Prvega je vložil Odbor za varstvo potrošnikov in pravi: v 10. točki se številka 14 nadomesti s številko 16 in številka 34 s število 36. Predlagatelj je Odbor za varstvo potrošnikov, matični odbor ne podpira, Vlada ne sprejema tega amandmaja in meni, da je smiselno povzet v amandmaju Vlade Republike Slovenije."
4,Kdo je za amandma?
3,Je kdo proti?
4,Se je kdo vzdržal?
5,"Ugotavljam, da amandma ni izglasovan."
40,"Naslednji amandma je vložil Odbor za proračun in javne finance in pravi: v 10. točki se doda za besedo ""igrač"" besedilo, ki se glasi: ""Ki nosijo oznako dobra igrača."" Predlagatelj je Odbor za proračun in javne finance. Vlada amandma sprejema."
3,Kdo je za?
3,Je kdo proti?
4,Se je kdo vzdržal?
5,"Ugotavljam, da je amandma sprejet."
68,"Komisija za družino je predložila amandma, ki se glasi: v 10. točki se v drugi vrsti za besedo ""deške"" doda nov tekst, tako da se glasi: ""Od deške obutve do vštete številke 38 in dekliške obutve do vštete številke 36, razen od športnih copat, kjer se upošteva številka 36."" Matični odbor amandmaja ne podpira, Vlada ga ne sprejema, je pa amandma smiselno povzet v amandmaju Vlade Republike Slovenije."
5,Kdo je za ta amandma?
3,Je kdo proti?
4,Se je kdo vzdržal?
5,"Ugotavljam, da je amandma sprejet."
114,"Naslednji amandma k besedilu 10. točke pravi, naj se točka dopolni, tako da se glasi: ""Od deških, dekliških oblačil (to je najbrž neka napaka) do vštete številke 16, od deške in dekliške obutve do vštete številke 36, od otroške kozmetike, od izdelkov, namenjenih za opremo novorojenca, od otroških vozičkov, od otroških igrač, od otroških varnostnih sedežev."" Predlagatelj je gospod France Tomšič. Amandma se deloma pokriva s prejšnjim amandmajem. Matični odbor ga ne podpira. Vlada ne sprejema s pripombo, ki je bila tudi k prejšnjemu amandmaju. Gospod Tomšič vztraja. Se pravi, glasujemo o tistem delu tega amandmaja, ki se ne pokriva z že sprejetim amandmajem, to bo potem redakcija že naredila, če bo amandma sprejet."
6,Kdo je za amandma gospoda Tomšiča?
3,Je kdo proti?
4,Se je kdo vzdržal?
5,"Ugotavljam, da je amandma sprejet."
9,"Potrebna bo redakcija, kot rečeno glede na prejšnji amandma."
76,"Vlada Republike Slovenije je k tej točki vložila amandma: ""Od deške in dekliške obutve do vštete številke 34."", da se to besedilo nadomesti: ""Od deške obutve do vštete številke 38 in dekliške obutve do vštete številke 36, superg do vštete številke 36. ""Ta amandma je v celoti zajet v amandmaju Komisije za družino, zato mislim, da ni treba o njem še enkrat glasovati, ker je identičen po številkah. Vi imate superge, kar ni prav lepo slovensko."
52,"Naslednji amandma se nanaša na 12. točko. Vložil ga je Odbor za kulturo in varstvo kulturne dediščine. V tarifni številki 3, naj se v 12. točki v drugem odstavku za besedo ""organ"" postavi pika. Besedilo ""V soglasju z republiškim upravnim organom za finance."" pa črta. Matični odbor amandma podpira, Vlada amandma sprejema."
4,Kdo je za amandma?
3,Je kdo proti?
4,Se je kdo vzdržal?
5,"Ugotavljam, da je amandma sprejet."
43,"K 12. točki je vložila amandma tudi Vlada Republike Slovenije, ki pravi: k 12. točki se za besedo ""značaja"" postavi vejica in doda besedilo: ""razen pornografije."" Matični odbor amandmaja ne podpira. Prosim, da preverimo navzočnost. Vse navzoče poslance prosim, da potrdite svojo navzočnost!"
7,Kdo je za amandma Vlade Republike Slovenije?
3,Je kdo proti?
4,Se je kdo vzdržal?
5,"Ugotavljam, da amandma ni sprejet."
41,"Gospa Spomenka Hribar je vložila amandma, ki pravi: v tarifni števili 3, 16. točka se spremeni, tako da se glasi: ""Mnenje o tem, da gre za proizvode iz te točke, daje Obrtna zbornica Slovenije."" Matični odbor ne podpira, Vlada ne sprejema."
3,Kdo je za?
3,Je kdo proti?
4,Se je kdo vzdržal?
5,"Ugotavljam, da amandma ni sprejet."
101,"Naslednji amandma je vložil Odbor za proračun in javne finance. Pod opombo 4 k tarifni številki 3 se doda nov, četrti odstavek, ki se glasi: ""Mnenje o tem, da gre za igrače, ki nosijo znak 'dobra igrača', daje pristojni republiški upravni organ v soglasju z republiškim upravnim organom za finance. Preden da proizvajalec ali prodajalec te proizvode v promet, mora na njih označiti, da gre za proizvode, od katerih se plačuje davek od prometa proizvodov po tej tarifni številki ter številko, datum in mnenje pristojnega upravnega organa."" Vlada amandma sprejema, amandma je kompatibilen z amandmajem, ki smo ga malo prej sprejeli."
3,Kdo je za?
3,Je kdo proti?
4,Se je kdo vzdržal?
5,"Ugotavljam, da je amandma sprejet."
31,"Naslednji amandma je vložila Komisija za informiranje in pravi: v tarifni številki 3 se v 12. točki v prvem odstavku črtata besedi ""in informativnega"". Matični odbor ne podpira, Vlada ne sprejema."
4,Kdo je za amandma?
3,Je kdo proti?
4,Se je kdo vzdržal?
5,"Ugotavljam, da amandma ni sprejet."
119,"Gospoda Vano Gošnik in Stanko Buser sta vložila amandma, ki pravi: doda se nova 27. točka, ki se glasi: ""Od proizvodov, ki so izdelani iz recikliranih surovin."" Pri opombah k tarifni številki 3 se doda nova opomba številka 14, ki se glasi: ""Proizvodi 27. točke te tarifne številke so izdelki surovin,pridobljeni iz reciklaže odpadnih snovi. Mnenje o tem, da gre za proizvode te točke, daje pristojni republiški upravni organ. Preden da proizvajalec ali prodajalec proizvode iz te točke v promet, mora na njih natisniti oziroma odtisniti klavzulo, da gre za proizvode, od katerih se plačuje davek od prometa proizvodov po tej tarifni številki ter številko in datum mnenja pristojnega organa."" Matični odbor ne podpira, Vlada ne sprejema amandmaja."
3,Kdo je za?
3,Je kdo proti?
4,Se je kdo vzdržal?
5,"Ugotavljam, da amandma ni izglasovan."
72,"Komisija za družino je vložila amandma, ki pravi: doda se nova 27. točka, ki se glasi: ""Od prometa novih osebnih avtomobilov, ki jih največ enkrat v petih letih kupijo osebe, ki imajo v družini tri in več otrok, ki še niso mogli pridobiti vozniškega dovoljenja."" Gospod Polajnar bo obrazložil svoj glas, sicer pa matični odbor ne podpira amandmaja, Vlada mu pa ne nasprotuje. Gospod Kopač bo razložil po gospodu Polajnarju svoj glas."
25,"Gospod predsedujoči, to bo več replik, skušal pa bom biti kratek, taksativen, predvsem pa nič patetičen. Če bom kakšno patetično besedo izpustil, mi odvzemi besedo."
49,"Rečeno je bilo kontrola knjig, kontrola cene za knjige. Opozarjam vas, to bi prišlo v poštev, če bi v prometnem zakonu dosegli oziroma sprejeli izvzetje za vrhunske dosežke s področja znanosti, kulture itn. Ker to ni bilo v prometnem zakonu sprejeto (da se oprosti davka), jasno, ta točka odpade."
