4,"Kdor je, prosim, za?"
26,"Tako da imamo položaj, ko iz komisij pride 10 ali veè predlogov, na koncu pa mora upravni odbor odloèati o treh glavnih nagradah, o treh izbrancih."
7,Teh podroèij je trenutno šest ali sedem.
16,"Dajem na glasovanje predlog za imenovanje èlanov upravnega odbora Prešernovega sklada, kot ga je predlagala komisija."
17,Vsem izvoljenim in imenovanim èestitam k izvolitvi oz. imenovanju in jim želim veliko uspehov pri opravljanju dolžnosti.
5,O predlogu želi kdo razpravljati?
13,"Dajem na glasovanje predlog, da se Ivo Daneu izvoli za èlana te komisije."
9,Predlaga kdo loèeno glasovanje za kakšnega od teh kandidatov?
20,Na glasovanje dajem sedaj predlog za razrešitev Ive Štucin dolžnosti sodnice Temeljnega sodišèa v Novi Gorici s 13.12. t.l.
1,Vzdržani?
10,"Ne znam latinskega odgovora, da bo lahko odgovoril Jaši Zlobcu."
14,"In konèno, tudi literatura bi si zaslužila resnièno pravo nagrado, ne pa le sodelovanje."
41,"Imam prijetno dolžnost, da vam, vašim družinam, kakor tudi vsem državljanom Slovenije v imenu kolektiva Sadjarstvo pri Kmetijski zadrugi Panonka, zadružnikov KOP ter drugega slovensko in madžarsko govoreèega prebivalstva Gorièkega zaželim vesele božiène praznike in sreèno uspeha polno novo leto 1991."
12,Ker je dnevni red seje s tem izèrpan zakljuèujem 12. skupno sejo.
11,"V isti skupni skledi sta, recimo, roman in igranje na flavto."
29,"Komisija za volitve, imenovanja in administrativne zadeve predlaga, da Skupšèina razreši Franca Lovrenèièa dolžnosti èlana Komisije za volitve, imenovanja in administrativne zadeve in za èlana komisije izvoli Iva Daneua."
8,"Preden nadaljujemo glasovanje, bi še enkrat ugotovil navzoènost."
6,"Torej,ugotavljam, da smo še sklepèni."
27,"Ugotavljam, da so z veèino glasov izvoljeni za sodnike porotnike Višjega sodišèa v Mariboru vsi kandidati, ki jih je predlagala Komisija za volitve, imenovanja in administrativne zadeve."
3,Predlog ste prejeli?
2,Ne želi?
37,"Nemalo obèanov pa se obraèa direktno na obèinske funkcionarje, zlasti na predsednika obèinske skupšèine. veè udeležencev v komasacijskem postopku obmoèja Brje - Žablje v teh razgovorih oèita pristranost in sorodstvene vezi pri delu predsednika te komisije, Dušana Žorža."
15,"Prešernove nagrade so bile ustanovljene takoj po vojni, in sicer kot èista kopija sovjetskega vzorca."
18,"Ugotavljam, da je z veèino glasov Ivo Daneu izvoljen za èlana Komisije za volitve, imenovanja in administrativne zadeve."
19,"Da pa me ne bi obtožili anarholiberalizma in rušenja, bi predlagal zelo konkreten predlog v razmislek slovenski kulturni javnosti."
24,"Komisija za volitve, imenovanja in administrativne zadeve predlaga, da Skupšèina razreši Borisa Stadlerja dolžnosti temeljnega javnega tožilca Temeljnega javnega tožilstva v Ljubljani z 31.12.1990."
33,"Zlasti zato, ker se pripravlja nov zakon o Prešernovih nagradah, ki po mojih informacijah sedanjega stanja odloèilno ne bo spremenil, zato bi izkoristil to priložnost za naèelen pomislek v zvezi s temi nagradami."
48,"Ni naš namen kakorkoli vplivati na odloèitev pri predlaganju morebitnega kandidata Skupšèine Republike Slovenije, paè pa vas želimo še v fazi priprave opozoriti na nekatere probleme v naši obèini, ki so vezani na ime Dušan Žorž, ker menimo, da so kadrovski problemi neprimerna snov za razpravo v skupšèini."
21,"S tem bo sicer izgubila svojo vsenacionalno avreolo, kar pa je ob siceršnji obilici vsakršne nacionalne patetike èisto dobro in zdravo."
31,"V vseh komasacijskih postopkih, pa še v komasacijskem postopku obmoèja Brje - Žablje so številni obèani vlagali pritožbe in se pri tem opirali na pomanjkljivo izvedene melioracije, neustrezno kvaliteto pridobljenega zemljišèa ipd."
23,"Ugotavljam, da je z veèino glasov Boris Stadler razrešen dolžnosti temeljnega javnega tožilca Temeljnega javnega tožilstva v Ljubljani z 31. decembrom t.l."
22,"Noèem vplivati na glasovanje, ker v zadnjem trenutku ni mogoèe veè nièesar spremeniti in izboljšati, lahko bi pa prišlo do kulturnega škandala."
25,"V kolikor ne želi, potem prehajamo na glasovanje in dajem na glasovanje predlog, da se za predsednika upravnega odbora Prešernovega sklada imenuje dr. Ivan Sedej."
55,"Gre za volitve sodnikov porotnikov, in sicer Komisije za volitve, imenovanja in administrativne zadeve predlaga, da Skupšèina izvoli sodnike porotnike višjih sodišè Republike Slovenije, in sicer 24 sodnikov porotnikov Višjega sodišèa v Celju, 24 sodnikov porotnikov Višjega sodišèa v Kopru, 47 sodnikov porotnikov Višjega sodišèa v Ljubljani in 25 sodnikov porotnikov Višjega sodišèa v Mariboru."
40,"V delu je, pripravlja se zakon o Prešernovih nagradah, takrat bo odprt koncept, najbrž, bomo veliko dorekli, sedaj velja še vedno stari zakon in gre samo za to, da imenujemo upravni odbor na osnovi in za zakon, ki paè velja."
28,"Torej, èe ne želi nihèe razpravljati prehajamo na glasovanje in dajem na glasovanje predlog, da se Franc Lovrenèiè razreši dolžnosti èlana Komisije za volitve, imenovanja in administrativne zadeve."
62,"Ugotavljam, da so z veèino glasov izvoljeni za èlane RTV Slovenije: Matjaž Albreht, Viktor Blažiè, Danijel Božiè, dr. Pavel Gantar, Vano Gošnik, Bražnko Grims, Vlasta Jelušiè, Danijel Malenšek, Stane Perpar, Franc Pibernik, Ela Pivar, Marjan Podobnik, Janez Pogaènik, Silvano Sau, Marko Selan, Jože Snoj, mag. Lenart Šetinc, Borut Šuklje, Tone-Mito Trefalt, Igor Vidmar, dr. Boštja M. Zupanèiè, Jože Zupanèiè in Blaž Železnik."
32,"Vse druge specializirane nagrade - od gledaliških do arhitekturnih - bi izrazito pridobile na svoji teži, saj v sedanjem položaju vedno hirajo v hladni senci Prešernove nagrade in nikakor ne morejo dobiti nacionalnega statusa."
34,"Prešernove nagrade so simbol slovenske kulture in èeprav vsi v kulturi dobro vemo, da je z njimi marsikaj hudo narobe, ni do tega trenutka še nihèe nièesar storil, da bi se to tudi spremenilo."
36,"Nenadoma mora strokovnjak za literaturo meritorno odloèati, ali si Prešernovo nagrado zasluži slikar X, ali si jo bo mogoèe zaslužila operna pevka Y. To je veè kot nesmiselno in o tem najbrž ni treba zgubljati besed."
49,"Ugotavljam, da so z veèino glasov za èlane upravnega odbora Prešernovega sklada imenovani: Aleš Berger, dr. France Bernik, Lenèa Ferenèak, Niko Grafenauer, dr. Bruno Hartman, dr. Tine Hribar, dr. Mirko Juteršek, dr. Primož Kuret, Lojze Lebiè, Tomaž Pavšiè, dr. Damijan Prelovšek, dr. Primož Simoniti, Rapa Šuklje in Merina Zupanèiè."
