8,"Se pravi, 25 glasov je potrebnih za izglasovanje."
37,"V osnovnem tekstu je treba tam, kjer piše številka 8% dati 10 in potem naprej kar pomeni za drugega 12, tretjega 14, èetrtega 16, petega 18 za 6 in veè otrok je zavezanec oprošèen davka iz dohodnine."
7,"Prosim, da medtem nihèe ne zapusti dvorane."
9,"Jutri nadaljujemo ob 10.00 uri, zbor v istem prostoru."
10,"Kaj pa gospod Tomšiè, kaj vi pravite, vi vztrajate, seveda."
11,"Dajem na glasovanje amandma gospoda Mojmira Ocvirka, Izvršni svet ne sprejema."
23,"Še ena stvar, Odbor za splošno gospodarske zadeve, seja bo jutri ob 9. uri v sobi 311 v 3. nadstropju v zgradbi skupšèine."
38,"Jaz ne bi žele nastopati tukaj kot advokat vlade, vendar v tem primeru moram Cirila Kolešnika nekoliko korigirati v tem smislu, da ni vseeno ali je, kot je bilo že prej reèeno, velekapitalist oprošèen celotnega davka od dohodne."
26,"Ali je možno, èe so vsi trije predlagatelji tukaj, da bi ubrali podobno pot kot smo pri prejšnjem primeru ali da bi pristali pri enem predlogu."
35,"Prehajamo na amandma gospoda Francija Pivca k 11 toèki 7. èlena, ki je k isti toèki, kot je bil amandma gospoda Kolešnika s tem, da gospod Pivec, èe lahko opozorim, nima vkljuèenih tudi športnih organizacij."
19,"Ne morem se sedaj opredeljevati, ali je sedaj ta stopnja ta procent ali drugi procent, èe nimam globalnih izraèunov."
12,Medtem je gospod Žagar odstopil od svojega amandmaja še k temu èlenu.
24,"Dohodnine se pri olajšavah pod 50% ne razlikujejo v taki meri, da bi to bilo res krivièno, protisocialno in ne vem kaj še vse."
22,"Ali lahko to razumemo kot dogovor, ki bi bil stališèe za našo usklajevalno komisijo, ki bo šla na usklajevanje za ta zakon."
30,"Ta amandma pravi: v prvem in èetrtem odstavku tega èlena se za besedo ""zakonec oziroma zakonca"" v ustreznem sklonu doda besedilo ""ali oseba, ki z zavarovancem živi v izvenzakonski skupnosti""."
36,"Glede dohodnine ste pa dobili dejansko razdelitev, mislim vpogled v razdelitev davènega bremena davkoplaèevalcev, predvsem tistih, pretvorjeno v višino OD, tako da v celoti, kar je rekel poslanec Smole ne drži in ne moremo tega sprejeti."
15,"Sedaj se vraèamo na amandma gospod Tomšièa, ki predlaga lestvico 17, 26, 33, 38, 45%."
3,Je kdo proti?
17,"Mi smo imeli 49 navzoèih, dobil je pa 23 glasov, moral bi dobiti 25 glasov od navzoèih."
43,"Moram pa reèi, da iz tega sporoèila usklajevalne komisije sledi, da smo mi in Zbor združenega dela paè zavrnili skrajšani postopek, èeprav iz tega sporoèila ni jasno to, kar je zdaj povedal gospod Vaupotiè, da smo se opredelili za prvo in drugo fazo."
32,"Že zadnjiè sem rekel o tej razpravi, da se je težko opredeljevati, èe nimamo mi globalnih izraèunov, koliko sredstev rabi republika, koliko sredstev rabi proraèun in za kaj bo ta denar šel."
45,"Vendar, èe bi bilo sprejemljivo, kot je že gospod Pintar predlagal, bi se vseeno konzultiral s kolegi, ki predlagajo drugo lestvico glede na to, da je paè uporabljeno drugo merilo pri prejšnji oprostitvi za nad 65 let stare uživalce pokojnin, da bi imeli isti princip."
18,"Zato menim, da sama taka pavšalna trditev, da gre za veèje obdavèevanje, ne more biti v celoti sprejeta."
25,"Konec koncev gre za zelo resno vprašanje, ki prizadene vsakega obèana in mislim, dokler ne dobimo teh globalnih izraèunov, se ne moremo opredeljevati o stopnjah."
48,"To je amandma, ki pravi: prvi odstavek naj se glasi: ""Dohodnino plaèuje fizièna oseba s stalnim prebivališèem v Republiki Sloveniji (rezident), ki ima v posameznem koledarskem letu na njenem obmoèju dohodke iz 2. èlena tega zakona (v nadaljnjem besedilu zavezanec), razen èe ni s tem zakonom drugaèe doloèeno."""
2,Hvala lepa.
4,Obravnava celovite problematike gospodarstva.
1,Prisotnost.
28,"To je predlog poslanca Podobnika, ki pa predlaga številke - bom prebral samo Tomšièeve: 17, 26, 33, 38 in 45 odstotkov, Podobnik predlaga 19, 21, 24, 26, 28 lestvico."
57,"Menim, da v vsakem primeru, ko bi zaèeli ustavno-pravno proceduro o zastavi, ne bi smeli zaobiti te komisije, ker bomo v nasprotnem primeru podpirali prakso, ki se nekje uveljavlja, da imamo komisije, ki se ob kljuènih stvareh zaobidejo in se na komisijah take stvari ne obravnavajo in v takih primerih se potem sprašujem, zakaj smo komisije ustanavljali."
33,"To sem prebral, ta amandma, samo zaradi tega, da se boste lažje odloèili, ko boste glasovali o prvem, da ne bi spet prišlo do tega, da bi glasovali o dveh in oba sprejeli."
40,"Odloèiti se moramo, èe je mogoèe, med amandmajema gospoda Polajnarja in gospoda Kolešnika, ki pa se ne izkljuèujeta, zato predlagam, da najprej glasujemo o amandmaju gospoda Polajnarja, ki predlaga, da se besedi ""za otroke"" nadomestita z besedami ""za vsakega otroka""."
5,"Ugotavljam, da je predlog izglasovan."
41,"Glede na to, da je bilo reèeno, da bi nehali ob 17.00, sedaj pa je ura že èez 17.10 predlagam, da prekinemo, ker amandmajev je še dobre 3 ali 4 strani in da z glasovanjem od 15. èlena naprej nadaljujemo jutri."
21,"Opozarjam samo na to, da je potem še amandma na to temo, amandma gospoda Ocvirka, ki predlaga še nekako drugaène odstotke."
6,Kdo je za amandma gospoda Tomšièa?
29,"Ugotavljam, oziroma prosil bi, èe še enkrat ponovimo glasovanje, ker se seštevek ne ujema; èe pa ne bi vztrajali pri seštevku, je amandma izglasovan, ker je 23 glasov za."
14,"Zato pa prosimo, da še enkrat ugotovimo navzoènost in še enkrat izglasujemo ves amandma."
31,"Èe bi se to zgodilo, bi bil zelo vesel in mislim, da bi si ploskali, ker pa se ne bo, je pa stimulacija vsem nam, da naš tako star narod pomladimo."
27,"Komisija za obrambo in Komisija za mirovno politiko, obvešèamo èlane obeh komisij, da bo v èetrtek 27.12.1990 ob 8.30 uri v sobi 217/2 skupna seja obeh komisij."
20,"Ta zakon bi seveda imel to možnost, èe bi se tako odloèili, vendar iz navedenih razlogov je verjetno to dvomljivo."
49,"Ker èe na tej toèki to pomeni recimo manj, èe pomeni manj nekaj zaradi na nov bruto OD, kar tudi pomeni nekaj manj v popreèju in še potem nov davèni sistem in še kaj zraven, potem najbrž moramo vedeti in bomo videli, v kakšno situacijo gremo neposredno po prvem."
44,"Ker imam k tej toèki oziroma k temu èlenu tudi svoj amandma in ker smo v prejšnji toèki oziroma v toèki 16 k 7. èlenu sprejeli nek drug princip in s tem izpostavili nek precedens pri odmerjanju olajšav, bi želel pojasniti tudi moj tekst."
16,"Kdo je za amandma gdè. Metke Mencin oziroma poslancev Liberalno demokratske stranke, kot je bil prebran?"
34,"Amandma pravi, da naj se toèka 14 glasi: ""Jubilejne nagrade, odpravnine, regres za letni dopust in nadomestila za èas brezposelnosti."" Izvršni svet amandmaja ne sprejema, Zakonodajno-pravna komisija nima stališèa, ker gre za vsebinsko vprašanje."
47,"K 4. èlenu je bila sprejeta tudi s strani predlagatelja pripomba oziroma amandma Zakonodajno-pravne komisije v nekoliko izboljšanem besedilu in sicer naj se glasi tako: ""Postopek iz prejšnjega odstavka naj se opravi, èe je meseèna rast cen osnovnih življenjskih potrebšèin v dveh zaporednih mesecih veèja od 5%."""
52,"Amandma pravi: namesto 16. toèke naj se tekst prvega odstavka da v samostojnem 7.b èlenu, ki se glasi: ""Zavezancem, ki se jim odmerja dohodnina, se po dopolnjenem 65. letu starosti prizna odbitek od obraèunanega davka na dohodnino v višini 15% zajamèenega osebnega dohodka."" Nadaljevanje enako kot v drugem in tretjem odstavku."
56,"Amandma Izvršnega sveta: za prvim odstavkom 3. èlena se doda nov drugi odstavek, ki se glasi: ""Pravna oseba, ki je v prvem polletju 1990 dosegla 35% ali manj celotnega prihodka glede na celo 1990. leto, lahko izplaèa meseène akontacije osebnih odhodkov na podlagi meseènih povpreènih izplaèil osebnih dohodkov za obdobje april-junij 1990 v gospodarstvu Republike Slovenije""."
13,Zato da ne bi o treh glasovali in po možnosti vseh treh sprejeli.
0,...
51,"Prehajamo na šesti amandma Izvršnega sveta k 15. èlenu, ki se glasi: za prvim odstavkom 156. èlena se doda drugi odstavek z naslednjim besedilom ""Pri doloèanju nove lestvice iz tretjega odstavka 3. èlena tega zakona bo Izvršni svet Skupšèine Republike Slovenije zagotovil najveè 10% zaostajanj rasti OD za rastjo življenjskih stroškov."
68,"Gre pa za to, da je ta olajšava postavljena fiksno, se pravi, z nekim odstotkom zajamèenega osebnega odhodka in ker smo pri 16. toèki glede na isto startno osnovo predlagatelja pri starostnikih na 65 let starosti sprejeli, da je olajšava v višini 15% zajamèenega osebnega dohodka, predlagam, da namesto predlaganega amandmaja sicer spoštovanega Cirila Kolešnika, mojega strankarskega kolega, podprete amandma, ki starta za olajšavo tisti simbolièni znesek višje."
39,"Ga ne podpiramo, kajti prvi odstavek je v bistvu takšen, da to ne bi bilo veè zaèasno financiranje ampak bi bilo že kar dokonèno in bi se tudi postopek verjetno temu primerno zavlekel in bi stvar izgubila svoj smisel."
89,"Potem Izvršni svet sprejema tudi drugi amandma stranke Zelenih, ki se glasi: k prvemu odstavku 11. èlena se doda stavek: ""Prednost imajo ekološko èisti programi"" in da se v drugem odstavku 11. èlena med prvi in drugi stavek vrine naslednji stavek: ""Investitorji morajo zagotoviti varovaje okolja."" Prvi amandma, kjer se zahteva tudi sofinanciranje prostorskih planskih aktov zavraèamo, v obrazložitvi smo napisali, da sofinanciramo strokovne priprave za te akte, ne pa akte same, kajti ti akti so administrativna naloga obèine in jih mora obèina sofinancirati v okviru svojih rednih dejavnosti."
59,"Pri 100% povpreènem osebnem dohodku pomeni olajšava (8%, približno 200 din pri meseènem odbitku, medtem ko 15% od zajamèenega osebnega dohodka znese približno 400 din za prvega otroka in potem po 100 din zraven, kar bomo verjetno vsi skupaj priznali, da je še vedno na neki simbolni ravni, pa vendarle vsaj 100% veè, kot je tista predlagana ponujena rešitev."
42,"Ta amandma se glasi: 1. stopnja dohodnine naj se spremeni tako, da se glasi ""nad oziroma do 60.000 din 17%, 60.000 do 120.000 din 25%, od 120.000 do 240.000 din 33%, od 240.000 do 480.000 din 38% in nad 480.000 din 45%."
53,"Zaradi jasnosti in èistosti samega zakona, èe se odloèite za en amandma, predlagam, da bi se odloèili za amandma, ki ga je dal poslanec Semoliè, ki se glasi, da se 8 nadomesti z 10, ne pa da vleèemo v zakon tekst, ki ni v kontekstu sistema, ki ga zakon postavlja, dosežemo pa isto."
67,"Mislim, da gre tu za bolj pospešeno delovanje tržišèa delovne sile ali tržišèa dela in da se bo to po vsej verjetnosti dogajalo, vendar ne mislimo, da bo v tako enormnih razmerah, ker tudi privatna podjetja pravzaprav delujejo v podobnih ekonomskih okvirjih in verjetno ne bodo mogla iti v neka enormna izplaèila osebnih dohodkov, èe bodo hotela biti konkurenèna na tržišèu dela in imeti nizko ceno dela."
55,"Predlagam, da predsednik tega zbora in strokovna služba, ki delajo za ta zbor, razèistijo vprašanje ali imamo to na dnevnem redu in kaj smo zadnjiè sploh o tem predlogu za izdajo rekli in v tem smislu predlagam, da to toèko dnevnega reda preskoèimo, da ne izgubljamo èas in da preidemo na naslednjo toèko dnevnega reda."
102,"Popolnoma razumem Izvršni svet, da ni mogel pripraviti v teh izjemno dinamiènih trenutkih kompletnega osnutka oziroma predloga proraèuna za leto 1991 in da je tudi težave, ki jih ima znotraj, težave so se videle iz osnutka, ki smo ga imeli v rokah, ko je šlo za izjemno veliko poveèanje tudi za posledico poveèanega zaposlovanja, o tem je zadnjiè nekaj govoril gospod Mencinger, ko je naslovil neke vrste protest tudi na to skupšèino, kajti tudi skupšèina ima približno tako idejo, da se je torej Izvršni svet odloèil in nam predlagal podaljšanje financiranja proraèuna za naslednje tri mesece na osnovi proraèuna za leto 1990."
65,"Dovolite, da, glede na to, da se je prej stvar nekoliko zapletla v zvezi z glasovanjem o POBUDI V ZVEZI Z ZASTAVO REPUBLIKE SLOVENIJE predlagam, da vendarle ponovno to stvar uvrstimo na glasovanje in pooblastimo ustavno komisijo, da razišèe možnosti in poti za rešitev tega vprašanja, kako in kaj vendarle zaèeti postopek za spremembo ustave v tistem delu, ki govori o simbolu, zastavi Republike Slovenije."
60,"Dodatno se v proraèun vkljuèujejo samo zadeve, ki se po ustavnem zakonu prenehajo financirati na poseben naèin: naložbe v infrastrukturo (prej zagotovljeno z združevanjem sredstev za razširjeno reprodukcijo v infrastrukturi), spodbujanje demografsko ogroženih obmoèij v Republiki in finanèna izravnana obèin, ki sodimo, da jo je treba že na zaèetku leta izpeljati glede na celoten nov sistem financiranja ter zbiranja sredstev."
69,"S sprejemom ustavnega zakona za izvajanje teh amandmajev je bil najprej razveljavljen zakon o sistemu družbenega planiranja in družbenem planu Republike Slovenije, ki je doloèal postopek za sprejemanje planskih dokumentov, v letošnjem letu pa s sprejemom ustavnega zakona v oktobru mesecu še zvezni zakon o sistemih družbenega planiranja in družbenem planu in zvezni odlok o pripravljanju in sprejemanju plana oziroma ta dva smo prenehali uporabljati na obmoèju Republike Slovenije."
70,"V 5. èlenu doloèamo, da preneha veljati odlok o pripravi in sprejetju družbenega plana Slovenije za obdobje 1991-1995, ki je pravzaprav že izgubil svojo zakonsko podlago z ukinitvijo prej citiranih zakonov, hkrati doloèamo v 6. èlenu, da obèine nadaljujejo usklajevanje in prostorsko planiranje v skladu z zakonom o urejanju prostora, v drugem èlenu pa opredeljujemo postopke za spreminjanje in dopolnjevanje, v kolikor bo ta potreba nastopila, obstojeèih planskih aktov."
62,"Amandma gospoda Kocipra je sicer k vsem prvim trem odstavkom, ampak tudi k prvemu in ti štirje amandmaji k prvem odstavku se razlikujejo toliko, da se v bistvu amandma gospoda Semolièa in gospoda Kolešnika ujemata v celoti po vsebini, amandma gospoda Polajnarja je tako razlièen, da zaène z 10% in gospod Semoliè tudi zaène z 10%, gospod Kociper pa zaène s 15%."
72,"V razpravi pa je bilo opozorjeno, da je bilo ob obravnavi poroèila o urejanju prostora, ki ga je Skupšèini Republike Slovenije predložil njen Izvršni svet v letu 1987 in ga dopolnil na podlagi širših razprav v obèinskih skupšèinah in drugih okoljih v letu 1988, ugotovljeno, da stanje in pojavi na podroèju planiranja in naèrtovanja v prostoru ter izvajanje drugih nalog v zvezi s prostorskim urejanje kažejo, da je to podroèje v krizi."
64,"Zakon je bil sprejet glede na, to je pa moja osebna ocena in ne ocena koga drugega ali vlade, da je recimo takšno interventno poseganje, v kakršnega gremo zdaj izbiranje med manjšim zlom in zlom, ker v nasprotnem primeru ostane naprej v funkciji zvezni interventni zakon, ki je po oceni naših organizacij in tudi delavcev v marsièem še bolj restriktiven in neustrezen za aplikacijo."
46,"To pomeni, da ne bi danes glasovali o amandmajih, ampak da bi upoštevali te predlagane predloge Zakonodajno-pravne komisije kot predloge iz razprave, ki jih bo Izvršni svet pri pripravi predloga upošteval in bi glasovali samo o tem, ali se sprejme predlog za izdajo zakona, z osnutkom."
50,"Gospod Polajnar predlaga, da se besedi ""za otroke"" nadomestita za besedilom ""za vsakega otroka""; gospod Kolešnik predlaga, da se za namesto 4 zapiše št. 10%; gospod Kociper odstopa, hvala za uvidevnost; Zakonodajno-pravna komisija predlaga, to je paè ta amandma, ki se nanaša še na prvi odstavek, to je redakcijski amandma."
58,"Mi ugotavljamo, da je potrebno to urediti v našem zakonu prav zaradi veljavnega zakona o finanènem poslovanju, ki ne poznam izjem, ker bi morali v nasprotnem primeru z ustavnim zakonom izloèiti iz uporabe ta zvezni zakon, èe ga pa ne izloèimo, moramo pa seveda to pri nas urediti, drugaèe bo seveda sankcija taka, kot sem povedla v uvodu."
82,"V tem smislu je ne glede na možno oceno, da delamo na hitro, da vseh stvari ne vemo, nek poskus narejen, da bi se glavna ostrina, ki je bila v prvem tekstu v celoti nesprejemljiva, toliko omilila, da smo zdaj v situaciji, v kateri sprejemamo nekaj slabega, ker je tudi situacija zelo slaba, da poenostavim, mislim pa, da kljub temu gre za nekatera vprašanja, èe smemo ministrico zaprositi, da bi le bili malo bolj èiste vesti, o kateri kaže spregovoriti kakšno besedo."
63,"Kar zadeva zajamèeno nadomestilo, gre za to, da naredimo v tej relativno absurdni situaciji - ko danes mnogokrat dejanska izplaèila in celo OD, pa tudi nadomestila ne dosegajo najnižjega zneska, ki zagotavlja materialno in socialno varnost po sedanjem zakonu o zajamèenih osebnih odhodkih - da tukaj naredimo možnost oziroma naredimo nekoliko reda v tem smislu, da se ne prejema enak znesek za delo in ""nedelo""."
103,"Prehajam na amandma k 4. èlenu - Zakonodajno-pravna komisija nima pripomb, k 4. èlenu, ki se glasi: za drugim odstavkom 4. èlena se doda tretji odstavek, ki se glasi: ""Doloèba prvega odstavka tega èlena se ne uporablja za pravne osebe, ki so z letnim ali medletnim obraèunom izkazale izgubo v poslovanju, èe znaša delež prihodkov od izvoza v skupnih prihodkih pri pravni osebi veè kot 15% in za ugotovljeno izgubo na podlagi periodiènega obraèuna za prvo obdobje 1991. leta, za pravno osebo, ki je v prvem polletju 1990. leta dosegla 35% ali manj celotnega prihodka glede na celo leto 1990."" Zakonodajno-pravna komisija nima pripomb."
54,"Tudi mene je zmotila ista stvar kot Odbor za delo, zaposlovanje in socialno politiko, ki je, èe prav razumem iz tega materiala, predlagal èrtanje 3. èlena, ki govori o tem, da nadomestilo osebnega dohodka, ki pripada delavcu za èas odsotnosti z dela ne more biti nižje od 80% zajamèenega osebnega dohodka po tem zakonu."
151,"Že v mnenju Odbora za delo, zaposlovanje in socialno politiko, ki predlaga èrtanje tistega èlena, se sklicuje, da je ta èlen v nasprotju z doloèbami petega odstavka 66. èlena zakona o delovnih razmerjih, po katerem nadomestilo osebnega dohodka ne sme biti nižje od zajamèenega osebnega dohodka, Izvršni svet pravi, da si ti dve doloèbi nista v nasprotju, èeprav iz te dikcije, ki jo navaja Odbor za delo, zaposlovanje in socialno politiko sta oèitno v nasprotju in tudi sam Izvršni svet v obrazložitvi tega zakona pravi pod rimsko 3 oziroma ko govori o ustavni podlagi in ko prikazuje obstojeèe ureditve in razloge za izdajo zakona in potem o predlaganih rešitvah, pravi, zakon doloèa, da paè ne smejo biti nižji od 80% zajamèenega OD in pravi naprej: ""Nadomestila za èas odsotnosti z dela sicer doloèajo drugi predpisi, ki pa praviloma kot spodnja meja doloèajo 100% zajamèenega OD oziroma najnižjega zneska"" in tako dalje."
61,"Poglejte zadeva je preprosto taka - ne pade mi na kraj pameti, da bi zagovarjal zgolj tiste, ki so nesposobni, ki ne znajo, ki ne delajo - gre za to, da je vendarle treba zagotoviti izvajanje tega zakona, èe ga bomo sprejeli za tiste, ki ne morejo izvrševati tega zakona, ne po svoji krivdi, paè pa zaradi tega, ker so jim drugi dolžni."
71,"No, mislim, da zadrega ni tako tragièna, kot je zakon, zato predlagam naslednji dogovor: da gremo v usklajevalno komisijo najprej s stališèem, da se ta 14. toèka razširi, èe ne bi uspeli s tem stališèem, sprejemamo predlog Izvršnega sveta, da se v celoti èrta in naj pridejo naši usklajevalci nazaj povedati, ali so uspeli razširiti ali ne, potem pa se bomo o tem pogovorili, da ne zgubljamo èasa o tej zadevi."
78,"V zvezi s to toèko, tem èlenom in pa glede toèke 15 k 7. èlenu, ki je bil sprejet amandma, ki dejansko vzpostavlja drugaèen sistem dajanja olajšav oziroma znižanj osnove, kot pa je vgrajeno v zakonu s sprejetjem amandmaja k 16 toèki 7. èlena, kjer se odbitek priznava od obraèunanega davka, se ne ujema s sistemom, ki je v zakonu vgrajen in ga Izvršni svet tudi pri usklajevanju ne bo mogel sprejemati, ker gre za odstop od sistema."
