2,Ugotovimo prisotnost?
15,"In drugi: v prvem odstavku 4. èlena se za besedo ""doloèi"" doda ""po sprejeti metodologiji""."
32,"8. èlen: Jože Arzenšek predlaga, naj se glasi: ""Pravna oseba izplaèa meseène akontacije èistih osebnih dohodkov po tem zakonu v okvirjih, ki jih doloèajo poslovni rezultati."" Izvršni svet ne podpira tega amandmaja."
10,"Se strinjate s tem, kar je gospod kolega Boštjanèiè rekel?"
31,"Najprej imamo amandma Gospodarske zbornice Slovenije k 4. in 7. èlenu, za katera je bilo reèeno, da ju je Izvršni svet povzel v svojih amandmajih, to je 4. in 7. èlen."
18,"Omenjeni in regulirani osebni dohodki, kakor tudi ukinitev davka na osebne dohodke bi omogoèil podjetjem ustvarjanje veèjega dobièka."
19,"Menimo, in ta namen je imelo to naše zbiranje podpisov, da vlada o tem razpravlja in zavzame svoje stališèe."
23,"Predlagal bi, da najprej zakljuèimo razpravo o 14. toèki dnevnega reda glede predloga za izdajo zakona o zajamèenih osebnih dohodkih, s predlogom zakona."
20,"No hvala, samo zakon je eno, drugo je pa tisto ne, kaj mora narediti, to smo se pa tako pogovarjali."
4,"Ja, pa vas ni."
11,"Drage poslanke in poslanci, preden zakljuèim, bi rad povedal še dvoje."
7,S tem bi zakljuèil in na svidenje.
14,"Gospodarstvo je v izredno težkem položaju, veèje davène obveznosti pa njegov položaj še poslabšujejo."
8,"Oprostite, nisem nikoli imel namena izsiljevati takih stvari."
28,"Ker je število tako obsežno na tej listini, mislim, da bo imelo tudi svojo težo in razprava v vladi bo morala zelo resno vzeti naše mnenje na znanje."
1,Hvala.
3,Nekateri prehitro odhajajo.
5,Kdo je za dodatni sklep?
33,"Nenormalno, nenaravno in nepravièno visoke osebne dohodke, ki jih izplaèujejo tisti, nad katerimi ni višjega boga, pa bi moral biti in bo, mi si prizadevamo, da bo, to je sovražnik visokih osebnih dohodkov."
29,"Obrazložitev je: zajamèeni osebni dohodek je zaradi svoje narave, torej se pravi, zagotavljanje materialne in socialne varnosti, doloèen le na podlagi vnaprej sprejete metodologije, ki upošteva košarico življenjskih stroškov."
6,"Ne, saj bodo dobili vsi obvestila."
17,"To jim lahko zaupamo in da lahko, ko bodo dali zakon v objavo, bodo imeli pravilen izraz."
24,"Glede na to, da je zakon o omejevanju osebnih dohodkov v postopku sprejemanja menimo, da ni potrebo plaèevati posebnega davka na izplaèane osebne dohodke."
21,"Protokol bo sicer poslal osebna vabila vsem delegatom, danes vas le opozarjamo, da si rezervirate èas za obisk tega slavnostnega dogodka."
9,Slavnostni govornik bo predsednik Predsedstva Republike Slovenije Milan Kuèan.
13,"Dogovorimo se: glede te besede naj v Izvršnem svetu ugotovijo, katera je prava."
62,"Mi vemo sicer, da je kurz v rokah Zveznega izvršnega sveta, ampak mislim da v tej smeri bi bilo treba nekaj narediti, ker, èe ne bomo imeli realnega dinarja, potem bo v naslednjem letu izvozno gospodarstvo, kljub tem izvoznim spodbudam, unièeno in ne bo nekih osnov za to, da bomo vsi videli izhod v teh usmeritvah navzven, v usmeritvah na tuje trge."
58,"Menim, da na predloge oziroma diskusije o obsegu sredstev za zajamèene osebne dohodke pri nesolventnih ne bi bilo smiselno oblikovati amandmaje in spreminjati zaradi tega, ker je še vedno možno, da pravna oseba, takrat, ko je nelikvidna, zniža obraèun svojih osebnih dohodkov na 90%, pozneje, ko postane likvidna oziroma, ko se odblokira, to poraèuna oziroma v celoti izplaèa."
16,"Vseeno še imam, kljub temu, da že odhajate, PREDLOG ZAKONA O DAVKU NA IZPLAÈANE OSEBNE DOHODKE."
22,"Predlagal bi tri amandmaje (sedaj so zelo kratki), in sicer: amandma k 3. èlenu: 3. èlen zakona se èrta - s to obrazložitvijo."
40,"Tako bi z obdavèitvijo dobièka namenili veè sredstev iz gospodarstva za javno porabo, zato menimo, da je zakon o davku na izplaèane osebne dohodke nepotreben."" In zdaj, èe bi vas bilo tu veè kot 40, bi dal to na glasovanje."
45,"In še dodatni sklep: ""Izvršni svet Republike Slovenije naj v sodelovanju s sindikati in Gospodarsko zbornico zaradi spremenjenih gospodarskih razmer in padanja življenjskega standarda ponovno prouèi vrednost košarice minimalnih življenjskih potrebšèin in na tej podlagi opredeli minimalni znesek, ki zagotavlja materialno in socialno varnost delavca."
30,"Predlagam, da o tem danes ne glasujemo, ker bi se zdelo morebiti kot izsiljevanje ampak, da dopušèamo, da pred sprejetjem slišimo vlado, kaj misli o tem, in potem se izjasnimo."
54,"Jugoslovanski trg je interesanten, zato je vèasih tudi za nas gospodarstvenike vprašljivo, ali se je potrebno vedno politièno zaletavati na naèin, da pride do take ali drugaène reakcije tudi na gospodarskem podroèju oziroma, èe so sprejeti ukrepi v drugih republikah na teh drugih trgih, potem prièakujemo, da bodo ustrezni protiukrepi sprejeti tudi v Sloveniji."
12,"Amandmaje smo sprejeli, nekaj jih zavrnili, moramo sprejeti še zakon v celoti."
61,"To je sedaj že taka zmešnjava in taka mešanica, da bi predlagala, da predlagatelj te amandmaje vzame, vkljuèi tisto kar je, pa nam potem do prihodnje seje, 27.12., ponudi tak zakon, da bi z malo manj fiziènega napora celo lahko sledila temu èlenom - ker sedaj trije listamo in išèemo te amandmaje kam kaj spada, èe hoèemo sploh vedeti zakaj še glasujemo."
63,"Moram povedati, da iz kabineta gospoda Mencingerja, pa še pet telefonskih številk (vse že vem na pamet, èe me sedaj vpraša, jih vse vem) ne želim veè, da me bombardirajo, ampak naj reèejo, da je Peter ali Pavel, ali kdorkoli tisti, na katerega se lahko obrne, ne pa gospod Rejc je tisti, potem gospod Kranjec, potem financerji, to se vrti v èudnem krogu."
46,"Mi smo podpis dali, zato, da obvestimo vlado, da je položaj v gospodarstvu izredno težak in menimo, da se bodo današnje obremenitve v drugem letu poveèale in zaradi tega menimo, da se to ne sme zgoditi delovno intenzivnim panogam, ki v Sloveniji zaposlujejo ogromno število delavcev."
27,"Že kar vidim težave, ko bomo prišli na SDK, pa bomo hoteli izplaèevati plaèe, da bo spet velik problem nastal po vsem tem, ko bodo tolmaèenja razlièna."
34,"Predlagam, da se za nesolventna podjetja uporabi enaka omejitev kot je v 4. èlenu zakona o izplaèevanju osebnih dohodkov in nekaterih drugih prejemkov delavcev za leto 1991 predlagana za podjetja, ki poslujejo z izgubo."
26,"(Èe se spomnite, to je bila 5. toèka) tu vas je 40 (praktièno polovica) poslancev podpisalo naslednje: ""Skupina delegatov predlaga, da se predloženi zakon ne sprejme."
25,"Nas je vodilo, da smo dali nekatere pripombe na ta zakon, naslednje: Ta zakon predlaga rešitev, ki je pravzaprav kopija francoske rešitve iz leta 1970."
51,"Osebno se tudi ne strinjam z mnenjem, da je v tem trenutku prihajati s takšnimi stvarmi politièno nemodro - na eni strani s tem se ne strinjam, na drugi strani se pa ne strinjam tudi s tem, da je ta zakon restriktiven, da je bolj restriktiven, kot je tisto, kar danes imamo."
50,"Dodatno zmanjšanje bi utegnilo imeti nezaželene posledice še posebej ob dejstvu, da bo lahko negospodarstvo, ki prejema denar od tega preobremenjenega gospodarstva, v skladu z zakonom osebne dohodke ravno v tem èasu obèutno poveèalo - usklajevanje z rastjo osebnih dohodkov v gospodarstvu v oktobru - in da se bodo poveèale tudi pokojnine."
43,"Ne vem, èe bomo uspeli, ampak mi smo ta predlog dali že pred pol leta in smo rekli: tu, v tej rešitvi zadeve niso èiste in v tej gospodarski situaciji se nam zna zgoditi, da doloèene kategorije prebivalstva padejo res pod življenjski minimum."
44,"V amandmajih, ki jih predlagamo, smo upoštevali danes pripombe v zvezi s sezonskimi organizacijami, v zvezi z izvozniki, ki imajo izgube in v zvezi z možnostjo, da se masa osebnih dohodkov za odliène delavce v organizaciji ohrani in razdeli v višini 25% te mase."
37,"Tam imajo tako imenovani ""smik"", to je minimalni osebni dohodek, pod katerega ne sme pasti nobena socialna kategorija, ne glede na to, ali je zaposlen ali je invalid in dobiva od tam, ali je upokojenec ali kakorkoli."
56,"Ravno tukaj se bojim) - absolutno se strinjam, da se te plaèe omejijo - ampak bi rad mogoèe odgovor, èe smo bili v Sloveniji dosledni, dokaj dosledni v tem omejevanju plaè doslej, da bi se to potem niveliralo in kako se bodo obnašali, dokler smo še skupaj, v ostalih krajih Jugoslavije, kako se bo ta zadeva prijela itn."
35,"Prosim Te, da bi pred zakljuèkom seje zbora obvestil delegate, da v petek, 28. decembra 1990, Predsedstvo Republike Slovenije, Skupšèina Republike Slovenije in Izvršni svet Skupšèine Republike Slovenije prirejajo slavnostni koncert v èast Republike Slovenije."
38,"Èe nam bo uspelo ob takih plaèah, kot je rekel gospod Mencinger 40 - 50% realno nižjih plaèah, in bomo morali živeti ob 40 - 50% realno nižjih plaèah vsi segmenti naše družbe, da bomo prepreèili nacionalno in socialno katastrofo."
55,"Èe izhajam iz ekspozeja gospoda dr. Mencingerja, približno se skušam spomniti njegovih besed, ko je rekel, da bo administrativno urejanje osebnih dohodkov ostajalo vse do tedaj, dokler se ne bo pojavil naravni sovražnik dela, torej lastnik kapitala, ki ga bo zavaroval pred enormno rastjo plaè, potem naj reèem samo tole: ne klièimo razrednega sovražnika delavcev."
42,"Predlagal bi, da Izvršni svet ta amandma umakne - èe smem to predlagati ne vem, po poslovniku - v nasprotnem primeru pa apeliram na delegate, da bi glasovali proti amandmaju, kar pomeni, da ostane prvotno besedilo, tako kot smo prviè dobili v predlogu zakona."
53,"Predlog za izdajo zakona, s predlogom zakona je obravnaval Odbor za urejanje prostora ter stanovanjska in komunalna vprašanja, ki je podprl predlagani zakon in predlagal, da predlagatelj pripravi poroèilo o stanju na podroèju urejanja prostora, vkljuèno s položajem strokovnih služb, in navodilo o vsebini in metodologiji nadaljnjega strokovnega dela za potrebe prostorskega planiranja."
86,"Pomislek, ki ga ima gospod delegat, da se lahko ta sredstva povratno zopet vraèajo v veèja središèa, kjer so razne strokovne inštitucije, inštituti itn., da je sicer lahko prisoten, vendar zakon že v 1. èlenu izrecno nalaga obèinam, da same poskrbijo za pripravo teh razvojnih programov in kolikor nimajo lastnih strokovnjakov dovolj, da sicer angažirajo druge strokovnjake ali pa celo strokovne institucije, ampak same so tiste, ki izbirajo in tudi seveda zagotovijo, da bodo od teh strokovnih institucij dobile tisto, kar potrebujejo za te razvojne programe."
36,"Mene moti v tem trenutku - sem preprièan, da nam bo v Sloveniji uspelo, bi nam uspelo tudi v tem trenutku, èe bi imeli še ta monetarno devizni sistem za lastno kontrolo, ta ""Sachsov"" model ali kakorkoli."
39,"Predlagam, da se naš zbor v tem prostoru dobi 26.12. ob 14. uri, ker slavnostna seja in vse zadeve, ki sledijo, bo ob 18. uri in mi bi lahko dejansko od dveh, recimo, do petih opravili kar lepo delo."
87,"Medtem ko osnovni pristop v tem zakonu je bil prav na zahtevo zborov Skupšèine Republike Slovenije v prvi fazi obravnave tega zakona, se pravi, ko smo obravnavali predlog za izdajo zakona skupaj s tezami, ta, torej zahteva vseh zborov skupšèine, da mora biti osnovni pristop sklenjena, demografsko ogrožena obmoèja, kot so, recimo, Haloze, Gorièko, Pokolpje itn., da je treba za njih pripraviti razvojne programe v celoti, da se bolj organsko potem pristopa k izvajanju posameznih investicijskih zahtev tako v infrastrukturi kot tudi seveda pri spodbujanju gospodarskih vlaganj."
71,"1. da ob obravnavi gospodarske problematike, ki je iz dneva v dan vse težja, nujno obravnavate eksistenèno ogroženost zaposlenih in izoblikujete ustrezne sklepe. (Namreè pametno bi bilo po mojem, da bi Izvršni svet za takšne primere zagotovil za delavce, ki so skozi delali, èe se podjetje sluèajno v tem nahaja, in da podjetje ni v takšnem stanju, da bi šlo v steèaj, nekaj, da bi vsaj ti delavci preživeli ta èas);"
60,"Predlog za izdajo zakona s predlogom zakona je obravnaval Odbor za delo, zaposlovanje in socialno politiko, ki je predlagal, da naj Izvršni svet v sodelovanju s sindikati in Gospodarsko zbornico zaradi spremenjenih gospodarskih razmer in upadanja življenjskega standarda ponovno prouèi vrednost košarice minimalnih življenjskih potrebšèin in na tej podlagi opredeli minimalni znesek, ki še zagotavlja materialno in socialno varnost delavca."
98,"Drugi razlog, ki ga navaja v prvem amandmaju, da naj bi imela prednost pri sofinanciranju oziroma vzpodbujanju posameznih investicij narodnostno mešana obmoèja, zlasti še, èe so ob mejah, èe je tam veèja nezaposlenost - predlagano je, èe je ta nezaposlenost za 100% veèja kot v povpreèju Republike Slovenije - ta problem je pa zajet že v tistem doloèilu v predlogu zakona, da je treba v primerih, da je teh programov veè, kot pa je na razpolago v posameznem letu sredstev za te namene, da je treba to selekcijo opravljati na podlagi vpliva posamezne investicije na reševanje najakutnejših problemov posameznega obmoèja."
81,"Tudi lokacija tega amandmaja ni ustrezna, ker je vezana na 2. èlen, ki sicer ureja kriterije za doloèanje teh obmoèij, medtem ko sama vsebina amandmaja se pa nanaša na uporabo oziroma prioritete pri uporabi pospeševalnih ukrepov in, èe bi bil ta amandma primeren, bi ga morali vkljuèiti v enega tistih èlenov, ki obravnavajo ukrepe, zlasti tisti èlen, ki govori, kaj mora narediti pristojni republiški upravni organ v primeru, da je projektov veè, kot pa je na razpolago sredstev v posameznem letu."
75,"Vlada je vèeraj zveèer oblikovala amandmaje na besedilo predloga zakona, s katerimi se je želela èim bolj približati vsem, ki so dajali pripombe in amandmaje na zakon in je s tem že povezala sprejemljive predloge predlagateljev, vendar pa ni mogla in ne more odstopiti od osnovnih premis tega zakona, ki so v naslednjem: osebni dohodki, ki so izplaèani kot meseène akontacije naj sledijo rasti življenjskih stroškov na enak naèin, kot to opredeljuje splošna kolektivna pogodba."
67,"Samo bi prebral prvi amandma, ki ga je naša stranka dala in se glasi (èe Izvršni svet to podpira), da se prvi odstavek 1. èlena preoblikuje, tako da se glasi: ""Republika Slovenija posebej skrbi za razvoj demografsko zaokroženih obmoèij, ki v razvoju znatno zaostajajo in so demografsko ogrožena."" Menimo, da je s takšnim besedilom ustrezno izražena politika Republike Slovenije na tem podroèju, pa tudi vsebinam, intenca zakona."
57,"Te stvari so se sedaj približno reševale v tej smeri, da so jim bodisi obèine odpustile del dajatev na izplaèilo osebnih dohodkov, ki so jih obèini morale dajati, del jim je mogoèe odpustila republika, vendar to je sedaj šlo tako, da so intervenirali bodisi na obèini, bodisi na republiki, ali pa je tudi obèina intervenirala na republiki."
41,"Skratka mislim, da bi vlada morala pustiti ta prihranek notri, ker imamo vsi še mnogo rezerv in mislim, èe nalagamo veèja bremena delavcu (osebna, norme, boljšo organizacijo), da je verjetno tudi prav, da iz tega nekaj vidijo, da se lahko izplaèa."
70,"Mi smo v amandmajih na ta 15. èlen, mogoèe sem bila malo premalo jasna, ko sem povedala v uvodu - vse tiste pripombe, ki so bile že podane, pa jih je bilo možno smiselno graditi tudi z drugih podroèij, vgradili v same amandmaje Izvršnega sveta in že na ta naèin poskušali pravzaprav vse tisto notri prinesti, kar na nek naèin zahteva ali pogajanje ali predhodna mnenja ali predèasna sprožitev postopka ipd."
103,"Èe bo tudi podjetje prišlo do dobièka, potem pomeni, da je ekonomija zdrava, da poslujemo in naj se potem ta dobièek lepo obdavèi in skozi ta davèni model - skozi zamrznjene plaèe, da smo si na jasnem, in skozi ta model, ki smo ga mi predlagali, bomo dejansko prisilili vse te dejavnosti izven podjetij, da se bodo racionalno obnašale, ker èe se ne bodo, in èe nam bo uspelo v bližnji bodoènosti vplivati v Sloveniji na monetarno-devizno politiko in èe bo prišlo do te devalvacije (kar mora priti), potem je to edini naèin, da se izognemo hitri inflaciji in da uveljavljamo normalne pogoje gospodarjenja."
47,"V prvem odstavku 15. èlena se za prvim stavkom doda drugi stavek z naslednjim besedilom: ""Pri doloèanju nove lestvice iz tretjega odstavka 3. èlena tega zakona bo Izvršni svet Skupšèine Republike Slovenije zagotovil najveè 10% zaostajanje rasti osebnih dohodkov za rastjo življenjskih stroškov."" Želi tu kdo razpravljati?"
52,"Torej imamo dva podpisnika (eden je protestiral) kolektivne pogodbe, drugi kot podpisnik kolektivne pogodbe ni protestiral, to je zbornica, ki bi, po moji oceni, èe bi resno jemal pogodbo, tudi moral protestirati, èe ni kolektivna pogodba vgrajena oziroma pravzaprav sploh ne more biti, èe bi delovala po zakonu, je pravzaprav ne rabimo."
90,"Tretji amandma k 4. èlenu: za drugim odstavkom 4. èlena se doda tretji odstavek, ki se glasi: ""Doloèba prvega odstavka tega èlena se ne uporablja za pravne osebe, ki so v letnem ali medletnem obraèunu izkazale izgubo v poslovanju, èe znaša delež prihodkov od izvoza v skupnih prihodkih pri pravni osebi veè kot 15% za ugotovljeno izgubo na podlagi periodiènega obraèuna za prvo polletje 1991. leta za pravno osebo, ki je v prvem polletju 1990. leta dosegla 35% ali manj celotnega prihodka glede na celo leto 1990."" Želi kdo razpravljati?"
59,"Tu so še trije amandmaji Jožeta Arzenška, in sicer k 7. èlenu naj se glasi: ""Pravna oseba, ki je v letu 1990 glede na povpreèje leta 1989, zmanjšala število zaposlenih, lahko v masi sredstev za osebne dohodke, izraèunane po 3., 4. ali 6. èlenu, prišteje 25% obsega sredstev za osebne dohodke teh delavcev."" Kaj meni Izvršni svet glede tega?"
97,"Èe govori vlada, pa tudi danes smo slišali tu v tem ekspozeju, da je glavni delež take ali drugaène gospodarske politike v naslednjem letu v rokah zvezne vlade, Zvezne skupšèine, potem, dokler ne bo situacija drugaèna, menim, da je potrebno, da se v Beogradu pogovarjamo, da naši delegati gredo na oba zbora Zvezne skupšèine, da upravni organi delujejo v tej smeri, da je Gospodarska zbornica aktivna v okviru Gospodarske zbornice Jugoslavije, ker to nikamor ne pelje, on ti reže takšen ali drugaèen kruh, ti pa se tukaj iz svoje trme z njim noèeš in ne želiš pogovarjati."
49,"In zadnji amandma Izvršnega sveta, ki sodi k 17. èlenu: besedilo drugega odstavka 17. èlena tega zakona se nadomesti z besedilom, ki se glasi: ""Ne glede na doloèilo prejšnjega odstavka se za izplaèila osebnih dohodkov v zakljuènem raèunu ne uporabljajo doloèbe 4. èlena zveznega zakona."" Obrazložitev je tudi podana."
48,"Na koncu samo še tole predlagam, da bi bilo prav, da nekatere stvari pri amandmajih in tudi pri zakonu še razèistimo, tako na relaciji sindikat kot vlada, mogoèe tudi mi, delegati, in da o amandmajih in samem odloèanju o zakonu ne odloèamo danes, ampak na nadaljevanju 27. decembra."
76,"V zvezi z informacijo pa na predlog Odbora za proraèun in javne finance predlagam, da zbor sprejme naslednji sklep: ""Zbor združenega dela na predlog Odbora za proraèun in javne finance podpira predlog Izvršnega sveta Skupšèine Republike Slovenije za razrešitev pokritja primanjkljaja v republiškem proraèunu, ki skupaj znaša 4.379,7 milijon dinarjev, in sicer 3.687.007 milijona dinarjev v letu 1990 iz virov, ki so navedeni v predlogu razrešitve s tem, da posebej podpira vir zadržanega temeljnega prometnega davka."
68,"To zadnje je pravzaprav eden od pomembnih razlogov, da smo predlagali skrajšani postopek za sprejem zakona, ker sedanji naèin doloèanja zajamèenih osebnih dohodkov kot obsega sredstev za osebne dohodke preneha veljati z 31.12. in bi se tako lahko zgodilo, da bi vsi nesolventni prešli na izplaèevanje najnižjega zneska, ki zagotavlja materialno in socialno varnost, tj. 2.830 dinarjev in to neselektivno, ne glede na to, kateri delavec to prejme."
66,"Drugi amandma k 3. èlenu: za prvim odstavkom 3. èlena se doda nov drugi odstavek, ki se glasi: ""Pravna oseba, ki je v prvem polletju 1990. leta dosegla 35% ali manj celotnega prihodka glede na celo 1990. leto, lahko izplaèa meseène akontacije osebnih dohodkov na podlagi povpreènih meseènih izplaèil osebnih dohodkov za obdobje za april - junij 1990 v gospodarstvu Republike Slovenije."" Dosedanji drugi odstavek postane tretji."
65,"Vi veste, da se je ta prebeg plaè zaèel pri sami zvezni administraciji, v Srbiji in na Hrvaškem in da so potem poleti in jeseni na vsem jugu ogromno poveèali plaèe (v Sloveniji toliko niso) in da so vse te izgube prenesli v bistvu na banèni sistem in da se zdaj hoèe sanirati ta banèni sistem in potem na jugoslovanskem nivoju nekako socializirati te zadeve."
107,"Zato sem poskušala poiskati tisto, kar bi vseeno predlagala, da v zakonu popravimo: v 7. èlenu, kjer je navedenih teh 25% možnih od sredstev za osebne dohodke razdeliti, se mi zdi, da bi bilo vseeno dobro, èe bi tole dopolnili z drugo stimulacijo, tudi za kakšno inovativnost, drugaèno, ker bojim se, da bo dejansko tu sedaj odpušèanje delavcev tisto, ki bo potem pomenilo za vse tiste, ki ostanejo višje osebne dohodke - kar pa po moje niti ni namen zakonodajalca, vsekakor pa ni dolgoroèno dobro oziroma celo škodljivo, ker ne vem, kakšna bo tu izbira, kako bi, recimo, ljudi lahko zaèeli odpušèati tudi tam, kjer to ni prav."
88,"Menim, da po vsej verjetnosti veè doseèi, kot smo zdajle dosegli, verjetno ne bomo mogli, ker v kolikor se bomo še naprej pogajali, levo desno, gor, dol, mislim, da bomo dosegli to, da ne bomo niè veè omejevali osebnih dohodkov, ampak da bomo enostavno rekli, pustimo, da vsak deli tako kot mu, recimo, doloèajo eventualno zdajle ekonomske možnosti in kot mu pa kaže likvidna sredstva ali pa še kaj drugega, razen tistega, ki je mogoèe že uvedel to splošno kolektivno pogodbo,v kolikor je imel možnosti za to."
130,"Tako da teh stvari seveda ne bi mogli na novo sprejemati, mislim pa, da je stvar odloèitve tudi tega organa oziroma te skupšèine, ali bo (ker se, recimo, tisto ""del sredstev za osebne dohodke"" lahko razume na razliène naèine in tudi na razliène naèine uporablja; gre za tisti del osnovnih dohodkov, tisti del mase na raèun delavcev, ki so odšli iz organizacije) šla na bolj rigorozen pristop, kar pomeni, da gre vedno masa osebnih dohodkov toèno na doloèeno število ljudi ali pa se bo odloèila - v skladu s še neupoštevanim amandmajem Gospodarske zbornice - da se to opusti ali celo še od preteklega leta upošteva (èeprav menim, da od preteklega leta upoštevati, to je pa spet èisto moje osebno mnenje, res nas pripelje do tega, da bomo daleè nazaj stvari upoštevali)."
73,"K 4. èlenu je komisija oblikovala svoj amandma, in sicer, da se v drugem odstavku za prvim stavkom doda nov stavek, ki se glasi: ""Postopek iz prejšnjega odstavka se opravi, èe je rast cen osnovnih življenjskih potrebšèin v dveh zaporednih mesecih veèja kot 5%."" Tu v dodatnem poroèilu piše: Komisija je k svojemu amandmaju dodala svoj amandma, in sicer, da se v novem stavku v drugem odstavku pred besedo ""rast"" doda beseda ""meseèna""."
