25,"S tem smo v celoti usklajeni z dnevnim redom Nadaljujemo z zaèeto toèko, to je, nadaljevanje 9. seje Družbenopolitiènega zbora, predlog zakona o zasebnem delu."
18,"Izraèuni, ki so bili delani so napaèni, in jaz sem tudi na javni tribuni upokojencev povedal jasne številke."
9,"Šlo je za 6 toèk, to je, 6 zakonov."
5,"Mislim, da nam nekaj manjka."
15,"Samo eden je tak, ki je sedaj v drugaèni obliki kot smo ga mi sprejeli."
8,"Torej prvi 8, drugi 10, tretji 12 itn."
23,"In èe jih razumemo kot investicije, potem ne morem razumeti, kako da bo zaradi tega, ker država praktièno investira, zaradi tega v težavah."
42,"V kolikor bi pristali na rešitve, da naj bi dali doloèene pristojnosti nižjim lokalnim oblastem, bi dosegli prav tisto, proti èemur smo se borili in se še vedno borimo delno, proti velikemu številu avtonomnih odloèitev na podroèju doloèanja davènih ali drugih obveznosti."
56,"Èe vlada in veèinska koalicija ocenjujeta, da kljub vsemu temu in kljub vašim razpravam, ki so takšne, da kažejo na stiske, po predlogih sodi, da obstoje razlogi, da se ob takih postopkih in takih uèinkih in takih nejasnostih zakonodaja kljub temu sprejme, potem mislim, da mora vlada in ta veèina sprejeti tudi odgovornost za vse posledice."
11,Medzborovska skupina je usklajevala dnevni red in smo se hitro dogovorili.
41,"To je moj cilj in na ta naèin seveda tudi apeliram na poslance, da se tako seveda do vseh predlogov, ki so bili tule dani, posebej tisti, ki sem jih jaz dal, da se na ta naèin tudi do njih obnašamo."
39,"Seveda pa ta dohodnina, zmanjšana za to vsoto, se obdavèi odvisno od lestvice oziroma razreda, v katerem je pri 100% osebnem dohodku najprej za 11.400 in potem za 5.600, kar je letna razlika 2.600 din oziroma meseèno 20 din."
29,"Skratka, tisto kar smo rekli, preprièan sem, da ta lestvica, stimulacija te lestvice ni tako eksaktno narejena v tem kratkem èasu, da ne bi bilo možno za 2% znižati."
54,"Imamo davèno reformo, po kateri naj bi vsaj s korakom, ki zadeva zakon o dohodnini, prišli hitro v Evropo, po drugi strani pa se ohranja stara praksa v novi obliki. 12% davek na izplaèevanje osebnih dohodkov pomeni, da se je država odloèila napolniti svoje proraèune, ne glede na to, kako bo to preneslo gospodarstvo."
88,"V zvezi s toèkami, ki so bile v sklicu pod 23.a, b, in d) navedene, to je, osnutek proraèuna federacije za leto 1991, predlog za izdajo zakona o izvrševanju proraèuna za leto 1991, predlog za izdajo zakona o spremembah in dopolnitvah zakona o temeljih sistema premoženjskega in osebnega zavarovanja ter predlog za izdajo zakona o spremembah in dopolnitvah zakona o SDK, vas moram obvestiti, da je Zvezni zbor Skupšèine SFRJ navedene akte že sprejel 13.12.1990, zato bi bilo dajanje stališè Skupšèine Republike Slovenije v tej fazi brezpredmetno."
44,"Ne strinjam pa se s posameznimi toèkami, ki letijo na posamezne zadeve: prenizki so odbitki za prvega otroka, tudi za otroke z motnjami v razvoju, odbitki za vlaganja v šolanje, kulturo, stanovanja, podjetniška vlaganja, odbitki za tiste upokojence, ki živijo sami po smrti zakonca."
30,"Mi moramo sodelovati z državo, vendar je tudi res, da moramo braniti tudi državljana, volilca, èe bom malo bolj demagoški, od samovolje sleherne države, socialne, liberalne, socialistiène, nesocialistiène, demokratiène, nedemokratiène..."
28,"Osebno bi se pridružil, namreè glede na vprašanja gospoda Smoleta moram reèi, da sem bil na zboru, kjer je ta informacija izzvala veliko razburjenje in nezadovoljstvo med upokojenci."
52,"In zato ne morem pritrditi trditvi, da bo povpreèni dohodek obremenjen zelo visoko, ker èe samo te tabele pogledamo, v tem delu lahko ugotovimo, da fizièna oseba, ki prejema osebni dohodek v višini enega povpreènega osebnega dohodka in vzdržuje enega èlana, osebnega dohodka ne bo imel zmanjšanega, ampak bo nekoliko minimalno poveèan."
4,Se je kdo vzdržal?
12,"Prosim toèen izraèun, koliko bo upokojenec s 5.000 din pokojnine plaèal davka."
7,Danes govorimo o povpreèni plaèi 6.000 din.
3,Je kdo proti?
6,"Ugotavljam, da je predlog komisije sprejet."
40,"Samo tudi mene zanima ali 10. èlen, ko je govor o 8% olajšavi za prvega otroka in potem 2 nadalje ali se to sešteva, skratka, da ne bi ponavljal vprašanja, ki je še v zraku, bi prosil odgovor o tem."
32,"Absolutno se strinjam z zakonom, podpiram vlado in apeliram, da ta zakon v tej fazi sprejmemo, oziroma cel komplet zakonov, da bo vlada imela temelj, da gremo lahko naprej v tej smeri."
51,"Upam, da vlada prav gotovo ve, da so davèni predpisi tisti, ki po svetu delajo vlade priljubljene in nepriljubljene in da vsaka vlada pride, recimo, pred volilce v doloèenih trenutkih, ko je treba poravnavati družbi, ki jo predstavlja, tudi ustrezne raèune in da utegne biti prav davèni sistem tukaj dosti nevaren."
36,"Problem je pri pokojninah v tem, da gre za zneske v neto, mislim, da gre za prejemke v neto zneskih, ki jih je treba zaradi tega prevesti na bruto znesek in obraèunani davek upoštevati kot plaèanega."
19,"To je bistveno, ne pa kako se ta trenutek pobere nek denar in se ga potem porabi za proraèun."
20,"Ne mislim, da nam pojasni poraèun v celoti, da nam pojasni strategijo polnjenja in delitve proraèunskih sredstev v letu 1991."
57,"Po teh izraèunih lahko ugotovimo, ob predpostavki, da je povpreèno osebni dohodek 6.000 din, da je dejansko davèna olajšava za enega vzdrževanega družinskega èlana približno 1 in pol meseèni povpreèni osebni dohodek v Slovenji, za dva pa tri meseèna povpreèna dohodka in ne, tako kot je bilo tu reèeno, v nekih minimalnih zneskih, ki niso omembe vredni."
47,"Da za enkrat ni prav nobenih kriterijev za dopolnilno financiranje, kar je tudi predstavnica Ministrstva za finance ugotovila, ti bi naj bili sicer doloèeni v proraèunu ampak mi proraèuna nimamo in zato veljajo vse te kritiène pripombe toliko bolj še za predvideno financiranje v prvih treh mesecih."
2,Gospod Potoènik.
1,Hvala.
22,"Po metodologiji, ki mi je bila posredovana iz njegovega urada, je namreè davèna osnova znižana za en in pol povpreèni osebni dohodek."
50,"Kljub temu pa želim vladi, da bi denar, ki ga bo na ta naèin zbrala, v naslednjem letu uporabljala tako, da bo država dobila ekonomski zakon in da bomo èez leto in dan mogoèe že lahko o tem zakonu razpravljali samo v tem smislu, da bomo govorili o drugaènih stopnjah."
72,"Odbor za splošno gospodarske zadeve predlaga na podlagi drugega odstavka 265. èlena poslovnika Skupšèine Republike Slovenije, da se združita prva in druga faza zakonodajnega postopka, tako da se hkrati obravnava in sprejema predlog za izdajo zakona in zakonski osnutek pri zakonu o spremembah in dopolnitvah zakona o zagotavljanju sredstev za skupne družbene potreba v letu 1990 in o proraèunu doloèene obveznosti iz dohodka za skupne in splošne družbene potreba za leto 1989."
66,"Gospod Voljè navadno zakljuèuje svoje govore s sklepom, da je Zelence treba zašèititi, mene pa moèno mika, da bi zaèela ponavljati: ""Razvojno socialni program vlade je treba narediti takoj"" in na osnovi tega programa napraviti proraèun, da bomo razvidno vedeli da denar, ki ga s tako mujo zbiramo od gospodarstva in od ljudi, ne bo šel za policijsko in vojaško državo, ampak res za socialno državo."
35,"In na ta naèin z izvedbo, z izraèunom pridemo na enakopravno obravnavanje osebnih dohodkov in pokojnin in po tem izraèunu na podlagi zakona ugotavljamo, da pokojnine do povpreènega osebnega dohodka ne bodo obremenjene z dohodnino."
98,"Glede na ugotovitve v predlogu za izdajo navedenega zakona, da sedanja zakonska ureditev s podroèja vzgoje in izobraževanja ne omogoèa njegovega obvladovanja v organizacijskem in finanènem smislu, hkrati pa zelo ovira ravnatelja, da bi odgovorno opravljal vlogo pedagoškega vodje, kar vse povzroèa hude posledice, ter na osnovi mnenja teles Skupšèine Republike Slovenije, izraženega ob obravnavi osnutka zakona o zavodih, da je ob splošnem zakonu potrebno vedeti tudi, kako bodo naèelne zamisli konkretno rešene v podroènem zakonu, se Izvršni svet zavzema za takojšnjo razpravo o predlogu za izdajo zakona o organizaciji in financiranju vzgoje in izobraževanja, z osnutkom zakona."
24,"Za nas je pomembno to, da je bilo v teh šestih pet takih, ki smo jih sprejeli skupaj z enim od drugih dveh zborov."
16,"Ker sta ga Zbor obèin in Zbor združenega dela sprejela v enaki obliki, je potem tako:"
17,"Obseg javne porabe je veè ali manj jasen, za ta obseg javne porabe je potrebno zagotoviti sredstva."
33,"Vse stopnje, vse lestvice, ki jih zakon o dohodnini vsebuje, so medsebojno odvisne in kakršnekoli spremembe doživi lestvica za obdavèitev dohodnine, je temu primerno potrebno uskladiti tudi vse druge lestvice pri podvrstah dohodnine."
48,"To, kar je sedaj pri nas zapisano, je komplicirano z neto, z bruto, z valorizacijami, ono, tretje, da se povpreèen obèan v tem ne znajde, èe se celo ljudje, ki se, bi rekel, kvalificirano ukvarjajo s temi zadevami, ne znajdejo popolnoma in dajejo na doloèena vprašanja razliène odgovore."
27,"Kljub vsemu je le kar precej ljudi v Sloveniji, ki niso tako revni in je pravzaprav bolj revna naša država, predvsem njena infrastruktura, kjer smo strašno zaostali."
10,Povrnimo se na naše delo glede na poroèilo usklajevalne komisije.
21,"Kot da je sedaj vse odvisno od tega, da bo nekdo plaèal èimveè davka, da bomo zaradi tega prišli iz težav."
31,"Ker sta Zbor obèin in Zbor združenega dela sprejela predlog za združitev faz obravnave zakona o organiziranju in financiranju vzgoje in izobraževanja, skupna komisija predlaga, naj to stori tudi Družbenopolitièni zbor."
37,"Glede predloga, da bi sprejeli sistem, politiko, ki je opredeljena v obliki lestvic in olajšav mislim, da se ne more sprejeti, ker zakon je enoten, zakon je konsistenten in se ga sprejme ali se ga ne sprejme."
13,"Odloèanje in glasovanje preložimo, dokler ne dobimo stališèa Zakonodajno-pravne komisije in Izvršnega sveta."
53,"Vendar mislim, da je to eden od prvih zakonov, ki so dokaj normalni, konsistentni, ki prihajajo iz te vlade in zaradi tega se bojim, da bi izgubili ta trenutek, ko mislim, da je to možno sprejeti bolj ali manj konsistentno in da bi do takega davènega sistema, modernega, evropskega nikoli veè ne prišli."
14,"- Predlog za izdajo zakona o organizaciji in financiranju vzgoje in izobraževanja, z osnutkom zakona."
45,"Vendar, ker ima tudi opozicija svoj delež odgovornosti v državi, saj v tej državi bomo funkcionirali morda in upam jutri mi kot oblastniki, seveda moramo razmišljati bolj kompleksno, zato se tudi strinjam s tistimi predlogi, ki zagovarjajo sistem, vendar oporekajo smotrnosti takih proporcij, takih procentov."
58,"Vendar bi prièakoval, da potem, ko nam je gospod Kopaè natresel nekaj kritik, tako Demosovcem, kot kasneje tista kritika, ki jo je natresel, velja oèitno tudi za njegove kolege, bi prièakoval, da se bo vsaj med razpravo o zakonu, za katerega predstavlja on matièno komisijo, toliko uspel zadržati, da bo med nami in nam poskušal odgovarjati na vprašanja."
64,"In èe bodo za govornico prihajali in skozi lobije pritiskali za vse mogoèe olajšave razno razni ljudje, recimo v tem primeru poslanci, potem seveda se odre ves ta sistem in se bomo vrnili oziroma obstali, obtièali v tem sistemu, kakšnega imamo sedaj in ki je nastal v dolgem socialistiènem razvoju, ko so bili nekateri dohodki bolj zaželjeni in nekateri sloji prebivalstva pa manj zaželjeni."
43,"Mi smo v sistemu federalnih davkov dejansko doživljali to, da smo imeli isti dohodek dvojno obdavèen z davkom iz dejavnosti ali pa z davkom iz kmetijstva in potem še na koncu s skupnim dohodkom obèanov, kjer smo imeli progresivne stopnje do višine 80%."
76,"To so nekateri predlogi, lahko bi še detajlirali ampak mislim, da je smisel mojega predloga na ta naèin razumljen, a bi prišli do nekega konsenza, ki bi ga zavestno skupaj sprejeli, kaj pravzaprav je dnevni red, o èem bi razpravljati, kako bi odloèati in da bi tisto, kar bi bilo sprejeto izkljuèno pod pritiskom opozoril na èas, na nujnost, ampak tudi z neko našo vestjo, da so pripravljene rešitve glede na obstojeèe možnosti kolikor toliko dobre."
26,"Predlagam samo en podatek, za 100% povpreèni osebni dohodek oziroma za dohodnino v višini 100% osebnega dohodka in olajšavo za 8%, kar je v zakonu predlagano."
34,"Glede na razprave in ugotovitve o obremenitvah posameznih osebnih dohodkov moram reèi, da so bile dane delno zaradi nerazumevanja zakonskih doloèb, kar je po eni strani objektivno razumljivo, ker gre za dokaj zapleteno materijo."
68,"Prva je ta, da zakon hoèeš noèeš, neodvisno od svojih dobrih namenov v bistvu vsiljuje tezo, da imamo pri nas prevelike razpone v plaèah ta hip, da nam torej ne grozi niti ne vlada, ne uravnilovka, kot smo mislili doslej, ampak da imamo prevelike razpone (v èasih starega mraènega režima bi najbrž rekli prevelike socialne razlike) in ta zakon jih zmanjšuje in zmanjšuje jih kar v znatni meri."
49,"Sicer pa bi v zvezi z amandmajem, ki ga je predlagal Milan Balažic, predlagala spremembo oziroma malo drugaèen amandma v zvezi z opustitvijo plaèevanja dohodnine iz naslova plaèila za zaèasno oziroma obèasno opravljanje dela uèencev in študentov, sprejetih preko organizacij, ki imajo na podlagi zakona pooblastilo za posredovanje dela."
59,"Vendar, najbrž tudi v proraèunu obstojajo neka doloèena podroèja financiranja, ki so pravzaprav primerjalno izrazito veèja glede na druge države in o teh se mi moramo pogovarjati, ne pa o tem, da nekdo, ki recimo zahteva ustrezna sredstva za šolstvo, dela proti svoji vladi, ker se paè zavzema za to, da šolstvo ne bi še bolj izgubljalo kot doslej."
0,...
60,"Prosim, spoštovani zbor, sedaj se pogovarjamo obširno o teh stvareh, ko smo mislili, da bomo sprejeli z aklamacijo, ker to je prvi korak k tej lažni utvari socializma, ki nam govori, da smo vsi enaki, tu pa vidimo, da imamo razlike 1:20, ko zahod pozna 1:3, oziroma èe izvzamemo menedžment, pa privatniki, ampak oni odgovarjajo za to, kar so ustvarili."
46,"Predlagam pa še eden amandma v zvezi z 9. èlenom in sicer, da se med vzdrževane družinske èlane šteje tudi oseba, ki z zavarovancev živi v izvenzakonski skupnosti, s èimer bi izenaèili pravne posledice zakonske in izvenzakonske skupnosti tudi na podroèju, ki ga ureja ta zakon."
38,"Menim, da dejansko potrebujemo sistem, ki naj bi približal naš davèni sistem zahodnim zakonodajam, vendar se strinjam tudi s pomisleki tistih, ki pravijo, da bodo ti davki dodatno in preveè obremenili že tako obremenjenega posameznika, davkoplaèevalca pri nas."
62,"K predlogu zakona pa komisija predlaga naslednji amandma, ki ga je predlagatelj na seji komisije sprejel: Pri 16. èlenu naj se doda nova 6. toèka, ki se glasi: ""Davka od osebnih prejemkov se ne plaèuje od prejemkov za obèasno ali zaèasno nego oziroma pomoè invalidom, ki jih fiziènim osebam izplaèajo invalidske organizacije."" Toèka 6 do 14 se preštevilèi v 7 do 15."
65,"Mi smo dopoldan povedali, takole sem povedal dobesedno: na 9. seji Družbenopolitiènega zbora nismo obravnavali predloga zakona o zasebnem delu ker naš zbor ni bil veè sklepèen, zato predlagam, da bi nadaljevali 9. sejo z omenjeno toèko dnevnega reda in to obravnavali med današnjo sejo, ko bo na seji navzoè tudi predlagatelj gospod Kopaè in ko bodo konèane toèke, ki se nanašajo na davèno zakonodajo."
55,"Drugiè, vemo, da se bomo pri proraèunu morali odloèiti, ali bomo šli z minusom naprej; sami veste, da smo zadnjiè sprejeli na skupšèini oziroma tudi tem zboru zakon o intervenciji v gospodarstvu kjer... 4 milijarde 900 dinarjev in te bo tudi treba nekje vzpostaviti v proraèun oziroma vsaj v tistih valovih, ki bodo prihajali naokoli."
71,"Zato sprašujem Republiškega sekretarja za notranje zadeve, gospoda Igorja Bavèarja, ali so pogoji, ki jih je navajal republiški podsekretar Debelak, mišljeni le za bodoèe priseljence, se pravi tiste, ki se bodo priseljevali v Republiko Slovenijo po uveljavitvi neodvisnosti in samostojnosti in vzpostavitvi državne suverenosti in takrat kandidirali za državljanstvo ali pa so mišljeni tudi za pripadnike narodov in narodnosti iz drugih delov Jugoslavije, ki že imajo stalno bivališèe v Republiki Sloveniji."
83,"Zlasti zaradi tega, da bi res lahko z novim letom tudi zaèeli ta sistem uveljavljati in bi si tako omogoèili prehod v nek drug tip, da tako reèem, gospodarstva v celoti; ker moram reèi in to izhaja tudi iz gradiva, ki smo ga dobili od podpredsednika Izvršnega sveta, da ta sprememba davènega sistema v celoti pomeni tudi pogoj, ki nam ga veèkrat postavljajo tudi latentni tuji vlagatelji, kadar se pogovarjajo o pogojih, pod katerimi bi se bili pripravljeni vkljuèiti v naš gospodarski sistem."
89,"Se pravi, obèine naj bi tudi po njem poèasi umirale, ampak, da bi jim to umiranje olajšali, ali pa ga naredili dostojnega, kljub temu prehodnemu obdobju, bi predlagal, da v 8. èlen tega zakona o javni porabi vnesemo naslednjo dikcijo v drugi odstavek, ki naj bi se glasil: ""Davke in takse in druge dajatve iz èlena 6 uvaja obèina."" To govorim zaradi tega, ker se mi zdi, da obèine nimajo enakega startnega položaja niti niso enako razvite, kaj šele imajo iste možnosti za razvoj in seveda tudi stopnjo razvitosti."
79,"V 7. èlenu predlagam, da se v toèki 11. glasi takole: ""plaèane èlanarine politiènim strankam, sindikatom, in športnim organizacijam."" Naslednji je 8. èlen, kjer naj bi se prvi odstavek glasil: Na koncu prvega odstavka, torej za piko, naj bi se postavila vejica in nadaljujem tekst: ""kar pomeni za drugega 10%, za tretjega 12%, èetrtega 14, petega 16, za šest in veè otrok je zavezanec oprošèen davka iz dohodnine."" Mislim, da mi ni treba povedati zakaj, saj je obrazložitev znana."
123,"Kar se tièe konkretnega amandmaja, bi rekel, nekako poznamo situacijo, vemo, da v tem èasu, glede študirajoèe mladine, štipendije padajo, manj jih je in manjše so, standard na sploh pada, življenjski stroški rastejo, kvaliteta življenja pada, nezaposlenost raste itn., itn., zato bi tudi predlagal amandma k 16. èlenu predloga zakona o dohodnini, ki se glasi: ""Prejemkov iz naslova plaèila za zaèasno ali obèasno opravljanje dela uèencev in študentov prejetih preko študentskih organizacij ljubljanske in mariborske univerze, ki imata na podlagi pogodbe o koncesiji s pristojnim republiškim upravnim organom pooblastilo za izvajanje strokovnih nalog posredovanja dela."" Obrazložitev: Ob vse bolj zaostrenih materialnih možnostih za šolanje si za opravljanje zaèasnih ali obèasnih del v organizacijah oziroma pri delodajalcih mnogi študenti zagotavljajo dodaten vir za preživetje."
81,"Ko je gospod Kopaè omenil vprašanje, ali se bo nekoè nekdo pojavil, ki bo zahteval, da Izvršni svet da za doloèene zadeve za kulturo, socialo itn., manj dearja, je verjetno jasno, da se bo ob novem proraèunu na tem podroèju moralo v tej skupšèini slišati tudi nasprotno stran in verjetno tisti, ki bi danes zahtevali zmanjšanje obremenitve, tako pri zakonu o dohodninah in tisti, ki bodo to zahtevali pri naslednjih zakonih, da se bodo morali ob sprejemanju proraèuna tega tudi držati."
80,"V 16. èlenu predlagam, da se vnese nova 11.a toèka, ki bi se glasila: ""Posebnih plaèil, ki jih prejme delavec za uporabo svojega avtorskega dela, za avtorski honorar, ustvarjenega na izvrševanju svoje delovne obveznosti pri podjetju, organu družbenopolitiène skupnosti in drugih organizacijah skupnosti ali delovnem èloveku, ki z osebnim delom samostojno kot poklic opravlja poklicno dejavnost oziroma, ki samostojno opravlja dejavnost z osebnim delom, sredstvi, ki so v lastnini obèanov, pri katerih je v delovnem razmerju."" Namen je jasen."
115,"Predlagam, da se popravi tudi 49. èlen s tem, da se kot amandma doda drugi odstavek: ""Zavezancem, ki na novo zaèno opravljati dejavnost na obmoèjih"" bi se nadomestil z besedilom ""Zavezanci, ki na novo zaèno opravljati dejavnost na obmoèjih in v dejavnostih, za katere so z republiškim zakonom doloèeni posebni ukrepi, bi se dobièek prvih treh let ne obdavèil, v èetrtem letu poslovanja bi se obdavèilo 50%, v petem letu pa bi se obdavèilo 75% dobièka."" Gre za to, da se preko tega lahko uveljavi selektivna davèna zakonodaja, ki bi bila predvsem, usmerjena v hitrejše nastopanje in razvoj manjših gospodarskih subjektov in zaposlovanja, dotok tujega kapitala, razvoj stagnatnih obmoèij in ne samo demografsko ogroženih obmoèjih."
90,"Namreè, rekel, je, glede na to, da smo oèitno nebogljeni pred temi masami papirja, da ne uspemo niti predelati tega, kar spotoma dobivamo na mizo in da je to dolgoroèno gotovo tudi zelo draga zadeva, bi kazalo razmisliti, glede na svetovne trende, da poèasi dobivamo na mize vsak en majhen raèunalnik, pa si tam pogledamo stvari, ki nas zanimajo, oziroma nam posredujejo vse, kar nam morajo sicer posredovati in bi v tem smislu morda tudi prištedili kakšno smrekico ali kaj podobnega, predvsem pa olajšali te zadeve, ker so vsekakor neuèinkovite."
63,"Vendar bi rad izrazil protest proti nekaterim razpravljalcem, posebej proti gospodu Žagarju, èeprav mi je žal, da je šel ta trenutek ven, iz Liberalne stranke iz Kranja, ki zahteva oziroma predlaga, da se osnova do 60.000 ne obdavèuje, da se v 7. èlenu uvedejo 60% olajšave davène osnove in da se po drugi strani znižajo davène in prispevne stopnje, ki sedaj bremenijo gospodarstvo."
61,"Èe je to tako, potem moram seveda reèi, da se na nek naèin niti ne bi mogel s tem ali se ne morem s tem strinjati, kajti to pospešuje, bom rekel, neko družinsko podjetništvo, mora pa, vsaj moj vtis je in moja logika je ta, da mora država vendarle poskrbeti za to, da imajo družinska podjetja ali obrtniki neko znosno življenje."
73,"Že veèkrat sem ponovil, da spreminjamo sistem posameznih vrst davkov od dohodkov fiziènih oseb oziroma obèanov v sintetièno obdavèevanje vseh dohodkov in da so vse tiste podvrste dohodnine, ki so navedene v 2. èlenu, le akontacija, ki se odšteva po koncu odmerjene letne dohodnine in zato so podatki v tabelah, ki so priloženi in ki govorijo, katere podnaslov je Novi èisti osebni dohodek po dokonènem letnem obraèunu dohodnine, dejanski rezultat obdavèitve z dohodnino."
91,"Moram reèi, da je zakon o dohodnini edini iz paketa davènih zakonov, s katerim se globoko in naèelno strinjam in sicer zaradi tega, ker se zavedam, da smo razmeroma revna država, da se obdavèevanje dohodnine mora zaèeti razmeroma nizko, da je neizogibno, da najveèje breme nosijo v takšni družbi sredinski sloji z ugotovljivimi, nezatajljivimi dohodki in zdi se mi tudi normalno, da ni drugega izhoda, kot da v državi te vrste, ki o sebi misli in hoèe postati socialna država, bogatejši paè nosijo veèje breme od tistih, ki prejemajo manjše prejemke."
82,"Ne bom v svoji repliki zahteval, da bi vezali lestvico na lipe, bi pa izrazil svoje nezadovoljstvo s takšno lestvico, ki je bila predstavljena, ki še bolj protežira doloèene sloje in še bolj obremenjuje neke druge sloje na naèin, za katerega je vprašanje, èe je koristen, še posebej v trenutku, ko imamo toliko in toliko procentov podjetij v družbeni lasti, ki bodo na vsak naèin, in imajo seveda tudi možnost, prikazala, èim manj dohodka in seveda s tem èim manj prispevala državi."
