13,"Samo kratko obvestilo: Jutri, 13.6.1991, bo seja Ustavne komisije ob 9. uri zjutraj."
22,"2. Mislim, da je tak zakon kot ga imamo, strokovno gledano, neresna zadeva in je strokovno nekorekten, da ne uporabim izraza zmazek."
26,"Izgleda, da je gospod Pintar malo sodeloval na teh usklajevanjih, zdaj v novem sistemu oziroma sodeloval je enkrat, èe se prav spomnim, ko smo proraèun delali."
9,"Prosim vse prisotne, da pritisnete na sivi gumb! 26."
2,Hvala lepa.
5,Nadaljevali bomo po skupnem zasedanju.
7,"Prosim imenovane, da gredo v sobo 311."
21,"Predlagam, da to sejo prekinemo oziroma, da uvrstimo v nadaljevanju te toèke poroèilo in da glasujemo o predlogu usklajevalne delovne skupine."
43,"Ker pa je usklajevalna komisija Družbenopolitiènega zbora in Zbora obèin, ki je bila imenovana na podlagi 306. èlena, predlagala Družbenopolitiènemu zboru, da sprejme ta zakon, je smotrno, da se dnevni red razširi, da se na ta naèin omogoèi glasovanje o predlogu usklajevalne komisije."
1,Nadaljujemo!
4,Hvala lepa gospodu Kopaèu.
6,"To so me zaprosili, da sporoèim."
10,Gospod Kopaè bila je samo replika na besede gospoda Reberca.
3,Prekinjam današnje zasedanje.
14,"Glede na obveznosti èez pet minut, prekinjam to sejo, prekinjam razpravo k tej toèki."
27,"Samo še kratko obvestilo: usklajevalna skupina za toèko 2/b in c), pri kateri smo danes ostali neusklajeni (skupino smo malo preje imenovali), zaseda v sobi 311."
34,"Argument, ki je dan za poseben sklep - 6 mesecev po sprejemu nove ustave - ta rok je blago reèeno (po tistem, kar vem, ker delam v ustavni komisiji), ne nedoloèen, ampak ta moment celo nedoloèljiv."
12,"No, predlog vlade, ki ga je Odbor za javne finance in proraèun ..."
16,"Prosim, da se v razpravi opredelite tudi do predlaganih sklepov Odbora za proraèun in javne finance."
33,"In sedaj, ker sem zaèela brati 100. èlen, bi prebrala še zadnji odstavek 100. èlena, ki pravi takole: ""Predlog za razširitev dnevnega reda že sklicane seje zbora se objavi v sredstvih javnega obvešèanja."""
35,"Glede zakona je bila razprava že zakljuèena; amandmaji na sam zakon niso možni, zato amandmaja gospoda Petra Bekeša na sam zakon ne moremo sprejeti, niti ga dati na glasovanje, ker je glede zakona razprava zakljuèena."
31,"In sedaj dajem na glasovanje predlog dodatnega sklepa, kakor ga je predlagal gospod Peršak, to je: da je izvršni svet dolžan predložiti novi zakon v šestih mesecih po sprejemu tega zakona."
46,"Ne trdim, da niso možni še kakšni drugi vidiki; ker jaz sem bil sedaj opozorjen, da je paè reèeno: res je, to je 365 dni, kmet dela - soglašam - in paè od tega je ravno tako, èe plaèa en procent, približno isto kot tisto velja za delavca."
15,"In rezultati so razvidni iz povzetka posveta, ki ste ga dobili, upam, danes na klop."
45,"Mislim, da je to tipièen primer, kako se politiène stranke poskušajo polašèati države kot instrumenta, da je to tisto èesar ne smemo dovoliti, ker je podobno tistemu, kar je delal režim pred nami, tam v 50-ih letih in zato je za mene stvar strokovno nesprejemljiva."
29,"Zato je seveda zelo napaèno tolmaèenje, po katerem 13. toèka 16. èlena, kar samo dvema, ki si to želita in imata sluèajno ime študentska organizacija, daje nek poseben monopol."
40,"Vi se spomnite - enkrat sem bil tu predlagan v tako skupino, je pa zbor sprejel nekaj kar ni bilo tudi, moje mnenje in sem zaprosil, da ne grem v tisto skupino, da ne bom proti svojemu lastnemu mnenju se usklajeval."
19,"In to navodilo se izvaja, kar jaz štejem, da je protizakonito, ker je v nasprotju s sprejetim zakonskim tekstom."
32,"Ni posebej uzakonjena in v Mariboru se je že pojavila tudi druga študentska organizacija, morda se bo tudi v Ljubljani, morda se bo še kakšna tretja, èetrta in bog vedi katera še."
30,Odbor za proraèun in javne finance Skupšèine Republike Slovenije je ob obravnavi stališè Izvršnega sveta do predlogov in pobud za spremembe davène zakonodaje sprejel še mnenje in oblikoval tudi sklepe.
60,"""Èe predsedniki zborov ugotovijo, da besedilo, v katerem je bil zakonski predlog izglasovan v enem zboru, ni enako besedilu, v katerem je bil izglasovan v drugem zboru, ali èe besedilo, v katerem je bil zakonski predlog izglasovan, ni v skladu s stališèi Družbenopolitiènega zbora (to ni veè važno, ker so sedaj zbori po ustavi enakopravni) obvesti o tem svoj zbor."
18,"Drugo: O nadaljevanju te seje bomo naknadno obvestili; praviloma po 21. seji, ki je sklicana za naslednji teden."
28,Stališèa Izvršnega sveta do predlogov in pobud za spremembo davène zakonodaje sta obravnavala Odbor za proraèun in javne finance Skupšèine Republike Slovenije ter Odbor za splošno gospodarske zadeve.
54,"Jaz sicer verjamem, ali pa bom boljše rekel - iskreno upam, da bomo mi res kmalu sprejeli ustavo - ker pa razumem to previdnost, ki je bila tu povedana, predlagam, da naš zbor sprejme dopolnilni sklep v naslednjem tekstu: ne 6. mesecev po sprejemu ustave, ampak 6 mesecev po sprejemu tega zakona, o katerem danes glasujemo."
36,"Zato seveda pozivam vse tiste, ki kaj daste na stroko in strokovno mnenje, da glasujete proti temu zmazku, tiste, ki vam je to vseeno, pa imate politiène obveze pa glasujte v skladu s svojimi politiènimi obvezami."
56,"Zato menim, da je treba to zadevo resno vzeti, skleniti ustrezne pogodbe s študentsko organizacijo v Ljubljani in Mariboru ali s pooblašèenimi študentskimi servisi in potem seveda tudi doloèiti naèin uporabe teh sredstev, v kolikor jih mislimo namenjati za financiranje obštudijskih dejavnosti; èe pa to ni stališèe, potem pa naj se seveda vsi ti dohodki obdavèijo."
41,"Predlagam, da k stališèem, ki jih je gospod podpredsednik pravkar prebral, dodamo še stavek, da ""Družbenopolitièni zbor še vedno vztraja, da sekretariat za varstvo okolja in urejanje prostora pripravi analizo vzrokov, ki so pripeljali do katastrofalnih poplav v Zgornji Savinjski dolini."""
97,"Torej, da se gradiva, ki so bila pripravljena za to razpravo, dopolnijo tudi s podatki, ki smo jih terjali na Odboru za delo, to pa so podatki, ki se nanašajo na zajamèene osebne dohodke in delavce, koliko jih prejema, na podatke o tem, koliko delavcev sploh ne neredno ali celo nižje od zajamèenih osebnih dohodkov prejema in en sklep, ki smo ga sicer že sprejeli, pa bi ga bilo treba sedaj realizirati, se pa nanaša na to, kaj misli država oziroma Izvršni svet ukreniti za socialno varnost zaposlenih, ki nimajo osebnih dohodkov, ki jih ne prejemajo redno?"
11,Predstavnik Izvršnega sveta na seji k tej toèki je gospa Markièeva.
24,"In študentskih organizacij, ki pa nimajo tega imena, paè imajo drugo ime, na primer Klub študentov ali kaj podobnega, je v Sloveniji zelo veliko."
8,"Seveda mislim, da na to ne moremo pristajajti."
55,"Potem, ko so dobili mnenje delovnih teles in tako naprej."" To smo opravili zadnjiè, 306. èlen: ""Èe se zbori po dveh zaporednih obravnavah spornega vprašanja ne sporazumejo o besedilu zakonskega predloga, se zaène usklajevalni postopek (ta se je zaèel danes.) V ta namen zbori doloèijo skupno komisijo, v katero izvoli vsak zbor enako število èlanov."
39,"Jaz predlagam, da najprej glasujemo o tem osnovnem sklepu, da se tako kot je bil prebran, da se je zbor seznanil z informacijo in predlogom za odpravo in da to sprejema, kar v bistvu vkljuèuje vse predloge Izvršnega sveta."
52,"Predlog, ki ga je kolega Peršak dal, bi bilo treba normativno zavarovati in sicer na ta naèin, da se kot amandma sprejme v konènih in prehodnih odloèbah zakona, sicer ne veže nikogar in ostane paè ena od številnih želja na dolgem spisku dobrih namenov, ki smo jih že v tej skupšèini izrazili."
20,Se pravi da se tisti tekst glasi: da 6 mesecev po sprejemu tega zakona pripravi nov predlog za izdajo zakona.
44,"To je predstavljalo nad 200% letnega družbenega produkta obèine, vendar je dosedaj za Mozirsko obèino bilo namenjenih samo 12,58% za odpravo te škode (13% je poroèilo, torej približno tam), skratka ni bil veèji delež usmerjen v to najbolj prizadeto obèino kot pa v druge."
42,"Eden je to, da so se mehanizmi verifikacije te škode zaèeli kazati kot mehanizmi utrujanja po eni strani, po drugi strani bi bil to vendarle kredit iz primarne emisije, po tretji strani pa Slovenija nima najèistejših raèunov iz naslova solidarnosti do Jugoslavije."
25,"Na predlog dodatnega sklepa je dodal gospod Peršak predlog, da ni v šestih mesecih po sprejemu ustave, ampak v šestih mesecih po sprejemu tega zakona."
38,"Moram povedati, da verjamem tako argumentom izvršnega sveta, zakaj pravi da je treba ta zakon sprejeti, verjamem pa tudi temu, kar je rekel zadnjiè predsednik skupšèine gospod Buèar, ki je strokovnjak za to podroèje, zato imam en predlog."
86,"Zato predlagam, da ko bomo drugiè odprli vprašanje in garancij in virov za financiranje cest, da se odpre tudi vprašanje cestnin tudi iz tega zornega kota in vprašanje, ali se ne bi Slovenija odloèila za drugaèen sistem financiranja v tej konstrukciji, tudi recimo sistem brez cestnin, pa drugaènega pobiranja denarja za te zadeve, vkljuèno s tujci oziroma, ali ne bi predlagali pri vstopu tujcev posebne takse za ceste, tako kot ima Švica, spada pa to seveda v celoten kompleks graditve cest oziroma zagotavljanja denarja za ceste."
48,"Jaz bom pa vseeno poskusil nekaj povedati, prav zato, ker me je g. Pintar izzval, ker sem eden izmed tistih treh, ki je na tem usklajevanju, da ne bi zavlaèeval zadeve, takoj povedal svoje mišljenje, da ne bi v nedogled razpravljali in usklajevali in se tam šli bikoborbe."
23,"Ampak to je za boljše èase, takrat ko bo on sedel v vladi, pa mogoèe bo takrat prišel s temi svojimi predlogi skozi."
17,"Hvala lepa. (Med tem so me obvestili, da pred dvorano imate na razpolago slušalke, za spremljanje prevoda.)"
49,"Dejansko stanje pa je takšno, da je zelo malo resnih prizadevanj, od ustavne komisije naprej, da bi ustavo res tudi imeli in mi imamo lahko takšno upravo še tudi dolgo èasa z izgovori, da paè ni moglo priti do uskladitve ali pa do sporazumnih rešitev v novi slovenski ustavi."
64,"Rad bi povedal samo to: Èe obstane 13. toèka 16. èlena taka kot je zapisana, se bo zgodilo naslednje: Èe se bo zakon izvajal, bodo obdavèeni prejemki vseh študentov in uèencev ne glede na to, preko katerega koli servisa so bili nakazani, ker te koncesijske pogodbe, ki jo ta toèka omenja, ni, in tudi obštudijske dejavnosti ne bodo veè prišle do tistega svojega denarja."
37,"Rad bi pa rekel še tole (ja bila je replika), tretja stvar iz govora gospoda Reberca, na katero bi rad repliciral je pa ta: študentska organizacija v Ljubljani in študentska organizacija v Mariboru je paè neka organizacija."
57,"Ta katastrski dohodek ni bil revaloriziran 20 krat (to velja samo za katastrski dohodek gozdnih zemljišè), paè pa 13 krat; in tudi 36 dinarjev, kar je prispevek od katastrskega dohodka za pol hektara, pri 10 hektarih npr. pomeni 720 dinarjev (10 hektarov ima orne zemlje, torej ne gozdnega zemljišèa ali pa travnikov, ima zelo, zelo velik kmet)."
68,"K predlogu za izdajo zakona o najetju posojila za odpravljanje posledic poplav v osrednji Sloveniji v letu 1990, s predlogom zakona, so vloženi naslednji amandmaji: Odbor za splošno gospodarske zadeve Skupšèine Republike Slovenije k 1., 3. in 6. èlenu; Odbor za proraèun in javne finance je vložil amandma tudi k 6. èlenu, èe prav razumem, bo predstavnik odbora umaknil ta amandma (gre za isto temo.) Je že umaknil."
47,"Nikakor pa ne morem pristati na to, da študentski in mladinski servisi po Sloveniji, ki so se ustanovili v tistih mraènih dopoldnevih, brez resne pravne podlage in danes poslujejo na ta naèin neobdavèeno, da si jih je enostavno prisvojila Liberalno-demokratska stranka in iz tega financira svojo dejavnost."
72,"Lansko leto je bilo nekoliko drugaèe, ker še ni bil revaloriziran katastrski dohodek (to je bilo v decembrskem), ampak takrat je pa prav zaradi tega (mislim, da je šlo za nafto), denar ki je bil sicer v proraèunu lanskega leta namenjen za subvencioniranje nakupa nafte za kmetijstvo, je bil potem preusmerjen v to, in tista obremenitev kmetov je bila toliko veèja; tako da je tu kar lepo izenaèena obremenitev enih in drugih."
59,"Pol ure po tistem, ko naj bi se seja nadaljevala, se pravi ob 14.00 uri je bila zasedba taka: socialistièna stranka - eden, narodnosti - eden, Stranka demokratiène prenove - štirje, Liberalno demokratska - dva, liberalna stranka - eden (pred vrati, se ne ugotavlja sklepènost) Slovenska demokratièna zveza - eden, SKZ - šest, Slovenski kršèanski demokrati - trije, socialdemokratska - dva, Zeleni Slovenije - pet, neodvisni še zmeraj nihèe."
100,"Tisto kar naj bi pokrivala republika - prviè imamo danes tu program gradnje cest iz naslova poplav (pri èemer 200 milijonov, ki so angažirani, pomenijo eno tretjino potrebnih sredstev, kar pomeni, da se ta problem v resnici razteza na tri leta); denar 200 milijonov za družbene dejavnosti (pomeni, da se saturacija tega problema bodisi raztegne za dve leti, bodisi da ne bo v celoti pokrito) in 200 milijonov na vodah (pomeni, da se ena petina v letošnjem letu razrešuje) - oplemeniteno s kreditom MBOR lahko to pomeni, da se namesto v petih letih zadeva razreši v dveh in pol do treh letih."
50,"Predlog kakršen koli da je - gospod Pintar pravi da je zmazek, ker je nad zakonom; ker sem pa jaz noter, ker sem mnogo nižje, ga razumem kot normalno življenjsko potrebo, katera bo za to prehodno obdobje koristila in služila svojemu namenu, posebno zato, ker za tem tudi stoji izvršni svet."
65,"Dajmo tu vzeti èiste kmete; ampak mi vsi vemo, da je èistih kmetov, ki živijo samo od kmetovanja, kakih 11 procentov, da pa imamo okrog 150.000 kmetij, ki imajo tak katastrski dohodek, da bodo plaèale po 100, 150 ali 200 dinarjev, ampak ti ljudje delajo po tovarnah in še drugod in bodo tam normalno prispevali, od katastrskega dohodka pa tudi, kar je tudi popolnoma normalno."
51,"Dodatno k temu stališèu, ki sem ga navedel v samem pismu, moram povedati še naslednje, da veèina, èe ne trièetrt teh mladinskih servisov, študentskih servisov, ki danes obstajajo po Sloveniji, sploh ni registrirana v nikakršnem registru, ima kljub temu svoj žiro raèun, posluje na nek naèin neobdavèeno, brez prave pravne podlage."
53,"Mimogrede naj omenim samo še to: odkar so se povišale najnižje pokojnine za kmete, je približen izraèun tak (ampak to ni vezano na to debato), da eno tretjino pokojnin, ki jih dobivajo kmetje, pridobivajo oziroma dajo s svojimi prispevki kmetje, dve tretjine kmeèkih pokojnin pa prihaja skozi prispevke drugih kategorij prebivalstva, torej nekmetov."
0,.
58,"In v takšni funkciji bi se seveda zakljuèni raèun moral nekako opredeliti tudi do strukturnih odnosov v taki javni porabi; ali so ta razmerja primerljiva z razmerji drugje, v drugih državah, ali so podoptimalna in bi mi morali potem kot poslanci pri svojem odloèanju bolj paziti na ene vrste javnih izdatkov, oziroma bolj podpirati druge vrste javnih izdatkov."
63,"Predlog vlade, ki ga je Odbor za finance in proraèun podprl pa je, da se prejemki študentov in uèencev na sploh ne obdavèujejo, ne glede na to, preko katerega servisa ali pa sploh ali so bili nakazani preko študentskega oz. mladinskega servisa, no in posebej pa smo se pogovarjali o problemu financiranja obštudijskih dejavnosti, ki ga je tudi treba rešiti vzporedno s tem."
77,"Dobili smo, prejeli smo torej predlog usklajevalne skupine, kjer se predlaga Družbenopolitiènemu zboru naj sprejme predlog zakona o organizaciji in delovnih podroèjih republiške uprave ter predlog, da Družbenopolitièni zbor in Zbor obèin skupaj sprejmeta naslednji dodatni sklep: V našem primeru Družbenopolitièni zbor Skupšèine Republike Slovenije nalaga Izvršnemu svetu Skupšèine Republike Slovenije, da v toku šestih mesecev po sprejetju Ustave Republike Slovenije predloži Skupšèini Republike Slovenije nov predlog za izdajo zakona o organizaciji in delovnem podroèju republiške uprave."
69,"Repliciral bi rad zato, ker je bila omenjena Liberalno-demokratska stranka in študentski servisi (ki niso ljubljanski eden in mariborski eden, èeprav sta tam dva,) so po teh besedah servisi, ki jih je ustanovila Liberalno-demokratska stranka, kar seveda še zdaleè ni res, ker je približno polovica obstojeèih študentskih servisov v Sloveniji - teh pa je okrog 25 res ustanovljenih s strani Liberalno-demokratske stranke - recimo polovica pa s strani èisto nekih drugih."
62,"Danes smo na klop prejeli še dodatno poroèilo Odbora za proraèun in javne finance; na klop smo prejeli tudi povzetek posveta o problematiki obdavèevanja dohodkov študentov in uèencev ter nadaljnjega financiranja študijskih obveznosti, ki je bil dne 28.5.1991 na pobudo Odbora za proraèun in javne finance zaradi dileme, ki se je pojavila v razpravi ob 13. toèki 16. èlena zakona o dohodnini."
87,"Druga ugotovitev ali pa dejstvo je, da je kljub jasno sprejetemu zakonu o dohodnini, ki pravi v tem zadevnem èlenu, da se ne obdavèujejo dohodki, ki so izplaèani preko študentskih organizacij v Ljubljani ali v Mariboru, republiška sekretarka za delo poslala neko pismo na Službo družbenega knjigovodstva in to pismo je potem Služba družbenega knjigovodstva razposlal po celi Sloveniji, z navodilom, naj se ne obdavèujejo vsi tisti dohodki, ki so izplaèani bodisi preko kateregakoli študentskega ali mladinskega servisa ali pa tisti dohodki, ki so izplaèani študentom direktno."
73,"Polemika se vleèe tudi po èasopisih in si jo lahko preberete in tam je problem tudi natanèneje razložen, pa vam s tem ne bi kratil èasa. 13. toèka 16. èlena je napisana zaniè in je neizvedljiva (naj tokrat v obrambo vladi reèem, da se predlagatelj, to je Izvršni svet s to doloèbo takrat ni strinjal) in zato je zakon torej neizvedljiv in zato je nek dogovor, da se v tem trenutku ne izvaja."
90,"Gospod Reberc (ki je èlan Odbora za javne finance in proraèun, ki je potem napisal nek dopis, na katerega je odbor sam odgovoril na seji, na kateri je bil prisoten tudi gospod Reberc) se je s tem problemom ogromno ukvarjal, veliko ur in v ta namen sklical tudi poseben skupšèinski posvet, na katerem je bilo okrog 40 udeležencev, èlanov odbora, predstavnikov študentskih in mladinskih servisov, predstavnikov študentskih organizacij, predstavnikov vlade in morda še kdo in prouèeval ta problem v teh mnogih urah na tem posvetu in sicer na svojih sejah."
