101,"Na vztrajanje kar, moram reči, večine članov komisije, smo predlagali dodatni sklep, ki eksplicitno potrjuje tisto, kar je v obrazložitvi, ki ste jo prejeli glede sprememb obeh zakonov, ki je obravnavana na 7. strani, in sicer, da bo Izvršni svet oziroma sklep naj bi se glasil: tega pa še nimam v pisni obliki - Izvršni svet naj skladno s spremembo in uresničitvijo zakonov o osebnih dohodkih v državnih organih zagotovi povečanje obsega sredstev za financiranje družbenih dejavnosti, spremni naj kalkulativne elemente za vrednost programov oziroma poveča osebne dohodke v tistih primerih, ko je financiranje urejeno na podoben način, kot za državne organe."
56,"Vendar glede na to, da nam je bilo pojasnjeno, da je bil natečaj, da so se zbrali vsi ti simboli in da je bilo tudi arhitektu, ki je to kreiral, podano s strani ustavne komisije pač, kakšno vsebino naj ta dva simbola predstavljata, in glede na to, da je on to popravil in izoblikoval tudi vsebinsko."
72,"Pa bi prosil kolegico Lončarjevo, da pove: prvič, kakšno vlogo je tukaj odigrala stroka v zadnji fazi, se pravi Društvo oblikovalcev, ki je bilo pred časom povabljeno kot tisto telo, ki naj bi dejansko svojo odločilno besedo povedalo, z vsemi temi heraldičnimi zadev ami, in drugič, kako si vi v komisiji predstavljate tisto salamonsko rešitev, da bi taka zastava eventualno pač lahko veljala do nove ustave, se pravi, da je vse odprto."
70,"Zdi se, da bi kazalo, da ne bi vsak izobešal isto državno zastavo v različnih dimenzijah, dopolniti 2. člen tega sporazumnega predloga s tem da je višina - ne vem, se je treba dogovoriti - ena šestina dolžine zastave in da je grb oddaljen od roba zastave, tudi to je treba opredeliti, potem je pa za vse to točno, natanko opredeljeno tukaj, kako se riše grb, potem je tudi zastava natanko opredeljena."
87,"Jasno, s tem se pa ugotavlja, da prihaja do forsirane prodaje in istočasno do izpada dohodka ostalih knjigotrških podjetij v Sloveniji, ko namreč cene osnovnošolskih učbenikov niso nikjer drugačne oz. so v Sloveniji izenačene, gre pa za posebne pogoje prodaje, ki se skozi razno razne načine prodaje teh osnovnošolskih učbenikov izvaja, vendar s takim posegom dejansko prihaja do neke vrste monopolnega položaja Državne založbe Slovenije na slovenskem tržišču in seveda zaradi tega tudi prihaja do podrejenega položaja ostalih knjigotrških podjetij in seveda do izpada določenega dela dohodka."
97,"Ker smo glede skupnega osamosvajanja z Republiko Hrvaško tega prav v vsem sporazumeli z Republiko Slovenijo tudi o načelih, da Slovenija in Hrvaška skleneta zvezo suverenih držav, vanjo pa se lahko vključijo vsi, ki sprejmejo ta pravila itn., bi seveda zastavil vprašanje Izvršnemu svetu Skupščine Republike Slovenije, prav tako Predsedstvu Republike Slovenije in slovenski delegaciji, ki je bila v soboto na tem sestanku skupaj s Hrvati, ali trditev dr. Domljana drži, in če drži, kdo se je dogovarjal s predstavniki Hrvaške o zvezi suverenih držav po osamosvojitvi in zakaj seveda o tem ni obvestil Skupščino Republike Slovenije."
85,"Drugi odstavek tega 1. člena, ki ga je takrat, ko je bil ta zakon sprejet, sooblikoval Republiški sekretariat za pravosodje in upravo, ker sicer je bil nosilec za sprejem zakona, za pripravo zakona Sekretariat za kmetijstvo, gozdarstvo in prehrano, za drugi odstavek je pa prispeval Republiški sekretariat za pravosodje in upravo, in sicer v tem smislu, da je želel varovati tudi druge nepremičnine, ne samo tiste, s katerimi upravljajo kmetijske organizacije, torej kmetijska zemljišča in gozdove, ampak tudi druge nepremičnine, s katerimi upravljajo družbenopolitične skupnosti."
79,"Tisto je čisto jasno, da se tisti rok, ki bo potekel konec junija, da se podaljša in ta je čisto logičen, ni mi pa popolnoma jasno, kaj pomeni amandma delovnih teles in bi lepo prosil, če se tisti stavek v celoti prečita, ne samo z vejico, pa se še nekaj črta, in to bi želel, da se zdaj zagotovi, da bo to vsebina celovitega tistega člena, ki jo delovna telesa predlagajo, da se to reši pred odločitvijo za postopek."
75,"Roki, s katerimi so bile varovane, te pravice, vis-a-vis teh upravljalcev s temi nepremičninami, je potekel 31. decembra lanskega leta in je bila ta varovalna določba nekako nadomeščena s spremembo zakona o kmetijskih zemljiščih, ki ste jo v Skupščini sprejeli - to spremembo zakona kmetijskih zemljiščih - v letošnjem januarju in je bila objavljena v Uradnem listu št. 5 letošnjega leta, tako da tega ne bi sedaj ponavljal in se ne bi izgubljal naprej v ostalih določbah."
139,"Namreč, s tem zakonom o denacionalizaciji je predvidena oziroma je sprejeto načelo, da naj bi se v okviru denacionalizacije v prvi vrsti vračala v naravi, torej tiste nepremičnine, oziroma premoženje, ki je bilo posameznikom podržavljeno na različne načine, in to iz dveh razlogov: po eni strani naj bi se varovalo korist te republike, da ne bi bilo potrebno tam v tistih primerih, kjer ni mogoče vrniti stvari v naravi, da se ne bi torej zaradi tega povečeval fond družbenih sredstev za plačilo odškodnine bodisi v gotovini, bodisi v obveznicah, ker tudi za obveznice je potrebno imeti kritje, kot tudi zaradi samih prejšnjih lastnikov, ker marsikomu pomeni stvar sama, če dobi stvar v naravi denacionalizaciji več, kakor pa da dobi nek papir, v okviru katerega bo in s katerim bo enkrat uveljavljal torej pravice v obliki denarja, torej za izplačilo."
