87,"Vendar pri tem moram povedati, da ugotavljanje obstoja in uveljavljanja premoženjsko pravnega zahtevka, da je dolgotrajen postopek, ki omejuje pri nas še dejstvo, da do sedaj nimamo pri nas sodne prakse za to ugotavljanje, saj ne poznamo primera, ko bi sodišèe ugotovilo obstoj monopolnega sporazuma. zaradi tega mi smatramo, da je pooblastilo o posegu na podroèje cen zaradi prepreèitve monopolnega položaja, dokler se do tega ne dokopljemo, se pravi do zakona in do sodne prakse, da je za toliko èasa potrebno zagotoviti tudi v zakonu o cenah."
117,"Zavzemam pa se za vse ostale, to je amandma k 32. èlenu, kjer naj bo predvidena tudi možnost, da daje soglasje k imenovanju oziroma razrešitvi direktorja svet zavoda: potem k 35. èlenu, ker mislim, da gre za eno tehnièno napako, namreè, da ni naveden rok do katerega se sprejemajo prijave kandidatov: k 38. èlenu, mislim, da je tudi nekdo drug vložil ta amandma in pa k 1. èlenu bi imel samo pripombo, da podpiram v celoti amandma gospoda Glavièa oziroma bi bilo dobro, èe bi predlagatelj razmislil o tem, da bi se drugi odstavek v celoti èrtal in bi se drugi glasil samo: ""Zavodi so neprofitne organizacije."" Namreè, da ne našteva taksativno, katere organizacije so javni zavodi."
110,"Ti amandmaji, ki izhajajo iz zahtev vodstva ljubljanske univerze, ki smo jih tudi lahko slišali in brali na podlagi poroèil s tiskovne konference, ki je vodstvo ljubljanske univerze pripravila 8. marca, jaz pa sem bil o tem prej obvešèen, ker sem bil povabljen na sestanke dekanov, ki ga je sklical rektor ljubljanske univerze, da bi pojasnjeval nekatera vprašanja glede uporabe zakona o zavodih in na tistem sestanku je tudi prišlo do predloga moramo priznati, da sem bil sicer preseneèen, ker dekani so se zelo zanimali za reorganizacijo po zakonu o zavodih, potem pa je prišel predlog s strani vodstva univerze, da se univerza oziroma visoko šolstvo iz tega zakona izkljuèi."
86,"Èe grem lahko naprej v zvezi s tem je predlog delegata Danijela Božièa, naj se èrta prvi odstavek 6. èlena, se pravi tista doloèba, ki temu zakonu daje popolnoma subsidiaren znaèaj, ki omogoèa, da se na posameznih podroèjih, kjer se za to pokaže potreba status zavodov in upravljanje z njimi na drug naèin, uredijo, ne na ta naèin, kakor ta zakon doloèa, in to tudi omogoèa tudi ta doloèba, da se z zakonom o univerzi ta vprašanja ustrezno uredijo, tako kot univerzi in njeni avtonomiji ustreza."
75,"Mislim pa, da so novele zakona o usmerjenem izobraževanju, ki spreminjajo pedagoško-znanstveni svet ponovno v to, kar je: to , da ima pooblastila na podroèju stroke, da voli uèitelja tako, kot se to spodobi, da znanstveni svet univerze voli rektorja, da svet šole voli dekana, to vse je, kar piše tam notri, da ne velja za visoko šolstvo oziroma, da kadar ni z zakonom drugaèe doloèeno, vse te stvari tvorijo eno novo, vendarle obnovljeno avtonomijo univerze."
81,"K 70. èlenu imamo amandma Odbora za vzgojo in izobraževanje in telesno kulturo, ki pravi: drugi odstavek 70. èlena se glasi: ""V zavodih iz 62. èlena tega zakona, ki nadaljujejo delo kot javni zavodi, imenuje in razrešuje direktorja skupšèine družbenopolitiène skupnosti, ki je ustanoviteljica zavoda, èe ni z zakonom doloèeno, da ga imenuje in razrešuje Izvršni svet skupšèine družbenopolitiène skupnosti ali da daje skupšèina družbenopolitiène skupnosti ali njen Izvršni svet soglasje k njegovemu imenovanju in razrešitvi."" Izvršni svet tega ne podpira."
