5,V sredo ob 10.00 uri?
16,"Lepo prosim, èe se lahko zmenimo, za datum, kdaj bo sklicano nadaljevanje 19. seje Družbenopolitiènega zbora?."
7,Gospod Battelli bi še rad nekaj povedal.
4,Kako bomo to opravili?
13,Sedaj èakamo obravnavo in sprejem predloga za izdajo s tezami v Družbenopolitiènem zboru.
9,"To kar je Izvršni svet predlagal, je spoštovanja vredno."
3,Tisto je zmenjeno.
1,Hvala.
19,"Èe je, potem lahko jutri republiški Izvršni svet pride vedno z novimi predlogi, da gre na združitev dveh faz."
8,"Dnevni red je - prvi štirje zakoni, ali kako?"
12,"Postavljen je na dnevni red, njegova obravnava pa se odlaga ves èas."
15,"Predlagam, da ob koncu te neuspešne seje (glede kvoruma) doloèimo, kdaj bi konèali 18. sejo."
6,"Se strinjate, raje ob 16.00 uri?"
85,"Od dveh trenutno ni nobenega.) Stranka SDP jih je bilo 6, sedaj trenutno 3 od 14; Liberalno demokratska stranka - 3 od 12; Liberalna stranka - 1 od 3; Slovenska demokratièna zveza - 4 od 8; Slovenska kmeèka zveza - ljudska stranka - 8 od 11; Slovenski kršèanski demokrati - 5 od 11; Socialdemokratska stranka - 2 od 5; Zeleni Slovenije - 6 od 8. In neodvisni, nobeden od 1. Neodvisnosti 1 od 2. Po podatkih službe se jih je 45 danes prijavilo, po moji evidenci pa jih je okoli 60 v hiši."
18,"Zato ker Izvršni svet èaka, da bi izdelal predlog zakona o zunanjih zadevah oziroma osnutek o zunanjih zadevah."
37,"To pa ne pomeni, da razprava ne bo popolnoma normalno tekla na zboru, da tisti, ki ne bo dal pisnih pripomb zaradi tega ne bo imel možnosti razpravljati o osnutku popolnoma normalno in dajati naj svojega stališèa."
31,"In èe je mogoèe, bi se zmenili, da 18. sejo konèamo v torek, èe je to mogoèe, ne pa da bi spet naslednjiè nadaljevali z 19. sejo, odlagali to v nedogled."
23,"Mene osebno je zaprosil, da posredujem njegovo stališèe, da gre stvar ne po skrajšanem postopku, ampak govorimo o združitvi prve in druge faze."
29,"Dobro, v sredo, ob 10.00 uri, ampak imamo v torek spet to nadaljevanje 17. seje, obenem so pa ostala delovna telesa, kot ustavna komisija, ki pa zaseda v ponedeljek."
39,"Kolikor so mi zadeve poznane o tem zakonu se mudi zato, ker bi Višja pomorska šola rada že v naslednjem šolskem letu prerasla v Visoko pomorsko šolo in verjetno morajo biti zadeve pravoèasno urejene in to verjetno pred polletjem."
66,"Ko sem vèeraj prišel s tem predlogom, da bi ta seja bila non stop, èe tako reèem, da bi zadeve sprejemali po hitrem postopku in da bi jih sprejemali toliko èasa, dokler ne pripravimo vse potrebno in na koncu ugotovimo, da imamo vse v svojih rokah, da smo suverena država Slovenija, sem ta predlog dal iz naslednjih razlogov: živim v obèini, kjer se veliko stvari dogaja."
17,"Prosil bi gospode poslance (ki množièno odhajajo), da preverimo sklepènost in èe nismo sklepèni, bomo prekinili sejo."
42,"Kakšni razlogi paè vodijo, ker pri drugih je šlo preprosto za to, da so to zakoni, ki so pomembni v sklopu tega cilja, o katerem je na veliko govoril tudi gospod Šeligo in ki gre tudi èez to, da bi imeli demokracijo."
27,"Zato sem mislil to, kar je gospod Thaler rekel, predlagati, je pa seveda res problem, da bi se Družbenopolitièni zbor sestal v torek; ponedeljek je nesmiselno predlagati."
45,"Poglejte, zelo kompliciran zakon o notranjih zadevah - ki pa je bolj pomemben od tega za uveljavljanje državnosti neke države - smo lepo normalno brez naglice, pa v relativno hitrem èasu dveh mesecev, sprejeli skozi tri faze in imamo danes sprejetega in ne zbuja nobene slabe volje."
24,"Tega se moramo držati tudi zaradi uskladitve z ostalima zboroma, ki sta oba sklicana v sredo ob 10.00 uri, nadaljevati s to 19. sejo."
20,"Ko bo predloženo ustrezno gradivo Izvršnega sveta Skupšèine Republike Slovenije, se bo zbor opredelil do morebitne razširitve predloga dnevnega reda."
43,"Prejeli smo dodatni sklep, da bi danes, da pozovemo poslanke in poslance in poslanske klube, da po možnosti dajo èimprej pisne pripombe na zakone zato, da bi lahko delovna telesa že v zaèetku naslednjega tedna in Izvršni svet ustrezno upošteval te pisne pripombe."
38,"Najprej nekaj ugotovitev, ki jih bom povsem na kratko komentiral. (Ne bom vas dolgo obremenjeval s tem.) Najbrž vsi ugotavljamo, da nam nepripravljene ali slabo pripravljene seje ne koristijo in prej zavlaèujejo delo kot da bi ga pospeševale."
30,"Gre za to, da bi tudi sami sebi na nek naèin olajšali delo, ker bi delovna telesa lahko že na nekatere pripombe reagirala in mogoèe že tudi kakšno pojasnilo dala."
11,Mi smo v sekretariatu pripombe že upoštevali in pripravili osnutek osnutka.
2,Prekinjam sejo.
77,"Nenazadnje imamo nekaj nedokonèanih sej in èe bi pošteno analizirali to, kar se je v skupšèini dogajalo vèeraj, in to, kar se v skupšèini dogaja danes, potem bi se izkazalo, da v kolikor se ne spametujemo in ne zaènemo delati po proceduri, ki je paè lahko komplicirana, ki gre mogoèe komu na živce, ampak v kolikor teh procedur ne bi spoštovali, potem mi lahko verjamete, da nas bo prej ali slej sram hoditi po ulicah v Ljubljani."
10,Tisti v hiši smo ga dobili že pred nekaj dnevi.
21,"Dobro, jaz bom predlagal predsedniku, da sklièe Družbenopolitièni zbor za nadaljevanje 18. in 17. seje v torek, recimo, ob 14.00 uri."
46,"Torej, imam dve pobudi nas tu, ki smo v zboru in mislim, da bi bilo dobro, da tudi to uvrstimo v mesecu maju, ker èe bomo samo po tem delali, kar smo danes prejeli, se bojim, da bomo izèrpali dnevni red in tega ne bomo uvrstili."
63,"Druga stvar, ki jo predlagam je, da bi omogoèili v okviru sprejemanja dnevnega reda ta možnost, da pride toèka, ki se tièe zakona o državljanstvu Republike Slovenije, v takem roku v razpravo (to bi bil lahko predlog tudi ostalima zboroma, zato to predlagam, da bi to za naèrt dela jutri predložili, da bi lahko opravili pri tem zakonu tudi konzultacijo s civilnodružbenimi interesi."
35,"Èe ni veè razpravljalcev, predlog Izvršnega sveta o združitvi dveh faz, ne govorimo o skrajšanem niti pospešenem postopku, ampak združitvi prve in druge faze, glede na to, da je paè v tej fazi predloženo skupšèini."
26,"Moram reèi, da tudi pol ure po tistem, ko smo dali odmor za deset minut, nismo sklepèni in ne vidim druge možnosti, kod da to ugotovim."
76,"In jaz ne bi sedaj o vsem tem govoril, da nimam tukaj stališè delovnih teles, da ni bilo mogoèe tega prouèiti, da ne vemo, kaj bomo sprejeli ampak trdim, da v kolikor hoèemo, da bi poslanci Liberalno-demokratske stranke lahko sodelovali pri oblikovanju teh zakonov, kvalitetno dajali svoje predloge in da skupšèina ne bi bila samo kulisa vlade, da je potrebno omogoèiti, da se ti zakoni preèitajo in da je potrebno omogoèiti, da normalno o tem razpravljamo."
40,"Oznake na registrskih tablicah je treba spremeniti v tem èasu, gre tudi za potovanja v tujino in podobne zadeve, zato predlagamo, da se sprejme zakon, da se združita ti fazi postopka; tako in tako bodo potem procesi trajali dlje èasa."
14,"Ker je problem predvsem v tem, ker moramo ta gradiva preštudirati, sklicati delovna telesa."
57,"Izvršni svet Skupšèine Republike Slovenije je predložil predlog za izdajo zakona o postopku za uveljavljanje socialnovarstvenih pravic s predlogom zakona in predlagam, da se v skladu z 312. èlenom poslovnika Skupšèine Republike Slovenije zakon obravnava in sprejme po skrajšanem postopku, da se zagotovi kontinuiteta dela pri uresnièevanju socialnovarstvenih pravic do uveljavitve nove zakonodaje na podroèju socialnega varstva."
58,"Ampak zato, da ne bomo rekli da seje, ki je bila sklicana regularno, niti zaèeli nismo, dajmo vsaj to narediti - kar je bilo že reèeno in kar mislim, da je bila tudi s strani SDP - pokazana pripravljenost in tudi s strani Socialistiène stranke - da se zmenimo, ali smo za to ali ne, da se ta dnevni red sprejme."
36,"Tukaj je bilo reèeno, da je on sicer pred vrati, ampak vestno zastopa predlagatelja v Izvršnem svetu in bi ga prosil, èe lahko pojasni, zakaj je pri tem zakonu pomembno, da ga sprejemamo po takšnem postopku."
34,"Poglejte, kaj se nam dogaja, mi smo pa izpostavljeni javnosti: v naši delegaciji imamo nekaj ljudi, ki so direktorji iz podjetij, gospod Kuhariè, gospod Kocijanèiè; ona dva sta opozorila, da sta zmeraj nekje odsotna."
25,"Odbor za zdravstvo je predlagal - imam te papirje, nakazal je na težak, alarmanten problem zdravstvu - da se to uvrsti na dnevni red v mesecu maju."
28,"Se opravièujem, za prve štiri, to je predlog za izdajo zakona o carinski službi, o Narodni banki, o državljanstvu, o tujcih. mislim, da predvsem te prve štiri toèke."
32,"Ne se sklicevati na poslovnike; kadar vam ustreza, gospodje iz Demosa, se sklicujete na poslovnik, ki je bil sformuliran še v prejšnjem režimu, kadar pa vam ne ustreza boste pa govorili drugaèe."
22,"Gre za to, da smo mi, ko smo razmišljali oziroma sestavljali dnevni red, da nimamo praktièno na razpolago gradiva, razen stališè odbora."
67,"Soglašam (èeprav moram reèi, da o delu govorim dogovorjen v klubu, o delu govorim tudi v osebnem mnenju), da imamo odprto sejo, da ni treba, da bi morali imeti petnajstdnevni rok, da ni treba, da se pregovarjamo o tem, ali je nekaj formalno prav sklicano ali ni formalno prav sklicano in da imamo tudi razumevanje o tolmaèenju faz v pripravljanju in sprejemanju zakonov, ki je naše odgovorno."
65,"Glede prvega pa bi povedal naslednje; glede na to, da je bila seja prvotno predvidena za 21. maj, so vsaj delno te konzultacije o poteku te odprte seje med vodji klubov že bile opravljene - delno pravim, ker ni bilo vse èisto dobro domenjeno - in se strinjam s tem, da jih je treba še opravljati, lahko se mi še danes kaj dogovorimo med seboj o tem."
41,"Glede predloga, da bi dali pisne predloge, je od strokovne sodelavke Zakonodajno-pravne komisije prišlo obvestilo, da bi želeli zlasti amandmaje v zvezi z zakonom o cenah, ki ga imamo že dlje èasa, smo ga že pred èasom dobili, ne šele vèeraj."
33,"Prosim, kdo je za združitev dveh faz? (Samo o enem zakonu govorimo dve uri do sedaj; govorimo samo o enem predlogu) pri predlogu za izdajo zakona o Narodni banki Slovenije, z osnutkom zakona?"
56,"Potem mesec, dva meseca, tri mesece za tem isti zakon ponovno obravnavamo in ga popravljamo, ali pa seveda vsi vemo, da zakon, tudi èe je sprejet, ni izvedljiv (tako je bilo z zakonom o intervenciji na cene na podroèju kmetijstva) oziroma moramo zakon, tako kot je šlo na davèni sistem, moramo kar naprej ""flikati"" in popravljati."
50,"Mogoèe ste nekateri že pozabili stanje: zakon o zunanjih zadevah, ki je prav tako pomemben zakon za osamosvojitev in neodvisnost Slovenije - naš name je bil, da bi ga sprejemali v treh fazah in smo poskušali v vladi hiteti z njim kolikor se je dalo - se je ustavil v tem zboru."
81,"Moj predlog je, da se ta zbor, ki oèitno rabi veliko èasa, da se pogovori o nekaterih stvareh, ker se želi temeljito dogovoriti, moj predlog je da se dogovorimo, da imamo redno vsak teden v torek ali sredo, sredo in èetrtek (odloèimo se glede tega) redno sejo, da se na seji, ki jo konèamo en teden, dogovorimo, kaj je na dnevnem redu naslednji teden, da imamo mi priložnost narediti dve stvari: razporediti svoje ostale obveznosti in tudi možnosti za ekspertno delo."
62,"Èe bi razprava o prvem, ki je na dnevnem redu, trajala približno dve uri, kakor traja razprava o dnevnem redu, potem bi verjetno vsaj približno bili že seznanjeni z vsebino tega zakona in bi se že lahko odloèali o tem, kar poskušamo pred tem; pred tem odloèati o tem, ali smo sposobni, dokler razprava ni bila niti poskušana, je za mene nesprejemljivo."
55,"Prosil bi predlagatelja, da obrazloži, zakaj je ta zakon tako pomemben, da mora iti po skrajšanem postopku. (Pustite vi to, èe je 45 let, potem še 45 let poèakajte, èe je taka stvar.) Èe sedaj govorimo o osamosvojitvi Slovenije, prosim, kakšne zveze ima ta zakon o spremembah in dopolnitvah zakona o pravnem položaju verskih skupnosti?"
88,"Zato bi zakljuèeval s tem, da jasno je, da je v naravi vsake pravne norme, da je kršena, ne bi pa rad, da bi na podlagi nekih etiènih meril ta zbor kršil ta merila, merila demokratiènosti - kajti, konec koncev, veste na zahodu ima tudi na smrt obsojen, èlovek oziroma tisti, ki se mu sodi za umor, svoj dan na sodišèu, kjer lahko pove, ves dan govori in govori o tem, kar mu leži na duši - in mislim, da tudi ta zakonodaja, ki jo bomo sprejemali, zahteva temeljit pretres."
84,"Zato predlagam, da danes ne odloèamo o teh zakonih, ravno zaradi razloga, ker želim kvalitetne zakone v osamosvojeni Sloveniji, ampak si dajmo nekaj dni odloga za prouèitev vsaj nekaterih zakonov, ki se jih danes izbere; da danes konèamo 17. in 18. sejo Družbenopolitiènega zbora, da pa se 19. seja preloži, morda na prihodnji teden in seveda takrat poslanci, in to vsi poslanci te skupšèine, tudi Družbenopolitiènega zbora, jasno, lahko kompetentno, na podlagi svojih študij, posvetovanj s strokovnjaki odloèamo o taki in tako pomembni zakonodaji."
51,"Res spoštujem tiste zakone o državljanstvu, o carini in vse to, kar smo prej sklepali in za to sem tudi glasoval, da je postopek skrajšan; medtem resnièno tukaj vidim, da to ni potrebno pri tem zakonu, o katerem bomo sedaj glasovali oziroma da pride na dnevni red in po skrajšanem postopku."
47,"V predlaganem zakonu se s èrtanjem posameznih èlenov odpravljajo ovire za vkljuèevanje verskih šol v sistem vzgoje in izobraževanja, z manjšo dopolnitvijo zakona pa bi lahko omogoèili diplomantom verskih šol, da bi že v letošnjem študijskem letu pridobili sprièevala ali diplome, ki bi imele znaèaj javne listine."
74,"Mislim, da velike škode ne bi bilo, tudi zaradi kvalitete sprejemanja zakonov in bi resnièno danes sprejeli dnevni red 19. seje, potem uveljavili to priporoèilo, da bi klubi posredovali pisne pripombe do ponedeljka in da se dogovorimo, tako kot je gospod Potrè predlagal - pa upam, da zaradi tega moji kolegi ne boste proti temu predlogu - da sklièemo to 19. sejo resnièno za torek ali sredo in gremo po teh skrajšanih postopkih, kot so predlagani."
72,"Osebni predlog: omejimo se na vprašanje, ki je na dnevnem redu, to je predlog Izvršnega sveta, da v smislu 260. èlena poslovnika Skupšèine Republike Slovenije, po 265. èlenu, se združita prva in druga faza zakonodajnega postopka, tako da se hkrati obravnava predlog za izdajo zakona z osnutkom zakona, kar ste prejeli na klop in kar so tudi delovna telesa danes dopoldne obravnavala, pri predlogu zakona o Narodni banki Slovenije, z osnutkom zakona."
69,"Ampak poglejte, mi imamo danes res situacijo, ki jo lahko opišemo takole - niti ne vemo natanèno, na kateri osnovi, tu v tem tekstu piše: ""Pristojni zbor lahko na predlog predlagatelja zakona, s katerim soglaša pristojno delovno telo zbora in Zakonodajno-pravna komisija..."" in tretjiè, normalno bi bilo, da imamo na zasedanju tega zbora vsaj enega èlana Izvršnega sveta, ki je tudi èlan našega zbora, ki naj bi bil zastopnik predlagatelja."
80,"A ne bi bilo možno prav zares, ker zdaj že kaže, da to stanje se malo bolj normalizira, da lahko te zakone lepo obravnavamo, tako kot ste dali na 21.5., jih preštudiramo, vse komisije to predlagajo in da mi danes (oprostite res, da dajem, saj vem, da bo iz naših vrst kritika prišla), dajem popolnoma konstruktiven predlog, da danes vsaj to konèamo, kar je zadnjiè ostalo nedokonèano, ker sem preprièan, da tisto bomo konèali, novega, kaže še zaèeli ne bomo."
44,"Izvršni svet predlaga, da se v skladu z drugim odstavkom 265. èlena poslovnika Skupšèine Republike Slovenije združita prva in druga faza zakonodajnega postopka, tako da se hkrati obravnava predlog za izdajo zakona z osnutkom zakona pri predlogu zakona o deviznem poslovanju, z osnutkom zakona."
89,"Mislim, da gre za izredno resne zadeve in zato prosim, da se že zresnimo in da smo tu, èe bi bilo tudi potrebno, da sprejemamo tisti zakon, ki ga imamo, kot smo rekli, v hladilniku; zato naj bo ta odprta seja in zato tudi ponovno prosim - ne bom nobenih drugih argumentov našteval, ne bom našteval nobenih informacij, s katerimi razpolagam in to, ker se bo nocoj pa na jutrišnji dan dogajalo v Sloveniji, ne bi želel plašiti, ampak vam povem, da se bodo stvari dogajale tako kot se dogajajo."
53,"Izvršni svet predlaga, da se v skladu z drugim odstavkom 265. èlena poslovnika Skupšèine Republike Slovenije združita prva in druga faza zakonodajnega postopka, tako da se hkrati obravnava predlog za izdajo zakona z osnutkom zakona pri predlogu za izdajo zakona o ustanovitvi visoke pomorske šole in prometne šole v Piranu, z osnutkom zakona."
48,"Resnièno, ta zakon - jaz sem ga danes imel na klopi, vemo, da smo že dobili osnutek tega predloga, že zdavnaj smo ga dobili in smo nekako to obravnavali že tudi v Komisiji za visoko šolstvo - vendar, ne mudi se toliko, da bi to moralo iti po skrajšanem postopku."
0,...
54,"Izvršni svet predlaga, da se v skladu z drugim odstavkom 265. èlena poslovnika Skupšèine Republike Slovenije združita prva in druga faza zakonodajnega postopka, tako da se hkrati obravnava predlog zakona za izdajo zakona z osnutkom zakona; pri predlogu za izdajo zakona o Agenciji Republike Slovenija za zavarovanje depozitov bank in hranilnic z osnutkom zakona."
59,"Vprašal bi, ali gre za to, da poslanci morajo dati pisne predloge, ali gre za to, da jih lahko dajo, koliko je teh poslancev, ki naj bi jih dali, da bo ta sklep izvršen? èe pa gre za priporoèilo, da lahko damo pisne predloge, potem pa mislim, da sklep ni potreben, ker vsakdo lahko da pisne predloge, kadar koli."
52,"Izvršni svet predlaga, da se v skladu z drugim odstavkom 265. èlena poslovnika Skupšèine Republike Slovenije združita prva in druga faza zakonodajnega postopka tako, da se hkrati obravnava predlog za izdajo zakona z osnutkom zakona pri predlogu za izdajo zakona o prehajanju èez državno mejo in varovanju državne meje, z osnutkom zakona."
49,"Izvršni svet predlaga, da se v skladu z drugim odstavkom 265. èlena poslovnika Skupšèine Republike Slovenije združita prva in druga faza zakonodajnega postopka, tako da se hkrati obravnava predlog za izdajo zakona z osnutkom zakona pri predlogu za izdajo zakona o potnih listinah državljanov Republike Slovenije z osnutkom zakona."
112,"Jaz sicer v naprej povem, da tega zakona nisem bral - in da sem si vzel to, lahko bi pri kateremkoli zakonu to sprožili, ampak pojasnilo, ki ga je tukaj korektno dal gospod iz Sekretariata za notranje zadeve me preprièuje, da to ni potrebno sprejemati po takšnem postopku, ker so seveda tablice oznaèene tako, da se natanèno razloèi, recimo imamo KP, LJ itn; v prometnem dovoljenju so tudi stvari, kodificirane po republikah in vse te stvari bodo v prehodnem režimu verjetno ravno tako tekle, razen èe to pomeni, da moramo v istem trenutku zamenjati - ampak potem bi bilo treba seveda tukaj ob tem oceniti kakšne stroške to povzroèa, da ne odpiram drugih diskusij."
75,"Imam to pravico, da reèem, da sem se tudi v prejšnjem režimu tolkel proti sprejemanju zakona po hitrem postopku in sem - èakajte, jaz sem bil dosledno na tem in bom dosledno še naprej in ne me, še enkrat ponavljam, ne mene ""folirati"" (bom srbski izraz uporabil) s to suverenostjo Slovenije, da moramo zdaj v imenu suvernesti kar na hitro sprejemati vse, od registrskih tablic pa do ne vem èesa, pa do cen tega in onega."
