11,S tem tudi zakljuèujem skupno sejo in se zahvaljujem za udeležbo.
18,"Dajmo se navaditi tu nekega kontinuiranega procesa in zato, èe bo prišlo na glasovanje, bom seveda glasoval proti."
8,Gospod Potrè bi prosil še za zakljuèno besedo.
4,Kdo se je vzdržal?
41,"V vèerajšnji razpravi so ostali še razpravljalci in sicer Zvone Žagar, Milan Aksentijeviæ, Jožef Školjè, Žarko Pregelj, Darja Lavtižar-Bebler in Ivan Vodopivec in to v teh splošnih zadevah o politiki vlade in o resoluciji in o sklepih, ki smo jih sprejeli."
12,"Na predlog gospoda Potrèa, ki je opozoril, da morda nismo bili sklepèni ..."
5,Èetrti sklep je tudi umaknjen.
3,Kdo je proti?
38,"V imenu skupšèine dovolite, da dr. Andreju Ocvirku in Dušanu Šešoku, seveda v imenu vseh delegatov in ostalih, èestitam k imenovanju in jima zaželim mnogo uspeha in osebnega zadovoljstva, èeprav bo to težko najti v tem napornem delu."
25,"Druga je, da o stvareh, o katerih predsedstvo ali predsedujoèi meni, da ta skupšèina ni pristojna sprejemati tovrstnih sklepov, jih ne sme dati na glasovanje."
20,"V imenu skupšèine bi mu izrazil zahvalo, da je v tem delu paè pomagal, da se gradi nov gospodarski sistem."
32,"Samo prosim, da se v stenogram vnese, da sem predlagal, da bi moral dati predsednik v razpravo ali poslanci soglašamo, da se, ker ni bila ugotovljena sklepènost, o prvem sklepu ponovno glasuje."
13,"Kdo je za to, da se obnovi glasovanje, prostim pritisnite na sivo tipko?"
2,Ne želi.
30,"Moj komentar k temu sklepu je, da je to po dosedanjih ustavnopravnih aktih samo po sebi umevno in da bi bilo pravzaprav zelo nepotrebno, èe bi tak sklep ponovno sprejemali."
14,Ali želi kdo od teh prijavljenih razpravljalcev še brati oziroma obnoviti svoj pripravljen referat?
35,"Ta sklep ni bil v nasprotju s sklepi, ki smo jih sprejeli vèeraj, in je po moji presoji najmanj neprimeren glede na situacijo, kot smo jo analizirali vèeraj in kot jo tudi v bodoèe prièakujemo."
47,"3. Vsi še veljavni zvezni predpisi postanejo predpisi Republike Slovenije in jih s tem slovenska skupšèina proglaša za zakonske predpise Republike Slovenije v obsegu in po seznamu kot bo to pripravila ustavna komisija Skupšèine Republike Slovenije, ki je to delo dolžna opraviti najpozneje do 15. maja 1991."
43,"Gre za predpise z raznih podroèij in verjetno bi taka generalna klavzula povzroèila negativne posledice, se pravi anarhijo v pravnem redu, tako da menim, da bi le prepustili to razveljavljanje in prevzem predpisov normalnemu teku dela, kot smo se glede tega že sporazumeli."
34,"Za vprašanja, pri katerih gre za vprašanje ustavnosti in zakonitosti, pa je potrebno pred glasovanjem preveriti ustavnost in zakonitosti v ustreznih organih, ki jih ima, delovna telesa tudi, ta skupšèina in še drugi so."
46,"To po mojem ni dopustno, predlogi sklepov so bili dani že zelo davno od tega, seveda so bili takrat nekoliko bolj aktualni kot danes, vendar kljub temu vztrajamo pri vseh predlogih sklepov, edino kar je možno, je verjetno možno, da da predsedujoèi predloge sklepov v razpravo."
1,Spoštovani.
27,"Okrog te številke bi rad povedal in to naslednje, kar naenkrat je bil Zbor združenega dela tukaj s 45 poslanci zastopan in v tem je bistvo nesporazuma."
24,"Kvorum je, glasujejo pa ne vsi, mi še nimamo predpisov, ki bi silili poslanca, da pritisne na tipko, ali v vseh treh oblikah izjavljanja."
36,"Gre za žaljiv odnos do stranke, ki zelo konstruktivno nastopa v tem parlamentu in za žaljiv odnos do sokolegov, poslancev, ki jih tukaj ni, zato v skladu z vèerajšnjo prakso predlagam, da mu predsedujoèi izreèe opomin."
10,"Družbenopolitièni zbor prosim: 47 prisotnih; Zbor obèin, ni vkljuèen, oprostite."
42,"Jaz sem pred približno 8 meseci predlagal ravno zato, da bi se izognili tovrstnim resnièno neprijetnim dogodkom, da paè uporabljamo uradne nazive strank v medsebojnem komuniciranju in to seveda velja tudi za številèno najmanjšo stranko v tem parlamentu, to je Liberalna stranka."
55,"Namreè ni nobene potrebe, da ob razlikah, ki so, kontaminiramo prostor demokratiènega dialoga z uporabo kakršnihkoli nazivov, ki niso v registru strank in niso v zakonu urejeni in v tem delu bi se pridružil intervenciji spoštovanega kolega Starmana, s tem, da nisem pristaš sankcij, in mislim, da je stvar demokratiène zrelosti, da tak dogovor izvajamo."
31,"Zato predlagam, da to nervozo, ki se nas je polotila in nam bo onemogoèila normalno delo, da jo, èe je drugaèe ne moremo, preložimo in bomo ta prepir nadaljevali kdaj drugiè."
53,"Ne predlagam, da se karkoli ponovi, samo hoèemo opozoriti, da èe bi se hotelo, bi se lahko temu izognili na ta naèin, da bi prepreèili, da glasujemo eni delegati za prisotnost v drugem, kar se je oèitno sedaj zgodilo, kar je brez prisotnosti kar naenkrat za deset glasov skoka prisotnosti v enem zboru."
17,"Jaz bi se zahvalil za to razpravo, èeprav je glasovanje in bi lahko le razlagali svoj glas."
88,"Glede na to, da so bili sklepi regularno predlagani in da bomo o njih vsekakor morali glasovati, ne glede na to, kaj si kdo o njih misli, bi vseeno sicer še enkrat predlagatelje vprašal, èe res vztrajajo glede na to, da sami ugotavljajo, da niso veè tako aktualni, bi pa hkrati tudi opozoril na to, da po mojem mnenju 3. toèka ne more biti navaden skupšèinski sklep, tudi èe bi se zanjo odloèili danes ali kdajkoli že, ker je to sigurno odloèitev, ki mora imeti nivo ustavne odloèitve."
7,Še enkrat Zbor združenega dela: 43 prisotnih.
29,"To bi bilo možno tehnièno prepreèiti, jaz sem zaèel to pripombo dajati pred enim letom in jo bom sedaj še enkrat ponovil, èeprav ne verjamem, da bo naprej upoštevana."
6,"Kaj je to zdaj, prekmalu pritisnete."
21,"Prihranite se za medije, kdor se paè hoèe, in to obrazložite, samo prosim, tu smo glasovali in tak je paè rezultat."
39,"Prvi sklep se pa namreè glasi, 1. toèka prvega sklepa, ki smo jo izglasovali je: Nihèe brez soglasja slovenske skupšèine ne sme prevzeti nikakršnih obveznosti in podpisati nikakršnega dokumenta, ki bi lahko imel kakršnekoli državnopravne posledice za Republiko Slovenijo."
33,"To kar se predlaga, ne vem, tile liberalci ali kaj so že, in sem proti temu in prosim, dajmo se obnašati racionalno in sodelovati v organih federacije, kjer moramo reševati naše skupne interese."
15,"V bodoèem pravilniku bomo verjetno tudi uredili, ker vzdržani glasovi so pravzaprav glasovi proti vedno."
16,"Gospod Potrè meni, da nismo ugotovili prisotnost, najprej bi morali glasovati o tem, ali glasovanje obnovimo."
9,Zbor obèin: 49 prisotnih; Zbor združenega dela: 34 prisotnih.
26,"Gre pa za resne predloge in zaradi tega je najmanj to, kar bi bilo vredno storiti, da bi Zakonodajno-pravna komisija to obravnavala z vidika svoje pristojnosti."
23,"Pojasnil bi samo toliko, da je ta predlog prišel že 24.4. in to je tudi edini, ki ga še danes predlagamo v glasovanje."
54,"Hkrati pa želim povedati, da ostro protestiram proti temu, da spet zaèenjamo debato o goloti in bososti slovenskega naroda, kar smo vèeraj dvakrat zaèeli in pa seveda o konkretni dilemi bomo podobni lahko, èe bomo obdržali še dolgo poslance zvezne skupšèine v Beogradu tistemu mežnarju, ki je za vsak primer prižgal sveèko tudi hudièu."
22,"Med tem je prišlo do spremembe predloga predlagatelja, in sicer, da se ta dva odstavka prvega sklepa odstopita v obravnavanje Zakonodajno-pravni komisiji."
28,"Po mojem mnenju, pa ni reèeno, da imam prav, sta prva in tretja toèka ustavna materija in zaradi tega skupšèina ne more z navadnim sklepom izloèiti ustavnih doloèil."
50,"V tej zvezi bi rada spomnila, da smo tako na hitro že sprejeli sklep v tej skupšèini, tudi na predlog liberalne stranke, da je skupšèina vpeljala oziroma naložila uvedbo kazenskega pregona zoper Miloševiæa in druge, in sprašujem, kakšna je usoda takratnega našega skupšèinskega sklepa, kaj se je z njim zgodilo."
37,"Zaèeli smo s tem, da smo prešli na glasovanje, sprejeli prvi odstavek, zaèeli z obrazlaganjem glasov, tudi za nazaj, tisti, ki so bili že oddani, prišli do proceduralnih vprašanj in nenadoma odprli celotno razpravo z replikami vred."
48,"Tehnièno je zelo enostavno prepreèiti, da bi en poslanec glasoval, da je prisoten v drugem zboru in sicer na ta naèin, da se pod znakom plus glasuje za Družbenopolitièni zbor, pod znakom minus glasuje za Zbor obèin in pod znakom vzdržani glasuje za prisotnost pri Zboru združenega dela."
76,"Skupšèina Republike Slovenije naroèa javnemu tožilcu Republike Slovenije, da do 15. maja - roki so malo kratki, èe se ne motim - pripravi informacijo o t.i. seznamu slovenskih vojnih hudodelcev, in sicer skupaj s poroèilom, zakaj zoper ljudi s tega seznama ni bil uveden kazenski postopek in zahtevana morebitna ekstradicija oziroma, èe je bilo to storjeno, kako, kdaj in zoper koga in kateri uradni organ Republike Slovenije je to storil, ali je dopustil dolžnost, da to stori."
