8,"Mislim, da ga je okoli 1,5% celotnih sredstev."
21,"In takrat smo opozorili, da je zdravstvo sistem, ki rabi stabilno financiranje in ki mu je mogoèe vzeti 5%, da preživi."
22,"Opravièujem se, ker sem zamudila zaèetek; nisem raèunala, da boste glede na odlok odloèanja o zakonu obravnavali tudi ta odlok že danes."
2,Še kdo?
13,"In vam moram reèi: dajmo razmišljati vsebinsko in racionalno, ne zgolj v številkah."
33,"V nasprotnem primeru, tako kot sem dejal, ali pa obstaja še tretja varianta, da obveznosti delovnih organizacij, podjetij glede izostanka z dela in podobnih stvari, ostanejo pri njih, ker drugaèe to no možno."
59,"Mislim, da gre po obsegu, materialno, za zelo zahtevno materijo, vendar problemov je toliko odprtih, da je nujno da se ti razrešijo in da zbor sprejme ta predlog v obravnavo in da morebitne pripombe ali amandmaji, ki bodo dani, ali pa potrebe po spremembah, lahko potem v sami razpravi poveste in se besedilo zakona v tem smislu tudi dopolni."
4,Se je kdo vzdržal?
20,"Se pravi: èe se danes tudi za to ne dogovorimo, potem je pa potrebno v integralnem proraèunu tisti del dvigniti."
29,"Zaradi tega, ker Klinièni center enostavno ni v stanju plaèevati teh sredstev, sredstev za servisiranje (konkretno) Siemensovega aparata in zaradi tega popravilo ne steèe tako, kot bi bilo potrebno."
24,"Opozarjam, da na prenekateri toèki že v tem momentu nismo veè v stanju nuditi vam oz. sami sebi najosnovnejših posegov oziroma intervencij v medicini."
25,"Ko smo sprejemali teze za pripravo zakonodaje, smo rekli, da bomo iz republiškega proraèuna - in to integralnega proraèuna - financirali približno 15% celotnega programa zdravstvenega varstva."
36,"Mreža javnih zavodov in podobne stvari moram reèi, da bo v racionalizaciji, ki je že sedaj v pripravi, prinesla minimalno spremembo in s tem tudi minimalno spremembo v prihranku kar se tièe racionalizacije, razen doloèenih sredin."
10,"Oba predsednika vljudno vabita èlane, da se udeležijo teh sej."
1,Hvala.
3,Hvala za danes.
26,"In zato vas opozarjam, da bo prišlo do enake kritiène situacije tudi v naslednjem letu, èe sedaj ne bomo pretehtali stvari in podprli te prve variante."
18,"In drugiè: jutri bomo potem v tej dvorani ""telovadili"", ker imamo ogromno amandmajev za sprejeti oziroma za zavrniti."
7,Sedaj smo pravzaprav postavljeni pred podoben problem.
6,Zakljuèek pa bo sedaj opravil predsednik.
14,"In zato je nujno potrebno, da smo tu prisotni vsi od zaèetka do kraja."
19,"Predpogoj je, da imamo milijardo dolarjev ali mark deviznih rezerv, èe hoèemo kakršnokoli monetarno politiko ali antiinflacijski program voditi."
5,Kdo je za prvo varianto?
55,"V sluèaju, ko pride do zmanjšanja hranilnih vlog, in v bankah so se delali obraèuni za vsak mesec posebej, v sluèaju ko pride do zmanjšanja hranilnih vlog, se je Narodna banka Jugoslavije zavezala, da bo vrnila v višini zmanjšanja neto hranilnih vlog te depozite bankam tako, da bodo banke lahko normalno izplaèale prihranke svojim varèevalcem."
9,In sicer se moramo odloèiti za eno od variant.
23,"Varianta, ki je napisana v desni koloni, je izraèunana za nazaj iz obstojeèih stopenj in je nepokrita za ukrepi, ki bi zagotavljali preživetje."
28,"Ministrstvo je šlo za razpravljanje oz. na sklepanje o tem z eno variantno, ki nekako pomeni prenos obsega, kakršen je sedaj, zmanjšanega za 5 odstotkov, v prihodnje leto."
27,"Prviè, da res pridete ob 10. uri na skupno zasedanje, tako kot se za naš zbor spodobi, glede na to, kar smo se tudi dogovorili v zboru."
17,"Povedal bom še to, da je meni zelo neljubo, ko je Odbor za zdravstvo te stvari obravnaval."
12,S tem želim lahko noè in jutri ob 10. uri na svidenje.
15,"Ne bi želel niti primerjave, ampak to je minimum, da se lahko spelje ta stvar."
11,"In sedaj glasujemo še o odloku v celoti, s prvo varianto."
86,"Ker èe ne bi imeli zadaj državljanov, varèevalcev, posebno pa ne kritiène toèke, ko mnogi želijo te svoje prihranke uporabiti za nakup stanovanj po zakonu, ki smo ga že sprejeli in ta prodaja že teèe, potem bi jaz rekel, ko bomo razpravljali o prevzemu zunanjih dolgov federacije in o premoženju, dobroimetju in dolgovih federacije, razpravljajmo tudi o tem delu dolga federacije, ki se imenuje javni dolg, ki je nastal z deponiranimi devizami obèanov se v bistvu sploh ne bi mudilo, da se mora to zdaj sprejeti."
61,"V primeru, da te variante ne sprejmemo v odloku, moram reèi, da se bomo kljub relativno kvalitetno sprejeti zdravstveni zakonodaji, sreèali z doloèenimi težavami pri izvajanju zakonodaje, ampak to z odgovornostjo parlamenta, s tem, da vrednost programa po drugi varianti pomeni 25% zmanjšanje sredstev, kar bi zdravstvo ponovno privedlo do zloma, ampak to ne v organizacijskem smislu, v izvedbi samega programa."
57,"Ker se seveda zdaj odloèate o tem, bi zboru predlagal, da na osnovi te obrazložitve, ki sem jo dal - èe bo pa še kakšno vprašanje, pa lahko še podrobneje gremo skozi - da sprejme sklep, da iz obravnave umakne prvotni predlog Izvršnega sveta na ta zakon, ampak da v postopku obravnava ta predlog, ki ste ga dobili vèeraj."
44,"Po 8. oktobru, ko je nastopila mejna toèka naše državnosti, sem bil nemilo preseneèen nad predlogom, ki je prišel v naše delegatske klopi, kako naj obremenimo tiste, ki so zaupali bankam in vladi, ki je izjavljala, kako so naložbe oziroma depoziti v banko varni."
41,"To je ena zadeva, ki jaz moram reèi, da vsebinsko ne štima in èe ne drugega, bi prosil, preden bi odloèali o tem, da se to uskladi in dogovori in se tudi predstavnikom Odbora za proraèun in javne finance to pojasni."
60,"V tem èasu so se gibanja glede razmerij med teèajem in obrestno mero in glede gibanja cen na podroèju stanovanjskega zakona toliko spremenila, da imamo v Sloveniji veèji devizni priliv, kot smo lahko prièakovali in zato smo lahko v tem novem predlogu zakona ponudili varèevalcem nekaj veè sredstev takoj, ne pa toliko, kot je bilo v prvotnem predlogu zakona napisano."
56,"To pomeni, da morebitni vstop v lastništvo banke bo po izvršeni sanaciji bank oziroma v skladu s programom sanacije bank, ker bi v kolikor bi za ta vstop države, ko prevzamete terjatve lastništva bank v postopku sanacije banke država izgubila to ustanovitveno vlogo, ker se v postopku sanacije bank ustanovitveni kapital uporablja za pokrivanje slabih terjatev."
54,"Zato se je Odbor za proraèun in finance opredelil za to drugo varianto in po podatkih, ki so nam bili dosegljivi, tudi druga varianta pomeni poveèani delež družbenega proizvoda, ki se namenja za zdravstvo - od ocenjenega za letos 5,8% na drugo leto, variante dve, 6,7%, brez stroškov za nadomestila, ki so še posebej prikazana."
50,"Glejte, ponovno, ne bi rad, ker iskreno rešpektiram in spoštujem kolega Grašièa, ampak jaz vam moram takole reèi: raèunica in pa cifre so eno, in èe recimo lahko zdravje, kot najveèjo vrednoto ovrednotimo s ciframi, potem moram reèi, da sem ""za"" s pogojem oziroma pogoji, ki so bili preje posredovani."
32,"Vsakih 500 mark predstavlja za Slovenijo okoli 80, nimamo še podatkov A banke, zato jemljite z rezervo, jutri zjutraj bomo imeli te podatke, predstavlja vsakih 500 mark okoli 80 milijonov mark izplaèila."
46,"Kajti moram reèi, da se mi zdi, da se ponavljajo stvari iz npr. razprave o proraèunu v mesecu aprilu; v bistvu smo na koncu, decembra prišli enako sem in takrat celo ni bil upoštevan predlog, ki sem ga jaz podal - razbremenitev gospodarstva, vrniti tisti denar nazaj."
45,"Ugotavljam, da smo predlog usklajevalne skupine sprejeli, takšen, kot je predlagan in s tem umikamo z dnevnega reda toèko 12., razširjamo toèko 16. s podtoèko b. in razširjamo dnevni red z novo toèko, to je izjava v zvezi z napadi na poslance Skupšèine Republike Slovenije."
47,"Zato smo zadolženi, da informiramo javnost, da v kolikor se opredeli parlament za drugo varianto, pogojujemo drugo varianto s soèasnim sprejetjem ukrepov, to pa pomeni: doloèene stvari, ki so tudi v novi zakonodaji kot predlog programa, avtomatsko vsaj za doloèen èas izkljuèiti iz realizacije za leto 1992."
30,"In sedaj se pa zamislimo: procent družbenega proizvoda - okrog 9, z (recimo) absolutno nominalno vrednostjo, ta je pa še bolj pomembna - 250 mark, in si predstavljajte opravljanje vseh teh del."
43,"Danes sem že govoril pri 2. toèki, kako moramo banke kot eden nosilnih stebrov nadaljnjega razvoja usposobiti in vkljuèiti v razvoj nadaljnjega slovenskega gospodarstva in zato mi ni všeè nekakšno izžarevanje veselja nekaterih, èeš bodo tudi banke videle, kaj se jim bo zgodilo."
51,"Piše namreè: Spremembo sistema oziroma s sprejemom zakona o zdravstvenem zavarovanju bo Zavod za zdravstveno zavarovanje v bodoèe moral zagotavljati upravièencu tudi pravice do nadomestil za zadržanost z dela nad 30 dni - boleznina, nega, izolacija, spremstvo, pogrebnine, posmrtnine, potne stroške, kot tudi plaèevanje stroškov zdravljenja poškodb na delu in poklicnih bolezni."
93,"V trenutku, ko se je v Mariboru pojavil prvi servis, ki mu je moj predgovornik rekel, da razbija monopol, je vrednost študentske delovne ure padla za 50% in to zato, ker množica servisev praviloma popušèa zahtevam delodajalca po znižanju vrednosti študentske ure in zaradi te konkurence, ker provizije so tukaj zelo majhne in se toliko ne pozna, èe kloni servis zahtevam delodajalca, je ob tem povpraševanju po delih in tako mali ponudbi seveda nastradal študent, ki se mu je to poznalo tako, da je za isti obseg dela dobil kar pol manj denarja."
16,Tako bi lahko jutri veliko dela opravili in bi potem v petek imeli bolj drobno delo.
53,"Situacija je enaka: moram reèi, da jaz razumem na eni strani gospodarstvenike, ki se zavzemajo za to krèenje - torej, èe se bomo odloèali v tej smeri, moram pa biti toliko pošten, da reèem, da v marsikateri toèki že danes nismo v stanju zagotavljati tiste osnovne pravice, ki vsem Slovencem gredo iz naslova zavarovanja."
39,"Naslednja zadeva, glejte zelo zelo umetelno je napisano, težko pa izvedljivo v letu 1992, ko piše, da je èimprej treba pripraviti mehanizme za opravljanje zasebnih zdravstvenih storitev z možnostjo, da zasebnik - zdravnik zaène opravljati zdravstvene storitve na raèun zavarovalništva."
72,"In nekatere zadeve so že na tak naèin v okviru strank tudi razèišèene in tu lahko tudi mi veliko na èasu pridobimo, èe vi veste toèno, da bo nekdo imel daljšo razpravo o doloèenem amandmaju npr. v Družbenopolitiènem zboru, jaz ne vem ali je umestno še tudi v našem zboru enako dolgo potem o isti zadevi govoriti, èe vemo, da bo tako in tako potem še prišlo do sprejemanja oz. do usklajevanja."
52,"Pa so prav in tudi nekateri posamezniki iz naše stranke delovali po svoje in mimo tega in navsezadnje tudi, kot pravi nedavno izdani èlanek v 43. številki Nove dobe, celo dajali okrilje in dopušèali podporo povsem nelegalnemu in mimo zakona delujoèemu Velenjskemu mladinskemu servisu, pa tudi mariborski Formi in Murskosoboškemu mladinskemu servisu."
31,Odbor za varstvo potrošnikov ima jutri svojo sejo ob 8.30 uri v sobi 110; medtem ko ima Odbor za proraèun in javne finance sejo tudi ob 8.30 uri v sobi 212.
35,"Spoštovani, jaz sem tudi èlan Odbora za proraèun in finance in sem se oglasil zato, ker bi rad povedal, da se tudi moèno strinjam s predlogom, ki ga nam posreduje ta odbor, iz preprostega razloga."
40,"Namreè ne držijo stvari in ne stojijo, ker poglejte, ta Odbor za proraèun in javne finance, ki seveda jasno in razumljivo gleda številke, piše, poglejte, da recimo ta ni sprejemljiva, ker paè moramo gledati integralno na obravnavo proraèuna Republike Slovenije."
37,"In vedno smo govorili o tem, da to obremenjuje gospodarstvo približno 1,8 in 2,5 in Ministrstvo za zdravstvo in finance so nam kar naprej pripovedovali, kako se vse to šteje v t.i. tisti procent družbenega proizvoda."
34,"Jaz verjamem, da bi bil po drugi strani potreben resen pristop k racionalizaciji, vendar se moramo tega - kot je to že pred menoj rekla dr. Kebrova - lotiti resnièno sistematièno in postopno, ne pa naenkrat."
48,"Preprièan sem, da imamo Slovenci dovolj deviz, ali v nogavicah ali zunaj, da èe zastavimo, pa smo priznani ali ne, upajmo da bomo priznani, da bi relativno hitro dobili dovolj deviznih rezerv, kar je predpogoj, da zaènemo voditi kakršnokoli samostojno monetarno politiko, ki je do sedaj nismo mogli."
73,"Zaradi tega, da tudi javno povem, kar sem tudi predsedniku Peterletu povedal, ker so se dokaj glasno razširili glasovi, ko bo na skupni seji, bo tako, kot bo treba, to kot bo potreba, pa je zelo blizu vladnega zakona, za katerega pa mislim, moje osebno mnenje, ki pa je precej razširjeno, da nima urejenih vseh komponent, o katerih sem prej govoril in še o nekaterih drugih, ki se jih ta trenutek ne spomnim."
81,"Predlagatelj je to dilemo razrešil tako, da je v bistvu v vseh tistih primerih, ko je v osnutku, poleg osnovne rešitve, bila predložena tudi varianta, o kateri se ni definitivno opredelilo, v zakonu obdržal le osnovno rešitev, in to gre v primerih za variante v zvezi z uvedbo pravice do delne pokojnine, dodatka za rekreacijo upokojencev, to so pravice, ki so bile v varianti možne pravice, ki bi se èrtale, v osnovnem tekstu so bile in so tudi v predlogu ostale."
42,"Predlog odloka o stopnjah prispevkov za obvezno zdravstveno zavarovanje je obravnaval tudi skupšèinski Odbor za zdravstvo in bi poleg tega, da je sklep, da odbor predlaga zborom, da sprejmejo prvo varianto predloga odloka o stopnjah prispevkov za obvezno zavarovanje in zdravstveno zavarovanje."
80,"Razmere, kakršne so, seveda situacija, kakršna je v krogu tistih, ki odvajajo te prispevke, seveda narekujejo ali pa predstava, kakšna je bila, je opredeljevala tak odnos do tega, ne samo za to vrsto namenov, ampak za kompletno javno porabo je bila opredelitev Odbora za proraèun in finance, da ni mogoèe v letu 1992 za vse namene javne porabe nameniti veèji delež družbenega proizvoda kot bo to v letošnjem letu, razen èe je eno tako poveèanje, ki izhaja iz dodatnih zadolžitev."
66,"Družbenopolitièni zbor je sprejel na svoj dnevni red še nekaj izhodišè za kulturni razvoj Slovenije, ki ga je pripravilo Ministrstvo za kulturo in zato predlagajo tudi Zboru obèin in nam, da razširimo to toèko tako, da bi bila nekako 16.b toèka v bistvu izhodišèe Ministrstva za kulturo, dali bi pa èas še komisiji oz. Odboru za kulturo, da tudi pripravi svoje stališèe do tega gradiva."
91,"In èe te stvari štejemo, je bilo že sedaj prišteto, da je približno 9% družbenega proizvoda minimum, da se lahko nameni za zdravstvo, še posebej ob dejstvu, da je družbeni proizvod zelo nizek in da recimo pride, èe še drži ta podatek ne vem, na glavo prebivalca na leto okoli 250 do 260 mark za program, ki bo nekoliko skrèen od tega, ki ga imajo v drugih deželah, kjer pa je družbeni proizvod, ali pa kakorkoli bi rekel, tudi 9, 10%,samo je pa za to namenjeno od 800 mark navzgor."
71,"Ko bodo amandmaji na glasovanju, se bom seveda še oglasila in vas prosila, da res prisluhnete, ker mislim, da so res vredni pozornosti, zlasti tudi nekateri, ki se nas tièejo prav danes, recimo odpadki oziroma proizvodi, ki so izdelani iz recikliranih surovin, naj bi se manj obdavèili, potem proizvodi, ki nosijo ime okolju prijaznejši proizvod, to naj bi bila neka novost na našem tržišèu, potem igraèe, ki nosijo oznako dobra igraèa."
69,"Torej odbor meni, seveda tudi zdravniki smo tega mnenja v veliki veèini, da je glede na slabšanje socialnega položaja velikega dela prebivalstva vprašljivo, ali bo prostovoljno zavarovanje lahko doseglo uèinke, ki jih nekako predvideva predlagatelj zakona in ravno iz tega razloga mislim, da ima tak osnutek oz. tak predlog, alternativni predlog, ki je pred vami, sorazmerno veèjo težo, kot pa èleni v predlogu, ki je v tem uradnem tekstu."
38,"Rada bi vas opozorila, da se ponavlja situacija, ki smo jože imeli spomladi, ko smo odloèali o dajatvah za zdravstvo in ko smo odloèili - in ta zbor je bil tukaj zelo glasen - da se zdravstvu vzame 25% denarja."
67,"Prav tako smo pa tudi v prehodnih doloèbah v skladu z dogovorom v tej delovni skupini vnesli tudi doloèilo, po katerem morajo banke sporoèati Skupšèini do 30.6.1992, kako so uredile razmerja z varèevalci in kako izpolnjujejo te obveznosti do varèevalcev in da v primeru, da banke ne bodo izpolnjevale teh obveznosti, potem se uvedejo proti takim bankam ukrepi v skladu z Zakonom o predsanaciji, sanaciji in steèaju."
74,"Obrazložitev: zakonsko doloèilo o valorizaciji povpreènih starostnih pokojnin je republiška skupšèina sprejela marca tega leta, ko je Skupnost pokojninskega in invalidskega zavarovanja zašla v finanène zlasti likvidnostne težave in to zaradi nerednega plaèevanja prispevkov, zaradi nerednega plaèevanja federacije, zaradi obveznosti iz tako imenovanega Grašièevega zakona, ki nalaga SPIZ-u, da vrne podjetjem preveè plaèane akontacije prispevkov, zaradi vedno manjše možnosti, da sprejme SPIZ zadostne kredite od Ljubljanske banke ali iz proraèuna za redno izplaèevanje pokojnin."
84,"Prviè: že po obstojeèi zakonodaji tako, da èe bi bila volja takšna in bi se podelila koncesija tako, kot tam notri piše, nobeden študent ne bi potreboval hoditi iz Nove Gorice v Ljubljano se zaposlovat, ampak bi bilo to povsem možno delati tudi v servisu v Novi Gorici, s tem, da bi ta servis spadal seveda pod zakonodajo obeh študentskih organizacij, ki sta po tem doloèilu tudi edini, ki lahko izvajata plaèila za opravljeno delo in s tem tudi namenjata sredstva za obštudijske dejavnosti."
63,"Bilo bi nelogièno in jaz se strinjam s tistimi davkoplaèevalci, to ste vi in jaz, da nismo dolžni v celoti, ali pa to premoženje odplaèati, ampak da se najprej sredstva, ki so bila dosežena s prodajo tega družbenega kapitala, uporabijo za odplaèevanje obveznosti do domaèih upnikov, to pomeni deviznih varèevalcev in šele kasneje, èe to ni dovolj, uporabijo sredstva od davkov iz proraèuna."
62,"In èe prištejete, èe ste pregledali vsebino odloka o stopnjah, tu pride za vse pravice, pravice do zdravstvenih storitev, povraèila potnih stroškov, pogrebnine, posmrtnine, potem zdravstvene storitve, povraèilo potnih stroškov za kmete in tako naprej, skratka vse, nadomestilo in pa recimo povraèilo, recimo stvari, ki - to se pravi izostanka z dela zaradi bolezenske odsotnosti in druge stvari, ki so v zakonu navedene."
68,"Po mnenju komisije gre to izgovoru v korist državnega fiskusa, namreè nastanek in vpeljava iger na sreèo v zgodovini èloveštva ni nikoli izhajala iz fiskalnih potreb države, ampak iz špekulativnega pristopa paè do zbiranja denarja za vse mogoèe èloveške potrebe, pri èemer je seveda zelo izpostavljen element, bom rekla, zabave, da pa pri tem obraèanje posameznih finanènih sredstev želi participirati tudi državni fiskus, nam je tudi povsem razumljivo."
70,"Odbor za zdravstvo Republike Slovenije se je sestal na temo obravnave predlogov zakonov s podroèja zdravstva v èetrtek in vèeraj, s tem, da je recimo skušal obravnavati in postaviti stališèa do vseh tistih amandmajev in pripomb in vseh ostalih stvari, ki so bile posredovane najprej do èetrtka, do nekaterih pa tudi, ki so bile posredovane vèeraj, tako da opredelitve do danes in pa še do posredovanih amandmajev ni možno podati."
125,"Mislim, da tudi ne gre, da bi poroèilo Odbora za zdravstvo kot matiènega odbora k predlogu zakona o zdravstveni dejavnosti brali, ker ste ga verjetno vsi tudi prejeli na klop, sicer danes, s tem, da mislim, da je potem težko slediti doloèenim stvarem, povedal bi pa rad glede na to, da dve, tri stvari, ki se mi zdijo pomembne kot postulat za obravnavo celotne zdravstvene zakonodaje in pa seveda tiste toèke, ki zagotavljajo doloèene spremembe v izvajanju zdravstvene dejavnosti in seveda ne samo nekaj novega oz. drugaènega, ampak v perspektivi bi rekel perspektivnejšega, do doloèene mere bolj organiziranega, jasno s tistim, kar smo že pri obravnavi osnutka povedali: par ciljev, drugaèna organizacija zavodov, potem opredelitev primarne, sekundarne in tercialne službe v tem zakonu o dejavnosti."
49,"To pomeni, da tudi po prvi varianti prispevna stopnja ni bistveno razlièna kot je v letošnjem letu in kljub temu terja od nas za 5% znižani program, medtem, ko o drugi varianti niti ne upam razmišljati, ker je primarij Arzenšek jasno povedal, da to pomeni 27% skrèenje obstojeèih programov."
77,"Kolega Primož Rode je že posebej opozoril na pozornost 23. do 26. èlena, ki so v besedilu predloga, katerega ste prejeli, jaz sem pa dolžan opozoriti na to, da je to ena bistvena novost, ki sploh ni bila prisotna niti v fazi nobenih od teh verzij in niti v fazi predloga s tezami in niti v osnutku itd., predstavlja pa, po mnenju veèine èlanov odbora, bistveno spremembo v organizaciji zdravstvenega zavarovanja kot osnovo za izvajanje zdravstvenega varstva."
65,"Takrat so iz razlogov, ki jih ne bi tu šel analizirati, zanimivo je to, da so zaèele najprej rapidno padati v Sloveniji, in sicer so zaèele padati po tistem dogodku, ki se je zgodil tu v bližini, po tem, ko je armada zasedla štab civilne zašèite, v tistem momentu je nastala panika, nastal je strah pred vojaško intervencijo in ljudje so želeli svoje prihranke dvigniti."
94,"Poglejte, ob dejstvu, da je 90% vseh razlogov za sprejem v dom starostnikov, ki so bolni, ki gredo v dom, potem druga taka zadeva bi bila,da je v Sloveniji preko l2.000 ljudi v domovih za stare, da je od tega 6l% starih nad 70 let, 35% nad 80 let in da je zaradi tega zdravstvenega stanja veè kot 60% nekaj veè, ki imajo težave s pomiènostjo, da je 35% nepomiènih v domovih, 25% jih vsako leto umre v domovih za stare, 42% prvih vselitev pa je bilo lani neposredno iz bolnišnic."
97,"To sem dolžan tudi povedati s tem, da mislim, da bi morali iti, kljub rešpektiranju Zakonodajno-pravne komisije, z ozirom na to, da se sedaj pogovarjamo o usklajevanju dnevnega reda, da je praktièno kljub temu bilo stališèe Zbora združenega dela, tako kot je že omenil gospod predsednik zbora, da praktièno vztrajamo pri predlogu zakona o lekarniški dejavnosti, ker mi smo mnenja, da naj se zdravstvena zakonodaja sprejema v paketu, lekarna je pa del tega in da se recimo pomisleki, ki jih je dala Zakonodajno-pravna komisija, ki jih seveda rešpektiramo, praktièno dajo v proceduro do sprejema tega zakona, odpraviti."
83,"Jaz se prej niti nisem hotel oglasiti, ker baje, da mi bodo dostavili, in to sem še hotel prositi predsednika, so mi napisali listek, da zahtevajo, da so šele sedaj zvedeli, da je Odbor za zdravstvo sprejel eno dopolnitev tega 35. èlena, pa sedaj zahtevajo, da naj bi ta dopolnitev bila širša, to se pravi, da zdravnik iznad 50 let, pa zaslužni in ne vem kaj, pa primarij in ne vem kdo še, tako kot je bilo baje v neki 13 verziji zakona."
187,"Vloženih je tudi že precej amandmajev, in sicer vlaga odbora za proraèun in javne finance k 4. odstavku 38. èlena, k 4l., 42. in 43.èlenu, doda naj se nov 88. a èlen in k tarifni številki 3. Odbor za pravosodje in upravo k 2l. èlenu, Odbor za raziskovalno dejavnost in tehnologijo k l8. èlenu, Odbor za varstvo potrošnikov prav tako k l8. èlenu, kar tri amandmaje, k 46. èlenu in pa k tarifni številki 3. Komisija za informiranje k l8. èlenu in pa k tarifni številki 3, Vlasta Sagadin, Zeleni Slovenije k l5.,l6.,l8. èlenu, dva amandmaja, k tarifni številki l, 2, dva amandmaja, k tarifni številki 2 in 3 tri amandmaje, k tarifni številki 3 osem amandmajev, k tarifni številki 4 dva, k tarifni številki 5 in k tarifni številki 6. Zraven tega imamo potem še amandma Rudija Mogeta k tarifni številki 2. Potem je amandma Marjana Starca in pa Maria Domia k 24. èlenu, potem poslanci Marija Lonèar, Franc Ban in pa Muharem Boliè k tarifni številki 5 zakona; Bizjak Davorin k 24.èlenu predlaga,da se doda nova 11. toèka."
131,"Jaz bi pa vprašal, èe mi dovolite, Jaša L. Zlobec je bolan in je meni dal en amandma, ki naj bi ga zagovarjal z vso silo in naj bi vas preprièal v sprejem tega amandmaja, in sicer gre za amandma na l8. èlen, namreè, da se dodata novi toèki, ki se glasita, to se pravi toèka 20: ""od nosilcev besede, slike in zvoka, ki so znanstvenega, umetniškega, kulturnega, izobraževalnega in informativnega znaèaja, mnenje o tem, da gre za proizvode iz te toèke, daje pristojni republiški upravni organ v soglasju z republiškim upravnim organom za finance, preden da založnik oziroma uvoznik proizvoda iz te toèke v promet, mora na njih natisniti klavzulo, da gre za proizvode, od katerih se ne plaèuje davek od prometa proizvodov ter številko in datum mnenja pristojnega organa""."
92,"To se pravi namensko uporabljena, ne pa samo eden od virov za zbiranje integralnega proraèuna, ker moram reèi, ko pogledam cel paket teh treh zakonodaj naprej, to je kar ena formalna pripomba vodi k temu ob dejstvu, da pa do danes še nimamo poroèila, pa smo tule zahtevali, da naj opravi vlada, konkretno ustrezni resor, da pobere tiste prometne davke, ki jih še ni pobral, pa so že v zakonodaji in šele potem pristopimo k zviševanju in spreminjanju ostalih stvari in moram reèi, da teh stvari nimamo poroèila in tu niso upoštevana."
87,"Jaz ne vem, kdo je pripravil obrazložitev k tem variantam, namreè pri prvi varianti je navedeno, da je prispevna stopnja višja, ker smo paè po zbirni prispevni stopnji v letošnjem letu zbirali 13,20%, po novem bi pa 14,50%, pri tem pa pozabljamo, da smo imeli tudi obèinsko prispevno stopnjo, ki je bila 0,66% in v kolikor so v obèinah zbirali 0,66%, je bila torej skupna prispevna stopnja 14,52%, medtem, ko po novem bi bila 14,50%, se pravi, da bi po prvi varianti bila skupna prispevna stopnja nižja."
