8,Zakon je sprejet brez amandmaja z veèino glasov.
19,"Prej, ko sem povedal obrazložitev, sem pa povedal samo, zakaj je prišlo gradivo po hitrem postopku kar na mizo."
7,S tem smo sedaj dnevni red izèrpali.
15,"Sprašujem vas, kdor je za to, da predlog obravnavamo po hitrem postopku, naj prosim glasuje."
29,"Samo èe bi lahko celovito besedilo tistega 1. èlena, upoštevaje ta amandma, ki so ga delovna telesa predložila, da bi ga prebrali, ker mi nimamo tega zakona s seboj."
28,"Drugiè pa, glede na to, da pri tem amandmaju ni strokovne ocene o pozitivnih in negativnih uèinkih dosedanjega tega amandmaja v praksi, paè ne morem glasovati za amandma."
16,"Oprostite, prosim, ja saj zdaj imamo postopek, saj potem bomo pa razpravljali še o samem zakonu."
34,"V imenu študentov zato zahtevam, da naj se ta vrnejo v normalne in racionalne okvire in pri tem upošteva vrhunec izpitnega obdobja tako, da se študentov v tem èasu v enote TO ne klièe."
4,Se je kdo vzdržal?
40,"Izhodišèe za takšno odloèitev je bilo verjetno v predpostavki, da bo slovenski devizni trg normalno deloval zaradi uradnega priznanja tako imenovane ""šticunge"" prek prodaje EDP na jugoslovanski borzi vrednostnih papirjev v Ljubljani in vezave EDP na dejanski deviz ni priliv."
23,"Njegova ideja je bila predvsem ta, temeljil je, zastava je znana iz 1. oktobra 1948, ko je bilo to veliko slavje v Ljubljani."
6,Še želi kdo svoj glas obrazložiti?
39,"Zato prosim vse poslance, da temu prisluhnete in da podprete, da se ta zakon podaljša, mislim ta moratorij nekako podaljša, da potem vlada, ki bo enkrat pripravljala denacionalizacijo in privatizacijo, da to zadevo tudi na kmeèkem podroèju ustrezno rešimo."
44,"Kot se spomnite, lansko leto, ko smo to dali skozi na pritisk Kmeèke zveze, je stvar uspela, potem pa, èez nekaj èasa se je pa v življenju pokazalo, da je bila tu narejena napaka in èe se zopet dobro spomnim, je sama vlada priznala."
12,"Je kar v redu, zaradi tega, ker smo nekatere stvari tudi razèistili."
1,Hvala.
11,"Drug zbor bo pa mogoèe kaj delal, vi ste pa pohvaljeni."
3,Je kdo proti?
14,"Sedaj sem še enkrat tekel, zato se opravièujem, ker nisem imel s sabo gradiva."
2,Hvala lepa.
10,"In sedaj bi razpravljali še o samem zakonu, èe želite."
24,Glasujemo o zakonu o spremembi zakona o zaèasni prepovedi seènje v gozdovih v družbeni lastnini in zaèasni prepovedi prometa z nepremièninami v družbeni lastnini.
5,Samo svoj glas bi obrazložil.
32,"Navidezno ta sistem borznega trženja EDP omogoèa podjetjem poravnavo svojih obveznosti do tujine, èe imajo dinarsko kritje, saj ne more biti izdanih oz. prodanih veè EDP kot je znašal dejanski devizni priliv."
13,"Kdor je za zakon, kot ga je predlagal Izvršni svet, naj prosim glasuje."
22,"Liberalizacija pogojev za opravljanje zunanje- trgovinskega poslovanja je omogoèila, da so se z zunanjetrgovinskimi posli prièela ukvarjati številna nova, predvsem zasebna podjetja."
38,"Ker do tega, kot sem že povedal, iz znanih razlogov še ni prišlo, torej v teh 10. morda 12. èlenih teh uskladitev še ni, je torej zastoj v predložitvi oziroma pripravi zakona o denacionalizaciji zaradi zakona o privatizaciji."
30,"Najkrajše povedano, tudi jaz sem za to, da se strokovno mnenje upošteva in glavni oblikovalec je bil gospod Pogaènik, ki je priznan kipar, slikar in on je dal to idejo."
69,"V zvezi s problematiko onesnaženosti zraka in sanacijskim programom za varstvo zraka, ki je izdelan v obèini Laško in temelji tudi na ugotovitvi, da se poveèuje stopnja onesnaženosti zraka na obmoèju obèine Laško v veliki meri kot posledica delovanja 360-metrskega dimnika termoelektrarne v Trbovljah, insistiramo v obèini Laško, da ustrezni republiški organi pristopijo k programu za sanacijo posledic delovanja dimnika in o tem seznanijo tudi vse prizadete v obèini."
17,"Tako apeliram, vas je bilo sedajle tukajle 60 in da ste tudi vsi ob 18.00 uri tukajle."
25,"V tem primeru, da ne bo amandma C sprejet v kakšnem zboru, potem imamo mi skupno delovno sejo in takrat je potrebno ponovno 2/3 veèina."
33,"Na ta naèin zavajamo javnost in sedaj so bili tisti podatki, ki so bili zadnjiè sicer zaupni, prišli na dan, da ima direktor % 65 plaèe, sekretar, ne vem kateri, pa 21 ali koliko."
27,"Dvomim, da je za vse ravno sekretariat kriv, ker ti zakoni, ki se sprejemajo, denacionalizacija, privatizacija itn. jih je cela vrsta, ni samo eden in ni tako."
65,"Za državno upravo in pa za funkcionarje vemo, da imamo svoj zakon, vemo da imamo na podroèju torej osebnih dohodkov v gospodarstvu, poleg kolektivnih pogodb, kjer so lahko, tudi interventno zakonodajo, da je gibanje osebnih dohodkov v družbenih dejavnostih vezano na gibanje v gospodarstvu, da vpliva nanje tudi interventna zakonodaja in da je seveda vse to skupaj treba sedaj pa še loèiti od naèina financiranja."
73,"Ker so pa med tem èasom prišla med sredstva družbenopolitiènih skupnosti tudi kmetijska zemljišèa in gozdovi oziroma zlasti kmetijska zemljišèa, s katerimi so upravljale kmetijsko-zemljiške skupnosti kot s kmetijsko-zemljiškim skladom, to je prišlo z ukinitvijo te kmetijsko-zemljiške skupnosti in sedaj s temi upravljajo dejansko obèine in mogoèe republika in federacija, da bi se to zavarovalo in da ne bi bilo nobenih dvoumnosti, so te tri komisije predlagale, da se še ta besedica èrta."
46,"Moteèe je to, da se je Republiški zavod za šolstvo obrnil na vse ravnatelje osnovnih šol s posebnim opozorilom, iz katerega praktièno izhaja tudi zahteva, da se povsod v vseh šolah dejansko forsira prodaja teh uèbenikov na naèin, kot je tu predstavljen skozi tega Modrega Janeza."
90,"Jaz bi predlagal, da bi v tej 3. toèki pri sklepih, tukaj je izpadla ena alinea, ki je na koncu v informaciji glede železniškega gospodarstva o zagotovitvi sredstev za tekoèe izgube in manjkajoèih sredstev za investicije po pogodbi z mednarodno banko in jaz bi predlagal, da bi tam dodali zdaj tretjo novo alineo, ki bi se glasila, da se zagotovi dodatna sredstva za pokritje izgub v letu 1991 ter dodatna sredstva za investicije v višini, ki bo zagotovila realizacijo plana investicij po pogodbi z Mednarodno banko za obnovo in razvoj."
9,"Ja tako daleè smo, jaz moram obrazložiti svoj glas."
55,"Lokacija pa je mislim nekje tudi nedoreèena sicer, ampak v tem sorazmerju piše v levem zgornjem kotu, kjer se meni, da je najboljše, ker je nekje najmanj izpostavljeno tem raznim, recimo ko visi, veter ali pa kaj takega, tako da tam bi bilo nekje najboljše to mesto, je pa velièina grba glede sorazmerja zastave doloèena."
42,"Izvršni svet, jaz sicer nimam podatkov o tem, ali se je s tem strinjal ali ne, ampak mislim, da ni nobenih ovir - kar smo ocenili skupaj z Republiškim sekretariatom za pravosodje in upravo - da ne bi Izvršni svet soglašal s takšnim amandmajem."
26,"Ne vem, kako bi sploh zaèel misel na to sramotno akcijo, ko pride noter predstavnik Izvršnega sveta in predstavi Marjana Podobnika kot pobudnika za to zadevo."
50,"Takšna ekonomska gibanja in ukrepi pa bodo resno ogrozili proces osamosvajanja Slovenije, zato predlagam, da Skupšèina Republike Slovenije imenuje parlamentarno skupino za prouèitev okolišèin, ki so pripeljala do zloma slovenskega deviznega trga ter možnosti poravnave izpada dobièka podjetjem, ki jih je tako ravnanje Ljubljanske banke in drugih bank poslovno prizadelo."
20,"In sedaj, to isto napako, ki smo jo lansko leto priznali, da smo napaèno naredili, jo sedaj še enkrat delamo."
21,"To so predvsem stanovanjske hiše, poslovni prostori, poslovne stavbe, stavbna zemljišèa in tudi kmetijska zemljišèa, ki so bila v upravljanju obèin."
94,"No zato je bila ta doloèba takrat ob sprejemu zakona o moratoriju uveljavljena in sedaj, mi smo paè raèunali takrat, ko se je ta zakon sprejemal, da bo ta zakon o denacionalizaciji sprejet nekako do srede tega leta in kot vidimo, iz razliènih razlogov, ki so vam verjetno vsem znani, prišlo je do spremembe koncepta v pripravi zakona o privatizaciji, na zakon o privatizaciji pa je navezan tudi zakon o denacionalizaciji, torej zaradi vseh teh razlogov zakona o denacionalizaciji še ni bilo mogoèe pripraviti in predložiti pred Izvršni svet oziroma pred Skupšèino v sprejemanje."
61,"Zato mislim, da bi se bilo treba sedaj lotiti tega, ali smo to, kar je bilo sedaj s to spremembo zakona predloženo, sposobni in pripravljeni sedaj takoj zakon menjati, da se nekaj v upravi le premakne, ne moremo pa dosegati in uresnièevati seveda tistega, kar je bilo zadnjiè sprejeto kot sprememba in pozneje tudi za doloèen èas odmaknjeno v smislu realizacije."
36,"Možno je pa celo, da bomo po skupni seji še imeli mi tudi sejo naprej, èe bo možno kaj uskladiti, zato da ne boste ne jutri in ne v petek hodili v Ljubljano, ampak boste prosti."
52,"Od najemnine, ki bi se oblikovala skladno s pogojem trga, torej ne ostane nièesar oz. bi lastniki imeli pravico samostojno doloèati najemnino za že zgrajeno stanovanje šele tedaj, èe bi si to pravico odkupili s tem, da bi sedanjim imetnikom stanovanjske pravice, uporabnikom torej, izplaèali 30 % vrednosti stanovanja in ga tako izpraznili."
63,"Na osnovi realizacije predhodno navedenega bi bili ustvarjeni bistveno drugaèni temelji za celovito urejanje obrtnih dejavnosti, kot jih poznamo sedaj, pri èemer bi lahko v mnogoèem povzeli tudi rešitve iz tujih zakonodaj, kot na primer, da se lahko obrtna ali druga dejavnost opravlja s statusom fiziène osebe, posameznih, ali tudi v drugi pravno organizacijski obliki, kot jih poznamo iz trgovinskih zakonov zahodnoevropskih držav."
66,"Potrditev predhodnega nam da že osnutke obrtnega zakona, ki kljub temu da v izredno majhni meri povzame nekatere rešitve iz tujih zakonodaj, pa iz teh ne povzema rešitve, da se lahko obrt opravlja tudi v raznih pravno-organizacijskih oblikah, temveè pozna le obrtnika kot posameznika, kar pa pomeni celo slabšo rešitev glede na sedaj veljavni obrtni zakon, ki pozna obrtnika kot posameznika in tudi institut skupne obratovalnice."
64,"Jaz bi predlagala, da se tega zakona lotimo, in da tudi se o tem poskušamo odloèiti, ker se mi zdi, da je to bistveno pomembno, ker nas, mislim da že 1. 7., èe se ne motim, zadane realizacija tiste spremembe, ki je bila sprejeta zadnjiè, za katero pa ugotavljamo seveda da enostavno v tem trenutku verjetno ne bo uresnièljiva in je vprašljiva tudi smotrnost."
58,"To zateèeno stanje v zemljiških knjigah bo povzroèilo torej katastrofo za vse, ki bodo pri pridobivanju lastništva najemali kredite, hipoteke ali si na kak drug naèin skušali pridobiti to lastništvo in pri tem bo zakon zahteval izpisek iz zemljiške knjige, ta pa bo seveda, tega pa bo seveda nemogoèe pridobiti zaradi anarhije, ki v teh zemljiških knjigah vlada."
18,"Ko piše, da je grb recimo v levem zgornjem kotu in da je polovica v belem in polovica ..."
31,"Prosim vas, da upoštevate naslednje: prviè, ob 18.00 uri morate biti vsi tukaj, v teh prostorih, kjer bo skupna seja, lahko se pa seveda zgodi, da bo tudi delovna skupna seja."
35,"Torej, jaz mislim, da je lahko to bistveno, da se ne bi zapletali; da se tisti stavek v celoti preèita, pa se bomo lažje lotili že sedaj, predhodno, postopka, da se ne bi potem zapletali."
80,"- predlogi zakonov, ki bodo urejali sedanje dejavnosti po obrtnem zakonu, naj se pripravijo vzporedno z novo statusno gospodarsko zakonodajo, to je zakon o kapitalskih družbah in trgovskega zakona, - ob pripravi navedenih zakonov je potrebno pripraviti zakon o Obrtni zbornici v tej smeri, da bo to javno-pravna institucija z vsemi potrebnimi javnimi pooblastili, - priprave predlogov zakonov se naj poveri delovni skupini, ki bi jo sestavljali predstavniki Izvršnega sveta Skupšèine Republike Slovenije, Obrtne zbornice Slovenije in drugi zunanji strokovnjaki za trgovinsko pravo."
57,"Jaz ne bi to brala, ker kratko razlago vseh teh simbolov, kaj predstavlja jo, ste dobili vsi na mizo in mislim, da kot delegat in kot poslanec zaupam vsem tem osebam, ki so pred našo usklajevalno komisijo vodile vse te razprave, da so v dobro nas vseh Slovencev paè te zadeve izbrale in se s tem strinjam."
37,"Na rekonstrukcijo magistralne ceste Kolodvorska ulica v Lendavi, povezava z madžarsko v dolžini 300 m M12, Lendava èaka že 5 let, ker bi rada takoj z rekonstrukcijo angažirala lastna referendumska sredstva za izgradnjo ploènikov in spremljajoèe infrastrukture."
92,"Zaradi številnih težav, ena izmed teh je tudi osamosvajanje, in številni zakonodajni procesi, ki so v zvezi s tem tekli, je uspelo Sekretariatu za drobno gospodarstvo pripraviti vse tri zakone, prav tako je tudi Sekretariat za gostinstvo in turizem pripravil svoj zakon v fazi osnutka, to pa se še ni zgodilo na Sekretariatu za trgovino in splošne gospodarske zadeve, ki že ima sicer celovit zakon pripravljen in ki bo v bodoèe urejal tudi zasebne trgovce, kot fiziène osebe, vendar ga še ni dal v skupšèinsko obravnavo, to pa namerava v prihodnjem mesecu."
43,"Ne gre za cel zakon, da bi bilo treba sedaj ponovno celotni zakon o denacionalizaciji pripraviti na novo, vendar se v nekaterih toèkah zakon o privatizaciji in zakon o denacionalizaciji stikata oziroma prekrivata in je potrebno med njima dobro usklajevanje oziroma dobra uskladitev."
48,"Èe bi èlovek hotel vaše zamoriti, bi še tudi to dodal, saj verjetno v enem takem zakonu bi tudi moralo stati, kaj se vse ukine s tem, èe mi to sprejmemo in še marsikaj drugega, tako da verjetno tu, v tem primeru res gre za klic v sili."
45,"Mislim, da bi gospod Olup, namestnik republiškega sekretarja za pravosodje in upravo moral sedaj povedati nekaj, da ne bi prišlo, ne, gre sedaj za podatke in je verjetno prav, da ugotovimo, kako je s podatki, da ne bi ne vem kako dolgo govorili o njih."
51,"Mislim, da je bilo dosti pobud, mi nismo ena politièna avantgarda, da tolèemo tukaj kaj bi radi, vendar vidim, da ta sekretariat, kakršen je, ni v stanju, da bi pripravil kmeèko zakonodajo v neki kvalitetni osnovi in zato ostro protestiram, kadar se tukaj na takem mestu uporabljajo kot Marjan Podobnik itn."
49,"Za to toèko ste prejeli OSNUTEK ZAKONA O TARIFI ZVEZNIH UPRAVNIH TAKS, mnenje Izvršnega sveta Skupšèine Republike Slovenije, v katerem meni, da je osnutek zakona sprejemljiv in predlaga Skupšèini Republike Slovenije, da pooblasti svojo delegacijo v Zbor republik in pokrajin Skupšèine SFRJ, da da soglasje k osnutku tega zakona."
113,"Èe ob tem upoštevamo, da so v Republiki Sloveniji cene na drobno rasle glede na december 1990 in na april 1991 za 38 %, da so cene industrijskih izdelkov v Republiki Sloveniji z indeksom december 1990 - april 1991 zrasle za 50 %, da je bila rast osebnih dohodkov v gospodarstvu, èe primerjam mesec april, glede na povpreèje leta 1990, 49,4 %, da je bila rast osebnih dohodkov v Republiki Sloveniji, èe primerjam december 1990 na april 1991 - 21,8 %, potem je tak zakon, ki bi ga sedaj nekako uvrstili na dnevni red, pa upoštevali, sprejemljiv, kajti osebni dohodki teh delavcev zaostajajo za osebnimi dohodki delavcev v gospodarstvu s takšno dinamiko, ki sem jo malo prej tukaj navedel."
41,"Ampak teh klicev v sili dejansko s strani Izvršnega sveta, zlasti zelo poznih, ko se že skoraj potapljamo, je vedno veè in bi bili veseli, èe bi bili ti klici v sili takrat, ko še moèno plavamo, ko smo na površju."
118,"Moja trditev, spoštovane poslanke in poslanci, je bila samo v tem, da, èe smo plaèani iz proraèuna in iz proraèuna so plaèani delavci v državnih organih, so plaèani funkcionarji in so plaèane družbene dejavnosti, potem vas lepo prosim, èe je indeks bil kot sem vam prej povedal, da so osebni dohodki v gospodarstvu narasli za 21 % glede na december in èe smo vsi enako plaèani, zakaj potem samo sedajle z zakonom loviti en segment, osebne dohodke poveèati vsem delavcem, recimo, v vzgoji in izobraževanju, ki so sedaj že dovolj štrajkali, dovolj poveda li, kaj mislijo o svojem stanju torej, da tudi nimajo briljantnih osebnih dohodkov, kaj je v zdravstvu, tudi vemo, in kaj je v kulturi, tudi vemo."
53,"Zaradi obsega sredstev, moram prebrati, ker mislim izgleda, da se ne razumemo, kar smo napisali, ki so ga iz proraèuna dobile družbene dejavnosti v zaèetku leta, je v mnogih primerih že prišlo do motenj v poslovanju, ki so se odražale predvsem kot neplaèevanje in odlaganje raèunov dobaviteljem in deloma tudi v samem proraèunu."
47,"Dejstvo je, da do teh naših simbolov moramo priti in menim, da bi lahko ta sporazumni predlog usklajevalne komisije vseh treh zborov le podprli v našem zboru, kljub temu da bo mogoèe kakšen spodrsljaj, ampak spodrsljajev na tem dirjanju v samostojno Slovenijo bomo imeli še verjetno veè."
88,"Uporabo grba in zastave bo uredil poseben zakon, na skupni usklajevalni komisiji je bil pa podan tudi predlog s strani gospoda predsednika SDP, da v kolikor bi bil kakršenkoli predlog, ali da bi se kdo poèutil, da je paè bilo to sprejeto brez nekega širšega informiranja javnosti, bo pa do nove ustave še možno kakršnokoli pripombo dati in to je tudi v tem poroèilu navedeno, vendar mislim, da delim mnenje vseh èlanov oz. veèine èlanov usklajevalne komisije, da je to naš grb in zastava, s katero bomo zadovoljni."
110,"Institucionalizirana oblika državne podpore bo usmerjena v naslednjih pojavnih oblikah: v kreditih pod ugodnejšimi pogoji kot so v poslovnih bankah oziroma v drugih institucijah, po nižjih obrestnih merah - mi ocenjujemo da bi bile te obrestne mere do 50 % nižje, kot veljajo na trgu, daljšem moratoriju na odplaèevanje glavnice ali obresti, potem vlaganja, beneficiranju obresti s pokritjem doloèene razlike med obrestno mero poslovnih bank in dogovorjeno obrestno mero, doloèeno za posamezne ciljne organizacijske enote drobnega gospodarstva, s sofinanciranjem in vlaganjem v podjetniško in materialno infrastrukturo, ter po naši oceni zelo pomembno podporo novo nastalim poslovnim subjektom z dajanjem državnih jamstev oziroma jamstev za kredite pri poslovnih bankah ali drugih finanènih institucijah."
54,"Torej v prvem odstavku je zakon rekel takole: Zaradi zavarovanja pravic prejšnjih lastnikov kmetijskih zemljišè in gozdov se s tem zakonom do 31. decembra 1990 družbenim in pravnim osebam, ki upravljajo s kmetijskimi zemljišèi in gozdovi v družbeni lastnini, prepove seènja v teh gozdovih in promet s kmetijskimi zemljišèi in gozdovi v družbeni lastnini."
59,"Spoštovani, nerad povzemam doloèene stvari iz èasopisov in potem seveda hoèem na njih dobiti nek odgovor, ampak mislim, da je èasopisni èlanek, ki je v današnjem Delu z dne 19. 6., verodostojen namreè v tem, ker na nek naèin citira besede predsednika Sabora Republike Hrvaške dr. Žarka Domljana, in sicer, èe lahko citiram in potem bi postavil ustrezno vprašanje."
78,"Sem pa toliko slišala, da mislim, da je ta debata pokazala, da mešamo razliène sisteme izplaèevanja osebnih dohodkov, in mislim, da si to enostavno ne moremo privošèiti zaradi tega, ker enostavno z enim majèkenim detaljèkom, ki ga urejamo s spremembo tega zakona zaradi tega, ker tistega, kar je bilo zadnjiè sprejeto, ne moremo realizirati in da ni potrebno seveda da sedaj poskušamo vse probleme naenkrat rešiti, ki se na tem podroèju pojavljajo in se bodo gotovo še pojavljali."
100,"Liberalno-demokratska stranka meni, da bi prav zato popuste, ki so jih sedanji uporabniki stanovanjske pravice deležni, bili takšni in po mojem mnenju bi lahko bili tudi še veèji, kot so sedaj predvideni in da bi se iz tega izdelala pred tem tudi ocena, kakšna pa je dejanska materialna moè imetnikov stanovanjske pravice, saj bi le na osnovi tega lahko gradili metodologijo teh popustov, kolikšen obseg stanovanj bo na tej osnovi privatiziran, prav tako pa ni raèunov v zvezi s privatizacijo podjetij iz istih sredstev, èeprav sicer menimo, da stanovanjskega zakona ne kaže preveè tesno vezati na zakon o privatizaciji podjetij."
89,"Drugi predlog je pa, da se pospešijo priprave na predvideno debato o turizmu kot temeljni gospodarski panogi v naši državi, ki je bila na pobudo našega zbora vkljuèena v program dela tega zbora, da se te priprave pospešijo in da se vanje vkljuèi najširši krog zainteresiranih, kot so: seveda Sekretariat za turizem, Gospodarska zbornica, ne samo sekcija za turizem ampak tudi druge sekcije, ki vplivajo in sodelujejo pri turistiènem razvoju in gospodarstvu in bi predlagal, da bi ta debata morda bila še pred parlamentarnimi poèitnicami, èe sploh poèitnice bodo."
77,"V tem jaz mislim, da recimo tu ni nobenih vprašanj niti pojasnil in zato še enkrat zahtevam, da še bolj eksplicitno, se poudari tisti sklep, ki ga je predlagala Komisija za volitve, imenovanja in administrativne zadeve, da se to ustrezno uredi tudi v negospodarstvu in jaz sem vprašal, ali je možno, to imam pa tudi pravico vprašati, podobno urediti, ta stvar, pa lahko interventno zaèasno, dokler ne bo veljala kolektivna pogodba ali karkoli, tudi z zakonom, danes."
95,"Ljudje se sprašujejo, kako lahko zakon upošteva npr. vnuka, ki zahteva vrnjeno stanovanje, nekoè last njegovega deda, ne upošteva pa nosilca stanovanjske pravice, ki je vrsto let ali desetletij hodil domov z manjšo plaèo in vlagal v stanovanjski fond, da je dobil stanovanje, pa sedaj njegov delež ni ustrezno vrednoten, èeprav ga je pošteno in z odrekanjem ustvarjal paè v èasu, ki ni poznal privatne lastnine, a delež je to bil in ne mali, èe vemo, da je npr. 50.000 Mariborèanov v tem èasu 35 let ustvarilo 12 milijonov m2 stanovanjskega fonda v družbeni lasti."
108,"Oglasil sem se pa iz preprostega razloga, ker smo tudi v zakonu o davku na dohodnino hote ali nehote izpustili seveda to izvenzakonsko skupnost in se pri olajšavah za tega partnerja, ki živi v izvenzakonski skupnosti in nima svojih dohodkov in bi moral biti zavarovan pri zaposlenem partnerju, ne dobi nobenih olajšav, zato apeliram, da tudi v tem zakonu se držimo zakona o zakonski zvezi in družinskih razmerjih in polno do spremembe, èe bo do te prišlo, kar se pa jaz paè ne strinjam, da bi prišlo, ker mislim, da je zelo liberalna, da upoštevamo izvenzakonsko skupnost tako, kot jo je ureditev prej poznala in jo zdaj pozna."
60,"Namreè poslušajte, to se ne dela zaradi neke politike, vendar, dela se za to, da bomo sestavili, da bi bila ta družba pripravljena, mislim takrat, ko bo, zakonsko pripravljena, da ne bo že vsa oropana, se pravi, da tukaj ne gre zdaj za tisto metamorfozno kot pravite vèasih liberalci za seènjo v gozdovih, ampak gre za mnogo bolj bistvene stvari."
83,"Najprej moramo reèi, da podpiram razpravo, ki je bila sedaj povedana s strani komisije, samo zakon je eno, dodatni sklep o neèem, o osebnih dohodkih družbene nadgradnje oziroma ostalih dejavnosti, ni enako, razen, èe bo Skupšèina eksplicitni sklep sprejela, èe pa sprejme eksplicitni sklep, da je potrebno po Izvršnem svetu zagotoviti ustrezno raven osebnih dohodkov in rasti tudi zdravstvu, šolstvu in tako dalje, potem ne vem, zakaj ne bi to v en stavek zakona dali zraven, ker bomo sprejemali tako ali drugaèe dvoje."
96,"To si ne znamo praktièno predstavljati, teoretièno pa tudi temu oporekam, ker kdo trdi, da bi z dosedanjih vložkov, bodisi v kolektiv podjetje, bodisi v kolektiv obèina, bodisi v kolektiv nacija skozi stanovanjski prispevek na nek naèin bil imetnik ali pa lastnik tega svojega vložka, potem vam seveda moram povedati, da mora najprej potem - rekel bi - legalnost dosedanjega sistema javnih financ v 40 ali pa 45 letih postaviti kot teoretièno vprašanje in ko bomo potem tukaj mi ugotovili, da je bil ta sistem ilegalen, bomo pa te vložke lahko zaèeli nazaj vraèati, èisto kot teoretièno vprašanje."
62,"Zato nekatere družbene dejavnosti dobivajo paè nek dohodek ali dotacijo in jo potem èisto po svojih merilih delijo znotraj, nekatere dobijo financiranje posebej za del osebnih dohodkov direktno in za del materialnih stroškov direktno in imamo tretji sistem, da sedaj poenostavim, v upravi, kjer imamo toèen spisek ljudi, ki so v službi doloèen mesec, njihove toèke in direktno financiranje vsake posamezne plaèe."
74,"Mi smo upoštevali pobudo gospoda Podobnika, delegata oz. poslanca v Družbenopolitiènem zboru, da naj bi se v zakonu o moratoriju, jaz govorim v skajšanem naslovu zakona o prepovedi seènje itd., da bi se podaljšal rok s 30. junija 1991, torej rok, ki je prepovedoval pravni promet z nepremièninami, ki so v družbeni lasti in s katerimi razpolagajo družbenopolitiène skupnosti, da bi se torej ta rok, ki prepoveduje promet podaljšal do sprejema zakona o denacionalizaciji."
86,"Druga obrazložitev je pa ta, ko je drugi del, piše pa naslednje: ob sprejemu tega zakona, ko piše, smo že veèkrat povedali, koliko rabimo sredstev za osebne dohodke, èe sprejmemo ta zakon, vpašal sem vmes, èe bo to stalno merilo ali ne in ali se bo kdaj spreminjalo in kar sem upravièeno vprašal, ker jaz mislim, da se bo, pa piše, da bo hkrati Izvršni svet, skladno s spremembo in uresnièitvijo zakona o osebnih dohodkih v državnih organih zagotovil poveèanje obsega sredstev za financiranje družbenih dejavnosti."
