64,"Vendar bi vas rad spomnil na nekaj, da nezaupanje ni samo zaradi tega, ker te banke in ta država nima teh deviz, ampak je zaradi vojne, ki je na Balkanu, zaradi tega, ker nimamo še zunanjega priznanja in jaz sem preprièan v to, da tudi èe bi zaèeli na šalterjih brez omejitev izplaèevati te devize, si postavljam vprašanje, kdaj bi se to izplaèevanje konèalo."
58,"Amandma k 1. èlenu se pravilno glasi: ""Ta èlen se spremeni tako, da se glasi: V zakonu o financiranju javne porabe, Uradni list RS, št. 48/90, se v prvem odstavku 45. èlena za prvim navajanjem letnice 1991 doda besedilo: ""in 1992"", na koncu odstavka pa se besedilo: ""v leto 1991"" èrta in nadomesti z besedami: ""za ustrezno leto""."
89,"In še amandma g. Domia in Starca, ki pravi: Podpiramo predlog zakona o dopolnitvi zakona o financiranju javne porabe in predlagamo, da se 43. èlen zakona o financiranju javne porabe dopolni in glasi tako, kot sledi: ""Èe ni s posebnimi predpisi drugaèe doloèeno, se sredstva za izvajanje nalog republike in obèin ter posebnih družbeno-politiènih skupnosti na podroèju družbenih dejavnosti, socialne varnosti in gospodarske infrastrukture zagotavljajo v proraèunu republike in proraèunih obèin ter posebnih družbeno-politiènih skupnosti za leto 1991 in 1992 za enake naloge oz. namene kot v letu 1990."""
105,"Bistvena razlika med prejšnjim predlogom in sedanjim predlogom je ta, da so v III. poglavju po prejšnjem predlogu bile pogodbene obveznosti med bankami, ki so sprejele devizne hranilne vloge in varèevalci, po prejšnjem predlogu so bile spremenjene v terjatev iz naslova izdanih obveznic, v današnjem predlogu je pa III. poglavje tako koncipirano, da predpisuje minimalne obveznosti bank, ki jih morajo izpolniti do varèevalcev, to pomeni, da so banke dolžne do 10. 1. izplaèati najmanj 500 mark, do 1.3. še nadaljnjih najmanj 500 mark, ostali znesek obveznosti iz naslova sprejetih hranilnih deviznih vlog pa izplaèati v eni dvajsetini vsako polletje oziroma najmanj 500 mark vsako polletje."
82,"Izvršni svet je predlog za izdajo zakona z osnutkom pripravil že za sejo 7. 10., takrat, ko smo sprejemali zakon o denarni enoti, takrat ko smo se odklapljali iz enotnega monetarnega in deviznega sistema, vendar je potem Izvršni svet klub temu, da bi bilo prav, da bi ta zakon že takrat bil sprejet, ker izhaja s tem zakonom za urejanje odnosov med bankami Slovenije in Narodno banko Jugoslavije, prav zaradi teže problema je predlagal v obravnavo predlog za izdajo zakona z osnutkom."
79,"Mislim, da veèina akademsko izobraženih Slovencev, pa tudi veèina tistih, ki so vojsko služili, bo hotela kupiti pet ali eno leto pokojninske dobe in èe zakon omogoèa, da se ta dokup lahko izvrši iz deponiranih hranilnih vlog z obveznico, ki bo izdana na osnovi tega zakona, imamo že drug zelo konkreten primer po katerem se lahko naslednjih, mogoèe 100 milijonov mark hranilnih vlog zopet uporabi za transakcijo, za nek nakup, ki pa ima v svojem nadaljevanju èisto pozitivne posledice."
124,"Èe ne želimo, da bodo varèevalci v tistih dnevih, ko bo lahko eno dvajsetino ali 500 mark dvignil, da bo takole èakal kot pes na kost, na tisto dvajsetino, pa dajmo omogoèiti tako, da bodo lahko normalno dvigali prihranke in vam garantiram, posebno v teh pogojih, ki so zdaj dani, da se lahko tudi v vrednostne papirje spremeni in da se te vrednostne papirje za celo vrsto stvari lahko uporabi, da jih bo le veliko vzelo vrednostne papirje in ne bo tako velik pritisk na samo gotovino in tudi tisti, èe bo enkrat lahko dvignil, vam zagotavljam, da jutri ne bo šel dvigati ali pa njegov sosed ne bo šel dvigniti, èe bo vedel, da mu bo država garantirala in bo lahko normalno dvigal."
121,"S tem, da je s tem razbremenjen proraèun, ta integralni proraèun, o katerem govorimo, postavke v zdravstvu, razen za tiste stvari, ki so vezane na doloèene obveznosti iz mednarodnih pogodb in podobno in pa obveznosti, in to v letu 1992, ki so vezane na izpolnitev programa za leto 1991, in to ta del, ko se je na predlog Izvršnega sveta to je vlade, zakljuèilo naše poslovno leto z 10. decembrom, kar je meni, to sem že pri proraèunu govoril, da mi ni jasno, èeprav nisem ekonomist in seveda da se pokrijejo vse stvari, ki so nastale do 31.12.1991 s pogojem, in ta je edini možen, da Zavod za zdravstveno zavarovanje priène z nulo in zbiranjem prispevkov in po novem to stvar..."
139,"Da za izvedbo programa, ki je doloèen z dosedanjim zakonom, da praktièno trditve, ki so bile dane ob razpravi osnutka in predloga proraèuna letos aprila oziroma marca oziroma februarja, da praktièno tista naša trditev, da naj bi se vse, kar se je iz prispevne stopnje nateklo za izvajanje programa zdravstvenega varstva, se bo sedaj realiziralo z eno veliko diskvalifikacijo opredelitev in odloèitev v tem smislu, da praktièno ni bilo zagotovljeno promptno odvajanje teh sredstev in da se recimo ta dodatna sredstva v obliki renominacije, pa me bo mogoèe gospod Marjan Starc popravil, ker jaz ne vem veè kaj je renominaciji in kaj rebalans proraèuna, na koncu prišli do te številke, s tem da smo zgubili z oziroma na devalvacijo in inflacijo sigurno zelo veliko sredstev, ker ta niso bila promtno, kot so bila združevana, tudi dana za izvajanje programa."
