132,"Če predlagatelja sploh skrbi to, da se zakon o zajamčenih plačah krši, v to nič ne dvomim, da se krši, če ga skrbi, seveda pravim, ker dvomim, da ga to zelo skrbi, ker sicer bi že poskrbel, da se to ne bi dogajalo in tudi ne bi tako machiavellistično uporabljal to kot argument za nadaljnje restrikcije v socialni varnosti, potem predlagam, da mogoče razmisli o spremembi zakonodaje oziroma predpisov, ki urejajo stečajni postopek in bi kot enega od kriterijev z navedbo stečaja dali notri tudi nesposobnost podjetja, da svojim delavcem zagotovi vsaj zakonsko garantirane minimalne plače, ker če podjetje tega ni sposobno narediti, je očitno, da svoje izgube in nevarnost nelikvidnost skriva v tem, da svojim delavcem ne zagotovi niti tistega, kar naj bi jim omogočilo, da od svojega dela minimalno preživijo."
0,...
61,"Predlagam, da sprejmete ta zakon, ker menim, da je res čas, da ga uveljavimo tudi na drugih segmentih in da začnemo malo pospešeno tudi tisti skromni del ukrepov aktivne politike zaposlovanja, ki smo jih že uveljavili in za katere načrtujemo letos uveljavitev in se boste z njimi seznanili ob priliki proračuna, spraviti v življenje in tako omejevati in zmanjševati grozečo brezposelnost."
74,"Kajti, če se bo zgodilo nasprotno, potem, če nekdo misli, da bo stvar lahko reševal s tem, da bomo prišli na stare klasične kapitalistične izkoriščevalske odnose, potem bomo odpirali perspektivno družbo, v kateri bo en majhen sloj nenehno odpiral, ogromna večina ljudi delavcev in kmetov bo pa stalno obubožana in po mojem to, kar sedaj razpravljamo v zvezi s tem zakonom, so samo neke parcialne rešitve, kajti manjka nam nek osnovni program ekonomskega razvoja."
66,"Vlada se mora odločiti, ali bo s to zakonodajo vračala slovensko družbo v klasični kapitalizem tistega prvega ranega industrijskega obdobja, kjer se vse dogaja v kategorijah zaposlitve, nezaposlenosti, sociale, ali bo poskušala s to zakonodajo slovensko družbo usmeriti v poindustrijsko obdobje, kjer je treba z zakoni odpreti možnosti, ne za zaposlovanje, ampak za angažiranje, ne za podporo nezaposlenim, ampak za podporo revitalizacije njihove delovne sposobnosti itd."
84,"Na glasovanje dajem tretji amandma k 12. členu, kjer se predlaga, da se doda nov peti oziroma četrti odstavek, ki se glasi: ""Če je zavarovancu prenehalo delovno razmerje zaradi nujnih operativnih razlogov ali zaradi stečaja, se za nadomestilo osebnega dohodka upošteva osnova v višini povprečnega osebnega mesečnega dohodka zadnjih treh mesecih, izplačanih pred znižanjem osebnih dohodkov, zaradi ekonomskih ali drugih razlogov, v skladu z zakonom, povečanih za rast življenjskih stroškov."" Amandma so vložili skupno sindikati - prejšnji amandma Socialdemokratske stranke, je treba še enkrat. dobro."
79,"Prehajamo na amandmaje k 77.a členu, kjer predlaga, da se za 77. člen doda nov 77.a člen, ki se glasi: Do uveljavitve sprememb in dopolnitev zakona o družbenem varstvu otrok se denarno nadomestilo ženskam, ki jim je prenehalo delovno razmerje v času nosečnosti, v času porodniškega dopusta ali dopusta za nego ali varstvo otroka izplačuje tudi po preteku časa iz 25. člena tega zakona, in sicer do poroda in po porodu toliko časa, kolikor traja ta dopust."
