21,"Moti me, ker ne upošteva boljšega dela, ne upošteva strukture zaposlenih oziroma ne priznava razliènih težavnih delovnih pogojev in tako naprej."
2,Lahko noè.
16,"Ne vem, mislim, da tiste anomalije, ki so bile nakazane na ta naèin, ne moremo reševati."
26,"Na našem Odboru za proraèun in javne finance smo seveda tudi to ugotovili, èe se že ta zakon obravnava, potem je smiselno samo po hitrem postopku."
25,"Imamo dvoje, najprej obravnavamo predlog za izdajo zakona o organizaciji in delovnem podroèju republiške uprave s predlogom zakona, ki se naj obravnava po skrajšanem postopku."
4,Se je kdo vzdržal?
5,Ob 10. uri na Tomšièevi.
30,"Na tej skupni seji moramo biti sklepèni, na vsak naèin, da ne odhajati in tam na tej skupni seji se bomo tudi dogovorili, ali bomo imeli jutri nadaljevanje ali ne."
42,"Potem pri nas nimamo te naloge, da umaknemo svoj amandma k 2. èlenu, ker to ni veè potrebno, moramo pa se seveda pogovoriti o 4. èlenu, da sprejemamo amandma k 4. èlenu, ki se glasi: Ta je pa seveda kar tudi sprejemljiv."
29,"To smo opravili in zdaj še predlog zakona o davku na izplaèane osebne prejemke nad doloèeno ravnijo v obdobju junij-december 1991, ki ga naj bi obravnavali po hitrem postopku."
17,"Ugotavljam, da postopka kot je bil predlagan s strani skupne komisije za uskladitev dnevnih redov, nismo sprejeli."
12,"Takrat smo dosti razpravljali na koncu, jaz sem že to enkrat ponovil."
11,Vi se dobro spominjate razprave okrog davènih zakonov okrog novega leta.
3,Je kdo proti?
6,Jaz se absolutno ne morem strinjati.
9,"Meseca aprila smo èrtali davek, tisti dodatni davek 12 %."
1,Hvala.
64,"Jaz bi vas uvodoma opozoril na pomembno sprejetje tega zakona, tako kot je predložen skupaj s predloženimi popravki, kajti to je eden od kompleksa tistih zakonov, ki nam omogoèajo nemoten prevzem zveznih funkcij v obstojeèe upravne organe s tem, da smo naredili eno pomembno spremembo, in sicer smo samostojne upravne republiške organizacije vezali na matiène upravne organe, s tem da se zagotovi veèja odgovornost."
44,"Preden glasujemo o zakonu o spremembah in dopolnitvah zakona o varnosti cestnega prometa, na katerega ni nobenega amandmaja, vas prosim tako: Èe bomo v celoti dnevni red izèrpali do 18. ure, se bomo zbrali žele v ponedeljek, èe pa ne, pa jutri tudi delamo."
33,"In tu je k 2. èlenu,4. èlenu, 6., 7. in 8. èlenu, medtem ko je Zbor združenega dela sprejel predlog zakona z amandmaji, ki se glasita k 2. èlenu in 7. èlenu."
8,Ni tukaj problem posameznih špic in tako naprej.
19,"Najti moramo neko drugo regulativo, da bomo to uredili, ne pa da udarimo vse poèez, kar malo ven štrli."
10,"Verjetno so še stvari, ki bi se jih dalo našteti."
43,"To je namen tega, mislim, da je v osnovi v redu, ker maso regulira,da se vsaj malo skuša v tem socialno kritiène momentu doloèen korektiv vnesti v naša delitvena razmerja, zato sem za ta zakon, da se sprejme tako kot je predlagan."
22,"Glede na vsebino teh dveh amandmajev, je skupna komisija ugotovila, da je utemeljen umik drugih amandmajev, ki so bili sprejeti v zborih."
27,"Tako, da morate poèakati tu, ker so pa na skupni seji samo imenovanja, to bo krajša in zato vas iskreno prosim, da boste ob 18. tudi tu."
32,"Res je sodišèe v okviru svojih pristojnosti samostojno, da o teh zadevah odloèa, vendar pa, ali se zavedamo, kolikšna je kazen 10 let zapora in kakšna je naša statistika na tem podroèju."
18,"Prosim, da pridete v takšnem številu tudi v ponedeljek na sejo, ker imate zdaj en dan v dobrem."
61,"In v tem domu je poseben oddelek za mladoletnike, tam se lahko nastanijo vèasih tudi družine z otroki, celo z majhnimi otroki in ne vidim nobenega razloga, da ne bi potem organi za notranje zadeve dejansko namestili tega mladoletnega tujca, ki so ga prijeli, v ta dom, ki so ga v ta namen ustanovili in ga v ta namen tudi upravljajo."
91,"Zato zahtevamo od Izvršnega sveta, da pripravi celoten koncept reorganizacije državne uprave, zlasti z vidika njene veèje uèinkovitosti in racionalnosti, vkljuèno z zmanjševanjem števila potrebnih izvajalcev, ki naj ga predloži v obravnavo po redni proceduri, hkrati pa zavraèamo, da se predlog za izdajo zakona o organizaciji in delovnem podroèju republiške uprave s predlogom zakona uvrsti na dnevni red te seje zbora oziroma èe bi tole zavrnili, predlagamo, da se uvrsti kot predlog za izdajo zakona z zakonskim osnutkom, torej ne po skrajšanem postopku, temveè po postopku združitve prve in druge faze."
14,"Imamo še majhno razpravo o samem zakonu tudi, imamo pa razpravo samo o postopku."
80,"To, kar je bilo sicer v pripombi omenjeno, da se sklicujemo na veljavni zakon o sistemu državne uprave je seveda jasno, saj druge pravne podlage nimamo in šele sedaj intenzivno delamo na kompletni novi zakonodaji s tega podroèja, ki pa bo možna šele takrat, kot je bilo tudi v pripombi povedano, ko bo sprejeta ustava in s tem našim današnjim osnutkom, ni ureditev z ustavo èisto niè prejudicirana, kajti vsa ta podroèja bo urejala ustava, kot bo Skupšèina to doloèila."
7,Mi bomo obravnavali to v teku seje.
13,To ni bilo res in to smo pozneje v teh spomladanskih mesecih ugotovili.
31,"Z obema amandmajema k 1. in 20. èlenu smo seznanjeni in bi predlagala, da jih tudi sprejmemo, ker v bistvu gredo v kontekst, tisti amandmaji, ki se nanašajo na 1.èlen."
36,"V bistvu gre za usklajevanje z enim doloèilom zakona o deviznem poslovanju in k 20. èlenu gre tudi za v bistvu pojasnjevanje neèesa, kar je drugje urejeno, zato predlagam, da bi sprejeli oba amandmaja kot taka."
50,"""1. Èe je zoper državljana, ki prosi za izdajo potne liste ali vizuma uveden kazenski postopek za kaznivo dejanje, za katerega je zagrožena kazen 10 let zapora ali veè, dokler traja postopek in èe to zahteva sodišèe."" Slišali ste tudi gospoda Brvarja, da se ne more strinjati s tem amandmajem."
20,"Komisija meni, da je glede na naravo te doloèbe predlagani izraz pravno ustreznejši in tako menijo tudi v Izvršnem svetu."
23,"Pri nas pa smo še daleè od tega, da bi tržna ekonomija samodejno, optimalno distributirala med vse udeležence v proizvodnem procesu ustrezni dohodek."
54,"Skupna komisija je na podlagi pregledov dnevnih redov vseh zborov predlagala našemu zboru, da bi predlog za izdajo zakona o organizaciji in delovnem podroèju republiške uprave s predlogom zakona obravnavali po skrajšanem postopku, in drugo, predlog zakona o davku na izplaèane osebne prejemke na doloèeni ravni obdobja junij-december 1991, naj obravnava po hitrem postopku."
37,"V skladu s tem skupna komisija predlaga zborom naslednje: Družbenopolitiènemu zboru in Zboru obèin, vsakemu po svoje in seveda našemu tudi, in sicer, da umakne svoj amandma k 2. èlenu in sprejme k temu èlenu naslednji amandma."
35,"Potem bi zakljuèil v zvezi s tem razpravo in vas seveda sprašujem, kdo je za predlog zakona o davku na izplaèane osebne prejemke nad doloèeno ravnjo v obdobju junij-december 1991, da obravnavamo po hitrem postopku?"
96,"Potem moramo pa mi tako in tako poèakati, da se Izvršni svet in Zakonodajno-pravna komisija izreèeta o amandmaju in zato vas prosim, da èe je seveda to z vaše strani možno, da vložite èimprej amandmaje, lahko že vnaprej za vse zakone, ki so, in drugiè, obrazložite svoje predloge na kratko in jedrnato brez odveènega besedièenja, ker moramo še tako in tako tudi to drugo fazo, potem ko bomo sprejemali amandmaje, kdaj bomo to naredili, verjetno danes ne, ampak šele jutri, še enkrat opraviti in zato se mi zdi, da bi lahko danes bili racionalni in kratki."
48,"1. Družbenopolitièni zbor je sprejel predlog zakona z amandmaji k 4. èlenu, ki se glasi: Stranke vlagajo zahtevke za uveljavitev socialnovarstvenih pravic (v nadaljevanju: zahteve) v krajevnih skupnostih, kjer imajo stalno prebivališèe ali pri organu iz drugega odstavka 2. èlena tega zakona ali v organizaciji, kjer so zaposleni."
15,"Samo potrjujem stališèa, ki jih je gospod Perko povedal, drugaèe pa sem želel povedati tole."
24,"Jaz bi rada samo dodala še kot ena od èlanov te komisije, ki smo jo mi sicer pomotoma imenovali na prejšnji seji usklajevalna komisija."
41,"Jaz bi predlagal glede na to, da ni tu kakšna huda zapletenost, da bi mi tudi obravnavali te amandmaje in jih sprejeli, spravili pod streho, potem imajo možnost pri Izvršnem svetu in ostalih dveh zborih, da v drugi fazi uskladimo zadeve."
34,"Zato absolutno ne morem biti za tak zakon in predlagam, èe moramo problem rešiti, recimo, da obstoja, verjetno obstoja, dajmo tokrat res reševati problem, ne pa zbirati sredstva, da ne bom rekel za kaj."
55,"Zdaj vam, mislim, kateri so bili razlogi in kateri proti, lahko povem, da stvar ni inovativna, da ni prežveèena, da ni premišljena, so bili drugi razlogi, so pa govorili ravno obratno, da je to nujno potrebno, da to ne posega, da to bistveno rešuje probleme, ki bi se pojavili s 1. julijem, in tako naprej."
38,"Po moji oceni smo bili tudi na neki naèin okrog prinešeni, ko je šlo za to, da nam je bivši finanèni minister zatrjeval, da ima narejene simulacije in da davène obremenitve niso veèje od obstojeèih iz prejšnjih let."
63,"Zadnjiè smo, ko je bil predlog najprej o Narodni banki, pa tako naprej, so bila razlièna mnenja in republiški sekretariat je potem te pripombe upošteval in zdaj ponovno dal dikcijo, da naj bo to Banka Slovenije, vèeraj so se pa pojavljali novi predlogi okrog tega, in sicer en del razpravljalcev na odboru je bil mnenja, da naj bo pravi naslov Banka Republike Slovenije."
45,"Glede na to, da je danes v èasopisu že ta informacija, se pravi, da je bila tudi že vèeraj, gre za zelo resno zadevo, kot je rekel kolega Zabukovec in èe je, bi jaz rad slišal predstavnika Izvršnega sveta, kaj to v praksi dejansko pomeni."
51,"Jaz bi rekel, da moram tudi dobesedno na glas povedati, da se jaz taki vladi in taki politiki zahvaljujem in se ji odpovedujem, ker je za moje pojme neresna, da mi vsak mesec prinaša neke nove davke, enkrat na tak naèin, drugiè pa na drug naèin,osnovnega problema pa ne rešuje."
72,"Kakšne možnosti, kakšne protimožnosti, da ustavimo sodišèe zelo decidirano, oèitno zelo jasno zahteva, naj se ne upošteva, da se ta zakon umakne, daje izrecno prepoved, me zanima, kakšne možnosti imamo oziroma kakšne možnosti ima eksekucija iz Beograda, v teh èasih, ko se ta živènost z levo roko seje, na levo in desno, mislim, da bi bilo zelo zdravo, da bi predstavnik Izvršnega sveta v nekaj stavkih dal jasen decidiran odgovor na to."
60,"Paket zakonov, predvsem prvih štirih,s tem ne mislim tu na zakon o spremembah in dopolnitvah zakona o varnosti cestnega prometa, ureja temeljna pravna vprašanja, ki so brez dvoma zelo pomembna za vsakega prebivalca Republike Slovenije, bodisi da gre za status državljanstva, za pravila, ki jih bodo morali upoštevati tujci na ozemlju Republike Slovenije, ali za potne listine naših državljanov."
47,"In še bolj nenormalno je, da se lahko potem pogovarjamo in verjetno se bomo v vseh treh zborih v zvezi s temi nekaj èleni in mi instituciji, ki to opravlja, enostavno ne zaupamo veè, paè pa prenašamo in hoèemo zakomplicirati to vse skupaj, ker prenašamo v drugo."
94,"Najprej gospoda Murna, ki je predlagal amandma k 10. èlenu, k 40., potem so tu amandmaji, ki jih je predlagal Rudi Moge, in sicer tudi k 10. èlenu, da se èrta 5. toèka, spremeni se 6. toèka, potem amandma k 28. èlenu, ta èlen se v celoti èrta, k 29. èlenu, 40.èlenu, potem je Klub neodvisnih predlagal amandma k 43. èlenu in tu imamo še tudi Zakonodajno-pravno komisijo, ki je tudi predlagala amandma k 10., 40., 41., 42., èlenu ter da se nekatere zadeve popravijo v 18. in v 25. ter 38. èlenu."
40,"Èe ni veè razprave, bom zakljuèil v zvezi s tem razpravo in bomo opravili najprej prvo fazo, se pravi, gre za vprašanje, ali uvrstimo ta zakon sploh na dnevni red, èe smo se prav razumeli, za to prvo odloèitev gre."
28,"V proraèun je možno dobiti denar tudi iz drugih virov, ali pa na drug naèin, seveda pa ti naèini niso tako enostavni, kot so davki na osebne dohodke."
67,"Da se vrne vsa ta materija znova v razpravo, ker je na tak naèin tudi omogoèeno, da Zbor obèin, ki je dejansko o stvari dvakrat razpravljal in glasoval, lahko še enkrat razpravlja in enako potem tudi mi in Družbenopolitièni zbor, tako da jaz predlagam, da mi danes ponovno odpremo razpravo o tem zakonu in ne bi šli zgolj po postopku, ko samo amandma obravnavamo in zanj glasujemo."
58,"Amandmaji so pa tudi že predloženi, in sicer: Vili Sekereš k 13. èlenu, Andrej Muren k 28. èlenu predloga zakona o potnih listinah državljanov, Zakonodajno-pravna komisija ima tudi amandma k 39. èlenu in potem imamo še Komisijo za mednarodne odnose, ki ima amandma k 11. èlenu in Komisija za notranjo politiko ima amandma k 3. in 12. èlenu."
49,"Hkrati pa je seveda ta prvi problem, ki sem ga omenil, ni bistveno veèji in na koncu koncev je tudi stvar morale in ne samo ekonomije in mislim, da bi ta država morala znati te probleme razrešiti in èe že predlaga zakon, ne razumem, da tega problema ni reševala."
39,"Amandma k 28. èlenu, da se zavrne prošnja za izdajo potne listine ali vizuma v primeru, èe je zagrožena kazen za 10 let, ni sprejemljiva, ker sodišèe odloèi v postopku in drugaèe tudi ne more, takrat, kadar sumi begosumnost."
52,"Mislim, da moramo podpirati to, da se neka podjetja odtrgajo in ne smemo gledati po nekaterih izjemah, ki morda, recimo, da izkorišèamo položaj ali kakorkoli, samo tu ne moremo povpreèja udariti in vsa podjetja, ki so malo bolje stojeèa, kot tista, ki so pod vodo, potem še na ta naèin dodatno obremeniti."
69,"Ta èlen govori o tem, kdo je pristojen, da o tem odloèa in mi mislimo, da bi bile osnovne rešite,kot so v predlogu 40., 41. in 42. èlena kar primerne, s tem da, ker gre v primerih 41. in 42. èlena za te ljudi, ki ne živijo zunaj in je dana diskrecijska pravica organov, da bi doloèili tudi nekatere pogoje, na katere naj ta organ upre svojo odloèitev."
77,"Potem 6. in 9. toèka, da obvladajo slovenski jezik v taki meri, da se lahko sporazumevajo z okoljem, torej nekdo, ki je zapustil in gre tudi za njihove otroke, èe natanèno pogledate 41. in 42. èlen, èe ima ta pravi odnos in si želi tudi našega državljanstva, je kar prav, da tistih par besed slovenšèine obvlada in 9. toèka tega èlena, da sprejem v državljanstvo Republike Slovenije ne predstavlja nevarnosti za javni red, varnost ali obrambo države."
85,"Torej, tukaj imam pripombe k 10. èlenu, ker menimo, da bi se mogla èrtati tretja alinea, èetrta alinea pa spremeniti tako, da bi se glasila: ""Èe nima vstopnega vizuma za državo, v katero potuje, pa bi ga moral imeti"", èrta se tisto, ""za sosednjo državo"", ker menimo, da èe bi na primer en Filipinec potoval v Nemèijo pa nima vize in se znajde tukaj, ne gre ne za sosednjo državo ne za državljana iz sosednje države, pa mislimo, da bi lahko tisto sosednja seveda izpadlo."
53,"Zato predlagam, da v tem smislu in upoštevajoè vse to damo stvari na dnevni red, ker zakljuèujem z uvodno razpravo, èe bo to prispevalo k stabilizaciji razmer in iskanju rešitev, potem najbrž v tej smeri ne moremo zganjati demagogije, ampak se moramo zelo zavestno lotiti zadev in jih posušati tako ali drugaèe razreševati."
57,"Tretji odstavek 32. èlena zakona naj se spremeni tako, da se glasi: ""Organ, ki je izdal odloèbo po prvem ali prejšnjem odstavku, mora ustrezno obrazložitev razlogov, ki so ga vodili pri takšni odloèitvi, posredovati prizadeti osebi v 15 dnevih."" Slišali ste gospoda Brvarja, da se s tem amandmajem Izvršni svet ne strinja in se tudi ne more."
76,"Predlagam, da se ta èlen spremeni tako, da se glasi: O prijetju mladoletnega tujca, ki je prišel na obmoèje Republike Slovenije brez veljavnega potnega lista oziroma brez vednosti in dovoljenja njegovih zakonitih zastopnikov oziroma ostal brez potrebnega varstva oskrbe in sredstev za preživljanje, ali se ni ravnal po predpisih Republike Slovenije, pooblašèene uradne osebe organa za notranje zadeve takoj obvestijo diplomatsko-konzularno predstavništvo, katere državljan je, ali varnostne organe sosednje države in pristojni organ za socialno varstvo."
73,"Hvala, gospod predsednik, spoštovanog poslanca, našega kolegu spoštujem in verjamem, da je ta komisija imala razloge, da predlaga takšno taèko dnevnega reda, ampak rad bi res obrazložitev malo širšo, zakaj pa da to postavimo, ker smo že dali na dnevnom redu, se pravi, ne samo kaj je komisija sklenila, nego da nam da par besed, zakaj se on za to odloèio in nama predlagao, bi prosio da se odloèim, za kaj bi glasoval."
46,"Odbor je imel danes sejo in je na podlagi poroèila predstavnika Izvršnega sveta, ki je bilo zelo temeljito, ugotovil, da so bili vsi amandmaji s strani odbora praktièno nepotrebni in jim umika, tako da bi lahko predlog zakona ostal tak, kakršen je bil v zaèetku predložen."
86,"Jaz sem že prej nekaj povedal v tej smeri, namreè tudi jaz sem proti temu zakonu, ker s tem poveèujemo obremenitve t.i. dobrih podjetij, èeprav vem, da so dileme o tem, kaj so dobra, kaj so slaba podjetja, ampak kljub vsemu,to je tistih podjetij, ki se nekako s težavo borijo, bijejo borbo na svetovnem tržišèu in ta dodatni davek vsekakor avtomatsko zniža njihovo konkurenènost na teh podroèjih, to se pravi, namesto, da bi dovolili, da nekako vendarle poletijo v to smer, jih dodatno obremenjujemo."
0,.
71,"Problem ne obstaja toliko v višinah in razponih ampak v tem, ali smo v stanju, da politiko plaè oblikujemo tako, da tisti, ki lahko veè ustvarja, tudi nekaj veè prispeva in na ta raèun zagotavlja nekaj veè tudi za tiste, ki v teh pogojih enostavno ne morejo ustvarjati, so pa na robu eksistence in marsikdaj ne morejo pokrivati niti tistega, kar je nujno potrebno za razrešitev njihovih problemov in za preživetje."
62,"Vsi poslovodni delavci nismo v enakem položaju in samo spomnil bi, gospod predsednik, da vendarle tisti resorji, ki so nam za tem pultom obljubili, da bodo v najkrajšem èasu dali en pregled, da bi vendarle tudi to prepreèili, kar se tu ponovno pojavlja kot opozorilo in mnogi primeri, na žalost, v Sloveniji potrjujejo in kažejo na to, da se resnièno anomalije dogajajo."
70,"Mene bolj poredko vidite za tem pultom, kadar gre za zakone s podroèja davkov, vendar, ker se ti zakoni, vsaj kadar gre za obdavèitev plaè, zelo tesno prepletajo s tistim, za kar je odgovoren naš resor, se pravi, za politiko plaè in mislim, da moram ob tem trenutku tudi povedati, da ne samo za politiko plaè, ampak tudi za zagotavljanje uresnièevanja nekaterih programov, ki jih uresnièujemo preko Sekretariata za delo."
101,"Jaz bi razumel dober namen tega ali pa iskren namen tega zakona, èe bi pred obdavèenjem pisalo, da se vsem delovnim organizacijam, ki imajo maso osebnih dohodkov nižjo kot je povpreèna, ker vemo, da je zakon, ki omejuje maso osebnih dohodkov, ki je takrat, ko je bil tu potrjen na Skupšèini zatekel v neko momentalno stanje in danes je marsikatera delovna organizacija v taki situaciji, da ne more izplaèati osebnih dohodkov, ker se ji masa omejuje za osebne dohodke in išèe tiste izjeme, ki jih tukaj kritiziramo, da izplaèujejo osebne dohodke prek drugih naèinov, tako kot je regres in tako naprej."
117,"Jaz moram reèi, da na nek naèin razumem predlagatelja, ki paè v stiski, v kakršni smo, išèejo ustrezne rešitve in èe je približno toèno to, kar je napisano na 1. strani tega predloga, kjer gre za to, da bi prepreèevali veèje motnje v gospodarstvu, da bi vendarle na nek naèin omejili osebno potrošnjo in jo usmerjali v razvoj, v investicije itd. in prepreèili nadaljnje zmanjševanje družbenega premoženja na podroèju privatizacije, potem je èlovek zelo blizu temu, pri èemer pa moram spomniti na naslednje: V tem zboru velja že sedem mesecev star sklep, ki se je nekajkrat ponavljal, pa do pojasnil ni prišlo, ko smo terjali natanèen pregled vseh anomalij, ki se pojavljajo na podroèju lastninjenja, privatizacije itd."
56,"Imamo kolektivno pogodbo, samo ne vem, zakaj jo imamo, ker po eni strani želimo, da jo delovne organizacije, podjetja, podpišejo, po drugi strani pa vse tiste, ki pogoje v tej kolektivni pogodbi na nek naèin s težavo izpolnjujejo, potem pa po tistih udarimo, zaradi tega, ker nekako po naših mnenjih preskakujejo veè kot 20 % od povpreèja."
90,"To je tako reèeno kaznivo dejanje, stvar pride pred sodišèe in potem lahko sodnik, ta možakar temu sodniku ni všeè in mu enostavno ne da sodišèe ali pa zahteva, da se mu odvzame potni list in tako je èlovek lahko zaradi preproste razžalitve èasti ob potni list, to pa ni nobeno kriminalno dejanje, sicer kaznivo je, ni pa tako dejanje, da bi èlovek lahko potem odvzel potni list nekomu, zato smo mi paè v tem našem predlogu dali bolj rigorozen predlog, ki pa je zagrožen paè za hujša kazniva dejanja."
83,"Namreè, želim vam povedati, da prihajam z Zbora obèin in da so umaknili amandma na 2. èlen in tudi na vse èlene, razen na 7. in 8., kar sicer ni logièno, ker bi potem morali tudi ta dva èlena, ampak bistveno, kar pa je, da so 2. èlen umaknili, to se pravi, da zdaj glede na to, da ta vaš zbor in Družbenopolitièni zbor ste že zakon sprejeli, sicer pri vas z amandmajem, mislim, kar zadeva amandmaja Zbora obèin, ta ni veè aktualen."
59,"Tudi zadnjiè smo pravilno ravnali oziroma Izvršni svet, da je zamrznil, èeprav je naš zbor vseskozi proti temu, državnim uslužbencem plaèe in da vsaj skuša na nek naèin, kolikor se da, te agregate v osnovi kolikor toliko držati v nekih razmerjih in tukaj razumem ta problem, da so doloèeni poslovodni delavci moteèe previsoko nagrajeni, èeprav je to stvar diskusije."
95,"Zdaj smo mi za danes nekako zakljuèili in vas obvešèamo naslednje: Nadaljujemo z današnjo sejo v ponedeljek ob 10. uri v dvorani na Tomšièevi, in ker ste dobili danes tudi gradivo za zakone, predlog zakona o bankah in hranilnicah, predlog zakona o predsanaciji, sanaciji steèajev in likvidaciji bank in hranilnic ter predlog zakona o Agenciji Republike Slovenije za zavarovanje depozitov bank in hranilnic, bo to seveda na 2., 3. in 4. toèka dnevnega reda, tako da je treba zopet vse pripraviti, tako kot smo danes delali, d bi èimprej seveda to v ponedeljek dopoldne opravili."
