14,"Èlani tega odbora so pa: gospa Lokar, Semoliè, Pipan, Mencin, Kociper, Tomšiè in Lampret."
23,Moram povedati naslednje: èe danes ne bomo sprejeli tega zakona (jutri Zbor združenega dela ne dela) - gre za oba zakona - nismo naredili niè.
20,"Jutri Zbor združenega dela nima predvidene seje in zato apeliram na vse, ki odhajate oziroma nameravate oditi, da to upoštevate."
9,"To smo že tedaj predlagali, pa ni bilo upoštevano."
6,Zardževanje dosežene ravni plaè deluje demotivacijsko.
0,.
19,"Usklajevalna komisija za zakon o praznikih bo pa ob 13. uri v sobi 209, tako, da na to raèunate."
4,Spoštovane poslanke in poslanci.
5,Sedaj smo se precej razredèili.
18,"Svobodni sindikati Slovenije odklanjamo vsak zakon, ki na administrativne naèin posega v interno delitev in plaèe v podjetjih."
29,"Ugotavljam, da so dobili po vrstnem redu glasove: gospod Nemaniè 26, gospod Polajnar in Šuklje 25, gospod Golobiè 21, gospod Tomažiè 19, gospod Magajna 18 in gospod Kreft 15."
8,"Mi smo obvešèeni, da ostala dva zbora delata."
13,"Ni sprejemljivo, da zakon velja za podjetja ne glede na doseganje poslovnih rezultatov."
77,"Tudi dejstvo, in tukaj je izvor vsega tega zla, da je od lanskega leta v enem letu, povpreèni osebni dohodek v gospodarstvu padel s 1.400 nemških mark (èe uporabim to primerjavo) na 400 nemških mark na današnji dan in ta trend se nadaljuje, je tisti izvirni greh vseh nezadovoljstev in seveda tudi abnormno visoke plaèe (v nekaterih kolektivih) posameznikov na eni strani in izjemno nizke plaèe veèine delavcev; tudi to je res in tega ni moè zanikati."
16,"Veljavnost celotnega zakona, ker gre za spremembo že veljavnega interventnega zakona, se podaljšuje do 31.3. 1992."
3,Oba zbora delata.
7,S tem smo zaèasno to toèko zakljuèili.
1,Hvala.
28,"Glede plaè strokovnih in menedžerskih struktur smo že opozorili (in praksa kaže, da smo imeli prav), da je predlagani mnogokratnik, ki je v zakonu sprejet 1 : 15, neustrezen."
30,"Zbor obèin je samo prekinil toèko in je šel na naslednjo toèko. (Še enkrat apeliram na vse, da ne govorite iz klopi, ker je potem ta magnetogram kot ugankarski priroènik.)"
12,"Dejstvo je, da zakon ima naslov Zakon o praznikih v Republiki Sloveniji."
11,Zveza svobodnih sindikatov je pripravljena strokovno sodelovati pri oblikovanju teh kriterijev.
17,"Polajnar, Tomažiè, Magajna, Šuklje, Golobiè, Nemaniè, Potoènik (to je že sedem èlanov), Kreft in še gospod Balažic."
21,"Zato predlagam, da tudi mi prekinemo, da nadaljujemo s to toèko jutri ob 10. uri, ker tako in tako nismo sklepèni."
40,"Mi smo rekli , da bi delali do sedmih; vendar sprašujem, glede na to, da je ena redkih priložnosti, da smo še sklepèni, ali smo pripravljeni malo potegniti èez sedmo uro in vsaj diskusijo konèati, da bi to toèko danes zakljuèili."
48,"Kajti preprièan sem - sedaj pa govorim o svojem osebnem preprièanju - da se je slovenska kultura, tisto kar bi tudi lahko imenovali posvetna kultura (èeprav so bili to ljudje, ki so bili duhovniki), pa tudi slovenska samozavest v modernem pomenu besede, nacionalna samozavest, rodila s protestantizmom, s slovenskim protestantizmom."
33,"Obenem predlagamo tudi spremembo doloèitve glede najvišje meseène akontacije pri pravni osebi, tako da se ta znesek ne more poveèati skladno z novim zajamèenih osebnim dohodkom, ki je bil sprejet za mesec oktober."
15,"Torej problem je tukaj, je velik, toda pomemben je tudi naèin kako se ga lotimo."
26,"Zakon namreè omejuje izplaèila v podjetjih, ki nimajo posebnih likvidnostnih težav in bi to lahko storila in to tudi pravzaprav v bodoèe v veèji meri izkorišèala."
31,"Res je, številni protesti in stavke delavcev, ki smo jim prièa v zadnjem èasu, kot enega izmed pomembnih, najpomembnejših razlogov nezadovoljstva, izražajo nezadovoljstvo zaradi osebnih dohodkov, predvsem seveda nizkih osebnih dohodkov."
22,Enako velja tudi za regrese in pa za letni dopust in pa za prepoved izplaèevanja drugih dajatev iz sredstev neposredne skupne porabe.
2,Hvala lepa.
10,"To smo sindikati zahtevali že pri sprejemu zakona, žal neuspešno."
25,Samo še eno obvestilo: jutri ob 12. uri bo Odbor za delo obravnaval ta zakon o plaèah in sicer v sobi 212 ob 12. uri.
58,"Zakon o spremembah in dopolnitvah zakona o izplaèevanju osebnih dohodkov predlagamo zaradi zaostrenih razmer v slovenskem gospodarstvu, ki na veèino podjetij delujejo zelo negativno in ponekod tudi otežujejo, drugje pa že onemogoèajo izplaèevanje osebnih dohodkov, medtem ko pa v drugih podjetjih zaradi svojega izjemnega položaja, velikokrat tudi monopolnega na trgu, lahko osebne dohodke oblikujejo na relativno visoki ravni."
86,"Mi smo neko stopnjo zaupnosti pri tem materialu opredelili prav iz takih zalogov, ki so že bili tukaj navedeni, torej, da ne bi prišlo pri tistih, ki lahko to naredijo, do izkorišèanja informacije v tem èasu in seveda, da ne bi prišlo do tega, da bi prav tisti, ki lahko zdajle eventualno dvigajo osebne dohodke (masa je takih, ki jih ne morejo) to izkoristili in jasno, naredili prav tisto, kar hoèemo prepreèiti, torej poveèati razpone oziroma razliko med tistimi, ki lahko in tistimi, ki ne morejo."
24,"Naslednji amandma je vložil gospod IGNAC POLAJNAR in sicer, da bi se vnesla nova alinea v 2. èlen, ""- 6. januar, dan svetih treh kraljev""."
37,"Na ta naèin bi se izognili temu, da bi si jaz moral zdaj ta trenutek izmisliti, kateri bi bil najbolj primeren datum za italijansko manjšino in bi bila ta pravica zagotovljena; je to simpatièna in koristna stvar."
41,"Velike razlike v plaèah, do katerih prihaja v zadnjem èasu, povzroèajo nezadovoljstvo med delavci, visoka izplaèila v nekaterih podjetjih oziroma dejavnostih so pa tudi eden od pomembnih razlogov za stavke in proteste delavcev, ki smo jim bili prièa v zadnjem èasu."
45,"K zakonu, ki ga odklanjamo v celoti, imamo tudi naslednje konkretne pripombe: iz zakona ni mogoèe oceniti posledic, kaj pomeni zamrznitev plaè 45 % nad povpreèjem gospodarstva glede na razlièno kvalifikacijsko strukturo zaposlenih v posameznih dejavnostih in podjetjih, in to glede na uspešnost oziroma neuspešnost poslovanja."
53,"Poleg tega pa so to, ali pa npr. binkošti, to so izraziti, uveljavljeni, ljudski prazniki, ki so svojo ljudskost, vrašèenost v narod dokazali s tem, da so preživeli tisoèletja, bi rekel, da ljudje niso delali na ta dan, tudi preživeli so zadnjih nekaj desetletij, posebno prvih po vojni, ker so jih skušali zatirati."
56,"Dejstvo je, da tam, kjer je za strojem sto ljudi in od tega jih je nekaj te vere, nekaj druge, nekaj pa nobene, je zelo težko delovni proces narediti tak, da bo paè omogoèeno enim, drugim in tretjim, da bodo prosti na tisti dan, ki je glede na njihovo versko preprièanje v bistvu dela prost dan."
36,"To je 4. èlenu se doda drugi odstavek, ki se glasi: ""Ne glede na prejšnji odstavek, pa do konca leta 1991 kot dela prosti dnevi veljajo dnevi doloèeni v zakonih iz prejšnjega odstavka."" Liberalno-demokratska stranka vztraja?"
27,"Èe ima zakon namen kaznovati monopole, je ta pristop napaèen, saj se monopol ne odpravlja z zamrzovanjem plaè, ampak z odpravo vzrokov monopolnega položaja pri pridobivanju dohodka."
59,"Komisija za varstvo okolja in naravne dedišèine predlaga zboru, da umaknemo z dnevnega reda današnje seje poroèilo o jedrski varnosti pri obratovanju jedrskih objektov v letu 1990. - Komisija je na seji 18.11. 1991 obravnavala dopolnilno mnenje o naravnih danostih lokacije Nuklearne elektrarne Krško in v zvezi s tem stališèa prof. Sergeja Bubnova, ki jih je posredovalo Ministrstvo za energetiko."
80,"Mi ugotavljamo, da bi redni postopek iznièil prièakovane uèinke tega zakona; ker za vse druge redne postopke, tako pri pripravljanju ekonomskega in socialnega programa za drugo leto, kot za pripravljanje pravil ravnanja razliènih socialnih partnerjev (èe temu tako reèem, tudi države) in ravnanje na posameznih conskih podroèjih, mi pripravljamo poseben ekonomski in socialni program in v okviru tega bomo dolgoroèneje (to se pravi tudi za naslednje leto) doloèili neka pravila ravnanja, v katera upamo, da se bodo vsi drugi vkljuèili."
34,"To je, da se doda nova druga alinea k 2. èlenu, novi drugi odstavek v katerem bo pisalo: ""Na Martinovo, 11. novembra, imajo vsi zaposleni pravico, da si vzamejo ena dan plaèanega letnega dopusta."""
46,"Jaz sem o tem že govoril na tem mestu, da so trije kralji praznik, ki ima zelo veliko tudi narodopisnega, ki je prinesel zelo veliko narodopisnega izroèila in preprièan sem, da bi prav praznovanje svetih treh kraljev ponovno obudilo veliko tega izroèila, ki zdaj še spi."
44,"Izmed 40 pomembnih držav na našem planetu, za katere imam podatke, niti ena evropska niti ena ameriška država, nima dva dni praznika 1. in 2. januarja ampak samo 1., (celo Sovjetska zveza ima samo en dan), nekatere države pa ga nimajo tudi 1. januarja."
55,"Gre za doloèene krajše poèitnice - šolske poèitnice, èe jih lahko tako imenujem - pred tistim zadnjim zagonom šolskega leta, ker vemo, da imajo potem maja oz. do 3. ali 4. junija otroci še precej naporov pred seboj in da je to pomenilo neke krajše poèitnice od 27. aprila pa tja do 2. maja za te otroke."
54,"Videti je, da kršèanski demokrati veè razmišljamo o tem kako bi še veè praznovali, (moj kolega Žagar je govoril, da bi bilo treba manj praznovati), ampak vendarle naš prvi predlog je, da se slovenski kulturni praznik prestavi od spomina smrti Franceta Prešerna, na rojstvo Franceta Prešerna, se pravi z 8. februarja na 3. december."
67,"K tej toèki smo prejeli tudi amandmaje, ki so jih pisno predložili: Klub poslancev Socialdemokratske stranke Slovenije - v njegovem imenu gospod Matjaž Šinkovec, k 1. èlenu oziroma varianti amandma k 2. èlenu; Klub poslancev Socialdemokratske stranke Slovenije - v njegovem imenu gospod France Tomšiè, k 4. in 5. alinei 1. èlena; gospod Anton Tomažiè k prvemu odstavku 1. èlena k 3. alinei in amandma za novo 6. alineo."
51,"Samo je pa malo tu karikirano, da je zdaj 25 prazniènih dni; dejstvo je, da tisti, ki nek most naredi, naredi to na raèun svojega dopusta (èe gre tam med 27. aprilom in 2. majem, pa èe gre to med božièem in novim letom pa ravno tako na raèun svojega dopusta)."
47,"Res bi apeliral, èe nimate kakšnih hujših obveznosti (kot domaèe obveznosti), da bi vzdržali, kajti iz èisto operativnih razlogov bi morali mi ta zakon danes sprejeti (zaradi objave in zaradi 29. novembra itn.) Ostala dva zbora zdaj delata zakon o plaèah, kar naj bi tudi danes predelali."
39,"Republika Slovenija ima kot samostojna država mnogo veèje možnosti, da navzven in sebi pokaže visoko kakovost nekaterih vin, kar je bilo doslej nemogoèe v senci povpreènih jugoslovanskih vin, ki so se v masi in poceni prodajala v tuje dežele."
32,"Menimo, da predlagani pristop ni ustrezen, vendar bi v sedanji gospodarski situaciji sindikati sprejeti rešitve, ki bi temeljile na doloèitvi zgornje meje izplaèila osebnih dohodkov glede na kolektivne pogodbe gospodarstva in negospodarstva."
38,"In vprašanje je bilo: ali 23. ali 26. december - to se pravi, ali dan plebiscita (tista nedelja, ko smo glasovali na volišèih), ali 26. december, takrat ko je bil plebiscit razglašen - in tu je bila opredelitev: 26. december."
101,"Se bo morda na referendumu vprašanje manipulacije glasilo takole: ""Ali ste za pravièno privatizacijo in za brezplaèno razdelitev delnic?"" Vsled tega (širše ne bom elaboriral) v okviru te poslanske pobude, kot sem že rekel, že na tem mestu podpiram pobudo, ki jo je podala v javnost Socialistièna stranka Slovenije, hkrati pa seveda dodajam, da je potrebno to izkoristiti za široko razpravo o odgovornosti vlade in za temeljit pretres zgrešenih dejanj Peterletove vlade, tudi predvsem okrog lastninskega paketa, saj bi samo tak naèin razprave odgovornosti nudil konstuktivno popotnico za naprej kakšni drugi vladi ali vladi, ki bi bila izbrana na naslednjih volitvah."
42,"Tako da se mi zdi, da to res ni tak bistven razlog, je pa popolnoma pragmatièen razlog. 8. februar se podeljujejo - vsaj doslej so se - Prešernove nagrade in nagrade Prešernovega sklada, ki so za nekako za minulo ali za dne minuli leti."
60,"Stvari, ki se dogajajo na denarnem podroèju terjajo odgovoren pristop in glede na to, da smo kot poslanci odgovorni za situacijo na tem podroèju, ker je tako Svet banke kot tudi Izvršni svet neposredno odgovoren prav tej skupšèini, menim, da je te stvari, zaradi trendov na tem denarnem podroèju, treba nemudoma uvrstiti na dnevni red in obravnavati na naši skupšèini."
99,"Pobuda Kluba poslancev Socialdemokratske stranke Slovenije: glede na vse veèje število brezposelnih v Republiki Sloveniji, ter s tem v zvezi z vse slabšim socialnim in materialnim položajem nezaposlenih predlagam, da naredimo prvi manjši korak, sicer niè revolucionarnega, vendar nekaj kar je v Evropi nekaj vsakdanjega in sicer, da vlada Republike Slovenije prouèi možnost javnega priporoèila podjetjem oziroma ustanovam, da naj bi vsem nezaposlenim državljanom Republike Slovenije s potrdilom pristojnega zavoda za zaposlovanje, da bi bili vsi ti upravièeni do popusta pri nakupu raznih vozovnic, vstopnic in podobno, tako kot to velja za dijake, študente, upokojence, invalide in podobne kategorije."
49,"Za opravo neopravièenih razlik pri osebnih dohodkih so se v letošnjem letu pogosto zavzemali tudi delegati vseh zborov Skupšèine in Izvršni svet je prouèil možnost za drugaène ukrepe v smislu davènih restrikcij, ki bi bili sicer bolj smiselni, vendar je to nemogoèe storiti prej kot s prièetkom novega lega."
35,"V 1. èlenu se peta alinea spremeni tako, da se glasi: ""25. in 26. junij, dan državnosti."" Amandma gospoda Tomšièa; vstraja pri tem, to se pravi da se 25., ta dan državnosti, praznuje dva dni."
62,"V nekaterih demografsko ogroženih obèinah, konkretno v Slovenski Bistrici ugotavljajo, da vlada moèno zamuja s plasmaji teh sredstev in da sploh nima nikakršne informacije o njihovem dejanskem obsegu, niti o tem kateri projekti so glede na zakonske pogoje podprti in kdaj bodo prišli na vrsto tisti, ki do sedaj še niso dobili nobenega odgovora, pa so v zakonskem roku priglasili svoje projekte."
76,"Zato predlagam, da vlada takoj pripravi, v sodelovanju z Banko Slovenije, program za financiranje potrebne kmetijske proizvodnje - raje bi videl, da je to s kakšnim drugim instrumentom kot s primarno emisijo - in da naj Banka Slovenije po možnosti prilagaja dinamiko prehoda na nove kvote postopoma in skladno z dinamiko vraèanja odobrenih kreditov v kmetijsko proizvodnjo, ki se odvija po naravnih ciklusih proizvodnje - recimo: od setve do žetve, od priveza do zakola, od sajenja do pobiranja, itn."
52,"Zdaj sta po moje dve možnosti, èisto proceduralno gledano: ali da prekinemo glasovanje in poèakamo na opredelitev Izvršnega sveta, ali da glasujemo in èe je amandma izglasovan, seveda naroèimo, da se odloèitev Izvršnega sveta pridobi do usklajevanja, kajti usklajevanje bo prav gotovo potrebno, ker v drugih zborih ni bil vložen ta amandma."
78,"Vse drugo se pa briše ven in v tem pogledu se tudi vnaprej nisem strinjal tudi že s tem dnevom proti reformacije, èeravno se mi zdi, da je obrazložitev za njega še najbolj, kakor bi vi rekli, slovenska, ker je vezana na to, na razcvet slovenske kulture v tistem letu; ko je bila (kakor je zdaj sicer sporno) protireformacija, je bilo najveè knjig, - potem je veljal èrni mrak zelo dolgo èasa, (o tem bi kdaj drugiè lahko govorili)."
43,"Najvišja meseèna akontacija ne sme presegati 106.500,00 SLT, to je bruto plaèa, v kolikor izhaja iz do sedaj veljavnega zajamèenega osebnega dohodka in to dejansko pomeni znižanje (pogosto kritiziranega) razmerja med najnižjo in pa med najvišjo plaèo od 1 : 15 na 1 : 11."
69,"Èe boste prebrali oziroma, èe ste prebrali èlanek dr. Branta, ste lahko videli, da gre za zelo pomemben institut, hkrati pa kot neke vrste vprašanje, pobudo, dajem tudi v razmislek oziroma sprašujem, ali pri vladi deluje kaj podobnega, kar bi bilo mogoèe imenovati, recimo center za strateške analize ali kaj takega, se pravi neko telo, ki bi delalo znanstvene analize na podlagi katerih bi lahko vlada predlagala kakšne odloèitve."
61,"Edini amandma, ki mu ne nasprotuje je 3. december, Prešernov dan (skratka ne glede na to, kakšen status je imel pesnik takrat, še ne pesnik, ampak samo dojenèek); to so skratka stvari, ki smo jih pripravljeni sprejeti in ne bomo nasprotovali (glede na to, da veliko držav res praznuje sreène dogodke, to je pa rojstvo in ne smrt, kot bolj morbidno)."
57,"Mi smo slišali prej besede lepe, zakljuèimo stare rane in razprtije in tako dalje, in zato se nam zdi veliko bolj primeren datum 27. junij, ker je na ta dan letos slovenski narod pokazal svojo enotnost in odloènost v pogumnem uporu zoper sovražno jugoslovansko vojsko, okupatorsko, katera je skušala prepreèiti samoodloèbo slovenskega naroda in neodvisnost Republike Slovenije."
64,"Jaz bi samo predlagal, èe bi lahko poèakali nekaj trenutkov (ker me je paè presenetila ta zadeva, prijetno presenetila) in bi jaz enostavno oblikoval amandma na naèin, da bi nekako tako rekli, da narodne skupnosti imajo pravico do lastnega kulturnega dneva in torej tudi pripadniki te narodne skupnosti imajo pravico, da tisti dan ne gredo delat v te ustanove, ki so namenjene narodni skupnosti."
106,"Takšno opredelitev dela prostih dni, paè izhajajoè iz filozofije, ki jo je zasledoval predlagatelj, zanemarja ne samo veèkonfesionalnost v Sloveniji, temveè tudi deklarirano enakopravnost, predvsem evangelièanske verske skupnosti, kar se kaže v tem, (kar je bilo tu že reèeno), da je predlog popolnoma obšel 31. oktober, dan reformacije, kot najveèji praznik evangelistov. predlagam zato, da v skladu z naèelom veèkonfesionalnosti in enakopravnosti, pa tudi v skladu s tem, da pravzaprav dan reformacije ni samo verski praznik, ampak da je pomemben tudi v kulturni zgodovini, zgodovini Slovencev, da se izenaèi oba pomembna praznika, zato predlagam, da se v drugem èlenu doda nova alinea "" - 31. oktober, dan reformacije."""
72,"Pripadniki teh verskih skupnosti imajo pravico na ta dan dobiti dela prost dan, ki se jim ne šteje v redni letni dopust."" Smisel tega predloga je na dlani, namreè veliko je verskih skupnosti v Sloveniji in vsi ljudje, ne glede na to kakšne vere so, imajo po mojem mnenju enako pravico do praznovanja tistega praznika, ki se njim zdi najbolj pomemben, vsaj en dan v letu tako, da so takrat dela prosti."
85,"In javil sem se za besedo pravzaprav zato, ker bi rad izrazito podprl predlog gospoda Šukljeta, in to ne samo iz teh razlogov, ker na ta naèin simbolièno (da tako reèem) potrdimo tudi to, da je Slovenija veè verska skupnost ali družba (in res je, da je protestantizem pri nas na nek naèin avtohtona vera) paè pa se mi zdi, da bi s takim praznikom, z dnevom reformacije, na nek naèin pripeljali v to zavest praznovanje tudi vse to, kar so naredili Trubar, Bohoriè itn."
