101,"Na vztrajanje kar, moram reèi, veèine èlanov komisije, smo predlagali dodatni sklep, ki eksplicitno potrjuje tisto, kar je v obrazložitvi, ki ste jo prejeli glede sprememb obeh zakonov, ki je obravnavana na 7. strani, in sicer, da bo Izvršni svet oziroma sklep naj bi se glasil: tega pa še nimam v pisni obliki - Izvršni svet naj skladno s spremembo in uresnièitvijo zakonov o osebnih dohodkih v državnih organih zagotovi poveèanje obsega sredstev za financiranje družbenih dejavnosti, spremni naj kalkulativne elemente za vrednost programov oziroma poveèa osebne dohodke v tistih primerih, ko je financiranje urejeno na podoben naèin, kot za državne organe."
56,"Vendar glede na to, da nam je bilo pojasnjeno, da je bil nateèaj, da so se zbrali vsi ti simboli in da je bilo tudi arhitektu, ki je to kreiral, podano s strani ustavne komisije paè, kakšno vsebino naj ta dva simbola predstavljata, in glede na to, da je on to popravil in izoblikoval tudi vsebinsko."
72,"Pa bi prosil kolegico Lonèarjevo, da pove: prviè, kakšno vlogo je tukaj odigrala stroka v zadnji fazi, se pravi Društvo oblikovalcev, ki je bilo pred èasom povabljeno kot tisto telo, ki naj bi dejansko svojo odloèilno besedo povedalo, z vsemi temi heraldiènimi zadev ami, in drugiè, kako si vi v komisiji predstavljate tisto salamonsko rešitev, da bi taka zastava eventualno paè lahko veljala do nove ustave, se pravi, da je vse odprto."
70,"Zdi se, da bi kazalo, da ne bi vsak izobešal isto državno zastavo v razliènih dimenzijah, dopolniti 2. èlen tega sporazumnega predloga s tem da je višina - ne vem, se je treba dogovoriti - ena šestina dolžine zastave in da je grb oddaljen od roba zastave, tudi to je treba opredeliti, potem je pa za vse to toèno, natanko opredeljeno tukaj, kako se riše grb, potem je tudi zastava natanko opredeljena."
87,"Jasno, s tem se pa ugotavlja, da prihaja do forsirane prodaje in istoèasno do izpada dohodka ostalih knjigotrških podjetij v Sloveniji, ko namreè cene osnovnošolskih uèbenikov niso nikjer drugaène oz. so v Sloveniji izenaèene, gre pa za posebne pogoje prodaje, ki se skozi razno razne naèine prodaje teh osnovnošolskih uèbenikov izvaja, vendar s takim posegom dejansko prihaja do neke vrste monopolnega položaja Državne založbe Slovenije na slovenskem tržišèu in seveda zaradi tega tudi prihaja do podrejenega položaja ostalih knjigotrških podjetij in seveda do izpada doloèenega dela dohodka."
97,"Ker smo glede skupnega osamosvajanja z Republiko Hrvaško tega prav v vsem sporazumeli z Republiko Slovenijo tudi o naèelih, da Slovenija in Hrvaška skleneta zvezo suverenih držav, vanjo pa se lahko vkljuèijo vsi, ki sprejmejo ta pravila itn., bi seveda zastavil vprašanje Izvršnemu svetu Skupšèine Republike Slovenije, prav tako Predsedstvu Republike Slovenije in slovenski delegaciji, ki je bila v soboto na tem sestanku skupaj s Hrvati, ali trditev dr. Domljana drži, in èe drži, kdo se je dogovarjal s predstavniki Hrvaške o zvezi suverenih držav po osamosvojitvi in zakaj seveda o tem ni obvestil Skupšèino Republike Slovenije."
85,"Drugi odstavek tega 1. èlena, ki ga je takrat, ko je bil ta zakon sprejet, sooblikoval Republiški sekretariat za pravosodje in upravo, ker sicer je bil nosilec za sprejem zakona, za pripravo zakona Sekretariat za kmetijstvo, gozdarstvo in prehrano, za drugi odstavek je pa prispeval Republiški sekretariat za pravosodje in upravo, in sicer v tem smislu, da je želel varovati tudi druge nepremiènine, ne samo tiste, s katerimi upravljajo kmetijske organizacije, torej kmetijska zemljišèa in gozdove, ampak tudi druge nepremiènine, s katerimi upravljajo družbenopolitiène skupnosti."
79,"Tisto je èisto jasno, da se tisti rok, ki bo potekel konec junija, da se podaljša in ta je èisto logièen, ni mi pa popolnoma jasno, kaj pomeni amandma delovnih teles in bi lepo prosil, èe se tisti stavek v celoti preèita, ne samo z vejico, pa se še nekaj èrta, in to bi želel, da se zdaj zagotovi, da bo to vsebina celovitega tistega èlena, ki jo delovna telesa predlagajo, da se to reši pred odloèitvijo za postopek."
75,"Roki, s katerimi so bile varovane, te pravice, vis-a-vis teh upravljalcev s temi nepremièninami, je potekel 31. decembra lanskega leta in je bila ta varovalna doloèba nekako nadomešèena s spremembo zakona o kmetijskih zemljišèih, ki ste jo v Skupšèini sprejeli - to spremembo zakona kmetijskih zemljišèih - v letošnjem januarju in je bila objavljena v Uradnem listu št. 5 letošnjega leta, tako da tega ne bi sedaj ponavljal in se ne bi izgubljal naprej v ostalih doloèbah."
139,"Namreè, s tem zakonom o denacionalizaciji je predvidena oziroma je sprejeto naèelo, da naj bi se v okviru denacionalizacije v prvi vrsti vraèala v naravi, torej tiste nepremiènine, oziroma premoženje, ki je bilo posameznikom podržavljeno na razliène naèine, in to iz dveh razlogov: po eni strani naj bi se varovalo korist te republike, da ne bi bilo potrebno tam v tistih primerih, kjer ni mogoèe vrniti stvari v naravi, da se ne bi torej zaradi tega poveèeval fond družbenih sredstev za plaèilo odškodnine bodisi v gotovini, bodisi v obveznicah, ker tudi za obveznice je potrebno imeti kritje, kot tudi zaradi samih prejšnjih lastnikov, ker marsikomu pomeni stvar sama, èe dobi stvar v naravi denacionalizaciji veè, kakor pa da dobi nek papir, v okviru katerega bo in s katerim bo enkrat uveljavljal torej pravice v obliki denarja, torej za izplaèilo."
