4,Se je kdo vzdržal?
13,"Zavedati se pa moramo, da smo nekaj s tem v zvezi že sprejeli."
38,"To možnost vsak predlagatelj ima in priporoèam, da je obilno koristite. nadalje prosim, da v primeru, da bi sluèajno preskoèili kak amandma, ker se pri tej množici lahko zgodi, prosim, da na to opozorite, najbolje kar predlagatelj sam."
27,"No, potem je glede prvega odstavka in datuma samo še amandma v njem amandma Danijela Božièa, ki pravi: v prvem odstavku se datum 1.4.1991 spremeni v 1.6.1991."
32,"Tako da se ta del glasi: ""Nadzor nad strokovnostjo dela zavoda opravljajo z zakonom doloèeni strokovni organi."" Izvršni svet ne nasprotuje oziroma podpira tak amandma, Zakonodajno-pravna komisija pa meni, da ni potreben."
22,"Izvršni svet je povedal svoje mnenje, da je bil paè ta èlen umaknjen zato, ker je bilo v nasprotovanju v prvi fazi."
18,"Tako smo izèrpali vse toèke dnevnega reda 14. seje, razen zadnje, to so pobude, predlogi in vprašanja delegatov."
62,"No zaradi tega predlagam, d glasujemo najprej o amandmaju gospoda Danijela Božièa, ki pravi, da se za 70. èlenom doda 70.a èlen, ki se glasi: ""Višje in visoke šole in univerze, raziskovalne organizacije, ki so vkljuèene v univerzo ter raziskovalne organizacije, ki jih je ustanovila Slovenska akademija znanosti in umetnosti, nadaljujejo delo po dosedanjih predpisih."" Izvršni svet tega amandmaja ne podpira."
5,Ob 18.20 uri nadaljujemo sejo.
16,"Tako, ne bi bilo verjetno potrebno, da smo ta amandma sprejeli, ampak smo ga paè sprejeli."
8,"Ne vem, ali predlagatelj vztraja pri tem amandmaju?"
24,"Radi bi rekel zboru, da ni nujno poizvedovati, kdo predlaga kaj, ampak da bi veljalo kdaj tudi kakšno vsebino prebrati, pa tudi Izvršnemu svetu."
51,"Rad bi samo to rekel, da smo v 62. èlenu smo vkljuèili tudi RTV. najprej moram povedati, da se je Izvršni svet distanciral od tega, da se kar koli dodaja v 1. èlenu, ko je šlo za invalidsko varstvo in je to bilo sporno, potem pa ni bilo sporno vstaviti RTV."
9,"Ugotavljam, da je predlog zakona z veèino glasov sprejet."
14,"Tudi tisti del, ki ga niste citirali: ""na obmoèju, katere je bil uveden samoprispevek""."
6,Je pa še nekaj drugih stvari.
3,Je kdo proti?
10,"Gre pa za položaj mariborske inštitucije, koprske inštitucije in radiotelevizije."
40,"Samo to bi še rad povedal, tako kot je gospod Svete v ekspozeju in pri pojasnjevanju tudi povedal: da je pri univerzi èakamo - 25. maja bo tri leta - da predloži teze za svoj zakon, ker je tak mandat tudi dobila."
11,"Prosim lep, naj bo 10 minutna, takoj nato bi pa nadaljevali."
1,Hvala.
12,"Ne nasprotujem, ampak držim roko že od prej, ko ste zakljuèevali toèko."
28,"To je vmesno po mojem mnenju tudi zaradi tega, ker so bile mnoge pobude, predlogi, vprašanja dani v pisni obliki že na prejšnji seji in med današnjo sejo."
80,"So pa nekateri defekti, ki niso vsebovani v besedilu in zato je moj predlog v tem smislu, da se tisto, kar je federacija do zdaj urejala, gre za neke malenkosti, neke olajšave, ki so jih imeli invalidi, ki jih pa sam nikoli nisem uporabljal, ampak pri uvozu avtomobila, pri plaèilu carine in pri prometnem davku, da se to restavrira, ker so me obvestili pisno, mislim, da je mariborsko invalidsko društvo, da je federacija te olajšave v nekem zadnjem aktu ukinila."
52,"V Avstriji pa lahko zvezni minister za gospodarstvo v primerih, ko je eno ali veè podjetij izvršilo povišanje cen, ki ni bilo po njihovem mnenju gospodarsko potrebno ali pa zaradi znižanja surovin, ni izvedlo znižanja cen konènih izdelkov, da lahko v teh primerih doloèi za trajanje najveè šest mesecev ekonomsko upravièeno ceno."
2,Hvala lepa.
25,"Danes oziroma èe bo ta zakon sprejet, ste pa že vse uredili in zaukazali, tako da svet RTV pravzaprav nima veè tu kaj dosti tuhtati."
19,"Èe ni nasprotovanja k združitvi obojnih pobud, z obojih sej, bi jaz najprej odredil krajši odmor po napornem glasovanju."
37,"Tako da ti eksperimenti oziroma teh ekskurzij v neko namišljeno avtonomijo univerze, ki jo jaz po vsebini poskušam dojeti, ki pa ni gotovo nedoloèena tako, kot bi se reklo, da je dobro razumemo vsi enako težko, razumem."
26,"Mislim, da smo že, ker smo se od 70.a vrnili na 70., pri èemer ga je potem predlagatelj umaknil, ker ni imel ve posebnega smisla."
21,"Da preberem še tega: ""V drugem odstavku se za besedami: ""ki je ustanoviteljica zavoda"" doda besedilo: ""v soglasju s svetom zavoda."""
53,"Najprej je to amandma Kluba delegatov SDP, ki pravi, naj se èrta prvi odstavek 6. èlena, drugi odstavek pa postane prvi odstavek in doda se nov drugi odstavek, ki se glasi: ""V zakonu o univerzah so lahko posamezna vprašanja iz tega zakona urejena drugaèe."" Izvršni svet, kot smo slišali, tega amandmaja ne podpira."
66,"Jaz ne bi niè veè pojasnjeval tistega, kar je že zapisano v stališèih Izvršnega sveta do posameznih do vèeraj vloženih amandmajih, ker tam notri je zajeto tudi nekaj predlogov, ki so bili Izvršnemu svetu že znani, ker so bili paè na delovnih telesih skupšèine predloženi in jih je Izvršni svet tudi obravnaval, ker je paè prièakoval, da se do današnjega dne še lahko preoblikujejo v amandmaje."
7,"Besedo ima gospod Svete, predsednik Izvršnega sveta."
57,"To je nekaj drugega, vendar 6. èlen sicer v pogojih nekih izrednih razmer, pa daje državi ingerenco oblikovati izhodne cene ekonomskih subjektov podjetij, njihovi asociaciji v sleherni možni obliki, kar je po mojem v neposrednem nasprotju s konènim ciljem zakona o privatizaciji, ki postavlja doloèanje cen in ekonomsko racionalno obnašanje tistih, ki so lastniki kapitala in upravljalci."
78,"Imamo dva amandmaja k 63. èlenu, najprej amandma Odbora za delo, zaposlovanje in socialno politiko, ki pravi: doda se nov tretji odstavek, ki se glasi: ""Delavci delovne organizacije ali temeljne organizacije združenega dela lahko predlagajo ustanovitelju, da se delovna organizacija ali temeljna organizacija združenega dela v njeni sestavi organizira kot podjetje, èe pretežni del celotnega prihodka pridobiva s prodajo blaga ali storitev na trgu."" Zakonodajno-pravna komisija meni, da amandma ni potreben, Izvršni svet pa ne nasprotuje temu amandmaju."
45,"Gre za vsebinska vprašanja in zaradi tega, èe drugi zbori ne bodo sprejeli ali pa, èe kakšen zbor ne bo tega sprejel, predlagam, da se temeljito prouèi, kakšne posledice prinaša ta avtomatizem, ki je tu vnešen, potem kot se prebere iz 62. èlena drugi odstavek."
15,"Samo drobižek bi dodal, usklajevalcu oziroma opozoril bi zbor ob zakonu, ki smo ga sprejeli."
30,"Naslednji amandma je amandma gospoda Danijela Božièa, ki pravi: prvi in drugi odstavek se èrtata in nadomestita z besedilom: ""Direktorja javnega zavoda imenuje in razrešuje svet zavoda s soglasjem ustanovitelja."
35,"Nato imamo amandma Kluba delegatov SDP, ki pravi: ta èlen se preoblikuje, tako da se glasi: ""Direktorja imenuje in razrešuje svet zavoda, k imenovanju in razrešitvi daje soglasje ustanovitelj."" Izvršni svet tega amandmaja ne podpira."
17,"Zakonodajno-pravna komisija ne nasprotuje, vendar naj opozorim, da se izkljuèuje ta amandma z amandmajem gospoda Danijela Božièa."
93,"Izvršni svet je na sinoènji seji obravnaval tudi vse do takrat prispele amandmaje, pa tudi predloge, ki še niso dobili oblike amandmajev, za spremembe oziroma dopolnitve tega predloga in je podprl amandmaje Zakonodajno-pravne komisije razen tistega, ki se nanaša na vprašanje ustanavljanja javnih zavodov po narodnostnih skupnosti, ker je tam podprl amandma delegata Roberta Battellija za spremembo 3. èlena, ki se nanaša na ustanavljanje zavodov po narodnostnih skupnosti, podprl je tudi amandma Odbora za raziskovalno dejavnost k 32. èlenu, amandma Odbora za delo, zaposlovanje in socialno politiko k 50. in k 63. èlenu."
33,"Imamo en amandma, to je amandma Zakonodajno-pravne komisije, ki pravi: besedilo devete alinee se spremeni, tako da se glasi: ""Doloèbe o odgovornosti ustanovitelja za obveznosti zavoda."" Izvršni svet k temu amandmaju ne nasprotuje."
56,"K istemu 44. èlenu imamo amandma Kluba delegatov SDP, ki pravi, da se ta èlen dopolni z drugim odstavkom, ki se glasi: ""Èe direktor oziroma svet zavoda ne upošteva predloga ali mnenja strokovnega sveta, ta lahko zahteva, da o spornem strokovnem vprašanju sprejme stališèe pristojni strokovni orga na ravni republike."" Izvršni svet tega amandmaja ne podpira."
54,"Glede na to, da imamo na dolgu še nekatere zadeve iz 13. seje zbora, ki je bila 5., 6. in 7. marca in ker nam je tudi iz te seje preostala toèka pobude, predlogi in vprašanja delegatov, predlagam, da to toèko dnevnega reda z obeh sej združimo in jo obravnavamo na koncu današnjega dela."
34,"Ta predlog je povezan z novim 70.a èlenom v celoti oziroma visoko šolstvo v celoti iz zakona o zavodih, potem je logièno, da se ta odstavek èrta, ker je nepotreben v takem primeru."
43,"K 38. èlenu imamo amandma Odbora za raziskovalno dejavnost in tehnologijo, ki pravi: doda se nova šesta alinea, ki se glasi: ""Èe na osnovi strokovno utemeljenih negativnih ocen kakovosti dela direktorja ugotovi, da je delovanje zavoda ogroženo."" Izvršni svet tega amandmaja ne podpira."
68,"Drugo, kar bi rad povedal glede na vprašanje oziroma diskusija gospe Vike Potoènik, ker sem že v uvodnem govoru prej povedal, da smo v našem sekretariatu izhajali iz tega, da smo najprej preštudirali, kaj so naši predhodniki naredili in smo potem na osnovi tistega, kar so oni naredili, zadeve prouèili še enkrat, jih predelali in normirali na novo stanje in iz tega stanja zdaj izhajali z novimi predlogi."
88,"Na podlagi razprave, v kateri je odbor po veèinskem mnenju podprl uveljavitev veèje avtonomnosti stroke pri odloèanju o strokovnih vprašanjih in opravljanju dejavnosti v zavodih, je odbor oblikoval naslednje amandmaje: k 32. èlenu se doda nov tretji odstavek, ki se glasi ""Èe poslovodna funkcija in funkcija vodenja strokovnega dela zavoda nista loèeni, imenuje in razrešuje direktorja ustanovitelj oziroma svet zavoda ob soglasju strokovnega sveta zavoda, èe z zakonom ali aktom o ustanovitvi ni drugaèe doloèeno."" Sprememba je torej v tem, da je treba dodati soglasje tudi strokovnega sveta."
49,"Hkrati je ta zaèasen v toliko, ker še ni podroène zakonodaje, ki bo ta zakon dogradila in rodila zavode na posameznih podroèjih in v toliko zaèasen in zaèasen v tem, da uvaja neki prihodnji režim do nove zakonodaje, ni pa mišljeno v smislu nekega zaèasnega ukrepa kot državne intervencije."
31,"Dajem na glasovanje amandma Danijela Božièa, ki pravi naj se ta èlen preoblikuje, tako da se glasi: ""Direktor javnega zavoda se imenuje na podlagi javnega razpisa."" Izvršni svet tega ne podpira."
36,"Tu je predviden za splošni rok za imenovanje direktorjih v zavodih 3 mesece, za šolske zavode pa do konca letošnjega šolskega leta. medtem, ko amandma Ivana Vivoda ima rok treh mesecev za vse, tudi za šole."
41,"V 70. èlenu v drugem odstavku se za besedami ""ki je ustanoviteljica zavoda"" doda besedilo ""v soglasju s svetom zavoda"". ker menimo, da je tudi v teh primerih nujno, da se uzakoni veèji vpliv sveta zavoda na imenovanje in razreševanje direktorja."
61,"Ugotavlja, da je amandma z veèino glasov sprejet. nato imamo en amandma k 20. èlenu, oprostite, k 23. èlenu imamo amandma Zakonodajno-pravne komisije, ki pravi: ""Drugi stavek drugega odstavka se spremeni, tako da se glasi: ""Tak zavod ima glede opravljanja javne službe pravice, dolžnosti in odgovornosti javnega zavoda v nadaljnjem besedilu zavod s pravico javnosti."" Izvršni svet ne nasprotuje temu amandmaju."
85,"Predlog je, da bi v tem primeru svet zavoda predlagal in ustanovitelj imenoval oziroma razreševal direktorje in dal soglasje k temu sklepu sveta zavoda. kolikor sem pogledal, Zakonodajno-pravna komisija sicer meni, da bi peta alinea pokrivala tudi to, vendar mislim, da peta alinea pokriva druge zadeve, torej tam, kjer gre za nevestno dejanje in za dejanje, ki ni take narave, da bi direktor tega ne zmogel strokovno ali pa kakor koli drugaèe urediti in seveda menim, da ta zavrnitev s strani Zakonodajno-pravne komisije ni upravièena."
76,"Naj vas za toliko èasa, da dobite stališèe Izvršnega sveta, do prej oblikovanih in oddanih amandmajev na mizo in da dobite te danes vložene amandmaje, medtem pa raèunam, da bo lahko Izvršni svet - torej èe ne, kot celota pa vsaj njegovi predstavniki lahko ugotovijo, o nekaterih zadevah, ki so zdaj kot amandmaji vložene, se je nekje Izvršni svet v do sedanjem delu že opredelil in da vidimo, ali lahko na tej osnovi potem nadaljujemo z delom."
48,"Tretji odstavek naj se dopolni, tako da se glasi: ""Sestava, naèin imenovanja oziroma volitve èlanov, trajanje mandata in pristojnosti sveta se doloèijo z zakonom ali aktom o ustanovitvi oziroma statutom ali pravili zavoda."" O tem nismo glasovali in je nekoliko drugaèen od obeh ostalih amandmajev k temu èlenu."
20,"Amandmaje smo sprejeli, kolikor smo jih sprejeli, potrebno je, da glasujemo o predlogu zakona, skupaj s sprejetimi amandmaji v celoti."
55,"Statusne spremembe niso predvidene, povezovanje zavodov je zadeva, ki jo mora rešiti zakon o visokem šolstvu, prenehanje univerz najbrž ne pride v poštev, vpis v sodni register je napravljen, kazenske doloèbe se tièejo samo stvari, ki jih na univerzi ni mogoèe zagrešiti in prehodne in konène doloèbe so zadeve, ki jasno v tem primeru nima."
44,"V zakonu o ljudski obrambi piše, da se komandant teritorialne obrambe republike, to je sedaj mimo, ker smo mi teritorialno obrambo drugaèe uredili, ampak takrat je še ta zvezna zakonodaja veljala, da se komandanta teritorialne obrambe republike imenuje Predsedstvo SFRJ na predlog predsedstva republike."
39,"Poti, kako to doseèi, žal v tem trenutku niso še jasne in zato bi bilo po mojem mnenju manj škode, èe se pol leta porabi za to, da se to definira, in potem gre v spremembe, ki bodo pretehtane."
23,"To sem že veèkrat opozoril, pa bom moral še ponovno opozarjati, da gre na veliko neurejenost statusov - v bistvu gre za mesto Ljubljana."
29,"V bistvu se strinjam s tem, ker v bistvu je ta dostavek nepotreben, ker RTV tako in tako pade pod zakon o zavodih, avtomatsko, èe je omenjena ali ni."
46,"Smo pisali statute, 35 razliènih aktov je bilo potrebno, da smo lahko formalno oblikovali temeljne organizacije združenega dela z vsemi spori in tako naprej, ki so bili že takrat med, torej jaz sem bil sam in sem sam èlan ene od fakultet, ki je ena najveèja."
58,"Dokler ne bodo s posebnimi zakoni opredeljene javne službe in urejena vprašanja glede razpolaganja s premoženjem, ki je kot javna lastnina namenjeno za opravljanje javnih služb, ni dovoljena odtujitev ali sprememba namembnosti nepremiènin, ki po prvem odstavku tega èlena postanejo javna lastnina v upravljanju javnih zavodov in zavodov s pravico javnosti iz 2.odstavka 64. èlena tega zakona."
47,"Ves èas, to je 12 in veè let bijemo boj zato, da bi vsaj tisto bila univerza, kar je že nekoè bila. 25. maja 1988 leta so prve spremembe zakona o usmerjenem izobraževanju vrnile univerzi vsaj del tistega, kar je že pred zakonom o usmerjenem izobraževanju imela."
64,"Ta zakon pa omogoèa, da se z zakonom o univerzi vsa vprašanja glede univerze èisto drugaèe uredijo in že sedaj se zakon izrecno nanaša v tistih doloèbah, ki govorijo o upravljanju, se niè ne nanaša na univerzo, ker upravljanje univerze je urejeno v posebnem zakonu, ki se mu danes reèe zakon o usmerjenem izobraževanju, jutri pa se mu bo reklo paè zakon o univerzi."
71,"Seveda se ni mogoèe avtonomije razlagati tako, kot je verjetno malo v šali malo zares predlagal gospod Glaviè, ker to paè pomeni uporabiti tiste ugodnosti, ki jim zakon nudi, sicer pa biti povsem avtonomen. jaz mislim, da ima tudi ta zakon glede univerze dovolj novosti oziroma dovolj elementov avtonomnosti za samo univerzo, preprièan pa sem, èe ga zdaj izvzamemo iz tega zakona, da se bo preobrazba univerze vlekla še v nedogled."
50,"Nato imamo še amandma gospoda Senèurja, ki pravi: za drugim odstavkom se doda nov tretji odstavek, ki se glasi: ""Kadar je za imenovanje in razrešitev direktorja javnega zavoda pooblašèen ustanovitelj, daje k imenovanju in razrešitvi soglasje svet zavoda, èe z zakonom ni drugaèe doloèeno."" Izvršni svet ne podpira tega amandmaja."
65,"Koliko se ta zakon nanaša na univerzo Prviè, samo glede opredelitve, glede statusa, da je tudi visoka šola, fakulteta, akademija zavod, se pravi neprofitna organizacija, univerza pa skupnost zavodov, torej dotika se jo glede statusa in ta status tudi najbrž univerzi gre; in drugiè, dotika se je glede lastnine, ker po prihodnji doloèbi postane družbena lastnina tudi v upravljanju visokih šol, postna paè javna lastnina."
100,"Sam sem osebno zelo zainteresiran, da je to vprašanje javnosti in javnega pristopa k vsem tem informacijam omogoèeno tudi zaradi tega, èe se navežem na diskusijo gospoda Klavore, da prav zaradi tega ustanavljamo informativno službo, ki jih pravmo agencija in da s to informativno službo približamo vse pogoje, ki jih bo Izvršni svet dajal na osnovi tega zakona in na osnovi drugih zakonov, kot je zakon o demografsko ogroženih podroèjih, kolikor je zadeva na podroèju energetike, na podroèju zaposlovanja oziroma sekretariata za delo, na podroèju kmetijstva, sicer v bolj omejenem smislu, ampak tudi tukaj bi se nekatere informacije lahko dobile."
42,"Najprej amandma Odbora za zdravstvo, ki pravi, da se èrta besedilo ""doloèa strokovne podlage za programe dela in razvoja zavoda"" in nadomesti z naslednjim besedilom ""doloèa strokovne programe dela in razvoja zavoda z opredelitvijo prioritet izvajanja."" Izvršni svet tega amandmaja ne podpira."
70,"Prvi je amandma Odbora za zdravstvo, ki pravi: besedilo tega èlena se spremeni, tako da se glasi: ""Strokovnega vodjo imenuje in razrešuje strokovni svet zavoda, èe ni z zakonom ali aktom o ustanovitvi drugaèe doloèeno."" Drugi amandma je amandma Kluba delegatov SDP, ki pravi, da se besedilo tega èlena spremeni, tako da se glasi: ""Strokovnega vodjo imenuje in razrešuje strokovni svet zavoda po predhodnem mnenju sveta zavoda."" In tretji amandma."
60,"Drugi amandma k 32. èlenu je amandma Odbora za zdravstvo, ki pravi: doda se nov tretji odstavek, ki se glasi: ""Èe poslovodna funkcija in funkcija vodenja strokovnega dela zavoda nista loèeni, imenuje in razrešuje direktorja ustanovitelj oziroma svet zavoda ob soglasju strokovnega sveta zavoda, èe z zakonom ali aktom o ustanovitvi ni drugaèe doloèeno."" Izvršni svet tega amandmaja ne podpira."
82,"Drugo zadevo bi rad pojasnil, da peta alinea 4. toèke, ko govori o loterijskih sredstvih za financiranje invalidskih organizacij, bi rad povedal, da je v pripravi zakon o igrah na sreèo in da bo s tem zakonom tudi urejeno vprašanje nadaljnjega financiranja invalidskih organizacij, s tem se seveda popolnoma strinjam, da so ta sredstva invalidskih organizacij oziroma loterijska sredstva najbolj stabilen in najbolj siguren vir za delovanje invalidskih organizacij in upam in želim, da bodo tudi v bodoèe namenjena za te organizacije."
73,"In tretja zadeva, ki zadeva podroèje, vprašanje kvotnega sistema, to je na strani 3. Namreè, razmere v gospodarstvu so takšne, da je vse veè delovnih invalidov, za katere se zdaj ustanavlja invalidske organizacije, in ker nimamo tega kvotnega sistema ustrezno urejenega, torej nimamo te možnosti, bo treba z novim zakonom o usposabljanju in zaposlovanju invalidov, ki bo letos tudi predložen v skupšèini Slovenije, bo treba to vprašanje kvotnega sistema urediti v tem zakonu."
67,"To ravnotežje v tem trikotniku je tako pomembno za, bi rekel, uprosperiteto in za izboljšanje kvalitete in znižanje stroškov tega sistema javnega, da morda zasluži še par dni tehtnih razmislekov, èe smo dobili toliko teh zadev in bi morda tako, kot smo dobili pri nekaterih zavodih, spomnite se teh, ki so bili najbolj kritièni, smo èez en teden dobili lepo urejeno zadevo, prikazano tako kot se spodobi."
138,"Rešitve, take kot so tu, in oba amandmaja pravzaprav še vedno ne zadeneta zadeve v èrno in to je seveda razumljivo, kajti predlagatelj sam je napisal v obrazložitvi pod toèko 2.: ""V drugih državah nimajo splošnih zakonov o zavodih niti zakonov o javnih zavodih."" V tem je seveda problem, mi pa moramo preiti iz sistema samoupravljanja, ki je imel nekatere hibe, v drug sistem, ki bo te hib odpravil, hkrati pa ne bo zavrl tistega, kar je bilo pozitivno v tem sistemu in to je seveda neke vrste trikotnik med javnostjo, med državo in med izvajalci, kot smo jim mi rekli in v tem seveda nekateri amandmaji, zlasti okrog izvolitve in soglasja direktorja in tako naprej, izboljšujejo sistem, ki je bil zastavljen, mogoèe preveè v smeri enega ogljišèa od tega trikotnika in vzpostavlja ustrezno ravnotežje, ki je nujno."
106,"Upam, da boste Predlog za izdajo zakona obravnavali z vso resnostjo, da boste kritiko na ta zakon usmerjali benevolentno in da bo ta zakon sprejet èimprej, s èimer bi omogoèili Mladinskemu svetu Slovenije, da bo normalno kompetentno in upajmo tudi pošteno opravil svojo nalogo, za katero je bil ustanovljen s 17 èlanicami, med njimi, kot reèeno, nepolitiènih interesnih združenj mladih ljudi upa, da bo skupšèina razumela potrebo po takem zakonu, da bo tak zakon sprejet èimprej in da bo lahko Mladinski svet Slovenije zaèel in še veliko bolje nadaljeval svoje delo, zaradi katerega je bil ustanovljen in trdno sem preprièan, da so razlogi za njegov obstoj."
69,"Predlog za 70. a èlen imamo še, in sicer predlog, ki ga je v našem zboru dal gospod Ivan Vivot, torej za 70. èlenom naj se doda 70.a èlen, ki se glasi: ""Organi iz 69. in 70. èlena, pooblašèeni za imenovanje in razrešitve,realizirajo svoje pooblastilo glede prvih imenovanj v roku, ki ni daljši od treh mesecev od dneva uveljavitve tega zakona."" Izvršni svet ne podpira tega amandmaja."
98,"Tretja stvar pa, ki je, èe govorimo o mladinskem svetu, verjetno je tudi potrebno reèi, kako do tega mladinskega sveta pride, kdo pride vanj in kako pride z njega, seveda je v statutu mladinskega sveta doloèeno, vendar je doloèeno, tako da je praktièno organizacija, ki se znajde v njem in èe bi bil ta zakon sprejet, proraèunsko financirana preko posrednika mladinskega sveta, èe je v njem in dokler je v njem, ko preneha njeno èlanstvo, èe sama izstopi ali iz kakršnih koli drugih razlogov verjetno pade iz okvirja tega predloženega zakona in s tem seveda ostane brez sredstev."
149,"Zaradi tega, da ne bi tukaj ustanavljali neko organizacijo, ki bo sredstva dobila, jih delila ali pa tudi ne, slišal sem, da se po nekem predlogu predvideva kar 60% sredstev za delo administracije tega mladinskega sveta, tega podatka nimam èrno na belem, mislim pa, da obstaja, no èe je temu tako, potem praktièno tisti preostanek pride organizacijam. zaradi tega podpiram ta predlog, da mi zadevo obrnemo, pa da se naredijo, da pridemo do zakona o mladinskih organizacijah, ki naj bodo organizacije enakih, ki naj bi bile tukaj izkljuèno mladinski svet in ki naj zagotovi tem organizacijam na osnov ustreznih programov po doloèenih kriterijih sredstva in s tem zakonom je pa seveda lahko omenjen tudi mladinski svet ali mladinski sveti, s tem da se seveda pove, na kakšen naèin organizacija lahko enega ali veè takih svetov formira in tam seveda lahko tudi predvidi potem doloèena sredstva za delovanje takega sveta."
109,"Mislim, da je to neke vrste ne krona organizacije, temveè organizacija, ki inicira posamezne aktivnosti, recimo, tam je v nekem gradivu govora o tako imenovanem projektu o izmenjavi študentov v Evropi, kjer se prek te organizacije vzpostavijo ti potrebni stiki z insitucijami v Evropi, prenesejo vse to na èlanice in neèlanice, ker so tudi opazovalke in tako naprej, te organizacije in se potem dogovori o naèinu sodelovanja v tem evropskem projektu izmenjave študentov s tem, da posameznik plaèa na primer vožnjo, organizacija, kateri pripada, prispeva nekaj, ta pa morda dobi nekaj preko proraèuna - sredstva za vpisnino ali šolnino - ali kar koli je potrebno, da prisostvuje in ta program uresnièi."
79,"Mi imamo za to Zavod za statistiko, ki ga je treba opomniti, èe kakšne stvari ne ureja, ampak mi v èasopisu vedno znova slišimo, kako so te cene narašèale v eni drugi panogi in mislim, da ima ta zavod dovolj pregleda nad tem, kaj se dogaja, èe pa kdo misli, da potrebuje še kakšen podatek, naj se z zavodom dogovori za njega in se hkrati dogovori tudi za tiste podatke, ki jih ne rabi in ki jih je preveè."
72,"Izvršni svet že razmišlja, da bi zakon dopolnil s èlenom, ki naj bi se približno glasil tako, ker to še ni bilo verificirano na izvršnem svetu: ""Èe bi se zaradi sprejema ukrepov doloèitve cen iz 5. in 6. èlena zakona, èe bi se bistveno poslabšali pogoji poslovanja in trajneje in v veèjem obsegu zmanjšujejo dohodek in onemogoèa normalno poslovanje, se podjetjem in drugim pravnim osebam ter nosilcem samostojnega osebnega dela zagotovijo kompenzacije."
59,"Preden je ta TOZD postal TOZD, preden se je vkljuèil v neko delovno organizacijo, je bil sam delovna organizacija in je bil ustanovitelj tega TOZD-a nekdo drug, druga obèina, kot je ta ustanoviteljica delovna organizacija. zdaj je najbrž v teh primerih treba iskati soglasje obèin, èe je to treba eksplicitno tu povedati pa prosim, tudi ne nasprotujemo takemu amandmaju."
