14,"Prviè s tem, da ni zmanjšal davènih obremenitev na prehodu iz hiperinflacije v dezinflacijo."
13,"Tretjiè, poleg plaèilnobilanènih posledic je imela teèajna politika ZIS še dve pomembni posledici:"
15,"Strinjamo se, da je del tega neravnovesja nastal tudi zaradi negotovosti sprièo zaostrenih politiènih razmer."
5,Hvala lepa gospodu Anteju Markoviæu.
23,"Naš raèun kaže, da je za alimentiranje obresti državljanov, za plaèevanje njihovih zahtevkov, v tem letu treba zagotoviti 34 do 35 milijard dinarjev."
29,"Upam, iskreno upam, da bo Skupšèina Slovenije, v interesu slovenskega naroda in vseh drugih narodov v naši državi, dala pozitiven odgovor na vprašanje, ki ga pred njo postavlja zgodovina."
47,"On je povedal, da so pripravljeni, da èe bo program zvezne vlade imel podporo angažirati zaèenši od mednarodnega monetarnega fonda preko programa dolgov v pariškem klubu do (kakor je on povedal) novih sredstev, ki bi jih Evropska skupnost angažirala in s katerimi bi garantirala konvertibilnost jugoslovanskega dinarja."
10,"Morate vedeti, da ta svet zaseda enkrat na pol leta."
2,Hvala lepa.
12,Drugiè: teèaj dinarja je bil precenjen že v prvi polovici lanskega leta.
37,"Jaz sem res danes, mislim, da je mesec dni kar sem tu, ne èitam veliko, ampak prebral sem precej telexov, ki so šla iz kabineta podpredsednika vlade v Beograd, kjer je urgiral doloèene posege v gospodarski politiki."
4,Kaj je z valuto?
6,"Spoštovano predsedstvo, spoštovani poslanci in poslanke!"
27,"Mi imamo zelo jasne signale evropske skupnosti in sveta, da je navzoè proces spremljanja sprememb v Jugoslaviji in bi jih prav tako lahko uporabili pri našem odloèanju."
57,"Na tej predpostavki in z upoštevanjem sklepov, stališè in odloèitev Skupšèine Republike Slovenije o posameznih vidikih osamosvajanja Slovenije od sprejetja zakona o plebiscitu pa do danes, smo v vladi uresnièevali svoj del dgovornosti s pripravo potrebnih pravnih osnov in s soustvarjanjem gospodarskega ter potrebnega družbenopolitiènega okolja z vrsto aktivnosti v naši republiki, v Jugoslaviji in v tujini."
22,"Ta blokada sprememb v sistemu in njegove nadaljnje transformacije je ogromna, ekonomska in socialna in na žalost v zadnjem èasu tudi èloveška."
35,"Ob razliènih priložnostih smo gospodu Markoviæu kot predsedniku zvezne vlade povedali, da Slovenija ni pripravljena razpravljati o uporabi pravice do samoodloèbe, da pa je pripravljena na pogovore o tem, kako bo to svojo pravico uveljavila."
17,"To se pravi izraz ""ugaša"", mislim, da je to bolj kot prièakovati krizo šele èez tri mesece."
74,"Ob vseh teh zakonih, zlasti to velja za sprejete osamosvojitvene zakone, ki omogoèajo prevzem dejanske oblasti na obmoèju Republike Slovenije, moram vas - spoštovane poslanke in poslanci, verjetno pa še bolj gospoda Markoviæa, ki je danes gost v tej Skupšèini, spomniti, da je Slovenija v vsem dosedanjem procesu osamosvajanja ves èas poudarjala odprtost do nove jugoslovanske skupnosti in pripravljenost na sodelovanje (odprtosti v svet ne bi posebej poudarjal, saj je le-ta za Slovenijo razvojni imperativ)."
50,"Za svoje ukrepe ekonomske politike in slabe gospodarske rezultate v drugi polovici leta 1990, ter v prvem kvartalu letošnjega leta, navaja naslednje osnovne razloge: politiène razmere v Jugoslaviji in samostojno ukrepanje posameznih republik in nesprejetje predlaganih ustavnih amandmajev v celoti, ali vsaj tisti del, ki omogoèa minimalno funkcioniranje enotne države."
31,"Že v 1. fazi protiinflacijskega programa je prišlo do neustreznega ukrepanja in do globokih neravnotežij, ki so se sredi leta s preboji osebnih dohodkov in ponovno rastjo cen, le še poglabljali."
24,"Rešitve, ki jih v nekaterih primerih predlaga, so nekonsistentne glede na temeljne principe, ki jih je sam vseskozi poudarjal pri zagovarjanju svojih ekonomskih reform."
26,Mi smo se pogovarjali - bile so dostavljene iniciative od konfederacije do drugih variant dogovarjanja v okviru skupnosti suverenih držav - vendar do zdaj pravega odgovora ni bilo.
54,"V memorandumu smo opozorili zvezno vlado, da ni pravoèasno sprejela ukrepov, s katerimi bi zagotovila izvedbo programa gospodarske stabilizacije (s posebnim memorandumom smo že v avgustu 1990 opozorili zvezno vlado na odmike pri uveljavljanju programa in zahtevali korekcije, ki bi takrat, po našem mnenju, še mogle rešiti program, kar pa je zvezna vlada ignorirala)."
40,"Res je sicer, da so politiène konfrontacije v Jugoslaviji precej prispevale k zaostrovanju ekonomske krize v letu 1990, vendar pa z vraèanjem vse odgovornosti za sedanjo ekonomsko krizo na republike, ne more biti zadovoljiv odgovor na kompleksnost sedanje jugoslovanske stvarnosti."
42,"Druga posledica teèajne politike je prizadela izvozno usmerjeni del gospodarstva, ki je bilo prisiljeno v nerentabilen izvoz, èe je hotelo vzdržati z velikimi napori osvojene tržne dele na tujih trgih; zaradi tega tudi ni sluèajno, da je med izgubaši toliko pretežnih izvoznikov."
33,"Takšen odnos razkriva temeljno pozicijo ZIS, ki ne priznava dejanskega stanja stvari do katere je v Jugoslaviji prišlo z uveljavljanjem suverenosti republik v zadnjem letu in po kateri atribut suverenosti pripada edino federaciji."
20,"Prav tako, nemogoèe je reèi oprostite, ker vam moram to tako reèi - mi dajemo kotizacijo 4,8 milijard dinarjev za proraèun."
70,"Vse razprave okoli nepripravljenosti dogovarjanja z Zveznim izvršnim svetom in navajanje, da je to enostranski poseg Republike Slovenije moram zatrditi, da po vsej dokumentaciji, ki sem jo prevzel in po vseh navedbah, ki smo jih že poskušali v zadnjem èasu uskladiti, lahko trdim, da je Zvezni izvršni svet šele zdaj dojel, da so naše odloèitve trdne, da je konec junija praktièno pred nami in da bomo spoštovali voljo slovenskega naroda."
34,"Lahko bi namreè postavili tudi nasprotno hipotezo, da je zaostrovanje ekonomske krize pospešilo politièno krizo in da bi bile gospodarske razmere precej podobne sedanjim tudi v primeru, èe bi med republikami vladali najprisrènejši odnosi."
48,"To je v interesu te države, da kadar gradi nov sistem s privatno lastnino, da mora imeti ugotovljeno celotno lastnino in da zato mora povsem jasno vedeti, kaj je to in kaj gre v bilanco stanja neke države, ker je brez tega težko delati na kakršnikoli delitveni bilanci."
81,"Spoštovane poslanke in poslanci, glede na to, da so bila zelo deljena mnenja o pobudi predsednika Markoviæa za njegov nastop v Skupšèini R Slovenije, moram reèi, da smo v vladi to pobudo podprli, predvsem na temelju zadnjega razgovora, ki sva ga imela s predsednikom Kuèanom in dr. Drnovškom pri g. Markoviæu, ko je bilo (citiram izjavo ZIS-a za tisk) ""dogovorjeno da se Zvezni izvršni svet neposredno angažira pri iskanju takih rešitev, ki ne bodo postavila pod vprašaj plebiscitne odloèitve slovenskega naroda""."
28,"Poudarili smo tudi, da se Slovenija zaveda svoje odgovornosti - soodgovornosti za razplet jugoslovanske krize, da pa ne more biti samo odvisna spremenljivka glede na interese in dejanja drugih."
19,"Ker ZIS nima veè glavne iniciative v teh procesih to še ne pomeni, da se v republikah ne dogajajo."
41,"Moram povedati, da Zvezni izvršni svet - gospod Peterle je pred kratkim omenjal - da se je Izvršni svet Republike Slovenje obrnil na zvezni svet s številnimi pismi; tudi zvezni izvršni svet se je obraèal na izvršni svet prav tako s številnimi pismi."
25,"V letu 1991 sprejeti ukrepi, zlasti na kreditno-monetarnem podroèju, kažejo oèitno popušèanje ZIS tovrstnim pritiskom in odpovedovanjem njegovim lastnim konceptualnim opredelitvam in programa družbenoekonomskih reform."
30,"Avgusta lanskega leta, lepo prosim, to si dobro zapomnite, avgusta lanskega leta so bili sprejeti ukrepi o rekrutiranju (ko je bila sprejeta odloèitev v Sloveniji da zmanjša svojo rekrutno kvoto)."
8,Znano je da sem jaz manager in poslovnež.
44,"Vlada je v okviru posamiènih projektov in v okviru projektnega sveta, ki ga je oblikovala za pripravo, izvajanje in kontrolo procesa osamosvajanja Slovenije, s pomoèjo svojih strokovnjakov in zunanjih sodelavcev, skrbno pretehtala mnoge izraèunljive zadeve, ki so potrebne za vladno odloèanje in vaše odloèitve."
56,"Èe bo izbran proces, v katerem bo usklajevan in optimiziran ta odnos, potem je po moje zelo jasno, - nihèe v Jugoslaviji pa niti Slovenija ni avtarhièen - 70 let življenja je ustvarilo veliko vidnih in nevidnih zvez, sistemskih, infrastrukturnih, gospodarskih, družinskih, prijateljskih in številne druge veze, ki se ne morejo prekiniti kar tako, brez nadaljnega in takoj."
18,"Pri tem mislimo, da je bistveno ali v tem procesu imamo kontinuiteto ali diskonuiteto in tudi diskonuiteto države."
43,"Glede na to, da ZIS argumentira svoje predloge za izhod iz sedanje jugoslovanske politiène ekonomske krize z uspehi svojega ekonomskega programa iz prve polovice lanskega leta, po razèlenitvi vseh njegovih napak dvomimo o primernosti takšnega pristopa in o zagonu gospodarstva iz obstojeèe situacije."
45,"Mi smo pripravljeni še naprej, smo se tudi dogovorili, da bomo poskušali v tem kratkem èasu, ki ga imamo na razpolago, uskladiti maksimalno kar se bo dalo, vendar moram priznati, to ni samo naša stvar, ampak to zavisi tudi od dobre volje Zveznega izvršnega sveta."
61,"Na osnovi vrste razprav, strokovnih in politiènih, predlaga vlada postopno izvajanje monetarne samostojnosti Republike Slovenije pri izdajanju bankovcev in kovancev tako, da bomo v skladu s prehodnimi doloèili zakona o Banki Slovenije, v prehodni fazi kot plaèilno sredstvo še nadalje uporabljati jugoslovanske dinarje do dneva X, do osamosvojitve, ko jih bomo zamenjali z vrednostnimi papirji, ki jih je natisnila Republika Slovenija."
32,"Ostali viri, nakazila zdomcev, prodaja deviz obèanom, so namreè bistveno bolj sprejemljivi in odvisni od psiholoških faktorjev, ki so na zaèetku leta polnili devizne rezerve, konec leta pa jih enako hitro praznili."
21,"Prav tako se ne moremo strinjati z ocenami, da se je zaradi osamosvajanja republik, proces ekonomskih reform v Jugoslaviji povsem zaustavil."
16,"Po programu zakljuèujemo skupno zasedanje vseh treh zborov; nadaljevanje bo v loèenih zborih, na loèenih zborih."
60,"Pri infrastrukturi smo pripravili predloge za kontrolo letenja v zraènem prostoru Republike Slovenije, izdajanje dovolilnic, ki jih za opravljanje mednarodnega avtobusnega in tovornega prometa izdaja Zvezni sekretariat za promet in zveze oziroma Gospodarska zbornica Slovenije, opravljanje nalog Zvezne uprave za radijske zveze oziroma prevzemanje teh nalog s strani Republiške uprave za telekomunikacije ter predlagali variantne rešitve korišèenja tujih finanènih posojil."
59,"Ta pravna anarhija je pripeljala do gospodarskega kaosa in erozije in to je potem seveda prebilo tudi plaèe in plaèilni promet, proizvodnja je naenkrat padla in pada še naprej (ta tendenca je še nazoèa), erozija deviznih rezerv je v takšnih pogojih grozila, da bo prav hitro izèrpala ogromno bogastvo, ki ga je ta družba ustvarila v samo enem letu."
38,"Ne pomeni, da mi moramo do takrat rešiti vsa naša nasprotja in probleme, dovolj bodo samo pozitivni signali, da jih bomo rešili na demokratièen, miroljuben naèin, brez uporabe sile in da se ne bomo spušèali v enostranske odloèitve."
7,Slovenija takšnim pritiskom ne more veè popušèati.
0,.
39,"Prviè: monetarna politika je bila vodena nekonsistentno, po naèelu hladno - vroèe, premalo restriktivna - prvi mesec po sprejetju programa in preveè v kasnejših meseènih, ko so se cene že hitro umirjale, kar je poleg drugih vzrokov, dodatno zmanjšalo gospodarsko aktivnost."
171,"Takrat in v kontekstu razreševanja vseh vprašanj, ki so pred nami do 26. junija in za tem je bila s strani enega od sogovornikov na slovenski strani dana ideja, da bi bilo dobro, èe se ZIS, vezan s konkretnimi odloèitvami obrne s pismom na Skupšèino Slovenije in je tedaj na osnovi moje pripombe, da z nobenim pismom ne bi mogli razložiti tistega o èemer smo se mi s predstavniki Slovenije (Kuèanom, Drnovškom in Peterletom) dogovarjali veè kot 6 ur, da se tega ne da enostavno razložiti v navadnem pismu, takrat se je rodila ta ideja, da se ZIS obrne na vas s pismom (upam da ste vi seznanjeni s tem pismom in njegovo vsebino) in da se s tem pismom ponudi sodelovanje predsednika ZIS-a in èlanov ZIS-a na Skupšèini Slovenije, ne le da vas seznanimo z našimi stališèi, ampak da smo pripravljeni odgovarjati na vaša vprašanja, da smo pripravljeni na diskusijo o kateremkoli vprašanju, za katerega menite da je pomembno, v tisti obliki, ki jo boste vi doloèili kot najbolj racionalno."
64,"Jaz vas lepo prosim, premislite, dobro premislite, ali ni pametno, ali ni modro vse dokler se ne izvede dokonèna odloèitev, ki pomeni odcepitev (èe je nujno, èe bo to potrebno, toda jaz mislim, da bo tu zmagal razum), da vse do takrat ni treba sprejemati odloèitev, ki bi lahko imele tiste posledice, ki jih nihèe, ki želi dobro drugim in samemu sebi, ne želi."
183,"Mi smo se zavedali da se družba - ki se transformira iz sistema, katerega osnova je bila družbena lastnina, dogovorno gospodarstvo, samoupravljanje, ustavno pravni okvir, katerega vezivno tkivo je bila ena stranka, ena partija, da ta transformacija takšne družbe v popolnoma drugaèno družbo, družbo, ki je bolj uspešna, ki je zasnovana na ekonomskem pluralizmu, s privatno lastnino, na tržni ekonomiji, novi organizaciji vloge države, ki se ne meša v gospodarske subjekte, temveè z makroekonomsko politiko ustvarja okolje, v katerem samostojni gospodarski subjekti odloèajo, s pravno vlogo države in z njeno spremembo v tej smeri, s èlovekovimi pravicami in svobošèinami, s pravicami manjšin in pravicami republik ter z veèstrankarskim politiènim sistemom, ki je konsistenten in ustreza pluralizmu lastnine in njegovi privatizaciji - da gre transformacija oziroma izgradnja takšne nove družbe v principu, lahko v dve smeri, na dva naèina: ali s transformacijo skozi program sprememb enega sistema in izgradnjo drugega, v kateremu se proces sprememb s konsistentnimi programi vseh politik (od lastnine, trga, spremembe države in družbe do politiènega) v èasu in dinamiki, zagotavlja s stabilnim procesom, ki ima tudi stabilizacijski program, kot njegov neloèljivi del."
71,"Èe gremo na kontinuiteto države - ne glede na to, èe bo konèni zakljuèek nekaj drugega - potem se mi zdi, da bomo na neki skrajno miroljuben in demokratièen naèin lahko našli pozitiven izhod tudi iz te krize in da bodo odloèitve 26.6.1991 zaèetek nekega procesa, v katerem se bodo formirali novi odnosi v državi in v katerih bo Slovenija in njena skupšèina dala svoj pozitiven, konstruktiven prispevek pri formiranju teh novih odnosov."
104,"Teh rezultatov ne bi rad niti omenjal, ker izvršiti popolno liberalizacijo trga, deregulacijo, liberalizacijo gospodarskih odnosov z inozemstvom, enako z razvitimi državami, formirati devizne rezerve veèje od 10 milijard dolarjev, ustvariti interno konvertibilnost valute ter doseèi vse to ob rušenju inflacije na nulto stopnjo, to ni bila enostavna pot, toda ti rezultati so se zaèeli negirati v trenutku ko je tisti del programa, ki je predpostavljal pravno reguliranje odnosov v državi, ki jih je Zvezni izvršni svet s predlaganimi amandmaji ustave Jugoslavije želel regulirati in ki so bili onemogoèeni v svojem izvajanju, s tem je prišlo do pravnega razkoraka, prišlo je do pravne anarhije."
72,"Jaz vam sugeriram, seveda vi odloèate, toda jaz vam sugeriram, vse dokler se ne ustvari resnièni proces razdruževanja, ki pomeni - èe je njegova konsekvenca odcepitev, èe ni, je to nekaj drugega - toda èe je njegova konèna konsekvenca odcepitev, je do tega èasovnega obdobja treba najti rešitev, s katero bo regulirano tudi služenje vojaškega roka ter vsa vojaška vprašanja, ker brez tega, se bojim, bomo namesto demokratizacije morali z nekimi drugimi sredstvi odloèati."
90,"Pogovarjamo se ne samo o tem, kako vzpostaviti te funkcije, pogovarjamo se ne samo kako prepreèiti ali onemogoèati žarišèa spopadov, temveè prav tako kako zagotoviti dolgoroène rešitve, ki bodo od suverenosti republik naprej, omogoèile konstituiranje takšne skupnosti v Jugoslaviji, ki bo v interesu vseh njenih narodov, narodnosti in vseh njenih državljanov ki bodo zagotovile Jugoslavijo brez meja - namesto, da se borimo za medsebojne meje, bi se borili za odpiranje vseh meja, v Evropo in svet in naše vkljuèevanje v sodobne in civilizacijske in kulturne procese v Evropi in celem svetu."
53,"Za nas je pri tem osnovno vprašanje (spoštujoè vse pravice na samoopredelitev in odcepitev in vse, kar ta vprašanja vsebujejo) za nas je na prvem mestu vprašanje ali je odloèitev o razdruževanju oz. razdružitvi tudi odloèitev o odcepitvi, ali je osamosvojitev s suverenostjo republike ob izgradnji novih odnosov v neki novi skupnosti Jugoslaviji."
62,"Mi smo se že lansko leto, kot vlada opredelili, (ne glede na to, kako bo država organizirana), da moramo poiskati, èe bo še naprej funkcionirala kot ena država, ne glede na to, ali je to skupnost ali kakšna druga oblika, da je treba zahtevati eksteritorialnost njenih posameznih ustanov in da je treba iti na dislokacijo teh ustanov po vsej tako organizirani državi."
67,"Ali sedaj v tem smislu odloèitve, ki jih vi tukaj morate sprejeti 26. junija ali naj bi te odloèitve pomenile odcepitev ali razdružitev v katerem teèe ta proces vzporedno z drugim, v katerem se vrši optimalizacija ali to pomeni, da bodo sprejete odloèitve, ki pomenijo enostransko odcepitev, kar pa v bistvu pomeni ali bo proces sprememb, ki bi jih Slovenija rada realizirala potekal demokratièno ali na silo."
9,"Moram povedati, da smo sedaj vsi skupaj pred zidom."
36,"ZIS s takšnim pristopom objektivno podpira tiste federalne enote, ki se pod plašèem zavzemanja za moèno federacijo, prizadevajo ohraniti planso tržni naèin gospodarjenja in neuèinkovito gospodarsko strukturo z moèno porazdelitveno funkcijo federacije - seveda v njihovo korist."
11,Vseeno pa so èisto ekonomsko tehniène pomanjkljivosti protiinflacijskega programa daleè pomembnejše.
63,"Moram prav tako povedati, da smo zaradi tega sedaj v takšni situaciji jaz sicer ne vem po èigavem scenariju in zakaj in jaz tudi ne maram tega izraza in ga nerad uporabljam toda mi smo v situaciji, ko bo treba odloèati; toda verjemite mi, ni tega scenarija in njegovega cilja, ki zasluži eno samo prisilo in samo nasilje in eno samo kapljo krvi."
140,"Lahko bi vam sedaj prebral stenogram pogovora, ki je bil v Beogradu s predstavniki Evropske skupnosti Delorom in Santerom; sta popolnoma jasno in nedvoumno povedala, da se evropska skupnost prizadeva in podpira Jugoslavijo, ne glede na to, kakšna bo in kakšne odnose bo vzpostavljala - ali bo to skupnost držav ali kakršnakoli druga oblika - da si prizadeva za Jugoslavijo, brez sprememb zunanjih in notranjih meja, za Jugoslavijo, ki bo svoje notranje probleme reševala po demokratièni poti in z demokratiènimi sredstvi, ki si prizadeva za to, da se rešijo problemi v Predsedstvu Jugoslavije, prav tako na ustrezen in demokratièen naèin, da se vse odloèitve sprejemajo v okviru institucionalnega sistema brez enostrankosti, z dogovori in da se naredi vse, kar je možno, da se da politièna podpora programu reform zvezne vlade (celo imenovali so ga po imenu vašega gosta, ki vam sedaj govori)."
94,"Naša ocena je, da celo èe bi mi imeli politièni konsenz, po katerem Jugoslavija ostane takšna kot je (kar mi ne predlagamo), v kateri se nadaljuje proces reform in njene demokratizacije, v kateri je dosežen konsenz na programih reform Zveznega izvršnega sveta, da brez tuje podpore nihèe ne more ustaviti nadaljnega padca proizvodnje in družbenega proizvoda (po naši oceni 50 in veè kot 50%) nihèe ne bo mogel ustaviti gospodarskega kolapsa in nihèe ne bo mogel ustaviti milijonov delavcev na cestah, ki bodo odpušèeni in nihèe ne, bo mogel ustaviti in prepreèiti socialne eksplozije."
1,Hvala.
49,"Teoretièna in praktièna pravila pri liberalizaciji uvoznih režimov, ki narekujejo postopnost in v prvi fazi tudi devalvacijo domaèe valute, ki naj vsaj deloma nadomesti izgubljeno zašèito domaèega gospodarstva strategija odpiranja jugoslovanskega gospodarstva v letu 1990 tega ni upoštevala; celo nasprotno, ob liberalizaciji uvoza je dopustila izredno visoko precenjenost dinarja."
