19,"Gre za priznavanje legalnosti in legitimnosti, ne pa za to, ali bomo mi nekatere te odloèitve priznali ali ne."
18,"Potem moramo ugotoviti, da sta izglasovani drugi in tretji stavek in po vrstnem redu drugi in tretji stavek."
12,"Mislim, èe tega ne izglasujemo, potem ne vem, zakaj smo sploh tukaj."
4,Se je kdo vzdržal?
3,Je kdo proti?
103,"Zbor obvešèam, da moramo danes v okviru 19. seje opraviti še sklepanje o predlogu za izdajo zakona o postopku za uveljavljanje socialnovarstvenih pravic s predlogom zakona, sklepanje še o dodatnem sklepu k predlogu za izdajo zakona o spremembah in dopolnitvah zakona o pravnem položaju verskih skupnosti v Republiki Sloveniji in obravnavati predlog za izdajo zakona o raziskovalni dejavnosti, z osnutkom zakona, obravnavati znanstveno-raziskovalno tehnološko razvojno politiko v Republiki Sloveniji in predlog za izdajo zakona o predsanaciji, sanaciji, steèaju in likvidaciji bank in hranilnic, z osnutkom zakona - uvodno besedo predstavnika Izvršnega sveta in poroèevalce delovnih teles smo poslušali vèeraj ter delovno opravili še razpravo."
16,"Moram razložiti, èe ne je brez zveze, èe reèem samo za in ne povem, zakaj za."
47,"Osebno menim, in to je ravnala tudi pokojninska skupnost, da povsod tam, kjer gre za zavarovalne principe, takšno odlašanje nima nobene osnove in moj predlog je, da poostrimo disciplino, kar se tièe proraèunskih prihodkov, kajti ti so bili zlasti v prvih treh mesecih izredno nizki in katastrofalni."
38,"Predlagam, da se lotimo takoj razprave o zakonu in kolikor bomo videli, da so v zakonu nekateri elementi take narave, da jih lahko s hitrimi ukrepi uveljavljamo že v letošnjem letu, sem tudi za to, da to storimo."
5,"Ugotavljam, da je sklep izglasovan."
14,"Torej, zaradi tega, da bo ta stvar enkrat rešena, s tem ne prejudiciramo niè."
26,"Moram povedati, da bom vseeno glasoval proti temu amandmaju zato, ker normalno so glasovali tisti predstavniki v Predsedstvu in bi s tem priznavali, da so itd."
17,"Obvežemo samo vlado, da pripravi do, tu je bil rok en mesec, in da reši ta problem."
61,"V okviru tega bi tudi opozoril na delegatsko pobudo Janeza Kopaèa in Zorana Thalerja s 7. marca 1991, kjer reèeta - Družbenopolitièni zbor naj sprejme sklep: ""Zbor zahteva od Izvršnega sveta Skupšèine Republike Slovenije, da v roku enega meseca v skupšèinsko proceduro pošlje spremembe naslednjih zakonov, tako da vanje prepiše besedilo zakona o zasebnem delu."" Na prvem mestu je zakon o zdravstvu."
2,Ugotovimo sklepènost!
8,"To sejo, kakor je bilo za danes planirano."
31,"Moj amandma oziroma stavek je bil samo eden in je šel na to, da se razglasi, da se priznava Stipeta Mesiæa brez posebnih ponovnih volitev in razglasitev, ker tega ne bo."
6,Sedaj glasujemo o predlogu gospoda Thalerja.
52,"Menim, da bi bilo potrebno doseèi redno plaèevanje opravljenega dela (po možnosti z avansi za naprej, ne pa z dodatno zamudo za nazaj, kajti tudi mi moramo plaèati za naprej), èim prej skleniti te pogodbe med upravo za zdravstveno varstvo in zdravstvenimi organizacijami, ob prvi priložnosti pa izvesti v proraèunu ustrezen rebalans."
40,"Center za socialno delo ali pristojni upravi organ je po uradni dolžnosti dolžan preveriti, kateri delavci iz take organizacije so upravièeni do socialnovarstvenih pravic."" Izvršni svet temu nasprotuje, Zakonodajno-pravna komisija ne podpira, ker vsebina amandmaja ne sodi v ta zakon."
54,"Enkrat je bila danes tudi pripomba, da v zdravstvu ne veljajo ekonomski principi in tudi tržno gospodarjenje ne, èeprav smo mi tudi za lojalno konkurenco med zdravstvenimi organizacijami in smo že veèkrat zahtevali, da se ukine doloèilo samoupravnega sporazuma, ki prepreèuje, da bi se vsaj v slovenskem prostoru lahko bolniki gibali po prostem izboru."
46,"Glede drugega predloga gospoda Tomšeta - jaz ga sprejemam, s tem, da je paè situacija takšna, da vemo kakšni smo; sprejemam ga iz oportunizma, s tem da moramo vedeti, da je povsem logièno, da èe smo predlagali drugi sklep, vemo, da smo ga predlagali na podlagi prvega."
35,"Za organizirano reševanje jugoslovanske krize je seveda takšno ali drugaèno delovanje še obstojeèih institucij federacije, med njimi tudi Predsedstva SFRJ, lahko pomembno - in to je najpomembnejši razlog, zaradi katerega je bil takšen predlog sklepa predlagan."
13,S tem smo zakljuèili to toèko dnevnega reda in smo zakljuèilo to sejo.
25,"Èe še jaz smem povedati, glasoval bom proti, ker odpira - pardon, ne bom povedal zakaj; a ja, lahko povem zakaj - zato ker odpira preveè podvprašanj."
15,"Èe se strinjamo, poseben stavek, posebno glasovanje, da mi pozivamo nekoga, da sodeluje v predsedstvu."
11,"Prosim, da bi gospod Thaler pojasnil, kaj je s tem mislil."
23,"No, in sedaj mislim, da je to problematiko treba na nek naèin rešiti in tukaj s tem mi ne prejudiciramo niè, samo zadolžimo..."
37,"Prvi amandma k drugemu odstavku 2. èlena, ki se glasi: drugi odstavek tega èlena se spremeni, tako da se glasi: ""O pravicah iz prejšnjega odstavka odloèa organ, ki ga imenuje Izvršni svet obèine iz vrst zainteresirane javnosti""."
33,"Poleg tega se sprašujem, katero okrnjeno Predsedstvo bi sploh moglo prejemati kakšne odloèitve, ker najbrž se razmerje tu ne bo spreminjalo, sedaj je 4:4, niti eden del niti drugi del ni namreè sklepèen."
44,"Zdi se mi, da se postavljamo v dvolièno vlogo, ker vemo da je ta skupšèina ravno derogirala posamezne doloèbe zvezne ustave SFRJ in bi bilo morda res neprimerno, da sedaj postavljamo ravno te ostale doloèbe ustave SFRJ na nivo, na katerem se nanje sklicujemo."
27,"Predlog se glasi: ""Družbenopolitièni zbor poziva èlana Predsedstva iz Srbije in Èrne gore, da se vkljuèita v delo Predsedstva SFRJ, ki ga vodi gospod Stipe Mesiæ."" Prosim."
7,"Ugotavljam, da predlog gospoda Smoleta ni izglasovan."
48,"In ker gre za drugo situacijo, bi predlagal, da se vnese korektura v prvi odstavek; se pravi tam ko govorimo o ustavi, bi dodali vrinjeni stavek v tem smislu ""tistih doloèb ustave, ki urejajo pravila igre oziroma pravila delovanja Predsedstva federacije"", da je jasno, nad èim se pritožujemo."
39,"Zdi se mi tudi neprimerno, da ta skupšèina v svoji izjavi na tako vidno mesto postavlja koordinatorja tega Predsedstva, za katerega vemo, da ga ni v nobenem poslovniku, še manj v zakonskem doloèilu ali pa v sami ustavi SFRJ."
43,"In drugiè, da se pozove dva èlana Predsedstva iz Srbije in Èrne gore - slovenšèina ima to prednost, da ima dvojino, v srbohrvaškem prevodu bi se to izgubilo - da se pridružita temu predsedstvu; mi reèemo v Zagrebu, ampak tistemu, ki ga vodi Stipe Mesiæ."
1,Ponavljamo.
65,"Vse to se mi je zdelo potrebno povedati zato, da bi se uprla kakršnemukoli poizkusu, da bi krèili pravice, da bi spreminjali zdravstveni sistem, ne da bi prej toèno in natanèno analizirali, kaj najbolj potrebujemo, kje je treba ukrepati in kje je tisto, kar nobena revšèina, nobena ekonomska kriza ne sme zrušiti, ker se bo dejansko poslabšala tudi ekonomska situacija, èe bo izgubljeno zdravje populacije."
173,"Tukaj ne gre samo za krnitev slovenske suverenosti, za katero mislim, da jo že imamo na tem podroèju, ker smo paè te carine s sklepi skupšèine zasegli in jih vkljuèili v proraèunske vire, ampak gre za to, da že tako zmanjšan proraèun za nekatera vitalna podroèja, kot so šolstvo, zdravstvo, se sedaj ta vir, iz katerega se vsa ta podroèja napajajo, še dodatno zmanjšuje in kaže tudi, da to, kar je že znano, da so prilivi v proraèunu manjši, kot se je prièakovalo in kot bi morali biti glede na letno dinamiko, da je deloma tudi posledica te zadeve okoli carine in zato gospoda Ocvirka sprašujem, da naj pove (v kolikor je takšna strategija sploh izdelana v slovenski vladi) ali misli Slovenija disciplinirati carino na tak naèin, da tudi s silo, èe ne gre drugaèe, poskrbi, da se v skladu s sklepi slovenske skupšèine carine nakazujejo v republiški proraèun, ali misli nasprotno poveèati druge proraèunske vire, kar pomeni, da dvigne davke in s tem dodatno obremeni ali gospodarstvo ali prebivalstvo ali oboje skupaj."
24,"Predlaga da: ""Družbenopolitièni zbor poziva èlana Predsedstva Srbije in Èrne gore, da se vkljuèita v delo Predsedstva SFRJ, ki ga vodi Stipe Mesiæ."" (Prosim?"
20,"Pred tremi meseci približno sem dal pobudo v tej smeri, in sicer zaradi tega, ker so me takrat pooblastili sindikati."
60,"Prviè smo šli v krog evaluacij, makroekonomskih panožnih, prek gospodarske skupnosti in prek drugih sekretariatov, da smo dobili bolj pošteno oceno; èe je to primer ekspertnega sistema na delu, jaz si ne morem privošèiti, da bi neko nalogo, ki je dobila oceno 3, recimo rang 1 do 3, da bi jo dvignili v prvi razred in jo s tem financirali."
28,"Ker je italijanski predstavnik vlade priznal, da je Mesiè legitimen predsednik in verjetno bomo mi z našim jugoslovanskim predsedstvom imeli veè opravka kot Italijani, predlagam, da ga priznamo."
96,"Bojim se, da se nam bo to odpiralo seveda tu na naslednjih korakih, zato želim, da èimprej Vlada pride z vpogledom, kako bo postopoma, od toèke do toèke, te stvari realizirala, ker drugaèe se bomo vsak teden na nek toèki tako znašli kot danes in pravzaprav poslušali zelo miroljuben, vendar tudi, ne mi zameriti, zelo neprecizen odgovor, ki nam ga v tem delu Vlada daje in prièakuje od nas, da ji zaupamo in dajemo polna pooblastila, da se bo naprej pogovarjala, odloèala in nam sporoèala, kaj se je zmenila, mi bomo pa to naprej formalno potrjevali."
29,"Drugo, predlog gospe Beblerjeve, ki ga je podprl Zagožen, Zoran Thaler, malo dopolnjeno, katerega tudi osebno podpiram, je, da izglasujemo samo drugi stavek, ki je v bistvu zakljuèena celota."
34,"Spoštovani predsednik, spoštovane kolegice in kolegi (tole bo malo dišalo po polemiki znotraj stranke, ampak mislim, da to ne škodi.) Jaz bi ob tem, da cenim fleksibilnost šefa svojega poslanskega kluba, predlagal drugi aspekt."
42,"""1. Družbenopolitièni zbor Skupšèine Republike Slovenije je na svoji seji, 22. maja 1991, celovito obravnaval kritiène razmere v slovenskem zdravstvu in se pri tem seznanil s stališèi in predlogi ukrepov za izboljšanje razmer, ki jih predlaga Odbor za zdravstvo Skupšèine Republike Slovenije."
62,"Prviè s tem, da se Izvršnemu svetu naloži, da pred obravnavo zakonov s podroèja zdravstva pripravi analizo kumulativnih uèinkov restrikcij v zdravstvu na dostopnost zdravstvenih storitev za posamezne kategorije prebivalstva in drugi sklep, ki sodi v to drugo poglavje predlogov odbora - zbor nalaga Izvršnemu svetu, da poslance do naslednje seje zbora seznani z informacijo o realizaciji proraèuna po posameznih postavkah oziroma porabnikih."
51,"Sedaj dajem na glasovanje prvi stavek, to je ta o katerem je bilo najveè spora glede ustavnosti, ki naj bi se po predlogu glasil: ""Družbenopolitièni zbor ugotavlja, da je z neizvolitvijo gospoda Stjepana Mesiæa, èlana Predsedstva SFRJ iz Republike Hrvaške za predsednika SFRJ, grobo kršenje ustave SFRJ."" Se je navzoènost spremenila?"
21,"Prej je bilo 40, sedaj sem videl, da je vstopil dr. Voljè, pa je vstopil Peter Bekeš, pa še vedno 40."
32,"Bebler in bi postavil še to vprašanje, ali ni Republika Slovenija s tem, ko je njen predstavnik v Predsedstvu SFRJ glasoval za gospoda Mesiæa, že dala vsem svetu vedeti, da ga priznava."
22,"Mislim, da so predlagatelji zelo dobro precizirali; zato ker volitve so paè morale biti opravljene, res je, da ni bil izvoljen, ampak."
10,"Prosim, gospod Tomšiè bo povedal kako in zakaj bo glasoval."
9,"Ampak jasnega odgovora še ni bilo, kako boste glasovali."
53,"Dr. Voljè nam je zelo tehtno in analitièno predstavil kritièni položaj v zdravstvu, razen tega pa je vse, kar nam je o položaju v zdravstvu povedal, pri zamudah, o plaèilih, sistemu limitov, nepriznavanju inflacije, dragih kreditih, odlog pri plaèevanju prispevkov, toèno ista zgodba, kakršno bi nam povedali v šolstvu ali v socialnih dejavnostih."
36,"Je pa res, da s tem kaj veliko ne reèemo, da v ožjem delu, kjer neka forma obstaja, pa jo seveda morajo spoštovati tisti, ki so tokrat najbolj grobo kršili - da ne naštevam, kdo je kršil."
41,"Kar pa zadeva drugo toèko, sem preprièan, da je veèina v tem zboru in v Skupšèini Slovenije s konkretnimi sklepi, ki jih je sprejemala, sprejela odloèitev, ki je izrecno usmerjena v organiziran, da ne reèem sporazum, ampak organizirano reševanje jugoslovanske krize."
50,"Samo še to, ker je bilo vprašanje dopolnitve - nimam niè proti temu, samo moram reèi, da bi se mi zdelo nesmiselno, da mi reèemo grobo kršena ustava SFRJ, pa naredimo vejico v delu, ki se nanaša na Predsedstvo SFRJ in mislim, da bi bilo slabše kot pa je sedaj napisano."
56,"Najprej bi dal na glasovanje predlog drugega stavka, kakor ga je obrazložila gospa Beblerjeva in podprl gospod Zagožen in tudi jaz, to je drugi stavek osnovnega besedila: ""Skupšèina Republike Slovenije priznava za legitimnega predsednika Predsedstva SFRJ gospoda Stjepana Mesiæa in zahteva, da ga Predsedstvo SFRJ razglasi in objavi njegovo izvolitev."" To je, edino beseda ""izvolitev"" moti."
86,"Pripombe so bile tudi k 17. èlenu osnutka, ki doloèa ustanovitev Sveta za znanost in tehnologijo Republiškega sekretariata, ki je posvetovalno telo, èeš da je treba temu dati veè oziroma doloèene pristojnosti, ki naj bi bile predvsem v tem, da daje predloge in pobude Izvršnemu svetu glede na doloèitev strateških raziskovalnih dejavnosti ter o delitvi proraèunskih sredstev na temeljne in aplikativne raziskave in razvoj in skrb za skladen in celovit ekonomski razvoj Slovenije, s povezavo razliènih interesov in združenj, ki naj bi bili v njem zastopani."
82,"Mislim pa, da je narod in da je država kot družba, èe govorimo o tem, celovit organizem in da je slabo, èe bi se zgodilo, da bi se ta pozornost ali pretežna pozornost posveèala samo eni, èeprav seveda za mnoge najpomembnejši razvojni komponenti, ker bi nas to na koncu lahko pripeljalo do podobne miselnosti, ki smo ji pri nas bili prièa, èeš (kot je posebej omenil tudi gospod Tanicg), važno je, da razvijamo en del tega organizma, drugi bodo pa že poèakali."
55,"Dobil sem tudi pismo zdravnikov, ki so se takrat borili za ohranitev zasebne zdravstvene dejavnosti (nimam jih danes s seboj), ampak argumenti, ki so takrat bili aktualni v njihovih poskusih, da bi ohranili privatno zdravniško prakso, so enaki mojim oziroma tistim, ki danes tudi govorijo o tem, da bi se ponovno vrnila zasebna zdravstvena praksa."
63,"To se pravi, da je, po mojem, poleg nizkega nivoja (strinjam se, da je nivo za zdravstvo tako nizek) to bil v prvih mesecih eden glavnih razlogov, ker so ob tako nizkem nivoju bile vse štiri akontacije izplaèane še z dodatnim enomeseènim zamikom. (Enomeseèni zamik je že sicer bolj ali manj normalen glede na to, da se storitve plaèujejo potem, ko so opravljene.)"
30,"Moj namen je bil implicite povedati, kdo se je odcepil od tega Predsedstva in kdo naj se k njemu povrne, èe to želi oziroma je drugaèe šel ven iz Jugoslavije."
90,"Oèitno je torej, da v Sloveniji prevladujejo, in èe bomo tako prednostno orientacijo tega dokumenta sprejeli, še naprej tiste znanosti, ki se ukvarjajo z mrtvo naravo, da bodo imele prednost pred tistimi, ki se ukvarjajo z živo naravo, da bodo še naprej imele prednost znanosti, ki se ukvarjajo z drobljenjem narave in z mehanskimi, pred tistimi znanostmi, ki se ukvarjajo s celostnim in evolucijskim, da bodo še naprej vladale tiste znanosti, ki se ukvarjajo z znanjem, ki omogoèa manipulacije, pred tistimi znanosti, ki se trudijo z znanjem, ki krepi sožitje."
45,"Po mojem je ta procedura dokaz, da se takih tekstov ne da delati s petdesetimi ljudmi naenkrat, ampak da je treba izbrati neko skupino iz razliènih strani ali kakorkoli se temu reèe, ki naj pripravi tekst, ki je malo bolj usklajen in sprejemljiv za vse."
109,"Svet za znanost in tehnologijo Republike Slovenije - moram reèi, da mi ni povsem jasna funkcija tega sveta; (mi smo se o tem pogovarjali tudi v okviru naše Komisije za strategijo) meni bi bila jasna, èe bi bila ta funkcija opredeljena na enega od dveh naèinov: ali da je to neka stvar, ki se ukvarja s strategijo, neko telo, sestavljeno iz najvišjih znanstvenikov, gospodarstvenikov, politikov in se ukvarja s strategijo raziskovalne dejavnosti - potem je pa 3. toèka 15. èlena, da bo ta svet obravnaval predloge predpisov, ki doloèajo metodologijo in postopek za izvajanje nacionalnega raziskovalnega programa, seveda smešna, kajti s tem mi to telo spreminjamo v neke vrste metodološko komisijo."
69,"Poglejte, èe primerjamo situacijo s svetom (imam najnovejšo študijo raziskave in razvoj v podjetjih, nanaša se na Francijo, lahko bi citiral uradne OECD podatke, pa so isti), se nam kaže, poglejte, naslednje: da je po eni strani, ko pogledamo vire sredstev, gospodarstvo prisotno nekako med 40, 50 do 60% kot vir (ostali viri so seveda državni.) Še bolj pa je zanimivo, èe pogledamo vsa ta sredstva po sektorju trošenja."
59,"Sedaj imamo k PREJŠNJI TOÈKI ŠE PREDLOG GOSPE SONJE LOKARJEVE, predlog sklepa, kjer predlaga: ""Zbor nalaga Izvršnemu svetu, da do naslednje seje Skupšèine predloži predlog sprememb in dopolnitev delovnopravne zakonodaje, s predlogom zakona oziroma zakonov, s katerimi se sistemsko uredi izplaèevanje socialne pomoèi oziroma osebnih dohodkov delavcem, ki, kljub temu da so zaposleni, niso prejeli osebnih dohodkov."" Sonja Lokar."
102,"Moj oèitek je šel v tej smeri, èe pogledate tudi 37. èlen - res je, da so v 36. èlenu v petih alineah posamezne skupine raziskovalnih in znanstvenih dosežkov navedene, ampak 37. èlen pravi, da za prve tri ali tiste skupne, ki so v prvih treh alineah, odloèajo o nagradah raziskovalci in gospodarstveniki (najbrž seveda gospodarstveniki ne bodo soodloèali o nagradah s podroèja filozofije, zgodovine umetnosti ali kaj podobnega), medtem ko v drugi grupi, kjer sta èetrta in peta alinea, zlasti peta alinea je važna, ker govori, da gre za dosežke, ki utrjujejo in razvijajo identiteto Slovenije, bi odloèil pa kar resor sam."
58,"In tretjiè zato, ker ne vem, kaj bi bilo boljše, èe bi bil Mesiæ legalno in v redu izvoljen in potrjen, kakor tudi èetrtiè - to je za mene nepotrebno enostransko priznanje nekega èloveka, kjer ne vidim posebne koristi, niti sluèajno pa ne politiène koristi; mogoèe to za predlagatelja, vendar za mene ne, zato predlagam, da izjave ne sprejmemo."
64,"Najpomembnejši argument, ki je bil za razumevanje razmer in dejavnosti Slovenije pri vseh parlamentarcih sprejet, je bilo dejstvo, da Srbija in Èrna gora s takim ravnanjem dejansko želita na kaotièen naèin onemogoèiti funkcioniranje Jugoslavije in s tem kažeta, da nista pripravljeni na nobeno pošteno dogovarjanje in iskanje skupnih rešitev v skladu s plebiscitnimi odloèitvami slovenskega naroda in državljanov Slovenije, ki jih kot dejstvo sprejemajo."
49,"Tako da mislim, da bistvo je, da priznavamo Stjepana Mesiæa kot legitimnega predsednika predsedstva, da se pa ne bi zapletali v to, katere enostranske odloèitve bomo priznavali in ali je to predsedstvo legitimno in legalno ob tem, da vemo, da je ravno z ustavo Srbije bilo tukaj narejeno marsikaj."
77,"Jaz tu vidim kvalitetno razliko med redukcijo kompetenc ustave v korist prenosa suverenosti na posamezne republike (proti èemur tudi mi nismo imeli tukaj, ko smo se mi odloèali, vsebinsko veèjih pomislekov) in med situacijo, ko gre za razgrajevanje pravil delovanja tistega dela federalnih mehanizmov, ki so za urejen, se pravi dogovorni, demokratièen proces, torej tak proces, ki mu je tudi Zahodna Evropa in demokratièni svet pripravljen priznati legitimnost in brez katerih tega procesa ne bomo mogli izvesti."
66,"Dr. Mencinger, bivši podpredsednik Vlade je dostikrat povedal za to govornico, da se z ekonomijo in gospodarstvom ukvarjajo vsi tisti, ki ga razumejo, berejo in tudi tisti, ki ne vedo in se mojim, da bo razprava o zdravstvu tudi v to smer posegla, da bodo o zdravstvu govorili vsi tisti, ki so zdravniki in ki nismo in da bo potem še veèja problematika v tem cehu."
84,"Verjamem, da v tem zelo fluidnem, dinamiènem sistemu kot smo danes v tej situaciji, ki se iz dneva v dan spreminja, je težko vgrajevati v zakon davène olajšave za posamezne kategorije tudi na tem davènem podroèju, ampak je verjetno to moè bolj sistemsko in hitreje urejati z nekim fleksibilnim sistemom, ki te finanène injekcije državne intervencije fokusira v inovatorje, v nakup moderne tehnologije, tudi sektorsko se to razlikuje; tako da je ta problematika bolj kompleksna, kot bi jo lahko reševali v bolj togem zakonu."
79,"Se pravi, da le prihajamo na tisto, kar paè bi res rekel, da je ogrožanje interesov in verjetno je skrb parlamenta kot najvišjega zakonodajnega organa družbe, da se odloèi, èe pusti tukaj nekaj veè pluralizma in tudi konkurence, za katero sem pa vsekakor zato, da se organizira na naèin, kot ga je gospod Žakelj omenil, da se pride do sinergije, do nekega izloèenega mesta, v katerega najboljšo ponudbo vsi kvalificirani subjekti dajejo, in to je bistveno konèni naš namen."
87,"In mislim oziroma sem trdno preprièan, da s èakanjem na reševanje kolektivnih pogodb tega problema ne bomo rešili, zato bi najbrž bilo potrebno v obdobju do priprave teh kolektivnih pogodb zadevo rešiti na drug naèin - na drug naèin pa se najbrž reši zopet, da v tem parlamentu sprejmemo doloèitev in na nek naèin izravnamo te plaèe vsem tem institucijam, ki sem jih naštel, in še nekaterim, ki jih nisem našteval - sicer bo še vedno oèitek, da imajo na nekaterih podroèjih dobre, na drugih podroèjih pa slabe plaèe."
70,"Sodim, da èetudi drugi sklep ne bo sprejet, da bo to paè pomenilo, da naš zbor sodi, da je bolje, da so razmere v Jugoslaviji èimbolj kaotiène, zato, da bi imeli èimveè razlogov za enostransko odcepitev zaradi razmer v Jugoslaviji, ne pa zaradi svojega lastnega preprièanja in ne zaradi dobre pripravljenosti, organiziranega delovanja, da bi po sprejemu naših odloèitev tudi vedeli, kakšne bodo aktivnosti, posledice, ukrepi, ki jih bomo sprejemali."
146,"Èe primerjamo še nekatere podatke, ki nam jih dr. Voljè ni povedal, jaz pa sem jih sluèajno lahko slišala, ker smo imeli na Odboru za delo razgovor tudi s strokovnjaki z Univerzitetnega centra zavoda za zdravstvo in socialno varstvo, je popolnoma jasno, da postajamo resnièno bolna družba, da je to družba, v kateri so obolevnosti pogostejše kot so bile v preteklosti in se tudi èas obolevnosti daljša in da prihajamo v situacijo množiènega invalidskega upokojevanja ter da postajajo tri diagnoze znaèilne za celotno našo populacijo: obolenja mišic, vezi in kosti (kar so v bistvu obolenja tekoèega traku in neargonomskih delovnih mest), obolenja srca in ožilja (kar so bolezni nezdravega naèina prehrane in nezdravega naèina življenja) in psihiène motnje (kar je posledica strahotnega stresa, ki ga je družba doživela, ko se iz dolgega obdobja navidezne socialne varnosti in blagostanja nenadoma prevesila v družbo zelo težke socialne negotovosti)."
71,"Jaz sem zato prosil za 3. toèko, ker mene pri tem to mori: èe je seveda poanta, in jaz to tako razumem, da je vsa razprava pomenila napotitev, da naj Izvršni svet ob pripravi zakonodaje razmišlja o tem, kaj je treba v zdravstvu narediti, potem se strinjam s tistimi, ki menijo, da smo opravili zelo koristno razpravo, vendar, na žalost, odložili reševanje, recimo, v najboljšem primeru do konca julija ali septembra."
89,"Jaz sem bil navzoè takrat, v tistih proraèunskih razpravah - in kdor še enkrat pogleda proraèun, bo videl, da je tam obilica stvari, ki se nikakor tako ne mudijo v tem letu in iz proraèuna ni videlo, da se vlada zaveda prihajajoèih problemov na podroèju družbenih dejavnosti, ampak je kar tako, brez naèel, vsakemu nekaj dodelila; tistemu, ki je bil bolj prodoren, je dala veè, tistemu, ki je bil manj, je dala manj, tistem, ki se je skliceval na suverenost Slovenije in svoj resor, je dala veliko in tako naprej."
72,"Da pa ne bi posebej glasovali o teh ukrepih, iz dveh razlogov: namreè, skupšèina ni kot celota te razprave sprejela in èetudi bi naš zbor potrdil oziroma kot svoje sklepe sprejel predloge teh ukrepov, ki jih je predlagal odbor, ima to drugaèno veljavo, kot èe to sprejme cela skupšèina, ker šele takrat je to sklep skupšèine in drugaèe, ravno zaradi te situacije, ker v bistvu že vstopamo v fazo obravnave teh zakonov."
57,"Na glasovanje dajem amandma Marie Pozsonec k 7. èlenu, ki se glasi: besedilo 7. èlena se naj spremeni, tako da se glasi: ""Ko organizacija oziroma krajevna skupnost sprejme zahtevek, preveri vpisane podatke, stranko opozori in dopolnitev in vlogo dopolni z mnenjem."" Izvršni svet nasprotuje, Zakonodajno-pravna komisija ne podpira, Odbor za delo, zaposlovanje in socialno politiko ne podpira."
68,"Mi smo s 96 amandmajem izloèili, to je in dali v podpredje tiste dele Ustave SFRJ, ki so v nasprotju z Ustavo Republike Slovenije; do osamosvojitve, do tistega dneva D, pa ta ustava je in v tem smislu je koristna tudi za nas; predvsem pa je z vidika mednarodne javnosti prav, da se prikaže, kdo jo krši, zato sem za takšno formulacijo, ki je predlagana v pisni obliki."
67,"Pri neizvolitvi oziroma neimenovanju Mesiæa se je zgodilo to, da sta se dve republiki odcepili od Jugoslavije in to je treba v tej izjavi po mojem poudariti, na naèin, da se poudari, da Skupšèina Republike Slovenije priznava za legitimnega predsednika Predsedstva SFRJ gospoda Stjepana Mesiæa in poziva èlana predsedstva iz Srbije in Èrne Gore, da se vkljuèita v delo predsedstva SFRJ, ki ga vodi gospod Stipe Mesiæ."
