34,"Razumljivo je, da je kot izhodišče za določitev volilnih enot predstavnikov lokalnih interesov primarno načelo regionalne geografske povezanosti, sekundarnega pomena, mogoče pa celo nepomembno načelo pa je število prebivalcev, ki živijo v določeni regiji."
41,"Gre za predlog za izdajo zakona o določitvi volilnih enot za volitve poslancev v državni zbor, z osnutkom zakona, kakor tudi za predlog za izdajo zakona o določitvi volilnih enot za volitve predstavnikov lokalnih interesov v državni svet, z osnutkom zakona."
26,"In zakaj potomci teh ljudi, pač ker jih ni na tem mestu toliko, bi še to, da bi po toliko stoletjih bili še ob tega poslanca."
42,"Zato na našem področju predlagamo, da se upošteva prvotni predlog, da sta občini Domžale in Kamnik samostojna volilna enota, ali pa, da se k temu področju doda še občina Litija in tako dobimo področje, ki ima 93.000 prebivalcev, kar ustreza vsem kriterijem."
21,"Mislimo, da je nujna vključitev v eno od teh volilnih enot in upamo, da bo v predlogu zakona to tudi uresničeno."
24,"Potem rokovno vežemo vlado, da nam v roku pripravi izvedbene oziroma predloge zakonov, kajti drugače so bili vsi naši napori v dveh dneh nepotrebni."
14,"To sta dve točki, ki smo jih že imeli na dnevnem redu 43. seje."
7,Potem dajem tak predlog sklepa na glasovanje.
20,"S tem smo opravili ti dve točki, ki sta najbolj neposredno vezani na volilno zakonodajo, ki smo jo prej sprejeli."
6,"Predlagam zboru, da sprejmejo naslednji sklep:"
4,Se je kdo vzdržal?
8,"Mislim, da neka posebna, druga obrazložitev ni potrebna."
22,1) Predlog za izdajo zakona o določitvi volilnih enot za volitve predstavnikov lokalnih interesov v državni svet z osnutkom zakona se sprejme.
12,Tu sta na tem področju na nek način oblikovani dve volilni enoti.
19,"Dejansko je to eno področje, ki je zgodovinsko, geografsko in tudi tretje po velikosti, kot zaokrožena celota v Sloveniji."
45,"Menim, da ta kriterij, da je pomembno tudi število prebivalcev v posamezni regiji, je pomemben pri oblikovanju posamezne volilne enote, v kateri naj se prezentira lokalni interes in je v tem smislu prejšnja rešitev bila celo boljša od te, ki jo imamo sedaj pred seboj."
29,"V avstrijskem parlamentu na Dunaju je bil poslanec Černe - Šonc Metod, ki je iz naših krajev, se spomni - in takrat si je prizadeval, da so tisti kraji dobili železnico."
15,"Tisti kraji okoli Maribora ne bodo prišli nikoli na vrsto, da bi imeli kakšnega predstavnika."
44,"Nimam nič proti, da bi bilo ministrstvo za finance v Celju in vrsta stvari je še takih, ki se jih v tako majhni deželi da racionalno urediti, tako da bo tudi tja prihajal kapitala, znanje ljudi in se ne bo vse koncentriralo v Ljubljani."
25,"Vemo, kako so se ta področja razselila, torej da se je število prebivalcev manjšalo načrtno; vemo, da so jih s pomočjo udbe vozili prek meje."
2,Poglejmo prisotnost.
5,"Drugič, ustrezno število prebivalcev, 75.000."
1,Hvala.
3,Je kdo proti?
35,"Skratka, mi predlagamo, da bi bilo treba stvar drugače urediti, drugače vidimo to volilno enoto, kjer naj bi se upoštevale te geografske in zgodovinske in pa tudi siceršnje lastnosti, ki v nekaterih segmentih povezujejo ljudi."
49,"Del te problematike, ki jo danes tu obravnavamo smo dejansko že slišali ob sprejemanju zakona o volitvah v državni zbor, kjer je bilo s strani več poslancev povedano, da t.i. domicil v volivni enoti je pomembna kategorija in da odstopanje od tega principa pomeni nastop in omogočanje centralizacije."
47,"Predlagal bi, da se napravi sprememba v 3. členu, in sicer v 3. volilni enoti, tako da se velika volilna enota, ki zajema celjsko regijo, razdeli na dve manjši volilni enoti; in sicer v eno enoto naj bi prišle Laško, Šentjur, Šmarje, v drugo pa Celje, Konjice."
23,"2) Predlog zakona pripravi vlada Republike Slovenije v roku osem dni, tako da bo zbor predlog zakona lahko obravnaval že na seji 23.9.1992."
31,"Tudi v tem primeru že zakon o volitvah v državni svet določa, da se za predstavnike lokalnih interesov oblikuje največ 22 volilnih enot, ki zajemajo območje ene ali več lokalnih skupnosti."
58,"V tej naši volilni enoti prevladujejo prebivalci Ljubljane, ki jih je preko 300.000 in tako na primer mi v občini Kamnik, kjer nas je 29.000 pa tudi Domžalčani v svoji občini, kjer jih je 45.000, verjetno nimajo niti teoretične možnosti oziroma nimamo niti teoretične možnosti, da bi dobili svojega svetnika, ki bi bil doma vsaj severno od Ljubljane."
28,"3) Pri pripravi predloga zakona naj predlagatelj prouči in ustrezno upošteva pripombe, predloge in mnenja delovnih teles skupščine, pisne pripombe in pripombe iz razprave poslancev na seji zbora."
33,"Z Idrijo smo nekoliko manj povezani, ampak Postojna in Ilirska Bistrica, Postojna in Bistrica pa sodita nekam drugam, ker sta sodili ves čas, do tega trenutka po svoji politični in tudi ekonomski povezavi."
11,"Če ne želi nihče, prosim gospod Rojec, razprava še ni zaključena."
9,"Ugotavljam, da je predlagani sklep z večino glasov sprejet."
39,"Večinoma je po teh predlogih opredeljeno 12, 14 oziroma 16 do 19 regij, s čimer ste se lahko seznanili tudi v gradivu, ki je bilo pripravljeno v zvezi z novimi koncepti lokalne samouprave in objavljeno v posebni številki Poročevalca."
18,Pod Italijo je bil monsignor Krk v Rimu in po vojni je bil Petrinja v CK in skupščini.
16,"Mislim, da morajo tudi prebivalci biti en faktor, vendar mislim, da ne morejo biti odločujoč faktor."
40,"Gre za dejstvo, da je že Zakonodajno-pravna komisija napisala v svojih točkah, da je ugotovila, da rešitve pri oblikovanju volilnih enot, ki bi vsaj približno upoštevale število prebivalcev in istočasno regijsko povezanost ter bi bile vsem ustrezne, niso bile dosežene."
38,"Tudi javno objavljeni sklepi občinskih skupščin Domžal in Kamnika so naravnani v smeri, da je občini Domžale in Kamnik treba obravnavati kot povezano in od Ljubljane in južno od Save ležečih občin zgodovinsko, geografsko in interesno ločeno področje."
43,"To je prvi problem, kjer naletimo zdaj na težave, na katere smo mi opozarjali pred sprejemanjem ustave, da je treba napraviti državni zbor in regionalni zbor; in to že drugič, ker prvič smo se pri volilni zakonodaji motali okrog tega, zdaj že drugič."
89,"Mi bi bili radi, četudi ena manjših regij in da pravzaprav pridem na to, kar hočem povedati, namreč še to moram dodati, da je naša občinska skupščina že lansko leto, torej mnogo pred tem zakonom, tako da nam nihče ne more očitati, da smo za to vedeli, ker nismo, skupaj sprejeli, da pač pristajamo na to našo idrijsko-cerkljansko regijo, ker smo pa nekje na robu in je naše ozemlje majhno, ni tako veliko, pravijo, nikamor ne spadamo, ampak to je končno argument tudi za nas, da smo lahko samostojni."
68,"Torej, zdaj s temi predlogi zakonov, s temi osnutki smo se znašli nekako prvič v zgodovini, bi rekel, da je zdaj cela občina izrezana iz Primorske, kajti vsaj po 1918. letu je tudi Idrija primorska, čeprav hkrati tudi notranjska in kaj vem še, ampak en del občine pa za gotovo ne, torej zdaj smo prišli v I. volilno enoto za Državni zbor, to je v sklop gorenjskih občin."
36,"Vrsta pripomb je kazala na to, da bi posamezne občine oziroma po dve ali tri sosednje občine želele imeti svojo volilno enoto ne glede na to, da je po zakonu možno oblikovati le 22 volilnih enot."
13,"Teritorij nima izoblikovanega centra, je geografsko in prometno nepovezan in brez kakršnekoli identitete."
46,"Ustavil bi se pri drugi volilni enoti, in sicer pri 9. in 10. volilnem okraju in bi najprej opozoril na siguren lapsus, ki je nastal, ker v 10. volilni enoti, kjer piše, da je del občin Nova Gorica in spodaj pa piše, da je sedež Sežana."
59,"In sicer v tretji volilni enoti tako, da bosta imeli občina Cerknica in Logatec za svoje območje vsaka svoj samostojni volilni okraj, v 5 volilni enoti tako, da bosta imeli občini Dravograd in Radlje za svoje območje vsaka svoj samostojni volilni okraj in v 6 volilni enoti občini Metlika in Črnomelj prav tako, da vsaka dobi samostojen volilni okraj."
10,Medtem ko naj bi Žalec prišel v sklop savinjskih občin.
48,"Pri tem se je oprl na strokovno podlago, ki jo je pripravil zavod za prostorsko planiranje v okviru ministrstva za urejanje prostora in varstvo okolja in oblikoval te urbane regije, ki so se v dosedanjem policentričnem razvoju oblikovale kot specifična regionalna območja, ki se navezujejo na določen center."
32,"V predlaganem zakonskem osnutku smo glede na pripombe k prvotnemu gradivu sledili konceptu 19 urbanih regij, s tem da bi v treh volilnih enotah z velikim številom občin imeli po dva predstavnika."
17,"Samo za primerjavo, imamo tudi volilne enote, kjer se za 23 oziroma 25.000 ljudi izvoli enega svetnika."
56,"To je po našem mnenju potrebno in nujno izhodišče, ki ga v tem v celjskem in savinjskem prostoru zastopajo občani, ne samo v oblastvenih strukturah, ampak tudi v političnih strankah in tu imam pred sabo eno interpelacijo, ki jo je podpisalo pet strank, torej delavska stranka, stranka krščanskih socialistov, demokratična stranka upokojencev in še dve stranki."
27,"Vendar predlagatelj te osnove v primeru 13. volilne enote, to je prej govoril gospod Štefančič, ki obsega občino Ilirsko Bistrico, Postojno, Cerknico, Logatec in Idrijo, ne upošteva."
61,"Mislim, da je tudi pomota v tem zakonu, in sicer pri volivnih okrajih, kjer v konceptu zakona piše, da je sedež 4. volivnega okraja, ki obsega občino Celje in iz občine Celje je 15.528 prebivalcev in iz občine Žalec 7.452 je prebivalcev; in da je v tem volivnem okraju center občine Celje, sedež vsega tega pa naj bi bil v Žalcu."
30,"Bolj ko prebivalci kamniško domžalskega področja ugotavljamo nevzdržnost in neuspešnost kakršnegakoli povezovanja severnih obljubljanskih občin z južno ležečimi obljubljanskimi občinami in odvisnost obeh skupin občin od Mesta Ljubljane, slabše je."
64,"Po moje mnenju bi se dalo - in tudi drugi, ki so okrog Celja razpravljali, pa Idrije in tako naprej - po moje bi se dalo tem težnjam veliko lažje približati, če bi volilne enote podvojili, da bi jih bilo namesto 8, 16, to se da na matematičen način hitro rešiti in se v eni volilni enoti voli pet, v drugi deset, pa do števila prebivalcev."
37,"Razpravljal sem z eno poslanko, ko domicilni amandma ni bil sprejet, mi je rekla dobesedno: ""Ne predstavljam si, kako bodo prišli ti poslanci s podeželja, kmetje, pa krščanski demokrati, pa bodo nam tukaj pamet solili"" - dobesedno tako."
62,"Ker, če se ne bo razvijal celotni slovenski prostor sinhrono, po vseh svojih delih, potem bomo iz tega slovenskega prostora napravili spačka in tudi to mislim, če je to tako kot smo tukaj slišali, potem naj bo celotna Slovenija ena volilna enota in na tej volilni enoti naj bo 88 imen in stvar zaključimo in se s to zadevo ne ukvarjajmo več."
53,"Torej, ta stvar je med seboj povezana in to je sicer zelo lepo, da bi bil poslanec predstavnik vsega ljudstva, to je hvale vredna želja in cilj in bi bilo lepo, če bi bilo tako, sem za to, da je tako in tudi v ustavi tako piše, ampak verjetno je to težko uresničiti."
66,"Naše izhodišče in odnos do predlaganih zakonskih rešitev izhaja iz jasnega in vsestransko utemeljenega spoznanja oziroma odločitve, soglasno sprejete na skupni seji vseh treh zborov idrijske skupščine, 17. decembra lani, da idrijsko-cerkljansko območje, sedaj upravno združeno v občini Idrija, iz zgodovinskih, zemljepisnih, kulturnih in političnih, zlasti pa gospodarskih vidikov, predstavlja zaokroženo posebno regijo, ki je ni mogoče priključiti kot obrobno ozemlje tej ali oni sosednji regiji."
75,"Ne iz kakšnih prestižnih krajevnih nagibov, pač pa, ker smo trdno prepričani, da se dela krivica našemu prebivalstvu in temu delu Slovenije, je potem naša skupščina na izredni seji vseh treh zborov 3. septembra letos odločno odklonila predlagano odločitev volilnih enot za državni svet, saj meni, da je razvrstitev v popolnem nasprotju tudi z večkrat deklarirano utemeljitvijo v predlogu zakona, namreč da se volilne enote oblikujejo ob upoštevanju zlasti regionalne pripadnosti in dosedanjih povezav občin."
