4,Kdo se je vzdržal?
32,"Lahko se zgodi, da bo nekdo - tujec - na podlagi takšne pogodbe ustanovil podjetje in bo potem nenadoma izdal 800 potrdil tujcem, da bodo delali na podlagi takšne pogodbe in bodo dobili dovoljenje."
19,"Bolje bi bilo, da je delovno dovoljenje vezano na konkretno delovno mesto, seveda da tudi izhaja iz interesa delodajalca."
9,"Konkretne pripombe, ki jih imamo, so pri 6. èlenu."
11,Seveda moramo najprej poskrbeti za naše državljane predvsem z vidika zaposlovanja.
6,"Predlagam, da zbor sprejme naslednji sklep:"
7,Ali želi kdo razpravljati o tem sklepu?
25,"Sicer pa bodo imeli možnost pozneje po rednem zakonu o državljanstvu tudi pridobiti državljanstvo z naturalizacijo itn., ampak tukaj ne bi smeli delati še izjem."
12,"S tem bi odpadli problemi, ki jih je tudi moj predhodnik omenil."
8,Jaz seveda razlikujem zakonodajo o zaposlovanju tujcev dvoplastno.
2,"Ne, hvala."
28,"In sicer zato, da bi prepreèili morebitne anomalije pri izvajanju doloèenih življenjsko pomembnih del ali delovnega procesa, do èesar bi lahko prišlo v preveè restriktivnem operativnem izvajanju zakona."
76,"Glede višine denarnega nadomestila, tu bi lahko samo ponovila, kot so rekli moji predhodniki, vezava na zajamèeni osebni dohodek je tvegana, èe bi osebni dohodki stagnirali, bi ta nadomestila ostajala ves èas enaka, èe bi se gibali tako kot v letu l99l, bi upravièenci brez poraèuna izgubili 20 odstotkov osnove, to smo izraèunali, èe pa bi, recimo, prišlo do hiperinflacije se lahko zgodi, da bi bila ta porodnina zelo dramatièno razvrednotena, kar iz izkušenj že poznamo."
18,"Drugo je pa seveda, kdo se bo pri njem zaposlil, tu bo pa pravzaprav moral on prikazati interes."
10,"Mi mislimo, da tu sploh ni potrebno nobeno delovno dovoljenje."
21,"Povedal sem že za drugo delovno skupino, ki pripravlja stališèa za proraèun - veste, kateri ste - seja je jutri ob 8. uri."
15,"Sedaj gremo (kot veste) na skupno sejo, po kateri je predvidena še delovna skupna seja."
14,Predlog za izdajo zakona z osnutkom zakona je predložila v obravnavo Vlada Republike Slovenije.
13,1. Zbor sprejema predlog za izdajo zakona o zaposlovanju tujcev z osnutkom zakona.
23,"Z zakonom, ali pa vsaj s podzakonskim aktom, bo potrebno natanèneje opredeliti zahtevo, da med brezposelnimi osebami na doloèenem obmoèju ni ustreznega kandidata."
27,"V zakonu tudi ni rešeno vprašanje pravic tujcev, ki izvirajo iz dela, saj tudi ni jasno, kakšne prispevke plaèujejo, zakon bi seveda moral te pravice jasno opredeliti."
33,"S tem je povezana tudi pripomba k 9. tezi; menimo namreè, da nadomestilo ne sme biti nižje od zajamèene plaèe, ne pa, da se na za spodnjo mejo postavlja samo 80% zajamèene plaèe."
1,Hvala.
3,Kdo je proti?
43,"Bojim se, da to ne bo mogoèe v tako kratkem èasu z njimi razèistiti in potem bi seveda prišlo do tega, da bi otroci delavcev, ki pri nas delajo, pa niso naši državljani in imajo otroke v svojih matiènih državah, to pravico izgubili."
24,In še eno obvestilo: usklajevanje zakona o zdravstveni dejavnosti in zakona o lekarniški dejavnosti bo jutri zjutraj ob 8.30 uri v sobi 209/II.
20,"Nasprotno bi pa bilo namreè, da bi zaposlovali tujce in celo dnevne delovne migrante v èasu, ko je brezposelnost velika."
45,"Režim, ki je predviden v osnutku zakona o zaposlovanju tujcev, pa takšnemu tujcu, ki iz kateregakoli razloga po pridobitvi dovoljenja za stalno prebivanje izgubi zaposlitev, sistemsko prepreèuje, da se še zaposli, dokler je na doloèenem obmoèju vsaj en brezposelni z enakimi kvalifikacijskimi in izobrazbenimi karakteristikami."
30,"Predlagam: èe bi se to konèalo pred 18. uro, da se vrnemo in še kaj postorimo, èe se pa ne bo konèalo pred 18. uro, potem pa tega ne predlagam."
29,"Mislimo, da èe je bila izdana negativna odloèba, vemo, da so bili gotovo tehtni razlogi in tu ne bi bilo treba dajati še nekih privilegijev pri dajanju delovnega dovoljenja."
31,"Verjetno velja ta èlen veliko bolj natanèno preuèiti in ga razširiti tudi s takimi konkretnimi zadevi, kot je, npr. sedaj problem, ki se pojavlja na hrvaški meji, v Istri in podobno."
35,"Opozarjamo tudi na 12. èlen, po katerem obrtno dovoljenje za opravljanje samostojne poklicne dejavnosti, ki ga tujcu izda pristojni upravni organ, da se to šteje za osebno delovno dovoljenje in velja za èas opravljanja dejavnosti."
5,"Prosim, da se tega držimo."
41,"Vsekakor ni potreben drugi odstavek, v katerem je doloèeno, da oseba, ki ji je bila v postopku za sprejem v državljanstvo Republike Slovenije izdana negativna odloèba, pridobi osebno delovno dovoljenje,èe v roku 90 dni itd. zaprosi za osebno delovno dovoljenje."
0,.
77,"Torej, kar zadeva prvi del zakona, tisti, ki govori o zaposlovanju tujcev, ki bi na novo prihajali k nam, je splošno preprièanje, da je v redu naravnan, sama pa mislim, da je preveè restriktiven in se strinjam s tistim, kar je na koncu rekel moj predgovornik, jutri bomo hoteli biti integrirani v Evropo, poglejmo njihove doloèbe o zaposlovanju tujcev in videli bomo, da so te doloèbe bistveno ostrejše in da nas s tega vidika od Evrope oddaljujejo."
44,"Tako v prvem èlenu predlagamo, da se obèinski prispevek za zdravstveno varstvo paè tudi zakonsko podaljša do uveljavitve nove zdravstvene zakonodaje, ker ostane do takrat obveznost obèin, da financirajo tiste naloge, ki so jih financirale do sedaj, to je približno 4% obsega zdravstvenih storitev."
22,"Torej to so ljudje, ki niso zaprosili za državljanstvo, ki tu živijo in verjetno se bodo morali poèasi zaèeti obnašati kot tujci."
38,"Osnutek zakona namreè predvideva, da bi morali vsi sedaj zaposleni tujci in tujke v treh mesecih po uveljavitvi zakona oziroma v treh mesecih po izdaji negativne odloèbe v postopku za pridobitev državljanstva vložiti vloge za pridobitev delovnega dovoljenja."
36,"S tega vidika se nam zdi, da so v tezah doloèeni prejemki, jaz mislim, da to so prejemki, da bi bil zakon o prejemkih ne dajatvah, meni se zdi popolnoma logièno, da so ti prejemki prenizki."
26,"Mi vemo, da so bile take pogodbe o dolgoroèni proizvodni kooperaciji itd. v preteklosti sicer za druge namene, ampak so bile velikokrat sredstvo za hude zlorabe."
64,"Sklepi, ki jih predlaga Komisija za obrambo, se glasijo takole: Družbenopolitièni zbor na predlog Komisije za obrambo ne uvršèa v dnevni red predloga za izdajo zakona o spremembah zakona o obrambi in zašèiti s predlogom zakona in predloga za izdajo zakona o spremembah zakona o vojaški dolžnosti s predlogom zakona, ker je potrebno obe podroèji v celoti prouèiti in uskladiti z Ustavo Republike Slovenije."
74,"Drugiè, Vlada Republike Slovenije naj èimprej pripravi in predloži Skupšèini Republike Slovenije spremembe in dopolnitve zakona o vojaški dolžnosti in zakona o obrambi in zašèiti, pri èemer naj poleg ustavne uskladitve prouèi in ustrezno upošteva predloge, mnenja in stališèa, izražena v delovnih telesih Skupšèine Republike Slovenije, v poslanskih vprašanjih in pobudah, pa tudi predloge, vsebovane v obeh zakonih, ki so ju v mesecu decembru 1991 predložili v postopek poslanci Liberalno-demokratske stranke vseh treh zborov."
57,"Mislim, da s sedanjo metodologijo, to je bilo tukaj že veèkrat izreèeno, nihèe ni prav zadovoljen, vendar opozarjam, da je, po mojem mnenju, izdela takšne nove metodologije zelo zahtevna in da se s tem problemom ubadajo tudi v drugih državah - natanèno vem, da na Švedskem - in ne vem, èe se to lahko uredi v neki medresorski komisiji."
42,"Glede variant v 24. èlenu osnutka zakona odloèno podpiramo osnovno besedilo, ki govori, da državljani drugih republik, ki so na dan uveljavitve zakona prebivali na obmoèju Slovenije in so bili tu tudi v delovnem razmerju, pridobijo osebno delovno dovoljenje za nedoloèen èas."
40,"Zato podpiramo tudi predloge, da se z zakonom opredeli tudi naèin valorizacije teh nadomestil, kar je pogoj za to, da se zaradi inflacije in dejstva, da se nadomestilo izraèunava iz starih podatkov, nadomestilo ne bo znižalo po 100 procentov osnove."
34,"Sodimo, da mora biti Republiški zavod za zaposlovanje edini pristojen za izdajo delovnih dovoljenj za vse tujce, tu mislim tujce, ki jih še ni v Sloveniji, ne tiste, ki so tukaj, tisti niso tujci."
49,"Pogoj za zaposlovanje tujcev naj bo torej delovno dovoljenje, ki ga izdaja Republiški zavod za zaposlovanje, pri èemer naj bo predpogoj za izdajo dovoljenja dejstvo, da na doloèenem obmoèju med brezposelnimi, ki so prijavljeni na zavodu, ni ustreznega enakega kandidata, ki bi izpolnjeval vse pogoje, ki jih zahteva delodajalec."
54,"Sam sem mnenja, da ta zakon ni restriktiven do teh, je pa seveda, ne bom rekel restriktiven do tistih tujcev, ki bodo še prihajali, je pravzaprav na nivoju Evropske skupnosti, pravzaprav še malo bolj liberalen, kot èe bi se hotel recimo nek Slovenec zaposliti, ker še nismo v Evropski skupnosti, v Avstriji ali Italiji."
52,"Zgledovati bi se seveda morali pri tistih narodih, ki so se zavedli pomembnosti svojega obstoja in dajo za družinske prejemke tudi do tri odstotke nacionalnega dohodka, na primer Francija ali pa celo iz realsocialistiènih držav, bivših realsocialistiènih držav kot je Èeška, 3,1% ali Madžarska 2,6% in Avstrija ter Belgija 2,8% nacionalnega dohodka."
17,"2. Zbor nalaga predlagatelju, da ob upoštevanju razprave na zboru in v delovnih telesih pripravi predlog zakona."
16,"S tem je ta predlog sklepa z 41 glasovi za, 1 proti in 1 vzdržanim sprejet."
37,"Druga zadrega je, da pravzaprav obravnava in je prisiljen obravnavati kot tujce naše dovèerajšnje sodržavljane, od katerih je 55.000 takih, ki niso mogli postati naši sodržavljani, ker preprosto niso izpolnili pogojev, da bi lahko zaprosili za državljanstvo."
56,"Je pa ta rešitev seveda sprejemljivejša tudi za zaposlene glede na to, da gre za najmanj 55 tisoè ljudi, ki nimajo stalnega bivališèa v Sloveniji in zato tudi niso imeli možnosti za pridobitev državljanstva, poleg njih pa še za tiste, ki državljanstva ne bodo dobili, kar lahko sproži nepotrebne socialne, nacionalistiène in tudi katere druge konflikte."
46,"V drugem èlenu predlagamo za invalidska podjetja specifièno ureditev, da se prav tako podaljša, to je vezano na zakon o prispevku, do sistemskega pokojninskega in zdravstvenega zakona, po katerih naj bi po predlogih tudi ta podjetja ne odvajala prispevkov, ampak jih uporabljala za razvoj svoje dejavnosti."
166,"Da bi dobili vpogled nad obsegom teh sredstev in naèinom njihovega korišèenja, prosim, da mi Vlada Republike Slovenije pisno posreduje merila, ki jih je 11.novembra sprejela; da posreduje seznam objektov, zemljišè in stanovanj, ki jih je prevzel od nekdanje Jugoslovanske armade; da posreduje oceno prihodkov iz naslova najemnin in podobnih pogodb, ki jih je oz. jih namerava skleniti v zvezi s temi objekti in zemljišèi; da Ministrstvo za obrambo posreduje seznam zemljišè in objektov, ki bodo služili za potrebe obrambe Republike Slovenije in seznam namenske uporabe drugih zemljišè in objektov; da posreduje seznam objektov in zemljišè, za katera je že sklenil najemne in podobne pogodbe z navedbo najemnika in višine najemnine in da izvršni svet, glede na dejstvo, da je po prvem odstavku 9. èlena ustavnega zakona že prevzel v upravljanje vse premièno in nepremièno premoženje bivše Jugoslovanske armade, odgovori, ali in kdaj namerava predlagati ustrezni zakon o prodaji stanovanjskih enot bivšega vojaškega stanovanjskega sklada oziroma zakaj takega predpisa ne more ali ne namerava predlagati."
39,"Tu imamo seveda tudi drugaène predloge, kot smo slišali od Liberalnih demokratov in prenoviteljev, namreè, to prehodno obdobje, kot reèeno, menimo, da je to v glavnem rešeno z zakonom o državljanstvu, zato naèeloma ta èlen ne bi bil potreben."
48,"Ta rešitev je sprejemljivejša z vidika podjetja oziroma delodajalca, ker ne posega v obstojeèi delovni proces, medtem ko variantni predlog, ki predvideva izdajo takšnega dovoljenja za dve leti, od podjetja oziroma delodajalca zahteva, da po sili administrativne zahteve prilagaja svojo kadrovsko sliko in s tem celoten delovni proces."
59,"Jaz bom krajši, kot sem mislil biti, ker bom moral oditi na usklajevalno Komisijo za zdravstveno zakonodajo, pa vendarle to je prvi zakon, ki ga je obravnavala Komisija za družino kot matièno telo in bi v tej zvezi rad rekel samo tole: zdi se, da položaj družine v slovenski državi odsevajo nekatera dejstva, ki jih pa moram tu omeniti."
68,"V kolikor torej tu neke izjeme so, pa bi poleg državljanov bivše SFRJ morali imeti vsaj enak položaj tudi tuji državljani slovenskega rodu, ki vsekakor ne bi smeli biti na slabšem, mi pa imamo tudi izrecen interes, da se vzpostavi stik z domovino za Slovence, ki živijo v tujini, tako da predlagamo, da se ta 24. èlen, v kolikor bo ostal, da se dopolni še s to kategorijo."
72,"Obrazložitev: Ustavno sodišèe je ugotovilo, da doloèba 4. èlena zakona o spremembah in dopolnitvah zakona o pokojninskem in invalidskem zavarovanju ni v skladu z Ustavo Republike Slovenije, v kolikor se nanaša na pokojnine, uveljavljene v èasu od 1.1.1991 do vkljuèno 21.3.1991, ker ni v skladu z doloèbo prvega odstavka 261. èlena ustave, ki skupaj z amandmajem 57 k ustavi doloèa, da predpisi in drugi splošni akti ne morejo imeti uèinka za nazaj."
63,"Gre samo za to, da se ne sme veè èakati, da bo še eno šolsko leto izgubljeno,ker so v zakonu potem vezave na pravice kandidiranja za direktorska mesta na višjo in visoko izobrazbo in s tem izkljuèimo ali pa otežimo kandidiranje ljudi, ki imajo po sili razmer zdaj samo višjo izobrazbo za ta mesta, imajo pa specialno izobrazbo na podroèju socialnega dela."
58,"Imamo pa še priložnost, da to ustrezno reguliramo oziroma ustrezno zvišamo, predlagamo pa torej po dohodkovnem cenzusu vendarle nekoliko diferencirano lestvico, kajti, tako kot so že pred menoj povedali številni razpravljalci, je ta namenjena seveda najosnovnejšim potrebam otrok in preprièan sem, da tukaj otrok ne smemo diferencirati in jim moramo omogoèiti vsaj tiste minimalne potrebe, da jih uresnièujejo."
71,"Mi smo seveda preprièani, da ta trenutek seveda doloèeni problemi še niso tako aktualni, vendar smo preprièani, Slovenija, sedaj kot samostojna država in priznana, se bo gotovo razvila, bo zelo cvetoèa, upajmo, evropska država tudi gospodarsko z visokim standardom in tedaj bodo seveda lahko dosti moèni migracijski pritiski tako iz sosednjih dežel, ki bodo morda še manj stabilne, kot tudi iz dežel tretjega sveta, kajti smo tudi na takšnem geografskem položaju."
47,"Ob tem pa vendarle kaže vendarle izreèi kritiko na raèun vlade, ki prihaja s predlaganim zakonom razmeroma pozno in èeprav gre za precej obèutljivo problematiko, ki od podjetij in ljudi zahteva ustrezno prilagoditev in potreben èas zanjo, predlaga zakonodajni postopek z združitvijo prve in druge faze postopka."
51,"Pri tem imamo tudi ob istem povpreènem osebnem dohodku torej, do 35 procentov višji zaèetek, ki je približno še enkrat višji od tega, ki ga predlagatelj predlaga, imamo pa tudi dohodkovno lestvico razdeljeno podobno, vendar ne do 50 procentov, paè pa do 7o procentov povpreènega osebnega dohodka na družinskega èlana."
80,"Preprost izraèun nam tako pokaže, da je ocena o 90 tisoè upravièencih do socialne pomoèi v letu 1992 najbrž nerealno nizka, celo ob predpostavki, da bodo kriteriji za prejemanje raznih vrst pomoèi, ki so že sedaj zelo zaostreni, znižani iz 43 na 46 odstotkov povpreène slovenske plaèe, kar je septembra 1991 pomenilo naslednje: dvoèlanska družina bo upravièena do socialnih dajatev šele, èe njeni dohodki, brez štipendij in otroških dodatkov, ne bi presegli 5000 tolarjev oziroma pri štirièlanski družini 12000 tolarjev."
53,"Zato mislim, da dokler se vprašanje zajamèenega osebnega dohodka ne reši, tako kot smo to v Odboru za delo, v sindikatih zahtevali že ves èas, ta zakon za poslanski klub Stranke demokratiène prenove ni sprejemljiv in mislim, da je že èas, da se zgane vlada in nekaj v zvezi s tem tudi ukrene."
65,"Prvo dejstvo je to, da javnost nekako ne vidi dela te komisije, èeprav smo doslej spremljali vso zakonodajo, ki se je kakorkoli dotikala tudi te problematike in moram reèi, da tudi na tej seji, bom rekel predstavnikov javnosti, ali recimo sredstev javnega obvešèanja ni bilo veliko, kolikor pa so bili, so precej pred koncem odšli in seveda, temu primeren je bil tudi odmev v javnosti."
55,"Najveèji problem zakona je pravzaprav, da ima zelo pretenciozen naslov, rešuje pa zelo ozko vprašanje in ga tudi ne more reševati bolj koncizno, preprosto zaradi tega, ker v naši republiki, v naši državi še nimamo eksplicitne imigracijske delovne politike in zato je to v bistvu zakon, ki rešuje dodeljevanje delovnih dovoljenj, ne pa zaposlovanje tujcev."
83,"Hkrati obenem smo preprièani, da je prav, da je postopek trifazen, ker mislimo, da je mogoèe v tem trifaznem postopku marsikatero stvar izboljšati, èeprav se zavedamo, da kakšnih bistvenih izboljšav ne bo mogoèe pripeljati vanj, glede na to, v kakšnem materialnem položaju je Slovenija, ali paè, jaz upam, da bodo poslanci spregovorili tudi o drugih plateh ali o možnostih, ki se pa le morda ponujajo, da bi ta zakon dobil trdnejšo materialno osnovo, ker navsezadnje, tu je zaèetek in konec uresnièevanja tega zakona."
61,"Omenili smo jih tudi mi, pri èemer smo zlasti izpostavili to, da gre pri otroških dodatkih zares za majhne vsote in seveda na tak naèin si Komisija za družino ne predstavlja oziroma si ne zna èisto dobro predstavljati, kako naj bi vodili navsezadnje tudi demografsko politiko, èe reèemo, da je ta zakon eden tistih, ki naj spodbuja odloèanje za rojstvo otrok."
62,"Zato bi kazalo razmisliti o èim veèji poenostavitvi tega postopka v smeri veèje vloge podjetja oziroma drugega delodajalca pri izdaji teh dovoljenj za delavce in delavke, ki so pri njih zaposleni ali pa vsaj za izdajo podzakonskega akta hkrati k zakonu, ki bi ta postopek poenostavil, predvsem pa ga povsem jasno predstavil tako upravièencem kot tistim, ki bodo o izdaji dovoljenj odloèali."
60,"Veseli me, da so mnoge od predlogov, ki jih predlagamo Slovenski kršèanski demokrati, podprle tudi skupšèinske komisije in posamezniki, ki so nastopili pred menoj, zavzemamo se torej tudi pri otroškem dodatku za uèinkovit otroški dodatek in ne le za simbolièen, ob tem da upoštevamo tudi progresivno lestvico, to pa pomeni konkretno, da se za vsakega nadaljnjega otroka nameni veè sredstev."
50,"Èe se boste spomnili, smo Slovenski kršèanski demokrati zelo vztrajali vsaj pri še enkrat višjem takem otroškem dodatku za slehernega otroka, vendar so bile grožnje z odstopom ministra za finance nekoliko hude in smo pristali tam, kjer smo, to pa pomeni konkretno za december približno 500 tolarjev pri povpreèni plaèi."
84,"Kljub temu da se strinjam s kritiki, ki pravijo, da je škoda, ker nismo tega dobili v takšnem vrstnem redu, pa mislim, da je vendarle prav, da danes o tem zakonu resno razpravljamo, in sicer zaradi tega, ker ta zakon ureja do sedaj obstojeèe pravice do dajatev za mater, za otroka in za družino, jih širi na dveh najbolj nujnih segmentih, namreè s tem, ko ureja materinski dodatek in s tem ko širi tudi število, število otrok, ki so upravièeni in višino otroškega dodatka."
87,"Tudi glede poveèanja sredstev za družinske dajatve nimamo naèelnih zadržkov, jaz se ne bi zanesla na èrne prerokbe, kako bomo kot narod izumrli, vendar so nekatera dejstva neizprosna in eno izmed njih je, da smo z veè kot 3o tisoè rojstev na leto pred komaj 13 leti zdaj upadli na komaj 21 tisoè rojstev na leto in to je razlog, da se vznemirimo, kajti, èe se nam ne rodi dovolj veliko otrok, obstaja resna nevarnost, da bomo v razvoju zaostajali in se kot družba prehitro starali."
70,"Zato bi bilo nujno, da se drugi odstavek 6. èlena èrta in to vprašanje razreši bodisi tako, da se tujcem, ki imajo dovoljenje za stalno prebivanje v Sloveniji, izda stalno delovno dovoljenje, na podlagi katerega lahko konkurirajo za sklenitev delovnega razmerja, ne glede na v 5. èlenu opredeljene pogoje, stanje brezposelnosti, ali pa z izenaèitvijo statusa tujcev z dovoljenjem za stalno prebivanje z državljani in državljankami Slovenije glede delovno-pravne zakonodaje."
66,"Kljub temu pa nas tudi do njih vežejo predplebiscitne obljube vseh strank in veže nas elementarni èut za praviènost, da jim ne moremo odvzeti tistega, kar so si s svojim dosedanjim delom skupaj z nami ustvarili in seveda tudi elementarna politièna pamet, da moramo na tem podroèju ravnati tako, da si bomo gradili mostove z državami nekdanje Jugoslavije, pa tudi s politiko na tem podroèju podpirali."
73,"Kar pa zadeva rešitve v drugem delu tega zakona, tistem, ki se nanaša na prehodne doloèbe, pa v našem klubu menimo takole: da bi bilo v 24. èlenu treba podpreti osnovni tekst, da bi v 25. èlenu sicer podprli varianto, vendar bi jo dopolnili tako, da bi tudi dnevni imigranti, ki so v delovnem razmerju za nedoloèen èas, preko delodajalca lahko dobili delovno dovoljenje ne z omejenim trajanjem ampak tudi za nedoloèen èas."
78,"Opozarjamo na 8. èlen in predlagamo, naj predlagatelj temeljito prouèi dikcijo, ki govori o tem, kdaj lahko pridobi osebno delovno dovoljenje, v kolikor bo ostalo in to je vezano na katerokoli zaposlitev, tujec, ki vloži priložene dokaze, iz katerih je razvidno, da bo opravljal na obmoèju Republike Slovenije dejavnosti, predvidene s predpisi, ki urejajo tuja vlaganja in opravljanja zunanjega trgovinskega poslovanja itd. in med drugim tudi pogodbe o poslovno-tehniènem sodelovanju oziroma dolgoroèni proizvodni kooperaciji oziroma o prenosu tehnologije."
