10,"Spoštovane poslanke in poslanci, najprej vprašanje, ki bo zelo kratko."
22,"To je prviè, drugo pa ali pozna države, kjer je poslovanje privatnih bolnic oziroma privatnih ordinacij rešilo splošno pomanjkanje denarja v zdravstvu."
7,Teh je dovolj in zdaj je tako.
18,"Zdaj, da se ta vrsta elektrarn ne gradi, to vem, zanima me pa kako je s temi študijami."
3,Jutri ne bo!
20,Kdo je za razširitev dnevnega reda te naše 44. seje s predlogom zakona o posebnem prispevku solidarnosti za pomoè beguncem?
12,"Saj so, samo smo tudi slišali, kako so obravnavali in so odklonili."
8,"Poslušajte, gospe in gospodje, saj to je smešno."
34,"Jaz sem sicer povedal, da dvomim o tem, da bo naš zbor to po takem postopku sprejemal, kot je bil predlog, ampak sem pa seveda dolžen prenesti, takšno je bilo veèinsko stališèe na komisiji."
19,"Veèina današnjih bolnikov pa se vrne uživat penzijo in èe hoèete, prosim, ne me razumeti napaèno, tratit državni denar."
5,Drugo vprašanje je pa to.
37,"Menimo, da je invalidska problematika tako specifièna, da se bodo lahko le z avtonomnim prizadevanjem pristojnega ministrstva urejale bistvene neloge invalidskega varstva, vkljuèno z uveljavljanjem sistema spremljanja ekonomskih in socialnih uèinkov izvajanja sprejete politike v naši državi."
42,"Kljub temu so tudi te inštitucije že dale nekatere sugestije oziroma pripombe, ki pa bolj pomenijo izboljšavo teksta ali pa konkretizacijo nekaterih doloèb, ne pa odstop od tega osnovnega naèela, ki ga zakon glede organiziranja in delitve dela v veterinarski službi predlaga."
15,"Namreè, èe se v nadaljnji situaciji še nadaljujejo koliko to stane in kdo ih financira."
21,"Vsi vemo, da je pred nami - jaz mislim, da letos vojne ali èesa takšnega ne bo - èas poèitnic in èas dopustov."
13,"Vsi veste, da smo dosti govorili o demografsko ogroženih obmoèjih v Republiki Sloveniji."
2,Še kdo?
11,"Potem bi zakljuèili, ob 15.00 se pa v veliki dvorani vidimo."
9,"Mislim, da tega v tem trenutku povezovati ni mogoèe."
4,Govori o nepotrebnih bolnicah.
43,"Praksa pa je pokazala, da marsikateri od mlajše generacije tega ne ve, zato prihaja do sporov in prav s tem v zvezi postavljam vprašanje: kateri zvezni ali republiški zakon iz bivše Jugoslavije ureja to, in, èe je v Republiki Sloveniji še v veljavi?"
6,To bomo pa vsi pol odloèali.
44,"Upam si trditi, da marsikdo izmed nas v popoldanskem èasu, ravno zaradi tega, ker ta služba ni tako organizirana kot bi morala biti in kot je v svetu in izkljuèno zaradi financ, marsikdo izmed nas popoldne od dveh naprej ne bi dobil ustrezne oskrbe."
64,"Uvodoma je bilo povedano stališèe Odbora za pravosodje in upravo, mislim, da je to lahko kot simptom, ker se vleèe tudi skozi današnje razprave, namreè vsak se naèelno zavzame za operativno in majhno vlado, potem pa sledi vejica in besedica vendar, potem je pa odvisno, èe prihaja iz industrije ali rudarstva, bo videl tam potrebo po treh ministrstvih, pa bo združeval šolstvo in kulturo."
25,"Jaz mislim, da mora biti nam vsem jasno, da je zdravstvo danes humanitarna dejavnost in toliko, kolikor denarja odštejemo za to, toliko ga tudi imamo."
1,Hvala.
30,"Namreè, nekateri smo s teh obmoèij pošiljali veè prošenj, ampak so rekli, da brez javnega nateèaja teh prošenj ne morejo reševati, javnih nateèajev pa ni in tukaj je krog zaprt."
28,"Zakonodajalec pa mora pri tem, seveda pri svojih izhodišèih, vztrajati in zakon o vladi v svojih tezah nakazuje rešitve, ki jih podpiramo, vendar ne kaže se preveè ozirati."
14,"Razen, èe ne bi bil drugaèen sklep tam, ko bomo vsi v veliki dvorani!"
32,"Drugo vprašanje pa je na zahtevo Skupšèine obèine Ravne na Koroškem, ki postavljajo vprašanje, nalagajo nam, delegatom iz koroške obèine, da ponovno sprožimo vprašanje namenske uporabe bencinskega tolarja in prihodkov od cestnin."
23,"Le na ta naèin lahko prièakujemo, da bo del sredstev namenjen tudi za ureditev cest na našem obmoèju, kjer je stanje že katastrofalno."
41,"V 25. èlenu tega zakona sem zasledil zopet zadevo, ki se vleèe pri nas že kar precej èasa skozi razne carinske in uvozno-izvozne zakonodaje, namreè klasificiranje državljanov na dve vrsti, na tiste, ki delajo zunaj in na tiste, ki delajo doma."
51,"Predlog za izdajo zakona je v obravnavo predložila Vlada Republike Slovenije, objavljen je bil v Poroèevalcu št. 8. Predlog so obravnavali: Odbor za pravosodje in upravo, ki je ugotovil, da predlagani osnutek zakona, skladno s novo ustavo skuša urediti položaj, sestavo in delovanje Vlade v smislu 114. èlena Ustave Republike Slovenije."
17,"Mi smo tu o tem problemu dosti diskutirali, vendar v veliki meri za to mi nismo odgovorni."
16,Ta sredstva naj se zbirajo na posebnem raèunu in se koristijo izkljuèno za urejanje cestnega omrežja.
29,"To so pa podroèja družbenih dejavnosti in zato zastavljam naslednje vprašanje: zakaj ni javnega nateèaja za pridobitev sredstev, ki so namenjena za demografsko ogroženo obmoèje s podroèja družbenih dejavnosti?"
56,"Jaz moram reèi, da zato še posebej poudarjam, da je bil kljub nekaterim ugovorom sklep, da je treba z doloèenim korekturami, ki naj bi bile usklajene z vso zakonodajo pri nas tako èasovno, vsebinsko kot denarno ta zakon v celoti podpreti in zahtevati odgovornost tistih, ki do sedaj niso storili vsega, da bi se to zgodilo."
59,"Namreè, èe gremo iz aspekta, da se tukaj sreèujejo dela špediterjev in carinarjev, je v tujih zakonih oziroma tujih conah zaslediti, da so špediterji sami zadolženi za carinske postopke in da je v velikih conah, recimo švicarskih, po en sam carinik v službi, ne pa pri nas, kjer je teh ljudi veliko veè, rezultat tega pa ni tako majhen."
57,"In tukaj - zakaj Komisija za pomorstvo - mi se nismo toliko spušèali niti v ta strateški razvoj Slovenije kot take, niti se nismo toliko spušèali v tiste sedanje potencialne nosilce obstojeèih industrijskih con na kontinentu, izhajajoè iz tega in tu nam je jasno, da na morju, ob luki ne glede na strateški razvoj, mi bomo nekaj takšnega potrebovali."
54,"Spoštovani, ker že kar nekaj èasa govorimo o tem našem cestnem križu za dve leti nazaj, predlanski in lanski proraèun, èe se spomnimo, smo najbolj govorili o odseku Celje - Ljubljana, seveda tisti na južnem delu so govorili o odcepu nadaljevanja avtoceste od Razdrtega pa proti Kopru in Gorici, Prekmurci pa o posodobitvi te ceste."
35,"Republika Hrvaška je postala samostojna država, Slovenija je postala samostojna država, tukaj ni èistega plaèilnega prometa, tukaj so potrebni pasoši, tukaj je potrebno pridobiti vize za zaposlovanje naših delavcev, ki bi delali v teh obratih."
24,"Tudi kandidat za sedanjega ministra, gospod Kozinc, vidi potrebo po razloèevanju teh dveh komponent svojega ministrstva, torej plus eno ministrstvo ali uprava nekomu drugemu."
60,"Seveda, nenazadnje bi zakljuèil s tem, èe bo Skupšèina sprejela predlog, tak, kakršnega je ponudila Vlada, bo - to je bilo že danes povedano - pripomogla k poglabljanju nacionalnih konfliktov, predvsem z vsiljevanjem videza, da so za socialne probleme in probleme zaposlovanja krive priseljenke in priseljenci iz drugih republik nekdanje SFRJ, ne pa zgrešena ekonomska politika, ki jo je vodila dosedanja vlada."
26,"Skupna komisija predlaga Zboru združenega dela, da uvrsti na dnevni red predlog zakona o spremembah in dopolnitvah zakona o podjetjih in ga obravnava po hitrem postopku."
39,"Zato dajem pobudo, da bi Vlada Republike Slovenije uredila z Vlado Republike Hrvaške to vprašanje tako, da bi bilo tudi že v letošnjem poletju mogoèe letovanje naših otrok na Hrvaškem in tudi naših delavcev, ki imajo tam poèitniške domove."
50,"Mnoge dejavnosti so splošnega interesa in zaradi varstva javne koristi, to je zdravje ljudi in živali, zdravo okolje, neoporeèna živila živalskega izvora so take dejavnosti celo obvezne in take dejavnosti mora država vsiliti tistim, ki te dejavnosti naj bi uporabljali, èetudi niso uvideli, kakšne koristi jim pravzaprav taka dejavnost nudi."
77,"Jaz ne bi razpravljala o vsebini amandmajev in stališè predlagatelja, samo želela bi, da gospa z Ministrstva za delo pojasni situacijo okrog 26. èlena, kjer bi po zakonu bili v podjetjih dolžni, èe hoèemo vedeti, kdo je tu, kdo ne, iskati državljanski list ali pa potrdilo o državljanstvu, da pojasni situacijo oziroma dogovor med Ministrstvom za notranje zadeve, da ne bi bilo potem kasneje, ko bi dejansko bilo izvajanje potrebno, nepotrebnih pošiljanj ljudi po potrdila o državljanstvu."
49,"Jaz bi rad gospodu Kopaèu v imenu zdravstvenih delavcev in verjamem, vseh svojih kolegov, zastavil nekaj vprašanj, èeprav je primarij doktor Arzenšek že postavil to vprašanje, pa vendar mislim, da je bilo po moji oceni premalo odmevno in tudi ne samo po moji oceni, tudi po oceni mojih kolegov."
78,"Moram reèi, da smo sledili tistim pripombam, kar sicer pomeni nekaj restriktivnejši pristop, tistim pripombam, ki so šle v to smer, naj se loèijo med tistimi tujci, ki že delajo v Republiki Sloveniji na take, ki so tu že dalj èasa, to se pravi, ki imajo daljši delovni èas in med tistimi, ki so tu krajši èas, ki so tu v delovnem razmerju samo za doloèen èas, oziroma, ki prihajajo na delo v Slovenijo kot dnevni delovni migranti."
55,"Jasno je, da je po lanskem oktobru situacija v Sloveniji bistveno drugaèna, kot je bila prej, jasno je, da ogromen tranzit trenutno potuje skozi Slovenijo in to je prilika - vsaj jaz jo vidim - da to izkoristimo, da pritegnemo tuje sovlagatelje, da naredimo to cesto zdaj, ko so tudi oni zainteresirani, da vlagajo v to cesto."
45,"Ni mišljen prost uvoz v smislu brez plaèila carine, ker samo carinsko problematiko in plaèilo dajatev ureja carinski zakon, medtem ko tukaj, ko govorimo ""prosto"", mislimo brez posebnih dovoljenj oziroma soglasij in možnost, da se uvozi tudi vozilo, ki je paè staro do treh let."
40,"Danes je tega bistveno manj, posebno še zaradi tega, ker sta se obe Nemèiji združili - Vzhodna in Zahodna, zdaj je nastala ena sama Nemèija in so naši ljudje iz Vzhodne Nemèije prišli domov in nimajo nobenega dovoljenja za delo tam."
33,"Zakonodajno-pravna komisija je z vidika svoje pristojnosti menila, da je predlog za izdajo zakona z osnutkom pravno-tehnièno pa tudi sicer strokovno solidno pripravljen ter, da vsebuje potrebne elemente za presojo ustreznosti predlaganih rešitev."
46,"V kolikor pa bo iz upravièenih razlogov mnenje predlagatelja negativno, to se pravi, da to ne bi bilo mogoèe, komisija meni, da se 57. èlen dopolni z državnim sekretariatom za invalide, ki ga tudi vodi in predstavlja v Vladi minister za zdravstvo, družino in socialno varstvo."
63,"Èe ne bi jaz zakljuèil to našo 44. sejo - zaèasno - zaradi tega, ker imamo še vedno odprto vprašanje - predlog zakona o posebnem prispevku solidarnosti za pomoè beguncem - potem pa te štiri toèke, ki smo jih paè pripeljali tako daleè, da zdaj èakamo na stališèa matiènih delovnih teles in vlade do amandmajev pri 2. toèki, 3. toèki, 5. in 6. toèki našega dnevnega reda."
58,"Kakor veste, smo v Republiki Sloveniji poskušali za tiste ogrožene sloje, kot so bili otroci, katerih starši niso zmogli letovanja na morju, in za delavce v tovarnah z zelo nizkimi dohodki je Slovenija vložila ogromno denarja za to, da je zgradila letovišèa na obmoèju Republike Hrvaške, bodisi da je šlo za poèitniške domove ali pa za okrevališèa otrok."
61,"Ob tem smo poslušali tudi ljudi, ki so si ogledali takšne cone v tujini, o organizaciji v teh conah in tak prerez, èe bi rekli, in priporoèilo Vladi, kako naj s tem zakonom poèenja in ga dograjuje, bi bil naslednji: da je v tem zakonu za delo v prostih conah, kjer naj bi se oblikovale proizvodnje, še veliko preveè normativizma, kontrole."
52,"Namreè, da nekomu dajemo pravice brez carinskega uvoza in je ta èas, ko je bila njegova domovina potrebna temeljitega dela, veèjega odrekanja, bil v boljših pogojih kot tisti delavci, ki so ostali doma in da potem, ko se vraèa domov, ne plaèa carinskih dajatev na uvoženo opremo ali vozila in tako dalje."
36,"Objavljen je bil v Poroèevalcu številka 8. Predlog za izdajo zakona sta obravnavala Odbor za kmetijstvo in gozdarstvo, ki je v naèelni razpravi poudarjal, da obrazložitev predstavnika predlagatelja ne ustreza tezam iz predloga za izdajo zakona."
38,"Ta reè naj bi bila nekako bolj neformalna, ker èe se formalizira, potem se lahko zgodi, da se znotraj vlade oblikuje nek neformalen center odloèanja, v katerem bodo bolj pomembni ministri, drugi, manj pomembni, bodo ostali pa izven."
27,"Vemo pa, da je na takem obmoèju zelo važno, ali ima tako demografsko ogroženo obmoèje tudi v redu zdravstveno ustanovo ali ima tako ogroženo obmoèje tudi šolo."
71,"Ta zakon dejansko se z obrtnimi dovoljenji, z zasebnim delom, s poklicnim delom ne ukvarja in ne želi drugega, kot povedati to, da tisti, ki to dovoljenje dobi tam, kjer se paè izdaja in na podlagi predpisov, na podlagi katerih se izdaja, vemo pa, da obrtna dovoljenja se izdajajo na podlagi zakona o obrti na pristojnih obèinskih upravnih organih, medtem ko se izdajajo dovoljenja za neko poklicno dejavnost na pristojnih ministrstvih."
62,"Osebno sem na tem stališèu, da je Slovenija ravno toliko velika za eno dobro cono v pravem pomenu besede, vendar na tej razvojni fazi, kot smo, si mi ne moremo zamišljati, da bi imeli duty free cono brez carin, tako kot je Singapur, Hongkong ali Tajvan in da bomo potrebovali lep èas in iti skozi doloèeno zašèitno politiko ter urejati naš razvoj."
48,"Tu je Vlado Puc dal pobudo in zahtevo v zvezi z vprašanji glede demografsko ogroženih obmoèji in, èe dejansko družbene dejavnosti ne morejo participirati pri teh sredstvih, Anka Osterman pa v zvezi s pošiljanjem delavcev v Zvezno Republiko Nemèijo in z akcijami, ki jih ima Ministrstvo za delo."
101,"Jaz mislim, da smo jih obrazložili v toèki 9, drugi odstavek oziroma na strani 7. Gre verjetno za to in jaz to razumem, da je paè bilo v tem smislu vprašanje postavljeno, da je eno najbolj problematiènih sprememb razlikovanje delavcev na tiste, ki so tu že dalj èasa in na tiste, ki so manj, ker v bistvu razlika med osnutkom, med predhodnim režimom v osnutku in predlogu je ta, da prej smo dajali osebna delovna dovoljenja praktièno vsem, ki so tu že bili in delali, zdaj pa jih dajemo enim samo za eno leto, ostalim pa permanentno oziroma za nedoloèen èas."
0,.
47,"Odbor se je seznanil z amandmaji Komisije za varstvo okolja in naravne dedišèine, ki jih je predlagala kot zainteresirano delovno telo k 2., 7. in 11. èlenu, ni pa podprl amandmaja k 11. èlenu, saj gre za strokoven in operativen program, za katerega mora biti pristojna Vlada."
31,"Zato predlagam, da ta zakon obravnavate, ga skupaj s pripombami sprejmete in tudi naložite Vladi, da èimprej pripravi osnutek zakona, seveda ob upoštevanju pripomb, ki jih bo mogoèe v zakon vkljuèiti."
94,"V glavnem je predlagatelj od procedure osnutka do predloga zakona upošteval pripombe, razen tiste pripombe, ki se je zaèela že v osnutku zakona glede odškodnine, ko je stališèe predlagatelja v tem, da naj bi se vprašanje odškodnine urejalo potem, ko bo sprejet zakon o varstvu okolja, ki bo sistemsko urejal to vprašanje in to se potem replicira na konkretnem primeru RUŽ, ker tako posplošen amandma, predlog amandmaja, da naj se uredi odškodnina, bolj želi, torej ti, ki so dali to pripombo oziroma amandma gre za to, da se opozori, da bo treba to upoštevati."
66,"To je stvar, kako ga mi definiramo in kako bomo status in kakšne olajšave in kakšne stimulanse in tako naprej in naša želja je samo, da se to sproži, da ne èakamo, kot je Vlada želela in mislila, da naj èakamo, da se vse prej reši, da mi soustvarjamo, pomagamo ta koncept graditi naprej, s tem, da bomo forsirali tako obliko v Kopru, kot sem povedal."
135,"Druga stvar, rad bi sporoèil tole, da je žalski župan, gospod Milan Dobnik, glede na to, da so predstavniki Vlade pri obravnavi zakona o proraèunu, ko se je govorilo o cestah in glede na dva amandmaja, katera sem jaz posredoval v zvezi s to cesto, sicer samo del trase, praktièno recimo in da so tam v vsebinskem pogledu bile obrazložitve, da - saj to bi šlo hitreje, èe ne bi zavirala žalska obèina z razno-raznimi stvarmi, kar se tièe naravne dedišèine, odkupa zemljišèa in podobnih stvari, in ker se je žalski župan èutil prizadet, je izjavil javno, moram pa reèi, da je nekaj poslancev tukaj prisotnih, ko je tekla 2-3 urna razprava, katere so se udeležili - moram reèi - poslanci, ki so utegnili iz Maribora, Konjic, Celja in tako dalje - ugotoviti, da to sploh ni vzrok."
72,"Na drugi strani pa so govorili o tem, da ni mogoèe kar na vrat na nos pripraviti projektne dokumentacije glede na spremenjene pogoje in tako dalje in trdili celo nekaj neresnice, èeš da ta cesta kot važnejši del, pa najvažnejši del cestne infrastrukture Republike Slovenije ni niti toliko strateško pomembna, kar je v nasprotju z vsemi trditvami, ki, recimo, konkretno veljajo po osamosvojitvi glede na Luko Koper in povezavo z Vzhodno Evropo."
53,"Tako po mnenju komisije ni rešeno vprašanje uèinkovitega nadzora nad poslovanjem podjetja v tujini, ustanovljenega s strani domaèega podjetja, vprašanje vlaganj domaèega kapitala v tuje osebe z njegovim ponovnim vraèanjem v domaèe gospodarstvo in s tem povezanim lastninjenjem, kot tudi ne vprašanje prenosa sredstev v tujino zgolj na podlagi tekoèih odloèitev poslovodnega organa."
83,"To je prva stvar in naj to stori kdo drug in odgovor njihov je bil tale - da koliko imamo visibility študij o tem ali bi bili tuji vlagatelji pripravljeni vložiti v to cesto - in moram reèi, da te visibility študije, jaz sem se vmes pozanimal, ne dela tisti investitor, on lahko samo to preverja ampak recimo tisto, ki to strateško opredeljuje to je država Slovenija, da pa lahko se investitor sam, kot vlagatelj sredstev pridruži s sredstvi, da se ta stvar zajemno naredi."
67,"Jaz bi predlagal naslednje: ker gre tu seveda za precejšna vsebinska vprašanja in tudi za izraèun finanènih posledic, predlagam, da sedaj prekinemo to toèko dnevnega reda, s tem, da smo zakljuèili razpravo in predlaganje amandmajev, da smo si na jasnem in poèakamo potem na mnenje matiènega delovnega telesa, to je Odbora za promet in zveze, Zakonodajno-pravne komisije ter vlade Republike Slovenije in po tem odloèamo o amandmajih."
69,"Predlog za izdajo zakona z osnutkom je tudi v obravnavo predložila Komisija Skupšèine Republike Slovenije za pomorstvo in objavljen je bil v Poroèevalcu št. 9. Predlog za izdajo zakona z osnutkom zakona sta obravnavala Odbor za splošno gospodarske zadeve, kot matièno delovno telo, je bil seznanjen z mnenjem vlade Republike Slovenije o obravnavanem zakonu, v katerem vlada pojasnjuje razloge zaradi katerih ni že sama predložila zakona v skupšèinsko obravnavo."
73,"V zvezi s tem so zbori ob obravnavi odloka o programu statistiènih raziskovanj, pomembnih za republiko za leto 1991, decembra 1990 in januarja 1991 na predlog komisije sprejeli sklep, s katerim so Izvršni svet zavezali, da pri pripravi zakona o republiški upravi predvidi interdisciplinarno stalno vladno telo kot dominantnega uporabnika statistiènih raziskav, ki zadevajo položaj žensk, znotraj katerega bo posebna analitièna skupina vsako leto pripravila integralno poroèilo o položaju žensk v Republiki Sloveniji."
85,"V veterinarsko dejavnost spadajo dejavnosti, ki so namenjene varovanju in izboljševanju zdravja živali, prepreèevanju in zatiranju bolezni, ugotavljanju, diagnosticiranju in zdravljenju bolnih ter poškodovanih živali, zagotavljanju preventivnih ukrepov za varstvo zdravja prebivalstva pred zoonozami in zastrupitvami z živili živalskega izvora, zagotavljanju nemotene reprodukcije živali in ohranjanju in izboljševanju fizioloških lastnosti živali zaradi poveèanja proizvodnje zdravstveno neoporeène hrane, varstvu, izboljševanju èlovekovega okolja in higienskih razmer ter zagotavljanju takih veterinarsko-sanitarnih pogojev, ki bodo pozitivno vplivali na razvoj izvoza in mednarodnega prometa z živalmi ter živili živalskega izvora."
70,"Poleg tega se v prehodnih doloèbah predvideva tudi, te doloèbe so v bistvu najbolj nedodelane, gre pa za prvo fazo zakona in vsi vemo, da lastninskega zakona oziroma zakona o lastninskem preoblikovanju podjetij še nimamo, zato tudi te rešitve niso dodelane, vendar je vseeno predvideno, da bi se lahko del obstojeèih veterinarskih zavodov olastninil in s tem bi bila pod ugodnimi pogoji omogoèena tudi materialna podlaga za razvoj zasebne prakse."
76,"V predlogu za izdajo je tudi predvideno, da bi hkrati s predlogom tega zakona predložili tudi podzakonske akte, ki bodo urejali pogoje, ki jih morajo izpolnjevati tako zasebniki kot njihove oblike organiziranja za opravljanje te dejavnosti, kajti v dosedajnih obravnavah so bili veliki pomisleki izraženi, èeš da bomo potem v podzakonskih aktih predpisali take pogoje, ki jih ne bodo mogli ljudje izpolnjevati in bomo na ta naèin obdržali monopol javnih zavodov, kar nikakor ni naš interes."
