7,LJUBLJANA ZA PLAÈILO STROŠKOV PRENOSA ZEMELJSKEGA PLINA.
9,Ljubljana za plaèilo stroškov prenosa zemeljskega plina v celoti.
49,"Za današnjo sejo imamo zelo veliko opravièenih, to so: Ivan Atelšek, Vojka Štular, Niko Rajner, Alojz Metelko, Miloš Urbanèiè, Danijel Božiè, Janez Jug, Isabella Flego, dr. Peter Glaviè, Anton Partljiè, Janez Kramberger, Aurelio Juri, Boris Jež, Marko Stadler, Bruno Podveršiè, Ivan Vodopivec, Stanislav Bevc, Leopold Frelih in Danijel Starman."
8,"TOÈKO DNEVNEGA REDA - POBUDE, PREDLOGE IN VPRAŠANJA POSLANCEV."
38,"Vendar naèin, kako so predlagatelji tega zakona zaèeli ta problem razreševati, vlada meni, da ni pravi, da ne bomo dosegli zaželenega rezultata in da tako, kot gospod Dvornik pravilno ugotavlja, se ta zakon ne bo v življenju izvajal."
46,"Pravna regulacija obresti, o kateri je bil govor in jo omenja dr. Toplak, ji pa nasprotuje mnenje ministrstva, èeš da se v svetu o tej pravni regulaciji med seboj dogovarjajo, kaže na to, da se dogovarjajo predvsem o vrednosti denarja in o naèinu plasiranja tega denarja."
25,"Pri pripravi predloga zakona naj predlagatelj prouèi in ustrezno upošteva pripombe, predloge in mnenja delovnih teles Skupšèine in pisne pripombe."" - ker razprave paè ni bilo."
4,Se je kdo vzdržal
5,Gremo kar na novo sejo?
111,"Po sprejetem dnevnem redu 47. seje, ki smo jo prièeli 7. oktobra, nadaljevali pa 8. in 14. oktobra, smo zakljuèili obravnavo 1. toèke, to je predlog za izdajo zakona o Vladi Republike Slovenije z osnutkom zakona; 2. toèka - predlog zakona o socialnem varstvu; in 3. toèka - predlog zakona o odkupu terjatev do Iraka in Zvezne direkcije za promet in rezerve izdelkov posebnega namena, med tem ko smo pri 5. toèki, torej pri predlogu zakona o najetju kredita za nakup opreme za potrebe Republiške uprave za zraèno plovbo zakljuèili razpravo, odloèanje odložili in zadolžili vlado, da predhodno predloži odgovore in pojasnila na številna vprašanja in pripombe iz razprave poslancev na seji zbora."
56,"Za obravnavo pa so nam iz te 47. seje v celoti preostale 4., 6., 11. toèka dnevnega reda te 47. seje, sploh se pa še nismo lotili 48. seje, ki pa, èe si dovolim oceno, težavnosti toèk dnevnega reda, v bistvu ne vsebuje izrazito zahtevnih toèk in bi predlagal, da jo po tem tudi poskušamo izpeljati."
21,Potem prehajamo na glasovanje o predlogu zakona o ratifikaciji sporazuma med Vlado Republike Slovenije in Vlado Republike Madžarske o ukinitvi vizumov.
12,"In pa k 5. èlenu predlaga, da se 12% nadomesti s 15%."
6,"Ugotavljam, da je ta amandma sprejet."
3,Prehajamo na 11.
19,"Menim, da je na pravilen pristop pristopila Komisija za proraèun in javne finance in v celoti podpiram njene ugotovitve."
47,"Te posledice mi bodo šele pokazale, ali je resnica na tem in kolikšna je resnica na tem, kaj se bo zgodilo, èe bi v resnici sprejeli tak zakon in poskušali zrušiti tistega najveèjega, ki pa sploh ni veè najveèji, ampak je še samo diktirajoèi o vprašanju obresti."
11,"Glasujemo še o predlogu zakona v celoti, skupaj s sprejetimi amandmaji."
18,"Naj opozorim, da Odbor za proraèun in javne finance predlaga amandma k drugemu odstavku 1. èlena predloga zakona."
2,Dva manjkata.
16,"Glasovati moramo še o predlogu zakona o jamstvu Republike Slovenije za obveznosti podjetja Petrol-Zemeljski plin, d.o.o."
51,"Tako se pridružujem tisti manjšini, ki je bila v razpravi, da mi s tem zakonom - kljub temu da želimo znižati obrestno mero - tega cilja ne bomo dosegli in da uèinkovitost ni nobena garancija, da bodo po sprejemu tega zakona obrestne mere nižje in da se bo ekonomska situacija zaradi tega popravila."
54,"Zato obresti povsod limitirajo, izjema je, na primer v New Yorku; èe te na ulici nekdo prosi za change, takole kot se reèe, za drobiž in ga nikdar veè ne vidiš, ali pa malo verjetnosti, da ga boš še kdaj sreèal, imaš mu pravico zaraèunati obresti celo do 25% minus inflacija, ki znaša 4%."
42,"Istoèasno pa predlagatelja tega akta prosim, da pride v naslednji fazi dejansko s èistimi ugotovitvami, da upošteva tudi pripombe SDK; v kolikor ne, potem napovedujem že vnaprej, da bomo naredili vse, da Skupšèina takšnega predloga, kot je sedaj predložen, ne bo sprejela."
76,"Pravna tehnika pa je, ali da je ta stvar urejena v civilnih zakonikih, kot je to bilo pri nas do pred nekaj leti v zakonu o obligacijskih razmerjih, kar tudi nekateri danes pravijo, da to spada v zakon o obligacijskih razmerjih, ali je to urejeno s posebnim zakonom proti oderuštvu, kot je npr. Avstrija uredila 1868. leta, ali je to urejeno v kazenskih zakonih in reèejo, obrestna mera nad tem odstotkom je oderuštvo in tako dalje."
31,"Pojasnil bi samo to, da gre za osnutek zakona, tako da ne sprejemamo dokonènega besedila in se mi v tem primeru ne zdi tako nujno, da ga ravno Zakonodajno-pravna komisija obravnava."
1,Hvala.
13,"""1. Predlog za izdajo zakona o Bloudkovih priznanjih, z osnutkom zakona se sprejme."
52,"Gospod De Juan, ki je bil pri nas na predavanju, mislim, da je bilo to pretekli teden, (ta veliki strokovnjak iz Španije,) je lepo nakazal, da nimamo nekih posebnih možnosti hitre ozdravitve gospodarstva, da bodo žrtve potrebne in da te žrtve tudi gredo v to smer - brezposelnosti, o katerem sem pravkar govoril."
10,Kje naj potem konkurira in se razvija v zahodnoevropskem gospodarstvu?
14,"Predlog zakona ste prejeli z gradivom za 43. sejo zbora, dne 29. in 30.7.1992."
20,"Obravnaval ga je Odbor za proraèun in javne finance, ki je osnutek zakona podprl in predlaga zborom, da ga sprejmejo."
37,"Vi dobro veste, da smo imeli vrsto zakonov o zamrznitvi cen, vrsto zakonov o zamrznitvi plaè, vendar je kljub temu šla inflacija dalje, ker so našli še in še rešitev, da se je te zakonske doloèbe obšlo."
58,"Že na Zakonodajno-pravni komisiji sem ob razpravi o osnutku dejal gospodu Toplaku, da èe bi ta zakon na ustrezen naèin znižal izredno visoke obrestne mere, kakršne so v praksi in to, tako da ne bi vnesel v finanène odnose nesorazmerja, ki bodo po moji oceni nastala in bi nastala, èe bi ta zakon sprejeli, potem sem takoj za."
24,"Vendar, od tu naprej brez posega v to, gospod Schwarzbartl ni bil v dvorani, ko sem govoril o tem, kakšni so ti programi itd."
102,"Osebno v uèinek takega posega ne verjamem, nasprotno, zdi se mi, da mora biti obrestna mera in cena denarja in vse, kar je s tem povezano, vendarle splet politike banke, vlade, èe hoèete, kadar gre za oderuške obresti, tudi oblastnih ukrepov, da pa se ne more z neposrednim posegom in doloèanjem ravni obresti za razne globalne namene poseèi na trg denarja, ki je pri nas sicer zelo neurejen,ima mnoge pomanjkljivosti, vendar mislim, da je to proces, mora biti proces, ki bi pripeljal potem povezano tudi s cenami inflacije in vsem ostalim, do neke normalne, èe lahko govorimo o normalnih obrestnih merah."
101,"Zato mislim, da bi bilo dobro, da vendarle nekoliko zadržimo sprejetje tega zakona, in da se najprej izèistijo ti odnosi in problemi, ki sta jih izpostavila Banka Slovenije in Vlada, ki sta od prvih, nekoliko ostrih medsebojnih konfrontacij vendarle prišli do tega, da ugotavljata, kje so ti racionalni vzroki za takšne obresti, kakršne so in kakšna naj bo politika na tem podroèju, pri èemer se je seveda treba zavedati tega, da so akterji te politike vendarle institucionalno izpostavljeni, to je Banka Slovenije, kot temeljni akter in seveda banke, ki na tak ali drugaèen naèin reagirajo na posege te centralne monetarne institucije."
27,"Pri pripravi predloga zakona naj predlagatelj prouèi in ustrezno upošteva pripombe, predloge in mnenja delovnih teles skupšèine, pisne pripombe in pripombe iz razprave poslancev na seji zbora."""
50,"Morda nekaj primerov, kakšne so obrestne mere v Evropi, ne glede na to, da v teh zakonih oziroma v tisti debeli knjigi, ki jo je imel tudi na Odboru za kreditno-monetarni sistem, o kateri je gospod Toplak govoril, se gibljejo v skladu s ponudbo in povpraševanjem in stanjem na tržišèu."
55,"Zato menim, da ima ta Toplakov zakon nekaj dobrega v sebi; enkrat sem celo rekel, da tudi slepa kura vèasih zrno najde in mislim osnovni namen tega zakona je, da da denarju neko realno ceno, da da v bistvu ne previsoko ceno in hkrati pomeni, da mora biti profitna stopnja veèja, kot je cena denarja."
64,"To je izzvalo padec na newyorški borzi, znamenito svetovno gospodarsko krizo, ki jo je v Ameriki reševal Keyness s svojo teorijo ""Denar, obresti in delo"" in Roosevelt z ""New deal programom"", Evropo pa je to pahnilo v drugo svetovno vojno, katere posledice mi danes èutimo, ker smo pozabili na ta naravni ekonomski zakon, ki ga je pravo v vsej zgodovini in religiji praktièno povzelo."
22,"Osnutek zakona je obravnaval Odbor za pravosodje in upravo, ki k osnutku zakona ni imel pripomb in predlaga zborom, da ga sprejmejo."
45,"Vendar moramo ne glede na vse to še enkrat jasno povedati, to je moje stališèe, da èe mislimo, da bo ta zakon rešil vse te probleme, o katerih je bil danes govor, je to velika iluzija, in da nas bo kasneje bolela glava zaradi tega."
32,"Po zdravi logiki presojam, èe podjetnik ali gospodarstvo najame kredit v Zahodni Nemèiji, bo tam plaèal 6 do 8%, ga bo to pri 100.000 markah stalo na leto 6 do 8.000 mark."
15,To je stališèe vlade do amandmaja Odbora za proraèun in javne finance k 1. èlenu.
23,"Tukaj imam opombo, da bi se bilo treba izreèi o mnenju vlade k amandmaju Odbora za proraèun in javne finance k 1. èlenu."
33,"Osebno mislim, da bi naša inflacija, èeprav je še veè vzrokov za njo, bila bistveno manjša, èe bi na denarnem podroèju tak korak, ki ga s tem zakonom predvidevamo, storili že mnogo prej."
29,"Doda naj se nov odstavek, ki se glasi: ""Ta zakon ureja pravico do obresti tudi tistim fiziènim osebam, ki so upniki napram pravnim osebam."" Sedanji prvi odstavek postane drugi."
61,"Pred vami je predlog zakona o obrestni meri z zadnjimi amandmaji redakcijskega znaèaja, kakor so jih predlagatelji oblikovali po obširnih strokovnih razpravah, ki smo jih imeli zlasti z ekonomisti na Ekonomski fakulteti v Ljubljani, s klubom finanènih delavcev ter z izkušenimi, praktiènimi pravniki v gospodarstvu, na Visoki pravni šoli v Mariboru, preko Društva pravnikov v gospodarstvu, s sodniki in drugimi strokovnjaki."
17,Prehajamo na 9. TOÈKO DNEVNEGA REDA - OBRAVNAVO PREDLOGA ZA IZDAJO ZAKONA O BLOUDKOVIH PRIZNANJIH Z OSNUTKOM ZAKONA.
28,"Predlog zakona sta obravnavala Komisija za mednarodne odnose, ki je soglašala s predlogom zakona in predlaga zborom, da ga sprejmejo; Zakonodajno-pravna komisija pa tega akta še ni obravnavala."
39,"Prav tako tudi Zavod za makroekonomske analize in razvoj, ki je vladna institucija (ni treba, da kdo reèe, da to ni, ampak je strokovna vladna institucija, ki se ukvarja z makro analizami) zavraèa tak zakon, kot ga ponujajo predlagatelji."
72,"Predlagatelji zakona potem, ko smo obširneje, zlasti na Ekonomski fakulteti v Ljubljani na veèjem zboru ekonomisti prediskutirali, in so ekonomisti bili enoglasnega mnenja, da je treba tako imenovano neproduktivno, kot pravi prof. Vilijem Merhar, distribucijsko koalicijo v njeni nenasitni želji po profitu, bolje reèeno po nezasluženih koristih iz naslova obresti in ki s tem unièuje vso realno ustvarjalno ekonomijo, na neki naèin zaustaviti, tako kakor to delajo vse druge pravno urejene dežele."
36,"Ker Zakonodajno-pravna komisija tega predloga še ni obravnavala in ker se ne mudi - to sem že povedal, da ta zakon po mojem mnenju ne bi smel biti sprejet pred zakonom o privatizaciji - predlagam, da to odložimo."
35,"Pri tem naj, v sodelovanju s Službo družbenega knjigovodstva Republike Slovenije pri proraèunskih postavkah, ki so se izkazale kot metodološko sporne, pripravi predlog zakona o zakljuènem raèunu o izvršitvi proraèuna Republike Slovenije za leto 1991."
44,"Ves èas govorimo o sanaciji bank; govorimo o tistem, kdo je ves èas ""slaèil kožo"" s podjetij in gospodarstva in jih kupoval na ta naèin, sedaj pa ga bomo sanirali zato, da bo imel dovolj denarja, da nam bo lahko še enkrat zaraèunal obresti."
34,"Predlagatelj gospod Toplak in gospod Slejko kot razpravljalec sta mi zelo nazorno dokazala kot nestrokovnjaku, da je ta obrestna mera ena od življenjskih gonilnih sil našega gospodarstva in tudi v smislu pravilnega banènega razvoja."
71,"Do danes je preteklo, mislim da že 127 dni in sem slišal vèeraj, da je v skupšèino že prišel koncesijski akt z zamudo, kot reèeno, 69 dni, s katerim predlagamo javni mednarodni nateèaj za razpis koncesije, ki bi pripeljal v deželo nekaj milijard mark, ki bi dal, kar bi dalo delo in vaši industriji in železarnam in cementarnam in zaslužek našim delavcem in tudi bankam denar za obratovanje in za delo."
26,"3. Pri pripravi predloga zakona naj predlagatelj prouèi in ustrezno upošteva pripombe, predloge in mnenja delovnih teles skupšèine ter pisne pripombe."" Pripomb iz razprave ni bilo."
43,"Nobenega dvoma ni, da so anomalije v zvezi z obrestnimi merami posledica bolnega banènega sistema; obstaja samo dilema, ali je zdravilo, ki ga ponujamo v obliki sanacije oziroma v obliki javnega dolga, tisto pravo, ali je kot pomožno zdravilo primeren tudi ta zakon."
66,"Bilo je tudi nekaj izvajanj poslancev iz bivše opozicije, zanimivo, ko pride na dnevni red nek zakon, ki jim ne ustreza, zaènejo razpravljati neke teoretiène razprave tu, po domaèe bi rekli temu da ""bluzijo"" in se izogibajo kot maèek vroèe kaše prave teme in ne dajo konkretnih odgovorov in konkretnih odgovorov mi je že vèeraj manjkalo tu od vladnih predstavnikov in jih tudi danes nisem dobil."
40,"Ker razen tega, da so povedali, kako je v teh zakonih, v zakonu o obligacijskih razmerjih rešeno drugje, praksa pa, kot ste videli iz podatkov Zahodne Evrope odstopa od tega, niso dali izraèunov in posledic tega zakona v slovenskem gospodarstvu."
30,"Male banke imajo naslednjo prakso: zberejo sredstva in jih plasirajo na medbanènem trgu po visoki obrestni meri in te banke, ki so stare, ki imajo obveznosti, ta sredstva plasirajo naprej."
73,"Iz tega izhaja, (iz njega ne izhaja, ampak utemeljitev izhaja iz tega), da imamo zgrešen sistem vrednotenja dela, da se preplaèujemo, èe bi smel tako reèi in da ne znamo vrednotiti kapitala oziroma ne znamo dovolj jasno in nedvoumno postaviti pred gospodarske subjekte in banène sisteme vrednosti denarja ali obrestne politike, stroškov, ki jih imajo banke v zvezi s tem in vse tiste razlike, ki povzroèajo, da imamo ob najemu kapitala neke stroške."
41,"Ali mi lahko odgovorite na to prepletenost gospodarstva in banènega sistema in posledic, ki se lahko zgodijo s tem, da - kot temu reèemo - postavimo tiste, ki imajo maslo na glavi na sonce; ko se zaène maslo topiti in teèi preko oèi?"
57,"In èe ne gre drugaèe, je treba poskusiti z nekim carskim rezom, ki bo omogoèal, da se bo vendarle situacija premaknila in se ne neprestano odlagala na poznejši èas in se ne iz politiènih ali kakšnih drugih razlogov zadrževala v nekem doloèenem obdobju, kajti nasledniki bodo vsa ta bremena tako ali drugaèe prevzeli in jih morali razrešiti."
122,"Saj gre tudi za doloèen spor v teoriji in praksi monetarne in kreditne politike, vendar, èe mi ne bomo znali in uspeli sanirati bank, o èemer je bil govor, zakon je pripravljen, ali je dober ali ne, to je drugo vprašanje, èe ne bomo šli smelo v proces lastninjenja, èe ne bomo sprejeli zakonov, ki zagotavljajo doloèene evropske standarde v obraèunavanju denarja in tako naprej, èe ne bomo vzpostavili finanène policije ali kakorkoli se bo imenovala služba, ki bo paè kontrolirala pretoke denarja, do vseh mogoèih drugih institucij, vse kar je v programu, kar pa nekako ne gre skozi ta naš parlament, potem mislim, da je to dejansko lahko samo enostranski ukrep, èigar posledice bodo, da se bo vzpostavil sivi trg denarja."
82,"Osebno ne verjamem v to, èe ne bo to sklop ukrepov in politike, ki bo soèasno usmerjen v dviganje racionalnosti z vsem, kar pomeni ta politika, èišèenje dubioz, prenos tega tudi na javni dolg in tako naprej, da ne razpletam vsega tega in s tem povezano potem pa tudi neka normalna cena denarja in kredita, kjer se pa najbrž lahko, in to je normalno po svetu, dajo neki limiti za tako imenovane oderuške obresti, za to, kar presega neko normalno sprejemljivo višino."
59,"Prvo, da smo v razgovorih, ki smo jih imeli predstavniki vlade - zapis teh razgovorov ste dobili - skupaj s predlagatelji prišli do naslednjega predloga: res je, da v zakonu o obligacijskih razmerjih ni doloèila, kakšne so obresti, èe niso pogodbeno doloèene; da ni kriterijev za oderuške obresti in da je potrebno ta zakon o obligacijskih razmerjih s temi doloèili dopolniti."
68,"Kar se tièe reguliranja višine obrestnih mer na 6%, na 8%, na 8% z amandmaji tudi za hranilne vloge in ostala doloèila zakona, pa menimo, da so administrativni poseg, ki v življenju ne bo zaživel in da je to - kot je rekel gospod, ki je prejšnji teden obrazložil svoj koncept sanacije bank, ko je bilo direktno postavljeno vprašanje - da je to slab korak, korak, ki bo povzroèil zmedo."
53,"Treba je razumeti, da se bo potem poleg obresti našlo še in še naèinov, kako bodo sicer v pogodbah ta doloèila, vendar bodo razne provizije, razni stroški in razni naèini, kako se bo potem to tržno obrestno mero plaèalo, da bo povzroèil zmešnjavo in še veèji kaos, kot je sedaj na tem podroèju."
60,"To, kar je vlada v zvezi s problemom previsokih obrestnih mer naredila, je naslednje: v juniju lani, ko smo pripravljali zakon o Banki Slovenije, zakon o bankah in hranilnicah, smo toèno vedeli, kakšno stanje je v bankah, zato je bil tudi takrat, 24. junija, dan v obravnavo zakon o predsanaciji, sanaciji, likvidaciji in steèaju bank - in je bilo to sprejeto."
85,"Vsaka banka, ki bo prišla v ta postopek sanacije in tudi te, ki so že v predsanaciji, mora iti v racionalizacijo, mora iti v zniževanje stroškov, mora iti na rekonstrukcijo svoje organiziranosti in konèni rezultat tega pa je - strinjam pa se, da to ne bo èez noè, da ta proces traja - drugaèna organiziranost bank, drugaèna razporeditev teh, ker mi vemo, da imajo te banke - ki so, po izjavah guvernerja najnovejše - najveèja banka ima na tolarskem podroèju v Sloveniji 30% potenciala, na deviznem pa še 80%."
48,"Predlaga tudi, da zbori zadolžijo Vlado, da v sodelovanju s Službo družbenega knjigovodstva Republike Slovenije pri proraèunskih postavkah, ki so se v razpravi na Odboru izkazale kot metodološko sporne, pripravi predlog zakona o zakljuènem raèunu o izvršitvi proraèuna Republike Slovenije za leto 1991 in upošteva tudi vso razpravo."
63,"Najprej moramo glasovati o amandmaju Odbora za proraèun in javne finance k drugemu odstavku 1. èlena, ki se glasi: ""Obveznost Republike Slovenije iz prejšnjega odstavka je omejena do vsakokratnega letnega zneska v višini njegove tolarske protivrednosti, ki znaša v mesecu novembru 1991 206.816.604 ATS in se nato v èasu trajanja pogodbe, od 1.10.1992 do 31.3.2006, spreminja v skladu s pogodbeno doloèeno eskalacijsko klavzulo."""
